Context,Collocate,File,Directory,Year
"the existence of the same fact at Liverpool and London, and",the,rstl_1837_0011.txt,txt_rstl,1837
omitted to observe the important fact of the existence of a,the,rstl_1837_0019.txt,txt_rstl,1837
experiment almost impossible. But the fact is sufficiently clear that they,the,rstl_1837_0019.txt,txt_rstl,1837
from a knowledge of the fact that both the amount of,the,rstl_1837_0019.txt,txt_rstl,1837
by HausmaxxF. I remarked the fact during my earlier observations on,the,rstl_1837_0019.txt,txt_rstl,1837
lead us to anticipate the fact that the volant insects in,the,rstl_1837_0019.txt,txt_rstl,1837
as is proved by the fact that when the thermometer is,the,rstl_1837_0019.txt,txt_rstl,1837
"the surrounding medium, of in fact a voluntary power of generating",the,rstl_1837_0019.txt,txt_rstl,1837
had numerous proofs of this fact in my observations on the,the,rstl_1837_0019.txt,txt_rstl,1837
the observa- tion of this fact during the winter when making,the,rstl_1837_0019.txt,txt_rstl,1837
This Table also indicates the fact that the whole process of,the,rstl_1837_0019.txt,txt_rstl,1837
have abun- dantly established the fact that there is a considerable,the,rstl_1838_0021.txt,txt_rstl,1838
to account for the well-known fact of plants increasing most in,the,rstl_1838_0021.txt,txt_rstl,1838
"field of view, but the fact would also perhaps have forced",the,rstl_1838_0019.txt,txt_rstl,1838
be regarded as a new fact in the theory of vision.,the,rstl_1838_0019.txt,txt_rstl,1838
fallacy in vision; but the fact does not appear to me,the,rstl_1838_0019.txt,txt_rstl,1838
have observyed a very interesting fact connected with the proper membrane,the,rstl_1838_0016.txt,txt_rstl,1838
"escape adherent to it; the fact being, that all that properly",the,rstl_1838_0016.txt,txt_rstl,1838
"improvement resulted. So that in fact the gold leaves became, in",the,rstl_1838_0007.txt,txt_rstl,1838
combination. I may mention another fact which segems to have the,the,rstl_1838_0015.txt,txt_rstl,1838
everything in the form of fact and experiment with conducting masses,the,rstl_1838_0014.txt,txt_rstl,1838
"ELECTRICITY. (SERIES XIV.) rather in fact have proved the contrary, namely,",the,rstl_1838_0014.txt,txt_rstl,1838
is in accordance with the fact already stated as regards water,the,rstl_1838_0008.txt,txt_rstl,1838
When I discovered the general fact that electrolytes refused to yield,the,rstl_1838_0002.txt,txt_rstl,1838
would be a very important fact in the theory which as8umes,the,rstl_1838_0002.txt,txt_rstl,1838
the case. This is another fact in fayour of the inseparability,the,rstl_1838_0002.txt,txt_rstl,1838
the line ; that in fact the electric at these two,the,rstl_1838_0002.txt,txt_rstl,1838
for the present the general fact sought to be proved ;,the,rstl_1838_0002.txt,txt_rstl,1838
common resin ; and the fact that most of the resins,the,rstl_1839_0020.txt,txt_rstl,1839
the earth. It is this fact that I announced in the,the,rstl_1839_0018.txt,txt_rstl,1839
measure of gravity; and the fact observed by M. Rricnzs proved,the,rstl_1839_0016.txt,txt_rstl,1839
"upon the extremity b, a fact which may be further observed",the,rstl_1839_0015.txt,txt_rstl,1839
we take into consideration the fact that the force between two,the,rstl_1839_0015.txt,txt_rstl,1839
"exist in nature, the striking fact will at once suggest itself,",the,rstl_1839_0010.txt,txt_rstl,1839
"the sand bath, nor in fact until the resulting chlo- ride",the,rstl_1839_0003.txt,txt_rstl,1839
on a knowledge of the fact that the germinal vesicle returns,the,rstl_1839_0021.txt,txt_rstl,1839
it needful to inquire. The fact that in the course of,the,rstl_1839_0021.txt,txt_rstl,1839
"referred to, the not uninteresting fact will be made evident, that",the,rstl_1839_0021.txt,txt_rstl,1839
the three last stages; the fact being that its appearance undergoes,the,rstl_1839_0021.txt,txt_rstl,1839
"it accords perfectly with the fact (Plate VI. fig. 114.), that",the,rstl_1839_0021.txt,txt_rstl,1839
have now to mention a fact or two regarding the nature,the,rstl_1839_0021.txt,txt_rstl,1839
(par. 124. 299.) ? 'The fact that the germinal spot becomes,the,rstl_1839_0021.txt,txt_rstl,1839
"Dick has observed, and the fact is very important, that the",the,rstl_1839_0005.txt,txt_rstl,1839
Laupsr endeayours to explain this fact by supposing that when the,the,rstl_1839_0005.txt,txt_rstl,1839
already alluded to the important fact communicated to me by Sir,the,rstl_1839_0005.txt,txt_rstl,1839
less grandeur and symmetry. The fact of their occurrence at these,the,rstl_1839_0005.txt,txt_rstl,1839
it is viewed. Of this fact the shelves on the south-east,the,rstl_1839_0005.txt,txt_rstl,1839
"of this great valley, —a fact somewhat analogous to the coincidence",the,rstl_1839_0005.txt,txt_rstl,1839
"the case by MaccvLLocn, the fact would be highly satisfactory on",the,rstl_1839_0005.txt,txt_rstl,1839
obseryed the same kind of fact strikingly illustrated in Norway#. It,the,rstl_1839_0005.txt,txt_rstl,1839
and more especially the remarkable fact of the exact coincidence of,the,rstl_1839_0005.txt,txt_rstl,1839
strongest argument being the ascertained fact of the land rising at,the,rstl_1839_0005.txt,txt_rstl,1839
"point with certainty. If the fact be 80, and I scarcely",the,rstl_1839_0005.txt,txt_rstl,1839
of the gully. From this fact it is evident that the,the,rstl_1839_0005.txt,txt_rstl,1839
"the negative, marvellons though the fact be, that the beaches of",the,rstl_1839_0005.txt,txt_rstl,1839
the sea. 5th. The extraordinary fact that a large country has,the,rstl_1839_0005.txt,txt_rstl,1839
conjecture is confirmed by the fact that such an embryonic muscular,the,rstl_1840_0025.txt,txt_rstl,1840
"in cartilage, follows from the fact that the cell-nuclei do not",the,rstl_1840_0025.txt,txt_rstl,1840
"42. In connexion with the fact now recorded, that muscular fibre",the,rstl_1840_0025.txt,txt_rstl,1840
"the same materials, was a fact which clearly proved that certainty",the,rstl_1840_0023.txt,txt_rstl,1840
figure; he had observed the fact correctly : in assign- ing,the,rstl_1840_0023.txt,txt_rstl,1840
presented to the iodine. This fact will render obvious the superiority,the,rstl_1840_0017.txt,txt_rstl,1840
The singular nature of this fact will account for its introduction,the,rstl_1840_0017.txt,txt_rstl,1840
"is extremely faint, but the fact is worthy of notice, as",the,rstl_1840_0017.txt,txt_rstl,1840
entire. But let not this fact militate against our conelusions. The,the,rstl_1840_0014.txt,txt_rstl,1840
"respiration continued, I established the fact that there was a source",the,rstl_1840_0014.txt,txt_rstl,1840
when compared with the remarkable fact which we shall find given,the,rstl_1840_0008.txt,txt_rstl,1840
obtained further evidence of the fact from an apparatus which I,the,rstl_1840_0012.txt,txt_rstl,1840
It is a well known fact that the voltaic current will,the,rstl_1840_0012.txt,txt_rstl,1840
"in the ninety-sixth, to the fact of the induced current in",the,rstl_1840_0010.txt,txt_rstl,1840
at once removed by the fact of a spark of the,the,rstl_1840_0010.txt,txt_rstl,1840
ascertained. There is already one fact which was obtained with the,the,rstl_1840_0010.txt,txt_rstl,1840
this is supported by the fact of several portions being discovered,the,rstl_1840_0009.txt,txt_rstl,1840
"to be decidedly cylindrical. The fact seems to be, that in",the,rstl_1840_0022.txt,txt_rstl,1840
sections ; and the one fact is strikingly confirmatory of the,the,rstl_1840_0022.txt,txt_rstl,1840
"in it. The next remarkable fact is, that in each division",the,rstl_1840_0022.txt,txt_rstl,1840
demonstrated. This depends on the fact that its contents swell considerably,the,rstl_1840_0022.txt,txt_rstl,1840
Primitive Fasciculi. There is a fact in the anatomical history of,the,rstl_1840_0022.txt,txt_rstl,1840
"and others, though noticing the fact of the zigzag flexure of",the,rstl_1840_0022.txt,txt_rstl,1840
75. from the Frog. This fact may serve to illustrate those,the,rstl_1840_0022.txt,txt_rstl,1840
"have not only established the fact now mentioned, but they also",the,rstl_1840_0024.txt,txt_rstl,1840
"really is the case, another fact will be hereafter given (par,",the,rstl_1840_0024.txt,txt_rstl,1840
without a knowledge of the fact that the germinal vesicle returns,the,rstl_1840_0024.txt,txt_rstl,1840
"same number of diameters, the fact here referred to may be",the,rstl_1840_0024.txt,txt_rstl,1840
"think this possible, from the fact that in the gill-cartilage of",the,rstl_1840_0024.txt,txt_rstl,1840
this was very nearly the fact we may infer from Captain,the,rstl_1840_0005.txt,txt_rstl,1840
"the results, s0 that in fact the * Magnetic Survey of",the,rstl_1840_0005.txt,txt_rstl,1840
is strengthened also by the fact that he found the active,the,rstl_1840_0016.txt,txt_rstl,1840
permanency is promoted by the fact that in making archil too,the,rstl_1840_0016.txt,txt_rstl,1840
the metals themselves must in fact be forced into this constrained,the,rstl_1840_0003.txt,txt_rstl,1840
"gold, platinum, palladium ; in fact all the bodies that can",the,rstl_1840_0003.txt,txt_rstl,1840
"periscopic nor achromatic, being in fact no other than the aplanatic",the,rstl_1840_0002.txt,txt_rstl,1840
"as a burning-glass, is in fact one of the worst possible",the,rstl_1840_0002.txt,txt_rstl,1840
"s80lved, since it is a fact that the negative reversed photographic",the,rstl_1840_0002.txt,txt_rstl,1840
on iodic preparations is in fact the difference of two opposing,the,rstl_1840_0002.txt,txt_rstl,1840
"of using it, and in fact using the paper actually wet",the,rstl_1840_0002.txt,txt_rstl,1840
hitherto hesitated to announce. The fact to which I allude is,the,rstl_1840_0002.txt,txt_rstl,1840
to belieye it from the fact of some slight inequalities in,the,rstl_1840_0002.txt,txt_rstl,1840
"the entire length of any,—a fact tending to the same conclusion.",the,rstl_1841_0009.txt,txt_rstl,1841
thus mainly rested upon the fact that shade prevents radiation. In,the,rstl_1841_0005.txt,txt_rstl,1841
"different values for Pz. The fact 1s, that constants must be",the,rstl_1841_0011.txt,txt_rstl,1841
central patch may be in fact aggregated with the central patches,the,rstl_1841_0002.txt,txt_rstl,1841
twelve columns we do in fact combine the intensities from all,the,rstl_1841_0002.txt,txt_rstl,1841
the know- ledge of this fact forms a necessary introduction to,the,rstl_1841_0015.txt,txt_rstl,1841
3 and 4. From the fact of the presence of these,the,rstl_1841_0015.txt,txt_rstl,1841
"comparative anatomist, from the remarkable fact that it takes place in",the,rstl_1841_0012.txt,txt_rstl,1841
"in coitu, but from the fact that the oviduct in the",the,rstl_1841_0012.txt,txt_rstl,1841
have overlooked the remark- able fact of its remaining for many,the,rstl_1841_0012.txt,txt_rstl,1841
observe no perfect fibre. This fact will safficiently account for the,the,rstl_1841_0012.txt,txt_rstl,1841
of the animal. This latter fact shows that it is not,the,rstl_1841_0012.txt,txt_rstl,1841
as is shown in the fact that the new segments are,the,rstl_1841_0012.txt,txt_rstl,1841
"more re- markable, from the fact that this outlet is in",the,rstl_1841_0012.txt,txt_rstl,1841
"be the case, from the fact that each of these organs",the,rstl_1841_0012.txt,txt_rstl,1841
"care, to detect a single fact inconsistent with the conclusion above",the,rstl_1841_0019.txt,txt_rstl,1841
"admit of being established. The fact is, that at an early",the,rstl_1841_0019.txt,txt_rstl,1841
well as to connect this fact with the existence of the,the,rstl_1841_0019.txt,txt_rstl,1841
"ascribed to them : the fact being that, besides the minuteness",the,rstl_1841_0019.txt,txt_rstl,1841
"have been not inappropriate. The fact is, they are discs, having",the,rstl_1841_0019.txt,txt_rstl,1841
"of the sponge tribe, the fact of having found these curious",the,rstl_1842_0014.txt,txt_rstl,1842
"is prepared, and from the fact that it in all cases",the,rstl_1842_0016.txt,txt_rstl,1842
is strongly supported by the fact of the accuracy with which,the,rstl_1842_0016.txt,txt_rstl,1842
"nearly equal, but to the fact that the quantity which was",the,rstl_1842_0016.txt,txt_rstl,1842
"system, I should notice this fact as illustrative of the equiva-",the,rstl_1842_0016.txt,txt_rstl,1842
"no doubt, mainly from the fact (amply confirmed by the hygro-",the,rstl_1842_0015.txt,txt_rstl,1842
"have called unexpected, was the fact that an equal ordinate or",the,rstl_1842_0015.txt,txt_rstl,1842
are not in point of fact the same rays which are,the,rstl_1842_0015.txt,txt_rstl,1842
di- minishing one. That in fact the absorption almost certainly reaches,the,rstl_1842_0015.txt,txt_rstl,1842
in- teresting to verify the fact in the case of the,the,rstl_1842_0015.txt,txt_rstl,1842
low water. There is in fact the ru- diment of a,the,rstl_1842_0002.txt,txt_rstl,1842
"flattened form. It is in fact the structure which, for want",the,rstl_1842_0008.txt,txt_rstl,1842
"to the buffy coat. 'The fact is, that the globules I",the,rstl_1842_0008.txt,txt_rstl,1842
have myself observed the same fact in the eggs of several,the,rstl_1833_0032.txt,txt_rstl,1833
"also are reyersed, but the fact is not easily observed, except",the,rstl_1833_0032.txt,txt_rstl,1833
may be proved by the fact that the other two layers,the,rstl_1833_0032.txt,txt_rstl,1833
"that the volutions are in fact formed of three coats, each",the,rstl_1833_0032.txt,txt_rstl,1833
"scar jtself also demonstrates the fact of the revolution, its hinder",the,rstl_1833_0032.txt,txt_rstl,1833
much reliance on the mere fact of their presence or absence,the,rstl_1833_0032.txt,txt_rstl,1833
the observation of the above fact induces me to giye credit,the,rstl_1833_0032.txt,txt_rstl,1833
"of the poles, express the fact generally, rather than give any",the,rstl_1833_0030.txt,txt_rstl,1833
"there of that, except the fact that the matters evolved collect",the,rstl_1833_0030.txt,txt_rstl,1833
"plest possible ; but the fact is against his theory, and",the,rstl_1833_0030.txt,txt_rstl,1833
"made the wonder, is in fact the essential condition of transfer",the,rstl_1833_0030.txt,txt_rstl,1833
most satisfactory manner with the fact of an element or substance,the,rstl_1833_0030.txt,txt_rstl,1833
of the reflex arc. The fact of the frequent occurrence of,the,rstl_1833_0028.txt,txt_rstl,1833
"the mere nervo-muscular fibre. This fact will snggest the propriety, as",the,rstl_1833_0028.txt,txt_rstl,1833
no wise vitiated by the fact noticed by Dr. ProuT. But,the,rstl_1833_0023.txt,txt_rstl,1833
"P.D. has been observed, the fact is indicated by dotted lines.",the,rstl_1833_0021.txt,txt_rstl,1833
"that as it may, the fact that an appearance, exactly resembling",the,rstl_1833_0021.txt,txt_rstl,1833
"by time. 6. Although the fact itself, abstractedly considered, may not",the,rstl_1833_0019.txt,txt_rstl,1833
or less with steel. The fact of iron retaining a trifling,the,rstl_1833_0019.txt,txt_rstl,1833
"root of the length. The fact is, M. BecquerEL has deduced",the,rstl_1833_0017.txt,txt_rstl,1833
"Sir Humenry Davy explains this fact by saying, © that the",the,rstl_1833_0016.txt,txt_rstl,1833
is confirmed by the observed fact of the stronger odour exhaled,the,rstl_1833_0016.txt,txt_rstl,1833
"of subarseniate. It is a fact of extraordinary interest, that the",the,rstl_1833_0015.txt,txt_rstl,1833
600?. The salt became in fact very nearly anhydrous. Now on,the,rstl_1833_0015.txt,txt_rstl,1833
of high water is the fact which is most important for,the,rstl_1833_0013.txt,txt_rstl,1833
"great rapidity, though it in fact moves slower than the tide-wave",the,rstl_1833_0013.txt,txt_rstl,1833
physiologists have led us. The fact on which this inference is,the,rstl_1833_0007.txt,txt_rstl,1833
"spinal marrow, however improbable the fact may at first sight appear,",the,rstl_1833_0007.txt,txt_rstl,1833
unequivocal proof of such a fact to induce its belief. The,the,rstl_1833_0007.txt,txt_rstl,1833
"intervention of the nerves, a fact which is well ascer- tained,",the,rstl_1833_0007.txt,txt_rstl,1833
"conclusion then from the foregoing fact is unavoidable, that the neryous",the,rstl_1833_0007.txt,txt_rstl,1833
"but adds, that © in fact the resemblance is not complete,”",the,rstl_1833_0006.txt,txt_rstl,1833
at the changed pole. This fact may be obseryed by turning,the,rstl_1833_0006.txt,txt_rstl,1833
"the process of solution, a fact particularly exposed in my paper",the,rstl_1834_0030.txt,txt_rstl,1834
from the parent. The principal fact on which I found this,the,rstl_1834_0026.txt,txt_rstl,1834
by some authors? The above fact would seem to indicate that,the,rstl_1834_0026.txt,txt_rstl,1834
"persist in the trials, the fact that the torpedinal electricity passes",the,rstl_1834_0026.txt,txt_rstl,1834
crus cerebri ; * In fact all the columns which form,the,rstl_1834_0023.txt,txt_rstl,1834
"chemical action, and is in fact quoting the experiment as the",the,rstl_1834_0022.txt,txt_rstl,1834
"condition. This, generally, is the fact described by RiTTer, Martanini, and",the,rstl_1834_0022.txt,txt_rstl,1834
"I think, apparent, from the fact that in the Bee, the",the,rstl_1834_0021.txt,txt_rstl,1834
from the ganglia. Another striking fact indicative of their separate function,the,rstl_1834_0021.txt,txt_rstl,1834
"nerves, there is a curious fact relating to the terminal pair,",the,rstl_1834_0021.txt,txt_rstl,1834
"the commencement of an interesting fact before alluded to, the for-",the,rstl_1834_0021.txt,txt_rstl,1834
has been adduced establishes the fact that the mammary foetus at,the,rstl_1834_0019.txt,txt_rstl,1834
"is a remarkable and interesting fact that in the Sloth, in",the,rstl_1834_0019.txt,txt_rstl,1834
HR g's (TY.) and in fact the parabolic form of the,the,rstl_1834_0017.txt,txt_rstl,1834
"bodies, and the like. This fact seems to have hitherto escaped",the,rstl_1834_0016.txt,txt_rstl,1834
"of the stars seem in fact to be, if anything, rather",the,rstl_1834_0013.txt,txt_rstl,1834
obtained. The approximations were in fact carried much further by M.,the,rstl_1834_0010.txt,txt_rstl,1834
to actual decomposition. Upon this fact is founded much of the,the,rstl_1834_0008.txt,txt_rstl,1834
"such appears to be the fact (697.), dependent upon a law,",the,rstl_1834_0008.txt,txt_rstl,1834
"solid body by the simple fact of attenuation, and is highest",the,rstl_1834_0007.txt,txt_rstl,1834
"the moon's transit, is in fact principally a table of the",the,rstl_1834_0004.txt,txt_rstl,1834
"of a fluid, are in fact the results of its motion",the,rstl_1834_0004.txt,txt_rstl,1834
having first made known the fact of the Brachyura of the,the,rstl_1835_0023.txt,txt_rstl,1835
entirely on such evidence. The fact of their not having thus,the,rstl_1835_0021.txt,txt_rstl,1835
and that such is the fact is proved by the following,the,rstl_1835_0021.txt,txt_rstl,1835
to DuTrocner until after the fact had been fully ascertained by,the,rstl_1835_0021.txt,txt_rstl,1835
by the water. If the fact is 80 in regard to,the,rstl_1835_0020.txt,txt_rstl,1835
the surrounding air. This important fact is now well ascertained. On,the,rstl_1835_0020.txt,txt_rstl,1835
which is cheliferous ; the fact that the Zoea has distinct,the,rstl_1835_0019.txt,txt_rstl,1835
to the universality of the fact of metamorphosis taking place in,the,rstl_1835_0019.txt,txt_rstl,1835
"of these inquiries, from the fact that five large folio plates",the,rstl_1835_0019.txt,txt_rstl,1835
"certain phenomena, he discovered a fact in the structure which diverted",the,rstl_1835_0015.txt,txt_rstl,1835
this last quantity being in fact the same as the reciprocal,the,rstl_1835_0014.txt,txt_rstl,1835
six monsoons; and the same fact was observed at Kotgherry on,the,rstl_1835_0012.txt,txt_rstl,1835
but on the whole the fact of their oc- currence during,the,rstl_1835_0012.txt,txt_rstl,1835
"of its existence, since the fact of the rapid, constant, and",the,rstl_1835_0012.txt,txt_rstl,1835
"comparatively a low range, in fact the month of July has",the,rstl_1835_0012.txt,txt_rstl,1835
"their labours had verified the fact established by HumBorpr, that the",the,rstl_1835_0012.txt,txt_rstl,1835
"than at Poona, is in fact greater. The mean of three",the,rstl_1835_0012.txt,txt_rstl,1835
observations at 2416 feet. One fact is very re- markable; the,the,rstl_1835_0012.txt,txt_rstl,1835
glass; and I deemed the fact sufficiently curious to induce me,the,rstl_1835_0012.txt,txt_rstl,1835
fields seem to establish the fact of the local charac- ter,the,rstl_1835_0012.txt,txt_rstl,1835
be as- sured of the fact by the corresponding movements of,the,rstl_1835_0012.txt,txt_rstl,1835
interrupting them : the anomalons fact of the mean diurnal oscillations,the,rstl_1835_0012.txt,txt_rstl,1835
latitude at Madras : the fact of the diurnal tides at,the,rstl_1835_0012.txt,txt_rstl,1835
"this be the cause, the fact is indisputable in the observations,",the,rstl_1835_0007.txt,txt_rstl,1835
"particular pains to ascertain the fact with certainty, A wire of",the,rstl_1835_0005.txt,txt_rstl,1835
"also have increased. 1073. The fact is, that under many variations",the,rstl_1835_0005.txt,txt_rstl,1835
"Proceeding, however, upon the known fact that electric currents of great",the,rstl_1835_0005.txt,txt_rstl,1835
"earthquakes and yolcanos, that the fact appeared to require more than",the,rstl_1835_0002.txt,txt_rstl,1835
been laid dry; but the fact is that it fills a,the,rstl_1835_0002.txt,txt_rstl,1835
of sand and gravel. The fact of finding the recent shells,the,rstl_1835_0002.txt,txt_rstl,1835
"in the confirmation of the fact afforded by artificial marks, for",the,rstl_1835_0002.txt,txt_rstl,1835
"must have heen decomposed. The fact recorded by M. BroNGNIarm was,",the,rstl_1835_0002.txt,txt_rstl,1835
the Royal Society an anatomical fact of considerable importance in relation,the,rstl_1836_0027.txt,txt_rstl,1836
"parts of the body. This fact once clearly established, it follows",the,rstl_1836_0027.txt,txt_rstl,1836
; and judging from the fact that the sensory division of,the,rstl_1836_0027.txt,txt_rstl,1836
author who points out the fact that the restiform bodies are,the,rstl_1836_0027.txt,txt_rstl,1836
"by slavery, as by every fact in the past history and",the,rstl_1836_0025.txt,txt_rstl,1836
"by slavery, as by every fact in the past history and",the,rstl_1836_0025.txt,txt_rstl,1836
in Vanessa urtice. From the fact of all the trachee being,the,rstl_1836_0026.txt,txt_rstl,1836
"is further supported by the fact that they are most developed,",the,rstl_1836_0026.txt,txt_rstl,1836
reconcile this opinion with the fact of their being situated along,the,rstl_1836_0026.txt,txt_rstl,1836
"distinct func- tions, The remarkable fact that the transverse nerves appear",the,rstl_1836_0026.txt,txt_rstl,1836
"combined actions. The experi- mental fact observed by Reaumus, that the",the,rstl_1836_0026.txt,txt_rstl,1836
"has become nearly asphyxiated, the fact will then be still more",the,rstl_1836_0026.txt,txt_rstl,1836
of Respiration. The very important fact established by Dr. Epwanvs in,the,rstl_1836_0026.txt,txt_rstl,1836
electricity from another. The curious fact that we do not abstract,the,rstl_1836_0022.txt,txt_rstl,1836
"the experiment as a mere fact abstracted from hypotheses, it must",the,rstl_1836_0022.txt,txt_rstl,1836
indeed quite evident from the fact that a compound ele- ment,the,rstl_1836_0022.txt,txt_rstl,1836
"a; as 2180 from the fact already noticed (36.), that whatever",the,rstl_1836_0022.txt,txt_rstl,1836
"Voura, who obseryed the curious fact that the intensity of a",the,rstl_1836_0022.txt,txt_rstl,1836
"that country. It is a fact worthy of remark, that the",the,rstl_1836_0028.txt,txt_rstl,1836
the Springs.—It is a curious fact that all the chief springs,the,rstl_1836_0028.txt,txt_rstl,1836
"Perhaps the most re- markable fact connected with their geological position,",the,rstl_1836_0028.txt,txt_rstl,1836
"' is corroborated by the fact that, at Montreal Island ©",the,rstl_1836_0021.txt,txt_rstl,1836
"probably the cause of the fact ascertained by Haurzs, that it",the,rstl_1836_0020.txt,txt_rstl,1836
"blood, it appears from the fact just stated, existing in itself,",the,rstl_1836_0020.txt,txt_rstl,1836
"the nerves; because such a fact would, independently of all others,",the,rstl_1836_0020.txt,txt_rstl,1836
"London and Paris, has the fact been questioned. If the facts",the,rstl_1836_0020.txt,txt_rstl,1836
may be inferred from the fact that light is reflected from,the,rstl_1836_0009.txt,txt_rstl,1836
which reaches Liverpool does in fact come from the Southern Ocean;,the,rstl_1836_0014.txt,txt_rstl,1836
"is not conclusive, although the fact of the beach on the",the,rstl_1836_0006.txt,txt_rstl,1836
"respect to animals, by the fact said to have been observed",the,rstl_1836_0015.txt,txt_rstl,1836
that of the salmon. This fact was obseryed by LEeEUwennoek# and,the,rstl_1836_0008.txt,txt_rstl,1836
three being double. The same fact will be more particularly noticed,the,rstl_1836_0008.txt,txt_rstl,1836
"fused polarity was the only fact actually observed, I find that",the,rstl_1836_0008.txt,txt_rstl,1836
markable example of the same fact in the tides on the,the,rstl_1836_0019.txt,txt_rstl,1836
"world is a very curious fact ; and the more 80,",the,rstl_1836_0019.txt,txt_rstl,1836
"science. This, together with the fact that in the dynamical problems",the,rstl_1836_0011.txt,txt_rstl,1836
"But recur- ring to the fact furnished by equation (82.), that",the,rstl_1836_0011.txt,txt_rstl,1836
"variation in the height. In fact there does not appear, at",the,rstl_1837_0026.txt,txt_rstl,1837
"easily accounted for by the fact that the old barometer, prior",the,rstl_1837_0026.txt,txt_rstl,1837
able to discover it. The fact is that there is no,the,rstl_1837_0026.txt,txt_rstl,1837
years to find how the fact stands in this respect ;,the,rstl_1837_0021.txt,txt_rstl,1837
; and even this common fact has not the same character,the,rstl_1837_0017.txt,txt_rstl,1837
