Context,Collocate,File,Directory,Year
"trary, a most important geological fact is established; namely that an",an,rstl_1839_0005.txt,txt_rstl,1839
conjecture is confirmed by the fact that such an embryonic muscular,an,rstl_1840_0025.txt,txt_rstl,1840
obtained further evidence of the fact from an apparatus which I,an,rstl_1840_0012.txt,txt_rstl,1840
"admit of being established. The fact is, that at an early",an,rstl_1841_0019.txt,txt_rstl,1841
"have called unexpected, was the fact that an equal ordinate or",an,rstl_1842_0015.txt,txt_rstl,1842
"also are reyersed, but the fact is not easily observed, except",not,rstl_1833_0032.txt,txt_rstl,1833
It is remarkable that this fact should not have been before,not,rstl_1833_0032.txt,txt_rstl,1833
"by time. 6. Although the fact itself, abstractedly considered, may not",not,rstl_1833_0019.txt,txt_rstl,1833
"that they are not in fact stimulants to that fibre, but",not,rstl_1833_0007.txt,txt_rstl,1833
"but adds, that © in fact the resemblance is not complete,”",not,rstl_1833_0006.txt,txt_rstl,1833
entirely on such evidence. The fact of their not having thus,not,rstl_1835_0021.txt,txt_rstl,1835
electricity from another. The curious fact that we do not abstract,not,rstl_1836_0022.txt,txt_rstl,1836
GAULT. It is a 8ingular fact that we are not only,not,rstl_1836_0028.txt,txt_rstl,1836
means prove its absence; a fact with which we should not,not,rstl_1836_0020.txt,txt_rstl,1836
"is not conclusive, although the fact of the beach on the",not,rstl_1836_0006.txt,txt_rstl,1836
"variation in the height. In fact there does not appear, at",not,rstl_1837_0026.txt,txt_rstl,1837
; and even this common fact has not the same character,not,rstl_1837_0017.txt,txt_rstl,1837
determination does not invalidate the fact that the great commissure which,not,rstl_1837_0010.txt,txt_rstl,1837
doubting this curious fact. The fact is certainly not easily reconciled,not,rstl_1837_0009.txt,txt_rstl,1837
"not quite 80 steady. The fact is, that at that port",not,rstl_1837_0009.txt,txt_rstl,1837
life. It is a curious fact that these bees do not,not,rstl_1837_0019.txt,txt_rstl,1837
fallacy in vision; but the fact does not appear to me,not,rstl_1838_0019.txt,txt_rstl,1838
described this membrane. And in fact it is not easy to,not,rstl_1838_0016.txt,txt_rstl,1838
not perceive as yet one fact against it. 1353. There are,not,rstl_1838_0008.txt,txt_rstl,1838
"paying more respect to a fact than a theory, not too",not,rstl_1838_0002.txt,txt_rstl,1838
"referred to, the not uninteresting fact will be made evident, that",not,rstl_1839_0021.txt,txt_rstl,1839
"in cartilage, follows from the fact that the cell-nuclei do not",not,rstl_1840_0025.txt,txt_rstl,1840
slight eleyations of temperature; a fact of which I was not,not,rstl_1840_0020.txt,txt_rstl,1840
entire. But let not this fact militate against our conelusions. The,not,rstl_1840_0014.txt,txt_rstl,1840
"have not only established the fact now mentioned, but they also",not,rstl_1840_0024.txt,txt_rstl,1840
do not act chemically. In fact all conductors that do not,not,rstl_1840_0003.txt,txt_rstl,1840
of the animal. This latter fact shows that it is not,not,rstl_1841_0012.txt,txt_rstl,1841
"have been not inappropriate. The fact is, they are discs, having",not,rstl_1841_0019.txt,txt_rstl,1841
are not in point of fact the same rays which are,not,rstl_1842_0015.txt,txt_rstl,1842
"calculations, although we know in fact that they would not be",not,rstl_1842_0009.txt,txt_rstl,1842
"heretofore, Solid or fluid. A fact also, in itself not uninteresting,",not,rstl_1842_0004.txt,txt_rstl,1842
"also are reyersed, but the fact is not easily observed, except",not,rstl_1833_0032.txt,txt_rstl,1833
It is remarkable that this fact should not have been before,not,rstl_1833_0032.txt,txt_rstl,1833
"by time. 6. Although the fact itself, abstractedly considered, may not",not,rstl_1833_0019.txt,txt_rstl,1833
"that they are not in fact stimulants to that fibre, but",not,rstl_1833_0007.txt,txt_rstl,1833
"but adds, that © in fact the resemblance is not complete,”",not,rstl_1833_0006.txt,txt_rstl,1833
entirely on such evidence. The fact of their not having thus,not,rstl_1835_0021.txt,txt_rstl,1835
electricity from another. The curious fact that we do not abstract,not,rstl_1836_0022.txt,txt_rstl,1836
GAULT. It is a 8ingular fact that we are not only,not,rstl_1836_0028.txt,txt_rstl,1836
means prove its absence; a fact with which we should not,not,rstl_1836_0020.txt,txt_rstl,1836
"is not conclusive, although the fact of the beach on the",not,rstl_1836_0006.txt,txt_rstl,1836
"variation in the height. In fact there does not appear, at",not,rstl_1837_0026.txt,txt_rstl,1837
; and even this common fact has not the same character,not,rstl_1837_0017.txt,txt_rstl,1837
determination does not invalidate the fact that the great commissure which,not,rstl_1837_0010.txt,txt_rstl,1837
doubting this curious fact. The fact is certainly not easily reconciled,not,rstl_1837_0009.txt,txt_rstl,1837
"not quite 80 steady. The fact is, that at that port",not,rstl_1837_0009.txt,txt_rstl,1837
life. It is a curious fact that these bees do not,not,rstl_1837_0019.txt,txt_rstl,1837
fallacy in vision; but the fact does not appear to me,not,rstl_1838_0019.txt,txt_rstl,1838
described this membrane. And in fact it is not easy to,not,rstl_1838_0016.txt,txt_rstl,1838
not perceive as yet one fact against it. 1353. There are,not,rstl_1838_0008.txt,txt_rstl,1838
"paying more respect to a fact than a theory, not too",not,rstl_1838_0002.txt,txt_rstl,1838
"referred to, the not uninteresting fact will be made evident, that",not,rstl_1839_0021.txt,txt_rstl,1839
"in cartilage, follows from the fact that the cell-nuclei do not",not,rstl_1840_0025.txt,txt_rstl,1840
slight eleyations of temperature; a fact of which I was not,not,rstl_1840_0020.txt,txt_rstl,1840
entire. But let not this fact militate against our conelusions. The,not,rstl_1840_0014.txt,txt_rstl,1840
"have not only established the fact now mentioned, but they also",not,rstl_1840_0024.txt,txt_rstl,1840
do not act chemically. In fact all conductors that do not,not,rstl_1840_0003.txt,txt_rstl,1840
of the animal. This latter fact shows that it is not,not,rstl_1841_0012.txt,txt_rstl,1841
"have been not inappropriate. The fact is, they are discs, having",not,rstl_1841_0019.txt,txt_rstl,1841
are not in point of fact the same rays which are,not,rstl_1842_0015.txt,txt_rstl,1842
"calculations, although we know in fact that they would not be",not,rstl_1842_0009.txt,txt_rstl,1842
"heretofore, Solid or fluid. A fact also, in itself not uninteresting,",not,rstl_1842_0004.txt,txt_rstl,1842
have myself observed the same fact in the eggs of several,have,rstl_1833_0032.txt,txt_rstl,1833
It is remarkable that this fact should not have been before,have,rstl_1833_0032.txt,txt_rstl,1833
physiologists have led us. The fact on which this inference is,have,rstl_1833_0007.txt,txt_rstl,1833
Part. We have noticed a fact of more than ordinary importance,have,rstl_1834_0023.txt,txt_rstl,1834
"bodies, and the like. This fact seems to have hitherto escaped",have,rstl_1834_0016.txt,txt_rstl,1834
"also have increased. 1073. The fact is, that under many variations",have,rstl_1835_0005.txt,txt_rstl,1835
"must have heen decomposed. The fact recorded by M. BroNGNIarm was,",have,rstl_1835_0002.txt,txt_rstl,1835
"really exist there, and which fact we have experimentally shown (31.).",have,rstl_1836_0022.txt,txt_rstl,1836
"respect to animals, by the fact said to have been observed",have,rstl_1836_0015.txt,txt_rstl,1836
"electricity, T have found no fact to militate against it; and",have,rstl_1836_0012.txt,txt_rstl,1836
and it is a singular fact that his successors have never,have,rstl_1837_0017.txt,txt_rstl,1837
have abun- dantly established the fact that there is a considerable,have,rstl_1838_0021.txt,txt_rstl,1838
"field of view, but the fact would also perhaps have forced",have,rstl_1838_0019.txt,txt_rstl,1838
have observyed a very interesting fact connected with the proper membrane,have,rstl_1838_0016.txt,txt_rstl,1838
combination. I may mention another fact which segems to have the,have,rstl_1838_0015.txt,txt_rstl,1838
"ELECTRICITY. (SERIES XIV.) rather in fact have proved the contrary, namely,",have,rstl_1838_0014.txt,txt_rstl,1838
and we have in this fact a very remarkable evi- dence,have,rstl_1838_0011.txt,txt_rstl,1838
"Though I have no decisive fact to quote at present, I",have,rstl_1838_0009.txt,txt_rstl,1838
have now to mention a fact or two regarding the nature,have,rstl_1839_0021.txt,txt_rstl,1839
"have not only established the fact now mentioned, but they also",have,rstl_1840_0024.txt,txt_rstl,1840
placing in distinct evidence a fact which I have long more,have,rstl_1840_0002.txt,txt_rstl,1840
"years, and also by a fact which I have myself frequently",have,rstl_1841_0008.txt,txt_rstl,1841
have overlooked the remark- able fact of its remaining for many,have,rstl_1841_0012.txt,txt_rstl,1841
"have been not inappropriate. The fact is, they are discs, having",have,rstl_1841_0019.txt,txt_rstl,1841
"have called unexpected, was the fact that an equal ordinate or",have,rstl_1842_0015.txt,txt_rstl,1842
have myself observed the same fact in the eggs of several,have,rstl_1833_0032.txt,txt_rstl,1833
It is remarkable that this fact should not have been before,have,rstl_1833_0032.txt,txt_rstl,1833
physiologists have led us. The fact on which this inference is,have,rstl_1833_0007.txt,txt_rstl,1833
Part. We have noticed a fact of more than ordinary importance,have,rstl_1834_0023.txt,txt_rstl,1834
"bodies, and the like. This fact seems to have hitherto escaped",have,rstl_1834_0016.txt,txt_rstl,1834
"also have increased. 1073. The fact is, that under many variations",have,rstl_1835_0005.txt,txt_rstl,1835
"must have heen decomposed. The fact recorded by M. BroNGNIarm was,",have,rstl_1835_0002.txt,txt_rstl,1835
"really exist there, and which fact we have experimentally shown (31.).",have,rstl_1836_0022.txt,txt_rstl,1836
"respect to animals, by the fact said to have been observed",have,rstl_1836_0015.txt,txt_rstl,1836
"electricity, T have found no fact to militate against it; and",have,rstl_1836_0012.txt,txt_rstl,1836
and it is a singular fact that his successors have never,have,rstl_1837_0017.txt,txt_rstl,1837
have abun- dantly established the fact that there is a considerable,have,rstl_1838_0021.txt,txt_rstl,1838
"field of view, but the fact would also perhaps have forced",have,rstl_1838_0019.txt,txt_rstl,1838
have observyed a very interesting fact connected with the proper membrane,have,rstl_1838_0016.txt,txt_rstl,1838
combination. I may mention another fact which segems to have the,have,rstl_1838_0015.txt,txt_rstl,1838
"ELECTRICITY. (SERIES XIV.) rather in fact have proved the contrary, namely,",have,rstl_1838_0014.txt,txt_rstl,1838
and we have in this fact a very remarkable evi- dence,have,rstl_1838_0011.txt,txt_rstl,1838
"Though I have no decisive fact to quote at present, I",have,rstl_1838_0009.txt,txt_rstl,1838
have now to mention a fact or two regarding the nature,have,rstl_1839_0021.txt,txt_rstl,1839
"have not only established the fact now mentioned, but they also",have,rstl_1840_0024.txt,txt_rstl,1840
placing in distinct evidence a fact which I have long more,have,rstl_1840_0002.txt,txt_rstl,1840
"years, and also by a fact which I have myself frequently",have,rstl_1841_0008.txt,txt_rstl,1841
have overlooked the remark- able fact of its remaining for many,have,rstl_1841_0012.txt,txt_rstl,1841
"have been not inappropriate. The fact is, they are discs, having",have,rstl_1841_0019.txt,txt_rstl,1841
"have called unexpected, was the fact that an equal ordinate or",have,rstl_1842_0015.txt,txt_rstl,1842
"speedily rubbed off. Such a fact would be readily observyed, as",a,rstl_1833_0032.txt,txt_rstl,1833
able to perceive a single fact which could be brought forward,a,rstl_1833_0030.txt,txt_rstl,1833
I shall add but one fact more of a medical cha-,a,rstl_1833_0028.txt,txt_rstl,1833
"rubbed out; and is in fact a globular cluster, but to",a,rstl_1833_0021.txt,txt_rstl,1833
"(but which is in = fact a finite quantity,) is added",a,rstl_1833_0020.txt,txt_rstl,1833
or less with steel. The fact of iron retaining a trifling,a,rstl_1833_0019.txt,txt_rstl,1833
"of heat, I state a fact which, though new to science,",a,rstl_1833_0016.txt,txt_rstl,1833
"of subarseniate. It is a fact of extraordinary interest, that the",a,rstl_1833_0015.txt,txt_rstl,1833
but a knowledge of one fact may be of service in,a,rstl_1833_0013.txt,txt_rstl,1833
do we pos8ess a single fact to prove that there are,a,rstl_1833_0007.txt,txt_rstl,1833
unequivocal proof of such a fact to induce its belief. The,a,rstl_1833_0007.txt,txt_rstl,1833
"intervention of the nerves, a fact which is well ascer- tained,",a,rstl_1833_0007.txt,txt_rstl,1833
"the process of solution, a fact particularly exposed in my paper",a,rstl_1834_0030.txt,txt_rstl,1834
"a natural formation, is a fact worthy of notice. I think",a,rstl_1834_0029.txt,txt_rstl,1834
Part. We have noticed a fact of more than ordinary importance,a,rstl_1834_0023.txt,txt_rstl,1834
"its failure, and for a fact which I had obseryed long",a,rstl_1834_0022.txt,txt_rstl,1834
"nerves, there is a curious fact relating to the terminal pair,",a,rstl_1834_0021.txt,txt_rstl,1834
"is a remarkable and interesting fact that in the Sloth, in",a,rstl_1834_0019.txt,txt_rstl,1834
led us. Although a Single fact is often sufficient to establish,a,rstl_1834_0012.txt,txt_rstl,1834
"such appears to be the fact (697.), dependent upon a law,",a,rstl_1834_0008.txt,txt_rstl,1834
"established as a matter of fact amongst gases and yapours, extends",a,rstl_1834_0007.txt,txt_rstl,1834
"the moon's transit, is in fact principally a table of the",a,rstl_1834_0004.txt,txt_rstl,1834
"of a fluid, are in fact the results of its motion",a,rstl_1834_0004.txt,txt_rstl,1834
"on a muddy bottom, a fact which M. Araco notices, when",a,rstl_1835_0020.txt,txt_rstl,1835
will show that a similar fact has been ob- served among,a,rstl_1835_0018.txt,txt_rstl,1835
"certain phenomena, he discovered a fact in the structure which diverted",a,rstl_1835_0015.txt,txt_rstl,1835
"tenths of an inch, in fact to *1950, with a difference",a,rstl_1835_0012.txt,txt_rstl,1835
"comparatively a low range, in fact the month of July has",a,rstl_1835_0012.txt,txt_rstl,1835
inquiry arose out of a fact communicated to me by Mr.,a,rstl_1835_0005.txt,txt_rstl,1835
"particular pains to ascertain the fact with certainty, A wire of",a,rstl_1835_0005.txt,txt_rstl,1835
been laid dry; but the fact is that it fills a,a,rstl_1835_0002.txt,txt_rstl,1835
parts of each ridge; a fact which seems to me to,a,rstl_1835_0002.txt,txt_rstl,1835
"the experiment as a mere fact abstracted from hypotheses, it must",a,rstl_1836_0022.txt,txt_rstl,1836
indeed quite evident from the fact that a compound ele- ment,a,rstl_1836_0022.txt,txt_rstl,1836
"Voura, who obseryed the curious fact that the intensity of a",a,rstl_1836_0022.txt,txt_rstl,1836
GAULT. It is a 8ingular fact that we are not only,a,rstl_1836_0028.txt,txt_rstl,1836
"that country. It is a fact worthy of remark, that the",a,rstl_1836_0028.txt,txt_rstl,1836
This is a very inleresting fact ; and it will be,a,rstl_1836_0028.txt,txt_rstl,1836
the Springs.—It is a curious fact that all the chief springs,a,rstl_1836_0028.txt,txt_rstl,1836
"ordinary springs, is a curious fact mentioned to me by M.",a,rstl_1836_0028.txt,txt_rstl,1836
"the nerves; because such a fact would, independently of all others,",a,rstl_1836_0020.txt,txt_rstl,1836
means prove its absence; a fact with which we should not,a,rstl_1836_0020.txt,txt_rstl,1836
"may be conceded, as a fact already well established, that plants",a,rstl_1836_0015.txt,txt_rstl,1836
"world is a very curious fact ; and the more 80,",a,rstl_1836_0019.txt,txt_rstl,1836
it tends to establish a fact which appears to me to,a,rstl_1837_0022.txt,txt_rstl,1837
and it is a singular fact that his successors have never,a,rstl_1837_0017.txt,txt_rstl,1837
"a single cilium is in fact a wave of cilia, and",a,rstl_1837_0024.txt,txt_rstl,1837
omitted to observe the important fact of the existence of a,a,rstl_1837_0019.txt,txt_rstl,1837
from a knowledge of the fact that both the amount of,a,rstl_1837_0019.txt,txt_rstl,1837
"the surrounding medium, of in fact a voluntary power of generating",a,rstl_1837_0019.txt,txt_rstl,1837
life. It is a curious fact that these bees do not,a,rstl_1837_0019.txt,txt_rstl,1837
have abun- dantly established the fact that there is a considerable,a,rstl_1838_0021.txt,txt_rstl,1838
be regarded as a new fact in the theory of vision.,a,rstl_1838_0019.txt,txt_rstl,1838
"his new theory by a fact which he acci- dentally observed,",a,rstl_1838_0019.txt,txt_rstl,1838
have observyed a very interesting fact connected with the proper membrane,a,rstl_1838_0016.txt,txt_rstl,1838
and we have in this fact a very remarkable evi- dence,a,rstl_1838_0011.txt,txt_rstl,1838
"paying more respect to a fact than a theory, not too",a,rstl_1838_0002.txt,txt_rstl,1838
would be a very important fact in the theory which as8umes,a,rstl_1838_0002.txt,txt_rstl,1838
simplest considerations ; but a fact in proof will be better.,a,rstl_1838_0002.txt,txt_rstl,1838
"upon the extremity b, a fact which may be further observed",a,rstl_1839_0015.txt,txt_rstl,1839
little interesting ; they in fact help us to a more,a,rstl_1839_0015.txt,txt_rstl,1839
; it would be in fact merely placing a coated pane,a,rstl_1839_0015.txt,txt_rstl,1839
on a knowledge of the fact that the germinal vesicle returns,a,rstl_1839_0021.txt,txt_rstl,1839
with one another ; a fact well shown in Plate VII.,a,rstl_1839_0021.txt,txt_rstl,1839
have now to mention a fact or two regarding the nature,a,rstl_1839_0021.txt,txt_rstl,1839
* This is a similar fact to what has been observed,a,rstl_1839_0005.txt,txt_rstl,1839
"trary, a most important geological fact is established; namely that an",a,rstl_1839_0005.txt,txt_rstl,1839
the sea. 5th. The extraordinary fact that a large country has,a,rstl_1839_0005.txt,txt_rstl,1839
it is to admit a fact made known by two of,a,rstl_1840_0025.txt,txt_rstl,1840
"the same materials, was a fact which clearly proved that certainty",a,rstl_1840_0023.txt,txt_rstl,1840
"marked c, c, is a fact which it would be im-",a,rstl_1840_0023.txt,txt_rstl,1840
slight eleyations of temperature; a fact of which I was not,a,rstl_1840_0020.txt,txt_rstl,1840
would draw attention to a fact which may hereafter prove of,a,rstl_1840_0019.txt,txt_rstl,1840
"respiration continued, I established the fact that there was a source",a,rstl_1840_0014.txt,txt_rstl,1840
It is a well known fact that the voltaic current will,a,rstl_1840_0012.txt,txt_rstl,1840
at once removed by the fact of a spark of the,a,rstl_1840_0010.txt,txt_rstl,1840
"faint, sometimes undistinguishable ; a fact which scems $ufficiently explained by",a,rstl_1840_0022.txt,txt_rstl,1840
Primitive Fasciculi. There is a fact in the anatomical history of,a,rstl_1840_0022.txt,txt_rstl,1840
"Mizzer's Physiology, This is a fact which may hereafter prove important",a,rstl_1840_0022.txt,txt_rstl,1840
"to low water, are in fact more simply conceived as a",a,rstl_1840_0007.txt,txt_rstl,1840
without a knowledge of the fact that the germinal vesicle returns,a,rstl_1840_0024.txt,txt_rstl,1840
and a knowledge of this fact pre- pared me for attempting,a,rstl_1840_0021.txt,txt_rstl,1840
of forcible experimental evidence; a fact sufficiently clear to my mind,a,rstl_1840_0003.txt,txt_rstl,1840
"as a burning-glass, is in fact one of the worst possible",a,rstl_1840_0002.txt,txt_rstl,1840
"s80lved, since it is a fact that the negative reversed photographic",a,rstl_1840_0002.txt,txt_rstl,1840
enable us to anticipate a fact s0 totally at variance with,a,rstl_1840_0002.txt,txt_rstl,1840
to produce at all; a fact which seems difficult to deal,a,rstl_1840_0002.txt,txt_rstl,1840
placing in distinct evidence a fact which I have long more,a,rstl_1840_0002.txt,txt_rstl,1840
"years, and also by a fact which I have myself frequently",a,rstl_1841_0008.txt,txt_rstl,1841
the know- ledge of this fact forms a necessary introduction to,a,rstl_1841_0015.txt,txt_rstl,1841
albuminous fluid and shell. This fact deserves particular consideration. A large,a,rstl_1841_0012.txt,txt_rstl,1841
"care, to detect a single fact inconsistent with the conclusion above",a,rstl_1841_0019.txt,txt_rstl,1841
"muriatic acid, and is in fact a highly basic carbonate of",a,rstl_1842_0016.txt,txt_rstl,1842
"their composition, and are in fact di- chromatic. A good example",a,rstl_1842_0013.txt,txt_rstl,1842
low water. There is in fact the ru- diment of a,a,rstl_1842_0002.txt,txt_rstl,1842
"heretofore, Solid or fluid. A fact also, in itself not uninteresting,",a,rstl_1842_0004.txt,txt_rstl,1842
"investigation of fibre, is in fact a con- tinuation of those",a,rstl_1842_0008.txt,txt_rstl,1842
"speedily rubbed off. Such a fact would be readily observyed, as",a,rstl_1833_0032.txt,txt_rstl,1833
able to perceive a single fact which could be brought forward,a,rstl_1833_0030.txt,txt_rstl,1833
I shall add but one fact more of a medical cha-,a,rstl_1833_0028.txt,txt_rstl,1833
"rubbed out; and is in fact a globular cluster, but to",a,rstl_1833_0021.txt,txt_rstl,1833
"(but which is in = fact a finite quantity,) is added",a,rstl_1833_0020.txt,txt_rstl,1833
or less with steel. The fact of iron retaining a trifling,a,rstl_1833_0019.txt,txt_rstl,1833
"of heat, I state a fact which, though new to science,",a,rstl_1833_0016.txt,txt_rstl,1833
"of subarseniate. It is a fact of extraordinary interest, that the",a,rstl_1833_0015.txt,txt_rstl,1833
but a knowledge of one fact may be of service in,a,rstl_1833_0013.txt,txt_rstl,1833
do we pos8ess a single fact to prove that there are,a,rstl_1833_0007.txt,txt_rstl,1833
unequivocal proof of such a fact to induce its belief. The,a,rstl_1833_0007.txt,txt_rstl,1833
"intervention of the nerves, a fact which is well ascer- tained,",a,rstl_1833_0007.txt,txt_rstl,1833
"the process of solution, a fact particularly exposed in my paper",a,rstl_1834_0030.txt,txt_rstl,1834
"a natural formation, is a fact worthy of notice. I think",a,rstl_1834_0029.txt,txt_rstl,1834
Part. We have noticed a fact of more than ordinary importance,a,rstl_1834_0023.txt,txt_rstl,1834
"its failure, and for a fact which I had obseryed long",a,rstl_1834_0022.txt,txt_rstl,1834
"nerves, there is a curious fact relating to the terminal pair,",a,rstl_1834_0021.txt,txt_rstl,1834
"is a remarkable and interesting fact that in the Sloth, in",a,rstl_1834_0019.txt,txt_rstl,1834
led us. Although a Single fact is often sufficient to establish,a,rstl_1834_0012.txt,txt_rstl,1834
"such appears to be the fact (697.), dependent upon a law,",a,rstl_1834_0008.txt,txt_rstl,1834
"established as a matter of fact amongst gases and yapours, extends",a,rstl_1834_0007.txt,txt_rstl,1834
"the moon's transit, is in fact principally a table of the",a,rstl_1834_0004.txt,txt_rstl,1834
"of a fluid, are in fact the results of its motion",a,rstl_1834_0004.txt,txt_rstl,1834
"on a muddy bottom, a fact which M. Araco notices, when",a,rstl_1835_0020.txt,txt_rstl,1835
will show that a similar fact has been ob- served among,a,rstl_1835_0018.txt,txt_rstl,1835
"certain phenomena, he discovered a fact in the structure which diverted",a,rstl_1835_0015.txt,txt_rstl,1835
"tenths of an inch, in fact to *1950, with a difference",a,rstl_1835_0012.txt,txt_rstl,1835
"comparatively a low range, in fact the month of July has",a,rstl_1835_0012.txt,txt_rstl,1835
inquiry arose out of a fact communicated to me by Mr.,a,rstl_1835_0005.txt,txt_rstl,1835
"particular pains to ascertain the fact with certainty, A wire of",a,rstl_1835_0005.txt,txt_rstl,1835
been laid dry; but the fact is that it fills a,a,rstl_1835_0002.txt,txt_rstl,1835
parts of each ridge; a fact which seems to me to,a,rstl_1835_0002.txt,txt_rstl,1835
"the experiment as a mere fact abstracted from hypotheses, it must",a,rstl_1836_0022.txt,txt_rstl,1836
indeed quite evident from the fact that a compound ele- ment,a,rstl_1836_0022.txt,txt_rstl,1836
"Voura, who obseryed the curious fact that the intensity of a",a,rstl_1836_0022.txt,txt_rstl,1836
GAULT. It is a 8ingular fact that we are not only,a,rstl_1836_0028.txt,txt_rstl,1836
"that country. It is a fact worthy of remark, that the",a,rstl_1836_0028.txt,txt_rstl,1836
This is a very inleresting fact ; and it will be,a,rstl_1836_0028.txt,txt_rstl,1836
the Springs.—It is a curious fact that all the chief springs,a,rstl_1836_0028.txt,txt_rstl,1836
"ordinary springs, is a curious fact mentioned to me by M.",a,rstl_1836_0028.txt,txt_rstl,1836
"the nerves; because such a fact would, independently of all others,",a,rstl_1836_0020.txt,txt_rstl,1836
means prove its absence; a fact with which we should not,a,rstl_1836_0020.txt,txt_rstl,1836
"may be conceded, as a fact already well established, that plants",a,rstl_1836_0015.txt,txt_rstl,1836
"world is a very curious fact ; and the more 80,",a,rstl_1836_0019.txt,txt_rstl,1836
it tends to establish a fact which appears to me to,a,rstl_1837_0022.txt,txt_rstl,1837
and it is a singular fact that his successors have never,a,rstl_1837_0017.txt,txt_rstl,1837
"a single cilium is in fact a wave of cilia, and",a,rstl_1837_0024.txt,txt_rstl,1837
omitted to observe the important fact of the existence of a,a,rstl_1837_0019.txt,txt_rstl,1837
from a knowledge of the fact that both the amount of,a,rstl_1837_0019.txt,txt_rstl,1837
"the surrounding medium, of in fact a voluntary power of generating",a,rstl_1837_0019.txt,txt_rstl,1837
life. It is a curious fact that these bees do not,a,rstl_1837_0019.txt,txt_rstl,1837
have abun- dantly established the fact that there is a considerable,a,rstl_1838_0021.txt,txt_rstl,1838
be regarded as a new fact in the theory of vision.,a,rstl_1838_0019.txt,txt_rstl,1838
"his new theory by a fact which he acci- dentally observed,",a,rstl_1838_0019.txt,txt_rstl,1838
