Context,Collocate,File,Directory,Year,Frequency Filter
"also cases of phthisis. These facts possess the greatest interest, and",these,rstl_1854_0014.txt,txt_rstl,1854,14
"these were confirmatory of the facts before stated, as the variation",these,rstl_1854_0009.txt,txt_rstl,1854,14
spoken of its length. These facts will explain the results of,these,rstl_1855_0010.txt,txt_rstl,1855,14
"; but these prove other facts also ; and first, that",these,rstl_1855_0005.txt,txt_rstl,1855,14
the same agent. Supposing these facts to have been known to,these,rstl_1855_0001.txt,txt_rstl,1855,14
the manner in which these facts have been explained. © La,these,rstl_1855_0001.txt,txt_rstl,1855,14
by critical examinations of the facts already accumulated. These menoirs I,these,rstl_1856_0020.txt,txt_rstl,1856,14
LIONEL BEALE ON THE These facts appear to me to militate,these,rstl_1856_0017.txt,txt_rstl,1856,14
a like kind. Among these facts were several that became of,these,rstl_1856_0012.txt,txt_rstl,1856,14
"identical properties. Connecting all these facts together, it clearly follows,— That",these,rstl_1856_0001.txt,txt_rstl,1856,14
inch to crush them. These facts show the great superiority of,these,rstl_1857_0039.txt,txt_rstl,1857,14
moment de leur formation.” These facts appear to be totally at,these,rstl_1857_0016.txt,txt_rstl,1857,14
"electricity. The first of these facts is, that a differential current",these,rstl_1857_0010.txt,txt_rstl,1857,14
"fibres, still I think these facts render it highly probable that",these,rstl_1857_0009.txt,txt_rstl,1857,14
"inference I deduce from these facts is, first, that the animals",these,rstl_1857_0009.txt,txt_rstl,1857,14
faces in the quadrant (111...211). Facts presented by these Tables —The,these,rstl_1857_0004.txt,txt_rstl,1857,14
angles. With regard to these facts no difference of opinion can,these,rstl_1857_0004.txt,txt_rstl,1857,14
to the same family. These facts I now proceed to particularize,these,rstl_1858_0035.txt,txt_rstl,1858,14
within half an hour. These facts appeared to me of great,these,rstl_1858_0030.txt,txt_rstl,1858,14
"the paralysed parts. All these facts tend to the same conclusion,",these,rstl_1858_0029.txt,txt_rstl,1858,14
which circulation ceased. From these facts it appears that there exists,these,rstl_1858_0029.txt,txt_rstl,1858,14
"89-3:100, or 7:10 nearly. These facts are conclusive in showing the",these,rstl_1858_0021.txt,txt_rstl,1858,14
"boilers invariably present joints, these facts are proþ of some significance",these,rstl_1858_0021.txt,txt_rstl,1858,14
they were very adhesive. These facts seem sufficient proof of the,these,rstl_1858_0031.txt,txt_rstl,1858,14
possible to explain these curious facts upon chemical Sprinciples seems very,these,rstl_1858_0031.txt,txt_rstl,1858,14
the natural interpretation of these facts seems my E to be,these,rstl_1858_0031.txt,txt_rstl,1858,14
"functions became unveiled, and Further facts were developed, these difficulties were",these,rstl_1858_0031.txt,txt_rstl,1858,14
"From these and other similar facts it appeared that mustard, croton",these,rstl_1858_0031.txt,txt_rstl,1858,14
"only very feeble action, Such facts as these prove conclusively that,",these,rstl_1858_0031.txt,txt_rstl,1858,14
"bodies, resembling spermatozoa. From these facts it can scarcely be doubted",these,rstl_1858_0034.txt,txt_rstl,1858,14
"= fairly deducible from the facts which these researches have disclosed,",these,rstl_1858_0005.txt,txt_rstl,1858,14
organs is certain from these facts :— S At a particular,these,rstl_1858_0006.txt,txt_rstl,1858,14
The significance 2 of these facts cannot for a moment be,these,rstl_1858_0006.txt,txt_rstl,1858,14
"simi- Slarly situated, leaving these facts to be discussed by others",these,rstl_1859_0017.txt,txt_rstl,1859,14
"the correct determination of these facts is concerned, it seems to",these,rstl_1859_0017.txt,txt_rstl,1859,14
more considerable diameter. = These facts puzzled me a little at,these,rstl_1859_0018.txt,txt_rstl,1859,14
HoykiNs has drawn from these facts is unavoidable ; the glaciers,these,rstl_1859_0015.txt,txt_rstl,1859,14
These experiments developed the following facts :—lIst. That the effect of,these,rstl_1859_0005.txt,txt_rstl,1859,14
"about 24 per cent. These facts are of considerable interest, when",these,rstl_1859_0025.txt,txt_rstl,1859,14
"of terrestrial induction. Bearing these facts in view, and taking further",these,rstl_1860_0021.txt,txt_rstl,1860,14
"one of the most remarkable facts is this, that these luminous",these,rstl_1860_0010.txt,txt_rstl,1860,14
at first produced. All these facts are easily explained from the,these,rstl_1860_0008.txt,txt_rstl,1860,14
"flash than atmospheric air, These facts are in harmony with the",these,rstl_1861_0001.txt,txt_rstl,1861,14
"the central aperture. Keeping these facts in view, it would be",these,rstl_1861_0029.txt,txt_rstl,1861,14
To the statement of these facts it should be added that,these,rstl_1861_0024.txt,txt_rstl,1861,14
be no doubt that these facts are evidence of a great,these,rstl_1862_0042.txt,txt_rstl,1862,14
"this change, and as these facts have been observed, not in",these,rstl_1862_0038.txt,txt_rstl,1862,14
is far above this. These facts may be explained in two,these,rstl_1862_0040.txt,txt_rstl,1862,14
the hardest like rocks. These facts point towards the circumstance of,these,rstl_1862_0033.txt,txt_rstl,1862,14
"dilute hydrochloric acid (83.); these facts also indicate that, the change",these,rstl_1862_0020.txt,txt_rstl,1862,14
the Tonbridge- London values. These facts all indicate the yery notable,these,rstl_1862_0013.txt,txt_rstl,1862,14
than when cold. From these facts we learn another marked difference,these,rstl_1862_0001.txt,txt_rstl,1862,14
"geographically opposite. Now, keeping these facts in view, let us imagine",these,rstl_1863_0030.txt,txt_rstl,1863,14
organs of respiration. From the facts which I have already succeeded,have,rstl_1854_0014.txt,txt_rstl,1854,14
experiments have therefore elicited three facts as regards beams formed of,have,rstl_1855_0009.txt,txt_rstl,1855,14
the same agent. Supposing these facts to have been known to,have,rstl_1855_0001.txt,txt_rstl,1855,14
the manner in which these facts have been explained. © La,have,rstl_1855_0001.txt,txt_rstl,1855,14
"growth; on which inquiry, the facts which I have now brought",have,rstl_1856_0027.txt,txt_rstl,1856,14
"any other explanation of the facts I have observed, or of",have,rstl_1856_0017.txt,txt_rstl,1856,14
stroma ; but if the facts T have stated be not,have,rstl_1857_0027.txt,txt_rstl,1857,14
"this respect. 2 From the facts that have just been mentioned,",have,rstl_1857_0009.txt,txt_rstl,1857,14
appears strictly comparable to the facts which have been obseryed in,have,rstl_1857_0007.txt,txt_rstl,1857,14
T think the following new facts have been established in the,have,rstl_1858_0013.txt,txt_rstl,1858,14
for myself; and several new facts which I have unexpectedly met,have,rstl_1858_0031.txt,txt_rstl,1858,14
good definition. Thus far the facts of observation have been stated,have,rstl_1858_0025.txt,txt_rstl,1858,14
a thorough investigation of the facts had become necessary. I have,have,rstl_1858_0034.txt,txt_rstl,1858,14
"have been led Sby the facts described in the foregoing pages,",have,rstl_1858_0032.txt,txt_rstl,1858,14
"= fairly deducible from the facts which these researches have disclosed,",have,rstl_1858_0005.txt,txt_rstl,1858,14
and of observing some interesting facts which have not been clearly,have,rstl_1859_0024.txt,txt_rstl,1859,14
reconcile this account with the facts which I have met with.,have,rstl_1859_0024.txt,txt_rstl,1859,14
"the simplest manner possible, the facts I have to bring forward;",have,rstl_1859_0017.txt,txt_rstl,1859,14
we find that the extreme facts have been dwelt upon princi-,have,rstl_1859_0015.txt,txt_rstl,1859,14
to interference; but the new facts which have been elicited in,have,rstl_1859_0007.txt,txt_rstl,1859,14
NERVES Conclusions. 'The most important facts which have been elucidated in,have,rstl_1860_0028.txt,txt_rstl,1860,14
"frame, as it were—the various facts which I have collected relating",have,rstl_1860_0023.txt,txt_rstl,1860,14
"they are isolated, and the facts which they have established can",have,rstl_1860_0024.txt,txt_rstl,1860,14
to the analogy of the facts which have been determined by,have,rstl_1860_0026.txt,txt_rstl,1860,14
of the large body of facts which have been brought together,have,rstl_1860_0026.txt,txt_rstl,1860,14
"this mmunication, because the two facts with which we have to",have,rstl_1861_0008.txt,txt_rstl,1861,14
of fairly discussing the crude facts that have accumulated in my,have,rstl_1861_0008.txt,txt_rstl,1861,14
"and other questions, referring to facts more or less established, have",have,rstl_1861_0001.txt,txt_rstl,1861,14
"causes. So far as the facts we have already considered go,",have,rstl_1861_0024.txt,txt_rstl,1861,14
have been drawn from the facts observed. The author preferred to,have,rstl_1862_0041.txt,txt_rstl,1862,14
"limbs, — and many other facts which I have considered elsewhere,",have,rstl_1862_0038.txt,txt_rstl,1862,14
"this change, and as these facts have been observed, not in",have,rstl_1862_0038.txt,txt_rstl,1862,14
supposed simple substances; and the facts which have been stated respecting,have,rstl_1862_0040.txt,txt_rstl,1862,14
real amount? Two of the facts which I have noted respecting,have,rstl_1862_0040.txt,txt_rstl,1862,14
"is not yet complete, the facts which have already been brought",have,rstl_1862_0012.txt,txt_rstl,1862,14
con- clusions are justified by facts which have been demonstrated *.,have,rstl_1863_0026.txt,txt_rstl,1863,14
"the alkalies, we have numerous facts to prove that its true",have,rstl_1863_0009.txt,txt_rstl,1863,14
the same agent. Supposing these facts to have been known to,been,rstl_1855_0001.txt,txt_rstl,1855,14
the manner in which these facts have been explained. © La,been,rstl_1855_0001.txt,txt_rstl,1855,14
"this respect. 2 From the facts that have just been mentioned,",been,rstl_1857_0009.txt,txt_rstl,1857,14
appears strictly comparable to the facts which have been obseryed in,been,rstl_1857_0007.txt,txt_rstl,1857,14
T think the following new facts have been established in the,been,rstl_1858_0013.txt,txt_rstl,1858,14
good definition. Thus far the facts of observation have been stated,been,rstl_1858_0025.txt,txt_rstl,1858,14
"have been led Sby the facts described in the foregoing pages,",been,rstl_1858_0032.txt,txt_rstl,1858,14
and of observing some interesting facts which have not been clearly,been,rstl_1859_0024.txt,txt_rstl,1859,14
we find that the extreme facts have been dwelt upon princi-,been,rstl_1859_0015.txt,txt_rstl,1859,14
to interference; but the new facts which have been elicited in,been,rstl_1859_0007.txt,txt_rstl,1859,14
NERVES Conclusions. 'The most important facts which have been elucidated in,been,rstl_1860_0028.txt,txt_rstl,1860,14
"not yet completed. The principal facts have, however, been already ascertained,",been,rstl_1860_0008.txt,txt_rstl,1860,14
to the analogy of the facts which have been determined by,been,rstl_1860_0026.txt,txt_rstl,1860,14
of the large body of facts which have been brought together,been,rstl_1860_0026.txt,txt_rstl,1860,14
have been drawn from the facts observed. The author preferred to,been,rstl_1862_0041.txt,txt_rstl,1862,14
"this change, and as these facts have been observed, not in",been,rstl_1862_0038.txt,txt_rstl,1862,14
supposed simple substances; and the facts which have been stated respecting,been,rstl_1862_0040.txt,txt_rstl,1862,14
"is not yet complete, the facts which have already been brought",been,rstl_1862_0012.txt,txt_rstl,1862,14
been demonstrated. Although many general facts are opposed to the notion,been,rstl_1863_0026.txt,txt_rstl,1863,14
con- clusions are justified by facts which have been demonstrated *.,been,rstl_1863_0026.txt,txt_rstl,1863,14
organs of respiration. From the facts which I have already succeeded,which,rstl_1854_0014.txt,txt_rstl,1854,14
all of which the same facts could be noted. The segmentation,which,rstl_1854_0009.txt,txt_rstl,1854,14
tried in the search for facts which might throw light on,which,rstl_1854_0008.txt,txt_rstl,1854,14
1855. Ir is among the facts in chemical science which admit,which,rstl_1855_0008.txt,txt_rstl,1855,14
which appears to represent the facts with a con- siderable degree,which,rstl_1855_0002.txt,txt_rstl,1855,14
the manner in which these facts have been explained. © La,which,rstl_1855_0001.txt,txt_rstl,1855,14
"M. MarTevecr, and converted the facts upon which the objection is",which,rstl_1855_0001.txt,txt_rstl,1855,14
critical review of all the facts of the case which at,which,rstl_1855_0017.txt,txt_rstl,1855,14
"growth; on which inquiry, the facts which I have now brought",which,rstl_1856_0027.txt,txt_rstl,1856,14
"which presumption was corroborated by facts adduced in the £ame communication,",which,rstl_1856_0016.txt,txt_rstl,1856,14
conclusively established by the following facts :—In all the spirit-specimens which,which,rstl_1856_0012.txt,txt_rstl,1856,14
not premature to search for facts which may serve as starting-points,which,rstl_1857_0019.txt,txt_rstl,1857,14
"writes, © a multitude of facts which scem to necessitate the",which,rstl_1857_0016.txt,txt_rstl,1857,14
appears strictly comparable to the facts which have been obseryed in,which,rstl_1857_0007.txt,txt_rstl,1857,14
without a knowledge of the facts upon which zoologists ve adopted,which,rstl_1858_0028.txt,txt_rstl,1858,14
which circulation ceased. From these facts it appears that there exists,which,rstl_1858_0029.txt,txt_rstl,1858,14
and we trust that the facts which we are about to,which,rstl_1858_0018.txt,txt_rstl,1858,14
for myself; and several new facts which I have unexpectedly met,which,rstl_1858_0031.txt,txt_rstl,1858,14
"= fairly deducible from the facts which these researches have disclosed,",which,rstl_1858_0005.txt,txt_rstl,1858,14
and of observing some interesting facts which have not been clearly,which,rstl_1859_0024.txt,txt_rstl,1859,14
reconcile this account with the facts which I have met with.,which,rstl_1859_0024.txt,txt_rstl,1859,14
of the popula- tion. The facts which a Life-Table expresses in,which,rstl_1859_0034.txt,txt_rstl,1859,14
of the other set of facts on which the opponents of,which,rstl_1859_0014.txt,txt_rstl,1859,14
together a great mass of facts which will perhaps ere long,which,rstl_1859_0018.txt,txt_rstl,1859,14
not help feeling that the facts and arguments which I was,which,rstl_1859_0015.txt,txt_rstl,1859,14
to interference; but the new facts which have been elicited in,which,rstl_1859_0007.txt,txt_rstl,1859,14
"the main and more prominent facts and conclusions, which the investigation,",which,rstl_1859_0025.txt,txt_rstl,1859,14
the full explanation of the facts and conclusions which Chemistry and,which,rstl_1859_0025.txt,txt_rstl,1859,14
NERVES Conclusions. 'The most important facts which have been elucidated in,which,rstl_1860_0028.txt,txt_rstl,1860,14
"frame, as it were—the various facts which I have collected relating",which,rstl_1860_0023.txt,txt_rstl,1860,14
"they are isolated, and the facts which they have established can",which,rstl_1860_0024.txt,txt_rstl,1860,14
"in its other reactions, any facts which countenance this otherwise improbable",which,rstl_1860_0008.txt,txt_rstl,1860,14
to the analogy of the facts which have been determined by,which,rstl_1860_0026.txt,txt_rstl,1860,14
of the large body of facts which have been brought together,which,rstl_1860_0026.txt,txt_rstl,1860,14
"this mmunication, because the two facts with which we have to",which,rstl_1861_0008.txt,txt_rstl,1861,14
"in the presence of the facts before us, and which requires",which,rstl_1861_0008.txt,txt_rstl,1861,14
a 7&ume of the principal facts which are contained in the,which,rstl_1861_0030.txt,txt_rstl,1861,14
many of the most important facts with Which we are yet,which,rstl_1861_0024.txt,txt_rstl,1861,14
; nor are we without facts which give some support to,which,rstl_1862_0042.txt,txt_rstl,1862,14
"limbs, — and many other facts which I have considered elsewhere,",which,rstl_1862_0038.txt,txt_rstl,1862,14
supposed simple substances; and the facts which have been stated respecting,which,rstl_1862_0040.txt,txt_rstl,1862,14
"The only conclusion which such facts permit is, that the spectrum",which,rstl_1862_0040.txt,txt_rstl,1862,14
real amount? Two of the facts which I have noted respecting,which,rstl_1862_0040.txt,txt_rstl,1862,14
"is not yet complete, the facts which have already been brought",which,rstl_1862_0012.txt,txt_rstl,1862,14
"be deductions to which the facts diseussed inevitably lead; facts, s0me",which,rstl_1862_0019.txt,txt_rstl,1862,14
refer to a class of facts which surprised and perplexed me,which,rstl_1862_0008.txt,txt_rstl,1862,14
"is needless to remark that facts of this character, of which",which,rstl_1862_0008.txt,txt_rstl,1862,14
"By the combination of the facts which would be thus obtained,",which,rstl_1863_0030.txt,txt_rstl,1863,14
con- clusions are justified by facts which have been demonstrated *.,which,rstl_1863_0026.txt,txt_rstl,1863,14
therefore sought diligently for any facts that might coun- tenance such,that,rstl_1854_0011.txt,txt_rstl,1854,14
accurate conclusion that the observed facts may justify. For all practical,that,rstl_1854_0013.txt,txt_rstl,1854,14
"; but these prove other facts also ; and first, that",that,rstl_1855_0005.txt,txt_rstl,1855,14
does not sufficiently express the facts to say that the bar,that,rstl_1855_0001.txt,txt_rstl,1855,14
a like kind. Among these facts were several that became of,that,rstl_1856_0012.txt,txt_rstl,1856,14
"identical properties. Connecting all these facts together, it clearly follows,— That",that,rstl_1856_0001.txt,txt_rstl,1856,14
"deserved. There were but few facts known, at that period, with",that,rstl_1857_0029.txt,txt_rstl,1857,14
prevented further publication of the facts at that time; but I,that,rstl_1857_0017.txt,txt_rstl,1857,14
"electricity. The first of these facts is, that a differential current",that,rstl_1857_0010.txt,txt_rstl,1857,14
"this respect. 2 From the facts that have just been mentioned,",that,rstl_1857_0009.txt,txt_rstl,1857,14
"fibres, still I think these facts render it highly probable that",that,rstl_1857_0009.txt,txt_rstl,1857,14
"inference I deduce from these facts is, first, that the animals",that,rstl_1857_0009.txt,txt_rstl,1857,14
LISTER ON THE CUTANEOUS 'These facts indicated pretty clearly that the,that,rstl_1858_0030.txt,txt_rstl,1858,14
The idea suggested by the facts is that the tissues begin,that,rstl_1858_0030.txt,txt_rstl,1858,14
which circulation ceased. From these facts it appears that there exists,that,rstl_1858_0029.txt,txt_rstl,1858,14
and we trust that the facts which we are about to,that,rstl_1858_0018.txt,txt_rstl,1858,14
within the yessels. But the facts mentioned by that gentleman in,that,rstl_1858_0031.txt,txt_rstl,1858,14
"From these and other similar facts it appeared that mustard, croton",that,rstl_1858_0031.txt,txt_rstl,1858,14
the latter mountain. The additional facts and inferences obtained at that,that,rstl_1858_0032.txt,txt_rstl,1858,14
will afterwards appear that the facts to be related in this,that,rstl_1858_0006.txt,txt_rstl,1858,14
"phenomena. 'The analysis of the facts gives the result, that where",that,rstl_1859_0014.txt,txt_rstl,1859,14
not help feeling that the facts and arguments which I was,that,rstl_1859_0015.txt,txt_rstl,1859,14
the sliding theory. That such facts exist is known to every,that,rstl_1859_0015.txt,txt_rstl,1859,14
we find that the extreme facts have been dwelt upon princi-,that,rstl_1859_0015.txt,txt_rstl,1859,14
These experiments developed the following facts :—lIst. That the effect of,that,rstl_1859_0005.txt,txt_rstl,1859,14
"in that of others, the facts peculiar to Physiology herself must",that,rstl_1859_0025.txt,txt_rstl,1859,14
"one of the most remarkable facts is this, that these luminous",that,rstl_1860_0010.txt,txt_rstl,1860,14
of fairly discussing the crude facts that have accumulated in my,that,rstl_1861_0008.txt,txt_rstl,1861,14
Warr establishing for us the facts that common + air consists,that,rstl_1861_0024.txt,txt_rstl,1861,14
To the statement of these facts it should be added that,that,rstl_1861_0024.txt,txt_rstl,1861,14
"pit, and irrespective of the facts that the bottom has certainly",that,rstl_1862_0042.txt,txt_rstl,1862,14
be no doubt that these facts are evidence of a great,that,rstl_1862_0042.txt,txt_rstl,1862,14
"are at present understood, certain facts 8eem to imply that it",that,rstl_1862_0042.txt,txt_rstl,1862,14
"can be drawn from the facts demonstrated is, that the neryes",that,rstl_1862_0038.txt,txt_rstl,1862,14
"The only conclusion which such facts permit is, that the spectrum",that,rstl_1862_0040.txt,txt_rstl,1862,14
the genus Ficus. The following facts indicate that the granulation belongs,that,rstl_1862_0043.txt,txt_rstl,1862,14
"longitudinal fissure, and that such facts are much against an interpreta-",that,rstl_1862_0043.txt,txt_rstl,1862,14
he infers that all the facts are consistent with the supposition,that,rstl_1862_0013.txt,txt_rstl,1862,14
to infer from the observed facts that ice did possess ome,that,rstl_1862_0034.txt,txt_rstl,1862,14
remark that the evidence of facts in fayour of it is,that,rstl_1862_0034.txt,txt_rstl,1862,14
"is needless to remark that facts of this character, of which",that,rstl_1862_0008.txt,txt_rstl,1862,14
"the alkalies, we have numerous facts to prove that its true",that,rstl_1863_0009.txt,txt_rstl,1863,14
organs of respiration. From the facts which I have already succeeded,from,rstl_1854_0014.txt,txt_rstl,1854,14
"fecundating fluid. . From the facts stated above, and before detailed",from,rstl_1854_0009.txt,txt_rstl,1854,14
from pole to pole. The facts observed by M. MaTTEvcer seem,from,rstl_1855_0001.txt,txt_rstl,1855,14
"proved, by the comparison of facts then to be addaced from",from,rstl_1856_0027.txt,txt_rstl,1856,14
"Electrical Convections of Heat, from Facts of Thermo-electric Inversion. 102. 'The",from,rstl_1856_0031.txt,txt_rstl,1856,14
24% 259 26? Several curious facts become apparent from inspection of,from,rstl_1857_0022.txt,txt_rstl,1857,14
"this respect. 2 From the facts that have just been mentioned,",from,rstl_1857_0009.txt,txt_rstl,1857,14
"inference I deduce from these facts is, first, that the animals",from,rstl_1857_0009.txt,txt_rstl,1857,14
"from a Tenia-embryo. Finally, the facts made known in this communication",from,rstl_1857_0009.txt,txt_rstl,1857,14
which circulation ceased. From these facts it appears that there exists,from,rstl_1858_0029.txt,txt_rstl,1858,14
evidence quite distinet from the facts mentioned with relation to the,from,rstl_1858_0017.txt,txt_rstl,1858,14
be gathered from the following facts :;—As regards the variation of,from,rstl_1858_0013.txt,txt_rstl,1858,14
"excess of fibrine. From the facts detailed in this section, it",from,rstl_1858_0031.txt,txt_rstl,1858,14
"OF INFLAMMATION. 661 From the facts above mentioned, I became convinced",from,rstl_1858_0031.txt,txt_rstl,1858,14
"From these and other similar facts it appeared that mustard, croton",from,rstl_1858_0031.txt,txt_rstl,1858,14
"bodies, resembling spermatozoa. From these facts it can scarcely be doubted",from,rstl_1858_0034.txt,txt_rstl,1858,14
"= fairly deducible from the facts which these researches have disclosed,",from,rstl_1858_0005.txt,txt_rstl,1858,14
organs is certain from these facts :— S At a particular,from,rstl_1858_0006.txt,txt_rstl,1858,14
hypothesis does not express the facts deduced from the observations exactly.,from,rstl_1859_0034.txt,txt_rstl,1859,14
HoykiNs has drawn from these facts is unavoidable ; the glaciers,from,rstl_1859_0015.txt,txt_rstl,1859,14
largest acces- Sions of new facts by reasoning deductively from fundamental,from,rstl_1859_0005.txt,txt_rstl,1859,14
be deduced from the following facts — 1. At the turning-points,from,rstl_1860_0011.txt,txt_rstl,1860,14
"mechanical mixtures, we know from facts determined by other experimenters; thus,",from,rstl_1860_0011.txt,txt_rstl,1860,14
at first produced. All these facts are easily explained from the,from,rstl_1860_0008.txt,txt_rstl,1860,14
in its relations to analogous facts drawn from the far greater,from,rstl_1860_0026.txt,txt_rstl,1860,14
have been drawn from the facts observed. The author preferred to,from,rstl_1862_0041.txt,txt_rstl,1862,14
"can be drawn from the facts demonstrated is, that the neryes",from,rstl_1862_0038.txt,txt_rstl,1862,14
"others may draw from the facts related, for my own part",from,rstl_1862_0012.txt,txt_rstl,1862,14
to infer from the observed facts that ice did possess ome,from,rstl_1862_0034.txt,txt_rstl,1862,14
than when cold. From these facts we learn another marked difference,from,rstl_1862_0001.txt,txt_rstl,1862,14
@ priori conclusion from the facts established by expe- riment; but,from,rstl_1863_0001.txt,txt_rstl,1863,14
"now, we review the principal facts relating to the structure of",we,rstl_1856_0027.txt,txt_rstl,1856,14
a parallel to the curious facts thus established we must look,we,rstl_1857_0015.txt,txt_rstl,1857,14
and we trust that the facts which we are about to,we,rstl_1858_0018.txt,txt_rstl,1858,14
we find that the extreme facts have been dwelt upon princi-,we,rstl_1859_0015.txt,txt_rstl,1859,14
"Physiologist, may yet supply important facts to both. We have, then,",we,rstl_1859_0025.txt,txt_rstl,1859,14
when we ther consider the facts now adduced as to the,we,rstl_1859_0025.txt,txt_rstl,1859,14
"mechanical mixtures, we know from facts determined by other experimenters; thus,",we,rstl_1860_0011.txt,txt_rstl,1860,14
"this mmunication, because the two facts with which we have to",we,rstl_1861_0008.txt,txt_rstl,1861,14
many of the most important facts with Which we are yet,we,rstl_1861_0024.txt,txt_rstl,1861,14
