Context,Word,File,Directory
a matter of fact absolutely compact. Such,matter,rstb_1896_0003.txt,txt_rstb
a matter of fact along septum. Yet,matter,rstb_1896_0003.txt,txt_rstb
a matter of fact it proved to,matter,rstb_1897_0012.txt,txt_rstb
a matter of fact it has presented,matter,rstb_1897_0009.txt,txt_rstb
a matter of fact hardly any two,matter,rstb_1897_0010.txt,txt_rstb
a matter of fact a short anal,matter,rstb_1898_0008.txt,txt_rstb
a matter of fact affected to bout,matter,rstb_1898_0008.txt,txt_rstb
a matter of fact all the minors,matter,rsta_1898_0007.txt,txt_rsta
a matter of fact Plates A and,matter,rstb_1899_0005.txt,txt_rstb
a matter of fact it has been,matter,rsta_1899_0007.txt,txt_rsta
a matter of fact it is very,matter,rstb_1900_0008.txt,txt_rstb
matter by the fact that we have,matter,rsta_1900_0029.txt,txt_rsta
matter certain. The fact that these freezing,matter,rsta_1900_0017.txt,txt_rsta
a matter of fact this is not,matter,rsta_1900_0019.txt,txt_rsta
a matter of fact he found after,matter,rstb_1901_0003.txt,txt_rstb
a matter of fact none was used,matter,rsta_1902_0013.txt,txt_rsta
Asa matter of fact only at a,matter,rsta_1902_0005.txt,txt_rsta
a matter of fact this plan was,matter,rstb_1903_0006.txt,txt_rstb
a matter of fact at low temperatures,matter,rsta_1903_0023.txt,txt_rsta
a matter of fact this is not,matter,rsta_1903_0014.txt,txt_rsta
a matter of fact the number of,matter,rstb_1904_0007.txt,txt_rstb
1300° C. The fact that the matter,matter,rsta_1905_0005.txt,txt_rsta
"spite of the fact that others (Hooper,",that,rstb_1896_0002.txt,txt_rstb
"doubt, to the fact that some centres",that,rstb_1896_0002.txt,txt_rstb
view of the fact that the muscles,that,rstb_1896_0002.txt,txt_rstb
owing to the fact that the movements,that,rstb_1896_0002.txt,txt_rstb
the cat. The fact that I have,that,rstb_1896_0002.txt,txt_rstb
likely by the fact that it is,that,rstb_1896_0002.txt,txt_rstb
"T. teniatus. The fact is, that this",that,rstb_1896_0001.txt,txt_rstb
stress upon the fact that the whole,that,rstb_1896_0001.txt,txt_rstb
"Amphibia, and the fact that the tail",that,rstb_1896_0001.txt,txt_rstb
to the important fact that the atlas-ring,that,rstb_1896_0001.txt,txt_rstb
secondly in the fact that it can,that,rstb_1896_0004.txt,txt_rstb
of the familiar fact that the intensity,that,rstb_1896_0004.txt,txt_rstb
and demonstrate the fact that the production,that,rstb_1896_0004.txt,txt_rstb
upon the undoubted fact that a portion,that,rstb_1896_0004.txt,txt_rstb
proved by the fact that there is,that,rstb_1896_0004.txt,txt_rstb
"But, from the fact that each author",that,rstb_1896_0003.txt,txt_rstb
indicating merely the fact observed that the,that,rstb_1896_0003.txt,txt_rstb
attention to the fact that the latter,that,rstb_1896_0003.txt,txt_rstb
face with the fact that the genera,that,rstb_1896_0003.txt,txt_rstb
"outer surface, a fact indicating that the",that,rstb_1896_0003.txt,txt_rstb
proved by the fact that the fibres,that,rstb_1896_0003.txt,txt_rstb
a fairly accepted fact that the median,that,rstb_1896_0003.txt,txt_rstb
"bands, the mere fact that the growth-lamelle",that,rstb_1896_0003.txt,txt_rstb
correlation with this fact we find that,that,rstb_1896_0003.txt,txt_rstb
trabeculz is the fact that the granulations,that,rstb_1896_0003.txt,txt_rstb
aceount of the fact that the tentacular,that,rstb_1896_0003.txt,txt_rstb
have in this fact a proof that,that,rstb_1896_0003.txt,txt_rstb
When that general fact is recognized we,that,rstb_1896_0003.txt,txt_rstb
"corallum, and the fact that the soft",that,rstb_1896_0003.txt,txt_rstb
due to the fact that the growth-parts,that,rstb_1896_0003.txt,txt_rstb
opinion by the fact that these synapticular,that,rstb_1896_0003.txt,txt_rstb
consists in the fact that a trabecular,that,rstb_1896_0003.txt,txt_rstb
with the general fact that the basal,that,rstb_1896_0003.txt,txt_rstb
"Turbinaria. Again, the fact that many synapticule",that,rstb_1896_0003.txt,txt_rstb
is in the fact that a number,that,rstb_1896_0003.txt,txt_rstb
heightened by the fact that the individual,that,rstb_1896_0003.txt,txt_rstb
merely to the fact that the growth-parts,that,rstb_1896_0003.txt,txt_rstb
only in the fact that it is,that,rstb_1896_0003.txt,txt_rstb
indicating (1) the fact that a tangential,that,rstb_1896_0003.txt,txt_rstb
familiar with the fact that the aboral,that,rstb_1896_0003.txt,txt_rstb
here the familiar fact that costee are,that,rstb_1896_0003.txt,txt_rstb
"coral, The ehief fact is that the",that,rstb_1896_0003.txt,txt_rstb
shown by the fact that both radial,that,rstb_1896_0003.txt,txt_rstb
"I believe, the fact that they never",that,rstb_1896_0003.txt,txt_rstb
can explain the fact that in the,that,rstb_1896_0003.txt,txt_rstb
is a familiar fact that many “,that,rstb_1896_0003.txt,txt_rstb
MICROSCOPIC AND the fact that it became,that,rstb_1896_0003.txt,txt_rstb
remarkable in the fact that the symmetry,that,rstb_1896_0003.txt,txt_rstb
consistent with the fact that the Turbinolide,that,rstb_1896_0003.txt,txt_rstb
characterized by the fact that the “spines”,that,rstb_1896_0003.txt,txt_rstb
Yet the curious fact is that everyone,that,rstb_1896_0003.txt,txt_rstb
research. The very fact that the Eupsammide,that,rstb_1896_0003.txt,txt_rstb
Lophoserine. The mere fact that the primitive,that,rstb_1896_0003.txt,txt_rstb
polyps by the fact that a fairly,that,rstb_1896_0003.txt,txt_rstb
"this, is the fact that the central",that,rstb_1896_0003.txt,txt_rstb
"Zaphrentids, and that fact in itself sufficiently",that,rstb_1896_0003.txt,txt_rstb
Madreporaria. The important fact is that these,that,rstb_1896_0003.txt,txt_rstb
evidence of the fact that the simpler,that,rstb_1896_0003.txt,txt_rstb
of the parallel fact that its Paleozoic,that,rstb_1896_0003.txt,txt_rstb
there is the fact that in Helophyllum,that,rstb_1896_0003.txt,txt_rstb
and therefore the fact that the relative,that,rsta_1896_0001.txt,txt_rsta
"zero, expresses the fact that u, and",that,rsta_1896_0001.txt,txt_rsta
is also a fact that they are,that,rsta_1896_0001.txt,txt_rsta
21. From the fact that p is,that,rsta_1896_0001.txt,txt_rsta
on the established fact that one side,that,rsta_1896_0002.txt,txt_rsta
S express that fact by a doubled,that,rsta_1896_0002.txt,txt_rsta
"BOaoBOaof, expressing the fact that opposite links",that,rsta_1896_0002.txt,txt_rsta
due to the fact that the distribution,that,rsta_1896_0018.txt,txt_rsta
perpendicular thereto. The fact that the electric,that,rsta_1896_0017.txt,txt_rsta
part due-to the fact that the moving,that,rsta_1896_0017.txt,txt_rsta
simply express the fact that the work,that,rsta_1896_0017.txt,txt_rsta
found from the fact that the surface-integral,that,rsta_1896_0017.txt,txt_rsta
arises from the fact that there must,that,rsta_1896_0017.txt,txt_rsta
arise from the fact that the presence,that,rsta_1896_0011.txt,txt_rsta
is deplorable. The fact is that from,that,rsta_1896_0011.txt,txt_rsta
view of the fact that interposed foreign,that,rsta_1896_0011.txt,txt_rsta
anticipated from the fact that the colour,that,rsta_1896_0011.txt,txt_rsta
note of the fact that the subject,that,rsta_1896_0016.txt,txt_rsta
addition express the fact that the material,that,rsta_1896_0008.txt,txt_rsta
equations express the fact that the surface-tractions,that,rsta_1896_0008.txt,txt_rsta
"nutation, and the fact that it would",that,rsta_1896_0008.txt,txt_rsta
or by the fact that we have,that,rsta_1896_0007.txt,txt_rsta
by the obvious fact that size of,that,rsta_1896_0007.txt,txt_rsta
taken of the fact that at temperatures,that,rsta_1896_0010.txt,txt_rsta
due to the fact that athe burners,that,rsta_1896_0010.txt,txt_rsta
due to the fact that the resistance,that,rsta_1896_0010.txt,txt_rsta
will be modified. fact that when water,that,rsta_1896_0010.txt,txt_rsta
Alloys by Cementation..—The fact that alloys can,that,rsta_1896_0010.txt,txt_rsta
Ordinary Temperature. The fact that two clean,that,rsta_1896_0010.txt,txt_rsta
It is a fact that as yet,that,rsta_1896_0009.txt,txt_rsta
proved by the fact that in so,that,rsta_1896_0005.txt,txt_rsta
"limestones, however, the fact that the unaltered",that,rsta_1896_0005.txt,txt_rsta
either in the fact that Bropin used,that,rsta_1896_0004.txt,txt_rsta
to believe. The fact probably is that,that,rsta_1896_0004.txt,txt_rsta
"Fhonectne sulphur, The fact that the melting-point",that,rsta_1896_0004.txt,txt_rsta
lies in the fact that very often,that,rsta_1896_0004.txt,txt_rsta
as in the fact that a small,that,rsta_1896_0004.txt,txt_rsta
and (2) the fact that the mirror,that,rsta_1896_0004.txt,txt_rsta
arises from the fact that they always,that,rsta_1896_0004.txt,txt_rsta
increased by the fact that it carries,that,rsta_1896_0004.txt,txt_rsta
cated by the fact that the resultant,that,rsta_1896_0004.txt,txt_rsta
the mirror. The fact that the instrument,that,rsta_1896_0004.txt,txt_rsta
lies in the fact that sulphur Zdoes,that,rsta_1896_0004.txt,txt_rsta
we have the fact that the melting-point,that,rsta_1896_0004.txt,txt_rsta
both by the fact that the large,that,rsta_1896_0004.txt,txt_rsta
real part. The fact that the definite,that,rsta_1896_0013.txt,txt_rsta
consideration of the fact that (z+ aa,that,rsta_1896_0013.txt,txt_rsta
by the > fact that the plates,that,rsta_1896_0015.txt,txt_rsta
"above, but the fact that I did",that,rsta_1896_0015.txt,txt_rsta
a very striking fact that they then,that,rstb_1897_0006.txt,txt_rstb
"the view. The fact remains, however, that",that,rstb_1897_0006.txt,txt_rstb
accords with the fact that there are,that,rstb_1897_0006.txt,txt_rstb
attributable to the fact that it allows,that,rstb_1897_0004.txt,txt_rstb
"by antiseptics, The fact that the infra-red",that,rstb_1897_0004.txt,txt_rstb
at once the fact that has been,that,rstb_1897_0004.txt,txt_rstb
striking by the fact that in moving,that,rstb_1897_0002.txt,txt_rstb
owing to the fact that there always,that,rstb_1897_0002.txt,txt_rstb
beyond doubt the fact that the muscles,that,rstb_1897_0002.txt,txt_rstb
clear by the fact that lateral section,that,rstb_1897_0002.txt,txt_rstb
suggested by the fact that the degree,that,rstb_1897_0002.txt,txt_rstb
also upward. The fact that the direction,that,rstb_1897_0002.txt,txt_rstb
under discussion. The fact that with all,that,rstb_1897_0002.txt,txt_rstb
as is the fact that these differences,that,rstb_1897_0002.txt,txt_rstb
case by the fact that application of,that,rstb_1897_0005.txt,txt_rstb
"functionally, nor the fact that stimulation of",that,rstb_1897_0005.txt,txt_rstb
From the latter fact it follows that,that,rstb_1897_0005.txt,txt_rstb
continuity. Besides the fact that the whole,that,rstb_1897_0005.txt,txt_rstb
direction is the fact that if the,that,rstb_1897_0005.txt,txt_rstb
"section. Finally, the fact that all observers",that,rstb_1897_0005.txt,txt_rstb
breeding season. The fact that a very,that,rstb_1897_0003.txt,txt_rstb
"and further, the fact that of those",that,rstb_1897_0003.txt,txt_rstb
months’ time. The fact that there is,that,rstb_1897_0003.txt,txt_rstb
"point, is the fact that menstruation undoubtedly",that,rstb_1897_0003.txt,txt_rstb
point out the fact that the results,that,rstb_1897_0003.txt,txt_rstb
to record the fact that the 144,that,rstb_1897_0003.txt,txt_rstb
"therein, while the fact that diapedesis does",that,rstb_1897_0003.txt,txt_rstb
paper to the fact that Minor (No.,that,rstb_1897_0003.txt,txt_rstb
occur- rence. The fact that this specimen,that,rstb_1897_0003.txt,txt_rstb
lies in the fact that they both,that,rstb_1897_0003.txt,txt_rstb
opposed to the fact that menstruation and,that,rstb_1897_0003.txt,txt_rstb
opposition to the fact that menstruation may,that,rstb_1897_0003.txt,txt_rstb
"attention to the fact that Soporra, in",that,rstb_1897_0003.txt,txt_rstb
stress upon the fact that the increase,that,rstb_1897_0003.txt,txt_rstb
now added the fact that the effect,that,rstb_1897_0007.txt,txt_rstb
show only the fact that the cardiac,that,rstb_1897_0007.txt,txt_rstb
"arrested, notwithstanding the fact that the track",that,rstb_1897_0007.txt,txt_rstb
"e.g., Busow,§ the fact that fluid fat",that,rstb_1897_0007.txt,txt_rstb
shown by the fact that in the,that,rstb_1897_0007.txt,txt_rstb
consists in the fact that the cerebro-spinal,that,rstb_1897_0007.txt,txt_rstb
be mentioned the fact that within certain,that,rstb_1897_0012.txt,txt_rstb
spite of the fact that lignin and,that,rstb_1897_0013.txt,txt_rstb
positive evidence. The fact that the winged,that,rstb_1897_0011.txt,txt_rstb
least in the fact that they are,that,rstb_1897_0011.txt,txt_rstb
importance to the fact that in Spencerites,that,rstb_1897_0011.txt,txt_rstb
Spencerites. In the fact that the insertion,that,rstb_1897_0011.txt,txt_rstb
shown by the fact that its bundles,that,rstb_1897_0009.txt,txt_rstb
"dimensions, and the fact that they occur",that,rstb_1897_0009.txt,txt_rstb
cially by the fact that the leaf-bases,that,rstb_1897_0009.txt,txt_rstb
the family.§ The fact that the number,that,rstb_1897_0009.txt,txt_rstb
"hypothetical, but the fact stands firm that",that,rstb_1897_0009.txt,txt_rstb
"ends, is the fact that the end",that,rstb_1897_0008.txt,txt_rstb
"weakened by the fact that VuLPrAN (77,",that,rstb_1897_0008.txt,txt_rstb
shown by the fact that when the,that,rstb_1897_0008.txt,txt_rstb
"ends, from the fact that both central",that,rstb_1897_0008.txt,txt_rstb
and in the fact that they do,that,rstb_1897_0010.txt,txt_rstb
remarks that the fact of each sporangium,that,rstb_1897_0010.txt,txt_rstb
increased by the fact that the softer,that,rstb_1897_0010.txt,txt_rstb
specially of the fact that there is,that,rstb_1897_0010.txt,txt_rstb
"follows from the fact that each sporangium,",that,rstb_1897_0010.txt,txt_rstb
stress on the fact that certain types,that,rstb_1897_0010.txt,txt_rstb
Marattiacesw. In the fact that it is,that,rstb_1897_0010.txt,txt_rstb
:— (1). The fact that in nerve,that,rstb_1897_0001.txt,txt_rstb
illustration of the fact that the response,that,rstb_1897_0001.txt,txt_rstb
indicated by the fact that a similar,that,rstb_1897_0001.txt,txt_rstb
open question. The fact that the exceptional,that,rstb_1897_0001.txt,txt_rstb
of metabolism. The fact that the retina,that,rstb_1897_0001.txt,txt_rstb
attention to the fact that in many,that,rstb_1897_0014.txt,txt_rstb
this from the fact that the femur,that,rstb_1897_0014.txt,txt_rstb
a rather remarkable fact that length and,that,rstb_1897_0014.txt,txt_rstb
lies in the fact that the temperature,that,rsta_1897_0015.txt,txt_rsta
introduced by the fact that the velocities,that,rsta_1897_0013.txt,txt_rsta
depends on the fact that if the,that,rsta_1897_0013.txt,txt_rsta
due to the fact that the theoretical,that,rsta_1897_0013.txt,txt_rsta
made from the fact that as far,that,rsta_1897_0013.txt,txt_rsta
to Jupiter. The fact that the achievements,that,rsta_1897_0014.txt,txt_rsta
"called, to the fact that the heliacal",that,rsta_1897_0014.txt,txt_rsta
due to the fact that the samples,that,rsta_1897_0017.txt,txt_rsta
"necessary, From the fact that the platinum",that,rsta_1897_0017.txt,txt_rsta
black to the fact that it was,that,rsta_1897_0017.txt,txt_rsta
distinguished by the fact that they have,that,rsta_1897_0017.txt,txt_rsta
due to the fact that they come,that,rsta_1897_0017.txt,txt_rsta
gram. From the fact that in Operation,that,rsta_1897_0017.txt,txt_rsta
the equally significant fact that neither nitrogen,that,rsta_1897_0017.txt,txt_rsta
of absorption. The fact that it has,that,rsta_1897_0018.txt,txt_rsta
"judiciously recognizing the fact that it exists,",that,rsta_1897_0018.txt,txt_rsta
outer portions. The fact that the disappearance,that,rsta_1897_0018.txt,txt_rsta
thought that this fact would present an,that,rsta_1897_0018.txt,txt_rsta
points to the fact that the colours,that,rsta_1897_0018.txt,txt_rsta
"theory, and the fact that a colour",that,rsta_1897_0018.txt,txt_rsta
clear from the fact that these stresses,that,rsta_1897_0008.txt,txt_rsta
due to the fact that the magnetisation,that,rsta_1897_0008.txt,txt_rsta
consequence of the fact that magnetisation depends,that,rsta_1897_0008.txt,txt_rsta
lies in the fact that the distribution,that,rsta_1897_0022.txt,txt_rsta
follows from the fact that the frequency,that,rsta_1897_0022.txt,txt_rsta
lies in the fact that p and,that,rsta_1897_0022.txt,txt_rsta
"column, and the fact that the base",that,rsta_1897_0005.txt,txt_rsta
hole.* From the fact that these early,that,rsta_1897_0005.txt,txt_rsta
due to the fact that the sphere,that,rsta_1897_0005.txt,txt_rsta
confirmation from the fact that there is,that,rsta_1897_0005.txt,txt_rsta
it fits. The fact that contact takes,that,rsta_1897_0011.txt,txt_rsta
"use of the fact that v,/2, when",that,rsta_1897_0011.txt,txt_rsta
spite of the fact that the condensation,that,rsta_1897_0011.txt,txt_rsta
evident from the fact that the colours,that,rsta_1897_0011.txt,txt_rsta
also from the fact that the sample,that,rsta_1897_0003.txt,txt_rsta
"composition, From the fact that the value",that,rsta_1897_0003.txt,txt_rsta
mainly from the fact that in the,that,rsta_1897_0003.txt,txt_rsta
allow for the fact already noted that,that,rsta_1897_0003.txt,txt_rsta
it was the fact that every presentment,that,rsta_1897_0009.txt,txt_rsta
attention to the fact that this length,that,rsta_1897_0009.txt,txt_rsta
explanation of the fact that the ocean-currents,that,rsta_1897_0009.txt,txt_rsta
attention to the fact that the free,that,rsta_1897_0009.txt,txt_rsta
turns on the fact that it only,that,rsta_1897_0009.txt,txt_rsta
second equation. The fact that for these,that,rsta_1897_0009.txt,txt_rsta
explained by the fact that we have,that,rsta_1897_0009.txt,txt_rsta
such tides. The fact that when the,that,rsta_1897_0009.txt,txt_rsta
attention to the fact that free oscillations,that,rsta_1897_0009.txt,txt_rsta
currents is the fact that in equatorial,that,rsta_1897_0009.txt,txt_rsta
the equator. The fact that this flow,that,rsta_1897_0009.txt,txt_rsta
arises from the fact that our rotating,that,rsta_1897_0009.txt,txt_rsta
cause of the fact that the first,that,rsta_1897_0002.txt,txt_rsta
due to the fact that very little,that,rsta_1897_0002.txt,txt_rsta
be seen. The fact that alloys of,that,rsta_1897_0002.txt,txt_rsta
so that the fact that it lies,that,rsta_1897_0002.txt,txt_rsta
only in the fact that the extra,that,rsta_1897_0021.txt,txt_rsta
independently of the fact that in default,that,rsta_1897_0020.txt,txt_rsta
the matter. The fact is that transmission,that,rsta_1897_0020.txt,txt_rsta
consequence of the fact that the energies,that,rsta_1897_0020.txt,txt_rsta
"absolute time, the fact remains that it",that,rsta_1897_0020.txt,txt_rsta
pdv; and the fact that dE and,that,rsta_1897_0020.txt,txt_rsta
that * The fact that the values,that,rsta_1897_0020.txt,txt_rsta
"the light. The fact that for gases,",that,rsta_1897_0020.txt,txt_rsta
"Media. 34, The fact that light preserves",that,rsta_1897_0020.txt,txt_rsta
lies in the fact that the complex,that,rsta_1897_0020.txt,txt_rsta
footnote) by the fact that we cannot,that,rsta_1897_0020.txt,txt_rsta
separating them. [The fact that the amount,that,rsta_1897_0020.txt,txt_rsta
account of the fact that the molecules,that,rsta_1897_0020.txt,txt_rsta
"deducible from the fact that such forcives,",that,rsta_1897_0020.txt,txt_rsta
"and further, the fact that the external",that,rstb_1898_0006.txt,txt_rstb
spite of the fact that the shell,that,rstb_1898_0006.txt,txt_rstb
led to the fact that some of,that,rstb_1898_0007.txt,txt_rstb
renders conspicuous the fact that the line,that,rstb_1898_0007.txt,txt_rstb
that in this fact lay the clue,that,rstb_1898_0007.txt,txt_rstb
"indicated by the fact that where, by",that,rstb_1898_0007.txt,txt_rstb
been a familiar fact that the teeth,that,rstb_1898_0007.txt,txt_rstb
and enamel. The fact that the processes,that,rstb_1898_0007.txt,txt_rstb
the very essential fact that no corresponding,that,rstb_1898_0007.txt,txt_rstb
"regularity, and the fact that the distauce",that,rstb_1898_0007.txt,txt_rstb
animal ova. The fact that in this,that,rstb_1898_0005.txt,txt_rstb
due to the fact that HormuisrEr examined,that,rstb_1898_0005.txt,txt_rstb
connected with the fact that in Ephedra,that,rstb_1898_0005.txt,txt_rstb
point to the fact that the spindle,that,rstb_1898_0005.txt,txt_rstb
chromosomes and the fact that they overlap,that,rstb_1898_0005.txt,txt_rstb
and also the fact that the fertilization,that,rstb_1898_0005.txt,txt_rstb
apparent from the fact that uo such,that,rstb_1898_0001.txt,txt_rstb
"down, from the fact that many of",that,rstb_1898_0001.txt,txt_rstb
assumed from the fact that no evidence,that,rstb_1898_0001.txt,txt_rstb
fillet. From the fact that the auditory,that,rstb_1898_0001.txt,txt_rstb
"cranial nerve, a fact which indicates that",that,rstb_1898_0001.txt,txt_rstb
; while the fact that it medullates,that,rstb_1898_0001.txt,txt_rstb
points to the fact that the fibres,that,rstb_1898_0001.txt,txt_rstb
right from the fact that the occipital,that,rstb_1898_0001.txt,txt_rstb
support from the fact that in smaller,that,rstb_1898_0001.txt,txt_rstb
fibres. From the fact that the tract,that,rstb_1898_0001.txt,txt_rstb
shown by the fact that destruction of,that,rstb_1898_0001.txt,txt_rstb
owing to the fact that the acid,that,rstb_1898_0010.txt,txt_rstb
and from the fact that the two,that,rstb_1898_0010.txt,txt_rstb
lies in the fact that it is,that,rstb_1898_0010.txt,txt_rstb
due to the fact that the loose,that,rstb_1898_0010.txt,txt_rstb
reiteration of the fact that they certainly,that,rstb_1898_0010.txt,txt_rstb
due to the fact that the large,that,rstb_1898_0010.txt,txt_rstb
"Fucus by the fact that there is,",that,rstb_1898_0010.txt,txt_rstb
greater. One curious fact observed was that,that,rstb_1898_0010.txt,txt_rstb
account for the fact that Pelvetia refuses,that,rstb_1898_0010.txt,txt_rstb
"to note the fact that Mr. Druxry,",that,rstb_1898_0003.txt,txt_rstb
cylindrical process. The fact that a normal,that,rstb_1898_0003.txt,txt_rstb
mainly on the fact that the sporophyte,that,rstb_1898_0003.txt,txt_rstb
strand and the fact that it is,that,rstb_1898_0003.txt,txt_rstb
"fertilisatior, but the fact that a 206",that,rstb_1898_0003.txt,txt_rstb
"improbable. Further, the fact that a group",that,rstb_1898_0003.txt,txt_rstb
change apospory. The fact that there is,that,rstb_1898_0003.txt,txt_rstb
apart from the fact that the portion,that,rstb_1898_0003.txt,txt_rstb
"elaboration. Further, the fact that division of",that,rstb_1898_0003.txt,txt_rstb
checked by the fact that fertilisation and,that,rstb_1898_0003.txt,txt_rstb
lie in the fact that the Strongylocentrotus,that,rstb_1898_0008.txt,txt_rstb
observe the striking fact that whilst in,that,rstb_1898_0008.txt,txt_rstb
favoured by the fact that very much,that,rstb_1898_0008.txt,txt_rstb
curious was the fact that there was,that,rstb_1898_0008.txt,txt_rstb
consideration of the fact that the “,that,rstb_1898_0008.txt,txt_rstb
due to the fact that all of,that,rstb_1898_0008.txt,txt_rstb
drawn to the fact that the nature,that,rstb_1898_0008.txt,txt_rstb
depends on the fact that in adult,that,rstb_1898_0009.txt,txt_rstb
side. * The fact that Uncrr (62),that,rstb_1898_0009.txt,txt_rstb
so that the fact itself is not,that,rstb_1898_0009.txt,txt_rstb
WirHeErina. . The fact that in most,that,rstb_1898_0009.txt,txt_rstb
revealing the interesting fact that in many,that,rstb_1898_0009.txt,txt_rstb
of transpiration. The fact that the el,that,rstb_1898_0009.txt,txt_rstb
water supply. The fact that the leaves,that,rstb_1898_0009.txt,txt_rstb
"a 3, The fact that many plants",that,rstb_1898_0009.txt,txt_rstb
to open.* The fact that the stomata,that,rstb_1898_0009.txt,txt_rstb
throw light. The fact that stomata are,that,rstb_1898_0009.txt,txt_rstb
advantageous time. The fact that aquatic plants,that,rstb_1898_0009.txt,txt_rstb
tentative spirit. The fact that aquatic plants,that,rstb_1898_0009.txt,txt_rstb
out the interesting fact that the red,that,rstb_1898_0009.txt,txt_rstb
shut. S The fact that red is,that,rstb_1898_0009.txt,txt_rstb
classification of the fact that seems to,that,rstb_1898_0009.txt,txt_rstb
spite of the fact that turgor is,that,rstb_1898_0009.txt,txt_rstb
"the stomata, the fact proves clearly that",that,rstb_1898_0009.txt,txt_rstb
615 stomata. The fact that I failed,that,rstb_1898_0009.txt,txt_rstb
suggested. But the fact that they soon,that,rstb_1898_0009.txt,txt_rstb
probably from the fact that the influence,that,rstb_1898_0004.txt,txt_rstb
obtained of the fact that in lethal,that,rstb_1898_0004.txt,txt_rstb
: Thus the fact becomes evident that,that,rstb_1898_0004.txt,txt_rstb
view of the fact that the experiment,that,rstb_1898_0004.txt,txt_rstb
the vagal. The fact that atropine does,that,rstb_1898_0004.txt,txt_rstb
response and the fact that rest permits,that,rstb_1898_0004.txt,txt_rstb
a series. The fact that the fibres,that,rstb_1898_0002.txt,txt_rstb
malia reveals the fact that the XIIth,that,rstb_1898_0002.txt,txt_rstb
| interossei. The fact that after degeneration,that,rstb_1898_0002.txt,txt_rstb
and Rat. The fact that in Macacus,that,rstb_1898_0002.txt,txt_rstb
theoretical considerations. The fact that certain’of the,that,rstb_1898_0002.txt,txt_rstb
to note the fact that broad similarity,that,rstb_1898_0002.txt,txt_rstb
that the curious fact * *Proe. Roy.,that,rstb_1898_0002.txt,txt_rstb
cervical root. The fact that so deep-lying,that,rstb_1898_0002.txt,txt_rstb
ignorant of the fact that the Ist,that,rstb_1898_0002.txt,txt_rstb
lie in the fact that die roots,that,rstb_1898_0002.txt,txt_rstb
outcome of the fact that after the,that,rstb_1898_0002.txt,txt_rstb
"impulses, and the fact that at its",that,rstb_1898_0002.txt,txt_rstb
out by the fact that in my,that,rstb_1898_0002.txt,txt_rstb
"course, a familiar fact in photometry that",that,rsta_1898_0002.txt,txt_rsta
found in the fact that in all,that,rsta_1898_0012.txt,txt_rsta
for by the fact that the enclosures,that,rsta_1898_0012.txt,txt_rsta
and with the fact that solids in,that,rsta_1898_0010.txt,txt_rsta
