Context,Word,File,Directory
it has in fact led to the,the,rsta_1897_0020.txt,txt_rsta
It is in fact the standpoint of,the,rsta_1897_0020.txt,txt_rsta
footnote) by the fact that we cannot,the,rsta_1897_0020.txt,txt_rsta
separating them. [The fact that the amount,the,rsta_1897_0020.txt,txt_rsta
gaseous state. In fact the difference between,the,rsta_1897_0020.txt,txt_rsta
account of the fact that the molecules,the,rsta_1897_0020.txt,txt_rsta
"deducible from the fact that such forcives,",the,rsta_1897_0020.txt,txt_rsta
"and further, the fact that the external",the,rstb_1898_0006.txt,txt_rstb
spite of the fact that the shell,the,rstb_1898_0006.txt,txt_rstb
led to the fact that some of,the,rstb_1898_0007.txt,txt_rstb
renders conspicuous the fact that the line,the,rstb_1898_0007.txt,txt_rstb
that in this fact lay the clue,the,rstb_1898_0007.txt,txt_rstb
"indicated by the fact that where, by",the,rstb_1898_0007.txt,txt_rstb
been a familiar fact that the teeth,the,rstb_1898_0007.txt,txt_rstb
and enamel. The fact that the processes,the,rstb_1898_0007.txt,txt_rstb
the very essential fact that no corresponding,the,rstb_1898_0007.txt,txt_rstb
"regularity, and the fact that the distauce",the,rstb_1898_0007.txt,txt_rstb
animal ova. The fact that in this,the,rstb_1898_0005.txt,txt_rstb
due to the fact that HormuisrEr examined,the,rstb_1898_0005.txt,txt_rstb
general type. The fact of this formation,the,rstb_1898_0005.txt,txt_rstb
"than eight, in fact the number seems",the,rstb_1898_0005.txt,txt_rstb
"staining powers. The fact clearly remains, however,",the,rstb_1898_0005.txt,txt_rstb
established the same fact in Picea vulgaris.,the,rstb_1898_0005.txt,txt_rstb
connected with the fact that in Ephedra,the,rstb_1898_0005.txt,txt_rstb
the spindle in fact hardly exists as,the,rstb_1898_0005.txt,txt_rstb
point to the fact that the spindle,the,rstb_1898_0005.txt,txt_rstb
chromosomes and the fact that they overlap,the,rstb_1898_0005.txt,txt_rstb
and also the fact that the fertilization,the,rstb_1898_0005.txt,txt_rstb
apparent from the fact that uo such,the,rstb_1898_0001.txt,txt_rstb
"down, from the fact that many of",the,rstb_1898_0001.txt,txt_rstb
assumed from the fact that no evidence,the,rstb_1898_0001.txt,txt_rstb
fillet. From the fact that the auditory,the,rstb_1898_0001.txt,txt_rstb
; while the fact that it medullates,the,rstb_1898_0001.txt,txt_rstb
obvious from the fact of the experiments,the,rstb_1898_0001.txt,txt_rstb
points to the fact that the fibres,the,rstb_1898_0001.txt,txt_rstb
right from the fact that the occipital,the,rstb_1898_0001.txt,txt_rstb
support from the fact that in smaller,the,rstb_1898_0001.txt,txt_rstb
fibres. From the fact that the tract,the,rstb_1898_0001.txt,txt_rstb
shown by the fact that destruction of,the,rstb_1898_0001.txt,txt_rstb
it. But the fact must not be,the,rstb_1898_0010.txt,txt_rstb
owing to the fact that the acid,the,rstb_1898_0010.txt,txt_rstb
and from the fact that the two,the,rstb_1898_0010.txt,txt_rstb
lies in the fact that it is,the,rstb_1898_0010.txt,txt_rstb
Not improbably the fact is to be,the,rstb_1898_0010.txt,txt_rstb
"the oogonium, a fact noted also by",the,rstb_1898_0010.txt,txt_rstb
due to the fact that the loose,the,rstb_1898_0010.txt,txt_rstb
"shewn by the fact that, in Halidrys",the,rstb_1898_0010.txt,txt_rstb
the sea-water. This fact has its bearing,the,rstb_1898_0010.txt,txt_rstb
reiteration of the fact that they certainly,the,rstb_1898_0010.txt,txt_rstb
due to the fact that the large,the,rstb_1898_0010.txt,txt_rstb
"shown by the fact that, according to",the,rstb_1898_0010.txt,txt_rstb
"Fucus by the fact that there is,",the,rstb_1898_0010.txt,txt_rstb
account for the fact that Pelvetia refuses,the,rstb_1898_0010.txt,txt_rstb
"Untersuchungen’ (1851), the fact of e regular",the,rstb_1898_0003.txt,txt_rstb
"to note the fact that Mr. Druxry,",the,rstb_1898_0003.txt,txt_rstb
cylindrical process. The fact that a normal,the,rstb_1898_0003.txt,txt_rstb
mainly on the fact that the sporophyte,the,rstb_1898_0003.txt,txt_rstb
strand and the fact that it is,the,rstb_1898_0003.txt,txt_rstb
"fertilisatior, but the fact that a 206",the,rstb_1898_0003.txt,txt_rstb
"improbable. Further, the fact that a group",the,rstb_1898_0003.txt,txt_rstb
"explained by the fact that, previous to",the,rstb_1898_0003.txt,txt_rstb
change apospory. The fact that there is,the,rstb_1898_0003.txt,txt_rstb
apart from the fact that the portion,the,rstb_1898_0003.txt,txt_rstb
"elaboration. Further, the fact that division of",the,rstb_1898_0003.txt,txt_rstb
checked by the fact that fertilisation and,the,rstb_1898_0003.txt,txt_rstb
as the fundamental fact in the origin,the,rstb_1898_0003.txt,txt_rstb
lie in the fact that the Strongylocentrotus,the,rstb_1898_0008.txt,txt_rstb
observe the striking fact that whilst in,the,rstb_1898_0008.txt,txt_rstb
favoured by the fact that very much,the,rstb_1898_0008.txt,txt_rstb
This was in fact the case. Thus,the,rstb_1898_0008.txt,txt_rstb
curious was the fact that there was,the,rstb_1898_0008.txt,txt_rstb
consideration of the fact that the “,the,rstb_1898_0008.txt,txt_rstb
due to the fact that all of,the,rstb_1898_0008.txt,txt_rstb
drawn to the fact that the nature,the,rstb_1898_0008.txt,txt_rstb
in the centre—a fact which demonstrates the,the,rstb_1898_0009.txt,txt_rstb
depends on the fact that in adult,the,rstb_1898_0009.txt,txt_rstb
side. * The fact that Uncrr (62),the,rstb_1898_0009.txt,txt_rstb
so that the fact itself is not,the,rstb_1898_0009.txt,txt_rstb
In practice the fact is of no,the,rstb_1898_0009.txt,txt_rstb
use of the fact in his discussion,the,rstb_1898_0009.txt,txt_rstb
WirHeErina. . The fact that in most,the,rstb_1898_0009.txt,txt_rstb
revealing the interesting fact that in many,the,rstb_1898_0009.txt,txt_rstb
temporary opening. This fact illustrates the dependence,the,rstb_1898_0009.txt,txt_rstb
of transpiration. The fact that the el,the,rstb_1898_0009.txt,txt_rstb
water supply. The fact that the leaves,the,rstb_1898_0009.txt,txt_rstb
"a 3, The fact that many plants",the,rstb_1898_0009.txt,txt_rstb
to open.* The fact that the stomata,the,rstb_1898_0009.txt,txt_rstb
to control the fact on the leaves,the,rstb_1898_0009.txt,txt_rstb
throw light. The fact that stomata are,the,rstb_1898_0009.txt,txt_rstb
"at night. The fact is not ‘Bnew,§",the,rstb_1898_0009.txt,txt_rstb
advantageous time. The fact that aquatic plants,the,rstb_1898_0009.txt,txt_rstb
tentative spirit. The fact that aquatic plants,the,rstb_1898_0009.txt,txt_rstb
out the interesting fact that the red,the,rstb_1898_0009.txt,txt_rstb
shut. S The fact that red is,the,rstb_1898_0009.txt,txt_rstb
classification of the fact that seems to,the,rstb_1898_0009.txt,txt_rstb
interest of the fact is in relation,the,rstb_1898_0009.txt,txt_rstb
spite of the fact that turgor is,the,rstb_1898_0009.txt,txt_rstb
"the stomata, the fact proves clearly that",the,rstb_1898_0009.txt,txt_rstb
p. 154. The fact is easily confirmed.,the,rstb_1898_0009.txt,txt_rstb
615 stomata. The fact that I failed,the,rstb_1898_0009.txt,txt_rstb
I connected the fact with the prolonged,the,rstb_1898_0009.txt,txt_rstb
suggested. But the fact that they soon,the,rstb_1898_0009.txt,txt_rstb
probably from the fact that the influence,the,rstb_1898_0004.txt,txt_rstb
obtained of the fact that in lethal,the,rstb_1898_0004.txt,txt_rstb
: Thus the fact becomes evident that,the,rstb_1898_0004.txt,txt_rstb
view of the fact that the experiment,the,rstb_1898_0004.txt,txt_rstb
the vagal. The fact that atropine does,the,rstb_1898_0004.txt,txt_rstb
response and the fact that rest permits,the,rstb_1898_0004.txt,txt_rstb
"struck by the fact that, contrary to",the,rstb_1898_0002.txt,txt_rstb
segmental character the fact found to hold,the,rstb_1898_0002.txt,txt_rstb
a series. The fact that the fibres,the,rstb_1898_0002.txt,txt_rstb
malia reveals the fact that the XIIth,the,rstb_1898_0002.txt,txt_rstb
| interossei. The fact that after degeneration,the,rstb_1898_0002.txt,txt_rstb
but the above fact is not the,the,rstb_1898_0002.txt,txt_rstb
and Rat. The fact that in Macacus,the,rstb_1898_0002.txt,txt_rstb
"agreement with the fact that, aa shown",the,rstb_1898_0002.txt,txt_rstb
theoretical considerations. The fact that certain’of the,the,rstb_1898_0002.txt,txt_rstb
to note the fact that broad similarity,the,rstb_1898_0002.txt,txt_rstb
that the curious fact * *Proe. Roy.,the,rstb_1898_0002.txt,txt_rstb
cervical root. The fact that so deep-lying,the,rstb_1898_0002.txt,txt_rstb
ignorant of the fact that the Ist,the,rstb_1898_0002.txt,txt_rstb
lie in the fact that die roots,the,rstb_1898_0002.txt,txt_rstb
the sag in fact they are only,the,rstb_1898_0002.txt,txt_rstb
outcome of the fact that after the,the,rstb_1898_0002.txt,txt_rstb
"impulses, and the fact that at its",the,rstb_1898_0002.txt,txt_rstb
out by the fact that in my,the,rstb_1898_0002.txt,txt_rstb
found in the fact that in all,the,rsta_1898_0012.txt,txt_rsta
for by the fact that the enclosures,the,rsta_1898_0012.txt,txt_rsta
the crater. This fact may be taken,the,rsta_1898_0012.txt,txt_rsta
and with the fact that solids in,the,rsta_1898_0010.txt,txt_rsta
made for the fact that the palladium,the,rsta_1898_0003.txt,txt_rsta
and of the fact that the determination,the,rsta_1898_0003.txt,txt_rsta
"justified by the fact that, under proper",the,rsta_1898_0003.txt,txt_rsta
made. From the fact that platinum black,the,rsta_1898_0003.txt,txt_rsta
"oxygen, and the fact that the substance",the,rsta_1898_0003.txt,txt_rsta
Granam to the fact that the metal,the,rsta_1898_0003.txt,txt_rsta
repeated use.” The fact that increase of,the,rsta_1898_0003.txt,txt_rsta
shown by the fact that on raising,the,rsta_1898_0003.txt,txt_rsta
due to the fact that the bore,the,rsta_1898_0003.txt,txt_rsta
"103,100 1268 The fact that the volume",the,rsta_1898_0003.txt,txt_rsta
other equations. The fact that the characteristic,the,rsta_1898_0001.txt,txt_rsta
arising from the fact that every term,the,rsta_1898_0001.txt,txt_rsta
point to the fact that they might,the,rsta_1898_0005.txt,txt_rsta
"generality, but the fact that it has",the,rsta_1898_0005.txt,txt_rsta
We may in fact anticipate that the,the,rsta_1898_0005.txt,txt_rsta
have explained the fact by stating that,the,rsta_1898_0005.txt,txt_rsta
"results from the fact that, whereas when",the,rsta_1898_0005.txt,txt_rsta
consequence of the fact that the quantities,the,rsta_1898_0005.txt,txt_rsta
due to the fact that in each,the,rsta_1898_0005.txt,txt_rsta
"loaded. Thus, the fact that the fall",the,rsta_1898_0011.txt,txt_rsta
partly to the fact that the pressure,the,rsta_1898_0011.txt,txt_rsta
significance of the fact that formule with,the,rsta_1898_0011.txt,txt_rsta
complicated by the fact that the index,the,rsta_1898_0011.txt,txt_rsta
with age. The fact that discontinuous changes,the,rsta_1898_0011.txt,txt_rsta
arises from the fact that the time,the,rsta_1898_0011.txt,txt_rsta
due to the fact that the stoppage,the,rsta_1898_0011.txt,txt_rsta
supplied by the fact that the mean,the,rsta_1898_0011.txt,txt_rsta
view of the fact that the average,the,rsta_1898_0011.txt,txt_rsta
allowance for the fact that in mountain,the,rsta_1898_0011.txt,txt_rsta
it is this fact which the guthor,the,rsta_1898_0008.txt,txt_rsta
proved by the fact that the bands,the,rsta_1898_0008.txt,txt_rsta
account of the fact that it is,the,rsta_1898_0008.txt,txt_rsta
"temperature portion, the fact that it follows",the,rsta_1898_0008.txt,txt_rsta
"depends upon the fact that C,,, G,,,",the,rsta_1898_0007.txt,txt_rsta
drawn to the fact that we have,the,rsta_1898_0007.txt,txt_rsta
a matter of fact all the minors,the,rsta_1898_0007.txt,txt_rsta
paid to the fact that m increases,the,rsta_1898_0007.txt,txt_rsta
It is in fact given by the,the,rsta_1898_0007.txt,txt_rsta
coincides with the fact that fresh extracts,the,rstb_1899_0004.txt,txt_rstb
proved by the fact that when the,the,rstb_1899_0004.txt,txt_rstb
"hand, that the fact that some of",the,rstb_1899_0004.txt,txt_rstb
to emphasise the fact that during blue-,the,rstb_1899_0001.txt,txt_rstb
acid media. The fact was also interesting,the,rstb_1899_0005.txt,txt_rstb
"MINS. * The fact should be noted,",the,rstb_1899_0005.txt,txt_rstb
"important, since the fact of motility might",the,rstb_1899_0005.txt,txt_rstb
indicating the interesting fact that the leaves,the,rstb_1899_0002.txt,txt_rstb
agrees with the fact that the prepared,the,rstb_1899_0002.txt,txt_rstb
follows from the fact that both the,the,rstb_1899_0002.txt,txt_rstb
also from the fact that the solubility,the,rstb_1899_0002.txt,txt_rstb
Enruarpr.* From the fact that the substance,the,rstb_1899_0002.txt,txt_rstb
"phloem, and in fact the structure is",the,rstb_1899_0003.txt,txt_rstb
due to the fact that the periderm,the,rstb_1899_0003.txt,txt_rstb
"reasonable doubt, the fact that the species",the,rstb_1899_0003.txt,txt_rstb
notably in the fact that the primary,the,rstb_1899_0003.txt,txt_rstb
consists in the fact that in M.,the,rstb_1899_0003.txt,txt_rstb
THE STRUCTURE interesting fact that in the,the,rstb_1899_0006.txt,txt_rstb
he overlooks the fact that the lateral,the,rstb_1899_0006.txt,txt_rstb
confirmed by the fact that it a,the,rstb_1899_0007.txt,txt_rstb
"aware of the fact that, although nerve-fibres",the,rstb_1899_0007.txt,txt_rstb
"experiments, beyond the fact that all urines",the,rstb_1899_0007.txt,txt_rstb
the heart. The fact is not without,the,rstb_1899_0007.txt,txt_rstb
we regard the fact that choline does,the,rstb_1899_0007.txt,txt_rstb
"holds, but the fact that the equation",the,rsta_1899_0011.txt,txt_rsta
and by the fact that polyvalent ions,the,rsta_1899_0007.txt,txt_rsta
"again, however, the fact that the observed",the,rsta_1899_0007.txt,txt_rsta
also in the fact that it seeks,the,rsta_1899_0007.txt,txt_rsta
; Sut the fact that the best,the,rsta_1899_0007.txt,txt_rsta
of the same fact adduced by others.,the,rsta_1899_0007.txt,txt_rsta
"found in the fact that, while it",the,rsta_1899_0007.txt,txt_rsta
and from the fact Sthat the visible,the,rsta_1899_0007.txt,txt_rsta
evident from the fact that there will,the,rsta_1899_0007.txt,txt_rsta
"due to the fact that the experiment,",the,rsta_1899_0007.txt,txt_rsta
arises from the fact that every term,the,rsta_1899_0008.txt,txt_rsta
(*) a simple fact that the following,the,rsta_1899_0008.txt,txt_rsta
involved in the fact of the existence,the,rsta_1899_0008.txt,txt_rsta
"Art. 96, The fact is that the",the,rsta_1899_0008.txt,txt_rsta
"of 7, a fact which necessitates the",the,rsta_1899_0008.txt,txt_rsta
"NUMBERS. further, the fact that the expression",the,rsta_1899_0008.txt,txt_rsta
and the mere fact of such expression,the,rsta_1899_0008.txt,txt_rsta
It acts in fact as the stream-function,the,rsta_1899_0002.txt,txt_rsta
velocity zero. In fact the parameters of,the,rsta_1899_0002.txt,txt_rsta
easy from the fact that they are,the,rsta_1899_0002.txt,txt_rsta
for A the fact that whenever a,the,rsta_1899_0009.txt,txt_rsta
except in the fact that the rays,the,rsta_1899_0009.txt,txt_rsta
seen from the fact that even isolated,the,rsta_1899_0009.txt,txt_rsta
not for the fact that the fogs,the,rsta_1899_0009.txt,txt_rsta
obvious from the fact that the lowering,the,rsta_1899_0009.txt,txt_rsta
due to the fact that they very,the,rsta_1899_0009.txt,txt_rsta
related to the fact first noticed by,the,rsta_1899_0009.txt,txt_rsta
is increased. The fact that the source,the,rsta_1899_0009.txt,txt_rsta
takes place. The fact that the carriers,the,rsta_1899_0009.txt,txt_rsta
air also. The fact that the nuclei,the,rsta_1899_0009.txt,txt_rsta
was _ the fact that in ordinary,the,rsta_1899_0009.txt,txt_rsta
arrangements were in fact exactly the same,the,rsta_1899_0009.txt,txt_rsta
accounting for the fact that an electric,the,rsta_1899_0009.txt,txt_rsta
than molecules; the fact that dense condensation,the,rsta_1899_0009.txt,txt_rsta
owing to the fact that they ave,the,rsta_1899_0001.txt,txt_rsta
Group. from the fact which has just,the,rsta_1899_0001.txt,txt_rsta
corresponds to the fact that a point,the,rsta_1899_0001.txt,txt_rsta
corresponds to the fact that by taking,the,rsta_1899_0001.txt,txt_rsta
depends on the fact that algebraic forms,the,rsta_1899_0001.txt,txt_rsta
"weights, and the fact that they form",the,rsta_1899_0010.txt,txt_rsta
together with the fact that the increment,the,rsta_1899_0010.txt,txt_rsta
consequence of this fact the coefficients of,the,rsta_1899_0010.txt,txt_rsta
the same. The fact that the differences,the,rsta_1899_0010.txt,txt_rsta
view of the fact that the author,the,rsta_1899_0010.txt,txt_rsta
interesting by the fact that. about this,the,rsta_1899_0010.txt,txt_rsta
together with the fact that the change,the,rsta_1899_0010.txt,txt_rsta
"rubidium salt, a fact which the method",the,rsta_1899_0010.txt,txt_rsta
demonstrated by the fact that the difference,the,rsta_1899_0010.txt,txt_rsta
together with the fact that the replacement,the,rsta_1899_0010.txt,txt_rsta
arises from the fact that all records,the,rsta_1899_0006.txt,txt_rsta
"comparison, neglecting the fact that their frequency",the,rsta_1899_0006.txt,txt_rsta
"lies in the fact that death, restraint,",the,rsta_1899_0006.txt,txt_rsta
"and effect, the fact that correlation can",the,rsta_1899_0006.txt,txt_rsta
Thus the mere fact of breeding from,the,rsta_1899_0006.txt,txt_rsta
taken place. The fact is that neither,the,rsta_1899_0006.txt,txt_rsta
our theory. The fact that the elder,the,rsta_1899_0006.txt,txt_rsta
balanced by the fact that heiresses come,the,rsta_1899_0006.txt,txt_rsta
of marriage. The fact is that heiresses,the,rsta_1899_0006.txt,txt_rsta
"19/20-1, would the fact that the fecundity",the,rsta_1899_0006.txt,txt_rsta
selected by the fact that their daughters,the,rsta_1899_0006.txt,txt_rsta
the variabilities. The fact that we are,the,rsta_1899_0006.txt,txt_rsta
for the observed fact that the fecundity,the,rsta_1899_0006.txt,txt_rsta
due to the fact that the mothers,the,rsta_1899_0006.txt,txt_rsta
based. This fundamental fact of the application,the,rsta_1899_0004.txt,txt_rsta
"organ. Hence, the fact that individual variations",the,rsta_1899_0004.txt,txt_rsta
"drawn from the fact that our formule,",the,rsta_1899_0004.txt,txt_rsta
bad results. The fact that the formula,the,rsta_1899_0004.txt,txt_rsta
due to the fact that he allowed,the,rsta_1899_0004.txt,txt_rsta
evidenced by the fact that tibias of,the,rsta_1899_0004.txt,txt_rsta
allowed for the fact that he used,the,rsta_1899_0004.txt,txt_rsta
view of the fact that the agrams,the,rsta_1899_0004.txt,txt_rsta
"has emphasised the fact that, for dwarf",the,rsta_1899_0004.txt,txt_rsta
attention to the fact that it underestimates,the,rsta_1899_0004.txt,txt_rsta
arises from the fact that the regression,the,rsta_1899_0004.txt,txt_rsta
"heated, illustrates a fact pointed THE NODULES",the,rstb_1900_0001.txt,txt_rstb
attributed to the fact that the plants,the,rstb_1900_0001.txt,txt_rstb
"development, and the fact that they are",the,rstb_1900_0008.txt,txt_rstb
of 3 the fact that according to,the,rstb_1900_0006.txt,txt_rstb
by the a fact that the nerve,the,rstb_1900_0006.txt,txt_rstb
them indicates the fact that they pass,the,rstb_1900_0006.txt,txt_rstb
the former. This fact is brought out,the,rstb_1900_0006.txt,txt_rstb
into consideration the fact that the most,the,rstb_1900_0006.txt,txt_rstb
be mentioned the fact that in the,the,rstb_1900_0006.txt,txt_rstb
levis. Now the fact that M. levis,the,rstb_1900_0006.txt,txt_rstb
"difficulties. Firstly, the fact that a nerve",the,rstb_1900_0006.txt,txt_rstb
lies in the fact that in one,the,rstb_1900_0006.txt,txt_rstb
"and from the fact that, as will",the,rstb_1900_0010.txt,txt_rstb
due to the fact that we cannot,the,rstb_1900_0007.txt,txt_rstb
gland itself. In fact the usual hardening,the,rstb_1900_0007.txt,txt_rstb
attention to the fact that he does,the,rstb_1900_0007.txt,txt_rstb
aware of the fact that the spectrum,the,rstb_1900_0007.txt,txt_rstb
struck by the fact that the pigment,the,rstb_1900_0007.txt,txt_rstb
and from the fact that they are,the,rstb_1900_0007.txt,txt_rstb
proved by the fact that it is,the,rstb_1900_0012.txt,txt_rstb
obscured by the fact that spontaneous gradual,the,rstb_1900_0012.txt,txt_rstb
"referred, and the fact itself is mentioned",the,rstb_1900_0012.txt,txt_rstb
reason of the fact that I find,the,rstb_1900_0012.txt,txt_rstb
"Once recognised, the fact of a struggle",the,rstb_1900_0012.txt,txt_rstb
"tissue, the bare fact as regards the",the,rstb_1900_0012.txt,txt_rstb
depends on the fact that in dogs,the,rstb_1900_0011.txt,txt_rstb
attention to the fact that convulsions oceur,the,rstb_1900_0011.txt,txt_rstb
on myself the fact that compression of,the,rstb_1900_0011.txt,txt_rstb
doses paralysis. The fact that aneesthetics stop,the,rstb_1900_0011.txt,txt_rstb
out by the fact that after a,the,rstb_1900_0011.txt,txt_rstb
"examples of the fact that hyper-excitability is,",the,rstb_1900_0011.txt,txt_rstb
or to the fact that the power,the,rstb_1900_0011.txt,txt_rstb
"excitation, and in fact the arm area",the,rstb_1900_0011.txt,txt_rstb
"this tract. The fact that cortical discharge,",the,rstb_1900_0011.txt,txt_rstb
to illustrate the fact that the results,the,rstb_1900_0011.txt,txt_rstb
"view is the fact that tonus, evoked",the,rstb_1900_0011.txt,txt_rstb
the brain. One fact which has become,the,rstb_1900_0011.txt,txt_rstb
and to the fact that it was,the,rstb_1900_0013.txt,txt_rstb
and in the fact that the layer,the,rstb_1900_0013.txt,txt_rstb
the convolutions. In fact almost the only,the,rstb_1900_0013.txt,txt_rstb
here to the fact that in the,the,rstb_1900_0013.txt,txt_rstb
"calcarine fissure. The fact also, that this",the,rstb_1900_0013.txt,txt_rstb
responsible for the fact that not a,the,rstb_1900_0013.txt,txt_rstb
owing to the fact that the afferent,the,rstb_1900_0013.txt,txt_rstb
be added the fact that the surface,the,rstb_1900_0013.txt,txt_rstb
owing to the fact that fibres have,the,rstb_1900_0013.txt,txt_rstb
new conditions.are in fact practically the same,the,rstb_1900_0014.txt,txt_rstb
gas. The interesting fact was then brought,the,rstb_1900_0014.txt,txt_rstb
From the well-known fact that the laws,the,rstb_1900_0014.txt,txt_rstb
"alkaline solution, the fact that the velocity",the,rstb_1900_0014.txt,txt_rstb
"seale, one in fact the magnified image",the,rstb_1900_0014.txt,txt_rstb
The case in fact would be analogous,the,rstb_1900_0014.txt,txt_rstb
This last- mentioned fact illustrates experimentally the,the,rstb_1900_0014.txt,txt_rstb
explains the striking fact that the apertures,the,rstb_1900_0014.txt,txt_rstb
due to the fact that the pressure,the,rstb_1900_0014.txt,txt_rstb
struck with the fact that such an,the,rstb_1900_0014.txt,txt_rstb
"con- centrations, a fact due to the",the,rstb_1900_0014.txt,txt_rstb
"dioxide molecules, The fact that the limit",the,rstb_1900_0014.txt,txt_rstb
largest output. The fact that Lygodium exceeds,the,rstb_1900_0002.txt,txt_rstb
and notwithstanding the fact that the indusium,the,rstb_1900_0002.txt,txt_rstb
been numerous. The fact is that Dennstedtia,the,rstb_1900_0002.txt,txt_rstb
oblique. “” In fact the sporangium of,the,rstb_1900_0002.txt,txt_rstb
have verified the fact already observed by,the,rstb_1900_0002.txt,txt_rstb
attached to the fact that in certain,the,rstb_1900_0002.txt,txt_rstb
simpler types. The fact that a vascular,the,rstb_1900_0002.txt,txt_rstb
found in the fact that the receptacle,the,rstb_1900_0002.txt,txt_rstb
con- stancy. This fact leaves the question,the,rstb_1900_0002.txt,txt_rstb
the Marattiacexe. The fact that its sorus,the,rstb_1900_0002.txt,txt_rstb
per sporangium. The fact that some species,the,rstb_1900_0002.txt,txt_rstb
partly from the fact that different pulses,the,rsta_1900_0031.txt,txt_rsta
into account the fact that the train,the,rsta_1900_0031.txt,txt_rsta
aspect of the fact that for lines,the,rsta_1900_0031.txt,txt_rsta
arises from the fact that * Tt,the,rsta_1900_0031.txt,txt_rsta
due to the fact that the material,the,rsta_1900_0022.txt,txt_rsta
lies in the fact that all our,the,rsta_1900_0022.txt,txt_rsta
arises from the fact that the errors,the,rsta_1900_0022.txt,txt_rsta
even ‘5939. The fact is that the,the,rsta_1900_0022.txt,txt_rsta
"error, and this fact may obscure the",the,rsta_1900_0022.txt,txt_rsta
we consider the fact that in the,the,rsta_1900_0030.txt,txt_rsta
"method, is the fact that it enables",the,rsta_1900_0030.txt,txt_rsta
diagrams is the fact that in those,the,rsta_1900_0030.txt,txt_rsta
opinions on the fact that rocks are,the,rsta_1900_0032.txt,txt_rsta
owing to the fact that a certain,the,rsta_1900_0032.txt,txt_rsta
the tests. The fact that the twinning,the,rsta_1900_0032.txt,txt_rsta
and toe the fact that but a,the,rsta_1900_0032.txt,txt_rsta
shown by the fact that they cut,the,rsta_1900_0032.txt,txt_rsta
deformed marbles. The fact that these later,the,rsta_1900_0032.txt,txt_rsta
or to the fact of No. 5,the,rsta_1900_0027.txt,txt_rsta
view of the fact that the results,the,rsta_1900_0027.txt,txt_rsta
partly to the fact that the temperature,the,rsta_1900_0027.txt,txt_rsta
the microscope. In fact it is not,the,rsta_1900_0029.txt,txt_rsta
of the well-known fact that the external,the,rsta_1900_0029.txt,txt_rsta
"bands, and the fact that they are",the,rsta_1900_0029.txt,txt_rsta
but the remarkable fact remains that even,the,rsta_1900_0029.txt,txt_rsta
"the pressure, a fact which is associated",the,rsta_1900_0029.txt,txt_rsta
view of the fact that an etched,the,rsta_1900_0029.txt,txt_rsta
due to the fact that etching develops,the,rsta_1900_0029.txt,txt_rsta
matter by the fact that we have,the,rsta_1900_0029.txt,txt_rsta
a well known fact that the mechanical,the,rsta_1900_0029.txt,txt_rsta
point to the fact that changes of,the,rsta_1900_0029.txt,txt_rsta
at least one fact in the phenomena,the,rsta_1900_0029.txt,txt_rsta
refer to the fact that only strained,the,rsta_1900_0029.txt,txt_rsta
gauged from the fact that 0°1 per,the,rsta_1900_0029.txt,txt_rsta
