Context,Word,File,Directory
here possible. The fact that the association,the,rsta_1900_0019.txt,txt_rsta
"Bisley, noticed the fact that those boys",the,rsta_1900_0019.txt,txt_rsta
as decreasing.) The fact that partial associations,the,rsta_1900_0019.txt,txt_rsta
or to the fact that such coloured,the,rsta_1900_0024.txt,txt_rsta
and they in fact put the theory,the,rsta_1900_0024.txt,txt_rsta
due to the fact that this region,the,rsta_1900_0008.txt,txt_rsta
"arise from the fact that non-electrical effects,",the,rsta_1900_0002.txt,txt_rsta
"case, but in fact rather increases the",the,rsta_1900_0002.txt,txt_rsta
shown by the fact that the form,the,rsta_1900_0002.txt,txt_rsta
by Roramunp—the actual fact of the depression,the,rsta_1900_0002.txt,txt_rsta
due to the fact that the observed,the,rsta_1900_0002.txt,txt_rsta
lies in the fact that the difference,the,rsta_1900_0002.txt,txt_rsta
Taomson* has in fact used the rate,the,rsta_1900_0009.txt,txt_rsta
be set the fact that the positive,the,rsta_1900_0009.txt,txt_rsta
account for the fact that an electric,the,rsta_1900_0009.txt,txt_rsta
light on the fact that the effect,the,rsta_1900_0010.txt,txt_rsta
"may explain the fact that, when keyways",the,rsta_1900_0010.txt,txt_rsta
"above sections, the fact that the stress",the,rsta_1900_0010.txt,txt_rsta
above. The very fact that the torsional,the,rsta_1900_0010.txt,txt_rsta
have established the fact that the structure,the,rsta_1900_0011.txt,txt_rsta
17 illustrates the fact that oblique light,the,rsta_1900_0011.txt,txt_rsta
out by the fact that in metals,the,rsta_1900_0011.txt,txt_rsta
with the well-known fact that such strained,the,rsta_1900_0011.txt,txt_rsta
nickel. The mere fact that finite slips,the,rsta_1900_0011.txt,txt_rsta
ascribed to the fact that the surface,the,rsta_1900_0011.txt,txt_rsta
pointing to the fact that the crystalline,the,rsta_1900_0011.txt,txt_rsta
given to the fact that lenses are,the,rsta_1900_0006.txt,txt_rsta
"photograph illustrates the fact that, in the",the,rsta_1900_0006.txt,txt_rsta
The first striking fact shown by the,the,rsta_1900_0006.txt,txt_rsta
lies in the fact that bismuth and,the,rsta_1900_0006.txt,txt_rsta
"needed, of the fact that once the",the,rsta_1900_0006.txt,txt_rsta
lies in the fact that the discharge,the,rsta_1900_0006.txt,txt_rsta
"air, but the fact is rendered remarkable",the,rsta_1900_0006.txt,txt_rsta
due to the fact that at any,the,rsta_1900_0006.txt,txt_rsta
at all. The fact is that a,the,rsta_1900_0005.txt,txt_rsta
not disregard the fact that a con-,the,rsta_1900_0005.txt,txt_rsta
again emphasise the fact that our analysis,the,rsta_1900_0005.txt,txt_rsta
is a noteworthy fact that the coloration,the,rsta_1900_0003.txt,txt_rsta
0-6 | The fact that the readings,the,rsta_1900_0003.txt,txt_rsta
for by the fact that after the,the,rsta_1900_0003.txt,txt_rsta
"doubtless in the fact already mentioned, that,",the,rsta_1900_0003.txt,txt_rsta
determined by the fact that the rate,the,rsta_1900_0003.txt,txt_rsta
"gases, namely, the fact that the current",the,rsta_1900_0003.txt,txt_rsta
chemical evidence. The fact that the conductivity,the,rsta_1900_0003.txt,txt_rsta
"as electrolytes, the fact that at high",the,rsta_1900_0003.txt,txt_rsta
dissociating body. The fact that potassium iodide,the,rsta_1900_0003.txt,txt_rsta
sextant being in fact employed. The quartz,the,rsta_1900_0007.txt,txt_rsta
arises from the fact that the rigidity,the,rsta_1900_0007.txt,txt_rsta
arisen from the fact that it is,the,rsta_1900_0007.txt,txt_rsta
referred to the fact that it is,the,rsta_1900_0007.txt,txt_rsta
"in the resulting fact that, setting aside",the,rsta_1900_0007.txt,txt_rsta
sequence of the fact that the constants,the,rsta_1900_0007.txt,txt_rsta
"called to the fact that, primarily, the",the,rsta_1900_0001.txt,txt_rsta
duration. * The fact that yielding takes,the,rsta_1900_0001.txt,txt_rsta
but to the fact that the re-applica-,the,rsta_1900_0001.txt,txt_rsta
shown by the fact © that distinctly,the,rsta_1900_0001.txt,txt_rsta
out by the fact that a crystalline,the,rsta_1900_0001.txt,txt_rsta
cases reveals the fact that the reductions,the,rsta_1900_0014.txt,txt_rsta
view of the fact that it was,the,rsta_1900_0014.txt,txt_rsta
emphasised by the fact that we found,the,rsta_1900_0014.txt,txt_rsta
also of the fact that the Meyer,the,rsta_1900_0014.txt,txt_rsta
by NaGamatz.* The fact that outgrowths were,the,rstb_1901_0004.txt,txt_rstb
due to the fact that at the,the,rstb_1901_0004.txt,txt_rstb
proved by the fact that outgrowths never,the,rstb_1901_0004.txt,txt_rstb
light upon the fact that the formation,the,rstb_1901_0004.txt,txt_rstb
connection with the fact that the intumescences,the,rstb_1901_0004.txt,txt_rstb
allude to the fact that the median,the,rstb_1901_0003.txt,txt_rstb
shown from the fact that one of,the,rstb_1901_0003.txt,txt_rstb
explained by the fact that he crossed,the,rstb_1901_0003.txt,txt_rstb
ascertaining if the fact of crossing appreciably,the,rstb_1901_0003.txt,txt_rstb
found that the fact of the divided,the,rstb_1901_0003.txt,txt_rstb
and from the fact of the experiments,the,rstb_1901_0003.txt,txt_rstb
consisted in the fact that she was,the,rstb_1901_0003.txt,txt_rstb
unlikely by the fact that the facial,the,rstb_1901_0003.txt,txt_rstb
limb. 2. The fact of crossing the,the,rstb_1901_0003.txt,txt_rstb
owing to the fact that the walls,the,rstb_1901_0002.txt,txt_rstb
distinguished by the fact that radial threads,the,rstb_1901_0002.txt,txt_rstb
"another, notwithstanding the fact that they are",the,rstb_1901_0002.txt,txt_rstb
due to the fact that the cells,the,rstb_1901_0002.txt,txt_rstb
out the striking fact that the sieve,the,rstb_1901_0002.txt,txt_rstb
either to the fact that their contents,the,rstb_1901_0002.txt,txt_rstb
"case, the important fact comes to the",the,rstb_1901_0002.txt,txt_rstb
"+ C3H,,05. The fact that lotusin is",the,rstb_1901_0012.txt,txt_rstb
brought forward the fact that each forms,the,rstb_1901_0012.txt,txt_rstb
supported by the fact that the formation,the,rstb_1901_0012.txt,txt_rstb
"mentioned, as a fact known to the",the,rstb_1901_0012.txt,txt_rstb
point to the fact that wherever nuclear,the,rstb_1901_0010.txt,txt_rstb
reason of this fact the after- currents,the,rstb_1901_0005.txt,txt_rstb
incidentally mentions the fact that he obtained,the,rstb_1901_0005.txt,txt_rstb
struck by the fact that a single,the,rstb_1901_0005.txt,txt_rstb
shown by the fact that a standard,the,rstb_1901_0005.txt,txt_rstb
arises from the fact that the testing,the,rstb_1901_0005.txt,txt_rstb
as regards the fact itself. £ Experiments,the,rstb_1901_0005.txt,txt_rstb
THE “BLAZE CURRENTS” fact that I have,the,rstb_1901_0005.txt,txt_rstb
also does the fact that they yield,the,rstb_1901_0009.txt,txt_rstb
peculiar in the fact that after the,the,rstb_1901_0009.txt,txt_rstb
we mentioned the fact that we had,the,rstb_1901_0009.txt,txt_rstb
derived from the fact that at this,the,rstb_1901_0009.txt,txt_rstb
supported by the fact that in the,the,rstb_1901_0009.txt,txt_rstb
seed-bearing plants. The fact that an organ,the,rstb_1901_0007.txt,txt_rstb
"Cardiocarpon, in the fact that they were",the,rstb_1901_0007.txt,txt_rstb
shown by the fact that the micropyle,the,rstb_1901_0007.txt,txt_rstb
The most striking fact which comes out,the,rstb_1901_0007.txt,txt_rstb
"2, 1.) The fact is important, because",the,rstb_1901_0007.txt,txt_rstb
and by the fact that it is,the,rstb_1901_0007.txt,txt_rstb
"Lepidocarpon, though the fact that the nucellus",the,rstb_1901_0007.txt,txt_rstb
accounts for the fact that they are,the,rstb_1901_0007.txt,txt_rstb
radial sections.t| The fact that the attachment,the,rstb_1901_0007.txt,txt_rstb
due to the fact that the plane,the,rstb_1901_0007.txt,txt_rstb
influenced by the fact that the body,the,rstb_1901_0007.txt,txt_rstb
the top. The fact that only a,the,rstb_1901_0007.txt,txt_rstb
elongated opening. The fact that in Lepidocarpon,the,rstb_1901_0007.txt,txt_rstb
group. The mere fact that these plants,the,rstb_1901_0007.txt,txt_rstb
to face the fact that even the,the,rstb_1901_0006.txt,txt_rstb
"well with the fact that, although no",the,rstb_1901_0006.txt,txt_rstb
evident from the fact that another plot,the,rstb_1901_0006.txt,txt_rstb
view of the fact that they are,the,rstb_1901_0006.txt,txt_rstb
"9 Lastly, the fact that certain conditions",the,rstb_1901_0001.txt,txt_rstb
"Eocene epoch, a fact which favours the",the,rstb_1901_0001.txt,txt_rstb
under control. The fact that the Hyzenas,the,rstb_1901_0001.txt,txt_rstb
well as the fact that all through,the,rstb_1901_0001.txt,txt_rstb
"struck by the fact that, according to",the,rstb_1901_0001.txt,txt_rstb
the disc. The fact that all the,the,rstb_1901_0001.txt,txt_rstb
vessels. The important fact is that the,the,rstb_1901_0001.txt,txt_rstb
of Brucn. The fact pointed out by,the,rstb_1901_0001.txt,txt_rstb
struck by the fact that some of,the,rstb_1901_0001.txt,txt_rstb
"the like, the fact above stated will",the,rstb_1901_0001.txt,txt_rstb
slight * The fact that the Ant-eater,the,rstb_1901_0001.txt,txt_rstb
the Pinnipedia. This fact is possibly indicative,the,rstb_1901_0001.txt,txt_rstb
or greenish-blue. The fact that a very,the,rstb_1901_0001.txt,txt_rstb
interest is the fact that the Peninsula,the,rstb_1901_0008.txt,txt_rstb
(2) the remarkable fact that amongst mammals,the,rstb_1901_0008.txt,txt_rstb
as a definite fact that the oldest,the,rstb_1901_0008.txt,txt_rstb
due to the fact that whilst 2,the,rstb_1901_0008.txt,txt_rstb
"for instance, the fact that Eurylemi are",the,rstb_1901_0008.txt,txt_rstb
"however, placed the fact beyond a doubt.",the,rsta_1901_0016.txt,txt_rsta
probable from the fact that when a,the,rsta_1901_0016.txt,txt_rsta
irrespective of the fact that the electrodes,the,rsta_1901_0016.txt,txt_rsta
lies in the fact noted on p.,the,rsta_1901_0023.txt,txt_rsta
attention to the fact that the work,the,rsta_1901_0013.txt,txt_rsta
inferred from the fact that the direction,the,rsta_1901_0021.txt,txt_rsta
"plates, and the fact that the feature",the,rsta_1901_0021.txt,txt_rsta
lies in the fact that the walls,the,rsta_1901_0018.txt,txt_rsta
not for the fact that it decreases,the,rsta_1901_0018.txt,txt_rsta
to reconcile this fact with the theory,the,rsta_1901_0018.txt,txt_rsta
for by the fact that each gaseous,the,rsta_1901_0018.txt,txt_rsta
accounts for the fact already alluded to,the,rsta_1901_0019.txt,txt_rsta
is thus a fact that within the,the,rsta_1901_0019.txt,txt_rsta
derived from the fact that no nth,the,rsta_1901_0015.txt,txt_rsta
the verification The fact that the model,the,rsta_1901_0015.txt,txt_rsta
present case the fact that the criterion,the,rsta_1901_0015.txt,txt_rsta
remarked on the fact that all the,the,rsta_1901_0015.txt,txt_rsta
arose from the fact that it was,the,rsta_1901_0012.txt,txt_rsta
account of the fact that the molecular,the,rsta_1901_0001.txt,txt_rsta
Apart from the fact that no account,the,rsta_1901_0001.txt,txt_rsta
combined with the fact that the sum,the,rsta_1901_0001.txt,txt_rsta
interpretation in the fact that the density,the,rsta_1901_0001.txt,txt_rsta
It must in fact be the ratio,the,rsta_1901_0001.txt,txt_rsta
attention to the fact that some specimens,the,rsta_1901_0014.txt,txt_rsta
and for the fact that a small,the,rsta_1901_0014.txt,txt_rsta
depends on the fact that the ratios,the,rsta_1901_0014.txt,txt_rsta
save in the fact that their positions,the,rsta_1901_0014.txt,txt_rsta
"paid to the fact that helium, too,",the,rsta_1901_0014.txt,txt_rsta
follows from the fact that the series,the,rsta_1901_0024.txt,txt_rsta
§ are in fact reproduced. The notation,the,rsta_1901_0024.txt,txt_rsta
of are in fact reproduced. The principal,the,rsta_1901_0024.txt,txt_rsta
"follows from the fact that if @,",the,rsta_1901_0024.txt,txt_rsta
"verified), notwithstanding the fact that P® is",the,rsta_1901_0024.txt,txt_rsta
follows from the fact that in accordance,the,rsta_1901_0024.txt,txt_rsta
the Q-functions. In fact the series for,the,rsta_1901_0024.txt,txt_rsta
do as a fact disappear. The residues,the,rsta_1901_0024.txt,txt_rsta
"it, hence the fact of the sodium",the,rsta_1901_0010.txt,txt_rsta
accomplished. The first fact noticed was that,the,rsta_1901_0010.txt,txt_rsta
remark beyond the fact that the bands,the,rsta_1901_0010.txt,txt_rsta
the “blow.” The fact that the flame,the,rsta_1901_0010.txt,txt_rsta
proved by the fact that they scatter,the,rsta_1901_0010.txt,txt_rsta
proved by the fact that they scatter,the,rsta_1901_0010.txt,txt_rsta
view of the fact that according to,the,rsta_1901_0004.txt,txt_rsta
to communicate this fact to the Lords,the,rsta_1901_0017.txt,txt_rsta
"corona, notwithstanding the fact that part of",the,rsta_1901_0017.txt,txt_rsta
shown by the fact that a gas,the,rsta_1901_0008.txt,txt_rsta
virtue of the fact that the mean,the,rsta_1901_0008.txt,txt_rsta
"supplied by the fact that N, the",the,rsta_1901_0008.txt,txt_rsta
unexplained the remarkable fact that when the,the,rsta_1901_0002.txt,txt_rsta
by the obvious fact that the constants,the,rsta_1901_0005.txt,txt_rsta
this by the fact that Professor Wetpon,the,rsta_1901_0005.txt,txt_rsta
French women? The fact is that to,the,rsta_1901_0005.txt,txt_rsta
"formule, but the fact of the close",the,rsta_1901_0005.txt,txt_rsta
the variability. The fact is that vigour,the,rsta_1901_0020.txt,txt_rsta
arose from the fact that the plants,the,rsta_1901_0020.txt,txt_rsta
"mallow), but the fact which students of",the,rsta_1901_0020.txt,txt_rsta
struck by the fact that he did,the,rsta_1901_0020.txt,txt_rsta
a second. The fact that half our,the,rsta_1901_0020.txt,txt_rsta
to meet the fact that the individual,the,rsta_1901_0020.txt,txt_rsta
"insects, ()) the fact that the varieties",the,rsta_1901_0020.txt,txt_rsta
degree to the fact that the even,the,rsta_1901_0006.txt,txt_rsta
not observe this fact 3 until the,the,rsta_1901_0006.txt,txt_rsta
lies in the fact that it is,the,rsta_1901_0006.txt,txt_rsta
formula expresses the fact that the integral,the,rsta_1901_0006.txt,txt_rsta
"instance, from the fact that there are",the,rsta_1901_0003.txt,txt_rsta
apparent from the fact that not one,the,rsta_1901_0003.txt,txt_rsta
for by the fact that while in,the,rsta_1901_0003.txt,txt_rsta
drawn to the fact that the plant,the,rsta_1902_0018.txt,txt_rsta
results from the fact that the particles,the,rsta_1902_0012.txt,txt_rsta
and for the fact that a higher,the,rsta_1902_0016.txt,txt_rsta
Neer observed the fact that the P.D.,the,rsta_1902_0016.txt,txt_rsta
"Now take the fact that, with a",the,rsta_1902_0016.txt,txt_rsta
account for the fact already mentioned on,the,rsta_1902_0016.txt,txt_rsta
of current. The fact that the are,the,rsta_1902_0016.txt,txt_rsta
taken place. In fact the elongation obtained,the,rsta_1902_0001.txt,txt_rsta
called to the fact that the permanent,the,rsta_1902_0001.txt,txt_rsta
spite of the fact that flames of,the,rsta_1902_0017.txt,txt_rsta
owing to the fact that the temperature,the,rsta_1902_0017.txt,txt_rsta
owing to the fact that the dark,the,rsta_1902_0017.txt,txt_rsta
one another. The fact that the same,the,rsta_1902_0017.txt,txt_rsta
apparent in the fact that a velocity,the,rsta_1902_0017.txt,txt_rsta
"And, most important fact of all, the",the,rsta_1902_0019.txt,txt_rsta
"research by the fact that Prerznonpr (Perznoxpr,",the,rsta_1902_0011.txt,txt_rsta
traced to the fact that the wire,the,rsta_1902_0011.txt,txt_rsta
and hence the fact that they are,the,rsta_1902_0010.txt,txt_rsta
delicate magnetometer. The fact that the instrument,the,rsta_1902_0010.txt,txt_rsta
due to the fact that the temperature,the,rsta_1902_0010.txt,txt_rsta
brass. Hence the fact that the first,the,rsta_1902_0010.txt,txt_rsta
"shown by the fact that, if we",the,rsta_1902_0010.txt,txt_rsta
into account the fact that the internal,the,rsta_1902_0010.txt,txt_rsta
probably to the fact that observing in,the,rsta_1902_0010.txt,txt_rsta
"also to the fact that, following Hrrrorr,",the,rsta_1902_0003.txt,txt_rsta
consists in the fact that an experiment,the,rsta_1902_0003.txt,txt_rsta
preceding ions. The fact that the boundary,the,rsta_1902_0003.txt,txt_rsta
Proof of the fact that the velocity,the,rsta_1902_0003.txt,txt_rsta
depends on the fact that it has,the,rsta_1902_0003.txt,txt_rsta
lies in the fact that if their,the,rsta_1902_0003.txt,txt_rsta
found in the fact that in an,the,rsta_1902_0003.txt,txt_rsta
follows from the fact that the investigation,the,rsta_1902_0003.txt,txt_rsta
"due to the fact that, since there",the,rsta_1902_0003.txt,txt_rsta
due to the fact that with a,the,rsta_1902_0003.txt,txt_rsta
understood from the fact that the potential,the,rsta_1902_0003.txt,txt_rsta
case from the fact that in the,the,rsta_1902_0003.txt,txt_rsta
acetate—and by the fact that practically the,the,rsta_1902_0003.txt,txt_rsta
difficult by the fact that the transport,the,rsta_1902_0003.txt,txt_rsta
due to the fact that the velocity,the,rsta_1902_0003.txt,txt_rsta
of agreement. The fact that by the,the,rsta_1902_0003.txt,txt_rsta
and v the fact that if we,the,rsta_1902_0003.txt,txt_rsta
points to the fact that the potassium,the,rsta_1902_0003.txt,txt_rsta
"account of the fact that the I,",the,rsta_1902_0003.txt,txt_rsta
associated with the fact that the double,the,rsta_1902_0003.txt,txt_rsta
found that in fact the coefficient of,the,rsta_1902_0006.txt,txt_rsta
"solution, Also the fact that the values",the,rsta_1902_0004.txt,txt_rsta
is acting. In fact the greatest contraction,the,rsta_1902_0004.txt,txt_rsta
follows from the fact that we +,the,rsta_1902_0004.txt,txt_rsta
"explanation of the fact that, when short",the,rsta_1902_0004.txt,txt_rsta
allow for the fact that the next,the,rsta_1902_0013.txt,txt_rsta
partly to the fact that wire finer,the,rsta_1902_0013.txt,txt_rsta
lies in the fact that this adjustment,the,rsta_1902_0013.txt,txt_rsta
due to the fact that the motion,the,rsta_1902_0013.txt,txt_rsta
chiefly from the fact that the value,the,rsta_1902_0013.txt,txt_rsta
addition to the fact that his curve,the,rsta_1902_0013.txt,txt_rsta
due to the fact that the stranded,the,rsta_1902_0014.txt,txt_rsta
heating current. The fact that the results,the,rsta_1902_0014.txt,txt_rsta
spite of the fact that the distilled,the,rsta_1902_0014.txt,txt_rsta
occasioned by the fact that the wire,the,rsta_1902_0014.txt,txt_rsta
points to the fact that the values,the,rsta_1902_0014.txt,txt_rsta
"However remarkable the fact may be, being",the,rsta_1902_0014.txt,txt_rsta
safely group. The fact that my grouped,the,rsta_1902_0005.txt,txt_rsta
in practice. The fact that in both,the,rsta_1902_0005.txt,txt_rsta
the worse. The fact that in some,the,rsta_1902_0005.txt,txt_rsta
due to the fact that the errors,the,rsta_1902_0005.txt,txt_rsta
due to the fact that we considered,the,rsta_1902_0005.txt,txt_rsta
due to the fact that the preliminary,the,rsta_1902_0002.txt,txt_rsta
account of the fact that the curves,the,rsta_1902_0002.txt,txt_rsta
"observed, and this fact points to the",the,rstb_1903_0003.txt,txt_rstb
"insulation, though the fact that their average",the,rstb_1903_0001.txt,txt_rstb
measure for the fact that when heated,the,rstb_1903_0001.txt,txt_rstb
into account the fact that the temperature,the,rstb_1903_0001.txt,txt_rstb
suggested by the fact that the production,the,rstb_1903_0001.txt,txt_rstb
certainty by the fact that the brown,the,rstb_1903_0004.txt,txt_rstb
attention to the fact that in the,the,rstb_1903_0004.txt,txt_rstb
attention to the fact that the data,the,rstb_1903_0004.txt,txt_rstb
strengthened by the fact that young plants,the,rstb_1903_0004.txt,txt_rstb
DEVELOPMENT beyond the fact that the young,the,rstb_1903_0004.txt,txt_rstb
to establish the fact that the primitive,the,rstb_1903_0004.txt,txt_rstb
strengthened by the fact that in another,the,rstb_1903_0004.txt,txt_rstb
"however, in the fact that its “‘steles”",the,rstb_1903_0004.txt,txt_rstb
genus is the fact that the internally,the,rstb_1903_0004.txt,txt_rstb
"explanation of the fact that, even in",the,rstb_1903_0004.txt,txt_rstb
is probably this fact which explains the,the,rstb_1903_0002.txt,txt_rstb
"probable from the fact that a stimulation,",the,rstb_1903_0002.txt,txt_rstb
of Usdema. The fact was incidentally observed,the,rstb_1903_0002.txt,txt_rstb
channel. 3. The fact that some cedema,the,rstb_1903_0002.txt,txt_rstb
are given. The fact that the dose,the,rstb_1903_0002.txt,txt_rstb
"echinoid, from the fact that in the",the,rstb_1903_0006.txt,txt_rstb
gut and the fact that it gave,the,rstb_1903_0006.txt,txt_rstb
esculentus by the fact that in the,the,rstb_1903_0006.txt,txt_rstb
blastula. When the fact is borne in,the,rstb_1903_0006.txt,txt_rstb
hydroccele by the fact that in *,the,rstb_1903_0006.txt,txt_rstb
; and the fact that it is,the,rstb_1903_0006.txt,txt_rstb
owing to the fact that the morphological,the,rstb_1903_0005.txt,txt_rstb
p. 303). The fact that in ontogeny,the,rstb_1903_0005.txt,txt_rstb
"secondly, of the fact that Drew (22)",the,rstb_1903_0005.txt,txt_rstb
"thirdly, of the fact that the Protobranchia",the,rstb_1903_0005.txt,txt_rstb
by the above fact that their structure,the,rstb_1903_0005.txt,txt_rstb
way with the fact that these alone,the,rstb_1903_0005.txt,txt_rstb
connection is the fact that principal filaments’,the,rstb_1903_0005.txt,txt_rstb
owing to the fact that the columnar,the,rstb_1903_0005.txt,txt_rstb
is a significant fact that in the,the,rstb_1903_0005.txt,txt_rstb
into account the fact that the position,the,rstb_1903_0005.txt,txt_rstb
Owing to the fact that in Plewrotomaria,the,rstb_1903_0005.txt,txt_rstb
spite of the fact that Drew has,the,rstb_1903_0005.txt,txt_rstb
"arisen from the fact that some authors,",the,rstb_1903_0005.txt,txt_rstb
is a curious fact that in the,the,rstb_1903_0005.txt,txt_rstb
this is the fact that the chitinous,the,rstb_1903_0005.txt,txt_rstb
suggestive of the fact that the great,the,rstb_1903_0005.txt,txt_rstb
significance in the fact that athey are,the,rstb_1903_0005.txt,txt_rstb
"point is the fact that, in the",the,rstb_1903_0005.txt,txt_rstb
probable by the fact that all 176,the,rstb_1903_0005.txt,txt_rstb
primitive form. The fact that the other,the,rstb_1903_0005.txt,txt_rstb
shown by the fact that this muscle,the,rstb_1903_0005.txt,txt_rstb
attached to the fact that the upper,the,rstb_1903_0005.txt,txt_rstb
2 noting the fact that the nerve,the,rstb_1903_0005.txt,txt_rstb
spite of the fact that Daut’s mistrust,the,rstb_1903_0005.txt,txt_rstb
Anomia laqueata. The fact that in the,the,rstb_1903_0005.txt,txt_rstb
Except in the fact that the two,the,rstb_1903_0005.txt,txt_rstb
judging by the fact that he speaks,the,rstb_1903_0005.txt,txt_rstb
tubes and the fact that all the,the,rstb_1903_0005.txt,txt_rstb
for the disturbing fact that there are,the,rstb_1903_0005.txt,txt_rstb
due to the fact that the mode,the,rstb_1903_0005.txt,txt_rstb
and to the fact that each of,the,rstb_1903_0005.txt,txt_rstb
"due to the fact that Corbula levis,",the,rstb_1903_0005.txt,txt_rstb
evidenced by the fact observed by Dr.,the,rsta_1903_0024.txt,txt_rsta
owing to the fact that one of,the,rsta_1903_0021.txt,txt_rsta
to establish the fact that the least,the,rsta_1903_0020.txt,txt_rsta
point is the fact that if a,the,rsta_1903_0016.txt,txt_rsta
on the known fact that fracture by,the,rsta_1903_0006.txt,txt_rsta
the wire (in fact the saturation current,the,rsta_1903_0023.txt,txt_rsta
higher temperature. The fact that such large,the,rsta_1903_0023.txt,txt_rsta
owing to the fact that the current,the,rsta_1903_0023.txt,txt_rsta
absolute zero. The fact that the resistance,the,rsta_1903_0023.txt,txt_rsta
as to the fact that the exponential,the,rsta_1903_0023.txt,txt_rsta
out by the fact that the acid,the,rsta_1903_0005.txt,txt_rsta
to the well-known fact that the metallic,the,rsta_1903_0005.txt,txt_rsta
"relation, and the fact is further brought",the,rsta_1903_0005.txt,txt_rsta
in part the fact that the measures,the,rsta_1903_0022.txt,txt_rsta
emphasise here the fact that no corrections,the,rsta_1903_0022.txt,txt_rsta
the same general fact is apparent in,the,rsta_1903_0022.txt,txt_rsta
due to the fact that the lines,the,rsta_1903_0022.txt,txt_rsta
view of the fact pointed out by,the,rsta_1903_0022.txt,txt_rsta
§ 40. The fact that the value,the,rsta_1903_0019.txt,txt_rsta
décomposition.” Of the fact ot the partial,the,rsta_1903_0009.txt,txt_rsta
tube revealed the fact that the light,the,rsta_1903_0009.txt,txt_rsta
attention to the fact that in the,the,rsta_1903_0009.txt,txt_rsta
"table reveals the fact that, whether the",the,rsta_1903_0009.txt,txt_rsta
attention to the fact that when no,the,rsta_1903_0009.txt,txt_rsta
partly from the fact that I desired,the,rsta_1903_0007.txt,txt_rsta
follows from the fact that the and,the,rsta_1903_0007.txt,txt_rsta
y. As a fact the first five,the,rsta_1903_0007.txt,txt_rsta
note of the fact that the pear,the,rsta_1903_0007.txt,txt_rsta
due to the fact that it often,the,rsta_1903_0004.txt,txt_rsta
determined by the fact that it is,the,rsta_1903_0004.txt,txt_rsta
be set the fact that the heavier,the,rsta_1903_0015.txt,txt_rsta
"planet, and the fact that this STABILITY",the,rsta_1903_0015.txt,txt_rsta
is passed. The fact that the ultimate,the,rsta_1903_0015.txt,txt_rsta
protuberance is the fact that the axis,the,rsta_1903_0015.txt,txt_rsta
Part 2). The fact that Africa is,the,rsta_1903_0015.txt,txt_rsta
depending upon the fact that stream-line motion,the,rsta_1903_0013.txt,txt_rsta
. (16). The fact that (abcd) is,the,rsta_1903_0018.txt,txt_rsta
variable points. In fact (40) is the,the,rsta_1903_0018.txt,txt_rsta
analysis establishes the fact that a real,the,rsta_1903_0018.txt,txt_rsta
which are in fact of the same,the,rsta_1903_0018.txt,txt_rsta
S (pq). In fact (pq) is the,the,rsta_1903_0018.txt,txt_rsta
order; and the fact that a plane,the,rsta_1903_0018.txt,txt_rsta
2) from the fact that the volume,the,rsta_1903_0001.txt,txt_rsta
They reproduce in fact (xxxiv.). But the,the,rsta_1903_0001.txt,txt_rsta
