Context,Collocate,File,Directory,Year
it is a fact of experience that,it,rstb_1947_0001.txt,txt_rstb,1947
the plate. This fact would make it,it,rstb_1947_0007.txt,txt_rstb,1947
it does in fact take the former,it,rstb_1947_0007.txt,txt_rstb,1947
it from this fact alone that the,it,rstb_1947_0007.txt,txt_rstb,1947
and by the fact that it is,it,rstb_1947_0008.txt,txt_rstb,1947
it has in fact assumed the appearance,it,rstb_1947_0004.txt,txt_rstb,1947
lies in the fact that it operates,it,rstb_1947_0004.txt,txt_rstb,1947
"different directions, in fact it would be",it,rstb_1947_0004.txt,txt_rstb,1947
less than in fact it is. In,it,rstb_1947_0004.txt,txt_rstb,1947
"A, and in fact it only appears",it,rsta_1947_0002.txt,txt_rsta,1947
"bases are in fact complementary, it i",it,rsta_1947_0004.txt,txt_rsta,1947
"the case. In fact the per-radial casts,",the,rstb_1938_0003.txt,txt_rstb,1938
"insect physiologist, the fact that certain species",the,rstb_1938_0005.txt,txt_rstb,1938
in common the fact that they are,the,rstb_1938_0005.txt,txt_rstb,1938
due to the fact that at the,the,rstb_1938_0005.txt,txt_rstb,1938
outlined below. The fact that appreci- able,the,rstb_1938_0005.txt,txt_rstb,1938
graph is the fact that although the,the,rstb_1938_0005.txt,txt_rstb,1938
cannot be the fact that the females,the,rstb_1938_0005.txt,txt_rstb,1938
not alter the fact that throughout its,the,rstb_1938_0005.txt,txt_rstb,1938
nothing but the fact that they are,the,rstb_1938_0005.txt,txt_rstb,1938
interpretation concerns the fact that in the,the,rstb_1938_0005.txt,txt_rstb,1938
this action. The fact that animals may,the,rstb_1938_0005.txt,txt_rstb,1938
of the observable fact that under natural,the,rstb_1938_0005.txt,txt_rstb,1938
states that the fact that Trichogramma will,the,rstb_1938_0005.txt,txt_rstb,1938
It remains a fact that the overwhelming,the,rstb_1938_0005.txt,txt_rstb,1938
volume. But the fact that the chalcid,the,rstb_1938_0005.txt,txt_rstb,1938
supported by the fact that hosts containing,the,rstb_1938_0005.txt,txt_rstb,1938
clay and the fact that the more,the,rstb_1938_0006.txt,txt_rstb,1938
faced with the fact that a very,the,rstb_1938_0006.txt,txt_rstb,1938
the signi- ficant fact remains that oak,the,rstb_1938_0006.txt,txt_rstb,1938
Peterborough Museum. The fact that so much,the,rstb_1938_0006.txt,txt_rstb,1938
"difficult, and the fact that the fen",the,rstb_1938_0006.txt,txt_rstb,1938
stream. The primary fact of marine trans-,the,rstb_1938_0006.txt,txt_rstb,1938
"and did, in fact contribute to the",the,rstb_1938_0006.txt,txt_rstb,1938
"caused by the fact that the subsidence,",the,rstb_1938_0006.txt,txt_rstb,1938
complicated by the fact that dryness and,the,rstb_1938_0006.txt,txt_rstb,1938
found in the fact that in certain,the,rstb_1938_0004.txt,txt_rstb,1938
attention to the fact that sap from,the,rstb_1938_0004.txt,txt_rstb,1938
strain to the fact that they were,the,rstb_1938_0004.txt,txt_rstb,1938
S strain. In fact the character of,the,rstb_1938_0004.txt,txt_rstb,1938
attention to the fact that many of,the,rstb_1938_0004.txt,txt_rstb,1938
strain is in fact admixed with the,the,rstb_1938_0004.txt,txt_rstb,1938
due to the fact that the original,the,rstb_1938_0004.txt,txt_rstb,1938
explanation of the fact that such infected,the,rstb_1938_0004.txt,txt_rstb,1938
X” was in fact unmixed at the,the,rstb_1938_0004.txt,txt_rstb,1938
virus by the fact that it would,the,rstb_1938_0004.txt,txt_rstb,1938
have emphasized the fact that the peculiar,the,rstb_1938_0004.txt,txt_rstb,1938
shown by the fact that inoculum from,the,rstb_1938_0004.txt,txt_rstb,1938
due to the fact that X° had,the,rstb_1938_0004.txt,txt_rstb,1938
made to the fact that during the,the,rstb_1938_0004.txt,txt_rstb,1938
is indeed the fact is shown when,the,rstb_1938_0004.txt,txt_rstb,1938
explained by the fact that as soon,the,rstb_1938_0004.txt,txt_rstb,1938
Notwithstand- ing the fact that it is,the,rstb_1938_0004.txt,txt_rstb,1938
due to the fact that the virulent,the,rstb_1938_0004.txt,txt_rstb,1938
contradicted by the fact established inde- pendently,the,rstb_1938_0004.txt,txt_rstb,1938
the repeatedly observed fact that whereas paracrinkle,the,rstb_1938_0004.txt,txt_rstb,1938
found in the fact that the ordinary,the,rstb_1938_0004.txt,txt_rstb,1938
of virus. The fact that such a,the,rstb_1938_0004.txt,txt_rstb,1938
"shown by the fact that simple inoculation,",the,rstb_1938_0004.txt,txt_rstb,1938
"suggested, to the fact that the prior",the,rstb_1938_0004.txt,txt_rstb,1938
"value, then the fact that X” does",the,rstb_1938_0004.txt,txt_rstb,1938
"is by the fact that X”¥, X?,",the,rstb_1938_0004.txt,txt_rstb,1938
virus disclose the fact that the strains,the,rstb_1938_0004.txt,txt_rstb,1938
brings out the fact that the valley,the,rstb_1938_0002.txt,txt_rstb,1938
due to the fact that the central,the,rstb_1938_0002.txt,txt_rstb,1938
attention to the fact that truncated spurs,the,rstb_1938_0002.txt,txt_rstb,1938
"Hill, and the fact that it is",the,rstb_1938_0002.txt,txt_rstb,1938
"1902, emphasized the fact that the nuées",the,rstb_1938_0002.txt,txt_rstb,1938
"suggested by the fact that Gage’s Lower,",the,rstb_1938_0002.txt,txt_rstb,1938
comment on the fact that their conclusions,the,rstb_1938_0002.txt,txt_rstb,1938
brown hornblende. The fact that the red-brown,the,rstb_1938_0002.txt,txt_rstb,1938
He stressed the fact that these pseudomorphs,the,rstb_1938_0002.txt,txt_rstb,1938
owing to the fact that diagnostic data,the,rstb_1938_0002.txt,txt_rstb,1938
accordance with the fact that the mineral,the,rstb_1938_0002.txt,txt_rstb,1938
due to the fact that much of,the,rstb_1938_0002.txt,txt_rstb,1938
mainly from the fact that many of,the,rstb_1938_0002.txt,txt_rstb,1938
brings out the fact that the main,the,rstb_1938_0002.txt,txt_rstb,1938
measure to the fact that the hour,the,rsta_1938_0002.txt,txt_rsta,1938
owing to the fact that most of,the,rsta_1938_0002.txt,txt_rsta,1938
due to the fact that in these,the,rsta_1938_0002.txt,txt_rsta,1938
as 1/r?. The fact that the observed,the,rsta_1938_0002.txt,txt_rsta,1938
either to the fact that owing to,the,rsta_1938_0002.txt,txt_rsta,1938
associated with the fact that the mean,the,rsta_1938_0002.txt,txt_rsta,1938
result of the fact that certain relationships,the,rsta_1938_0002.txt,txt_rsta,1938
foci must in fact satisfy the condition,the,rsta_1938_0002.txt,txt_rsta,1938
correspond in actual fact to the waves,the,rsta_1938_0002.txt,txt_rsta,1938
have occurred. The fact that there are,the,rsta_1938_0002.txt,txt_rsta,1938
strengthened by the fact that in estimating,the,rsta_1938_0002.txt,txt_rsta,1938
magmatic pressure. The fact that seismic activity,the,rsta_1938_0002.txt,txt_rsta,1938
accounts for the fact that the disturbed,the,rsta_1938_0002.txt,txt_rsta,1938
lie in the fact that it would,the,rsta_1938_0002.txt,txt_rsta,1938
depends on the fact that the earth,the,rsta_1938_0002.txt,txt_rsta,1938
magnification and the fact that it registers,the,rsta_1938_0002.txt,txt_rsta,1938
Owing to the fact that alternate lines,the,rsta_1938_0014.txt,txt_rsta,1938
directly from the fact that the branches,the,rsta_1938_0014.txt,txt_rsta,1938
illustration of the fact that the Stark,the,rsta_1938_0001.txt,txt_rsta,1938
due to the fact that the above-mentioned,the,rsta_1938_0005.txt,txt_rsta,1938
"seen from the fact that In /,(«)",the,rsta_1938_0005.txt,txt_rsta,1938
due to the fact that these infinite,the,rsta_1938_0003.txt,txt_rsta,1938
due to the fact that when y,the,rsta_1938_0004.txt,txt_rsta,1938
view of the fact that these alternative,the,rsta_1938_0004.txt,txt_rsta,1938
lies in the fact that this determination,the,rsta_1938_0009.txt,txt_rsta,1938
corresponds to the fact that the edge,the,rsta_1938_0009.txt,txt_rsta,1938
taken of the fact that it is,the,rsta_1938_0009.txt,txt_rsta,1938
equivalent to the fact that the ground,the,rsta_1938_0009.txt,txt_rsta,1938
"predominant, and the fact that they are",the,rsta_1938_0009.txt,txt_rsta,1938
because of the fact that it is,the,rsta_1938_0013.txt,txt_rsta,1938
partly on the fact that that choice,the,rsta_1938_0013.txt,txt_rsta,1938
account of the fact that the observations,the,rsta_1938_0008.txt,txt_rsta,1938
owing to the fact that I have,the,rsta_1938_0008.txt,txt_rsta,1938
due to the fact that the mean,the,rsta_1938_0008.txt,txt_rsta,1938
arise from the fact that in their,the,rsta_1938_0008.txt,txt_rsta,1938
due to the fact that the Type,the,rsta_1938_0008.txt,txt_rsta,1938
use of the fact that a series,the,rsta_1938_0008.txt,txt_rsta,1938
does not in fact evaluate the associated,the,rsta_1938_0007.txt,txt_rsta,1938
"determined from the fact that, since the",the,rsta_1938_0007.txt,txt_rsta,1938
rests on the fact that “if a,the,rsta_1938_0007.txt,txt_rsta,1938
and is in fact the problem which,the,rsta_1938_0007.txt,txt_rsta,1938
these do in fact satisfy the conditions,the,rsta_1938_0007.txt,txt_rsta,1938
depends on the fact that in a,the,rsta_1938_0012.txt,txt_rsta,1938
becomes horizontal. The fact that the level,the,rsta_1938_0012.txt,txt_rsta,1938
N-axis expresses the fact that the quartic,the,rsta_1938_0012.txt,txt_rsta,1938
depends on the fact that what we,the,rsta_1938_0012.txt,txt_rsta,1938
interesting and important fact concerning the critical,the,rsta_1938_0012.txt,txt_rsta,1938
this is in fact the case. It,the,rsta_1938_0012.txt,txt_rsta,1938
spite of the fact that the direction,the,rsta_1938_0012.txt,txt_rsta,1938
spite of the fact that the planes,the,rsta_1938_0012.txt,txt_rsta,1938
owing to the fact that the wave,the,rsta_1938_0012.txt,txt_rsta,1938
arises from the fact that the values,the,rsta_1938_0012.txt,txt_rsta,1938
is based. The fact that reflexion is,the,rsta_1938_0012.txt,txt_rsta,1938
up with the fact co | Fic.,the,rsta_1938_0012.txt,txt_rsta,1938
lying in the fact that the complete,the,rstb_1939_0006.txt,txt_rstb,1939
again to the fact that quercetin (3,the,rstb_1939_0006.txt,txt_rstb,1939
demonstrated by the fact that while over,the,rstb_1939_0006.txt,txt_rstb,1939
view of the fact that blue (generally,the,rstb_1939_0006.txt,txt_rstb,1939
far apart. The fact that the nitrogenous,the,rstb_1939_0006.txt,txt_rstb,1939
1. InrrRopucTION The fact that there are,the,rstb_1939_0003.txt,txt_rstb,1939
giant cells. In fact the arrangement is,the,rstb_1939_0003.txt,txt_rstb,1939
position is the fact that the cell,the,rstb_1939_0003.txt,txt_rstb,1939
result of the fact that it has,the,rstb_1939_0003.txt,txt_rstb,1939
"artefact, but the fact that the two",the,rstb_1939_0003.txt,txt_rstb,1939
"proper, and in fact almost to the",the,rstb_1939_0003.txt,txt_rstb,1939
"stellate ganglion, in fact the structure shown",the,rstb_1939_0003.txt,txt_rstb,1939
of contact. The fact that there is,the,rstb_1939_0003.txt,txt_rstb,1939
large granules. In fact the incoming fibre,the,rstb_1939_0003.txt,txt_rstb,1939
up by the fact that the two,the,rstb_1939_0003.txt,txt_rstb,1939
found in the fact that they are,the,rstb_1939_0001.txt,txt_rstb,1939
for by the fact that either the,the,rstb_1939_0001.txt,txt_rstb,1939
known from the fact that the whole,the,rstb_1939_0001.txt,txt_rstb,1939
they could in fact be the limb,the,rstb_1939_0001.txt,txt_rstb,1939
basalts revealing the fact that they and,the,rstb_1939_0001.txt,txt_rstb,1939
due to the fact that they lie,the,rstb_1939_0001.txt,txt_rstb,1939
the latter. This fact seems to indicate,the,rstb_1939_0001.txt,txt_rstb,1939
account of the fact that at some,the,rstb_1939_0001.txt,txt_rstb,1939
"deposits. Nevertheless, the fact that such primitive",the,rstb_1939_0001.txt,txt_rstb,1939
lies in the fact that it is,the,rstb_1939_0001.txt,txt_rstb,1939
account of the fact that Levallois artifacts,the,rstb_1939_0001.txt,txt_rstb,1939
and may in fact be the volcanic,the,rstb_1939_0001.txt,txt_rstb,1939
inferred from the fact that the Basement,the,rstb_1939_0001.txt,txt_rstb,1939
"Nevertheless, the curious fact appears that the",the,rstb_1939_0001.txt,txt_rstb,1939
surrounding country. The fact that they have,the,rstb_1939_0001.txt,txt_rstb,1939
important is the fact that where they,the,rstb_1939_0001.txt,txt_rstb,1939
taking place. The fact that the first,the,rstb_1939_0002.txt,txt_rstb,1939
shown by the fact that it begins,the,rstb_1939_0002.txt,txt_rstb,1939
owing to the fact that the pectoral,the,rstb_1939_0002.txt,txt_rstb,1939
more precisely. The fact that one explant,the,rstb_1939_0002.txt,txt_rstb,1939
spite of the fact that one-third of,the,rstb_1939_0002.txt,txt_rstb,1939
shown by the fact that the distance,the,rstb_1939_0002.txt,txt_rstb,1939
tissue by the fact that the cells,the,rstb_1939_0002.txt,txt_rstb,1939
due to the fact that in the,the,rstb_1939_0002.txt,txt_rstb,1939
partly to the fact that a large,the,rstb_1939_0002.txt,txt_rstb,1939
disproved by the fact that it appears,the,rstb_1939_0002.txt,txt_rstb,1939
due to the fact that the conditions,the,rstb_1939_0002.txt,txt_rstb,1939
demonstrated by the fact that the distance,the,rstb_1939_0002.txt,txt_rstb,1939
shown by the fact that all the,the,rstb_1939_0002.txt,txt_rstb,1939
perhaps to the fact that there is,the,rstb_1939_0002.txt,txt_rstb,1939
gametophyte and the fact of numerical reduction,the,rstb_1939_0007.txt,txt_rstb,1939
due to the fact that each is,the,rstb_1939_0007.txt,txt_rstb,1939
owing to the fact that the technique,the,rstb_1939_0007.txt,txt_rstb,1939
one turn. The fact that untwisting is,the,rstb_1939_0007.txt,txt_rstb,1939
"owing to the fact that the coils,",the,rstb_1939_0007.txt,txt_rstb,1939
certainly occurs. The fact that the chromosomes,the,rstb_1939_0007.txt,txt_rstb,1939
owing to the fact that the chromosome,the,rstb_1939_0007.txt,txt_rstb,1939
"itself, the central fact of meiosis, must",the,rstb_1939_0007.txt,txt_rstb,1939
Appendix IT). The fact that ‘‘necks”’ are,the,rstb_1939_0007.txt,txt_rstb,1939
is the well-known fact that the most,the,rstb_1939_0007.txt,txt_rstb,1939
"be over-emphasized, the fact of chromosome shrinkage",the,rstb_1939_0007.txt,txt_rstb,1939
serious disadvantages. The fact that only one,the,rstb_1939_0007.txt,txt_rstb,1939
confirmation of the fact of elongation if,the,rstb_1939_0007.txt,txt_rstb,1939
owing to the fact that a metaphase,the,rstb_1939_0007.txt,txt_rstb,1939
ignorance of the fact that in no,the,rstb_1939_0005.txt,txt_rstb,1939
statement disregards the fact that filtration of,the,rstb_1939_0005.txt,txt_rstb,1939
"Tanganyika revealed the fact that, though the",the,rstb_1939_0004.txt,txt_rstb,1939
due to the fact that the adult,the,rstb_1939_0004.txt,txt_rstb,1939
view of the fact that the glands,the,rstb_1939_0004.txt,txt_rstb,1939
be found; in fact the corpus luteum,the,rstb_1939_0004.txt,txt_rstb,1939
this is in fact the case is,the,rsta_1939_0011.txt,txt_rsta,1939
"impact, but the fact that Neumann bands",the,rsta_1939_0011.txt,txt_rsta,1939
than 5°-3. The fact that only one,the,rsta_1939_0011.txt,txt_rsta,1939
theory; while the fact that orientations of,the,rsta_1939_0011.txt,txt_rsta,1939
Widmanstatten structure. The fact that Widmanstatten figures,the,rsta_1939_0011.txt,txt_rsta,1939
origin to the fact that a {110}-plane,the,rsta_1939_0011.txt,txt_rsta,1939
complicated by the fact that four sets,the,rsta_1939_0010.txt,txt_rsta,1939
thus verified. In fact the observed anisotropy,the,rsta_1939_0006.txt,txt_rsta,1939
the striking new fact which emerges is,the,rsta_1939_0009.txt,txt_rsta,1939
greater distances. The fact that a similar,the,rsta_1939_0009.txt,txt_rsta,1939
complicated by the fact that both positive,the,rsta_1939_0009.txt,txt_rsta,1939
it with the fact that many of,the,rsta_1939_0009.txt,txt_rsta,1939
essentially in the fact that in the,the,rsta_1939_0009.txt,txt_rsta,1939
based on the fact that the estimated,the,rsta_1939_0009.txt,txt_rsta,1939
owing to the fact that carbon monoxide,the,rsta_1939_0002.txt,txt_rsta,1939
owing to the fact that they decompose,the,rsta_1939_0002.txt,txt_rsta,1939
differ considerably. In fact the work of,the,rsta_1939_0007.txt,txt_rsta,1939
"composition, and the fact that they were",the,rsta_1939_0007.txt,txt_rsta,1939
"combustion, despite the fact that the lower",the,rsta_1939_0007.txt,txt_rsta,1939
view of the fact that Maass and,the,rsta_1939_0007.txt,txt_rsta,1939
owing to the fact that it was,the,rsta_1939_0005.txt,txt_rsta,1939
complicated by the fact that it was,the,rsta_1939_0005.txt,txt_rsta,1939
"spite of the fact that, for n=",the,rsta_1939_0001.txt,txt_rsta,1939
owing to the fact mentioned already that,the,rsta_1939_0001.txt,txt_rsta,1939
restricted by the fact that the induced,the,rsta_1939_0001.txt,txt_rsta,1939
evident from the fact that the relationship,the,rsta_1939_0004.txt,txt_rsta,1939
owing to the fact that air is,the,rsta_1939_0004.txt,txt_rsta,1939
due to the fact that the changes,the,rsta_1939_0004.txt,txt_rsta,1939
"view of the fact that invar, even",the,rsta_1939_0004.txt,txt_rsta,1939
due to the fact that air is,the,rsta_1939_0004.txt,txt_rsta,1939
The most important fact which emerges from,the,rsta_1939_0004.txt,txt_rsta,1939
"Tilton, despite the fact that the observed",the,rsta_1939_0004.txt,txt_rsta,1939
supported by the fact that the palatoquadrate,the,rstb_1940_0004.txt,txt_rstb,1940
be added the fact that the hyomandibular,the,rstb_1940_0004.txt,txt_rstb,1940
spite of the fact that the possible,the,rstb_1940_0002.txt,txt_rstb,1940
bones and the fact that the ‘‘,the,rstb_1940_0002.txt,txt_rstb,1940
"1938). First, the fact that the palatine",the,rstb_1940_0002.txt,txt_rstb,1940
placed on the fact that the vomer,the,rstb_1940_0002.txt,txt_rstb,1940
cartilaginous neurocranium. The fact that the embryo-,the,rstb_1940_0002.txt,txt_rstb,1940
"lizard, and in fact of all the",the,rstb_1940_0002.txt,txt_rstb,1940
"(Arpt), and the fact that the greatly",the,rstb_1940_0002.txt,txt_rstb,1940
supported by the fact that the curve,the,rstb_1940_0001.txt,txt_rstb,1940
supported by the fact that the peat,the,rstb_1940_0001.txt,txt_rstb,1940
they do in fact lie in the,the,rstb_1940_0001.txt,txt_rstb,1940
supported by the fact that late medieval,the,rstb_1940_0001.txt,txt_rstb,1940
graph is the fact that it should,the,rstb_1940_0001.txt,txt_rstb,1940
is a striking fact that the silts,the,rstb_1940_0001.txt,txt_rstb,1940
Owing to the fact that the spread,the,rsta_1940_0009.txt,txt_rsta,1940
owing to the fact that levels denoted,the,rsta_1940_0009.txt,txt_rsta,1940
obviously to the fact that we are,the,rsta_1940_0009.txt,txt_rsta,1940
they are in fact sharper than the,the,rsta_1940_0009.txt,txt_rsta,1940
consists in the fact that the curve,the,rsta_1940_0009.txt,txt_rsta,1940
"error. Also, the fact that the shift",the,rsta_1940_0009.txt,txt_rsta,1940
points to the fact that this may,the,rsta_1940_0009.txt,txt_rsta,1940
bands.* The important fact from the present,the,rsta_1940_0009.txt,txt_rsta,1940
forbidden. The observed fact that the filling,the,rsta_1940_0009.txt,txt_rsta,1940
owing to the fact that a really,the,rsta_1940_0009.txt,txt_rsta,1940
"the /,-spectra. This fact makes it almost",the,rsta_1940_0009.txt,txt_rsta,1940
account of the fact that if the,the,rsta_1940_0009.txt,txt_rsta,1940
be applicable. The fact that it gives,the,rsta_1940_0009.txt,txt_rsta,1940
"referred to the fact that the N,,,(Z)",the,rsta_1940_0009.txt,txt_rsta,1940
"arises from the fact that, since all",the,rsta_1940_0009.txt,txt_rsta,1940
correct for the fact that the band,the,rsta_1940_0009.txt,txt_rsta,1940
identical. But the fact that the two,the,rsta_1940_0010.txt,txt_rsta,1940
suggested by the fact that spinastanol also,the,rsta_1940_0010.txt,txt_rsta,1940
pattern is the fact that the new,the,rsta_1940_0010.txt,txt_rsta,1940
due to the fact that a small,the,rsta_1940_0007.txt,txt_rsta,1940
upper surface. In fact the results were,the,rsta_1940_0007.txt,txt_rsta,1940
from occurring. The fact that an e.m.f.,the,rsta_1940_0007.txt,txt_rsta,1940
supported by the fact that the addition,the,rsta_1940_0007.txt,txt_rsta,1940
the surfaces. The fact that an electromotive,the,rsta_1940_0007.txt,txt_rsta,1940
the load. The fact that the track,the,rsta_1940_0007.txt,txt_rsta,1940
differences do in fact exist. Similarly the,the,rsta_1940_0007.txt,txt_rsta,1940
complicated by the fact that the strength,the,rsta_1940_0007.txt,txt_rsta,1940
also by the fact that at the,the,rsta_1940_0007.txt,txt_rsta,1940
sliding solids. The fact that friction is,the,rsta_1940_0007.txt,txt_rsta,1940
due to the fact that they use,the,rsta_1940_0005.txt,txt_rsta,1940
arising from the fact that the values,the,rsta_1940_0004.txt,txt_rsta,1940
taken of the fact that there is,the,rsta_1940_0004.txt,txt_rsta,1940
doubt by the fact that the amplitudes,the,rsta_1940_0004.txt,txt_rsta,1940
(judging from the fact that the solution,the,rsta_1940_0004.txt,txt_rsta,1940
Another highly confirmatory fact is that the,the,rsta_1940_0004.txt,txt_rsta,1940
"made of the fact that log A,",the,rsta_1940_0003.txt,txt_rsta,1940
necessary) of the fact that log /,the,rsta_1940_0003.txt,txt_rsta,1940
It involves in fact the following of,the,rsta_1940_0008.txt,txt_rsta,1940
ened by the fact that the refracted,the,rsta_1940_0008.txt,txt_rsta,1940
and by the fact that the refracted,the,rsta_1940_0008.txt,txt_rsta,1940
"semicircular path. The fact that we get,",the,rsta_1940_0001.txt,txt_rsta,1940
distinguished by the fact that the machine,the,rsta_1940_0001.txt,txt_rsta,1940
angular amplitude. In fact the corrected phugoid,the,rsta_1940_0001.txt,txt_rsta,1940
phugoids. Using the fact that w’ is,the,rsta_1940_0001.txt,txt_rsta,1940
(7-2) in the fact that the former,the,rsta_1940_0001.txt,txt_rsta,1940
"into account the fact that usually, for",the,rsta_1940_0001.txt,txt_rsta,1940
"is a well-known fact that, of the",the,rsta_1940_0001.txt,txt_rsta,1940
restricted by the fact that 7’ is,the,rsta_1940_0001.txt,txt_rsta,1940
due to the fact that the machine,the,rsta_1940_0001.txt,txt_rsta,1940
confusing by the fact that when Kent,the,rstb_1941_0002.txt,txt_rstb,1941
"Prowazek were in fact the parabasal apparatus,",the,rstb_1941_0002.txt,txt_rstb,1941
point out the fact that the protoplasmic,the,rstb_1941_0002.txt,txt_rstb,1941
important as the fact of pig- mentation,the,rstb_1941_0001.txt,txt_rstb,1941
variety corresponds in fact to the superposition,the,rstb_1941_0001.txt,txt_rstb,1941
the case. This fact raised for us,the,rstb_1941_0001.txt,txt_rstb,1941
cynthia- xanthin. The fact that the pigment,the,rstb_1941_0001.txt,txt_rstb,1941
be true the fact remains that the,the,rstb_1941_0001.txt,txt_rstb,1941
view of the fact that plants with,the,rstb_1941_0004.txt,txt_rstb,1941
present specimen; in fact the likeness is,the,rstb_1941_0003.txt,txt_rstb,1941
"slightly concave, in fact nearly plane; the",the,rstb_1941_0003.txt,txt_rstb,1941
"megalospheric, must in fact be microspheric. The",the,rstb_1941_0003.txt,txt_rstb,1941
muscular contraction. The fact that the intrinsic,the,rstb_1941_0005.txt,txt_rstb,1941
"likely by the fact that three hearts,",the,rstb_1941_0005.txt,txt_rstb,1941
account for the fact that the heart,the,rstb_1941_0005.txt,txt_rstb,1941
with this the fact that the Purkinje,the,rstb_1941_0005.txt,txt_rstb,1941
dependent upon the fact that Di(2)=0 and,the,rsta_1941_0001.txt,txt_rsta,1941
"given, but the fact that the axons",the,rstb_1942_0004.txt,txt_rstb,1942
"size, and the fact that they enter",the,rstb_1942_0004.txt,txt_rstb,1942
ganglion. And the fact that the median,the,rstb_1942_0004.txt,txt_rstb,1942
"But further, the fact that this widely",the,rstb_1942_0001.txt,txt_rstb,1942
spores and the fact that some of,the,rstb_1942_0001.txt,txt_rstb,1942
a contribution of fact regarding the plants,the,rstb_1942_0001.txt,txt_rstb,1942
emphasized by the fact that the anterolateral,the,rstb_1942_0003.txt,txt_rstb,1942
spite of the fact that Ting mentions,the,rstb_1942_0003.txt,txt_rstb,1942
size and the fact that they continue,the,rstb_1942_0003.txt,txt_rstb,1942
account for the fact that the most,the,rstb_1942_0003.txt,txt_rstb,1942
"due to the fact that, although they",the,rstb_1942_0003.txt,txt_rstb,1942
"plates, and the fact that the lumen",the,rstb_1942_0003.txt,txt_rstb,1942
owing to the fact that each double,the,rstb_1942_0003.txt,txt_rstb,1942
did also the fact that the measurements,the,rstb_1942_0002.txt,txt_rstb,1942
given by the fact that it is,the,rstb_1942_0002.txt,txt_rstb,1942
"populations, and the fact that the first-year",the,rstb_1942_0002.txt,txt_rstb,1942
due to the fact that it is,the,rstb_1942_0002.txt,txt_rstb,1942
of development. The fact that all the,the,rstb_1942_0002.txt,txt_rstb,1942
due to the fact that a sufficiently,the,rstb_1942_0002.txt,txt_rstb,1942
D: and the fact that spaces D,the,rsta_1942_0001.txt,txt_rsta,1942
cof C. In fact the k-fold space,the,rsta_1942_0001.txt,txt_rsta,1942
"BQx, CRx. In fact the scroll is",the,rsta_1942_0001.txt,txt_rsta,1942
"points d), in fact where the scroll",the,rsta_1942_0001.txt,txt_rsta,1942
"(>) is) In fact the first e,",the,rsta_1942_0001.txt,txt_rsta,1942
of spaces in fact characterizes the increasing,the,rsta_1942_0001.txt,txt_rsta,1942
made for the fact that the integral,the,rsta_1943_0001.txt,txt_rsta,1943
together with the fact that the frequency,the,rsta_1943_0001.txt,txt_rsta,1943
(allowing for the fact that only half,the,rsta_1943_0001.txt,txt_rsta,1943
afforded by the fact that the binding,the,rsta_1943_0001.txt,txt_rsta,1943
"conditions prevail, the fact that the transfer",the,rsta_1943_0001.txt,txt_rsta,1943
later on the fact that nearly all,the,rstb_1944_0001.txt,txt_rstb,1944
"them are in fact vegetative, but the",the,rstb_1944_0001.txt,txt_rstb,1944
their nature. The fact that they are,the,rstb_1944_0001.txt,txt_rstb,1944
ripe seeds. The fact that our knowledge,the,rstb_1944_0001.txt,txt_rstb,1944
86). From the fact that the integument,the,rstb_1944_0001.txt,txt_rstb,1944
ascribed to the fact that the proportion,the,rstb_1944_0002.txt,txt_rstb,1944
and on the fact that such classifications,the,rstb_1944_0002.txt,txt_rstb,1944
