Context,Word,File,Directory
due to the fact that this region,this,rsta_1900_0008.txt,txt_rsta
This is in fact a particular case,this,rsta_1900_0010.txt,txt_rsta
because of this fact that we have,this,rsta_1900_0007.txt,txt_rsta
"highly poisonous. This fact is, however, not",this,rstb_1901_0012.txt,txt_rstb
i in this fact an indication ep,this,rstb_1901_0005.txt,txt_rstb
reason of this fact the after- currents,this,rstb_1901_0005.txt,txt_rstb
2 that this fact has led me,this,rstb_1901_0005.txt,txt_rstb
knowledge of this fact that led us,this,rstb_1901_0009.txt,txt_rstb
derived from the fact that at this,this,rstb_1901_0009.txt,txt_rstb
higher plants. This fact is connected with,this,rstb_1901_0007.txt,txt_rstb
the Pinnipedia. This fact is possibly indicative,this,rstb_1901_0001.txt,txt_rstb
is an important fact that this migration,this,rstb_1901_0008.txt,txt_rstb
8 ; in fact this value is,this,rsta_1901_0013.txt,txt_rsta
to reconcile this fact with the theory,this,rsta_1901_0018.txt,txt_rsta
to communicate this fact to the Lords,this,rsta_1901_0017.txt,txt_rsta
this by the fact that Professor Wetpon,this,rsta_1901_0005.txt,txt_rsta
not observe this fact 3 until the,this,rsta_1901_0006.txt,txt_rsta
"possess, and this fact we cannot, throughout",this,rsta_1902_0019.txt,txt_rsta
lies in the fact that this adjustment,this,rsta_1902_0013.txt,txt_rsta
"dry, and this fact has been raised",this,rsta_1902_0014.txt,txt_rsta
"observed, and this fact points to the",this,rstb_1903_0003.txt,txt_rstb
is probably this fact which explains the,this,rstb_1903_0002.txt,txt_rstb
"pseudaconitine, and this fact seems to stand",this,rstb_1903_0002.txt,txt_rstb
a matter of fact this plan was,this,rstb_1903_0006.txt,txt_rstb
of this curious fact which suggests itself,this,rstb_1903_0006.txt,txt_rstb
above it. This fact is easily demonstrated,this,rstb_1903_0005.txt,txt_rstb
this is the fact that the chitinous,this,rstb_1903_0005.txt,txt_rstb
shown by the fact that this muscle,this,rstb_1903_0005.txt,txt_rstb
attached to this fact has been discussed,this,rstb_1903_0005.txt,txt_rstb
p. 22). This fact is due to,this,rstb_1903_0005.txt,txt_rstb
It is in fact by this method,this,rsta_1903_0020.txt,txt_rsta
are colliding. In fact this assumption follows,this,rsta_1903_0023.txt,txt_rsta
"them, and this fact is still more",this,rsta_1903_0005.txt,txt_rsta
to [vd In fact this correction is,this,rsta_1903_0007.txt,txt_rsta
"planet, and the fact that this STABILITY",this,rsta_1903_0015.txt,txt_rsta
a matter of fact this is not,this,rsta_1903_0014.txt,txt_rsta
"frequently ascended, in fact this was one",this,rsta_1903_0010.txt,txt_rsta
knowledge of this fact ; our best,this,rstb_1904_0009.txt,txt_rstb
me that this fact possibly may explain,this,rstb_1904_0003.txt,txt_rstb
23— 27); this fact will be referred,this,rstb_1904_0005.txt,txt_rstb
this work. This fact has been noticed,this,rstb_1904_0005.txt,txt_rstb
"the archesporium, The fact is that this",this,rstb_1904_0007.txt,txt_rstb
spores ; this fact may have its,this,rstb_1904_0007.txt,txt_rstb
Mr. Kipston. The fact that this undifferentiated,this,rstb_1904_0007.txt,txt_rstb
or of the fact that in this,this,rsta_1904_0015.txt,txt_rsta
This is a fact which is readily,this,rsta_1904_0011.txt,txt_rsta
This extremely important fact is illustrated by,this,rsta_1904_0011.txt,txt_rsta
to establish this fact and to determine,this,rsta_1904_0011.txt,txt_rsta
of shydrogen. This fact agrees with BuNsEN,this,rsta_1904_0002.txt,txt_rsta
this is the fact can easily be,this,rsta_1904_0022.txt,txt_rsta
This explains the fact that only a,this,rsta_1904_0022.txt,txt_rsta
this statement. The fact that the eutectic,this,rsta_1904_0001.txt,txt_rsta
Sn 15. The fact that in this,this,rsta_1904_0001.txt,txt_rsta
brings out the fact that this ground,this,rsta_1904_0001.txt,txt_rsta
harmony with this fact the first steps,this,rsta_1904_0001.txt,txt_rsta
but notwithstanding this fact it has been,this,rsta_1904_0018.txt,txt_rsta
respiratory rate. This fact is of considerable,this,rstb_1905_0007.txt,txt_rstb
Colubrine portion. This fact no doubt accounts,this,rstb_1905_0007.txt,txt_rstb
"it, and this fact agrees with the",this,rstb_1905_0007.txt,txt_rstb
due to the fact that in this,this,rstb_1905_0008.txt,txt_rstb
other plants. This fact has an important,this,rstb_1905_0008.txt,txt_rstb
low temperatures. This fact seemed to render,this,rsta_1905_0012.txt,txt_rsta
The most obvious fact shown by this,this,rsta_1905_0008.txt,txt_rsta
"to, and the fact that this effect",this,rsta_1905_0007.txt,txt_rsta
"T. teniatus. The fact is, that this",this,rstb_1896_0001.txt,txt_rstb
"this excitation, a fact previously referred to",this,rstb_1896_0004.txt,txt_rstb
of times.* This fact has become familiar,this,rstb_1896_0004.txt,txt_rstb
skeletal end. This fact can be confirmed,this,rstb_1896_0003.txt,txt_rstb
the septum. This fact must be remembered,this,rstb_1896_0003.txt,txt_rstb
correlation with this fact we find that,this,rstb_1896_0003.txt,txt_rstb
"finds in this fact a simple explanation,",this,rstb_1896_0003.txt,txt_rstb
primary septa. This fact allows lateral thickening,this,rstb_1896_0003.txt,txt_rstb
have in this fact a proof that,this,rstb_1896_0003.txt,txt_rstb
mention this last fact because it is,this,rstb_1896_0003.txt,txt_rstb
It is this fact which in Zupsammia,this,rstb_1896_0003.txt,txt_rstb
are produced. This fact I have deduced,this,rstb_1896_0003.txt,txt_rstb
"growth, and this fact alone causes a",this,rstb_1896_0003.txt,txt_rstb
gold itself.* This fact led us to,this,rsta_1896_0011.txt,txt_rsta
al = This fact leads as before,this,rsta_1896_0016.txt,txt_rsta
rotation. This latter fact has been assumed,this,rsta_1896_0008.txt,txt_rsta
in this singular fact led them to,this,rsta_1896_0010.txt,txt_rsta
"this to the fact that, having now",this,rsta_1896_0004.txt,txt_rsta
spite of this fact of the posterior,this,rstb_1897_0002.txt,txt_rstb
the knee. This fact is of great,this,rstb_1897_0005.txt,txt_rstb
stroma; of this fact he clearly states,this,rstb_1897_0003.txt,txt_rstb
certain of the fact and consider this,this,rstb_1897_0003.txt,txt_rstb
occur- rence. The fact that this specimen,this,rstb_1897_0003.txt,txt_rstb
21. ** The fact of this successful,this,rstb_1897_0013.txt,txt_rstb
It is this fact which appears to,this,rstb_1897_0009.txt,txt_rstb
sorus; but this fact is still more,this,rstb_1897_0010.txt,txt_rstb
this from the fact that the femur,this,rstb_1897_0014.txt,txt_rstb
to utilise this fact as a check,this,rsta_1897_0012.txt,txt_rsta
heat transmitted. This fact has been often,this,rsta_1897_0015.txt,txt_rsta
thought that this fact would present an,this,rsta_1897_0018.txt,txt_rsta
"temperature, and this fact seems to hold",this,rsta_1897_0007.txt,txt_rsta
attention to the fact that this length,this,rsta_1897_0009.txt,txt_rsta
the equator. The fact that this flow,this,rsta_1897_0009.txt,txt_rsta
explanation of this fact will be obvious,this,rsta_1897_0009.txt,txt_rsta
or splashing. This fact renders the atomic,this,rsta_1897_0002.txt,txt_rsta
the system: in fact this reversal would,this,rsta_1897_0020.txt,txt_rsta
temperature depends in fact on this irregular,this,rsta_1897_0020.txt,txt_rsta
this paper: in fact von Hetmuorrz translates,this,rsta_1897_0020.txt,txt_rsta
that in this fact lay the clue,this,rstb_1898_0007.txt,txt_rstb
animal ova. The fact that in this,this,rstb_1898_0005.txt,txt_rstb
general type. The fact of this formation,this,rstb_1898_0005.txt,txt_rstb
left eye. This fact was detected by,this,rstb_1898_0001.txt,txt_rstb
"at all. This fact is of interest,",this,rstb_1898_0010.txt,txt_rstb
"ON to this fact by Dritner,* in",this,rstb_1898_0010.txt,txt_rstb
the sea-water. This fact has its bearing,this,rstb_1898_0010.txt,txt_rstb
This was in fact the case. Thus,this,rstb_1898_0008.txt,txt_rstb
stomatal effect. This fact would probably have,this,rstb_1898_0009.txt,txt_rstb
come on. This fact is also well,this,rstb_1898_0009.txt,txt_rstb
temporary opening. This fact illustrates the dependence,this,rstb_1898_0009.txt,txt_rstb
results.§ This last fact I have confirmed.,this,rstb_1898_0009.txt,txt_rstb
laboratory types. This fact may be OF,this,rstb_1898_0002.txt,txt_rstb
the crater. This fact may be taken,this,rsta_1898_0012.txt,txt_rsta
it is this fact which the guthor,this,rsta_1898_0008.txt,txt_rsta
comfirmatory of this fact it may be,this,rstb_1899_0005.txt,txt_rstb
10° C.; this fact was = repeatedly,this,rstb_1899_0005.txt,txt_rstb
Nevertheless one important fact militated against this,this,rstb_1899_0005.txt,txt_rstb
normal stele. This fact may have some,this,rstb_1899_0003.txt,txt_rstb
proof of this fact is afforded by,this,rstb_1899_0003.txt,txt_rstb
among them. This fact agrees well with,this,rstb_1899_0003.txt,txt_rstb
§) For this fact I am indebted,this,rstb_1899_0006.txt,txt_rstb
increases. This latter fact leads to an,this,rsta_1899_0010.txt,txt_rsta
consequence of this fact the coefficients of,this,rsta_1899_0010.txt,txt_rsta
interesting by the fact that. about this,this,rsta_1899_0010.txt,txt_rsta
and this very fact might indicate that,this,rsta_1899_0006.txt,txt_rsta
based. This fundamental fact of the application,this,rsta_1899_0004.txt,txt_rsta
the former. This fact is brought out,this,rstb_1900_0006.txt,txt_rstb
of syncope. This fact I have clearly,this,rstb_1900_0011.txt,txt_rstb
"monkey, and this fact has not been",this,rstb_1900_0011.txt,txt_rstb
"this tract. The fact that cortical discharge,",this,rstb_1900_0011.txt,txt_rstb
this case. This fact would be much,this,rstb_1900_0013.txt,txt_rstb
"calcarine fissure. The fact also, that this",this,rstb_1900_0013.txt,txt_rstb
how far this fact is likely to,this,rstb_1900_0014.txt,txt_rstb
This last- mentioned fact illustrates experimentally the,this,rstb_1900_0014.txt,txt_rstb
Reasoning from this fact we were led,this,rstb_1900_0014.txt,txt_rstb
have in this fact something more than,this,rstb_1900_0014.txt,txt_rstb
elongated receptacle. This fact was noted *,this,rstb_1900_0002.txt,txt_rstb
This is a fact of importance when,this,rstb_1900_0002.txt,txt_rstb
is an interesting fact in this connection,this,rstb_1900_0002.txt,txt_rstb
con- stancy. This fact leaves the question,this,rstb_1900_0002.txt,txt_rstb
"error, and this fact may obscure the",this,rsta_1900_0022.txt,txt_rsta
It is in fact in this way,this,rsta_1900_0032.txt,txt_rsta
"this line, a fact which is borne",this,rsta_1900_0032.txt,txt_rsta
smaller limits. In fact this mode of,this,rsta_1900_0027.txt,txt_rsta
"the wire, this fact affords an additional",this,rsta_1900_0023.txt,txt_rsta
+1. This simple fact shows that we,this,rsta_1900_0021.txt,txt_rsta
to make this fact clear. Hence the,this,rsta_1900_0017.txt,txt_rsta
offered of the fact that this is,this,rsta_1900_0012.txt,txt_rsta
a matter of fact this is not,this,rsta_1900_0019.txt,txt_rsta
due to the fact that this region,this,rsta_1900_0008.txt,txt_rsta
This is in fact a particular case,this,rsta_1900_0010.txt,txt_rsta
because of this fact that we have,this,rsta_1900_0007.txt,txt_rsta
"highly poisonous. This fact is, however, not",this,rstb_1901_0012.txt,txt_rstb
i in this fact an indication ep,this,rstb_1901_0005.txt,txt_rstb
reason of this fact the after- currents,this,rstb_1901_0005.txt,txt_rstb
2 that this fact has led me,this,rstb_1901_0005.txt,txt_rstb
knowledge of this fact that led us,this,rstb_1901_0009.txt,txt_rstb
derived from the fact that at this,this,rstb_1901_0009.txt,txt_rstb
higher plants. This fact is connected with,this,rstb_1901_0007.txt,txt_rstb
the Pinnipedia. This fact is possibly indicative,this,rstb_1901_0001.txt,txt_rstb
is an important fact that this migration,this,rstb_1901_0008.txt,txt_rstb
8 ; in fact this value is,this,rsta_1901_0013.txt,txt_rsta
to reconcile this fact with the theory,this,rsta_1901_0018.txt,txt_rsta
to communicate this fact to the Lords,this,rsta_1901_0017.txt,txt_rsta
this by the fact that Professor Wetpon,this,rsta_1901_0005.txt,txt_rsta
not observe this fact 3 until the,this,rsta_1901_0006.txt,txt_rsta
"possess, and this fact we cannot, throughout",this,rsta_1902_0019.txt,txt_rsta
lies in the fact that this adjustment,this,rsta_1902_0013.txt,txt_rsta
"dry, and this fact has been raised",this,rsta_1902_0014.txt,txt_rsta
"observed, and this fact points to the",this,rstb_1903_0003.txt,txt_rstb
is probably this fact which explains the,this,rstb_1903_0002.txt,txt_rstb
"pseudaconitine, and this fact seems to stand",this,rstb_1903_0002.txt,txt_rstb
a matter of fact this plan was,this,rstb_1903_0006.txt,txt_rstb
of this curious fact which suggests itself,this,rstb_1903_0006.txt,txt_rstb
above it. This fact is easily demonstrated,this,rstb_1903_0005.txt,txt_rstb
this is the fact that the chitinous,this,rstb_1903_0005.txt,txt_rstb
shown by the fact that this muscle,this,rstb_1903_0005.txt,txt_rstb
attached to this fact has been discussed,this,rstb_1903_0005.txt,txt_rstb
p. 22). This fact is due to,this,rstb_1903_0005.txt,txt_rstb
It is in fact by this method,this,rsta_1903_0020.txt,txt_rsta
are colliding. In fact this assumption follows,this,rsta_1903_0023.txt,txt_rsta
"them, and this fact is still more",this,rsta_1903_0005.txt,txt_rsta
to [vd In fact this correction is,this,rsta_1903_0007.txt,txt_rsta
"planet, and the fact that this STABILITY",this,rsta_1903_0015.txt,txt_rsta
a matter of fact this is not,this,rsta_1903_0014.txt,txt_rsta
"frequently ascended, in fact this was one",this,rsta_1903_0010.txt,txt_rsta
knowledge of this fact ; our best,this,rstb_1904_0009.txt,txt_rstb
me that this fact possibly may explain,this,rstb_1904_0003.txt,txt_rstb
23— 27); this fact will be referred,this,rstb_1904_0005.txt,txt_rstb
this work. This fact has been noticed,this,rstb_1904_0005.txt,txt_rstb
"the archesporium, The fact is that this",this,rstb_1904_0007.txt,txt_rstb
spores ; this fact may have its,this,rstb_1904_0007.txt,txt_rstb
Mr. Kipston. The fact that this undifferentiated,this,rstb_1904_0007.txt,txt_rstb
or of the fact that in this,this,rsta_1904_0015.txt,txt_rsta
This is a fact which is readily,this,rsta_1904_0011.txt,txt_rsta
This extremely important fact is illustrated by,this,rsta_1904_0011.txt,txt_rsta
to establish this fact and to determine,this,rsta_1904_0011.txt,txt_rsta
of shydrogen. This fact agrees with BuNsEN,this,rsta_1904_0002.txt,txt_rsta
this is the fact can easily be,this,rsta_1904_0022.txt,txt_rsta
This explains the fact that only a,this,rsta_1904_0022.txt,txt_rsta
this statement. The fact that the eutectic,this,rsta_1904_0001.txt,txt_rsta
Sn 15. The fact that in this,this,rsta_1904_0001.txt,txt_rsta
brings out the fact that this ground,this,rsta_1904_0001.txt,txt_rsta
harmony with this fact the first steps,this,rsta_1904_0001.txt,txt_rsta
but notwithstanding this fact it has been,this,rsta_1904_0018.txt,txt_rsta
respiratory rate. This fact is of considerable,this,rstb_1905_0007.txt,txt_rstb
Colubrine portion. This fact no doubt accounts,this,rstb_1905_0007.txt,txt_rstb
"it, and this fact agrees with the",this,rstb_1905_0007.txt,txt_rstb
due to the fact that in this,this,rstb_1905_0008.txt,txt_rstb
other plants. This fact has an important,this,rstb_1905_0008.txt,txt_rstb
low temperatures. This fact seemed to render,this,rsta_1905_0012.txt,txt_rsta
The most obvious fact shown by this,this,rsta_1905_0008.txt,txt_rsta
"to, and the fact that this effect",this,rsta_1905_0007.txt,txt_rsta
"fig. 9), a fact in keeping with",in,rstb_1896_0002.txt,txt_rstb
"fig. 13), a fact in keeping with",in,rstb_1896_0002.txt,txt_rstb
dog ; in fact there is rather,in,rstb_1896_0002.txt,txt_rstb
secondly in the fact that it can,in,rstb_1896_0004.txt,txt_rstb
The second noteworthy fact is involved in,in,rstb_1896_0004.txt,txt_rstb
has attained in fact the name of,in,rstb_1896_0003.txt,txt_rstb
"is in the fact that, although its",in,rstb_1896_0003.txt,txt_rstb
"finds in this fact a simple explanation,",in,rstb_1896_0003.txt,txt_rstb
have in this fact a proof that,in,rstb_1896_0003.txt,txt_rstb
It is this fact which in Zupsammia,in,rstb_1896_0003.txt,txt_rstb
consists in the fact that a trabecular,in,rstb_1896_0003.txt,txt_rstb
"itself in the fact that, at the",in,rstb_1896_0003.txt,txt_rstb
is in the fact that a number,in,rstb_1896_0003.txt,txt_rstb
calyx follows in fact the same system,in,rstb_1896_0003.txt,txt_rstb
septa. The fundamental fact in the definition,in,rstb_1896_0003.txt,txt_rstb
only in the fact that it is,in,rstb_1896_0003.txt,txt_rstb
can explain the fact that in the,in,rstb_1896_0003.txt,txt_rstb
"14, and in fact all multiples of",in,rstb_1896_0003.txt,txt_rstb
remarkable in the fact that the symmetry,in,rstb_1896_0003.txt,txt_rstb
"Zaphrentids, and that fact in itself sufficiently",in,rstb_1896_0003.txt,txt_rstb
there is the fact that in Helophyllum,in,rstb_1896_0003.txt,txt_rstb
in this singular fact led them to,in,rsta_1896_0010.txt,txt_rsta
proved by the fact that in so,in,rsta_1896_0005.txt,txt_rsta
either in the fact that Bropin used,in,rsta_1896_0004.txt,txt_rsta
lies in the fact that very often,in,rsta_1896_0004.txt,txt_rsta
as in the fact that a small,in,rsta_1896_0004.txt,txt_rsta
lies in the fact that sulphur Zdoes,in,rsta_1896_0004.txt,txt_rsta
striking by the fact that in moving,in,rstb_1897_0002.txt,txt_rstb
dog. Another interesting fact noted in the,in,rstb_1897_0005.txt,txt_rstb
"it was in fact a ripe follicle,",in,rstb_1897_0003.txt,txt_rstb
lies in the fact that they both,in,rstb_1897_0003.txt,txt_rstb
"be undoubtedly the fact that, in the",in,rstb_1897_0003.txt,txt_rstb
"drawn to the fact that, in the",in,rstb_1897_0003.txt,txt_rstb
"attention to the fact that Soporra, in",in,rstb_1897_0003.txt,txt_rstb
observed. After the fact of variability in,in,rstb_1897_0007.txt,txt_rstb
shown by the fact that in the,in,rstb_1897_0007.txt,txt_rstb
consists in the fact that the cerebro-spinal,in,rstb_1897_0007.txt,txt_rstb
least in the fact that they are,in,rstb_1897_0011.txt,txt_rstb
importance to the fact that in Spencerites,in,rstb_1897_0011.txt,txt_rstb
Spencerites. In the fact that the insertion,in,rstb_1897_0011.txt,txt_rstb
"indicated by the fact that, in transverse",in,rstb_1897_0009.txt,txt_rstb
and in the fact that they do,in,rstb_1897_0010.txt,txt_rstb
of Danea. In fact all the main,in,rstb_1897_0010.txt,txt_rstb
Marattiacesw. In the fact that it is,in,rstb_1897_0010.txt,txt_rstb
:— (1). The fact that in nerve,in,rstb_1897_0001.txt,txt_rstb
attention to the fact that in many,in,rstb_1897_0014.txt,txt_rstb
carried out; in fact a few seconds,in,rsta_1897_0012.txt,txt_rsta
lies in the fact that the temperature,in,rsta_1897_0015.txt,txt_rsta
gram. From the fact that in Operation,in,rsta_1897_0017.txt,txt_rsta
and is in fact a modification of,in,rsta_1897_0018.txt,txt_rsta
"not for the fact that, in noting",in,rsta_1897_0018.txt,txt_rsta
be made. In fact the eye requires,in,rsta_1897_0018.txt,txt_rsta
very severe. In fact one set of,in,rsta_1897_0016.txt,txt_rsta
lies in the fact that the distribution,in,rsta_1897_0022.txt,txt_rsta
lies in the fact that p and,in,rsta_1897_0022.txt,txt_rsta
to 0°9373. In fact the correlation for,in,rsta_1897_0022.txt,txt_rsta
infinite ; in fact it has a,in,rsta_1897_0004.txt,txt_rsta
mainly from the fact that in the,in,rsta_1897_0003.txt,txt_rsta
currents is the fact that in equatorial,in,rsta_1897_0009.txt,txt_rsta
"in mind the fact that, on account",in,rsta_1897_0002.txt,txt_rsta
only in the fact that the extra,in,rsta_1897_0021.txt,txt_rsta
independently of the fact that in default,in,rsta_1897_0020.txt,txt_rsta
forcives must in fact be equal and,in,rsta_1897_0020.txt,txt_rsta
ether is in fact virtually considered to,in,rsta_1897_0020.txt,txt_rsta
"Principia, is in fact the quiescent underlying",in,rsta_1897_0020.txt,txt_rsta
there is in fact no dielectric polarization,in,rsta_1897_0020.txt,txt_rsta
differentially irrotational. In fact when the change,in,rsta_1897_0020.txt,txt_rsta
value has in fact already been specified,in,rsta_1897_0020.txt,txt_rsta
analysis will in fact resemble Lapnacr’s general,in,rsta_1897_0020.txt,txt_rsta
wave-length is in fact an action involving,in,rsta_1897_0020.txt,txt_rsta
material medium. In fact when the period,in,rsta_1897_0020.txt,txt_rsta
"belong, are in fact introduced by the",in,rsta_1897_0020.txt,txt_rsta
the system: in fact this reversal would,in,rsta_1897_0020.txt,txt_rsta
which forms in fact a rude mechanical,in,rsta_1897_0020.txt,txt_rsta
lies in the fact that the complex,in,rsta_1897_0020.txt,txt_rsta
stress would in fact not then be,in,rsta_1897_0020.txt,txt_rsta
temperature depends in fact on this irregular,in,rsta_1897_0020.txt,txt_rsta
such discovery in fact involves an amendment,in,rsta_1897_0020.txt,txt_rsta
it has in fact led to the,in,rsta_1897_0020.txt,txt_rsta
It is in fact the standpoint of,in,rsta_1897_0020.txt,txt_rsta
volume; as in fact would flow directly,in,rsta_1897_0020.txt,txt_rsta
"Hetmuourz,* forming in fact a further extension",in,rsta_1897_0020.txt,txt_rsta
gaseous state. In fact the difference between,in,rsta_1897_0020.txt,txt_rsta
"stress-systems might in fact be specified, for",in,rsta_1897_0020.txt,txt_rsta
this paper: in fact von Hetmuorrz translates,in,rsta_1897_0020.txt,txt_rsta
following considerations in fact derive it from,in,rsta_1897_0020.txt,txt_rsta
principle supplies in fact a method of,in,rsta_1897_0020.txt,txt_rsta
induction is in fact made up of,in,rsta_1897_0020.txt,txt_rsta
"parabolic, as in fact they ave. At",in,rsta_1897_0020.txt,txt_rsta
"points, and in fact proclaimed more loudly",in,rstb_1898_0006.txt,txt_rstb
that in this fact lay the clue,in,rstb_1898_0007.txt,txt_rstb
animal ova. The fact that in this,in,rstb_1898_0005.txt,txt_rstb
"than eight, in fact the number seems",in,rstb_1898_0005.txt,txt_rstb
established the same fact in Picea vulgaris.,in,rstb_1898_0005.txt,txt_rstb
cell protoplasm. In fact they exactly resemble,in,rstb_1898_0005.txt,txt_rstb
segmentation division. In fact no resting fertilized,in,rstb_1898_0005.txt,txt_rstb
during maturation. In fact they pass through,in,rstb_1898_0005.txt,txt_rstb
connected with the fact that in Ephedra,in,rstb_1898_0005.txt,txt_rstb
the spindle in fact hardly exists as,in,rstb_1898_0005.txt,txt_rstb
support from the fact that in smaller,in,rstb_1898_0001.txt,txt_rstb
lies in the fact that it is,in,rstb_1898_0010.txt,txt_rstb
"ON to this fact by Dritner,* in",in,rstb_1898_0010.txt,txt_rstb
"shewn by the fact that, in Halidrys",in,rstb_1898_0010.txt,txt_rstb
as the fundamental fact in the origin,in,rstb_1898_0003.txt,txt_rstb
lie in the fact that the Strongylocentrotus,in,rstb_1898_0008.txt,txt_rstb
observe the striking fact that whilst in,in,rstb_1898_0008.txt,txt_rstb
They were in fact very similar to,in,rstb_1898_0008.txt,txt_rstb
This was in fact the case. Thus,in,rstb_1898_0008.txt,txt_rstb
in the centre—a fact which demonstrates the,in,rstb_1898_0009.txt,txt_rstb
depends on the fact that in adult,in,rstb_1898_0009.txt,txt_rstb
In practice the fact is of no,in,rstb_1898_0009.txt,txt_rstb
use of the fact in his discussion,in,rstb_1898_0009.txt,txt_rstb
WirHeErina. . The fact that in most,in,rstb_1898_0009.txt,txt_rstb
revealing the interesting fact that in many,in,rstb_1898_0009.txt,txt_rstb
interest of the fact is in relation,in,rstb_1898_0009.txt,txt_rstb
obtained of the fact that in lethal,in,rstb_1898_0004.txt,txt_rstb
and is in fact not promoted by,in,rstb_1898_0004.txt,txt_rstb
Rabbit ; a fact in accord with,in,rstb_1898_0002.txt,txt_rstb
and Rat. The fact that in Macacus,in,rstb_1898_0002.txt,txt_rstb
lie in the fact that die roots,in,rstb_1898_0002.txt,txt_rstb
the sag in fact they are only,in,rstb_1898_0002.txt,txt_rstb
"structure, as in fact Physiological units. 3",in,rstb_1898_0002.txt,txt_rstb
out by the fact that in my,in,rstb_1898_0002.txt,txt_rstb
"course, a familiar fact in photometry that",in,rsta_1898_0002.txt,txt_rsta
found in the fact that in all,in,rsta_1898_0012.txt,txt_rsta
and with the fact that solids in,in,rsta_1898_0010.txt,txt_rsta
We may in fact anticipate that the,in,rsta_1898_0005.txt,txt_rsta
We have in fact 160 MR. S.,in,rsta_1898_0005.txt,txt_rsta
due to the fact that in each,in,rsta_1898_0005.txt,txt_rsta
allowance for the fact that in mountain,in,rsta_1898_0011.txt,txt_rsta
It is in fact given by the,in,rsta_1898_0007.txt,txt_rsta
"phloem, and in fact the structure is",in,rstb_1899_0003.txt,txt_rstb
"Fern-like, and in fact almost certainly identical,",in,rstb_1899_0003.txt,txt_rstb
notably in the fact that the primary,in,rstb_1899_0003.txt,txt_rstb
consists in the fact that in M.,in,rstb_1899_0003.txt,txt_rstb
venation is in fact precisely that of,in,rstb_1899_0006.txt,txt_rstb
THE STRUCTURE interesting fact that in the,in,rstb_1899_0006.txt,txt_rstb
in parallel arrangement—a fact which Swhich we,in,rsta_1899_0005.txt,txt_rsta
also in the fact that it seeks,in,rsta_1899_0007.txt,txt_rsta
"found in the fact that, while it",in,rsta_1899_0007.txt,txt_rsta
"another, as in fact they do, it",in,rsta_1899_0007.txt,txt_rsta
involved in the fact of the existence,in,rsta_1899_0008.txt,txt_rsta
will be in fact a sign-post at,in,rsta_1899_0008.txt,txt_rsta
ring-shaped inside. In fact they are so,in,rsta_1899_0002.txt,txt_rsta
It acts in fact as the stream-function,in,rsta_1899_0002.txt,txt_rsta
velocity zero. In fact the parameters of,in,rsta_1899_0002.txt,txt_rsta
except in the fact that the rays,in,rsta_1899_0009.txt,txt_rsta
was _ the fact that in ordinary,in,rsta_1899_0009.txt,txt_rsta
arrangements were in fact exactly the same,in,rsta_1899_0009.txt,txt_rsta
2They might in fact be a direct,in,rsta_1899_0009.txt,txt_rsta
"or negative. In fact one would expect,",in,rsta_1899_0009.txt,txt_rsta
and will in fact be proved to,in,rsta_1899_0001.txt,txt_rsta
condition which in fact does determine them;,in,rsta_1899_0001.txt,txt_rsta
"lies in the fact that death, restraint,",in,rsta_1899_0006.txt,txt_rsta
