Context,Collocate,File,Directory,Year
and of this fact 1 am sure,this,rstl_1767_0042.txt,txt_rstl,1767
different climate. This fact at first certainly,this,rstl_1767_0005.txt,txt_rstl,1767
heart. Another anatomical fact Proves this last,this,rstl_1767_0002.txt,txt_rstl,1767
"me of this fact only, viz. that",this,rstl_1768_0005.txt,txt_rstl,1768
"curious circumftance, This fact [ 407 fad",this,rstl_1770_0036.txt,txt_rstl,1770
this is a fact that is evinced,this,rstl_1770_0034.txt,txt_rstl,1770
colleed of this fact from a multitude,this,rstl_1773_0038.txt,txt_rstl,1773
that denomination. This fact may. be brought,this,rstl_1774_0006.txt,txt_rstl,1774
rubens in Seed; Fact he 2 is,is,rstl_1767_0042.txt,txt_rstl,1767
"it is a fact absolutely certain, that",is,rstl_1767_0002.txt,txt_rstl,1767
and is in fact often omitted. The,is,rstl_1768_0020.txt,txt_rstl,1768
an acid. The fact is sufficiently evinced,is,rstl_1769_0030.txt,txt_rstl,1769
this is a fact that is evinced,is,rstl_1770_0034.txt,txt_rstl,1770
"however, is in Fact the produce of",is,rstl_1775_0039.txt,txt_rstl,1775
"=o. : ""In fact It is fin.",is,rstl_1775_0027.txt,txt_rstl,1775
"it is 2 fact well known, that",is,rstl_1776_0009.txt,txt_rstl,1776
rubens in Seed; Fact he 2 is,in,rstl_1767_0042.txt,txt_rstl,1767
and is in fact often omitted. The,in,rstl_1768_0020.txt,txt_rstl,1768
"it was in fact prolonged somewhat further,",in,rstl_1768_0042.txt,txt_rstl,1768
light are in fact much less than,in,rstl_1770_0038.txt,txt_rstl,1770
I should in fact think these chemical,in,rstl_1773_0038.txt,txt_rstl,1773
<oncerning that extraordinary fact in Natural Hi-,in,rstl_1774_0042.txt,txt_rstl,1774
"it does in fact obtain, when the",in,rstl_1774_0030.txt,txt_rstl,1774
"however, is in Fact the produce of",in,rstl_1775_0039.txt,txt_rstl,1775
"deter- ned in fact from 29/;, being",in,rstl_1776_0029.txt,txt_rstl,1776
"in England, din fact we have the",in,rstl_1776_0008.txt,txt_rstl,1776
Auvergne Sphich in fact agrees singularly with,in,rstl_1776_0008.txt,txt_rstl,1776
"Z are in fact hollow, like the",in,rstl_1776_0002.txt,txt_rstl,1776
"upon! them, should-in fact reflect, only a",a,rstl_1767_0028.txt,txt_rstl,1767
specific gravities: a fact which Dr. Woodward:,a,rstl_1767_0005.txt,txt_rstl,1767
"it is a fact absolutely certain, that",a,rstl_1767_0002.txt,txt_rstl,1767
as it4s a fact not at- tended,a,rstl_1769_0016.txt,txt_rstl,1769
this is a fact that is evinced,a,rstl_1770_0034.txt,txt_rstl,1770
upon as aicertain fact that a cubic,a,rstl_1770_0030.txt,txt_rstl,1770
"a doubt. The fact itself appears, not",a,rstl_1771_0029.txt,txt_rstl,1771
colleed of this fact from a multitude,a,rstl_1773_0038.txt,txt_rstl,1773
I remember a fact which appears to,a,rstl_1775_0014.txt,txt_rstl,1775
of age; a fact which seemed Svery,a,rstl_1775_0009.txt,txt_rstl,1775
and is in fact often omitted. The,the,rstl_1768_0020.txt,txt_rstl,1768
"but the S fact is, plain, and",the,rstl_1768_0042.txt,txt_rstl,1768
"to. clearnels, let fact decide. The Chinese",the,rstl_1769_0066.txt,txt_rstl,1769
"ternal contact; the faCt was, that when",the,rstl_1769_0043.txt,txt_rstl,1769
an acid. The fact is sufficiently evinced,the,rstl_1769_0030.txt,txt_rstl,1769
"account, of, the fact was communi- cated.",the,rstl_1769_0008.txt,txt_rstl,1769
"a doubt. The fact itself appears, not",the,rstl_1771_0029.txt,txt_rstl,1771
? The next fact I have happened,the,rstl_1772_0022.txt,txt_rstl,1772
witness of that fact which was the,the,rstl_1773_0038.txt,txt_rstl,1773
of ascertaining the fact by experiment seems,the,rstl_1773_0001.txt,txt_rstl,1773
lent. Allowing the fact fo repeatedly observed,the,rstl_1774_0017.txt,txt_rstl,1774
"their conclusions. The, fact is, that the",the,rstl_1774_0030.txt,txt_rstl,1774
"it does in fact obtain, when the",the,rstl_1774_0030.txt,txt_rstl,1774
"however, is in Fact the produce of",the,rstl_1775_0039.txt,txt_rstl,1775
ishment of the fact ap- bw -,the,rstl_1775_0035.txt,txt_rstl,1775
exact observation. The fact that Tr would,the,rstl_1775_0024.txt,txt_rstl,1775
"drawn from the fact give room.to suspegt,",the,rstl_1775_0021.txt,txt_rstl,1775
"aspects, though the fact should be, that",the,rstl_1775_0017.txt,txt_rstl,1775
con- tradict the fact he relates ;,the,rstl_1776_0039.txt,txt_rstl,1776
"* The recent fact you mention, of",the,rstl_1776_0030.txt,txt_rstl,1776
into immediate con- fact with the air.,the,rstl_1776_0014.txt,txt_rstl,1776
"in England, din fact we have the",the,rstl_1776_0008.txt,txt_rstl,1776
"Z are in fact hollow, like the",the,rstl_1776_0002.txt,txt_rstl,1776
and of this fact 1 am sure,of,rstl_1767_0042.txt,txt_rstl,1767
"me of this fact only, viz. that",of,rstl_1768_0005.txt,txt_rstl,1768
"acquaintance-with proofs of fact and histqry,ccriticism and-gramrmar,",of,rstl_1769_0066.txt,txt_rstl,1769
witness of that fact which was the,of,rstl_1773_0038.txt,txt_rstl,1773
colleed of this fact from a multitude,of,rstl_1773_0038.txt,txt_rstl,1773
of ascertaining the fact by experiment seems,of,rstl_1773_0001.txt,txt_rstl,1773
"however, is in Fact the produce of",of,rstl_1775_0039.txt,txt_rstl,1775
ishment of the fact ap- bw -,of,rstl_1775_0035.txt,txt_rstl,1775
of age; a fact which seemed Svery,of,rstl_1775_0009.txt,txt_rstl,1775
"* The recent fact you mention, of",of,rstl_1776_0030.txt,txt_rstl,1776
