Context,Collocate,File,Directory,Year
"sufficient, for the fact that the ground",that,rsta_1944_0001.txt,txt_rsta,1944
is not the fact that satisfaction of,that,rsta_1945_0005.txt,txt_rsta,1945
indicates that in fact it does not,that,rsta_1945_0004.txt,txt_rsta,1945
"shows that in fact all of rr,",that,rsta_1945_0004.txt,txt_rsta,1945
lies in the fact that a double,that,rsta_1945_0001.txt,txt_rsta,1945
comes from the fact that the boundaries,that,rsta_1945_0001.txt,txt_rsta,1945
taken of the fact that (since the,that,rsta_1945_0001.txt,txt_rsta,1945
explained by the fact that Anthophysa lives,that,rstb_1946_0004.txt,txt_rstb,1946
Apart from the fact that the muscles,that,rstb_1946_0003.txt,txt_rstb,1946
shown by the fact that any sharp,that,rstb_1946_0001.txt,txt_rstb,1946
spite of the fact that many have,that,rstb_1946_0001.txt,txt_rstb,1946
affected by the fact that some of,that,rstb_1946_0001.txt,txt_rstb,1946
apart from the fact that this latter,that,rstb_1946_0001.txt,txt_rstb,1946
by the well-known fact that the removal,that,rstb_1946_0001.txt,txt_rstb,1946
and indicate the fact that there is,that,rstb_1946_0001.txt,txt_rstb,1946
"influence, and the fact that they are",that,rstb_1946_0001.txt,txt_rstb,1946
east. ‘A striking fact is that in,that,rstb_1946_0002.txt,txt_rstb,1946
called kagai. The fact that the plant,that,rstb_1946_0002.txt,txt_rstb,1946
it is a fact that the upper,that,rstb_1946_0002.txt,txt_rstb,1946
irrespective of the fact that the stretch,that,rstb_1946_0002.txt,txt_rstb,1946
view is the fact that when Europeans,that,rstb_1946_0002.txt,txt_rstb,1946
tribes. g The fact that MacGregor found,that,rstb_1946_0002.txt,txt_rstb,1946
mostly on the fact that that is,that,rstb_1946_0002.txt,txt_rstb,1946
"included, notwithstanding the fact that the Portuguese",that,rstb_1946_0002.txt,txt_rstb,1946
"concludes, ‘from the fact that the people",that,rstb_1946_0002.txt,txt_rstb,1946
struck by the fact that the natives,that,rstb_1946_0002.txt,txt_rstb,1946
"literature, notwithstanding the fact that during the",that,rstb_1946_0002.txt,txt_rstb,1946
due to the fact that the names,that,rstb_1946_0002.txt,txt_rstb,1946
facilitated by the fact that on the,that,rstb_1946_0002.txt,txt_rstb,1946
of Ireland. The fact that the salinity,that,rsta_1946_0001.txt,txt_rsta,1946
28) that in fact the limiting ‘free’,that,rsta_1946_0004.txt,txt_rsta,1946
"example, by the fact that the transformation",that,rsta_1946_0002.txt,txt_rsta,1946
so that the fact that across the,that,rsta_1946_0002.txt,txt_rsta,1946
lies in the fact that the treatment,that,rstb_1947_0001.txt,txt_rstb,1947
it is a fact of experience that,that,rstb_1947_0001.txt,txt_rstb,1947
"secondly, to the fact that when the",that,rstb_1947_0001.txt,txt_rstb,1947
made of the fact that in other,that,rstb_1947_0001.txt,txt_rstb,1947
steles are in fact involved: that on,that,rstb_1947_0001.txt,txt_rstb,1947
formed notwithstanding the fact that there is,that,rstb_1947_0001.txt,txt_rstb,1947
out by the fact that leaf primordia,that,rstb_1947_0001.txt,txt_rstb,1947
(ii) in the fact that polycycly is,that,rstb_1947_0001.txt,txt_rstb,1947
though hardly surprising fact is that nearly,that,rstb_1947_0002.txt,txt_rstb,1947
due to the fact that the anaesthesia,that,rstb_1947_0002.txt,txt_rstb,1947
and from the fact that the number,that,rstb_1947_0002.txt,txt_rstb,1947
shown by the fact that in five,that,rstb_1947_0002.txt,txt_rstb,1947
doubtful by the fact that out of,that,rstb_1947_0002.txt,txt_rstb,1947
satisfactorily by the fact that the earlier,that,rstb_1947_0002.txt,txt_rstb,1947
unmyelinated fibres. The fact that other hypothalamic,that,rstb_1947_0002.txt,txt_rstb,1947
lies in the fact that in the,that,rstb_1947_0002.txt,txt_rstb,1947
"route, and the fact that the infundibular",that,rstb_1947_0002.txt,txt_rstb,1947
accounted for the fact that the post-operative,that,rstb_1947_0002.txt,txt_rstb,1947
view of the fact that the pars,that,rstb_1947_0002.txt,txt_rstb,1947
significance underlying the fact that the rabbit,that,rstb_1947_0002.txt,txt_rstb,1947
clear from the fact that the two,that,rstb_1947_0007.txt,txt_rstb,1947
argument. The relevant fact is that the,that,rstb_1947_0007.txt,txt_rstb,1947
plates and the fact that they all,that,rstb_1947_0007.txt,txt_rstb,1947
it from this fact alone that the,that,rstb_1947_0007.txt,txt_rstb,1947
deduced from the fact that in a,that,rstb_1947_0007.txt,txt_rstb,1947
view is the fact that the coronal,that,rstb_1947_0007.txt,txt_rstb,1947
lithology and the fact that the larger,that,rstb_1947_0005.txt,txt_rstb,1947
"characters, on the fact that several are",that,rstb_1947_0005.txt,txt_rstb,1947
view of the fact that macroscopic characters,that,rstb_1947_0005.txt,txt_rstb,1947
change and the fact that division into,that,rstb_1947_0005.txt,txt_rstb,1947
view of the fact that no more,that,rstb_1947_0008.txt,txt_rstb,1947
"2, and the fact that all three",that,rstb_1947_0008.txt,txt_rstb,1947
agree with the fact that the only,that,rstb_1947_0008.txt,txt_rstb,1947
together with the fact that here the,that,rstb_1947_0008.txt,txt_rstb,1947
and by the fact that it is,that,rstb_1947_0008.txt,txt_rstb,1947
we explain the fact that the visual,that,rstb_1947_0004.txt,txt_rstb,1947
eyeball discloses the fact that there is,that,rstb_1947_0004.txt,txt_rstb,1947
"1904), namely, the fact that to most",that,rstb_1947_0004.txt,txt_rstb,1947
experiment emphasizes the fact that for loss,that,rstb_1947_0004.txt,txt_rstb,1947
associated with the fact that in the,that,rstb_1947_0004.txt,txt_rstb,1947
chromatic aberration The fact that a change,that,rstb_1947_0004.txt,txt_rstb,1947
unusual manner. The fact that this observer,that,rstb_1947_0004.txt,txt_rstb,1947
lies in the fact that it operates,that,rstb_1947_0004.txt,txt_rstb,1947
justified by the fact that the visual,that,rstb_1947_0004.txt,txt_rstb,1947
this case the fact that the white,that,rstb_1947_0004.txt,txt_rstb,1947
of account the fact that the green,that,rstb_1947_0004.txt,txt_rstb,1947
screen discloses the fact that no two,that,rstb_1947_0004.txt,txt_rstb,1947
and disregarding the fact that white and,that,rstb_1947_0004.txt,txt_rstb,1947
to be a fact that human vision,that,rstb_1947_0004.txt,txt_rstb,1947
into dominators. The fact that the latter,that,rstb_1947_0004.txt,txt_rstb,1947
receptor is the fact that this part,that,rstb_1947_0004.txt,txt_rstb,1947
"does, that in fact the composi- tion",that,rstb_1947_0004.txt,txt_rstb,1947
previously to the fact that yellow and,that,rstb_1947_0004.txt,txt_rstb,1947
"another, and the fact that the stimulus",that,rstb_1947_0004.txt,txt_rstb,1947
"then, using the fact that Jo with",that,rsta_1947_0005.txt,txt_rsta,1947
arises from the fact that 04/dy can,that,rsta_1947_0005.txt,txt_rsta,1947
essentially on the fact that the excess,that,rsta_1947_0005.txt,txt_rsta,1947
mosaic crystals. The fact that good divergent-beam,that,rsta_1947_0002.txt,txt_rsta,1947
and that the fact of this increase,that,rsta_1947_0002.txt,txt_rsta,1947
. by the fact that reflexions from,that,rsta_1947_0002.txt,txt_rsta,1947
"by the known fact that R[y,, ...,",that,rsta_1947_0004.txt,txt_rsta,1947
By expressing the fact that the discriminant,that,rsta_1947_0004.txt,txt_rsta,1947
= n. The fact that N n<m**,that,rsta_1947_0004.txt,txt_rsta,1947
"N,(m;n), and in fact that R,.M(m;n) <",that,rsta_1947_0004.txt,txt_rsta,1947
"follows from the fact that (qS,) aASc=",that,rsta_1947_0004.txt,txt_rsta,1947
Sdoubt by the fact that a case,that,rsta_1947_0004.txt,txt_rsta,1947
Theorem 20 The fact that p; =,that,rsta_1947_0004.txt,txt_rsta,1947
many elements.) The fact that the degree,that,rsta_1947_0004.txt,txt_rsta,1947
coupled with the fact that the discrimination,that,rsta_1947_0001.txt,txt_rsta,1947
"insect physiologist, the fact that certain species",that,rstb_1938_0005.txt,txt_rstb,1938
from this experiment—the fact that movements of,that,rstb_1938_0005.txt,txt_rstb,1938
in common the fact that they are,that,rstb_1938_0005.txt,txt_rstb,1938
due to the fact that at the,that,rstb_1938_0005.txt,txt_rstb,1938
outlined below. The fact that appreci- able,that,rstb_1938_0005.txt,txt_rstb,1938
graph is the fact that although the,that,rstb_1938_0005.txt,txt_rstb,1938
cannot be the fact that the females,that,rstb_1938_0005.txt,txt_rstb,1938
not alter the fact that throughout its,that,rstb_1938_0005.txt,txt_rstb,1938
nothing but the fact that they are,that,rstb_1938_0005.txt,txt_rstb,1938
interpretation concerns the fact that in the,that,rstb_1938_0005.txt,txt_rstb,1938
this action. The fact that animals may,that,rstb_1938_0005.txt,txt_rstb,1938
of the observable fact that under natural,that,rstb_1938_0005.txt,txt_rstb,1938
states that the fact that Trichogramma will,that,rstb_1938_0005.txt,txt_rstb,1938
It remains a fact that the overwhelming,that,rstb_1938_0005.txt,txt_rstb,1938
volume. But the fact that the chalcid,that,rstb_1938_0005.txt,txt_rstb,1938
supported by the fact that hosts containing,that,rstb_1938_0005.txt,txt_rstb,1938
clay and the fact that the more,that,rstb_1938_0006.txt,txt_rstb,1938
faced with the fact that a very,that,rstb_1938_0006.txt,txt_rstb,1938
the signi- ficant fact remains that oak,that,rstb_1938_0006.txt,txt_rstb,1938
Peterborough Museum. The fact that so much,that,rstb_1938_0006.txt,txt_rstb,1938
"difficult, and the fact that the fen",that,rstb_1938_0006.txt,txt_rstb,1938
most striking characteristics—the fact that between it,that,rstb_1938_0006.txt,txt_rstb,1938
"caused by the fact that the subsidence,",that,rstb_1938_0006.txt,txt_rstb,1938
complicated by the fact that dryness and,that,rstb_1938_0006.txt,txt_rstb,1938
found in the fact that in certain,that,rstb_1938_0004.txt,txt_rstb,1938
attention to the fact that sap from,that,rstb_1938_0004.txt,txt_rstb,1938
strain to the fact that they were,that,rstb_1938_0004.txt,txt_rstb,1938
is an interesting fact that old tobacco,that,rstb_1938_0004.txt,txt_rstb,1938
attention to the fact that many of,that,rstb_1938_0004.txt,txt_rstb,1938
due to the fact that the original,that,rstb_1938_0004.txt,txt_rstb,1938
"however, an interesting fact that whilst paracrinkle",that,rstb_1938_0004.txt,txt_rstb,1938
explanation of the fact that such infected,that,rstb_1938_0004.txt,txt_rstb,1938
virus by the fact that it would,that,rstb_1938_0004.txt,txt_rstb,1938
have emphasized the fact that the peculiar,that,rstb_1938_0004.txt,txt_rstb,1938
shown by the fact that inoculum from,that,rstb_1938_0004.txt,txt_rstb,1938
due to the fact that X° had,that,rstb_1938_0004.txt,txt_rstb,1938
made to the fact that during the,that,rstb_1938_0004.txt,txt_rstb,1938
explained by the fact that as soon,that,rstb_1938_0004.txt,txt_rstb,1938
Notwithstand- ing the fact that it is,that,rstb_1938_0004.txt,txt_rstb,1938
due to the fact that the virulent,that,rstb_1938_0004.txt,txt_rstb,1938
the repeatedly observed fact that whereas paracrinkle,that,rstb_1938_0004.txt,txt_rstb,1938
found in the fact that the ordinary,that,rstb_1938_0004.txt,txt_rstb,1938
of virus. The fact that such a,that,rstb_1938_0004.txt,txt_rstb,1938
"shown by the fact that simple inoculation,",that,rstb_1938_0004.txt,txt_rstb,1938
"suggested, to the fact that the prior",that,rstb_1938_0004.txt,txt_rstb,1938
"value, then the fact that X” does",that,rstb_1938_0004.txt,txt_rstb,1938
"is by the fact that X”¥, X?,",that,rstb_1938_0004.txt,txt_rstb,1938
virus disclose the fact that the strains,that,rstb_1938_0004.txt,txt_rstb,1938
brings out the fact that the valley,that,rstb_1938_0002.txt,txt_rstb,1938
due to the fact that the central,that,rstb_1938_0002.txt,txt_rstb,1938
attention to the fact that truncated spurs,that,rstb_1938_0002.txt,txt_rstb,1938
"Hill, and the fact that it is",that,rstb_1938_0002.txt,txt_rstb,1938
"1902, emphasized the fact that the nuées",that,rstb_1938_0002.txt,txt_rstb,1938
"suggested by the fact that Gage’s Lower,",that,rstb_1938_0002.txt,txt_rstb,1938
comment on the fact that their conclusions,that,rstb_1938_0002.txt,txt_rstb,1938
brown hornblende. The fact that the red-brown,that,rstb_1938_0002.txt,txt_rstb,1938
He stressed the fact that these pseudomorphs,that,rstb_1938_0002.txt,txt_rstb,1938
owing to the fact that diagnostic data,that,rstb_1938_0002.txt,txt_rstb,1938
accordance with the fact that the mineral,that,rstb_1938_0002.txt,txt_rstb,1938
due to the fact that much of,that,rstb_1938_0002.txt,txt_rstb,1938
mainly from the fact that many of,that,rstb_1938_0002.txt,txt_rstb,1938
brings out the fact that the main,that,rstb_1938_0002.txt,txt_rstb,1938
and that this fact is valuable in,that,rstb_1938_0002.txt,txt_rstb,1938
measure to the fact that the hour,that,rsta_1938_0002.txt,txt_rsta,1938
owing to the fact that most of,that,rsta_1938_0002.txt,txt_rsta,1938
due to the fact that in these,that,rsta_1938_0002.txt,txt_rsta,1938
as 1/r?. The fact that the observed,that,rsta_1938_0002.txt,txt_rsta,1938
either to the fact that owing to,that,rsta_1938_0002.txt,txt_rsta,1938
associated with the fact that the mean,that,rsta_1938_0002.txt,txt_rsta,1938
result of the fact that certain relationships,that,rsta_1938_0002.txt,txt_rsta,1938
have occurred. The fact that there are,that,rsta_1938_0002.txt,txt_rsta,1938
strengthened by the fact that in estimating,that,rsta_1938_0002.txt,txt_rsta,1938
magmatic pressure. The fact that seismic activity,that,rsta_1938_0002.txt,txt_rsta,1938
accounts for the fact that the disturbed,that,rsta_1938_0002.txt,txt_rsta,1938
lie in the fact that it would,that,rsta_1938_0002.txt,txt_rsta,1938
depends on the fact that the earth,that,rsta_1938_0002.txt,txt_rsta,1938
magnification and the fact that it registers,that,rsta_1938_0002.txt,txt_rsta,1938
Owing to the fact that alternate lines,that,rsta_1938_0014.txt,txt_rsta,1938
directly from the fact that the branches,that,rsta_1938_0014.txt,txt_rsta,1938
illustration of the fact that the Stark,that,rsta_1938_0001.txt,txt_rsta,1938
due to the fact that the above-mentioned,that,rsta_1938_0005.txt,txt_rsta,1938
"seen from the fact that In /,(«)",that,rsta_1938_0005.txt,txt_rsta,1938
due to the fact that these infinite,that,rsta_1938_0003.txt,txt_rsta,1938
due to the fact that when y,that,rsta_1938_0004.txt,txt_rsta,1938
view of the fact that these alternative,that,rsta_1938_0004.txt,txt_rsta,1938
lies in the fact that this determination,that,rsta_1938_0009.txt,txt_rsta,1938
corresponds to the fact that the edge,that,rsta_1938_0009.txt,txt_rsta,1938
taken of the fact that it is,that,rsta_1938_0009.txt,txt_rsta,1938
equivalent to the fact that the ground,that,rsta_1938_0009.txt,txt_rsta,1938
"predominant, and the fact that they are",that,rsta_1938_0009.txt,txt_rsta,1938
because of the fact that it is,that,rsta_1938_0013.txt,txt_rsta,1938
partly on the fact that that choice,that,rsta_1938_0013.txt,txt_rsta,1938
and that in fact they are derived,that,rsta_1938_0008.txt,txt_rsta,1938
account of the fact that the observations,that,rsta_1938_0008.txt,txt_rsta,1938
owing to the fact that I have,that,rsta_1938_0008.txt,txt_rsta,1938
due to the fact that the mean,that,rsta_1938_0008.txt,txt_rsta,1938
arise from the fact that in their,that,rsta_1938_0008.txt,txt_rsta,1938
due to the fact that the Type,that,rsta_1938_0008.txt,txt_rsta,1938
use of the fact that a series,that,rsta_1938_0008.txt,txt_rsta,1938
rests on the fact that “if a,that,rsta_1938_0007.txt,txt_rsta,1938
depends on the fact that in a,that,rsta_1938_0012.txt,txt_rsta,1938
becomes horizontal. The fact that the level,that,rsta_1938_0012.txt,txt_rsta,1938
N-axis expresses the fact that the quartic,that,rsta_1938_0012.txt,txt_rsta,1938
depends on the fact that what we,that,rsta_1938_0012.txt,txt_rsta,1938
spite of the fact that the direction,that,rsta_1938_0012.txt,txt_rsta,1938
spite of the fact that the planes,that,rsta_1938_0012.txt,txt_rsta,1938
owing to the fact that the wave,that,rsta_1938_0012.txt,txt_rsta,1938
arises from the fact that the values,that,rsta_1938_0012.txt,txt_rsta,1938
is based. The fact that reflexion is,that,rsta_1938_0012.txt,txt_rsta,1938
lying in the fact that the complete,that,rstb_1939_0006.txt,txt_rstb,1939
again to the fact that quercetin (3,that,rstb_1939_0006.txt,txt_rstb,1939
demonstrated by the fact that while over,that,rstb_1939_0006.txt,txt_rstb,1939
view of the fact that blue (generally,that,rstb_1939_0006.txt,txt_rstb,1939
far apart. The fact that the nitrogenous,that,rstb_1939_0006.txt,txt_rstb,1939
1. InrrRopucTION The fact that there are,that,rstb_1939_0003.txt,txt_rstb,1939
position is the fact that the cell,that,rstb_1939_0003.txt,txt_rstb,1939
result of the fact that it has,that,rstb_1939_0003.txt,txt_rstb,1939
"artefact, but the fact that the two",that,rstb_1939_0003.txt,txt_rstb,1939
of contact. The fact that there is,that,rstb_1939_0003.txt,txt_rstb,1939
up by the fact that the two,that,rstb_1939_0003.txt,txt_rstb,1939
found in the fact that they are,that,rstb_1939_0001.txt,txt_rstb,1939
for by the fact that either the,that,rstb_1939_0001.txt,txt_rstb,1939
known from the fact that the whole,that,rstb_1939_0001.txt,txt_rstb,1939
KENYA COLONY 237 fact remains that it,that,rstb_1939_0001.txt,txt_rstb,1939
basalts revealing the fact that they and,that,rstb_1939_0001.txt,txt_rstb,1939
due to the fact that they lie,that,rstb_1939_0001.txt,txt_rstb,1939
account of the fact that at some,that,rstb_1939_0001.txt,txt_rstb,1939
"deposits. Nevertheless, the fact that such primitive",that,rstb_1939_0001.txt,txt_rstb,1939
lies in the fact that it is,that,rstb_1939_0001.txt,txt_rstb,1939
account of the fact that Levallois artifacts,that,rstb_1939_0001.txt,txt_rstb,1939
inferred from the fact that the Basement,that,rstb_1939_0001.txt,txt_rstb,1939
"Nevertheless, the curious fact appears that the",that,rstb_1939_0001.txt,txt_rstb,1939
surrounding country. The fact that they have,that,rstb_1939_0001.txt,txt_rstb,1939
African Province. In fact I believe that,that,rstb_1939_0001.txt,txt_rstb,1939
important is the fact that where they,that,rstb_1939_0001.txt,txt_rstb,1939
taking place. The fact that the first,that,rstb_1939_0002.txt,txt_rstb,1939
shown by the fact that it begins,that,rstb_1939_0002.txt,txt_rstb,1939
owing to the fact that the pectoral,that,rstb_1939_0002.txt,txt_rstb,1939
more precisely. The fact that one explant,that,rstb_1939_0002.txt,txt_rstb,1939
spite of the fact that one-third of,that,rstb_1939_0002.txt,txt_rstb,1939
shown by the fact that the distance,that,rstb_1939_0002.txt,txt_rstb,1939
tissue by the fact that the cells,that,rstb_1939_0002.txt,txt_rstb,1939
due to the fact that in the,that,rstb_1939_0002.txt,txt_rstb,1939
partly to the fact that a large,that,rstb_1939_0002.txt,txt_rstb,1939
disproved by the fact that it appears,that,rstb_1939_0002.txt,txt_rstb,1939
due to the fact that the conditions,that,rstb_1939_0002.txt,txt_rstb,1939
demonstrated by the fact that the distance,that,rstb_1939_0002.txt,txt_rstb,1939
shown by the fact that all the,that,rstb_1939_0002.txt,txt_rstb,1939
perhaps to the fact that there is,that,rstb_1939_0002.txt,txt_rstb,1939
due to the fact that each is,that,rstb_1939_0007.txt,txt_rstb,1939
owing to the fact that the technique,that,rstb_1939_0007.txt,txt_rstb,1939
one turn. The fact that untwisting is,that,rstb_1939_0007.txt,txt_rstb,1939
"owing to the fact that the coils,",that,rstb_1939_0007.txt,txt_rstb,1939
certainly occurs. The fact that the chromosomes,that,rstb_1939_0007.txt,txt_rstb,1939
owing to the fact that the chromosome,that,rstb_1939_0007.txt,txt_rstb,1939
Appendix IT). The fact that ‘‘necks”’ are,that,rstb_1939_0007.txt,txt_rstb,1939
is the well-known fact that the most,that,rstb_1939_0007.txt,txt_rstb,1939
serious disadvantages. The fact that only one,that,rstb_1939_0007.txt,txt_rstb,1939
owing to the fact that a metaphase,that,rstb_1939_0007.txt,txt_rstb,1939
ignorance of the fact that in no,that,rstb_1939_0005.txt,txt_rstb,1939
statement disregards the fact that filtration of,that,rstb_1939_0005.txt,txt_rstb,1939
due to the fact that the adult,that,rstb_1939_0004.txt,txt_rstb,1939
view of the fact that the glands,that,rstb_1939_0004.txt,txt_rstb,1939
"impact, but the fact that Neumann bands",that,rsta_1939_0011.txt,txt_rsta,1939
than 5°-3. The fact that only one,that,rsta_1939_0011.txt,txt_rsta,1939
theory; while the fact that orientations of,that,rsta_1939_0011.txt,txt_rsta,1939
Widmanstatten structure. The fact that Widmanstatten figures,that,rsta_1939_0011.txt,txt_rsta,1939
origin to the fact that a {110}-plane,that,rsta_1939_0011.txt,txt_rsta,1939
complicated by the fact that four sets,that,rsta_1939_0010.txt,txt_rsta,1939
greater distances. The fact that a similar,that,rsta_1939_0009.txt,txt_rsta,1939
complicated by the fact that both positive,that,rsta_1939_0009.txt,txt_rsta,1939
it with the fact that many of,that,rsta_1939_0009.txt,txt_rsta,1939
essentially in the fact that in the,that,rsta_1939_0009.txt,txt_rsta,1939
based on the fact that the estimated,that,rsta_1939_0009.txt,txt_rsta,1939
owing to the fact that carbon monoxide,that,rsta_1939_0002.txt,txt_rsta,1939
owing to the fact that they decompose,that,rsta_1939_0002.txt,txt_rsta,1939
"composition, and the fact that they were",that,rsta_1939_0007.txt,txt_rsta,1939
"combustion, despite the fact that the lower",that,rsta_1939_0007.txt,txt_rsta,1939
view of the fact that Maass and,that,rsta_1939_0007.txt,txt_rsta,1939
owing to the fact that it was,that,rsta_1939_0005.txt,txt_rsta,1939
complicated by the fact that it was,that,rsta_1939_0005.txt,txt_rsta,1939
owing to the fact mentioned already that,that,rsta_1939_0001.txt,txt_rsta,1939
restricted by the fact that the induced,that,rsta_1939_0001.txt,txt_rsta,1939
evident from the fact that the relationship,that,rsta_1939_0004.txt,txt_rsta,1939
owing to the fact that air is,that,rsta_1939_0004.txt,txt_rsta,1939
due to the fact that the changes,that,rsta_1939_0004.txt,txt_rsta,1939
"view of the fact that invar, even",that,rsta_1939_0004.txt,txt_rsta,1939
due to the fact that air is,that,rsta_1939_0004.txt,txt_rsta,1939
"Tilton, despite the fact that the observed",that,rsta_1939_0004.txt,txt_rsta,1939
supported by the fact that the palatoquadrate,that,rstb_1940_0004.txt,txt_rstb,1940
is a significant fact that among contemporaneous,that,rstb_1940_0004.txt,txt_rstb,1940
be added the fact that the hyomandibular,that,rstb_1940_0004.txt,txt_rstb,1940
spite of the fact that the possible,that,rstb_1940_0002.txt,txt_rstb,1940
bones and the fact that the ‘‘,that,rstb_1940_0002.txt,txt_rstb,1940
"1938). First, the fact that the palatine",that,rstb_1940_0002.txt,txt_rstb,1940
placed on the fact that the vomer,that,rstb_1940_0002.txt,txt_rstb,1940
cartilaginous neurocranium. The fact that the embryo-,that,rstb_1940_0002.txt,txt_rstb,1940
"(Arpt), and the fact that the greatly",that,rstb_1940_0002.txt,txt_rstb,1940
"nevertheless, a striking fact that similar changes",that,rstb_1940_0001.txt,txt_rstb,1940
supported by the fact that the curve,that,rstb_1940_0001.txt,txt_rstb,1940
supported by the fact that the peat,that,rstb_1940_0001.txt,txt_rstb,1940
supported by the fact that late medieval,that,rstb_1940_0001.txt,txt_rstb,1940
graph is the fact that it should,that,rstb_1940_0001.txt,txt_rstb,1940
is a striking fact that the silts,that,rstb_1940_0001.txt,txt_rstb,1940
Owing to the fact that the spread,that,rsta_1940_0009.txt,txt_rsta,1940
owing to the fact that levels denoted,that,rsta_1940_0009.txt,txt_rsta,1940
obviously to the fact that we are,that,rsta_1940_0009.txt,txt_rsta,1940
consists in the fact that the curve,that,rsta_1940_0009.txt,txt_rsta,1940
"error. Also, the fact that the shift",that,rsta_1940_0009.txt,txt_rsta,1940
points to the fact that this may,that,rsta_1940_0009.txt,txt_rsta,1940
forbidden. The observed fact that the filling,that,rsta_1940_0009.txt,txt_rsta,1940
owing to the fact that a really,that,rsta_1940_0009.txt,txt_rsta,1940
account of the fact that if the,that,rsta_1940_0009.txt,txt_rsta,1940
be applicable. The fact that it gives,that,rsta_1940_0009.txt,txt_rsta,1940
"referred to the fact that the N,,,(Z)",that,rsta_1940_0009.txt,txt_rsta,1940
correct for the fact that the band,that,rsta_1940_0009.txt,txt_rsta,1940
identical. But the fact that the two,that,rsta_1940_0010.txt,txt_rsta,1940
suggested by the fact that spinastanol also,that,rsta_1940_0010.txt,txt_rsta,1940
pattern is the fact that the new,that,rsta_1940_0010.txt,txt_rsta,1940
due to the fact that a small,that,rsta_1940_0007.txt,txt_rsta,1940
from occurring. The fact that an e.m.f.,that,rsta_1940_0007.txt,txt_rsta,1940
supported by the fact that the addition,that,rsta_1940_0007.txt,txt_rsta,1940
the surfaces. The fact that an electromotive,that,rsta_1940_0007.txt,txt_rsta,1940
the load. The fact that the track,that,rsta_1940_0007.txt,txt_rsta,1940
complicated by the fact that the strength,that,rsta_1940_0007.txt,txt_rsta,1940
also by the fact that at the,that,rsta_1940_0007.txt,txt_rsta,1940
sliding solids. The fact that friction is,that,rsta_1940_0007.txt,txt_rsta,1940
due to the fact that they use,that,rsta_1940_0005.txt,txt_rsta,1940
arising from the fact that the values,that,rsta_1940_0004.txt,txt_rsta,1940
taken of the fact that there is,that,rsta_1940_0004.txt,txt_rsta,1940
doubt by the fact that the amplitudes,that,rsta_1940_0004.txt,txt_rsta,1940
(judging from the fact that the solution,that,rsta_1940_0004.txt,txt_rsta,1940
Another highly confirmatory fact is that the,that,rsta_1940_0004.txt,txt_rsta,1940
"made of the fact that log A,",that,rsta_1940_0003.txt,txt_rsta,1940
necessary) of the fact that log /,that,rsta_1940_0003.txt,txt_rsta,1940
ened by the fact that the refracted,that,rsta_1940_0008.txt,txt_rsta,1940
and by the fact that the refracted,that,rsta_1940_0008.txt,txt_rsta,1940
"semicircular path. The fact that we get,",that,rsta_1940_0001.txt,txt_rsta,1940
distinguished by the fact that the machine,that,rsta_1940_0001.txt,txt_rsta,1940
