Context,Word,File,Directory
"paper, containing a variety of facts and experiments, which I have",of,Unknown,Unknown
to ascertain the fol- lowing facts : 1. What degree of,of,Unknown,Unknown
"But, instead of meeting with facts which could disprove my opinion,",of,Unknown,Unknown
"confirmed by reasonings drawn from facts and experience, is the object",the,Unknown,Unknown
to ascertain the fol- lowing facts : 1. What degree of,the,Unknown,Unknown
"Carnatic, thobgh 1 admit such facts require the * {rongelt teftimony",the,Unknown,Unknown
