Context,Word,File,Directory
of the straw-coloured (ilk. ©. Facts similar to these are observable,the,Unknown,Unknown
"shall take care that the facts shall be faithfully described, and",the,Unknown,Unknown
"is by the accumulation of facts f this kind, and efpecially",the,Unknown,Unknown
"So ""2b of the above-mentioned faCts were observed in the Fear",the,Unknown,Unknown
"Journal, March 1989. Among the facts adduced by Dis celebrated mineralogist",the,Unknown,Unknown
air. The discovery of these facts established this elastic fluid to,the,rstl_1792_0019.txt,txt_rstl
"I have not ascertained the facts with equal satisfaction, the experiments",the,rstl_1792_0019.txt,txt_rstl
unelectrified this day: and the facts and appearances have been nearly,the,Unknown,Unknown
occurred Zin mine. The threefollowing facts appear much against their probability,the,Unknown,Unknown
"it is from all these facts reasonable to suppose, the male",the,Unknown,Unknown
the discovery of any new facts relative to these operations. If,the,Unknown,Unknown
Having now stated all the facts relative to phosphorescent bodies which,the,rstl_1792_0006.txt,txt_rstl
