Context,Collocate,File,Directory,Year,Frequency Filter
"into the Earth. | Theſe Facts being fo, if my '",theſe,rstl_1746_0119.txt,txt_rstl,1746,8
"own opi- nions, Theſe are facts confider'd in themſelves in- dependently",theſe,rstl_1751_0066.txt,txt_rstl,1751,8
with amazement on reading theſe facts : but my ſurprize was,theſe,rstl_1751_0013.txt,txt_rstl,1751,8
"activity by evaporation. Theſe two facts plainly ſhew, how much precau-",theſe,rstl_1751_0013.txt,txt_rstl,1751,8
"in the former, From theſe facts it is eaſy to draw",theſe,rstl_1755_0043.txt,txt_rstl,1755,8
ever conſtant. Theſe were the facts ſtrongly atteſted by the com-,theſe,rstl_1755_0012.txt,txt_rstl,1755,8
"the Reality | of certain Facts publiſhed-in 1raly, and which have",which,rstl_1749_0074.txt,txt_rstl,1749,8
"of his Opinion:""Bur among the Facts which he colleds in his",which,rstl_1749_0074.txt,txt_rstl,1749,8
who arc Witneſſes of the Facts here mentioned. The Drawing (Tas.,the,rstl_1746_0097.txt,txt_rstl,1746,8
"into the Earth. | Theſe Facts being fo, if my '",the,rstl_1746_0119.txt,txt_rstl,1746,8
"draw Concluſions but from the Facts themſelves, it was determined to",the,rstl_1748_0004.txt,txt_rstl,1748,8
_into the Truth of the Facts here related. Andit is a,the,rstl_1748_0002.txt,txt_rstl,1748,8
"the Reality | of certain Facts publiſhed-in 1raly, and which have",the,rstl_1749_0074.txt,txt_rstl,1749,8
"of his Opinion:""Bur among the Facts which he colleds in his",the,rstl_1749_0074.txt,txt_rstl,1749,8
they will find the main facts properly vouched. Mr. Bright was,the,rstl_1751_0028.txt,txt_rstl,1751,8
"judgment and obſervation, the following facts : That having been in",the,rstl_1751_0007.txt,txt_rstl,1751,8
"in the former, From theſe facts it is eaſy to draw",the,rstl_1755_0043.txt,txt_rstl,1755,8
he wanted the recommendation of facts to ſupport and enforce it,the,rstl_1755_0036.txt,txt_rstl,1755,8
ever conſtant. Theſe were the facts ſtrongly atteſted by the com-,the,rstl_1755_0012.txt,txt_rstl,1755,8
who arc Witneſſes of the Facts here mentioned. The Drawing (Tas.,of,rstl_1746_0097.txt,txt_rstl,1746,8
_into the Truth of the Facts here related. Andit is a,of,rstl_1748_0002.txt,txt_rstl,1748,8
"the Reality | of certain Facts publiſhed-in 1raly, and which have",of,rstl_1749_0074.txt,txt_rstl,1749,8
"of his Opinion:""Bur among the Facts which he colleds in his",of,rstl_1749_0074.txt,txt_rstl,1749,8
with a great number of facts in proof of this. He,of,rstl_1755_0089.txt,txt_rstl,1755,8
he wanted the recommendation of facts to ſupport and enforce it,of,rstl_1755_0036.txt,txt_rstl,1755,8
