Context,Collocate,File,Directory,Year
the urine alkaline; and from facts which have been stated to,and,rstl_1845_0015.txt,txt_rstl,1845
at a knowledge of these facts I have repeated and varied,and,rstl_1845_0013.txt,txt_rstl,1845
and the explanation of the facts is as follows :— Whatever,and,rstl_1845_0013.txt,txt_rstl,1845
"general tenor of the preceding facts and observations, to maintain with",and,rstl_1845_0007.txt,txt_rstl,1845
this instance adopted. Now the facts and observations detailed in the,and,rstl_1845_0007.txt,txt_rstl,1845
"great, addition made to the facts and considerations which tend to",and,rstl_1846_0001.txt,txt_rstl,1846
acknow- ledge M. Becarzrr's important facts and labours in reference to,and,rstl_1846_0003.txt,txt_rstl,1846
"equatorial position : and the facts with regard to bodies generally,",and,rstl_1846_0003.txt,txt_rstl,1846
"T have suggested of the facts described be '> correct, and",and,rstl_1846_0024.txt,txt_rstl,1846
"and the bearing of the facts now related, to dis- sent",and,rstl_1846_0025.txt,txt_rstl,1846
the simplest and most elementary facts in s0 yast a field,and,rstl_1846_0026.txt,txt_rstl,1846
This Jast and the preceding facts establish the connection between the,and,rstl_1847_0014.txt,txt_rstl,1847
I would here recall the facts discovered by M. Loxcer and,and,rstl_1847_0013.txt,txt_rstl,1847
"July and August. From the facts here brought forward, it may",and,rstl_1847_0006.txt,txt_rstl,1847
and Fovcavrr observed some remarkable facts of the same kind on,and,rstl_1847_0004.txt,txt_rstl,1847
"The very singular and unexpected facts now detailed, merit attention and",and,rstl_1847_0011.txt,txt_rstl,1847
pletely set aside by the facts and arguments which have been,and,rstl_1848_0019.txt,txt_rstl,1848
"probable, has by the same facts and arguments been proved to",and,rstl_1848_0019.txt,txt_rstl,1848
and the bearing of the facts described on the still mooted,and,rstl_1848_0012.txt,txt_rstl,1848
combines these and many other facts respecting the tides into a,and,rstl_1848_0001.txt,txt_rstl,1848
hope and believe that the facts about to be brought forward,and,rstl_1849_0023.txt,txt_rstl,1849
"and teeth of Macropoma. These facts (if correctly interpreted, and T",and,rstl_1849_0023.txt,txt_rstl,1849
"substituting truth for error, and facts for hypotheses, that correct principles",and,rstl_1849_0015.txt,txt_rstl,1849
"But the next section records facts which, if established by future",by,rstl_1840_0025.txt,txt_rstl,1840
"attention. Taking adyantage of the facts pointed out by Wonrer®, I",by,rstl_1840_0017.txt,txt_rstl,1840
shall have brought for- ward facts and analytical results by which,by,rstl_1840_0020.txt,txt_rstl,1840
have appeared to consider the facts brought out by the experiments,by,rstl_1840_0014.txt,txt_rstl,1840
theoretical. < As the experimental facts observed by myself differ from,by,rstl_1840_0013.txt,txt_rstl,1840
it must be by the facts made known in this memoir—affects,by,rstl_1840_0024.txt,txt_rstl,1840
"by any independent measurement or facts (1808.), but only by the",by,rstl_1840_0003.txt,txt_rstl,1840
experiment. 1849. Proceeding on the facts made known by ScaaNBEIN respecting,by,rstl_1840_0003.txt,txt_rstl,1840
"resolved. Notwithstanding these differences, however, facts mentioned by authors regarding the",by,rstl_1841_0017.txt,txt_rstl,1841
"explained, I believe, by the facts above mentioned: as well as",by,rstl_1842_0008.txt,txt_rstl,1842
relation is confirmed by the facts detailed in the paper of,by,rstl_1843_0009.txt,txt_rstl,1843
"by publication some of the facts which I also have obtained,",by,rstl_1843_0004.txt,txt_rstl,1843
the abdominal nervous cord. The facts ascertained by Mr. Lonp were,by,rstl_1843_0013.txt,txt_rstl,1843
"'the Cephalopodal organization, the additional facts afforded by the well-preserved specimens",by,rstl_1844_0006.txt,txt_rstl,1844
"microscopic investigation, or by any facts like that above cited, it",by,rstl_1844_0006.txt,txt_rstl,1844
by an important class of facts which next fell under our,by,rstl_1844_0001.txt,txt_rstl,1844
simplest interpretation of all the facts discovered by myself ; it,by,rstl_1845_0011.txt,txt_rstl,1845
easily accounted for by the facts already stated of irregular composition,by,rstl_1845_0006.txt,txt_rstl,1845
"may be countenanced by the facts detailed in the text, but",by,rstl_1845_0007.txt,txt_rstl,1845
to 089 inch. As the facts shown by these observations are,by,rstl_1846_0020.txt,txt_rstl,1846
vessels in the neighbourhood. These facts were demonstrated by preparations at,by,rstl_1846_0017.txt,txt_rstl,1846
"the entire organ, These same facts are verified also by including",by,rstl_1847_0014.txt,txt_rstl,1847
am able to prove by facts of a very positive nature.,by,rstl_1847_0017.txt,txt_rstl,1847
fixation of mercurial vapour. The facts pointed out by M. Gavpin,by,rstl_1847_0017.txt,txt_rstl,1847
I would here recall the facts discovered by M. Loxcer and,by,rstl_1847_0013.txt,txt_rstl,1847
pletely set aside by the facts and arguments which have been,by,rstl_1848_0019.txt,txt_rstl,1848
"probable, has by the same facts and arguments been proved to",by,rstl_1848_0019.txt,txt_rstl,1848
as we cannot know what facts are designated by such terms,by,rstl_1848_0001.txt,txt_rstl,1848
to ganoid seales.” The new facts brought forward by Professor Owex,by,rstl_1849_0023.txt,txt_rstl,1849
"But the next section records facts which, if established by future",by,rstl_1840_0025.txt,txt_rstl,1840
"attention. Taking adyantage of the facts pointed out by Wonrer®, I",by,rstl_1840_0017.txt,txt_rstl,1840
shall have brought for- ward facts and analytical results by which,by,rstl_1840_0020.txt,txt_rstl,1840
have appeared to consider the facts brought out by the experiments,by,rstl_1840_0014.txt,txt_rstl,1840
theoretical. < As the experimental facts observed by myself differ from,by,rstl_1840_0013.txt,txt_rstl,1840
it must be by the facts made known in this memoir—affects,by,rstl_1840_0024.txt,txt_rstl,1840
"by any independent measurement or facts (1808.), but only by the",by,rstl_1840_0003.txt,txt_rstl,1840
experiment. 1849. Proceeding on the facts made known by ScaaNBEIN respecting,by,rstl_1840_0003.txt,txt_rstl,1840
"resolved. Notwithstanding these differences, however, facts mentioned by authors regarding the",by,rstl_1841_0017.txt,txt_rstl,1841
"explained, I believe, by the facts above mentioned: as well as",by,rstl_1842_0008.txt,txt_rstl,1842
relation is confirmed by the facts detailed in the paper of,by,rstl_1843_0009.txt,txt_rstl,1843
"by publication some of the facts which I also have obtained,",by,rstl_1843_0004.txt,txt_rstl,1843
the abdominal nervous cord. The facts ascertained by Mr. Lonp were,by,rstl_1843_0013.txt,txt_rstl,1843
"'the Cephalopodal organization, the additional facts afforded by the well-preserved specimens",by,rstl_1844_0006.txt,txt_rstl,1844
"microscopic investigation, or by any facts like that above cited, it",by,rstl_1844_0006.txt,txt_rstl,1844
by an important class of facts which next fell under our,by,rstl_1844_0001.txt,txt_rstl,1844
simplest interpretation of all the facts discovered by myself ; it,by,rstl_1845_0011.txt,txt_rstl,1845
easily accounted for by the facts already stated of irregular composition,by,rstl_1845_0006.txt,txt_rstl,1845
"may be countenanced by the facts detailed in the text, but",by,rstl_1845_0007.txt,txt_rstl,1845
to 089 inch. As the facts shown by these observations are,by,rstl_1846_0020.txt,txt_rstl,1846
vessels in the neighbourhood. These facts were demonstrated by preparations at,by,rstl_1846_0017.txt,txt_rstl,1846
"the entire organ, These same facts are verified also by including",by,rstl_1847_0014.txt,txt_rstl,1847
am able to prove by facts of a very positive nature.,by,rstl_1847_0017.txt,txt_rstl,1847
fixation of mercurial vapour. The facts pointed out by M. Gavpin,by,rstl_1847_0017.txt,txt_rstl,1847
I would here recall the facts discovered by M. Loxcer and,by,rstl_1847_0013.txt,txt_rstl,1847
pletely set aside by the facts and arguments which have been,by,rstl_1848_0019.txt,txt_rstl,1848
"probable, has by the same facts and arguments been proved to",by,rstl_1848_0019.txt,txt_rstl,1848
as we cannot know what facts are designated by such terms,by,rstl_1848_0001.txt,txt_rstl,1848
to ganoid seales.” The new facts brought forward by Professor Owex,by,rstl_1849_0023.txt,txt_rstl,1849
1 have now to record facts which in some of the,of,rstl_1840_0025.txt,txt_rstl,1840
am not aware of any facts having been observed which warranted,of,rstl_1840_0025.txt,txt_rstl,1840
functions of those tissnes. 'The facts made known in the present,of,rstl_1840_0025.txt,txt_rstl,1840
"attention. Taking adyantage of the facts pointed out by Wonrer®, I",of,rstl_1840_0017.txt,txt_rstl,1840
in these early papers. Those facts I am now desirous of,of,rstl_1840_0014.txt,txt_rstl,1840
"function, we are inattentive to facts of daily occurrence. To take",of,rstl_1840_0014.txt,txt_rstl,1840
common case of hemiplegia. Such facts countenance the view which was,of,rstl_1840_0014.txt,txt_rstl,1840
the obser- vation of the facts was with me long anterior,of,rstl_1840_0013.txt,txt_rstl,1840
in the perception of experimental facts not wholly coinciding with Sir,of,rstl_1840_0013.txt,txt_rstl,1840
to determine how far the facts elicited are of ge- neral,of,rstl_1840_0022.txt,txt_rstl,1840
of some of the foregoing Facts to the Physiology of Cells.,of,rstl_1840_0024.txt,txt_rstl,1840
present memoir is full of facts demonstrating that division is a,of,rstl_1840_0024.txt,txt_rstl,1840
"of the lichen products, any facts belonging to the substance found",of,rstl_1840_0016.txt,txt_rstl,1840
satisfactory explanation of all the facts be given. That deoxidation is,of,rstl_1840_0016.txt,txt_rstl,1840
"zealous in his production of facts and arguments, from the year",of,rstl_1840_0003.txt,txt_rstl,1840
"not controversial, but contains further facts and proofs of the truth",of,rstl_1840_0003.txt,txt_rstl,1840
of the enormous body of facts which appear to me to,of,rstl_1840_0003.txt,txt_rstl,1840
"contortions of the string of facts (1874. 1956. 1992. 2006. 2063.),",of,rstl_1840_0004.txt,txt_rstl,1840
METALLIC CONTACT. 115 observations and facts to show the number of,of,rstl_1840_0004.txt,txt_rstl,1840
"mere-contact excitement, derivable from the facts of thermo electricity, remains, since",of,rstl_1840_0004.txt,txt_rstl,1840
"Dr. Rocer is, upon the facts of the science, a sup-",of,rstl_1840_0004.txt,txt_rstl,1840
record a number of insulated facts and observations respecting the relations,of,rstl_1840_0002.txt,txt_rstl,1840
"of M. Dacuerre's discovery. The facts themselves, in the present state",of,rstl_1840_0002.txt,txt_rstl,1840
"time, a number of interesting facts have been en- countered in",of,rstl_1840_0002.txt,txt_rstl,1840
"of no small interest. The facts I am about to recite,",of,rstl_1840_0002.txt,txt_rstl,1840
of urea 6 Whether these facts have any connexion with the,of,rstl_1840_0002.txt,txt_rstl,1840
"enhances the value of any facts bearing on this obscure point,",of,rstl_1841_0009.txt,txt_rstl,1841
corpuscles of the blood. Those facts were of a character which,of,rstl_1841_0018.txt,txt_rstl,1841
On a review of the facts stated in the course of,of,rstl_1841_0018.txt,txt_rstl,1841
granules of the yelk. The facts recorded in the foregoing memoir,of,rstl_1841_0018.txt,txt_rstl,1841
have added but few new facts in this department of my,of,rstl_1841_0015.txt,txt_rstl,1841
of the embryo that the facts ascertained appear to be of,of,rstl_1841_0012.txt,txt_rstl,1841
have noticed the important additional facts of the detection of the,of,rstl_1841_0012.txt,txt_rstl,1841
produce such division. 97. But facts recorded in several of my,of,rstl_1841_0019.txt,txt_rstl,1841
as fibrous tissues. 174. Other facts observable in an examination of,of,rstl_1841_0019.txt,txt_rstl,1841
"find that, while bringing forward facts opposed to the views of",of,rstl_1841_0019.txt,txt_rstl,1841
I in pos- ses8ion of facts connected with the process of,of,rstl_1841_0019.txt,txt_rstl,1841
higher tribes of animals. 'These facts I had the honour of,of,rstl_1842_0014.txt,txt_rstl,1842
"protochloride of palladium developes some facts of considerable interest, It is",of,rstl_1842_0016.txt,txt_rstl,1842
"of a Postscript, some additional facts illustrative of the singular properties",of,rstl_1842_0013.txt,txt_rstl,1842
of Extinction. 84. Many familiar facts connected with the extinction of,of,rstl_1842_0015.txt,txt_rstl,1842
"doubt, almost any series of facts might be re- presented, and",of,rstl_1842_0015.txt,txt_rstl,1842
"whole, it appears from the facts and reasonings of this paper,",of,rstl_1842_0015.txt,txt_rstl,1842
Insecta (a kind of Caterpillar). Facts observed in the Formation and,of,rstl_1842_0008.txt,txt_rstl,1842
the same mode of origin. Facts observed in the Structure of,of,rstl_1842_0008.txt,txt_rstl,1842
saw the objects in question. Facts observed in the Coagulation of,of,rstl_1842_0008.txt,txt_rstl,1842
of the physical sciences the facts of observation and experiment have,of,rstl_1843_0014.txt,txt_rstl,1843
relation is confirmed by the facts detailed in the paper of,of,rstl_1843_0009.txt,txt_rstl,1843
the whole tenor of voltaic facts and general experience. Another point,of,rstl_1843_0009.txt,txt_rstl,1843
"by publication some of the facts which I also have obtained,",of,rstl_1843_0004.txt,txt_rstl,1843
"the attention of physiologists, certain facts appear, nevertheless, to have been",of,rstl_1843_0013.txt,txt_rstl,1843
divisions of Myriapoda. These additional facts fully accord with the already,of,rstl_1843_0013.txt,txt_rstl,1843
is however one of several facts which have presented themselves in,of,rstl_1843_0011.txt,txt_rstl,1843
"the whole tenor of voltaic facts and genera] experience.” 24, I",of,rstl_1844_0003.txt,txt_rstl,1844
we have before us certain facts connected with the action of,of,rstl_1844_0003.txt,txt_rstl,1844
"of lead in Solution. These facts are well known, and prove",of,rstl_1844_0002.txt,txt_rstl,1844
by an important class of facts which next fell under our,of,rstl_1844_0001.txt,txt_rstl,1844
"exclusion of the anion. These facts are, we believe, irreconcilable with",of,rstl_1844_0001.txt,txt_rstl,1844
place distinctly before our minds facts of which the explanation mnst,of,rstl_1844_0007.txt,txt_rstl,1844
From the sum of these facts I am again forced to,of,rstl_1845_0012.txt,txt_rstl,1845
of the happy temperate mean.:..Some facts which I sball have presently,of,rstl_1845_0014.txt,txt_rstl,1845
"From the whole of these facts I was led to conclude,",of,rstl_1845_0013.txt,txt_rstl,1845
at a knowledge of these facts I have repeated and varied,of,rstl_1845_0013.txt,txt_rstl,1845
and the explanation of the facts is as follows :— Whatever,of,rstl_1845_0013.txt,txt_rstl,1845
described a long series of facts relative to the cireumstances that,of,rstl_1845_0013.txt,txt_rstl,1845
simplest interpretation of all the facts discovered by myself ; it,of,rstl_1845_0011.txt,txt_rstl,1845
however to some of the facts connected with observations at different,of,rstl_1845_0010.txt,txt_rstl,1845
easily accounted for by the facts already stated of irregular composition,of,rstl_1845_0006.txt,txt_rstl,1845
upon the truth of the facts on which the doctrine of,of,rstl_1845_0007.txt,txt_rstl,1845
of reconciling it with many facts or opinions that seemed current,of,rstl_1845_0007.txt,txt_rstl,1845
"general tenor of the preceding facts and observations, to maintain with",of,rstl_1845_0007.txt,txt_rstl,1845
"the development of the principal facts of diurnal tide. Finally, that",of,rstl_1845_0001.txt,txt_rstl,1845
"formed :— From the ordinary facts of the tides, it seems",of,rstl_1845_0001.txt,txt_rstl,1845
to the bearing of the facts I have now related on,of,rstl_1846_0005.txt,txt_rstl,1846
"T have suggested of the facts described be '> correct, and",of,rstl_1846_0024.txt,txt_rstl,1846
"and the bearing of the facts now related, to dis- sent",of,rstl_1846_0025.txt,txt_rstl,1846
"say, the greatest number of facts possible from the smallest number",of,rstl_1846_0026.txt,txt_rstl,1846
see the application of these facts to the vocal apparatus. We,of,rstl_1846_0028.txt,txt_rstl,1846
collections of Ganglia.—From the foregoing facts it will appear that a,of,rstl_1846_0017.txt,txt_rstl,1846
a correct statement of the facts *. My attention was at,of,rstl_1846_0013.txt,txt_rstl,1846
play of forces. The following facts appear to me quite conclu-,of,rstl_1846_0013.txt,txt_rstl,1846
"are to investigations into the facts of terrestrial mag- netism, I",of,rstl_1846_0018.txt,txt_rstl,1846
of a certain number of facts lately discovered on the electricity,of,rstl_1847_0014.txt,txt_rstl,1847
of expo- sition of the facts in this memoir will be,of,rstl_1847_0014.txt,txt_rstl,1847
"Virginia, adding several other analogous facts confirming the theory of a",of,rstl_1847_0017.txt,txt_rstl,1847
am able to prove by facts of a very positive nature.,of,rstl_1847_0017.txt,txt_rstl,1847
fixation of mercurial vapour. The facts pointed out by M. Gavpin,of,rstl_1847_0017.txt,txt_rstl,1847
be an extensive series of facts which afford Strong hope of,of,rstl_1847_0002.txt,txt_rstl,1847
and Fovcavrr observed some remarkable facts of the same kind on,of,rstl_1847_0004.txt,txt_rstl,1847
"of founding this opinion on facts of a different kind, I",of,rstl_1847_0004.txt,txt_rstl,1847
of a sufficient number of facts to decide on the direction,of,rstl_1847_0009.txt,txt_rstl,1847
lowing experiment containing the principal facts worthy of notice will be,of,rstl_1848_0017.txt,txt_rstl,1848
and the bearing of the facts described on the still mooted,of,rstl_1848_0012.txt,txt_rstl,1848
very close approximation to the facts of nature. There is a,of,rstl_1848_0008.txt,txt_rstl,1848
exactly the reverse of the facts which take place at the,of,rstl_1848_0008.txt,txt_rstl,1848
as to include the following facts of observation :— (1.) The,of,rstl_1848_0001.txt,txt_rstl,1848
irregularity or complexity of the facts themselves. With regard to the,of,rstl_1848_0001.txt,txt_rstl,1848
":—the collec- tion of the facts then known, given in the",of,rstl_1848_0001.txt,txt_rstl,1848
pass through the tissue. These facts of course do away with,of,rstl_1849_0023.txt,txt_rstl,1849
"and teeth of Macropoma. These facts (if correctly interpreted, and T",of,rstl_1849_0023.txt,txt_rstl,1849
the true explanation of the facts which have been thus pointed,of,rstl_1849_0012.txt,txt_rstl,1849
"been thus pointed out, the facts themselves are highly deserving of",of,rstl_1849_0012.txt,txt_rstl,1849
1 have now to record facts which in some of the,of,rstl_1840_0025.txt,txt_rstl,1840
am not aware of any facts having been observed which warranted,of,rstl_1840_0025.txt,txt_rstl,1840
functions of those tissnes. 'The facts made known in the present,of,rstl_1840_0025.txt,txt_rstl,1840
"attention. Taking adyantage of the facts pointed out by Wonrer®, I",of,rstl_1840_0017.txt,txt_rstl,1840
in these early papers. Those facts I am now desirous of,of,rstl_1840_0014.txt,txt_rstl,1840
"function, we are inattentive to facts of daily occurrence. To take",of,rstl_1840_0014.txt,txt_rstl,1840
common case of hemiplegia. Such facts countenance the view which was,of,rstl_1840_0014.txt,txt_rstl,1840
the obser- vation of the facts was with me long anterior,of,rstl_1840_0013.txt,txt_rstl,1840
in the perception of experimental facts not wholly coinciding with Sir,of,rstl_1840_0013.txt,txt_rstl,1840
to determine how far the facts elicited are of ge- neral,of,rstl_1840_0022.txt,txt_rstl,1840
of some of the foregoing Facts to the Physiology of Cells.,of,rstl_1840_0024.txt,txt_rstl,1840
present memoir is full of facts demonstrating that division is a,of,rstl_1840_0024.txt,txt_rstl,1840
"of the lichen products, any facts belonging to the substance found",of,rstl_1840_0016.txt,txt_rstl,1840
satisfactory explanation of all the facts be given. That deoxidation is,of,rstl_1840_0016.txt,txt_rstl,1840
"zealous in his production of facts and arguments, from the year",of,rstl_1840_0003.txt,txt_rstl,1840
"not controversial, but contains further facts and proofs of the truth",of,rstl_1840_0003.txt,txt_rstl,1840
of the enormous body of facts which appear to me to,of,rstl_1840_0003.txt,txt_rstl,1840
"contortions of the string of facts (1874. 1956. 1992. 2006. 2063.),",of,rstl_1840_0004.txt,txt_rstl,1840
METALLIC CONTACT. 115 observations and facts to show the number of,of,rstl_1840_0004.txt,txt_rstl,1840
"mere-contact excitement, derivable from the facts of thermo electricity, remains, since",of,rstl_1840_0004.txt,txt_rstl,1840
"Dr. Rocer is, upon the facts of the science, a sup-",of,rstl_1840_0004.txt,txt_rstl,1840
record a number of insulated facts and observations respecting the relations,of,rstl_1840_0002.txt,txt_rstl,1840
"of M. Dacuerre's discovery. The facts themselves, in the present state",of,rstl_1840_0002.txt,txt_rstl,1840
"time, a number of interesting facts have been en- countered in",of,rstl_1840_0002.txt,txt_rstl,1840
"of no small interest. The facts I am about to recite,",of,rstl_1840_0002.txt,txt_rstl,1840
of urea 6 Whether these facts have any connexion with the,of,rstl_1840_0002.txt,txt_rstl,1840
"enhances the value of any facts bearing on this obscure point,",of,rstl_1841_0009.txt,txt_rstl,1841
corpuscles of the blood. Those facts were of a character which,of,rstl_1841_0018.txt,txt_rstl,1841
On a review of the facts stated in the course of,of,rstl_1841_0018.txt,txt_rstl,1841
granules of the yelk. The facts recorded in the foregoing memoir,of,rstl_1841_0018.txt,txt_rstl,1841
have added but few new facts in this department of my,of,rstl_1841_0015.txt,txt_rstl,1841
of the embryo that the facts ascertained appear to be of,of,rstl_1841_0012.txt,txt_rstl,1841
have noticed the important additional facts of the detection of the,of,rstl_1841_0012.txt,txt_rstl,1841
produce such division. 97. But facts recorded in several of my,of,rstl_1841_0019.txt,txt_rstl,1841
as fibrous tissues. 174. Other facts observable in an examination of,of,rstl_1841_0019.txt,txt_rstl,1841
"find that, while bringing forward facts opposed to the views of",of,rstl_1841_0019.txt,txt_rstl,1841
I in pos- ses8ion of facts connected with the process of,of,rstl_1841_0019.txt,txt_rstl,1841
higher tribes of animals. 'These facts I had the honour of,of,rstl_1842_0014.txt,txt_rstl,1842
"protochloride of palladium developes some facts of considerable interest, It is",of,rstl_1842_0016.txt,txt_rstl,1842
"of a Postscript, some additional facts illustrative of the singular properties",of,rstl_1842_0013.txt,txt_rstl,1842
of Extinction. 84. Many familiar facts connected with the extinction of,of,rstl_1842_0015.txt,txt_rstl,1842
"doubt, almost any series of facts might be re- presented, and",of,rstl_1842_0015.txt,txt_rstl,1842
"whole, it appears from the facts and reasonings of this paper,",of,rstl_1842_0015.txt,txt_rstl,1842
Insecta (a kind of Caterpillar). Facts observed in the Formation and,of,rstl_1842_0008.txt,txt_rstl,1842
the same mode of origin. Facts observed in the Structure of,of,rstl_1842_0008.txt,txt_rstl,1842
saw the objects in question. Facts observed in the Coagulation of,of,rstl_1842_0008.txt,txt_rstl,1842
of the physical sciences the facts of observation and experiment have,of,rstl_1843_0014.txt,txt_rstl,1843
relation is confirmed by the facts detailed in the paper of,of,rstl_1843_0009.txt,txt_rstl,1843
the whole tenor of voltaic facts and general experience. Another point,of,rstl_1843_0009.txt,txt_rstl,1843
"by publication some of the facts which I also have obtained,",of,rstl_1843_0004.txt,txt_rstl,1843
"the attention of physiologists, certain facts appear, nevertheless, to have been",of,rstl_1843_0013.txt,txt_rstl,1843
divisions of Myriapoda. These additional facts fully accord with the already,of,rstl_1843_0013.txt,txt_rstl,1843
is however one of several facts which have presented themselves in,of,rstl_1843_0011.txt,txt_rstl,1843
"the whole tenor of voltaic facts and genera] experience.” 24, I",of,rstl_1844_0003.txt,txt_rstl,1844
we have before us certain facts connected with the action of,of,rstl_1844_0003.txt,txt_rstl,1844
"of lead in Solution. These facts are well known, and prove",of,rstl_1844_0002.txt,txt_rstl,1844
by an important class of facts which next fell under our,of,rstl_1844_0001.txt,txt_rstl,1844
"exclusion of the anion. These facts are, we believe, irreconcilable with",of,rstl_1844_0001.txt,txt_rstl,1844
place distinctly before our minds facts of which the explanation mnst,of,rstl_1844_0007.txt,txt_rstl,1844
From the sum of these facts I am again forced to,of,rstl_1845_0012.txt,txt_rstl,1845
of the happy temperate mean.:..Some facts which I sball have presently,of,rstl_1845_0014.txt,txt_rstl,1845
"From the whole of these facts I was led to conclude,",of,rstl_1845_0013.txt,txt_rstl,1845
at a knowledge of these facts I have repeated and varied,of,rstl_1845_0013.txt,txt_rstl,1845
and the explanation of the facts is as follows :— Whatever,of,rstl_1845_0013.txt,txt_rstl,1845
described a long series of facts relative to the cireumstances that,of,rstl_1845_0013.txt,txt_rstl,1845
simplest interpretation of all the facts discovered by myself ; it,of,rstl_1845_0011.txt,txt_rstl,1845
however to some of the facts connected with observations at different,of,rstl_1845_0010.txt,txt_rstl,1845
easily accounted for by the facts already stated of irregular composition,of,rstl_1845_0006.txt,txt_rstl,1845
upon the truth of the facts on which the doctrine of,of,rstl_1845_0007.txt,txt_rstl,1845
of reconciling it with many facts or opinions that seemed current,of,rstl_1845_0007.txt,txt_rstl,1845
"general tenor of the preceding facts and observations, to maintain with",of,rstl_1845_0007.txt,txt_rstl,1845
"the development of the principal facts of diurnal tide. Finally, that",of,rstl_1845_0001.txt,txt_rstl,1845
