Context,Collocate,File,Directory,Year
and the bearing of the facts described on the still mooted,and,rstl_1848_0012.txt,txt_rstl,1848
combines these and many other facts respecting the tides into a,and,rstl_1848_0001.txt,txt_rstl,1848
hope and believe that the facts about to be brought forward,and,rstl_1849_0023.txt,txt_rstl,1849
"and teeth of Macropoma. These facts (if correctly interpreted, and T",and,rstl_1849_0023.txt,txt_rstl,1849
"substituting truth for error, and facts for hypotheses, that correct principles",and,rstl_1849_0015.txt,txt_rstl,1849
a new examination and new facts are required to de- termine,a,rstl_1840_0022.txt,txt_rstl,1840
present memoir is full of facts demonstrating that division is a,a,rstl_1840_0024.txt,txt_rstl,1840
is a © eytoblast.” And facts made known in the foregoing,a,rstl_1840_0024.txt,txt_rstl,1840
entering into detail and multiplying facts in a proportion far beyond,a,rstl_1840_0003.txt,txt_rstl,1840
"Dr. Rocer is, upon the facts of the science, a sup-",a,rstl_1840_0004.txt,txt_rstl,1840
record a number of insulated facts and observations respecting the relations,a,rstl_1840_0002.txt,txt_rstl,1840
"time, a number of interesting facts have been en- countered in",a,rstl_1840_0002.txt,txt_rstl,1840
corpuscles of the blood. Those facts were of a character which,a,rstl_1841_0018.txt,txt_rstl,1841
On a review of the facts stated in the course of,a,rstl_1841_0018.txt,txt_rstl,1841
"of a Postscript, some additional facts illustrative of the singular properties",a,rstl_1842_0013.txt,txt_rstl,1842
interesting in con- nection with facts recorded in a former memoir,a,rstl_1842_0008.txt,txt_rstl,1842
my observations were discontinued. These facts sufficiently show that a power,a,rstl_1844_0009.txt,txt_rstl,1844
"enabled to establish a few facts respecting polar tension, or rather",a,rstl_1844_0003.txt,txt_rstl,1844
at a knowledge of these facts I have repeated and varied,a,rstl_1845_0013.txt,txt_rstl,1845
described a long series of facts relative to the cireumstances that,a,rstl_1845_0013.txt,txt_rstl,1845
our own country. 3rdly. These facts place in rather a new,a,rstl_1845_0007.txt,txt_rstl,1845
tween the poles. The new facts give not a mere negative,a,rstl_1846_0003.txt,txt_rstl,1846
the simplest and most elementary facts in s0 yast a field,a,rstl_1846_0026.txt,txt_rstl,1846
collections of Ganglia.—From the foregoing facts it will appear that a,a,rstl_1846_0017.txt,txt_rstl,1846
a correct statement of the facts *. My attention was at,a,rstl_1846_0013.txt,txt_rstl,1846
The following are a few facts which I have collected on,a,rstl_1846_0013.txt,txt_rstl,1846
"a sulphate, &c. : the facts stated are suffi- cient to",a,rstl_1846_0012.txt,txt_rstl,1846
of a certain number of facts lately discovered on the electricity,a,rstl_1847_0014.txt,txt_rstl,1847
"Virginia, adding several other analogous facts confirming the theory of a",a,rstl_1847_0017.txt,txt_rstl,1847
am able to prove by facts of a very positive nature.,a,rstl_1847_0017.txt,txt_rstl,1847
"of founding this opinion on facts of a different kind, I",a,rstl_1847_0004.txt,txt_rstl,1847
of a sufficient number of facts to decide on the direction,a,rstl_1847_0009.txt,txt_rstl,1847
very close approximation to the facts of nature. There is a,a,rstl_1848_0008.txt,txt_rstl,1848
combines these and many other facts respecting the tides into a,a,rstl_1848_0001.txt,txt_rstl,1848
"a given point belonged. The facts that I have stated lead,",a,rstl_1849_0021.txt,txt_rstl,1849
a new examination and new facts are required to de- termine,a,rstl_1840_0022.txt,txt_rstl,1840
present memoir is full of facts demonstrating that division is a,a,rstl_1840_0024.txt,txt_rstl,1840
is a © eytoblast.” And facts made known in the foregoing,a,rstl_1840_0024.txt,txt_rstl,1840
entering into detail and multiplying facts in a proportion far beyond,a,rstl_1840_0003.txt,txt_rstl,1840
"Dr. Rocer is, upon the facts of the science, a sup-",a,rstl_1840_0004.txt,txt_rstl,1840
record a number of insulated facts and observations respecting the relations,a,rstl_1840_0002.txt,txt_rstl,1840
"time, a number of interesting facts have been en- countered in",a,rstl_1840_0002.txt,txt_rstl,1840
corpuscles of the blood. Those facts were of a character which,a,rstl_1841_0018.txt,txt_rstl,1841
On a review of the facts stated in the course of,a,rstl_1841_0018.txt,txt_rstl,1841
"of a Postscript, some additional facts illustrative of the singular properties",a,rstl_1842_0013.txt,txt_rstl,1842
interesting in con- nection with facts recorded in a former memoir,a,rstl_1842_0008.txt,txt_rstl,1842
my observations were discontinued. These facts sufficiently show that a power,a,rstl_1844_0009.txt,txt_rstl,1844
"enabled to establish a few facts respecting polar tension, or rather",a,rstl_1844_0003.txt,txt_rstl,1844
at a knowledge of these facts I have repeated and varied,a,rstl_1845_0013.txt,txt_rstl,1845
described a long series of facts relative to the cireumstances that,a,rstl_1845_0013.txt,txt_rstl,1845
our own country. 3rdly. These facts place in rather a new,a,rstl_1845_0007.txt,txt_rstl,1845
tween the poles. The new facts give not a mere negative,a,rstl_1846_0003.txt,txt_rstl,1846
the simplest and most elementary facts in s0 yast a field,a,rstl_1846_0026.txt,txt_rstl,1846
collections of Ganglia.—From the foregoing facts it will appear that a,a,rstl_1846_0017.txt,txt_rstl,1846
a correct statement of the facts *. My attention was at,a,rstl_1846_0013.txt,txt_rstl,1846
The following are a few facts which I have collected on,a,rstl_1846_0013.txt,txt_rstl,1846
"a sulphate, &c. : the facts stated are suffi- cient to",a,rstl_1846_0012.txt,txt_rstl,1846
of a certain number of facts lately discovered on the electricity,a,rstl_1847_0014.txt,txt_rstl,1847
"Virginia, adding several other analogous facts confirming the theory of a",a,rstl_1847_0017.txt,txt_rstl,1847
am able to prove by facts of a very positive nature.,a,rstl_1847_0017.txt,txt_rstl,1847
"of founding this opinion on facts of a different kind, I",a,rstl_1847_0004.txt,txt_rstl,1847
of a sufficient number of facts to decide on the direction,a,rstl_1847_0009.txt,txt_rstl,1847
very close approximation to the facts of nature. There is a,a,rstl_1848_0008.txt,txt_rstl,1848
combines these and many other facts respecting the tides into a,a,rstl_1848_0001.txt,txt_rstl,1848
"a given point belonged. The facts that I have stated lead,",a,rstl_1849_0021.txt,txt_rstl,1849
"June 4, 1840. Tre principal facts recorded in the following memoir",the,rstl_1840_0025.txt,txt_rstl,1840
3. y.)}. 19. Should these facts be thought to confirm the,the,rstl_1840_0025.txt,txt_rstl,1840
"But the next section records facts which, if established by future",the,rstl_1840_0025.txt,txt_rstl,1840
1 have now to record facts which in some of the,the,rstl_1840_0025.txt,txt_rstl,1840
within the cylinder. But certain facts communicated in my Third Series,the,rstl_1840_0025.txt,txt_rstl,1840
functions of those tissnes. 'The facts made known in the present,the,rstl_1840_0025.txt,txt_rstl,1840
"attention. Taking adyantage of the facts pointed out by Wonrer®, I",the,rstl_1840_0017.txt,txt_rstl,1840
"the paper. These, and the facts above-mentioned, render it probable that",the,rstl_1840_0017.txt,txt_rstl,1840
wanting for collecting the pathological facts which were to give importance,the,rstl_1840_0014.txt,txt_rstl,1840
"the ceconomy, there are no facts to countenance the belief, that",the,rstl_1840_0014.txt,txt_rstl,1840
have appeared to consider the facts brought out by the experiments,the,rstl_1840_0014.txt,txt_rstl,1840
common case of hemiplegia. Such facts countenance the view which was,the,rstl_1840_0014.txt,txt_rstl,1840
experiments. But as the leading facts of- the experiments have now,the,rstl_1840_0013.txt,txt_rstl,1840
theoretical. < As the experimental facts observed by myself differ from,the,rstl_1840_0013.txt,txt_rstl,1840
the obser- vation of the facts was with me long anterior,the,rstl_1840_0013.txt,txt_rstl,1840
in the perception of experimental facts not wholly coinciding with Sir,the,rstl_1840_0013.txt,txt_rstl,1840
"the experi- ments relate to facts and not opinions, I can",the,rstl_1840_0010.txt,txt_rstl,1840
to determine how far the facts elicited are of ge- neral,the,rstl_1840_0022.txt,txt_rstl,1840
opportunity for confirming the principal facts therein stated. I have now,the,rstl_1840_0024.txt,txt_rstl,1840
"be seen on comparing the facts about to be recorded, with",the,rstl_1840_0024.txt,txt_rstl,1840
"on the ovary||. From the facts just mentioned, and those about",the,rstl_1840_0024.txt,txt_rstl,1840
"** Second Series,” among the facts rendering it probable that the",the,rstl_1840_0024.txt,txt_rstl,1840
the same means. 364. The facts above recorded will show that,the,rstl_1840_0024.txt,txt_rstl,1840
"eight, &c. cells.” But these facts strengthen the analogy pointed out",the,rstl_1840_0024.txt,txt_rstl,1840
of some of the foregoing Facts to the Physiology of Cells.,the,rstl_1840_0024.txt,txt_rstl,1840
"have now to state, that facts observed in the pre- sent",the,rstl_1840_0024.txt,txt_rstl,1840
is a © eytoblast.” And facts made known in the foregoing,the,rstl_1840_0024.txt,txt_rstl,1840
in the parent cell.” The facts recorded in the present memoir,the,rstl_1840_0024.txt,txt_rstl,1840
"18, 1840. 431. Should the facts made known in the foregoing",the,rstl_1840_0024.txt,txt_rstl,1840
"near the truth ; and facts about to be made known,",the,rstl_1840_0024.txt,txt_rstl,1840
it must be by the facts made known in this memoir—affects,the,rstl_1840_0024.txt,txt_rstl,1840
"of the lichen products, any facts belonging to the substance found",the,rstl_1840_0016.txt,txt_rstl,1840
satisfactory explanation of all the facts be given. That deoxidation is,the,rstl_1840_0016.txt,txt_rstl,1840
"zealous in his production of facts and arguments, from the year",the,rstl_1840_0003.txt,txt_rstl,1840
"not controversial, but contains further facts and proofs of the truth",the,rstl_1840_0003.txt,txt_rstl,1840
"think accountable for, on the facts partly known respecting opposed currents;",the,rstl_1840_0003.txt,txt_rstl,1840
theory may agree with the facts is necessary : $till it,the,rstl_1840_0003.txt,txt_rstl,1840
"by any independent measurement or facts (1808.), but only by the",the,rstl_1840_0003.txt,txt_rstl,1840
"in opposition to the foregoing facts and conclusions is, to say",the,rstl_1840_0003.txt,txt_rstl,1840
experiment. 1849. Proceeding on the facts made known by ScaaNBEIN respecting,the,rstl_1840_0003.txt,txt_rstl,1840
"to the platinum, and the facts mainly as with iron. But",the,rstl_1840_0003.txt,txt_rstl,1840
of the enormous body of facts which appear to me to,the,rstl_1840_0003.txt,txt_rstl,1840
"that I worked out the facts to some extent, and think",the,rstl_1840_0004.txt,txt_rstl,1840
"contortions of the string of facts (1874. 1956. 1992. 2006. 2063.),",the,rstl_1840_0004.txt,txt_rstl,1840
METALLIC CONTACT. 115 observations and facts to show the number of,the,rstl_1840_0004.txt,txt_rstl,1840
"but reservedly expressed, that the facts were favourable to the theory",the,rstl_1840_0004.txt,txt_rstl,1840
"mere-contact excitement, derivable from the facts of thermo electricity, remains, since",the,rstl_1840_0004.txt,txt_rstl,1840
"Dr. Rocer is, upon the facts of the science, a sup-",the,rstl_1840_0004.txt,txt_rstl,1840
record a number of insulated facts and observations respecting the relations,the,rstl_1840_0002.txt,txt_rstl,1840
"of M. Dacuerre's discovery. The facts themselves, in the present state",the,rstl_1840_0002.txt,txt_rstl,1840
"considered as hitherto undecided. The facts about to be tated, however,",the,rstl_1840_0002.txt,txt_rstl,1840
"of no small interest. The facts I am about to recite,",the,rstl_1840_0002.txt,txt_rstl,1840
of urea 6 Whether these facts have any connexion with the,the,rstl_1840_0002.txt,txt_rstl,1840
"resolved. Notwithstanding these differences, however, facts mentioned by authors regarding the",the,rstl_1841_0017.txt,txt_rstl,1841
"enhances the value of any facts bearing on this obscure point,",the,rstl_1841_0009.txt,txt_rstl,1841
"preceding remarks, combined with the facts and arguments advanced in my",the,rstl_1841_0009.txt,txt_rstl,1841
corpuscles of the blood. Those facts were of a character which,the,rstl_1841_0018.txt,txt_rstl,1841
On a review of the facts stated in the course of,the,rstl_1841_0018.txt,txt_rstl,1841
granules of the yelk. The facts recorded in the foregoing memoir,the,rstl_1841_0018.txt,txt_rstl,1841
"be naturally deduced from the facts demonstrated in the foregoing dissections,—",the,rstl_1841_0015.txt,txt_rstl,1841
'The following are the leading facts which the preceding researches upon,the,rstl_1841_0015.txt,txt_rstl,1841
the eggs ; but the facts now about to be stated,the,rstl_1841_0012.txt,txt_rstl,1841
entirely overlooked many most important facts in regard to the production,the,rstl_1841_0012.txt,txt_rstl,1841
'The conclusions to which the facts detailed in this paper seem,the,rstl_1841_0012.txt,txt_rstl,1841
entirely in accordance with the facts subse- quently ascertained respecting the,the,rstl_1841_0012.txt,txt_rstl,1841
"the oyum. Moreover, the few facts detailed in this paper show",the,rstl_1841_0012.txt,txt_rstl,1841
of the embryo that the facts ascertained appear to be of,the,rstl_1841_0012.txt,txt_rstl,1841
with great difficulty that the facts connected with them are ascertained.,the,rstl_1841_0012.txt,txt_rstl,1841
have noticed the important additional facts of the detection of the,the,rstl_1841_0012.txt,txt_rstl,1841
"will be seen that the facts I have now to mention,",the,rstl_1841_0019.txt,txt_rstl,1841
nucleated cells. But the other facts now men- tioned+; I believe,the,rstl_1841_0019.txt,txt_rstl,1841
"find that, while bringing forward facts opposed to the views of",the,rstl_1841_0019.txt,txt_rstl,1841
"all anticipated. For, although the facts observed had led me pretty",the,rstl_1841_0019.txt,txt_rstl,1841
I in pos- ses8ion of facts connected with the process of,the,rstl_1841_0019.txt,txt_rstl,1841
higher tribes of animals. 'These facts I had the honour of,the,rstl_1842_0014.txt,txt_rstl,1842
"of a Postscript, some additional facts illustrative of the singular properties",the,rstl_1842_0013.txt,txt_rstl,1842
of Extinction. 84. Many familiar facts connected with the extinction of,the,rstl_1842_0015.txt,txt_rstl,1842
"whole, it appears from the facts and reasonings of this paper,",the,rstl_1842_0015.txt,txt_rstl,1842
remarks founded on the foregoing facts and speculations. 1. The bile,the,rstl_1842_0005.txt,txt_rstl,1842
subsequent figures in this Plate. Facts observed in the Formation and,the,rstl_1842_0008.txt,txt_rstl,1842
this object and its loop. Facts observed in the Formation and,the,rstl_1842_0008.txt,txt_rstl,1842
Insecta (a kind of Caterpillar). Facts observed in the Formation and,the,rstl_1842_0008.txt,txt_rstl,1842
the same mode of origin. Facts observed in the Structure of,the,rstl_1842_0008.txt,txt_rstl,1842
an investigator to record the facts he DR. MARTIN BARRY ON,the,rstl_1842_0008.txt,txt_rstl,1842
"peared almost wanting. Should the facts recorded in this memoir, however,",the,rstl_1842_0008.txt,txt_rstl,1842
"Ross, or SmiTH, the leading facts recorded in it. To one",the,rstl_1842_0008.txt,txt_rstl,1842
saw the objects in question. Facts observed in the Coagulation of,the,rstl_1842_0008.txt,txt_rstl,1842
"explained, I believe, by the facts above mentioned: as well as",the,rstl_1842_0008.txt,txt_rstl,1842
of the physical sciences the facts of observation and experiment have,the,rstl_1843_0014.txt,txt_rstl,1843
"lead, to some new valuable facts or natural relations. Reviewing the",the,rstl_1843_0009.txt,txt_rstl,1843
relation is confirmed by the facts detailed in the paper of,the,rstl_1843_0009.txt,txt_rstl,1843
the whole tenor of voltaic facts and general experience. Another point,the,rstl_1843_0009.txt,txt_rstl,1843
traced (in addition to the facts brought forward in the notes,the,rstl_1843_0002.txt,txt_rstl,1843
"baryta, and others, confirm the facts already stated ; viz. that",the,rstl_1843_0003.txt,txt_rstl,1843
"by publication some of the facts which I also have obtained,",the,rstl_1843_0004.txt,txt_rstl,1843
arranging in one system numerous facts connected with the reflected movements,the,rstl_1843_0013.txt,txt_rstl,1843
leads us to 8ome important facts in reference to the means,the,rstl_1843_0013.txt,txt_rstl,1843
the abdominal nervous cord. The facts ascertained by Mr. Lonp were,the,rstl_1843_0013.txt,txt_rstl,1843
with the orifices. From these facts it would appear that the,the,rstl_1843_0013.txt,txt_rstl,1843
"the attention of physiologists, certain facts appear, nevertheless, to have been",the,rstl_1843_0013.txt,txt_rstl,1843
divisions of Myriapoda. These additional facts fully accord with the already,the,rstl_1843_0013.txt,txt_rstl,1843
and liver in the latter; facts which I regard as new,the,rstl_1843_0013.txt,txt_rstl,1843
the Royal Society. Myriapoda. The facts already ascertained respecting the periodical,the,rstl_1844_0009.txt,txt_rstl,1844
"I was examining it, the facts were still more satisfac- tory.",the,rstl_1844_0009.txt,txt_rstl,1844
"with others showing the same facts in F. 15,—G. N., Sept.",the,rstl_1844_0009.txt,txt_rstl,1844
"communicated it was remodelled, the facts remaining the same.—E. W. EXPLANATION",the,rstl_1844_0011.txt,txt_rstl,1844
incorrect. 2. The preceding negative facts are not without their value,the,rstl_1844_0003.txt,txt_rstl,1844
"the whole tenor of voltaic facts and genera] experience.” 24, I",the,rstl_1844_0003.txt,txt_rstl,1844
we have before us certain facts connected with the action of,the,rstl_1844_0003.txt,txt_rstl,1844
"'the Cephalopodal organization, the additional facts afforded by the well-preserved specimens",the,rstl_1844_0006.txt,txt_rstl,1844
and Sepia: and the additional facts which we have now unexpectedly,the,rstl_1844_0006.txt,txt_rstl,1844
"certain thermal effect, the general facts now established will not be",the,rstl_1844_0002.txt,txt_rstl,1844
"exclusion of the anion. These facts are, we believe, irreconcilable with",the,rstl_1844_0001.txt,txt_rstl,1844
"fix the attention. These are facts which, when the true physical",the,rstl_1844_0007.txt,txt_rstl,1844
place distinctly before our minds facts of which the explanation mnst,the,rstl_1844_0007.txt,txt_rstl,1844
"differ 80 widely from the facts in the southern latitudes, shows",the,rstl_1844_0007.txt,txt_rstl,1844
From the sum of these facts I am again forced to,the,rstl_1845_0012.txt,txt_rstl,1845
of the happy temperate mean.:..Some facts which I sball have presently,the,rstl_1845_0014.txt,txt_rstl,1845
the urine alkaline; and from facts which have been stated to,the,rstl_1845_0015.txt,txt_rstl,1845
"From the whole of these facts I was led to conclude,",the,rstl_1845_0013.txt,txt_rstl,1845
and the explanation of the facts is as follows :— Whatever,the,rstl_1845_0013.txt,txt_rstl,1845
described a long series of facts relative to the cireumstances that,the,rstl_1845_0013.txt,txt_rstl,1845
simplest interpretation of all the facts discovered by myself ; it,the,rstl_1845_0011.txt,txt_rstl,1845
however to some of the facts connected with observations at different,the,rstl_1845_0010.txt,txt_rstl,1845
easily accounted for by the facts already stated of irregular composition,the,rstl_1845_0006.txt,txt_rstl,1845
upon the truth of the facts on which the doctrine of,the,rstl_1845_0007.txt,txt_rstl,1845
"may be countenanced by the facts detailed in the text, but",the,rstl_1845_0007.txt,txt_rstl,1845
present to deduce from the facts which I have laid before,the,rstl_1845_0007.txt,txt_rstl,1845
"general tenor of the preceding facts and observations, to maintain with",the,rstl_1845_0007.txt,txt_rstl,1845
this instance adopted. Now the facts and observations detailed in the,the,rstl_1845_0007.txt,txt_rstl,1845
"the development of the principal facts of diurnal tide. Finally, that",the,rstl_1845_0001.txt,txt_rstl,1845
"formed :— From the ordinary facts of the tides, it seems",the,rstl_1845_0001.txt,txt_rstl,1845
"great, addition made to the facts and considerations which tend to",the,rstl_1846_0001.txt,txt_rstl,1846
tween the poles. The new facts give not a mere negative,the,rstl_1846_0003.txt,txt_rstl,1846
"equatorial position : and the facts with regard to bodies generally,",the,rstl_1846_0003.txt,txt_rstl,1846
could be lowered sufficiently. The facts just described appear to me,the,rstl_1846_0004.txt,txt_rstl,1846
"be drawn from all the facts described in this paper, I",the,rstl_1846_0004.txt,txt_rstl,1846
"considerations. 2417. Such are the facts which, in addition to those",the,rstl_1846_0004.txt,txt_rstl,1846
to the bearing of the facts I have now related on,the,rstl_1846_0005.txt,txt_rstl,1846
"T have suggested of the facts described be '> correct, and",the,rstl_1846_0024.txt,txt_rstl,1846
"and the bearing of the facts now related, to dis- sent",the,rstl_1846_0025.txt,txt_rstl,1846
"secrefory portion+. From all the facts which have been now related,",the,rstl_1846_0025.txt,txt_rstl,1846
reduced to the two following facts :— 1. 'The electric discharge,the,rstl_1846_0026.txt,txt_rstl,1846
"say, the greatest number of facts possible from the smallest number",the,rstl_1846_0026.txt,txt_rstl,1846
the simplest and most elementary facts in s0 yast a field,the,rstl_1846_0026.txt,txt_rstl,1846
see the application of these facts to the vocal apparatus. We,the,rstl_1846_0028.txt,txt_rstl,1846
were expiratory. These were the facts ; | I could not,the,rstl_1846_0027.txt,txt_rstl,1846
to 089 inch. As the facts shown by these observations are,the,rstl_1846_0020.txt,txt_rstl,1846
vessels in the neighbourhood. These facts were demonstrated by preparations at,the,rstl_1846_0017.txt,txt_rstl,1846
collections of Ganglia.—From the foregoing facts it will appear that a,the,rstl_1846_0017.txt,txt_rstl,1846
a correct statement of the facts *. My attention was at,the,rstl_1846_0013.txt,txt_rstl,1846
play of forces. The following facts appear to me quite conclu-,the,rstl_1846_0013.txt,txt_rstl,1846
The following are a few facts which I have collected on,the,rstl_1846_0013.txt,txt_rstl,1846
present ; the seemingly opposed facts showing the glacier to be,the,rstl_1846_0015.txt,txt_rstl,1846
"are to investigations into the facts of terrestrial mag- netism, I",the,rstl_1846_0018.txt,txt_rstl,1846
"a sulphate, &c. : the facts stated are suffi- cient to",the,rstl_1846_0012.txt,txt_rstl,1846
"is generated. 5 From the facts above stated, it appears that",the,rstl_1846_0012.txt,txt_rstl,1846
"refresbing his memory. The real facts are, that on the 6th",the,rstl_1846_0008.txt,txt_rstl,1846
of a certain number of facts lately discovered on the electricity,the,rstl_1847_0014.txt,txt_rstl,1847
of expo- sition of the facts in this memoir will be,the,rstl_1847_0014.txt,txt_rstl,1847
"the entire organ, These same facts are verified also by including",the,rstl_1847_0014.txt,txt_rstl,1847
This Jast and the preceding facts establish the connection between the,the,rstl_1847_0014.txt,txt_rstl,1847
"Virginia, adding several other analogous facts confirming the theory of a",the,rstl_1847_0017.txt,txt_rstl,1847
fixation of mercurial vapour. The facts pointed out by M. Gavpin,the,rstl_1847_0017.txt,txt_rstl,1847
I would here recall the facts discovered by M. Loxcer and,the,rstl_1847_0013.txt,txt_rstl,1847
"July and August. From the facts here brought forward, it may",the,rstl_1847_0006.txt,txt_rstl,1847
"there may be in the facts I have communicated, is the",the,rstl_1847_0002.txt,txt_rstl,1847
"as I do to the facts themselves, though I consider it",the,rstl_1847_0002.txt,txt_rstl,1847
"Although, as applied to the facts detailed, I attached no further",the,rstl_1847_0002.txt,txt_rstl,1847
and Fovcavrr observed some remarkable facts of the same kind on,the,rstl_1847_0004.txt,txt_rstl,1847
of a sufficient number of facts to decide on the direction,the,rstl_1847_0009.txt,txt_rstl,1847
"the combustible gases, but the facts are far too few to",the,rstl_1847_0001.txt,txt_rstl,1847
"The very singular and unexpected facts now detailed, merit attention and",the,rstl_1847_0011.txt,txt_rstl,1847
pletely set aside by the facts and arguments which have been,the,rstl_1848_0019.txt,txt_rstl,1848
"probable, has by the same facts and arguments been proved to",the,rstl_1848_0019.txt,txt_rstl,1848
lowing experiment containing the principal facts worthy of notice will be,the,rstl_1848_0017.txt,txt_rstl,1848
and the bearing of the facts described on the still mooted,the,rstl_1848_0012.txt,txt_rstl,1848
"4, a.]* According to the facts at present known, the chambered",the,rstl_1848_0012.txt,txt_rstl,1848
the erystalline mineral matter. The facts above described appear to me,the,rstl_1848_0012.txt,txt_rstl,1848
very close approximation to the facts of nature. There is a,the,rstl_1848_0008.txt,txt_rstl,1848
exactly the reverse of the facts which take place at the,the,rstl_1848_0008.txt,txt_rstl,1848
as to include the following facts of observation :— (1.) The,the,rstl_1848_0001.txt,txt_rstl,1848
irregularity or complexity of the facts themselves. With regard to the,the,rstl_1848_0001.txt,txt_rstl,1848
":—the collec- tion of the facts then known, given in the",the,rstl_1848_0001.txt,txt_rstl,1848
combines these and many other facts respecting the tides into a,the,rstl_1848_0001.txt,txt_rstl,1848
"a given point belonged. The facts that I have stated lead,",the,rstl_1849_0021.txt,txt_rstl,1849
"District, as far as the facts then ascertained would permit. I",the,rstl_1849_0017.txt,txt_rstl,1849
"about three years ago. The facts previously on record, with few",the,rstl_1849_0017.txt,txt_rstl,1849
conelusions are deducible from the facts stated in the pre- ceding,the,rstl_1849_0022.txt,txt_rstl,1849
quoted. The following are the facts relative to the nervous supply,the,rstl_1849_0003.txt,txt_rstl,1849
