Context,Collocate,File,Directory,Year,Frequency Filter
a thorough investigation of the facts had become necessary. I have,the,rstl_1858_0034.txt,txt_rstl,1858,20
be two less than usnal; facts sufficiently puzzling without the light,the,rstl_1858_0034.txt,txt_rstl,1858,20
the latter mountain. The additional facts and inferences obtained at that,the,rstl_1858_0032.txt,txt_rstl,1858,20
"have been led Sby the facts described in the foregoing pages,",the,rstl_1858_0032.txt,txt_rstl,1858,20
"an explanation, however, of the facts would be fatal to any",the,rstl_1858_0032.txt,txt_rstl,1858,20
5 Review of the chief facts made known by the ES,the,rstl_1858_0005.txt,txt_rstl,1858,20
"EGYPT. Review of the chief facts made known by the Excavations,",the,rstl_1858_0005.txt,txt_rstl,1858,20
"= fairly deducible from the facts which these researches have disclosed,",the,rstl_1858_0005.txt,txt_rstl,1858,20
will afterwards appear that the facts to be related in this,the,rstl_1858_0006.txt,txt_rstl,1858,20
candid review of the preceding facts must inevitably conduct to the,the,rstl_1858_0006.txt,txt_rstl,1858,20
"to verify by observation the facts now to be nar- ted,",the,rstl_1858_0006.txt,txt_rstl,1858,20
The significance 2 of these facts cannot for a moment be,the,rstl_1858_0006.txt,txt_rstl,1858,20
reconcile this account with the facts which I have met with.,the,rstl_1859_0024.txt,txt_rstl,1859,20
"but if, as the \ Facts appear to indicate, the general",the,rstl_1859_0024.txt,txt_rstl,1859,20
"to the bearing of the facts contained in the present, Epaper",the,rstl_1859_0024.txt,txt_rstl,1859,20
of the popula- tion. The facts which a Life-Table expresses in,the,rstl_1859_0034.txt,txt_rstl,1859,20
"grow more exact, and the facts are multiplied, the intervals of",the,rstl_1859_0034.txt,txt_rstl,1859,20
hypothesis does not express the facts deduced from the observations exactly.,the,rstl_1859_0034.txt,txt_rstl,1859,20
"as T can, of the facts connected with the sensations of",the,rstl_1859_0017.txt,txt_rstl,1859,20
"the correct determination of these facts is concerned, it seems to",the,rstl_1859_0017.txt,txt_rstl,1859,20
clearly and fully the ordinary facts and impressions regarding colour in,the,rstl_1859_0017.txt,txt_rstl,1859,20
"the simplest manner possible, the facts I have to bring forward;",the,rstl_1859_0017.txt,txt_rstl,1859,20
"my own case, the general facts now known to characterize the",the,rstl_1859_0017.txt,txt_rstl,1859,20
will satisfactorily account for the facts observed. Take for instance the,the,rstl_1859_0017.txt,txt_rstl,1859,20
"the glaciers thus compressed, the facts appear still more astonishing. Previous",the,rstl_1859_0014.txt,txt_rstl,1859,20
be Z untenable. S The facts submitted to our consideration are,the,rstl_1859_0014.txt,txt_rstl,1859,20
and open 8lowly. Sand both facts are demonstrative of the non-viscosity,the,rstl_1859_0014.txt,txt_rstl,1859,20
"broadly, then, two classes of facts address themselves to the attention",the,rstl_1859_0014.txt,txt_rstl,1859,20
"phenomena. 'The analysis of the facts gives the result, that where",the,rstl_1859_0014.txt,txt_rstl,1859,20
"take account of all the facts adduced in proof of viscosity,",the,rstl_1859_0014.txt,txt_rstl,1859,20
of the other set of facts on which the opponents of,the,rstl_1859_0014.txt,txt_rstl,1859,20
not help feeling that the facts and arguments which I was,the,rstl_1859_0015.txt,txt_rstl,1859,20
nor its : tributaries furnished facts capable of completely deciding the,the,rstl_1859_0015.txt,txt_rstl,1859,20
the sliding theory. That such facts exist is known to every,the,rstl_1859_0015.txt,txt_rstl,1859,20
HoykiNs has drawn from these facts is unavoidable ; the glaciers,the,rstl_1859_0015.txt,txt_rstl,1859,20
we find that the extreme facts have been dwelt upon princi-,the,rstl_1859_0015.txt,txt_rstl,1859,20
to interference; but the new facts which have been elicited in,the,rstl_1859_0007.txt,txt_rstl,1859,20
These experiments developed the following facts :—lIst. That the effect of,the,rstl_1859_0005.txt,txt_rstl,1859,20
"the main and more prominent facts and conclusions, which the investigation,",the,rstl_1859_0025.txt,txt_rstl,1859,20
"present Paper, nor are the facts applicable to such a pur-",the,rstl_1859_0025.txt,txt_rstl,1859,20
when we ther consider the facts now adduced as to the,the,rstl_1859_0025.txt,txt_rstl,1859,20
far advanced—nor are our special facts in regard to the composition,the,rstl_1859_0025.txt,txt_rstl,1859,20
"in that of others, the facts peculiar to Physiology herself must",the,rstl_1859_0025.txt,txt_rstl,1859,20
the full explanation of the facts and conclusions which Chemistry and,the,rstl_1859_0025.txt,txt_rstl,1859,20
"of the feeding experiment. The facts bere «tated, will of course",the,rstl_1859_0025.txt,txt_rstl,1859,20
ounce to the pound. The facts as to the amount of,the,rstl_1860_0027.txt,txt_rstl,1860,20
the collection Zand discussion of facts elicited in the investigations of,the,rstl_1860_0017.txt,txt_rstl,1860,20
"they are isolated, and the facts which they have established can",the,rstl_1860_0024.txt,txt_rstl,1860,20
be deduced from the following facts — 1. At the turning-points,the,rstl_1860_0011.txt,txt_rstl,1860,20
"one of the most remarkable facts is this, that these luminous",the,rstl_1860_0010.txt,txt_rstl,1860,20
"One of the most, obvious facts on looking at the equations",the,rstl_1860_0009.txt,txt_rstl,1860,20
"not yet completed. The principal facts have, however, been already ascertained,",the,rstl_1860_0008.txt,txt_rstl,1860,20
at first produced. All these facts are easily explained from the,the,rstl_1860_0008.txt,txt_rstl,1860,20
a positive explanation of the facts now described regarding 0zone. 'I'he,the,rstl_1860_0008.txt,txt_rstl,1860,20
structive to consider whether the facts already known admit of a,the,rstl_1860_0008.txt,txt_rstl,1860,20
"latter circumstances, and, although the facts connected with its production in",the,rstl_1860_0008.txt,txt_rstl,1860,20
"who now frankly stated the facts relating to the discovery, but",the,rstl_1860_0018.txt,txt_rstl,1860,20
full possession of all the facts bearing upon his discoveries. To,the,rstl_1860_0018.txt,txt_rstl,1860,20
and of ome other interesting facts connected with the fossil bones,the,rstl_1860_0018.txt,txt_rstl,1860,20
"period which, if the eoregoing facts are truly interpreted, would seem",the,rstl_1860_0018.txt,txt_rstl,1860,20
to the analogy of the facts which have been determined by,the,rstl_1860_0026.txt,txt_rstl,1860,20
of the large body of facts which have been brought together,the,rstl_1860_0026.txt,txt_rstl,1860,20
in its relations to analogous facts drawn from the far greater,the,rstl_1860_0026.txt,txt_rstl,1860,20
it extremely desirable that the facts which are to be Q,the,rstl_1851_0032.txt,txt_rstl,1851,20
"circum- S stances may permit, facts of the same class obtained",the,rstl_1851_0032.txt,txt_rstl,1851,20
the means of generalizing the facts of the = Annual and,the,rstl_1851_0032.txt,txt_rstl,1851,20
"a correct representation of the facts of nature. MAGNETIC DECLINATION, AT",the,rstl_1851_0032.txt,txt_rstl,1851,20
of what would be the facts of the Annual and Diurnal,the,rstl_1851_0032.txt,txt_rstl,1851,20
practical considerations snggested by the facts now under notice. 1. Recent,the,rstl_1851_0032.txt,txt_rstl,1851,20
"1850. By reflecting on certain facts connected with the respiratory movements,",the,rstl_1851_0029.txt,txt_rstl,1851,20
"therefore, a few of the facts brought forward in this paper",the,rstl_1851_0029.txt,txt_rstl,1851,20
following summary of the principal facts described in this paper may,the,rstl_1851_0029.txt,txt_rstl,1851,20
a means of colligating the facts (for at best it can,the,rstl_1851_0027.txt,txt_rstl,1851,20
with the more facility to facts and views that have heretofore,the,rstl_1851_0005.txt,txt_rstl,1851,20
"at Toronto and Hobarton, the facts appear to be that the",the,rstl_1851_0005.txt,txt_rstl,1851,20
"advanced, besides agreeing with the facts regarding the direction of the",the,rstl_1851_0005.txt,txt_rstl,1851,20
being a contractile tissue. The facts which seem to militate against,the,rstl_1851_0010.txt,txt_rstl,1851,20
"present chapter; but, as the facts have been Stated in part,",the,rstl_1851_0002.txt,txt_rstl,1851,20
We are forced by unequivocal facts to admit that the fourth,the,rstl_1851_0017.txt,txt_rstl,1851,20
"present chapter; but, as the facts have been Stated in part,",the,rstl_1851_0002.txt,txt_rstl,1851,20
As an expression of the facts for use in applying them,the,rstl_1851_0006.txt,txt_rstl,1851,20
comparing these with the £ facts of the natural history and,the,rstl_1851_0011.txt,txt_rstl,1851,20
may be inferred from the facts of its structure. Being filled,the,rstl_1851_0011.txt,txt_rstl,1851,20
"in the germinal vesicle, the facts observed in the ova of",the,rstl_1851_0011.txt,txt_rstl,1851,20
the whole produced embryos. These facts proved that the ova employed,the,rstl_1851_0011.txt,txt_rstl,1851,20
of the area germinativa. These facts sufficiently prove the great influence,the,rstl_1851_0011.txt,txt_rstl,1851,20
"think, is rendered certain by facts now shown, which escaped the",the,rstl_1851_0011.txt,txt_rstl,1851,20
during impregnation. —But although the facts now mentioned are 80 opposed,the,rstl_1851_0011.txt,txt_rstl,1851,20
uniform in the interior. These facts ap- peared to be conelusive,the,rstl_1851_0011.txt,txt_rstl,1851,20
"was necessary to confirm the facts ascertained by chemical investigation, by",the,rstl_1851_0011.txt,txt_rstl,1851,20
"which are objectionable from the facts shown in Dr. Frericns' analyses,",the,rstl_1851_0011.txt,txt_rstl,1851,20
and to show from these facts that a non-production of the,the,rstl_1851_0011.txt,txt_rstl,1851,20
recapitulate briefly some of the facts and views derived from the,the,rstl_1851_0011.txt,txt_rstl,1851,20
did s0 well with the facts elicited during the oute of,the,rstl_1852_0020.txt,txt_rstl,1852,20
"as they are by the facts already known, they must, occasion",the,rstl_1852_0020.txt,txt_rstl,1852,20
"in common either between the facts or arguments therein given, and",the,rstl_1852_0024.txt,txt_rstl,1852,20
or peritoneal chamber. These indisputable facts establish conclusively the view which,the,rstl_1852_0024.txt,txt_rstl,1852,20
this bold =tatement by the facts which already my own labours,the,rstl_1852_0024.txt,txt_rstl,1852,20
"in the true-blood. From these facts the physiologist may state, that",the,rstl_1852_0024.txt,txt_rstl,1852,20
secretion in living animals. The facts which the experiments related in,the,rstl_1852_0016.txt,txt_rstl,1852,20
"4). A consideration of the facts thus presented to notice, led",the,rstl_1852_0005.txt,txt_rstl,1852,20
"Remarks—An examination of the preceding facts will, I think, justify me",the,rstl_1852_0005.txt,txt_rstl,1852,20
am of opinion that the facts detailed in this paper are,the,rstl_1852_0005.txt,txt_rstl,1852,20
placed in juxtaposition with the facts already elicited by more able,the,rstl_1852_0005.txt,txt_rstl,1852,20
"consistent with the generally known facts con- nected with the discharge,",the,rstl_1852_0008.txt,txt_rstl,1852,20
"the vast mass of accumulated facts in electrical science, and likely",the,rstl_1852_0008.txt,txt_rstl,1852,20
"atmosphere corre- Sponds with the facts registered by observers, is a",the,rstl_1852_0012.txt,txt_rstl,1852,20
"disturbance in different years, the facts which present themselves most obviously",the,rstl_1852_0009.txt,txt_rstl,1852,20
less remarkable than are the facts which they combine to indi-,the,rstl_1852_0009.txt,txt_rstl,1852,20
are bound to receive the facts which may appear to indicate,the,rstl_1852_0009.txt,txt_rstl,1852,20
"epoch is traceable. Now the facts of the solar spots, as",the,rstl_1852_0009.txt,txt_rstl,1852,20
"with this subject, because the facts I have ascertained regarding it",the,rstl_1852_0001.txt,txt_rstl,1852,20
at a considerable distance. The facts noticed by these authors are,the,rstl_1852_0001.txt,txt_rstl,1852,20
Itis quite/possible that when the facts shall-have|been/more precisely/Jetermined; it may prove'that-neither,the,rstl_1853_0019.txt,txt_rstl,1853,20
the grey substance. From these facts he calcu- lates that the,the,rstl_1853_0013.txt,txt_rstl,1853,20
signification of several of the facts with which we have thus,the,rstl_1853_0015.txt,txt_rstl,1853,20
one'of the most'striking of the facts which he has 86 skilfully,the,rstl_1853_0015.txt,txt_rstl,1853,20
The conelusion to which the facts s0nght to be demonstrated in,the,rstl_1853_0015.txt,txt_rstl,1853,20
of a periodical character: the facts appear to be important materials,the,rstl_1853_0006.txt,txt_rstl,1853,20
"the plate, we learn many facts regarding the temperature at Toronto,",the,rstl_1853_0005.txt,txt_rstl,1853,20
"con- Sideration of the foregoing facts will, we think, lead to",the,rstl_1853_0004.txt,txt_rstl,1853,20
"A consideration of the foregoing facts will, we think, lead to",the,rstl_1853_0004.txt,txt_rstl,1853,20
a due regard to the facts presented by the development of,the,rstl_1853_0002.txt,txt_rstl,1853,20
to bring into prominence some facts in the anatomy of the,the,rstl_1853_0002.txt,txt_rstl,1853,20
667). Again :—* From the facts which have just been stated,the,rstl_1853_0002.txt,txt_rstl,1853,20
"is one of the earliest facts in molluscons development, and it",the,rstl_1853_0002.txt,txt_rstl,1853,20
circulation in the Mollusca. The facts I MR. T. H. HUXLEY,the,rstl_1853_0002.txt,txt_rstl,1853,20
according to the species. These facts are well shown both in,the,rstl_1853_0010.txt,txt_rstl,1853,20
of maturity in both. These facts seem to lead to the,the,rstl_1853_0010.txt,txt_rstl,1853,20
fair then toinfer from these facts that the completion of the,the,rstl_1853_0010.txt,txt_rstl,1853,20
embryo was produced. S These facts then support the statement already,the,rstl_1853_0010.txt,txt_rstl,1853,20
"well be supposed that the facts just mentioned were exceedingly puzzling,",the,rstl_1853_0010.txt,txt_rstl,1853,20
Invertebrata. A comparison of the facts in the two divisions of,the,rstl_1853_0010.txt,txt_rstl,1853,20
agent in all animals. The facts already mentioned coincide with this,the,rstl_1853_0010.txt,txt_rstl,1853,20
to be drawn from the facts of natural impregnation in the,the,rstl_1853_0010.txt,txt_rstl,1853,20
force in the spermatozoon. The facts now 8tated of penetration by,the,rstl_1853_0010.txt,txt_rstl,1853,20
"fecundation, we have, in the facts now referred to, much reason",the,rstl_1853_0010.txt,txt_rstl,1853,20
"tions, together with the chief facts connected with the occurrence of",the,rstl_1854_0014.txt,txt_rstl,1854,20
organs of respiration. From the facts which I have already succeeded,the,rstl_1854_0014.txt,txt_rstl,1854,20
"also cases of phthisis. These facts possess the greatest interest, and",the,rstl_1854_0014.txt,txt_rstl,1854,20
then the whole of the facts and observations recorded in this,the,rstl_1854_0014.txt,txt_rstl,1854,20
accurate conclusion that the observed facts may justify. For all practical,the,rstl_1854_0013.txt,txt_rstl,1854,20
all of which the same facts could be noted. The segmentation,the,rstl_1854_0009.txt,txt_rstl,1854,20
"fecundating fluid. . From the facts stated above, and before detailed",the,rstl_1854_0009.txt,txt_rstl,1854,20
"these were confirmatory of the facts before stated, as the variation",the,rstl_1854_0009.txt,txt_rstl,1854,20
the same metal. The same facts deprive the latter part of,the,rstl_1854_0001.txt,txt_rstl,1854,20
to occasion osmose. The newer facts to be related also increase,the,rstl_1854_0008.txt,txt_rstl,1854,20
similar degree of diffusibility*. The facts appear to afford a strong,the,rstl_1854_0008.txt,txt_rstl,1854,20
tried in the search for facts which might throw light on,the,rstl_1854_0008.txt,txt_rstl,1854,20
"its explanation, with many other facts of the subject, till fuller",the,rstl_1854_0008.txt,txt_rstl,1854,20
spoken of its length. These facts will explain the results of,the,rstl_1855_0010.txt,txt_rstl,1855,20
"to complete, and as the facts elicited in reference to cast",the,rstl_1855_0009.txt,txt_rstl,1855,20
1855. Ir is among the facts in chemical science which admit,the,rstl_1855_0008.txt,txt_rstl,1855,20
which appears to represent the facts with a con- siderable degree,the,rstl_1855_0002.txt,txt_rstl,1855,20
law here deduced represents the facts of the case. The value,the,rstl_1855_0002.txt,txt_rstl,1855,20
does not sufficiently express the facts to say that the bar,the,rstl_1855_0001.txt,txt_rstl,1855,20
the same agent. Supposing these facts to have been known to,the,rstl_1855_0001.txt,txt_rstl,1855,20
the manner in which these facts have been explained. © La,the,rstl_1855_0001.txt,txt_rstl,1855,20
a more grave one. The facts are as follows :— the,the,rstl_1855_0001.txt,txt_rstl,1855,20
from pole to pole. The facts observed by M. MaTTEvcer seem,the,rstl_1855_0001.txt,txt_rstl,1855,20
"M. MarTevecr, and converted the facts upon which the objection is",the,rstl_1855_0001.txt,txt_rstl,1855,20
critical review of all the facts of the case which at,the,rstl_1855_0017.txt,txt_rstl,1855,20
"proved, by the comparison of facts then to be addaced from",the,rstl_1856_0027.txt,txt_rstl,1856,20
"now, we review the principal facts relating to the structure of",the,rstl_1856_0027.txt,txt_rstl,1856,20
"growth; on which inquiry, the facts which I have now brought",the,rstl_1856_0027.txt,txt_rstl,1856,20
based on an order of facts relating to the economy of,the,rstl_1856_0027.txt,txt_rstl,1856,20
by critical examinations of the facts already accumulated. These menoirs I,the,rstl_1856_0020.txt,txt_rstl,1856,20
LIONEL BEALE ON THE These facts appear to me to militate,the,rstl_1856_0017.txt,txt_rstl,1856,20
"any other explanation of the facts I have observed, or of",the,rstl_1856_0017.txt,txt_rstl,1856,20
"which presumption was corroborated by facts adduced in the £ame communication,",the,rstl_1856_0016.txt,txt_rstl,1856,20
conclusively established by the following facts :—In all the spirit-specimens which,the,rstl_1856_0012.txt,txt_rstl,1856,20
"are in harmony with the facts of observation. All the Orbitolites,",the,rstl_1856_0012.txt,txt_rstl,1856,20
"kind, may be cited the facts mentioned by Dr. J. D.",the,rstl_1856_0012.txt,txt_rstl,1856,20
inch to crush them. These facts show the great superiority of,the,rstl_1857_0039.txt,txt_rstl,1857,20
"No. 19), regarding the principal facts detailed in the present memoir,",the,rstl_1857_0028.txt,txt_rstl,1857,20
stroma ; but if the facts T have stated be not,the,rstl_1857_0027.txt,txt_rstl,1857,20
prevented further publication of the facts at that time; but I,the,rstl_1857_0017.txt,txt_rstl,1857,20
a parallel to the curious facts thus established we must look,the,rstl_1857_0015.txt,txt_rstl,1857,20
"writes, © a multitude of facts which scem to necessitate the",the,rstl_1857_0016.txt,txt_rstl,1857,20
an imperfect acquaintance with the facts must necessarily render to some,the,rstl_1857_0016.txt,txt_rstl,1857,20
rigorous demonstration of the principal facts and laws of muscular electri-,the,rstl_1857_0010.txt,txt_rstl,1857,20
clear explanation of several important facts of muscular electricity. The first,the,rstl_1857_0010.txt,txt_rstl,1857,20
"electricity. The first of these facts is, that a differential current",the,rstl_1857_0010.txt,txt_rstl,1857,20
"Z5th in breadth. The next facts requiring especial notice, are those",the,rstl_1857_0009.txt,txt_rstl,1857,20
"this respect. 2 From the facts that have just been mentioned,",the,rstl_1857_0009.txt,txt_rstl,1857,20
"inference I deduce from these facts is, first, that the animals",the,rstl_1857_0009.txt,txt_rstl,1857,20
"process in different cases, the facts observed by LEUCKART are in",the,rstl_1857_0009.txt,txt_rstl,1857,20
"from a Tenia-embryo. Finally, the facts made known in this communication",the,rstl_1857_0009.txt,txt_rstl,1857,20
close coincidence between all the facts of light and the physical,the,rstl_1857_0011.txt,txt_rstl,1857,20
supposition leaves many of the facts either imperfectly explained or untouched.,the,rstl_1857_0011.txt,txt_rstl,1857,20
undecided for the present. The facts to be hereafter mentioned as,the,rstl_1857_0007.txt,txt_rstl,1857,20
"eggs require impregnation, and the facts bearing on this $ub- Ject",the,rstl_1857_0007.txt,txt_rstl,1857,20
appears strictly comparable to the facts which have been obseryed in,the,rstl_1857_0007.txt,txt_rstl,1857,20
"ing Tables, to consider the facts they present, and their results.",the,rstl_1857_0004.txt,txt_rstl,1857,20
faces in the quadrant (111...211). Facts presented by these Tables —The,the,rstl_1857_0004.txt,txt_rstl,1857,20
"subject, both as to the facts of the case and as",the,rstl_1858_0036.txt,txt_rstl,1858,20
belonged to this genus. The facts brought to MDCCCLVIIL. 9X 872,the,rstl_1858_0035.txt,txt_rstl,1858,20
to the same family. These facts I now proceed to particularize,the,rstl_1858_0035.txt,txt_rstl,1858,20
LISTER ON THE CUTANEOUS 'These facts indicated pretty clearly that the,the,rstl_1858_0030.txt,txt_rstl,1858,20
"""This, however, only renders the facts above mentioned more striking, 80",the,rstl_1858_0030.txt,txt_rstl,1858,20
The idea suggested by the facts is that the tissues begin,the,rstl_1858_0030.txt,txt_rstl,1858,20
without a knowledge of the facts upon which zoologists ve adopted,the,rstl_1858_0028.txt,txt_rstl,1858,20
"the paralysed parts. All these facts tend to the same conclusion,",the,rstl_1858_0029.txt,txt_rstl,1858,20
"89-3:100, or 7:10 nearly. These facts are conclusive in showing the",the,rstl_1858_0021.txt,txt_rstl,1858,20
evidence quite distinet from the facts mentioned with relation to the,the,rstl_1858_0017.txt,txt_rstl,1858,20
and we trust that the facts which we are about to,the,rstl_1858_0018.txt,txt_rstl,1858,20
23:33 705 | 731 The facts presented by a bar 1,the,rstl_1858_0018.txt,txt_rstl,1858,20
be gathered from the following facts :;—As regards the variation of,the,rstl_1858_0013.txt,txt_rstl,1858,20
of the substance. But the facts already adverted to are a,the,rstl_1858_0013.txt,txt_rstl,1858,20
T think the following new facts have been established in the,the,rstl_1858_0013.txt,txt_rstl,1858,20
they were very adhesive. These facts seem sufficient proof of the,the,rstl_1858_0031.txt,txt_rstl,1858,20
"excess of fibrine. From the facts detailed in this section, it",the,rstl_1858_0031.txt,txt_rstl,1858,20
"OF INFLAMMATION. 661 From the facts above mentioned, I became convinced",the,rstl_1858_0031.txt,txt_rstl,1858,20
"tormer are capable, renders the facts regarding them more obvious and",the,rstl_1858_0031.txt,txt_rstl,1858,20
within the yessels. But the facts mentioned by that gentleman in,the,rstl_1858_0031.txt,txt_rstl,1858,20
ut though some of the facts above mentioned furnish clear evidence,the,rstl_1858_0031.txt,txt_rstl,1858,20
the natural interpretation of these facts seems my E to be,the,rstl_1858_0031.txt,txt_rstl,1858,20
"subject, bub the meantime the facts already known furnish to the",the,rstl_1858_0031.txt,txt_rstl,1858,20
good definition. Thus far the facts of observation have been stated,the,rstl_1858_0025.txt,txt_rstl,1858,20
petty = discussions concerning the facts and opinions of the present,the,rstl_1858_0016.txt,txt_rstl,1858,20
a thorough investigation of the facts had become necessary. I have,the,rstl_1858_0034.txt,txt_rstl,1858,20
be two less than usnal; facts sufficiently puzzling without the light,the,rstl_1858_0034.txt,txt_rstl,1858,20
the latter mountain. The additional facts and inferences obtained at that,the,rstl_1858_0032.txt,txt_rstl,1858,20
"have been led Sby the facts described in the foregoing pages,",the,rstl_1858_0032.txt,txt_rstl,1858,20
"an explanation, however, of the facts would be fatal to any",the,rstl_1858_0032.txt,txt_rstl,1858,20
5 Review of the chief facts made known by the ES,the,rstl_1858_0005.txt,txt_rstl,1858,20
"EGYPT. Review of the chief facts made known by the Excavations,",the,rstl_1858_0005.txt,txt_rstl,1858,20
"= fairly deducible from the facts which these researches have disclosed,",the,rstl_1858_0005.txt,txt_rstl,1858,20
will afterwards appear that the facts to be related in this,the,rstl_1858_0006.txt,txt_rstl,1858,20
candid review of the preceding facts must inevitably conduct to the,the,rstl_1858_0006.txt,txt_rstl,1858,20
"to verify by observation the facts now to be nar- ted,",the,rstl_1858_0006.txt,txt_rstl,1858,20
The significance 2 of these facts cannot for a moment be,the,rstl_1858_0006.txt,txt_rstl,1858,20
reconcile this account with the facts which I have met with.,the,rstl_1859_0024.txt,txt_rstl,1859,20
"but if, as the \ Facts appear to indicate, the general",the,rstl_1859_0024.txt,txt_rstl,1859,20
"to the bearing of the facts contained in the present, Epaper",the,rstl_1859_0024.txt,txt_rstl,1859,20
of the popula- tion. The facts which a Life-Table expresses in,the,rstl_1859_0034.txt,txt_rstl,1859,20
"grow more exact, and the facts are multiplied, the intervals of",the,rstl_1859_0034.txt,txt_rstl,1859,20
hypothesis does not express the facts deduced from the observations exactly.,the,rstl_1859_0034.txt,txt_rstl,1859,20
"as T can, of the facts connected with the sensations of",the,rstl_1859_0017.txt,txt_rstl,1859,20
"the correct determination of these facts is concerned, it seems to",the,rstl_1859_0017.txt,txt_rstl,1859,20
clearly and fully the ordinary facts and impressions regarding colour in,the,rstl_1859_0017.txt,txt_rstl,1859,20
"the simplest manner possible, the facts I have to bring forward;",the,rstl_1859_0017.txt,txt_rstl,1859,20
"my own case, the general facts now known to characterize the",the,rstl_1859_0017.txt,txt_rstl,1859,20
will satisfactorily account for the facts observed. Take for instance the,the,rstl_1859_0017.txt,txt_rstl,1859,20
