Context,Collocate,File,Directory,Year,Frequency Filter
which I had taken. These facts I bave since endeavoured to,these,rstl_1851_0017.txt,txt_rstl,1851,20
comparing these with the £ facts of the natural history and,these,rstl_1851_0011.txt,txt_rstl,1851,20
the whole produced embryos. These facts proved that the ova employed,these,rstl_1851_0011.txt,txt_rstl,1851,20
of the area germinativa. These facts sufficiently prove the great influence,these,rstl_1851_0011.txt,txt_rstl,1851,20
uniform in the interior. These facts ap- peared to be conelusive,these,rstl_1851_0011.txt,txt_rstl,1851,20
and to show from these facts that a non-production of the,these,rstl_1851_0011.txt,txt_rstl,1851,20
"embryos had been produced. These facts seemed to show, precisely as",these,rstl_1851_0011.txt,txt_rstl,1851,20
"perhaps always unpro- ductive. These facts lead us to inquire, whether",these,rstl_1851_0011.txt,txt_rstl,1851,20
by these two illustrious anatomists. Facts will now be adduced which,these,rstl_1852_0024.txt,txt_rstl,1852,20
or peritoneal chamber. These indisputable facts establish conclusively the view which,these,rstl_1852_0024.txt,txt_rstl,1852,20
"in the true-blood. From these facts the physiologist may state, that",these,rstl_1852_0024.txt,txt_rstl,1852,20
at a considerable distance. The facts noticed by these authors are,these,rstl_1852_0001.txt,txt_rstl,1852,20
© fair inference from these facts following ; that a large,these,rstl_1852_0014.txt,txt_rstl,1852,20
the grey substance. From these facts he calcu- lates that the,these,rstl_1853_0013.txt,txt_rstl,1853,20
according to the species. These facts are well shown both in,these,rstl_1853_0010.txt,txt_rstl,1853,20
of maturity in both. These facts seem to lead to the,these,rstl_1853_0010.txt,txt_rstl,1853,20
fair then toinfer from these facts that the completion of the,these,rstl_1853_0010.txt,txt_rstl,1853,20
embryo was produced. S These facts then support the statement already,these,rstl_1853_0010.txt,txt_rstl,1853,20
structure to be fecundated. These facts deserve consideration in connexion with,these,rstl_1853_0010.txt,txt_rstl,1853,20
S influence supplied. S These facts lead us to some further,these,rstl_1853_0010.txt,txt_rstl,1853,20
"also cases of phthisis. These facts possess the greatest interest, and",these,rstl_1854_0014.txt,txt_rstl,1854,20
"these were confirmatory of the facts before stated, as the variation",these,rstl_1854_0009.txt,txt_rstl,1854,20
spoken of its length. These facts will explain the results of,these,rstl_1855_0010.txt,txt_rstl,1855,20
"; but these prove other facts also ; and first, that",these,rstl_1855_0005.txt,txt_rstl,1855,20
the same agent. Supposing these facts to have been known to,these,rstl_1855_0001.txt,txt_rstl,1855,20
the manner in which these facts have been explained. © La,these,rstl_1855_0001.txt,txt_rstl,1855,20
by critical examinations of the facts already accumulated. These menoirs I,these,rstl_1856_0020.txt,txt_rstl,1856,20
LIONEL BEALE ON THE These facts appear to me to militate,these,rstl_1856_0017.txt,txt_rstl,1856,20
a like kind. Among these facts were several that became of,these,rstl_1856_0012.txt,txt_rstl,1856,20
"identical properties. Connecting all these facts together, it clearly follows,— That",these,rstl_1856_0001.txt,txt_rstl,1856,20
inch to crush them. These facts show the great superiority of,these,rstl_1857_0039.txt,txt_rstl,1857,20
moment de leur formation.” These facts appear to be totally at,these,rstl_1857_0016.txt,txt_rstl,1857,20
"electricity. The first of these facts is, that a differential current",these,rstl_1857_0010.txt,txt_rstl,1857,20
"fibres, still I think these facts render it highly probable that",these,rstl_1857_0009.txt,txt_rstl,1857,20
"inference I deduce from these facts is, first, that the animals",these,rstl_1857_0009.txt,txt_rstl,1857,20
faces in the quadrant (111...211). Facts presented by these Tables —The,these,rstl_1857_0004.txt,txt_rstl,1857,20
angles. With regard to these facts no difference of opinion can,these,rstl_1857_0004.txt,txt_rstl,1857,20
to the same family. These facts I now proceed to particularize,these,rstl_1858_0035.txt,txt_rstl,1858,20
within half an hour. These facts appeared to me of great,these,rstl_1858_0030.txt,txt_rstl,1858,20
"the paralysed parts. All these facts tend to the same conclusion,",these,rstl_1858_0029.txt,txt_rstl,1858,20
which circulation ceased. From these facts it appears that there exists,these,rstl_1858_0029.txt,txt_rstl,1858,20
"89-3:100, or 7:10 nearly. These facts are conclusive in showing the",these,rstl_1858_0021.txt,txt_rstl,1858,20
"boilers invariably present joints, these facts are proþ of some significance",these,rstl_1858_0021.txt,txt_rstl,1858,20
they were very adhesive. These facts seem sufficient proof of the,these,rstl_1858_0031.txt,txt_rstl,1858,20
possible to explain these curious facts upon chemical Sprinciples seems very,these,rstl_1858_0031.txt,txt_rstl,1858,20
the natural interpretation of these facts seems my E to be,these,rstl_1858_0031.txt,txt_rstl,1858,20
"functions became unveiled, and Further facts were developed, these difficulties were",these,rstl_1858_0031.txt,txt_rstl,1858,20
"From these and other similar facts it appeared that mustard, croton",these,rstl_1858_0031.txt,txt_rstl,1858,20
"only very feeble action, Such facts as these prove conclusively that,",these,rstl_1858_0031.txt,txt_rstl,1858,20
"bodies, resembling spermatozoa. From these facts it can scarcely be doubted",these,rstl_1858_0034.txt,txt_rstl,1858,20
"= fairly deducible from the facts which these researches have disclosed,",these,rstl_1858_0005.txt,txt_rstl,1858,20
organs is certain from these facts :— S At a particular,these,rstl_1858_0006.txt,txt_rstl,1858,20
The significance 2 of these facts cannot for a moment be,these,rstl_1858_0006.txt,txt_rstl,1858,20
"simi- Slarly situated, leaving these facts to be discussed by others",these,rstl_1859_0017.txt,txt_rstl,1859,20
"the correct determination of these facts is concerned, it seems to",these,rstl_1859_0017.txt,txt_rstl,1859,20
more considerable diameter. = These facts puzzled me a little at,these,rstl_1859_0018.txt,txt_rstl,1859,20
HoykiNs has drawn from these facts is unavoidable ; the glaciers,these,rstl_1859_0015.txt,txt_rstl,1859,20
These experiments developed the following facts :—lIst. That the effect of,these,rstl_1859_0005.txt,txt_rstl,1859,20
"about 24 per cent. These facts are of considerable interest, when",these,rstl_1859_0025.txt,txt_rstl,1859,20
"of terrestrial induction. Bearing these facts in view, and taking further",these,rstl_1860_0021.txt,txt_rstl,1860,20
"one of the most remarkable facts is this, that these luminous",these,rstl_1860_0010.txt,txt_rstl,1860,20
at first produced. All these facts are easily explained from the,these,rstl_1860_0008.txt,txt_rstl,1860,20
with the more facility to facts and views that have heretofore,have,rstl_1851_0005.txt,txt_rstl,1851,20
"present chapter; but, as the facts have been Stated in part,",have,rstl_1851_0002.txt,txt_rstl,1851,20
"present chapter; but, as the facts have been Stated in part,",have,rstl_1851_0002.txt,txt_rstl,1851,20
"with this subject, because the facts I have ascertained regarding it",have,rstl_1852_0001.txt,txt_rstl,1852,20
signification of several of the facts with which we have thus,have,rstl_1853_0015.txt,txt_rstl,1853,20
for of what value are facts until they have been made,have,rstl_1853_0002.txt,txt_rstl,1853,20
667). Again :—* From the facts which have just been stated,have,rstl_1853_0002.txt,txt_rstl,1853,20
"also Mr. Hexrrey$%, have noticed facts in regard to that of",have,rstl_1853_0010.txt,txt_rstl,1853,20
organs of respiration. From the facts which I have already succeeded,have,rstl_1854_0014.txt,txt_rstl,1854,20
experiments have therefore elicited three facts as regards beams formed of,have,rstl_1855_0009.txt,txt_rstl,1855,20
the same agent. Supposing these facts to have been known to,have,rstl_1855_0001.txt,txt_rstl,1855,20
the manner in which these facts have been explained. © La,have,rstl_1855_0001.txt,txt_rstl,1855,20
"growth; on which inquiry, the facts which I have now brought",have,rstl_1856_0027.txt,txt_rstl,1856,20
"any other explanation of the facts I have observed, or of",have,rstl_1856_0017.txt,txt_rstl,1856,20
stroma ; but if the facts T have stated be not,have,rstl_1857_0027.txt,txt_rstl,1857,20
"this respect. 2 From the facts that have just been mentioned,",have,rstl_1857_0009.txt,txt_rstl,1857,20
appears strictly comparable to the facts which have been obseryed in,have,rstl_1857_0007.txt,txt_rstl,1857,20
T think the following new facts have been established in the,have,rstl_1858_0013.txt,txt_rstl,1858,20
for myself; and several new facts which I have unexpectedly met,have,rstl_1858_0031.txt,txt_rstl,1858,20
good definition. Thus far the facts of observation have been stated,have,rstl_1858_0025.txt,txt_rstl,1858,20
a thorough investigation of the facts had become necessary. I have,have,rstl_1858_0034.txt,txt_rstl,1858,20
"have been led Sby the facts described in the foregoing pages,",have,rstl_1858_0032.txt,txt_rstl,1858,20
"= fairly deducible from the facts which these researches have disclosed,",have,rstl_1858_0005.txt,txt_rstl,1858,20
and of observing some interesting facts which have not been clearly,have,rstl_1859_0024.txt,txt_rstl,1859,20
reconcile this account with the facts which I have met with.,have,rstl_1859_0024.txt,txt_rstl,1859,20
"the simplest manner possible, the facts I have to bring forward;",have,rstl_1859_0017.txt,txt_rstl,1859,20
we find that the extreme facts have been dwelt upon princi-,have,rstl_1859_0015.txt,txt_rstl,1859,20
to interference; but the new facts which have been elicited in,have,rstl_1859_0007.txt,txt_rstl,1859,20
NERVES Conclusions. 'The most important facts which have been elucidated in,have,rstl_1860_0028.txt,txt_rstl,1860,20
"frame, as it were—the various facts which I have collected relating",have,rstl_1860_0023.txt,txt_rstl,1860,20
"they are isolated, and the facts which they have established can",have,rstl_1860_0024.txt,txt_rstl,1860,20
to the analogy of the facts which have been determined by,have,rstl_1860_0026.txt,txt_rstl,1860,20
of the large body of facts which have been brought together,have,rstl_1860_0026.txt,txt_rstl,1860,20
it extremely desirable that the facts which are to be Q,which,rstl_1851_0032.txt,txt_rstl,1851,20
"of this paper, that those facts only which were verified by",which,rstl_1851_0029.txt,txt_rstl,1851,20
being a contractile tissue. The facts which seem to militate against,which,rstl_1851_0010.txt,txt_rstl,1851,20
phenomena of magnetism those elementary facts which are to serve for,which,rstl_1851_0002.txt,txt_rstl,1851,20
former inquiry had elicited several facts which I was unable to,which,rstl_1851_0017.txt,txt_rstl,1851,20
which I had taken. These facts I bave since endeavoured to,which,rstl_1851_0017.txt,txt_rstl,1851,20
phenomena of magnetism those elementary facts which are to serve for,which,rstl_1851_0002.txt,txt_rstl,1851,20
produce rapidly a body of facts on which philosophers may proceed,which,rstl_1851_0006.txt,txt_rstl,1851,20
"think, is rendered certain by facts now shown, which escaped the",which,rstl_1851_0011.txt,txt_rstl,1851,20
"which are objectionable from the facts shown in Dr. Frericns' analyses,",which,rstl_1851_0011.txt,txt_rstl,1851,20
by these two illustrious anatomists. Facts will now be adduced which,which,rstl_1852_0024.txt,txt_rstl,1852,20
or peritoneal chamber. These indisputable facts establish conclusively the view which,which,rstl_1852_0024.txt,txt_rstl,1852,20
this bold =tatement by the facts which already my own labours,which,rstl_1852_0024.txt,txt_rstl,1852,20
secretion in living animals. The facts which the experiments related in,which,rstl_1852_0016.txt,txt_rstl,1852,20
"disturbance in different years, the facts which present themselves most obviously",which,rstl_1852_0009.txt,txt_rstl,1852,20
less remarkable than are the facts which they combine to indi-,which,rstl_1852_0009.txt,txt_rstl,1852,20
are bound to receive the facts which may appear to indicate,which,rstl_1852_0009.txt,txt_rstl,1852,20
"which has reference to experimental facts and not to hypotheses only,",which,rstl_1852_0004.txt,txt_rstl,1852,20
signification of several of the facts with which we have thus,which,rstl_1853_0015.txt,txt_rstl,1853,20
one'of the most'striking of the facts which he has 86 skilfully,which,rstl_1853_0015.txt,txt_rstl,1853,20
The conelusion to which the facts s0nght to be demonstrated in,which,rstl_1853_0015.txt,txt_rstl,1853,20
667). Again :—* From the facts which have just been stated,which,rstl_1853_0002.txt,txt_rstl,1853,20
organs of respiration. From the facts which I have already succeeded,which,rstl_1854_0014.txt,txt_rstl,1854,20
all of which the same facts could be noted. The segmentation,which,rstl_1854_0009.txt,txt_rstl,1854,20
tried in the search for facts which might throw light on,which,rstl_1854_0008.txt,txt_rstl,1854,20
1855. Ir is among the facts in chemical science which admit,which,rstl_1855_0008.txt,txt_rstl,1855,20
which appears to represent the facts with a con- siderable degree,which,rstl_1855_0002.txt,txt_rstl,1855,20
the manner in which these facts have been explained. © La,which,rstl_1855_0001.txt,txt_rstl,1855,20
"M. MarTevecr, and converted the facts upon which the objection is",which,rstl_1855_0001.txt,txt_rstl,1855,20
critical review of all the facts of the case which at,which,rstl_1855_0017.txt,txt_rstl,1855,20
"growth; on which inquiry, the facts which I have now brought",which,rstl_1856_0027.txt,txt_rstl,1856,20
"which presumption was corroborated by facts adduced in the £ame communication,",which,rstl_1856_0016.txt,txt_rstl,1856,20
conclusively established by the following facts :—In all the spirit-specimens which,which,rstl_1856_0012.txt,txt_rstl,1856,20
not premature to search for facts which may serve as starting-points,which,rstl_1857_0019.txt,txt_rstl,1857,20
"writes, © a multitude of facts which scem to necessitate the",which,rstl_1857_0016.txt,txt_rstl,1857,20
appears strictly comparable to the facts which have been obseryed in,which,rstl_1857_0007.txt,txt_rstl,1857,20
without a knowledge of the facts upon which zoologists ve adopted,which,rstl_1858_0028.txt,txt_rstl,1858,20
which circulation ceased. From these facts it appears that there exists,which,rstl_1858_0029.txt,txt_rstl,1858,20
and we trust that the facts which we are about to,which,rstl_1858_0018.txt,txt_rstl,1858,20
for myself; and several new facts which I have unexpectedly met,which,rstl_1858_0031.txt,txt_rstl,1858,20
"= fairly deducible from the facts which these researches have disclosed,",which,rstl_1858_0005.txt,txt_rstl,1858,20
and of observing some interesting facts which have not been clearly,which,rstl_1859_0024.txt,txt_rstl,1859,20
reconcile this account with the facts which I have met with.,which,rstl_1859_0024.txt,txt_rstl,1859,20
of the popula- tion. The facts which a Life-Table expresses in,which,rstl_1859_0034.txt,txt_rstl,1859,20
of the other set of facts on which the opponents of,which,rstl_1859_0014.txt,txt_rstl,1859,20
together a great mass of facts which will perhaps ere long,which,rstl_1859_0018.txt,txt_rstl,1859,20
not help feeling that the facts and arguments which I was,which,rstl_1859_0015.txt,txt_rstl,1859,20
to interference; but the new facts which have been elicited in,which,rstl_1859_0007.txt,txt_rstl,1859,20
"the main and more prominent facts and conclusions, which the investigation,",which,rstl_1859_0025.txt,txt_rstl,1859,20
the full explanation of the facts and conclusions which Chemistry and,which,rstl_1859_0025.txt,txt_rstl,1859,20
NERVES Conclusions. 'The most important facts which have been elucidated in,which,rstl_1860_0028.txt,txt_rstl,1860,20
"frame, as it were—the various facts which I have collected relating",which,rstl_1860_0023.txt,txt_rstl,1860,20
"they are isolated, and the facts which they have established can",which,rstl_1860_0024.txt,txt_rstl,1860,20
"in its other reactions, any facts which countenance this otherwise improbable",which,rstl_1860_0008.txt,txt_rstl,1860,20
to the analogy of the facts which have been determined by,which,rstl_1860_0026.txt,txt_rstl,1860,20
of the large body of facts which have been brought together,which,rstl_1860_0026.txt,txt_rstl,1860,20
may be inferred from the facts of its structure. Being filled,from,rstl_1851_0011.txt,txt_rstl,1851,20
"which are objectionable from the facts shown in Dr. Frericns' analyses,",from,rstl_1851_0011.txt,txt_rstl,1851,20
and to show from these facts that a non-production of the,from,rstl_1851_0011.txt,txt_rstl,1851,20
recapitulate briefly some of the facts and views derived from the,from,rstl_1851_0011.txt,txt_rstl,1851,20
"in the true-blood. From these facts the physiologist may state, that",from,rstl_1852_0024.txt,txt_rstl,1852,20
© fair inference from these facts following ; that a large,from,rstl_1852_0014.txt,txt_rstl,1852,20
the grey substance. From these facts he calcu- lates that the,from,rstl_1853_0013.txt,txt_rstl,1853,20
"Hobarton. We may expect, from facts already known, some agreement in",from,rstl_1853_0006.txt,txt_rstl,1853,20
667). Again :—* From the facts which have just been stated,from,rstl_1853_0002.txt,txt_rstl,1853,20
fair then toinfer from these facts that the completion of the,from,rstl_1853_0010.txt,txt_rstl,1853,20
to be drawn from the facts of natural impregnation in the,from,rstl_1853_0010.txt,txt_rstl,1853,20
organs of respiration. From the facts which I have already succeeded,from,rstl_1854_0014.txt,txt_rstl,1854,20
"fecundating fluid. . From the facts stated above, and before detailed",from,rstl_1854_0009.txt,txt_rstl,1854,20
from pole to pole. The facts observed by M. MaTTEvcer seem,from,rstl_1855_0001.txt,txt_rstl,1855,20
"proved, by the comparison of facts then to be addaced from",from,rstl_1856_0027.txt,txt_rstl,1856,20
"Electrical Convections of Heat, from Facts of Thermo-electric Inversion. 102. 'The",from,rstl_1856_0031.txt,txt_rstl,1856,20
24% 259 26? Several curious facts become apparent from inspection of,from,rstl_1857_0022.txt,txt_rstl,1857,20
"this respect. 2 From the facts that have just been mentioned,",from,rstl_1857_0009.txt,txt_rstl,1857,20
"inference I deduce from these facts is, first, that the animals",from,rstl_1857_0009.txt,txt_rstl,1857,20
"from a Tenia-embryo. Finally, the facts made known in this communication",from,rstl_1857_0009.txt,txt_rstl,1857,20
which circulation ceased. From these facts it appears that there exists,from,rstl_1858_0029.txt,txt_rstl,1858,20
evidence quite distinet from the facts mentioned with relation to the,from,rstl_1858_0017.txt,txt_rstl,1858,20
be gathered from the following facts :;—As regards the variation of,from,rstl_1858_0013.txt,txt_rstl,1858,20
"excess of fibrine. From the facts detailed in this section, it",from,rstl_1858_0031.txt,txt_rstl,1858,20
"OF INFLAMMATION. 661 From the facts above mentioned, I became convinced",from,rstl_1858_0031.txt,txt_rstl,1858,20
"From these and other similar facts it appeared that mustard, croton",from,rstl_1858_0031.txt,txt_rstl,1858,20
"bodies, resembling spermatozoa. From these facts it can scarcely be doubted",from,rstl_1858_0034.txt,txt_rstl,1858,20
"= fairly deducible from the facts which these researches have disclosed,",from,rstl_1858_0005.txt,txt_rstl,1858,20
organs is certain from these facts :— S At a particular,from,rstl_1858_0006.txt,txt_rstl,1858,20
hypothesis does not express the facts deduced from the observations exactly.,from,rstl_1859_0034.txt,txt_rstl,1859,20
HoykiNs has drawn from these facts is unavoidable ; the glaciers,from,rstl_1859_0015.txt,txt_rstl,1859,20
largest acces- Sions of new facts by reasoning deductively from fundamental,from,rstl_1859_0005.txt,txt_rstl,1859,20
be deduced from the following facts — 1. At the turning-points,from,rstl_1860_0011.txt,txt_rstl,1860,20
"mechanical mixtures, we know from facts determined by other experimenters; thus,",from,rstl_1860_0011.txt,txt_rstl,1860,20
at first produced. All these facts are easily explained from the,from,rstl_1860_0008.txt,txt_rstl,1860,20
in its relations to analogous facts drawn from the far greater,from,rstl_1860_0026.txt,txt_rstl,1860,20
it extremely desirable that the facts which are to be Q,that,rstl_1851_0032.txt,txt_rstl,1851,20
"of this paper, that those facts only which were verified by",that,rstl_1851_0029.txt,txt_rstl,1851,20
with the more facility to facts and views that have heretofore,that,rstl_1851_0005.txt,txt_rstl,1851,20
"at Toronto and Hobarton, the facts appear to be that the",that,rstl_1851_0005.txt,txt_rstl,1851,20
We are forced by unequivocal facts to admit that the fourth,that,rstl_1851_0017.txt,txt_rstl,1851,20
the whole produced embryos. These facts proved that the ova employed,that,rstl_1851_0011.txt,txt_rstl,1851,20
a state of nature. 'These facts appear to give that direct,that,rstl_1851_0011.txt,txt_rstl,1851,20
and to show from these facts that a non-production of the,that,rstl_1851_0011.txt,txt_rstl,1851,20
"in the true-blood. From these facts the physiologist may state, that",that,rstl_1852_0024.txt,txt_rstl,1852,20
am of opinion that the facts detailed in this paper are,that,rstl_1852_0005.txt,txt_rstl,1852,20
© fair inference from these facts following ; that a large,that,rstl_1852_0014.txt,txt_rstl,1852,20
Itis quite/possible that when the facts shall-have|been/more precisely/Jetermined; it may prove'that-neither,that,rstl_1853_0019.txt,txt_rstl,1853,20
the grey substance. From these facts he calcu- lates that the,that,rstl_1853_0013.txt,txt_rstl,1853,20
fair then toinfer from these facts that the completion of the,that,rstl_1853_0010.txt,txt_rstl,1853,20
"well be supposed that the facts just mentioned were exceedingly puzzling,",that,rstl_1853_0010.txt,txt_rstl,1853,20
"also Mr. Hexrrey$%, have noticed facts in regard to that of",that,rstl_1853_0010.txt,txt_rstl,1853,20
therefore sought diligently for any facts that might coun- tenance such,that,rstl_1854_0011.txt,txt_rstl,1854,20
accurate conclusion that the observed facts may justify. For all practical,that,rstl_1854_0013.txt,txt_rstl,1854,20
"; but these prove other facts also ; and first, that",that,rstl_1855_0005.txt,txt_rstl,1855,20
does not sufficiently express the facts to say that the bar,that,rstl_1855_0001.txt,txt_rstl,1855,20
a like kind. Among these facts were several that became of,that,rstl_1856_0012.txt,txt_rstl,1856,20
"identical properties. Connecting all these facts together, it clearly follows,— That",that,rstl_1856_0001.txt,txt_rstl,1856,20
"deserved. There were but few facts known, at that period, with",that,rstl_1857_0029.txt,txt_rstl,1857,20
prevented further publication of the facts at that time; but I,that,rstl_1857_0017.txt,txt_rstl,1857,20
"electricity. The first of these facts is, that a differential current",that,rstl_1857_0010.txt,txt_rstl,1857,20
"this respect. 2 From the facts that have just been mentioned,",that,rstl_1857_0009.txt,txt_rstl,1857,20
"fibres, still I think these facts render it highly probable that",that,rstl_1857_0009.txt,txt_rstl,1857,20
"inference I deduce from these facts is, first, that the animals",that,rstl_1857_0009.txt,txt_rstl,1857,20
LISTER ON THE CUTANEOUS 'These facts indicated pretty clearly that the,that,rstl_1858_0030.txt,txt_rstl,1858,20
The idea suggested by the facts is that the tissues begin,that,rstl_1858_0030.txt,txt_rstl,1858,20
which circulation ceased. From these facts it appears that there exists,that,rstl_1858_0029.txt,txt_rstl,1858,20
and we trust that the facts which we are about to,that,rstl_1858_0018.txt,txt_rstl,1858,20
within the yessels. But the facts mentioned by that gentleman in,that,rstl_1858_0031.txt,txt_rstl,1858,20
"From these and other similar facts it appeared that mustard, croton",that,rstl_1858_0031.txt,txt_rstl,1858,20
the latter mountain. The additional facts and inferences obtained at that,that,rstl_1858_0032.txt,txt_rstl,1858,20
will afterwards appear that the facts to be related in this,that,rstl_1858_0006.txt,txt_rstl,1858,20
"phenomena. 'The analysis of the facts gives the result, that where",that,rstl_1859_0014.txt,txt_rstl,1859,20
not help feeling that the facts and arguments which I was,that,rstl_1859_0015.txt,txt_rstl,1859,20
the sliding theory. That such facts exist is known to every,that,rstl_1859_0015.txt,txt_rstl,1859,20
we find that the extreme facts have been dwelt upon princi-,that,rstl_1859_0015.txt,txt_rstl,1859,20
These experiments developed the following facts :—lIst. That the effect of,that,rstl_1859_0005.txt,txt_rstl,1859,20
"in that of others, the facts peculiar to Physiology herself must",that,rstl_1859_0025.txt,txt_rstl,1859,20
"one of the most remarkable facts is this, that these luminous",that,rstl_1860_0010.txt,txt_rstl,1860,20
former inquiry had elicited several facts which I was unable to,i,rstl_1851_0017.txt,txt_rstl,1851,20
which I had taken. These facts I bave since endeavoured to,i,rstl_1851_0017.txt,txt_rstl,1851,20
was not in accordance with facts I had very long been,i,rstl_1851_0011.txt,txt_rstl,1851,20
"Remarks—An examination of the preceding facts will, I think, justify me",i,rstl_1852_0005.txt,txt_rstl,1852,20
"with this subject, because the facts I have ascertained regarding it",i,rstl_1852_0001.txt,txt_rstl,1852,20
circulation in the Mollusca. The facts I MR. T. H. HUXLEY,i,rstl_1853_0002.txt,txt_rstl,1853,20
organs of respiration. From the facts which I have already succeeded,i,rstl_1854_0014.txt,txt_rstl,1854,20
"growth; on which inquiry, the facts which I have now brought",i,rstl_1856_0027.txt,txt_rstl,1856,20
by critical examinations of the facts already accumulated. These menoirs I,i,rstl_1856_0020.txt,txt_rstl,1856,20
"any other explanation of the facts I have observed, or of",i,rstl_1856_0017.txt,txt_rstl,1856,20
