Context,Collocate,File,Directory,Year,Frequency Filter
"4). A consideration of the facts thus presented to notice, led",of,rstl_1852_0005.txt,txt_rstl,1852,20
"Remarks—An examination of the preceding facts will, I think, justify me",of,rstl_1852_0005.txt,txt_rstl,1852,20
am of opinion that the facts detailed in this paper are,of,rstl_1852_0005.txt,txt_rstl,1852,20
"the vast mass of accumulated facts in electrical science, and likely",of,rstl_1852_0008.txt,txt_rstl,1852,20
and long-continued observations. As ES facts and collocations of this description,of,rstl_1852_0009.txt,txt_rstl,1852,20
"1:33, and at Hobarton 1-34, Facts of such remarkable character, evidenced",of,rstl_1852_0009.txt,txt_rstl,1852,20
"epoch is traceable. Now the facts of the solar spots, as",of,rstl_1852_0009.txt,txt_rstl,1852,20
signification of several of the facts with which we have thus,of,rstl_1853_0015.txt,txt_rstl,1853,20
one'of the most'striking of the facts which he has 86 skilfully,of,rstl_1853_0015.txt,txt_rstl,1853,20
of a periodical character: the facts appear to be important materials,of,rstl_1853_0006.txt,txt_rstl,1853,20
"con- Sideration of the foregoing facts will, we think, lead to",of,rstl_1853_0004.txt,txt_rstl,1853,20
"A consideration of the foregoing facts will, we think, lead to",of,rstl_1853_0004.txt,txt_rstl,1853,20
for of what value are facts until they have been made,of,rstl_1853_0002.txt,txt_rstl,1853,20
"in considering what of new facts it contains, as of snhordinate",of,rstl_1853_0002.txt,txt_rstl,1853,20
a due regard to the facts presented by the development of,of,rstl_1853_0002.txt,txt_rstl,1853,20
to explain and account for facts of organization whose absolute genesis,of,rstl_1853_0002.txt,txt_rstl,1853,20
to bring into prominence some facts in the anatomy of the,of,rstl_1853_0002.txt,txt_rstl,1853,20
"is one of the earliest facts in molluscons development, and it",of,rstl_1853_0002.txt,txt_rstl,1853,20
of maturity in both. These facts seem to lead to the,of,rstl_1853_0010.txt,txt_rstl,1853,20
fair then toinfer from these facts that the completion of the,of,rstl_1853_0010.txt,txt_rstl,1853,20
"also Mr. Hexrrey$%, have noticed facts in regard to that of",of,rstl_1853_0010.txt,txt_rstl,1853,20
Invertebrata. A comparison of the facts in the two divisions of,of,rstl_1853_0010.txt,txt_rstl,1853,20
to be drawn from the facts of natural impregnation in the,of,rstl_1853_0010.txt,txt_rstl,1853,20
force in the spermatozoon. The facts now 8tated of penetration by,of,rstl_1853_0010.txt,txt_rstl,1853,20
"tions, together with the chief facts connected with the occurrence of",of,rstl_1854_0014.txt,txt_rstl,1854,20
organs of respiration. From the facts which I have already succeeded,of,rstl_1854_0014.txt,txt_rstl,1854,20
"also cases of phthisis. These facts possess the greatest interest, and",of,rstl_1854_0014.txt,txt_rstl,1854,20
then the whole of the facts and observations recorded in this,of,rstl_1854_0014.txt,txt_rstl,1854,20
all of which the same facts could be noted. The segmentation,of,rstl_1854_0009.txt,txt_rstl,1854,20
"these were confirmatory of the facts before stated, as the variation",of,rstl_1854_0009.txt,txt_rstl,1854,20
the same metal. The same facts deprive the latter part of,of,rstl_1854_0001.txt,txt_rstl,1854,20
similar degree of diffusibility*. The facts appear to afford a strong,of,rstl_1854_0008.txt,txt_rstl,1854,20
"its explanation, with many other facts of the subject, till fuller",of,rstl_1854_0008.txt,txt_rstl,1854,20
spoken of its length. These facts will explain the results of,of,rstl_1855_0010.txt,txt_rstl,1855,20
experiments have therefore elicited three facts as regards beams formed of,of,rstl_1855_0009.txt,txt_rstl,1855,20
law here deduced represents the facts of the case. The value,of,rstl_1855_0002.txt,txt_rstl,1855,20
critical review of all the facts of the case which at,of,rstl_1855_0017.txt,txt_rstl,1855,20
"proved, by the comparison of facts then to be addaced from",of,rstl_1856_0027.txt,txt_rstl,1856,20
"now, we review the principal facts relating to the structure of",of,rstl_1856_0027.txt,txt_rstl,1856,20
based on an order of facts relating to the economy of,of,rstl_1856_0027.txt,txt_rstl,1856,20
"Electrical Convections of Heat, from Facts of Thermo-electric Inversion. 102. 'The",of,rstl_1856_0031.txt,txt_rstl,1856,20
by critical examinations of the facts already accumulated. These menoirs I,of,rstl_1856_0020.txt,txt_rstl,1856,20
"any other explanation of the facts I have observed, or of",of,rstl_1856_0017.txt,txt_rstl,1856,20
a like kind. Among these facts were several that became of,of,rstl_1856_0012.txt,txt_rstl,1856,20
"are in harmony with the facts of observation. All the Orbitolites,",of,rstl_1856_0012.txt,txt_rstl,1856,20
inch to crush them. These facts show the great superiority of,of,rstl_1857_0039.txt,txt_rstl,1857,20
prevented further publication of the facts at that time; but I,of,rstl_1857_0017.txt,txt_rstl,1857,20
24% 259 26? Several curious facts become apparent from inspection of,of,rstl_1857_0022.txt,txt_rstl,1857,20
"writes, © a multitude of facts which scem to necessitate the",of,rstl_1857_0016.txt,txt_rstl,1857,20
rigorous demonstration of the principal facts and laws of muscular electri-,of,rstl_1857_0010.txt,txt_rstl,1857,20
clear explanation of several important facts of muscular electricity. The first,of,rstl_1857_0010.txt,txt_rstl,1857,20
"electricity. The first of these facts is, that a differential current",of,rstl_1857_0010.txt,txt_rstl,1857,20
close coincidence between all the facts of light and the physical,of,rstl_1857_0011.txt,txt_rstl,1857,20
supposition leaves many of the facts either imperfectly explained or untouched.,of,rstl_1857_0011.txt,txt_rstl,1857,20
angles. With regard to these facts no difference of opinion can,of,rstl_1857_0004.txt,txt_rstl,1857,20
"subject, both as to the facts of the case and as",of,rstl_1858_0036.txt,txt_rstl,1858,20
within half an hour. These facts appeared to me of great,of,rstl_1858_0030.txt,txt_rstl,1858,20
without a knowledge of the facts upon which zoologists ve adopted,of,rstl_1858_0028.txt,txt_rstl,1858,20
"boilers invariably present joints, these facts are proþ of some significance",of,rstl_1858_0021.txt,txt_rstl,1858,20
be gathered from the following facts :;—As regards the variation of,of,rstl_1858_0013.txt,txt_rstl,1858,20
of the substance. But the facts already adverted to are a,of,rstl_1858_0013.txt,txt_rstl,1858,20
they were very adhesive. These facts seem sufficient proof of the,of,rstl_1858_0031.txt,txt_rstl,1858,20
"excess of fibrine. From the facts detailed in this section, it",of,rstl_1858_0031.txt,txt_rstl,1858,20
"OF INFLAMMATION. 661 From the facts above mentioned, I became convinced",of,rstl_1858_0031.txt,txt_rstl,1858,20
characters ; and many other facts of similar nature might be,of,rstl_1858_0031.txt,txt_rstl,1858,20
ut though some of the facts above mentioned furnish clear evidence,of,rstl_1858_0031.txt,txt_rstl,1858,20
the natural interpretation of these facts seems my E to be,of,rstl_1858_0031.txt,txt_rstl,1858,20
good definition. Thus far the facts of observation have been stated,of,rstl_1858_0025.txt,txt_rstl,1858,20
petty = discussions concerning the facts and opinions of the present,of,rstl_1858_0016.txt,txt_rstl,1858,20
a thorough investigation of the facts had become necessary. I have,of,rstl_1858_0034.txt,txt_rstl,1858,20
and partly of inattention to facts supposed to be of no,of,rstl_1858_0032.txt,txt_rstl,1858,20
"an explanation, however, of the facts would be fatal to any",of,rstl_1858_0032.txt,txt_rstl,1858,20
5 Review of the chief facts made known by the ES,of,rstl_1858_0005.txt,txt_rstl,1858,20
"EGYPT. Review of the chief facts made known by the Excavations,",of,rstl_1858_0005.txt,txt_rstl,1858,20
candid review of the preceding facts must inevitably conduct to the,of,rstl_1858_0006.txt,txt_rstl,1858,20
The significance 2 of these facts cannot for a moment be,of,rstl_1858_0006.txt,txt_rstl,1858,20
and of observing some interesting facts which have not been clearly,of,rstl_1859_0024.txt,txt_rstl,1859,20
"to the bearing of the facts contained in the present, Epaper",of,rstl_1859_0024.txt,txt_rstl,1859,20
of the popula- tion. The facts which a Life-Table expresses in,of,rstl_1859_0034.txt,txt_rstl,1859,20
"more years, a number of facts is obtained sufficiently great to",of,rstl_1859_0034.txt,txt_rstl,1859,20
"grow more exact, and the facts are multiplied, the intervals of",of,rstl_1859_0034.txt,txt_rstl,1859,20
"as T can, of the facts connected with the sensations of",of,rstl_1859_0017.txt,txt_rstl,1859,20
"the correct determination of these facts is concerned, it seems to",of,rstl_1859_0017.txt,txt_rstl,1859,20
and open 8lowly. Sand both facts are demonstrative of the non-viscosity,of,rstl_1859_0014.txt,txt_rstl,1859,20
"broadly, then, two classes of facts address themselves to the attention",of,rstl_1859_0014.txt,txt_rstl,1859,20
"phenomena. 'The analysis of the facts gives the result, that where",of,rstl_1859_0014.txt,txt_rstl,1859,20
"take account of all the facts adduced in proof of viscosity,",of,rstl_1859_0014.txt,txt_rstl,1859,20
of the other set of facts on which the opponents of,of,rstl_1859_0014.txt,txt_rstl,1859,20
together a great mass of facts which will perhaps ere long,of,rstl_1859_0018.txt,txt_rstl,1859,20
nor its : tributaries furnished facts capable of completely deciding the,of,rstl_1859_0015.txt,txt_rstl,1859,20
These experiments developed the following facts :—lIst. That the effect of,of,rstl_1859_0005.txt,txt_rstl,1859,20
largest acces- Sions of new facts by reasoning deductively from fundamental,of,rstl_1859_0005.txt,txt_rstl,1859,20
"about 24 per cent. These facts are of considerable interest, when",of,rstl_1859_0025.txt,txt_rstl,1859,20
"in that of others, the facts peculiar to Physiology herself must",of,rstl_1859_0025.txt,txt_rstl,1859,20
the full explanation of the facts and conclusions which Chemistry and,of,rstl_1859_0025.txt,txt_rstl,1859,20
"of the feeding experiment. The facts bere «tated, will of course",of,rstl_1859_0025.txt,txt_rstl,1859,20
ounce to the pound. The facts as to the amount of,of,rstl_1860_0027.txt,txt_rstl,1860,20
the collection Zand discussion of facts elicited in the investigations of,of,rstl_1860_0017.txt,txt_rstl,1860,20
"of terrestrial induction. Bearing these facts in view, and taking further",of,rstl_1860_0021.txt,txt_rstl,1860,20
"one of the most remarkable facts is this, that these luminous",of,rstl_1860_0010.txt,txt_rstl,1860,20
"One of the most, obvious facts on looking at the equations",of,rstl_1860_0009.txt,txt_rstl,1860,20
a positive explanation of the facts now described regarding 0zone. 'I'he,of,rstl_1860_0008.txt,txt_rstl,1860,20
structive to consider whether the facts already known admit of a,of,rstl_1860_0008.txt,txt_rstl,1860,20
full possession of all the facts bearing upon his discoveries. To,of,rstl_1860_0018.txt,txt_rstl,1860,20
and of ome other interesting facts connected with the fossil bones,of,rstl_1860_0018.txt,txt_rstl,1860,20
to the analogy of the facts which have been determined by,of,rstl_1860_0026.txt,txt_rstl,1860,20
of the large body of facts which have been brought together,of,rstl_1860_0026.txt,txt_rstl,1860,20
"circum- S stances may permit, facts of the same class obtained",of,rstl_1851_0032.txt,txt_rstl,1851,20
the means of generalizing the facts of the = Annual and,of,rstl_1851_0032.txt,txt_rstl,1851,20
"a correct representation of the facts of nature. MAGNETIC DECLINATION, AT",of,rstl_1851_0032.txt,txt_rstl,1851,20
of what would be the facts of the Annual and Diurnal,of,rstl_1851_0032.txt,txt_rstl,1851,20
"of this paper, that those facts only which were verified by",of,rstl_1851_0029.txt,txt_rstl,1851,20
"therefore, a few of the facts brought forward in this paper",of,rstl_1851_0029.txt,txt_rstl,1851,20
following summary of the principal facts described in this paper may,of,rstl_1851_0029.txt,txt_rstl,1851,20
a means of colligating the facts (for at best it can,of,rstl_1851_0027.txt,txt_rstl,1851,20
"advanced, besides agreeing with the facts regarding the direction of the",of,rstl_1851_0005.txt,txt_rstl,1851,20
phenomena of magnetism those elementary facts which are to serve for,of,rstl_1851_0002.txt,txt_rstl,1851,20
phenomena of magnetism those elementary facts which are to serve for,of,rstl_1851_0002.txt,txt_rstl,1851,20
produce rapidly a body of facts on which philosophers may proceed,of,rstl_1851_0006.txt,txt_rstl,1851,20
As an expression of the facts for use in applying them,of,rstl_1851_0006.txt,txt_rstl,1851,20
comparing these with the £ facts of the natural history and,of,rstl_1851_0011.txt,txt_rstl,1851,20
may be inferred from the facts of its structure. Being filled,of,rstl_1851_0011.txt,txt_rstl,1851,20
"in the germinal vesicle, the facts observed in the ova of",of,rstl_1851_0011.txt,txt_rstl,1851,20
of the area germinativa. These facts sufficiently prove the great influence,of,rstl_1851_0011.txt,txt_rstl,1851,20
a state of nature. 'These facts appear to give that direct,of,rstl_1851_0011.txt,txt_rstl,1851,20
and to show from these facts that a non-production of the,of,rstl_1851_0011.txt,txt_rstl,1851,20
recapitulate briefly some of the facts and views derived from the,of,rstl_1851_0011.txt,txt_rstl,1851,20
did s0 well with the facts elicited during the oute of,of,rstl_1852_0020.txt,txt_rstl,1852,20
Society a collection of A facts observed with repeated and scrupulous,of,rstl_1852_0024.txt,txt_rstl,1852,20
ALper and Hancock adduce additional facts corroborative of their former conclusions.,of,rstl_1852_0024.txt,txt_rstl,1852,20
a current of fluid-sand. 'These facts are here noticed in historic,of,rstl_1852_0024.txt,txt_rstl,1852,20
"4). A consideration of the facts thus presented to notice, led",of,rstl_1852_0005.txt,txt_rstl,1852,20
"Remarks—An examination of the preceding facts will, I think, justify me",of,rstl_1852_0005.txt,txt_rstl,1852,20
am of opinion that the facts detailed in this paper are,of,rstl_1852_0005.txt,txt_rstl,1852,20
"the vast mass of accumulated facts in electrical science, and likely",of,rstl_1852_0008.txt,txt_rstl,1852,20
and long-continued observations. As ES facts and collocations of this description,of,rstl_1852_0009.txt,txt_rstl,1852,20
"1:33, and at Hobarton 1-34, Facts of such remarkable character, evidenced",of,rstl_1852_0009.txt,txt_rstl,1852,20
"epoch is traceable. Now the facts of the solar spots, as",of,rstl_1852_0009.txt,txt_rstl,1852,20
signification of several of the facts with which we have thus,of,rstl_1853_0015.txt,txt_rstl,1853,20
one'of the most'striking of the facts which he has 86 skilfully,of,rstl_1853_0015.txt,txt_rstl,1853,20
of a periodical character: the facts appear to be important materials,of,rstl_1853_0006.txt,txt_rstl,1853,20
"con- Sideration of the foregoing facts will, we think, lead to",of,rstl_1853_0004.txt,txt_rstl,1853,20
"A consideration of the foregoing facts will, we think, lead to",of,rstl_1853_0004.txt,txt_rstl,1853,20
for of what value are facts until they have been made,of,rstl_1853_0002.txt,txt_rstl,1853,20
"in considering what of new facts it contains, as of snhordinate",of,rstl_1853_0002.txt,txt_rstl,1853,20
a due regard to the facts presented by the development of,of,rstl_1853_0002.txt,txt_rstl,1853,20
to explain and account for facts of organization whose absolute genesis,of,rstl_1853_0002.txt,txt_rstl,1853,20
to bring into prominence some facts in the anatomy of the,of,rstl_1853_0002.txt,txt_rstl,1853,20
"is one of the earliest facts in molluscons development, and it",of,rstl_1853_0002.txt,txt_rstl,1853,20
of maturity in both. These facts seem to lead to the,of,rstl_1853_0010.txt,txt_rstl,1853,20
fair then toinfer from these facts that the completion of the,of,rstl_1853_0010.txt,txt_rstl,1853,20
"also Mr. Hexrrey$%, have noticed facts in regard to that of",of,rstl_1853_0010.txt,txt_rstl,1853,20
Invertebrata. A comparison of the facts in the two divisions of,of,rstl_1853_0010.txt,txt_rstl,1853,20
to be drawn from the facts of natural impregnation in the,of,rstl_1853_0010.txt,txt_rstl,1853,20
force in the spermatozoon. The facts now 8tated of penetration by,of,rstl_1853_0010.txt,txt_rstl,1853,20
"tions, together with the chief facts connected with the occurrence of",of,rstl_1854_0014.txt,txt_rstl,1854,20
organs of respiration. From the facts which I have already succeeded,of,rstl_1854_0014.txt,txt_rstl,1854,20
"also cases of phthisis. These facts possess the greatest interest, and",of,rstl_1854_0014.txt,txt_rstl,1854,20
then the whole of the facts and observations recorded in this,of,rstl_1854_0014.txt,txt_rstl,1854,20
all of which the same facts could be noted. The segmentation,of,rstl_1854_0009.txt,txt_rstl,1854,20
"these were confirmatory of the facts before stated, as the variation",of,rstl_1854_0009.txt,txt_rstl,1854,20
the same metal. The same facts deprive the latter part of,of,rstl_1854_0001.txt,txt_rstl,1854,20
similar degree of diffusibility*. The facts appear to afford a strong,of,rstl_1854_0008.txt,txt_rstl,1854,20
"its explanation, with many other facts of the subject, till fuller",of,rstl_1854_0008.txt,txt_rstl,1854,20
spoken of its length. These facts will explain the results of,of,rstl_1855_0010.txt,txt_rstl,1855,20
experiments have therefore elicited three facts as regards beams formed of,of,rstl_1855_0009.txt,txt_rstl,1855,20
law here deduced represents the facts of the case. The value,of,rstl_1855_0002.txt,txt_rstl,1855,20
critical review of all the facts of the case which at,of,rstl_1855_0017.txt,txt_rstl,1855,20
"proved, by the comparison of facts then to be addaced from",of,rstl_1856_0027.txt,txt_rstl,1856,20
"now, we review the principal facts relating to the structure of",of,rstl_1856_0027.txt,txt_rstl,1856,20
based on an order of facts relating to the economy of,of,rstl_1856_0027.txt,txt_rstl,1856,20
"Electrical Convections of Heat, from Facts of Thermo-electric Inversion. 102. 'The",of,rstl_1856_0031.txt,txt_rstl,1856,20
by critical examinations of the facts already accumulated. These menoirs I,of,rstl_1856_0020.txt,txt_rstl,1856,20
"any other explanation of the facts I have observed, or of",of,rstl_1856_0017.txt,txt_rstl,1856,20
a like kind. Among these facts were several that became of,of,rstl_1856_0012.txt,txt_rstl,1856,20
"are in harmony with the facts of observation. All the Orbitolites,",of,rstl_1856_0012.txt,txt_rstl,1856,20
inch to crush them. These facts show the great superiority of,of,rstl_1857_0039.txt,txt_rstl,1857,20
prevented further publication of the facts at that time; but I,of,rstl_1857_0017.txt,txt_rstl,1857,20
24% 259 26? Several curious facts become apparent from inspection of,of,rstl_1857_0022.txt,txt_rstl,1857,20
"writes, © a multitude of facts which scem to necessitate the",of,rstl_1857_0016.txt,txt_rstl,1857,20
rigorous demonstration of the principal facts and laws of muscular electri-,of,rstl_1857_0010.txt,txt_rstl,1857,20
clear explanation of several important facts of muscular electricity. The first,of,rstl_1857_0010.txt,txt_rstl,1857,20
"electricity. The first of these facts is, that a differential current",of,rstl_1857_0010.txt,txt_rstl,1857,20
close coincidence between all the facts of light and the physical,of,rstl_1857_0011.txt,txt_rstl,1857,20
supposition leaves many of the facts either imperfectly explained or untouched.,of,rstl_1857_0011.txt,txt_rstl,1857,20
angles. With regard to these facts no difference of opinion can,of,rstl_1857_0004.txt,txt_rstl,1857,20
"subject, both as to the facts of the case and as",of,rstl_1858_0036.txt,txt_rstl,1858,20
within half an hour. These facts appeared to me of great,of,rstl_1858_0030.txt,txt_rstl,1858,20
without a knowledge of the facts upon which zoologists ve adopted,of,rstl_1858_0028.txt,txt_rstl,1858,20
"boilers invariably present joints, these facts are proþ of some significance",of,rstl_1858_0021.txt,txt_rstl,1858,20
be gathered from the following facts :;—As regards the variation of,of,rstl_1858_0013.txt,txt_rstl,1858,20
of the substance. But the facts already adverted to are a,of,rstl_1858_0013.txt,txt_rstl,1858,20
they were very adhesive. These facts seem sufficient proof of the,of,rstl_1858_0031.txt,txt_rstl,1858,20
"excess of fibrine. From the facts detailed in this section, it",of,rstl_1858_0031.txt,txt_rstl,1858,20
"OF INFLAMMATION. 661 From the facts above mentioned, I became convinced",of,rstl_1858_0031.txt,txt_rstl,1858,20
characters ; and many other facts of similar nature might be,of,rstl_1858_0031.txt,txt_rstl,1858,20
ut though some of the facts above mentioned furnish clear evidence,of,rstl_1858_0031.txt,txt_rstl,1858,20
the natural interpretation of these facts seems my E to be,of,rstl_1858_0031.txt,txt_rstl,1858,20
good definition. Thus far the facts of observation have been stated,of,rstl_1858_0025.txt,txt_rstl,1858,20
petty = discussions concerning the facts and opinions of the present,of,rstl_1858_0016.txt,txt_rstl,1858,20
a thorough investigation of the facts had become necessary. I have,of,rstl_1858_0034.txt,txt_rstl,1858,20
and partly of inattention to facts supposed to be of no,of,rstl_1858_0032.txt,txt_rstl,1858,20
"an explanation, however, of the facts would be fatal to any",of,rstl_1858_0032.txt,txt_rstl,1858,20
5 Review of the chief facts made known by the ES,of,rstl_1858_0005.txt,txt_rstl,1858,20
"EGYPT. Review of the chief facts made known by the Excavations,",of,rstl_1858_0005.txt,txt_rstl,1858,20
candid review of the preceding facts must inevitably conduct to the,of,rstl_1858_0006.txt,txt_rstl,1858,20
The significance 2 of these facts cannot for a moment be,of,rstl_1858_0006.txt,txt_rstl,1858,20
and of observing some interesting facts which have not been clearly,of,rstl_1859_0024.txt,txt_rstl,1859,20
"to the bearing of the facts contained in the present, Epaper",of,rstl_1859_0024.txt,txt_rstl,1859,20
of the popula- tion. The facts which a Life-Table expresses in,of,rstl_1859_0034.txt,txt_rstl,1859,20
"more years, a number of facts is obtained sufficiently great to",of,rstl_1859_0034.txt,txt_rstl,1859,20
"grow more exact, and the facts are multiplied, the intervals of",of,rstl_1859_0034.txt,txt_rstl,1859,20
"as T can, of the facts connected with the sensations of",of,rstl_1859_0017.txt,txt_rstl,1859,20
"the correct determination of these facts is concerned, it seems to",of,rstl_1859_0017.txt,txt_rstl,1859,20
and open 8lowly. Sand both facts are demonstrative of the non-viscosity,of,rstl_1859_0014.txt,txt_rstl,1859,20
"broadly, then, two classes of facts address themselves to the attention",of,rstl_1859_0014.txt,txt_rstl,1859,20
"phenomena. 'The analysis of the facts gives the result, that where",of,rstl_1859_0014.txt,txt_rstl,1859,20
"take account of all the facts adduced in proof of viscosity,",of,rstl_1859_0014.txt,txt_rstl,1859,20
of the other set of facts on which the opponents of,of,rstl_1859_0014.txt,txt_rstl,1859,20
together a great mass of facts which will perhaps ere long,of,rstl_1859_0018.txt,txt_rstl,1859,20
nor its : tributaries furnished facts capable of completely deciding the,of,rstl_1859_0015.txt,txt_rstl,1859,20
These experiments developed the following facts :—lIst. That the effect of,of,rstl_1859_0005.txt,txt_rstl,1859,20
largest acces- Sions of new facts by reasoning deductively from fundamental,of,rstl_1859_0005.txt,txt_rstl,1859,20
"about 24 per cent. These facts are of considerable interest, when",of,rstl_1859_0025.txt,txt_rstl,1859,20
"in that of others, the facts peculiar to Physiology herself must",of,rstl_1859_0025.txt,txt_rstl,1859,20
the full explanation of the facts and conclusions which Chemistry and,of,rstl_1859_0025.txt,txt_rstl,1859,20
"of the feeding experiment. The facts bere «tated, will of course",of,rstl_1859_0025.txt,txt_rstl,1859,20
ounce to the pound. The facts as to the amount of,of,rstl_1860_0027.txt,txt_rstl,1860,20
the collection Zand discussion of facts elicited in the investigations of,of,rstl_1860_0017.txt,txt_rstl,1860,20
"of terrestrial induction. Bearing these facts in view, and taking further",of,rstl_1860_0021.txt,txt_rstl,1860,20
"one of the most remarkable facts is this, that these luminous",of,rstl_1860_0010.txt,txt_rstl,1860,20
"One of the most, obvious facts on looking at the equations",of,rstl_1860_0009.txt,txt_rstl,1860,20
a positive explanation of the facts now described regarding 0zone. 'I'he,of,rstl_1860_0008.txt,txt_rstl,1860,20
structive to consider whether the facts already known admit of a,of,rstl_1860_0008.txt,txt_rstl,1860,20
full possession of all the facts bearing upon his discoveries. To,of,rstl_1860_0018.txt,txt_rstl,1860,20
and of ome other interesting facts connected with the fossil bones,of,rstl_1860_0018.txt,txt_rstl,1860,20
to the analogy of the facts which have been determined by,of,rstl_1860_0026.txt,txt_rstl,1860,20
of the large body of facts which have been brought together,of,rstl_1860_0026.txt,txt_rstl,1860,20
the means of generalizing the facts of the = Annual and,and,rstl_1851_0032.txt,txt_rstl,1851,20
of what would be the facts of the Annual and Diurnal,and,rstl_1851_0032.txt,txt_rstl,1851,20
more anxious to eliminate new facts and to accumulate a mass,and,rstl_1851_0030.txt,txt_rstl,1851,20
with the more facility to facts and views that have heretofore,and,rstl_1851_0005.txt,txt_rstl,1851,20
"at Toronto and Hobarton, the facts appear to be that the",and,rstl_1851_0005.txt,txt_rstl,1851,20
comparing these with the £ facts of the natural history and,and,rstl_1851_0011.txt,txt_rstl,1851,20
and to show from these facts that a non-production of the,and,rstl_1851_0011.txt,txt_rstl,1851,20
recapitulate briefly some of the facts and views derived from the,and,rstl_1851_0011.txt,txt_rstl,1851,20
Society a collection of A facts observed with repeated and scrupulous,and,rstl_1852_0024.txt,txt_rstl,1852,20
ALper and Hancock adduce additional facts corroborative of their former conclusions.,and,rstl_1852_0024.txt,txt_rstl,1852,20
