Context,Collocate,File,Directory,Year
"June 4, 1840. Tre principal facts recorded in the following memoir",recorded,rstl_1840_0025.txt,txt_rstl,1840
"memoir in con- nexion with facts recorded in my Jast, it",recorded,rstl_1840_0024.txt,txt_rstl,1840
the same means. 364. The facts above recorded will show that,recorded,rstl_1840_0024.txt,txt_rstl,1840
in the parent cell.” The facts recorded in the present memoir,recorded,rstl_1840_0024.txt,txt_rstl,1840
granules of the yelk. The facts recorded in the foregoing memoir,recorded,rstl_1841_0018.txt,txt_rstl,1841
produce such division. 97. But facts recorded in several of my,recorded,rstl_1841_0019.txt,txt_rstl,1841
"in- deed as with many facts recorded in this memoir, I",recorded,rstl_1842_0008.txt,txt_rstl,1842
interesting in con- nection with facts recorded in a former memoir,recorded,rstl_1842_0008.txt,txt_rstl,1842
"peared almost wanting. Should the facts recorded in this memoir, however,",recorded,rstl_1842_0008.txt,txt_rstl,1842
"Ross, or SmiTH, the leading facts recorded in it. To one",recorded,rstl_1842_0008.txt,txt_rstl,1842
3. y.)}. 19. Should these facts be thought to confirm the,these,rstl_1840_0025.txt,txt_rstl,1840
in these early papers. Those facts I am now desirous of,these,rstl_1840_0014.txt,txt_rstl,1840
"eight, &c. cells.” But these facts strengthen the analogy pointed out",these,rstl_1840_0024.txt,txt_rstl,1840
of urea 6 Whether these facts have any connexion with the,these,rstl_1840_0002.txt,txt_rstl,1840
"resolved. Notwithstanding these differences, however, facts mentioned by authors regarding the",these,rstl_1841_0017.txt,txt_rstl,1841
"is not 80 much these facts to which I ask attention,",these,rstl_1841_0018.txt,txt_rstl,1841
61 and 62. 63. Such facts as these appear to warrant,these,rstl_1841_0018.txt,txt_rstl,1841
"from morning till night. These facts are perfectly normal*, and are",these,rstl_1842_0015.txt,txt_rstl,1842
itself (fig. 14. c). These facts seem further to show that,these,rstl_1843_0013.txt,txt_rstl,1843
with the orifices. From these facts it would appear that the,these,rstl_1843_0013.txt,txt_rstl,1843
divisions of Myriapoda. These additional facts fully accord with the already,these,rstl_1843_0013.txt,txt_rstl,1843
my observations were discontinued. These facts sufficiently show that a power,these,rstl_1844_0009.txt,txt_rstl,1844
"was every reason, with these facts before us, to expect that",these,rstl_1844_0003.txt,txt_rstl,1844
"of lead in Solution. These facts are well known, and prove",these,rstl_1844_0002.txt,txt_rstl,1844
"exclusion of the anion. These facts are, we believe, irreconcilable with",these,rstl_1844_0001.txt,txt_rstl,1844
"fix the attention. These are facts which, when the true physical",these,rstl_1844_0007.txt,txt_rstl,1844
From the sum of these facts I am again forced to,these,rstl_1845_0012.txt,txt_rstl,1845
"From the whole of these facts I was led to conclude,",these,rstl_1845_0013.txt,txt_rstl,1845
at a knowledge of these facts I have repeated and varied,these,rstl_1845_0013.txt,txt_rstl,1845
this moment in analysing these facts ; it is sufficient at,these,rstl_1845_0013.txt,txt_rstl,1845
our own country. 3rdly. These facts place in rather a new,these,rstl_1845_0007.txt,txt_rstl,1845
see the application of these facts to the vocal apparatus. We,these,rstl_1846_0028.txt,txt_rstl,1846
were expiratory. These were the facts ; | I could not,these,rstl_1846_0027.txt,txt_rstl,1846
"effusion rate. But, before these facts were ascertained this jet became",these,rstl_1846_0029.txt,txt_rstl,1846
to 089 inch. As the facts shown by these observations are,these,rstl_1846_0020.txt,txt_rstl,1846
vessels in the neighbourhood. These facts were demonstrated by preparations at,these,rstl_1846_0017.txt,txt_rstl,1846
"hyponitric acid, &. From these facts it appears that nitric acid",these,rstl_1846_0012.txt,txt_rstl,1846
"the entire organ, These same facts are verified also by including",these,rstl_1847_0014.txt,txt_rstl,1847
combination with that substance. These facts led me to suspect that,these,rstl_1848_0010.txt,txt_rstl,1848
combines these and many other facts respecting the tides into a,these,rstl_1848_0001.txt,txt_rstl,1848
pass through the tissue. These facts of course do away with,these,rstl_1849_0023.txt,txt_rstl,1849
"and teeth of Macropoma. These facts (if correctly interpreted, and T",these,rstl_1849_0023.txt,txt_rstl,1849
1 have now to record facts which in some of the,now,rstl_1840_0025.txt,txt_rstl,1840
in these early papers. Those facts I am now desirous of,now,rstl_1840_0014.txt,txt_rstl,1840
experiments. But as the leading facts of- the experiments have now,now,rstl_1840_0013.txt,txt_rstl,1840
opportunity for confirming the principal facts therein stated. I have now,now,rstl_1840_0024.txt,txt_rstl,1840
"have now to state, that facts observed in the pre- sent",now,rstl_1840_0024.txt,txt_rstl,1840
the eggs ; but the facts now about to be stated,now,rstl_1841_0012.txt,txt_rstl,1841
"will be seen that the facts I have now to mention,",now,rstl_1841_0019.txt,txt_rstl,1841
nucleated cells. But the other facts now men- tioned+; I believe,now,rstl_1841_0019.txt,txt_rstl,1841
and Sepia: and the additional facts which we have now unexpectedly,now,rstl_1844_0006.txt,txt_rstl,1844
"certain thermal effect, the general facts now established will not be",now,rstl_1844_0002.txt,txt_rstl,1844
this instance adopted. Now the facts and observations detailed in the,now,rstl_1845_0007.txt,txt_rstl,1845
to the bearing of the facts I have now related on,now,rstl_1846_0005.txt,txt_rstl,1846
"and the bearing of the facts now related, to dis- sent",now,rstl_1846_0025.txt,txt_rstl,1846
"secrefory portion+. From all the facts which have been now related,",now,rstl_1846_0025.txt,txt_rstl,1846
"The very singular and unexpected facts now detailed, merit attention and",now,rstl_1847_0011.txt,txt_rstl,1847
1 have now to record facts which in some of the,some,rstl_1840_0025.txt,txt_rstl,1840
till we have some distinct facts on which to rest ;,some,rstl_1840_0020.txt,txt_rstl,1840
of some of the foregoing Facts to the Physiology of Cells.,some,rstl_1840_0024.txt,txt_rstl,1840
"that I worked out the facts to some extent, and think",some,rstl_1840_0004.txt,txt_rstl,1840
"as ** wseless,” —but also facts which go to corroborate some",some,rstl_1841_0018.txt,txt_rstl,1841
"protochloride of palladium developes some facts of considerable interest, It is",some,rstl_1842_0016.txt,txt_rstl,1842
"of a Postscript, some additional facts illustrative of the singular properties",some,rstl_1842_0013.txt,txt_rstl,1842
"lead, to some new valuable facts or natural relations. Reviewing the",some,rstl_1843_0009.txt,txt_rstl,1843
"by publication some of the facts which I also have obtained,",some,rstl_1843_0004.txt,txt_rstl,1843
however to some of the facts connected with observations at different,some,rstl_1845_0010.txt,txt_rstl,1845
"TI have, however, some other facts to mention which will demonstrate",some,rstl_1846_0012.txt,txt_rstl,1846
expression can be given to facts which does not involve some,some,rstl_1847_0002.txt,txt_rstl,1847
and Fovcavrr observed some remarkable facts of the same kind on,some,rstl_1847_0004.txt,txt_rstl,1847
"attention. Taking adyantage of the facts pointed out by Wonrer®, I",i,rstl_1840_0017.txt,txt_rstl,1840
in these early papers. Those facts I am now desirous of,i,rstl_1840_0014.txt,txt_rstl,1840
"the experi- ments relate to facts and not opinions, I can",i,rstl_1840_0010.txt,txt_rstl,1840
opportunity for confirming the principal facts therein stated. I have now,i,rstl_1840_0024.txt,txt_rstl,1840
"that I worked out the facts to some extent, and think",i,rstl_1840_0004.txt,txt_rstl,1840
"of no small interest. The facts I am about to recite,",i,rstl_1840_0002.txt,txt_rstl,1840
"is not 80 much these facts to which I ask attention,",i,rstl_1841_0018.txt,txt_rstl,1841
"I explain it, and from facts above mentioned, showing that blood-corpuscles",i,rstl_1841_0018.txt,txt_rstl,1841
"will be seen that the facts I have now to mention,",i,rstl_1841_0019.txt,txt_rstl,1841
nucleated cells. But the other facts now men- tioned+; I believe,i,rstl_1841_0019.txt,txt_rstl,1841
I in pos- ses8ion of facts connected with the process of,i,rstl_1841_0019.txt,txt_rstl,1841
higher tribes of animals. 'These facts I had the honour of,i,rstl_1842_0014.txt,txt_rstl,1842
"will I think elucidate sevyeral facts already known, but, as it",i,rstl_1842_0008.txt,txt_rstl,1842
"in- deed as with many facts recorded in this memoir, I",i,rstl_1842_0008.txt,txt_rstl,1842
"explained, I believe, by the facts above mentioned: as well as",i,rstl_1842_0008.txt,txt_rstl,1842
"by publication some of the facts which I also have obtained,",i,rstl_1843_0004.txt,txt_rstl,1843
and liver in the latter; facts which I regard as new,i,rstl_1843_0013.txt,txt_rstl,1843
"I was examining it, the facts were still more satisfac- tory.",i,rstl_1844_0009.txt,txt_rstl,1844
"the whole tenor of voltaic facts and genera] experience.” 24, I",i,rstl_1844_0003.txt,txt_rstl,1844
From the sum of these facts I am again forced to,i,rstl_1845_0012.txt,txt_rstl,1845
of the happy temperate mean.:..Some facts which I sball have presently,i,rstl_1845_0014.txt,txt_rstl,1845
"From the whole of these facts I was led to conclude,",i,rstl_1845_0013.txt,txt_rstl,1845
at a knowledge of these facts I have repeated and varied,i,rstl_1845_0013.txt,txt_rstl,1845
present to deduce from the facts which I have laid before,i,rstl_1845_0007.txt,txt_rstl,1845
"be drawn from all the facts described in this paper, I",i,rstl_1846_0004.txt,txt_rstl,1846
to the bearing of the facts I have now related on,i,rstl_1846_0005.txt,txt_rstl,1846
were expiratory. These were the facts ; | I could not,i,rstl_1846_0027.txt,txt_rstl,1846
The following are a few facts which I have collected on,i,rstl_1846_0013.txt,txt_rstl,1846
"are to investigations into the facts of terrestrial mag- netism, I",i,rstl_1846_0018.txt,txt_rstl,1846
I would here recall the facts discovered by M. Loxcer and,i,rstl_1847_0013.txt,txt_rstl,1847
"there may be in the facts I have communicated, is the",i,rstl_1847_0002.txt,txt_rstl,1847
"as I do to the facts themselves, though I consider it",i,rstl_1847_0002.txt,txt_rstl,1847
"Although, as applied to the facts detailed, I attached no further",i,rstl_1847_0002.txt,txt_rstl,1847
"of founding this opinion on facts of a different kind, I",i,rstl_1847_0004.txt,txt_rstl,1847
on looking however into such facts as I can gather which,i,rstl_1848_0011.txt,txt_rstl,1848
"a given point belonged. The facts that I have stated lead,",i,rstl_1849_0021.txt,txt_rstl,1849
"District, as far as the facts then ascertained would permit. I",i,rstl_1849_0017.txt,txt_rstl,1849
1 have now to record facts which in some of the,have,rstl_1840_0025.txt,txt_rstl,1840
"finitely, and to have withheld facts which may perhaps be useful",have,rstl_1840_0023.txt,txt_rstl,1840
shall have brought for- ward facts and analytical results by which,have,rstl_1840_0020.txt,txt_rstl,1840
till we have some distinct facts on which to rest ;,have,rstl_1840_0020.txt,txt_rstl,1840
have appeared to consider the facts brought out by the experiments,have,rstl_1840_0014.txt,txt_rstl,1840
experiments. But as the leading facts of- the experiments have now,have,rstl_1840_0013.txt,txt_rstl,1840
opportunity for confirming the principal facts therein stated. I have now,have,rstl_1840_0024.txt,txt_rstl,1840
"have now to state, that facts observed in the pre- sent",have,rstl_1840_0024.txt,txt_rstl,1840
"time, a number of interesting facts have been en- countered in",have,rstl_1840_0002.txt,txt_rstl,1840
of urea 6 Whether these facts have any connexion with the,have,rstl_1840_0002.txt,txt_rstl,1840
have added but few new facts in this department of my,have,rstl_1841_0015.txt,txt_rstl,1841
have noticed the important additional facts of the detection of the,have,rstl_1841_0012.txt,txt_rstl,1841
"period just mentioned, any additional facts have been published, relating to",have,rstl_1841_0019.txt,txt_rstl,1841
"will be seen that the facts I have now to mention,",have,rstl_1841_0019.txt,txt_rstl,1841
"seems to have especial reference}. Facts will be hereafter mentioned, which",have,rstl_1842_0008.txt,txt_rstl,1842
of the physical sciences the facts of observation and experiment have,have,rstl_1843_0014.txt,txt_rstl,1843
"by publication some of the facts which I also have obtained,",have,rstl_1843_0004.txt,txt_rstl,1843
"the attention of physiologists, certain facts appear, nevertheless, to have been",have,rstl_1843_0013.txt,txt_rstl,1843
is however one of several facts which have presented themselves in,have,rstl_1843_0011.txt,txt_rstl,1843
we have before us certain facts connected with the action of,have,rstl_1844_0003.txt,txt_rstl,1844
and Sepia: and the additional facts which we have now unexpectedly,have,rstl_1844_0006.txt,txt_rstl,1844
of the happy temperate mean.:..Some facts which I sball have presently,have,rstl_1845_0014.txt,txt_rstl,1845
the urine alkaline; and from facts which have been stated to,have,rstl_1845_0015.txt,txt_rstl,1845
at a knowledge of these facts I have repeated and varied,have,rstl_1845_0013.txt,txt_rstl,1845
present to deduce from the facts which I have laid before,have,rstl_1845_0007.txt,txt_rstl,1845
to the bearing of the facts I have now related on,have,rstl_1846_0005.txt,txt_rstl,1846
"T have suggested of the facts described be '> correct, and",have,rstl_1846_0024.txt,txt_rstl,1846
"secrefory portion+. From all the facts which have been now related,",have,rstl_1846_0025.txt,txt_rstl,1846
The following are a few facts which I have collected on,have,rstl_1846_0013.txt,txt_rstl,1846
"there may be in the facts I have communicated, is the",have,rstl_1847_0002.txt,txt_rstl,1847
pletely set aside by the facts and arguments which have been,have,rstl_1848_0019.txt,txt_rstl,1848
"a given point belonged. The facts that I have stated lead,",have,rstl_1849_0021.txt,txt_rstl,1849
the true explanation of the facts which have been thus pointed,have,rstl_1849_0012.txt,txt_rstl,1849
1 have now to record facts which in some of the,which,rstl_1840_0025.txt,txt_rstl,1840
am not aware of any facts having been observed which warranted,which,rstl_1840_0025.txt,txt_rstl,1840
"finitely, and to have withheld facts which may perhaps be useful",which,rstl_1840_0023.txt,txt_rstl,1840
shall have brought for- ward facts and analytical results by which,which,rstl_1840_0020.txt,txt_rstl,1840
till we have some distinct facts on which to rest ;,which,rstl_1840_0020.txt,txt_rstl,1840
wanting for collecting the pathological facts which were to give importance,which,rstl_1840_0014.txt,txt_rstl,1840
common case of hemiplegia. Such facts countenance the view which was,which,rstl_1840_0014.txt,txt_rstl,1840
of the enormous body of facts which appear to me to,which,rstl_1840_0003.txt,txt_rstl,1840
corpuscles of the blood. Those facts were of a character which,which,rstl_1841_0018.txt,txt_rstl,1841
"is not 80 much these facts to which I ask attention,",which,rstl_1841_0018.txt,txt_rstl,1841
"as ** wseless,” —but also facts which go to corroborate some",which,rstl_1841_0018.txt,txt_rstl,1841
'The following are the leading facts which the preceding researches upon,which,rstl_1841_0015.txt,txt_rstl,1841
'The conclusions to which the facts detailed in this paper seem,which,rstl_1841_0012.txt,txt_rstl,1841
"seems to have especial reference}. Facts will be hereafter mentioned, which",which,rstl_1842_0008.txt,txt_rstl,1842
"by publication some of the facts which I also have obtained,",which,rstl_1843_0004.txt,txt_rstl,1843
and liver in the latter; facts which I regard as new,which,rstl_1843_0013.txt,txt_rstl,1843
is however one of several facts which have presented themselves in,which,rstl_1843_0011.txt,txt_rstl,1843
and Sepia: and the additional facts which we have now unexpectedly,which,rstl_1844_0006.txt,txt_rstl,1844
by an important class of facts which next fell under our,which,rstl_1844_0001.txt,txt_rstl,1844
place distinctly before our minds facts of which the explanation mnst,which,rstl_1844_0007.txt,txt_rstl,1844
of the happy temperate mean.:..Some facts which I sball have presently,which,rstl_1845_0014.txt,txt_rstl,1845
the urine alkaline; and from facts which have been stated to,which,rstl_1845_0015.txt,txt_rstl,1845
upon the truth of the facts on which the doctrine of,which,rstl_1845_0007.txt,txt_rstl,1845
present to deduce from the facts which I have laid before,which,rstl_1845_0007.txt,txt_rstl,1845
"great, addition made to the facts and considerations which tend to",which,rstl_1846_0001.txt,txt_rstl,1846
"secrefory portion+. From all the facts which have been now related,",which,rstl_1846_0025.txt,txt_rstl,1846
are at least founded on facts which are incontrovertibly established. DescRIPTION,which,rstl_1846_0028.txt,txt_rstl,1846
The following are a few facts which I have collected on,which,rstl_1846_0013.txt,txt_rstl,1846
"TI have, however, some other facts to mention which will demonstrate",which,rstl_1846_0012.txt,txt_rstl,1846
expression can be given to facts which does not involve some,which,rstl_1847_0002.txt,txt_rstl,1847
be an extensive series of facts which afford Strong hope of,which,rstl_1847_0002.txt,txt_rstl,1847
medium. Thus Mr. Grove adduces facts from which it appears that,which,rstl_1847_0004.txt,txt_rstl,1847
pletely set aside by the facts and arguments which have been,which,rstl_1848_0019.txt,txt_rstl,1848
on looking however into such facts as I can gather which,which,rstl_1848_0011.txt,txt_rstl,1848
exactly the reverse of the facts which take place at the,which,rstl_1848_0008.txt,txt_rstl,1848
the true explanation of the facts which have been thus pointed,which,rstl_1849_0012.txt,txt_rstl,1849
"But the next section records facts which, if established by future",but,rstl_1840_0025.txt,txt_rstl,1840
within the cylinder. But certain facts communicated in my Third Series,but,rstl_1840_0025.txt,txt_rstl,1840
experiments. But as the leading facts of- the experiments have now,but,rstl_1840_0013.txt,txt_rstl,1840
"eight, &c. cells.” But these facts strengthen the analogy pointed out",but,rstl_1840_0024.txt,txt_rstl,1840
"not controversial, but contains further facts and proofs of the truth",but,rstl_1840_0003.txt,txt_rstl,1840
"by any independent measurement or facts (1808.), but only by the",but,rstl_1840_0003.txt,txt_rstl,1840
"to the platinum, and the facts mainly as with iron. But",but,rstl_1840_0003.txt,txt_rstl,1840
"but reservedly expressed, that the facts were favourable to the theory",but,rstl_1840_0004.txt,txt_rstl,1840
have added but few new facts in this department of my,but,rstl_1841_0015.txt,txt_rstl,1841
the eggs ; but the facts now about to be stated,but,rstl_1841_0012.txt,txt_rstl,1841
produce such division. 97. But facts recorded in several of my,but,rstl_1841_0019.txt,txt_rstl,1841
nucleated cells. But the other facts now men- tioned+; I believe,but,rstl_1841_0019.txt,txt_rstl,1841
"may be countenanced by the facts detailed in the text, but",but,rstl_1845_0007.txt,txt_rstl,1845
"the combustible gases, but the facts are far too few to",but,rstl_1847_0001.txt,txt_rstl,1847
"function, we are inattentive to facts of daily occurrence. To take",are,rstl_1840_0014.txt,txt_rstl,1840
"the ceconomy, there are no facts to countenance the belief, that",are,rstl_1840_0014.txt,txt_rstl,1840
a new examination and new facts are required to de- termine,are,rstl_1840_0022.txt,txt_rstl,1840
to determine how far the facts elicited are of ge- neral,are,rstl_1840_0022.txt,txt_rstl,1840
'The following are the leading facts which the preceding researches upon,are,rstl_1841_0015.txt,txt_rstl,1841
with great difficulty that the facts connected with them are ascertained.,are,rstl_1841_0012.txt,txt_rstl,1841
"this time to speculate, without facts that are $till wanted regarding",are,rstl_1841_0019.txt,txt_rstl,1841
"from morning till night. These facts are perfectly normal*, and are",are,rstl_1842_0015.txt,txt_rstl,1842
incorrect. 2. The preceding negative facts are not without their value,are,rstl_1844_0003.txt,txt_rstl,1844
that there are any experimental facts to prove whether this tension,are,rstl_1844_0003.txt,txt_rstl,1844
"of lead in Solution. These facts are well known, and prove",are,rstl_1844_0002.txt,txt_rstl,1844
"fix the attention. These are facts which, when the true physical",are,rstl_1844_0007.txt,txt_rstl,1844
"considerations. 2417. Such are the facts which, in addition to those",are,rstl_1846_0004.txt,txt_rstl,1846
are at least founded on facts which are incontrovertibly established. DescRIPTION,are,rstl_1846_0028.txt,txt_rstl,1846
to 089 inch. As the facts shown by these observations are,are,rstl_1846_0020.txt,txt_rstl,1846
The following are a few facts which I have collected on,are,rstl_1846_0013.txt,txt_rstl,1846
"are to investigations into the facts of terrestrial mag- netism, I",are,rstl_1846_0018.txt,txt_rstl,1846
"a sulphate, &c. : the facts stated are suffi- cient to",are,rstl_1846_0012.txt,txt_rstl,1846
"the entire organ, These same facts are verified also by including",are,rstl_1847_0014.txt,txt_rstl,1847
"the combustible gases, but the facts are far too few to",are,rstl_1847_0001.txt,txt_rstl,1847
as we cannot know what facts are designated by such terms,are,rstl_1848_0001.txt,txt_rstl,1848
conelusions are deducible from the facts stated in the pre- ceding,are,rstl_1849_0022.txt,txt_rstl,1849
quoted. The following are the facts relative to the nervous supply,are,rstl_1849_0003.txt,txt_rstl,1849
"been thus pointed out, the facts themselves are highly deserving of",are,rstl_1849_0012.txt,txt_rstl,1849
"function, we are inattentive to facts of daily occurrence. To take",are,rstl_1840_0014.txt,txt_rstl,1840
"the ceconomy, there are no facts to countenance the belief, that",are,rstl_1840_0014.txt,txt_rstl,1840
a new examination and new facts are required to de- termine,are,rstl_1840_0022.txt,txt_rstl,1840
to determine how far the facts elicited are of ge- neral,are,rstl_1840_0022.txt,txt_rstl,1840
'The following are the leading facts which the preceding researches upon,are,rstl_1841_0015.txt,txt_rstl,1841
with great difficulty that the facts connected with them are ascertained.,are,rstl_1841_0012.txt,txt_rstl,1841
"this time to speculate, without facts that are $till wanted regarding",are,rstl_1841_0019.txt,txt_rstl,1841
"from morning till night. These facts are perfectly normal*, and are",are,rstl_1842_0015.txt,txt_rstl,1842
incorrect. 2. The preceding negative facts are not without their value,are,rstl_1844_0003.txt,txt_rstl,1844
that there are any experimental facts to prove whether this tension,are,rstl_1844_0003.txt,txt_rstl,1844
"of lead in Solution. These facts are well known, and prove",are,rstl_1844_0002.txt,txt_rstl,1844
"fix the attention. These are facts which, when the true physical",are,rstl_1844_0007.txt,txt_rstl,1844
"considerations. 2417. Such are the facts which, in addition to those",are,rstl_1846_0004.txt,txt_rstl,1846
are at least founded on facts which are incontrovertibly established. DescRIPTION,are,rstl_1846_0028.txt,txt_rstl,1846
to 089 inch. As the facts shown by these observations are,are,rstl_1846_0020.txt,txt_rstl,1846
The following are a few facts which I have collected on,are,rstl_1846_0013.txt,txt_rstl,1846
"are to investigations into the facts of terrestrial mag- netism, I",are,rstl_1846_0018.txt,txt_rstl,1846
"a sulphate, &c. : the facts stated are suffi- cient to",are,rstl_1846_0012.txt,txt_rstl,1846
"the entire organ, These same facts are verified also by including",are,rstl_1847_0014.txt,txt_rstl,1847
"the combustible gases, but the facts are far too few to",are,rstl_1847_0001.txt,txt_rstl,1847
as we cannot know what facts are designated by such terms,are,rstl_1848_0001.txt,txt_rstl,1848
conelusions are deducible from the facts stated in the pre- ceding,are,rstl_1849_0022.txt,txt_rstl,1849
quoted. The following are the facts relative to the nervous supply,are,rstl_1849_0003.txt,txt_rstl,1849
"been thus pointed out, the facts themselves are highly deserving of",are,rstl_1849_0012.txt,txt_rstl,1849
"the paper. These, and the facts above-mentioned, render it probable that",that,rstl_1840_0017.txt,txt_rstl,1840
"the ceconomy, there are no facts to countenance the belief, that",that,rstl_1840_0014.txt,txt_rstl,1840
"** Second Series,” among the facts rendering it probable that the",that,rstl_1840_0024.txt,txt_rstl,1840
the same means. 364. The facts above recorded will show that,that,rstl_1840_0024.txt,txt_rstl,1840
present memoir is full of facts demonstrating that division is a,that,rstl_1840_0024.txt,txt_rstl,1840
"have now to state, that facts observed in the pre- sent",that,rstl_1840_0024.txt,txt_rstl,1840
satisfactory explanation of all the facts be given. That deoxidation is,that,rstl_1840_0016.txt,txt_rstl,1840
"that I worked out the facts to some extent, and think",that,rstl_1840_0004.txt,txt_rstl,1840
"in conjunction with many preceding facts and arguments, to show that",that,rstl_1840_0004.txt,txt_rstl,1840
"but reservedly expressed, that the facts were favourable to the theory",that,rstl_1840_0004.txt,txt_rstl,1840
"I explain it, and from facts above mentioned, showing that blood-corpuscles",that,rstl_1841_0018.txt,txt_rstl,1841
of the embryo that the facts ascertained appear to be of,that,rstl_1841_0012.txt,txt_rstl,1841
with great difficulty that the facts connected with them are ascertained.,that,rstl_1841_0012.txt,txt_rstl,1841
"will be seen that the facts I have now to mention,",that,rstl_1841_0019.txt,txt_rstl,1841
"this time to speculate, without facts that are $till wanted regarding",that,rstl_1841_0019.txt,txt_rstl,1841
"baryta, and others, confirm the facts already stated ; viz. that",that,rstl_1843_0003.txt,txt_rstl,1843
itself (fig. 14. c). These facts seem further to show that,that,rstl_1843_0013.txt,txt_rstl,1843
