Context,Word,File,Directory
antagonistic to known facts in the assumption,known,rstl_1879_0062.txt,txt_rstl
serous glands the facts known are not,known,rstl_1881_0016.txt,txt_rstl
"vessels, The known facts of enlargement in",known,rstl_1883_0011.txt,txt_rstl
the known experimental facts in accordance with,known,rstl_1884_0016.txt,txt_rstl
accounts for known facts better than any,known,rstl_1885_0003.txt,txt_rstl
seen. Z These facts appear to me,these,rstl_1877_0007.txt,txt_rstl
object to the facts on which these,these,rstl_1877_0002.txt,txt_rstl
once that these facts afforded a solid,these,rstl_1877_0002.txt,txt_rstl
time. All these facts seem to show,these,rstl_1877_0018.txt,txt_rstl
estimation of these facts :!— « An,these,rstl_1877_0018.txt,txt_rstl
the nectocalyx*. These facts clearly point to,these,rstl_1877_0018.txt,txt_rstl
cage. * These facts were partly ascertained,these,rstl_1877_0018.txt,txt_rstl
correctly. = These facts may also be,these,rstl_1877_0018.txt,txt_rstl
and of these facts the first that,these,rstl_1877_0018.txt,txt_rstl
lation. These complementary facts clearly prove the,these,rstl_1877_0018.txt,txt_rstl
importance of any facts established by these,these,rstl_1877_0018.txt,txt_rstl
to sea-water. These facts how the extreme,these,rstl_1877_0018.txt,txt_rstl
"put on these facts is, that every",these,rstl_1877_0018.txt,txt_rstl
prolonged pause. These facts tend to show,these,rstl_1877_0018.txt,txt_rstl
may explain these facts without having recourse,these,rstl_1879_0062.txt,txt_rstl
of these experimental facts leads to the,these,rstl_1879_0066.txt,txt_rstl
2. 29. These facts will be better,these,rstl_1879_0078.txt,txt_rstl
explanation of these facts becomes one of,these,rstl_1880_0007.txt,txt_rstl
contraction. And these facts tend still further,these,rstl_1880_0007.txt,txt_rstl
before. That these facts are remarkable no,these,rstl_1880_0007.txt,txt_rstl
interpretation of these facts would geem to,these,rstl_1880_0007.txt,txt_rstl
attaching to these facts arises from the,these,rstl_1880_0007.txt,txt_rstl
evident that these facts are of considerable,these,rstl_1880_0007.txt,txt_rstl
one hand these facts snpply an interesting,these,rstl_1880_0016.txt,txt_rstl
and the experimental facts upon which these,these,rstl_1880_0016.txt,txt_rstl
accordance with these facts as to the,these,rstl_1880_0010.txt,txt_rstl
"implied by these facts is, however, rendered",these,rstl_1881_0019.txt,txt_rstl
nob affected. These facts prove that the,these,rstl_1881_0019.txt,txt_rstl
"of irritation. These facts prove, 1st, that",these,rstl_1881_0019.txt,txt_rstl
forty vessels. These facts show that as,these,rstl_1881_0003.txt,txt_rstl
latter. From these facts it would appear,these,rstl_1881_0003.txt,txt_rstl
at first. These facts indicate in the,these,rstl_1882_0023.txt,txt_rstl
the base. These facts show that direct,these,rstl_1882_0024.txt,txt_rstl
NERVE. 1015 These facts alone make it,these,rstl_1882_0024.txt,txt_rstl
them. From these facts I conclude that,these,rstl_1882_0024.txt,txt_rstl
"notes these new facts will be stated,",these,rstl_1882_0013.txt,txt_rstl
entertained upon these facts after a careful,these,rstl_1882_0015.txt,txt_rstl
"10, A). These facts warrant us in",these,rstl_1882_0015.txt,txt_rstl
sulphaur. From these facts we conclude that,these,rstl_1882_0011.txt,txt_rstl
By comparing these facts with those already,these,rstl_1882_0002.txt,txt_rstl
effect. But these facts afford no clue,these,rstl_1882_0002.txt,txt_rstl
To observe these facts the current of,these,rstl_1882_0002.txt,txt_rstl
these now well-known facts to enable the,these,rstl_1882_0008.txt,txt_rstl
"right angle. These facts are extremely interesting,",these,rstl_1882_0003.txt,txt_rstl
bearing of these facts on the question,these,rstl_1882_0029.txt,txt_rstl
is in these facts clear evidence of,these,rstl_1882_0029.txt,txt_rstl
ET; 6:64 These facts are of considerable,these,rstl_1883_0026.txt,txt_rstl
If these two facts are mutually dependent,these,rstl_1883_0022.txt,txt_rstl
"do, but these facts 8nggest the further",these,rstl_1883_0011.txt,txt_rstl
supporting lamella. These facts leave no doubt,these,rstl_1883_0024.txt,txt_rstl
"sheathing wings. These facts being 80, and",these,rstl_1884_0021.txt,txt_rstl
mixture increases. These facts account for the,these,rstl_1884_0022.txt,txt_rstl
the surface. These facts permit the question,these,rstl_1884_0022.txt,txt_rstl
"the patient. These facts are well known,",these,rstl_1885_0009.txt,txt_rstl
"larger tuberosities, These facts 8eem to show",these,rstl_1886_0019.txt,txt_rstl
erent trunk. These facts tend to confirm,these,rstl_1886_0018.txt,txt_rstl
"in calibre, These facts are clear enough",these,rstl_1886_0018.txt,txt_rstl
own observations these facts go to prove,these,rstl_1886_0007.txt,txt_rstl
"us the following facts — SIR B,",following,rstl_1877_0002.txt,txt_rstl
-8pectrum. The following facts seem to me,following,rstl_1879_0062.txt,txt_rstl
"* the following facts were elicited, The",following,rstl_1880_0003.txt,txt_rstl
overlooked the following facts given by us,following,rstl_1880_0008.txt,txt_rstl
add the following facts gathered from an,following,rstl_1880_0016.txt,txt_rstl
by the following facts — 1. The,following,rstl_1882_0024.txt,txt_rstl
brain the following facts T have repeatedly,following,rstl_1882_0015.txt,txt_rstl
"region, the following facts may be readily",following,rstl_1882_0015.txt,txt_rstl
"the two following facts : first, that",following,rstl_1883_0014.txt,txt_rstl
of the following facts — 1. In,following,rstl_1883_0001.txt,txt_rstl
38290. The following facts point to their,following,rstl_1884_0005.txt,txt_rstl
pole. The following facts have been established,following,rstl_1884_0005.txt,txt_rstl
light the following facts among others —,following,rstl_1885_0011.txt,txt_rstl
demonstrated the following facts :— A vertical,following,rstl_1886_0012.txt,txt_rstl
also observed the facts mentioned in this,observed,rstl_1877_0018.txt,txt_rstl
T believe similar facts have been observed,observed,rstl_1880_0025.txt,txt_rstl
of our observed facts to determine. That,observed,rstl_1880_0010.txt,txt_rstl
upon 8ome interesting facts observed by them,observed,rstl_1881_0016.txt,txt_rstl
of the observed facts in the solar,observed,rstl_1881_0009.txt,txt_rstl
as to observed facts connected with that,observed,rstl_1882_0024.txt,txt_rstl
consistent with the facts observed to say,observed,rstl_1882_0002.txt,txt_rstl
films. The observed facts were in accordance,observed,rstl_1883_0020.txt,txt_rstl
record all the facts which my studies,all,rstl_1877_0007.txt,txt_rstl
"branches, are all facts which point in",all,rstl_1877_0007.txt,txt_rstl
time. All these facts seem to show,all,rstl_1877_0018.txt,txt_rstl
all the other facts which are detailed,all,rstl_1877_0018.txt,txt_rstl
"serics, all the facts and inferences which",all,rstl_1877_0018.txt,txt_rstl
all the peculiar facts that have been,all,rstl_1879_0078.txt,txt_rstl
all the other facts which are detailed,all,rstl_1880_0007.txt,txt_rstl
"geries, all the facts and inferences which",all,rstl_1880_0007.txt,txt_rstl
"then, all the facts as concisely as",all,rstl_1880_0007.txt,txt_rstl
detail all the facts I have been,all,rstl_1880_0007.txt,txt_rstl
detailed all the facts which I have,all,rstl_1880_0007.txt,txt_rstl
"contrary, all the facts point to its",all,rstl_1882_0026.txt,txt_rstl
of all the facts I have been,all,rstl_1882_0004.txt,txt_rstl
All the exsential facts and opinions may,all,rstl_1882_0003.txt,txt_rstl
"Taking all the facts into account, the",all,rstl_1883_0016.txt,txt_rstl
of all the facts of the case.,all,rstl_1884_0003.txt,txt_rstl
of all the facts regarding «- 5,all,rstl_1885_0014.txt,txt_rstl
to include all facts which might have,all,rstl_1886_0017.txt,txt_rstl
together the various facts which constitute all,all,rstl_1886_0017.txt,txt_rstl
record all the facts which my studies,which,rstl_1877_0007.txt,txt_rstl
"branches, are all facts which point in",which,rstl_1877_0007.txt,txt_rstl
consequences with the facts to which the,which,rstl_1877_0002.txt,txt_rstl
object to the facts on which these,which,rstl_1877_0002.txt,txt_rstl
agreement with the facts which we wish,which,rstl_1877_0002.txt,txt_rstl
facts. Now the facts to which this,which,rstl_1877_0002.txt,txt_rstl
of the main facts which were detailed,which,rstl_1877_0018.txt,txt_rstl
"suppress, because the facts of which it",which,rstl_1877_0018.txt,txt_rstl
all the other facts which are detailed,which,rstl_1877_0018.txt,txt_rstl
"serics, all the facts and inferences which",which,rstl_1877_0018.txt,txt_rstl
interesting series of facts which have led,which,rstl_1877_0018.txt,txt_rstl
"far more astonishing, facts which are presently",which,rstl_1877_0018.txt,txt_rstl
a class of facts which physiologists will,which,rstl_1877_0018.txt,txt_rstl
of the analogous facts which we have,which,rstl_1877_0018.txt,txt_rstl
which the above facts supplied to my,which,rstl_1877_0018.txt,txt_rstl
marine vegetation ; facts which may yery,which,rstl_1879_0003.txt,txt_rstl
"the Crozets, | facts from which Mr.",which,rstl_1879_0003.txt,txt_rstl
it. Although many facts which could be,which,rstl_1879_0073.txt,txt_rstl
"also, the chief facts which remained to",which,rstl_1880_0024.txt,txt_rstl
portion contains wholly facts on which no,which,rstl_1880_0017.txt,txt_rstl
briefly the chiefs facts of interest which,which,rstl_1880_0003.txt,txt_rstl
of the main facts which were detailed,which,rstl_1880_0007.txt,txt_rstl
subsection RE The facts of which it,which,rstl_1880_0007.txt,txt_rstl
all the other facts which are detailed,which,rstl_1880_0007.txt,txt_rstl
"geries, all the facts and inferences which",which,rstl_1880_0007.txt,txt_rstl
"Nevertheless, as the facts which the hypotbesis",which,rstl_1880_0007.txt,txt_rstl
"thus accepted, the facts which ib is",which,rstl_1880_0007.txt,txt_rstl
speculation on such facts as those which,which,rstl_1880_0007.txt,txt_rstl
OF MEDUSM. 171 facts which T have,which,rstl_1880_0007.txt,txt_rstl
ciremmnstances. The only facts which still remain,which,rstl_1880_0007.txt,txt_rstl
detailed all the facts which I have,which,rstl_1880_0007.txt,txt_rstl
principally on the facts which have been,which,rstl_1880_0007.txt,txt_rstl
must incorporate the facts and inferences which,which,rstl_1880_0007.txt,txt_rstl
forasmuch as the facts on which my,which,rstl_1880_0007.txt,txt_rstl
on that of facts which are better,which,rstl_1880_0007.txt,txt_rstl
aurita.—The only remaining facts which I have,which,rstl_1880_0007.txt,txt_rstl
and the experimental facts upon which these,which,rstl_1880_0016.txt,txt_rstl
experity b mental facts which in the,which,rstl_1880_0016.txt,txt_rstl
both by the facts which they already,which,rstl_1880_0010.txt,txt_rstl
consistent with the facts which have been,which,rstl_1880_0010.txt,txt_rstl
mention the main facts which show that,which,rstl_1881_0016.txt,txt_rstl
"other hand, several facts which go far",which,rstl_1881_0016.txt,txt_rstl
pressure. Z The facts which have just,which,rstl_1882_0024.txt,txt_rstl
to give the facts upon which the,which,rstl_1882_0024.txt,txt_rstl
to abound in facts which it has,which,rstl_1882_0007.txt,txt_rstl
interpretation of the facts which would admit,which,rstl_1882_0008.txt,txt_rstl
and the only facts which I have,which,rstl_1882_0003.txt,txt_rstl
; but the facts which I have,which,rstl_1882_0003.txt,txt_rstl
review of the facts which have been,which,rstl_1882_0003.txt,txt_rstl
relation between the facts which have been,which,rstl_1882_0003.txt,txt_rstl
higher Decapods. The facts which have been,which,rstl_1882_0003.txt,txt_rstl
account for the facts which are supposed,which,rstl_1882_0003.txt,txt_rstl
1n other minerals. Facts which I had,which,rstl_1883_0027.txt,txt_rstl
number of other facts which point in,which,rstl_1883_0024.txt,txt_rstl
a number of facts which Sindicate the,which,rstl_1883_0024.txt,txt_rstl
have but few facts which serve to,which,rstl_1884_0005.txt,txt_rstl
view of the facts which experiment has,which,rstl_1886_0017.txt,txt_rstl
to include all facts which might have,which,rstl_1886_0017.txt,txt_rstl
together the various facts which constitute all,which,rstl_1886_0017.txt,txt_rstl
reasoning to existing facts would have enabled,have,rstl_1877_0002.txt,txt_rstl
interesting series of facts which have led,have,rstl_1877_0018.txt,txt_rstl
of the analogous facts which we have,have,rstl_1877_0018.txt,txt_rstl
"examined ; new facts have been observed,",have,rstl_1879_0076.txt,txt_rstl
all the peculiar facts that have been,have,rstl_1879_0078.txt,txt_rstl
T believe similar facts have been observed,have,rstl_1880_0025.txt,txt_rstl
OF MEDUSM. 171 facts which T have,have,rstl_1880_0007.txt,txt_rstl
detail all the facts I have been,have,rstl_1880_0007.txt,txt_rstl
detailed all the facts which I have,have,rstl_1880_0007.txt,txt_rstl
principally on the facts which have been,have,rstl_1880_0007.txt,txt_rstl
aurita.—The only remaining facts which I have,have,rstl_1880_0007.txt,txt_rstl
but as the facts there given have,have,rstl_1880_0008.txt,txt_rstl
consistent with the facts which have been,have,rstl_1880_0010.txt,txt_rstl
to consider what facts we have to,have,rstl_1881_0016.txt,txt_rstl
the cell-protoplasm. The facts we have at,have,rstl_1881_0016.txt,txt_rstl
"the Coal-measures, such facts as I have",have,rstl_1881_0003.txt,txt_rstl
pressure. Z The facts which have just,have,rstl_1882_0024.txt,txt_rstl
brain the following facts T have repeatedly,have,rstl_1882_0015.txt,txt_rstl
of all the facts I have been,have,rstl_1882_0004.txt,txt_rstl
and the only facts which I have,have,rstl_1882_0003.txt,txt_rstl
; but the facts which I have,have,rstl_1882_0003.txt,txt_rstl
review of the facts which have been,have,rstl_1882_0003.txt,txt_rstl
relation between the facts which have been,have,rstl_1882_0003.txt,txt_rstl
higher Decapods. The facts which have been,have,rstl_1882_0003.txt,txt_rstl
many of the facts we have to,have,rstl_1882_0029.txt,txt_rstl
"and, in the facts adduced, we have",have,rstl_1882_0029.txt,txt_rstl
have but few facts which serve to,have,rstl_1884_0005.txt,txt_rstl
pole. The following facts have been established,have,rstl_1884_0005.txt,txt_rstl
to include all facts which might have,have,rstl_1886_0017.txt,txt_rstl
all the other facts which are detailed,other,rstl_1877_0018.txt,txt_rstl
There are other facts tending to support,other,rstl_1879_0066.txt,txt_rstl
all the other facts which are detailed,other,rstl_1880_0007.txt,txt_rstl
number of other facts of the firs},other,rstl_1880_0007.txt,txt_rstl
"other hand, several facts which go far",other,rstl_1881_0016.txt,txt_rstl
and other 8upposed facts about it. The,other,rstl_1882_0026.txt,txt_rstl
1n other minerals. Facts which I had,other,rstl_1883_0027.txt,txt_rstl
number of other facts which point in,other,rstl_1883_0024.txt,txt_rstl
"other Aleyonaria, The facts presented by the",other,rstl_1883_0024.txt,txt_rstl
"other Eases, the facts related show that",other,rstl_1884_0020.txt,txt_rstl
"as other similar facts narrated, 8erve to",other,rstl_1884_0020.txt,txt_rstl
correctly. = These facts may also be,may,rstl_1877_0018.txt,txt_rstl
marine vegetation ; facts which may yery,may,rstl_1879_0003.txt,txt_rstl
"2,500 feet. The facts may seem somewhat",may,rstl_1879_0077.txt,txt_rstl
may explain these facts without having recourse,may,rstl_1879_0062.txt,txt_rstl
area. The above facts may be confirmed,may,rstl_1882_0015.txt,txt_rstl
"region, the following facts may be readily",may,rstl_1882_0015.txt,txt_rstl
"exemplified, The preceding facts may be summed",may,rstl_1882_0002.txt,txt_rstl
All the exsential facts and opinions may,may,rstl_1882_0003.txt,txt_rstl
detail all the facts I have been,i,rstl_1880_0007.txt,txt_rstl
detailed all the facts which I have,i,rstl_1880_0007.txt,txt_rstl
"interpretation of the facts cannot, I think,",i,rstl_1880_0007.txt,txt_rstl
aurita.—The only remaining facts which I have,i,rstl_1880_0007.txt,txt_rstl
"the Coal-measures, such facts as I have",i,rstl_1881_0003.txt,txt_rstl
them. From these facts I conclude that,i,rstl_1882_0024.txt,txt_rstl
of all the facts I have been,i,rstl_1882_0004.txt,txt_rstl
and the only facts which I have,i,rstl_1882_0003.txt,txt_rstl
I think the facts justify the statement,i,rstl_1882_0003.txt,txt_rstl
; but the facts which I have,i,rstl_1882_0003.txt,txt_rstl
1n other minerals. Facts which I had,i,rstl_1883_0027.txt,txt_rstl
account for the facts observed. I conclude,i,rstl_1884_0022.txt,txt_rstl
agreement with the facts which we wish,we,rstl_1877_0002.txt,txt_rstl
"we express dynamical facts by it, and",we,rstl_1877_0002.txt,txt_rstl
of the analogous facts which we have,we,rstl_1877_0018.txt,txt_rstl
From the above facts we ee that,we,rstl_1879_0069.txt,txt_rstl
to consider what facts we have to,we,rstl_1881_0016.txt,txt_rstl
the cell-protoplasm. The facts we have at,we,rstl_1881_0016.txt,txt_rstl
sulphaur. From these facts we conclude that,we,rstl_1882_0011.txt,txt_rstl
many of the facts we have to,we,rstl_1882_0029.txt,txt_rstl
"and, in the facts adduced, we have",we,rstl_1882_0029.txt,txt_rstl
most of the facts we are looking,we,rstl_1883_0010.txt,txt_rstl
of the above facts we can hardly,we,rstl_1885_0017.txt,txt_rstl
"branches, are all facts which point in",are,rstl_1877_0007.txt,txt_rstl
of oxygen. The facts here stated are,are,rstl_1877_0002.txt,txt_rstl
view are the facts that the first,are,rstl_1877_0018.txt,txt_rstl
all the other facts which are detailed,are,rstl_1877_0018.txt,txt_rstl
"far more astonishing, facts which are presently",are,rstl_1877_0018.txt,txt_rstl
"And, conversely, the facts of inhibition are",are,rstl_1877_0018.txt,txt_rstl
being 5:1”. Two facts are brought out,are,rstl_1879_0069.txt,txt_rstl
think that the facts are decidedly in,are,rstl_1879_0062.txt,txt_rstl
There are other facts tending to support,are,rstl_1879_0066.txt,txt_rstl
all the other facts which are detailed,are,rstl_1880_0007.txt,txt_rstl
to explain are facts of considerable importance,are,rstl_1880_0007.txt,txt_rstl
before. That these facts are remarkable no,are,rstl_1880_0007.txt,txt_rstl
on that of facts which are better,are,rstl_1880_0007.txt,txt_rstl
evident that these facts are of considerable,are,rstl_1880_0007.txt,txt_rstl
serous glands the facts known are not,are,rstl_1881_0016.txt,txt_rstl
"right angle. These facts are extremely interesting,",are,rstl_1882_0003.txt,txt_rstl
account for the facts which are supposed,are,rstl_1882_0003.txt,txt_rstl
ET; 6:64 These facts are of considerable,are,rstl_1883_0026.txt,txt_rstl
If these two facts are mutually dependent,are,rstl_1883_0022.txt,txt_rstl
most of the facts we are looking,are,rstl_1883_0010.txt,txt_rstl
and XXIII. similar facts are related. In,are,rstl_1884_0020.txt,txt_rstl
"the patient. These facts are well known,",are,rstl_1885_0009.txt,txt_rstl
"in calibre, These facts are clear enough",are,rstl_1886_0018.txt,txt_rstl
consequences with the facts to which the,with,rstl_1877_0002.txt,txt_rstl
agreement with the facts which we wish,with,rstl_1877_0002.txt,txt_rstl
in mind the facts already adduced with,with,rstl_1877_0018.txt,txt_rstl
most accordant with facts or not. That,with,rstl_1879_0062.txt,txt_rstl
consistent with the facts adduced in Table,with,rstl_1880_0010.txt,txt_rstl
accordance with these facts as to the,with,rstl_1880_0010.txt,txt_rstl
consistent with the facts which have been,with,rstl_1880_0010.txt,txt_rstl
enormous mass of facts in connexion with,with,rstl_1882_0024.txt,txt_rstl
as to observed facts connected with that,with,rstl_1882_0024.txt,txt_rstl
By comparing these facts with those already,with,rstl_1882_0002.txt,txt_rstl
consistent with the facts observed to say,with,rstl_1882_0002.txt,txt_rstl
"the Teleostei, the facts just recorded with",with,rstl_1882_0008.txt,txt_rstl
a few important facts with reference to,with,rstl_1882_0003.txt,txt_rstl
"(25, 33). Chemical facts connected with the",with,rstl_1883_0027.txt,txt_rstl
to review the facts in comparison with,with,rstl_1883_0024.txt,txt_rstl
"Lacaze-DuTaERs, with the facts presented by Alcyonarians.",with,rstl_1883_0024.txt,txt_rstl
the known experimental facts in accordance with,with,rstl_1884_0016.txt,txt_rstl
"account of the facts (1) that, with",with,rstl_1885_0010.txt,txt_rstl
agreement with the facts deseribed in this,with,rstl_1886_0012.txt,txt_rstl
"in harmony with facts previously known, there",with,rstl_1886_0012.txt,txt_rstl
once that these facts afforded a solid,that,rstl_1877_0002.txt,txt_rstl
g by the facts that the first,that,rstl_1877_0018.txt,txt_rstl
view are the facts that the first,that,rstl_1877_0018.txt,txt_rstl
doubt that the facts concerning Tiaropsis indicans,that,rstl_1877_0018.txt,txt_rstl
and of these facts the first that,that,rstl_1877_0018.txt,txt_rstl
"put on these facts is, that every",that,rstl_1877_0018.txt,txt_rstl
8een that the facts harmonize equally well,that,rstl_1877_0018.txt,txt_rstl
From the above facts we ee that,that,rstl_1879_0069.txt,txt_rstl
think that the facts are decidedly in,that,rstl_1879_0062.txt,txt_rstl
most accordant with facts or not. That,that,rstl_1879_0062.txt,txt_rstl
all the peculiar facts that have been,that,rstl_1879_0078.txt,txt_rstl
before. That these facts are remarkable no,that,rstl_1880_0007.txt,txt_rstl
on that of facts which are better,that,rstl_1880_0007.txt,txt_rstl
evident that these facts are of considerable,that,rstl_1880_0007.txt,txt_rstl
is obvious that facts special to anyone,that,rstl_1880_0010.txt,txt_rstl
seen that the facts guggest an interesting,that,rstl_1880_0010.txt,txt_rstl
of our observed facts to determine. That,that,rstl_1880_0010.txt,txt_rstl
mention the main facts which show that,that,rstl_1881_0016.txt,txt_rstl
nob affected. These facts prove that the,that,rstl_1881_0019.txt,txt_rstl
"of irritation. These facts prove, 1st, that",that,rstl_1881_0019.txt,txt_rstl
forty vessels. These facts show that as,that,rstl_1881_0003.txt,txt_rstl
or number of facts would accomplish that,that,rstl_1881_0003.txt,txt_rstl
the base. These facts show that direct,that,rstl_1882_0024.txt,txt_rstl
as to observed facts connected with that,that,rstl_1882_0024.txt,txt_rstl
them. From these facts I conclude that,that,rstl_1882_0024.txt,txt_rstl
sulphaur. From these facts we conclude that,that,rstl_1882_0011.txt,txt_rstl
results on two facts : (1) that,that,rstl_1882_0006.txt,txt_rstl
holds that the facts aro in —,that,rstl_1882_0008.txt,txt_rstl
"then, that the facts indicate that c",that,rstl_1882_0003.txt,txt_rstl
"find that the facts of embryology, if",that,rstl_1882_0003.txt,txt_rstl
explanation of the facts ; that the,that,rstl_1883_0026.txt,txt_rstl
"the two following facts : first, that",that,rstl_1883_0014.txt,txt_rstl
"other Eases, the facts related show that",that,rstl_1884_0020.txt,txt_rstl
"mined, But the facts demonstrated show that",that,rstl_1884_0020.txt,txt_rstl
that the chief facts thus far acquired,that,rstl_1885_0012.txt,txt_rstl
attention to the facts that whenever present,that,rstl_1885_0011.txt,txt_rstl
once that these facts afforded a solid,that,rstl_1877_0002.txt,txt_rstl
g by the facts that the first,that,rstl_1877_0018.txt,txt_rstl
view are the facts that the first,that,rstl_1877_0018.txt,txt_rstl
doubt that the facts concerning Tiaropsis indicans,that,rstl_1877_0018.txt,txt_rstl
and of these facts the first that,that,rstl_1877_0018.txt,txt_rstl
"put on these facts is, that every",that,rstl_1877_0018.txt,txt_rstl
8een that the facts harmonize equally well,that,rstl_1877_0018.txt,txt_rstl
From the above facts we ee that,that,rstl_1879_0069.txt,txt_rstl
think that the facts are decidedly in,that,rstl_1879_0062.txt,txt_rstl
most accordant with facts or not. That,that,rstl_1879_0062.txt,txt_rstl
all the peculiar facts that have been,that,rstl_1879_0078.txt,txt_rstl
before. That these facts are remarkable no,that,rstl_1880_0007.txt,txt_rstl
on that of facts which are better,that,rstl_1880_0007.txt,txt_rstl
evident that these facts are of considerable,that,rstl_1880_0007.txt,txt_rstl
is obvious that facts special to anyone,that,rstl_1880_0010.txt,txt_rstl
seen that the facts guggest an interesting,that,rstl_1880_0010.txt,txt_rstl
of our observed facts to determine. That,that,rstl_1880_0010.txt,txt_rstl
mention the main facts which show that,that,rstl_1881_0016.txt,txt_rstl
nob affected. These facts prove that the,that,rstl_1881_0019.txt,txt_rstl
"of irritation. These facts prove, 1st, that",that,rstl_1881_0019.txt,txt_rstl
forty vessels. These facts show that as,that,rstl_1881_0003.txt,txt_rstl
or number of facts would accomplish that,that,rstl_1881_0003.txt,txt_rstl
the base. These facts show that direct,that,rstl_1882_0024.txt,txt_rstl
as to observed facts connected with that,that,rstl_1882_0024.txt,txt_rstl
them. From these facts I conclude that,that,rstl_1882_0024.txt,txt_rstl
sulphaur. From these facts we conclude that,that,rstl_1882_0011.txt,txt_rstl
results on two facts : (1) that,that,rstl_1882_0006.txt,txt_rstl
holds that the facts aro in —,that,rstl_1882_0008.txt,txt_rstl
"then, that the facts indicate that c",that,rstl_1882_0003.txt,txt_rstl
"find that the facts of embryology, if",that,rstl_1882_0003.txt,txt_rstl
explanation of the facts ; that the,that,rstl_1883_0026.txt,txt_rstl
"the two following facts : first, that",that,rstl_1883_0014.txt,txt_rstl
"other Eases, the facts related show that",that,rstl_1884_0020.txt,txt_rstl
"mined, But the facts demonstrated show that",that,rstl_1884_0020.txt,txt_rstl
that the chief facts thus far acquired,that,rstl_1885_0012.txt,txt_rstl
attention to the facts that whenever present,that,rstl_1885_0011.txt,txt_rstl
most accordant with facts or not. That,or,rstl_1879_0062.txt,txt_rstl
experiments made or facts obtained under an,or,rstl_1880_0008.txt,txt_rstl
or number of facts would accomplish that,or,rstl_1881_0003.txt,txt_rstl
