Context,Word,File,Directory
but while the facts in the life-history,the,rstl_1882_0003.txt,txt_rstl
to express the facts of the metamorphosis,the,rstl_1882_0003.txt,txt_rstl
relation between the facts which have been,the,rstl_1882_0003.txt,txt_rstl
higher Decapods. The facts which have been,the,rstl_1882_0003.txt,txt_rstl
"find that the facts of embryology, if",the,rstl_1882_0003.txt,txt_rstl
account for the facts which are supposed,the,rstl_1882_0003.txt,txt_rstl
explanation of the facts E recorded lies,the,rstl_1882_0029.txt,txt_rstl
many of the facts we have to,the,rstl_1882_0029.txt,txt_rstl
bearing of these facts on the question,the,rstl_1882_0029.txt,txt_rstl
"and, in the facts adduced, we have",the,rstl_1882_0029.txt,txt_rstl
to appreciate the facts in reference to,the,rstl_1882_0029.txt,txt_rstl
record of the facts relating to the,the,rstl_1882_0029.txt,txt_rstl
"From the various facts adduced, it is",the,rstl_1882_0029.txt,txt_rstl
as do the facts in regard to,the,rstl_1882_0029.txt,txt_rstl
them. The main facts relating to the,the,rstl_1882_0029.txt,txt_rstl
explained the foregoing facts by the presence,the,rstl_1883_0027.txt,txt_rstl
"(25, 33). Chemical facts connected with the",the,rstl_1883_0027.txt,txt_rstl
36. Certain chemical facts concerning the behaviour,the,rstl_1883_0027.txt,txt_rstl
explanation of the facts ; that the,the,rstl_1883_0026.txt,txt_rstl
films. The observed facts were in accordance,the,rstl_1883_0020.txt,txt_rstl
"here described, the facts of their appearing",the,rstl_1883_0016.txt,txt_rstl
"Taking all the facts into account, the",the,rstl_1883_0016.txt,txt_rstl
"the two following facts : first, that",the,rstl_1883_0014.txt,txt_rstl
"vessels, The known facts of enlargement in",the,rstl_1883_0011.txt,txt_rstl
Do not the facts jus mentioned increase,the,rstl_1883_0011.txt,txt_rstl
"do, but these facts 8nggest the further",the,rstl_1883_0011.txt,txt_rstl
most of the facts we are looking,the,rstl_1883_0010.txt,txt_rstl
"review of the facts will be given,",the,rstl_1883_0024.txt,txt_rstl
to review the facts in comparison with,the,rstl_1883_0024.txt,txt_rstl
a number of facts which Sindicate the,the,rstl_1883_0024.txt,txt_rstl
"Lacaze-DuTaERs, with the facts presented by Alcyonarians.",the,rstl_1883_0024.txt,txt_rstl
"other Aleyonaria, The facts presented by the",the,rstl_1883_0024.txt,txt_rstl
of the following facts — 1. In,the,rstl_1883_0001.txt,txt_rstl
the known experimental facts in accordance with,the,rstl_1884_0016.txt,txt_rstl
express the experimental facts as far as,the,rstl_1884_0016.txt,txt_rstl
might bring interesting facts to light. The,the,rstl_1884_0021.txt,txt_rstl
account for the facts observed. I conclude,the,rstl_1884_0022.txt,txt_rstl
mixture increases. These facts account for the,the,rstl_1884_0022.txt,txt_rstl
oxygen. The same facts also account for,the,rstl_1884_0022.txt,txt_rstl
the surface. These facts permit the question,the,rstl_1884_0022.txt,txt_rstl
the explosion. The facts already discovered by,the,rstl_1884_0022.txt,txt_rstl
"other Eases, the facts related show that",the,rstl_1884_0020.txt,txt_rstl
the brain revealed facts of great importance,the,rstl_1884_0020.txt,txt_rstl
"mined, But the facts demonstrated show that",the,rstl_1884_0020.txt,txt_rstl
right. þ The facts of Experiment 23,the,rstl_1884_0020.txt,txt_rstl
be questionable. The facts of this experiment,the,rstl_1884_0020.txt,txt_rstl
38290. The following facts point to their,the,rstl_1884_0005.txt,txt_rstl
pole. The following facts have been established,the,rstl_1884_0005.txt,txt_rstl
of all the facts of the case.,the,rstl_1884_0003.txt,txt_rstl
of the above facts we can hardly,the,rstl_1885_0017.txt,txt_rstl
that the chief facts thus far acquired,the,rstl_1885_0012.txt,txt_rstl
of all the facts regarding «- 5,the,rstl_1885_0014.txt,txt_rstl
attention to the facts that whenever present,the,rstl_1885_0011.txt,txt_rstl
light the following facts among others —,the,rstl_1885_0011.txt,txt_rstl
"the patient. These facts are well known,",the,rstl_1885_0009.txt,txt_rstl
"account of the facts (1) that, with",the,rstl_1885_0010.txt,txt_rstl
determination by the Facts of embryology. In,the,rstl_1886_0018.txt,txt_rstl
view of the facts which experiment has,the,rstl_1886_0017.txt,txt_rstl
together the various facts which constitute all,the,rstl_1886_0017.txt,txt_rstl
demonstrated the following facts :— A vertical,the,rstl_1886_0012.txt,txt_rstl
"bearing on the facts here recorded, ]",the,rstl_1886_0012.txt,txt_rstl
"Briefly stated, the facts to be accounted",the,rstl_1886_0012.txt,txt_rstl
agreement with the facts deseribed in this,the,rstl_1886_0012.txt,txt_rstl
and if the facts described in this,the,rstl_1886_0007.txt,txt_rstl
"suppress, because the facts of which it",it,rstl_1877_0018.txt,txt_rstl
subsection RE The facts of which it,it,rstl_1880_0007.txt,txt_rstl
latter. From these facts it would appear,it,rstl_1881_0003.txt,txt_rstl
NERVE. 1015 These facts alone make it,it,rstl_1882_0024.txt,txt_rstl
to abound in facts which it has,it,rstl_1882_0007.txt,txt_rstl
"From the various facts adduced, it is",it,rstl_1882_0029.txt,txt_rstl
furnished by the facts brought to light,to,rstl_1877_0005.txt,txt_rstl
to render the facts safe by laborious,to,rstl_1877_0005.txt,txt_rstl
seen. Z These facts appear to me,to,rstl_1877_0007.txt,txt_rstl
consequences with the facts to which the,to,rstl_1877_0002.txt,txt_rstl
object to the facts on which these,to,rstl_1877_0002.txt,txt_rstl
reasoning to existing facts would have enabled,to,rstl_1877_0002.txt,txt_rstl
the range of facts accessible to our,to,rstl_1877_0002.txt,txt_rstl
facts. Now the facts to which this,to,rstl_1877_0002.txt,txt_rstl
Hence the principal facts to be gathered,to,rstl_1877_0018.txt,txt_rstl
time. All these facts seem to show,to,rstl_1877_0018.txt,txt_rstl
"an hour, 'These facts tend to =",to,rstl_1877_0018.txt,txt_rstl
the nectocalyx*. These facts clearly point to,to,rstl_1877_0018.txt,txt_rstl
curious class of facts to be dealt,to,rstl_1877_0018.txt,txt_rstl
collect some additional facts relating to this,to,rstl_1877_0018.txt,txt_rstl
OF MEDUS®E. 717 facts to be detailed,to,rstl_1877_0018.txt,txt_rstl
which the above facts supplied to my,to,rstl_1877_0018.txt,txt_rstl
to sea-water. These facts how the extreme,to,rstl_1877_0018.txt,txt_rstl
prolonged pause. These facts tend to show,to,rstl_1877_0018.txt,txt_rstl
to explain the facts ; for although,to,rstl_1877_0018.txt,txt_rstl
antagonistic to known facts in the assumption,to,rstl_1879_0062.txt,txt_rstl
-8pectrum. The following facts seem to me,to,rstl_1879_0062.txt,txt_rstl
of these experimental facts leads to the,to,rstl_1879_0066.txt,txt_rstl
There are other facts tending to support,to,rstl_1879_0066.txt,txt_rstl
"also, the chief facts which remained to",to,rstl_1880_0024.txt,txt_rstl
to regard the facts of artificial rhythm,to,rstl_1880_0007.txt,txt_rstl
to explain are facts of considerable importance,to,rstl_1880_0007.txt,txt_rstl
to meet the facts of a rhythm,to,rstl_1880_0007.txt,txt_rstl
to interpret the facts in the case,to,rstl_1880_0007.txt,txt_rstl
interpretation of these facts would geem to,to,rstl_1880_0007.txt,txt_rstl
attaching to these facts arises from the,to,rstl_1880_0007.txt,txt_rstl
"my mind, the facts seem rather to",to,rstl_1880_0007.txt,txt_rstl
hand the ascertained facts appear rather to,to,rstl_1880_0004.txt,txt_rstl
"its turn, contribute facts of interest to",to,rstl_1880_0010.txt,txt_rstl
is obvious that facts special to anyone,to,rstl_1880_0010.txt,txt_rstl
go beyond the facts more special to,to,rstl_1880_0010.txt,txt_rstl
later years. The facts relating to the,to,rstl_1880_0010.txt,txt_rstl
accordance with these facts as to the,to,rstl_1880_0010.txt,txt_rstl
of our observed facts to determine. That,to,rstl_1880_0010.txt,txt_rstl
to notice the facts bearing upon them.,to,rstl_1880_0010.txt,txt_rstl
to consider what facts we have to,to,rstl_1881_0016.txt,txt_rstl
COPPER. 1141 Several facts require to be,to,rstl_1882_0027.txt,txt_rstl
definite well established facts rather than to,to,rstl_1882_0024.txt,txt_rstl
as to observed facts connected with that,to,rstl_1882_0024.txt,txt_rstl
to give the facts upon which the,to,rstl_1882_0024.txt,txt_rstl
explain somewhat similar facts will apply to,to,rstl_1882_0024.txt,txt_rstl
"contrary, all the facts point to its",to,rstl_1882_0026.txt,txt_rstl
medulla. The above facts enable me to,to,rstl_1882_0015.txt,txt_rstl
to abound in facts which it has,to,rstl_1882_0007.txt,txt_rstl
two sets of facts relating to the,to,rstl_1882_0002.txt,txt_rstl
To observe these facts the current of,to,rstl_1882_0002.txt,txt_rstl
consistent with the facts observed to say,to,rstl_1882_0002.txt,txt_rstl
these now well-known facts to enable the,to,rstl_1882_0008.txt,txt_rstl
a few important facts with reference to,to,rstl_1882_0003.txt,txt_rstl
to express the facts of the metamorphosis,to,rstl_1882_0003.txt,txt_rstl
many of the facts we have to,to,rstl_1882_0029.txt,txt_rstl
to appreciate the facts in reference to,to,rstl_1882_0029.txt,txt_rstl
record of the facts relating to the,to,rstl_1882_0029.txt,txt_rstl
as do the facts in regard to,to,rstl_1882_0029.txt,txt_rstl
them. The main facts relating to the,to,rstl_1882_0029.txt,txt_rstl
"fig. 43), but facts exist to render",to,rstl_1883_0016.txt,txt_rstl
to review the facts in comparison with,to,rstl_1883_0024.txt,txt_rstl
might bring interesting facts to light. The,to,rstl_1884_0021.txt,txt_rstl
"as other similar facts narrated, 8erve to",to,rstl_1884_0020.txt,txt_rstl
have but few facts which serve to,to,rstl_1884_0005.txt,txt_rstl
38290. The following facts point to their,to,rstl_1884_0005.txt,txt_rstl
attention to the facts that whenever present,to,rstl_1885_0011.txt,txt_rstl
"larger tuberosities, These facts 8eem to show",to,rstl_1886_0019.txt,txt_rstl
erent trunk. These facts tend to confirm,to,rstl_1886_0018.txt,txt_rstl
to include all facts which might have,to,rstl_1886_0017.txt,txt_rstl
"Briefly stated, the facts to be accounted",to,rstl_1886_0012.txt,txt_rstl
own observations these facts go to prove,to,rstl_1886_0007.txt,txt_rstl
furnished by the facts brought to light,to,rstl_1877_0005.txt,txt_rstl
to render the facts safe by laborious,to,rstl_1877_0005.txt,txt_rstl
seen. Z These facts appear to me,to,rstl_1877_0007.txt,txt_rstl
consequences with the facts to which the,to,rstl_1877_0002.txt,txt_rstl
object to the facts on which these,to,rstl_1877_0002.txt,txt_rstl
reasoning to existing facts would have enabled,to,rstl_1877_0002.txt,txt_rstl
the range of facts accessible to our,to,rstl_1877_0002.txt,txt_rstl
facts. Now the facts to which this,to,rstl_1877_0002.txt,txt_rstl
Hence the principal facts to be gathered,to,rstl_1877_0018.txt,txt_rstl
time. All these facts seem to show,to,rstl_1877_0018.txt,txt_rstl
"an hour, 'These facts tend to =",to,rstl_1877_0018.txt,txt_rstl
the nectocalyx*. These facts clearly point to,to,rstl_1877_0018.txt,txt_rstl
curious class of facts to be dealt,to,rstl_1877_0018.txt,txt_rstl
collect some additional facts relating to this,to,rstl_1877_0018.txt,txt_rstl
OF MEDUS®E. 717 facts to be detailed,to,rstl_1877_0018.txt,txt_rstl
which the above facts supplied to my,to,rstl_1877_0018.txt,txt_rstl
to sea-water. These facts how the extreme,to,rstl_1877_0018.txt,txt_rstl
prolonged pause. These facts tend to show,to,rstl_1877_0018.txt,txt_rstl
to explain the facts ; for although,to,rstl_1877_0018.txt,txt_rstl
antagonistic to known facts in the assumption,to,rstl_1879_0062.txt,txt_rstl
-8pectrum. The following facts seem to me,to,rstl_1879_0062.txt,txt_rstl
of these experimental facts leads to the,to,rstl_1879_0066.txt,txt_rstl
There are other facts tending to support,to,rstl_1879_0066.txt,txt_rstl
"also, the chief facts which remained to",to,rstl_1880_0024.txt,txt_rstl
to regard the facts of artificial rhythm,to,rstl_1880_0007.txt,txt_rstl
to explain are facts of considerable importance,to,rstl_1880_0007.txt,txt_rstl
to meet the facts of a rhythm,to,rstl_1880_0007.txt,txt_rstl
to interpret the facts in the case,to,rstl_1880_0007.txt,txt_rstl
interpretation of these facts would geem to,to,rstl_1880_0007.txt,txt_rstl
attaching to these facts arises from the,to,rstl_1880_0007.txt,txt_rstl
"my mind, the facts seem rather to",to,rstl_1880_0007.txt,txt_rstl
hand the ascertained facts appear rather to,to,rstl_1880_0004.txt,txt_rstl
"its turn, contribute facts of interest to",to,rstl_1880_0010.txt,txt_rstl
is obvious that facts special to anyone,to,rstl_1880_0010.txt,txt_rstl
go beyond the facts more special to,to,rstl_1880_0010.txt,txt_rstl
later years. The facts relating to the,to,rstl_1880_0010.txt,txt_rstl
accordance with these facts as to the,to,rstl_1880_0010.txt,txt_rstl
of our observed facts to determine. That,to,rstl_1880_0010.txt,txt_rstl
to notice the facts bearing upon them.,to,rstl_1880_0010.txt,txt_rstl
to consider what facts we have to,to,rstl_1881_0016.txt,txt_rstl
COPPER. 1141 Several facts require to be,to,rstl_1882_0027.txt,txt_rstl
definite well established facts rather than to,to,rstl_1882_0024.txt,txt_rstl
as to observed facts connected with that,to,rstl_1882_0024.txt,txt_rstl
to give the facts upon which the,to,rstl_1882_0024.txt,txt_rstl
explain somewhat similar facts will apply to,to,rstl_1882_0024.txt,txt_rstl
"contrary, all the facts point to its",to,rstl_1882_0026.txt,txt_rstl
medulla. The above facts enable me to,to,rstl_1882_0015.txt,txt_rstl
to abound in facts which it has,to,rstl_1882_0007.txt,txt_rstl
two sets of facts relating to the,to,rstl_1882_0002.txt,txt_rstl
To observe these facts the current of,to,rstl_1882_0002.txt,txt_rstl
consistent with the facts observed to say,to,rstl_1882_0002.txt,txt_rstl
these now well-known facts to enable the,to,rstl_1882_0008.txt,txt_rstl
a few important facts with reference to,to,rstl_1882_0003.txt,txt_rstl
to express the facts of the metamorphosis,to,rstl_1882_0003.txt,txt_rstl
many of the facts we have to,to,rstl_1882_0029.txt,txt_rstl
to appreciate the facts in reference to,to,rstl_1882_0029.txt,txt_rstl
record of the facts relating to the,to,rstl_1882_0029.txt,txt_rstl
as do the facts in regard to,to,rstl_1882_0029.txt,txt_rstl
them. The main facts relating to the,to,rstl_1882_0029.txt,txt_rstl
"fig. 43), but facts exist to render",to,rstl_1883_0016.txt,txt_rstl
to review the facts in comparison with,to,rstl_1883_0024.txt,txt_rstl
might bring interesting facts to light. The,to,rstl_1884_0021.txt,txt_rstl
"as other similar facts narrated, 8erve to",to,rstl_1884_0020.txt,txt_rstl
have but few facts which serve to,to,rstl_1884_0005.txt,txt_rstl
38290. The following facts point to their,to,rstl_1884_0005.txt,txt_rstl
attention to the facts that whenever present,to,rstl_1885_0011.txt,txt_rstl
"larger tuberosities, These facts 8eem to show",to,rstl_1886_0019.txt,txt_rstl
erent trunk. These facts tend to confirm,to,rstl_1886_0018.txt,txt_rstl
to include all facts which might have,to,rstl_1886_0017.txt,txt_rstl
"Briefly stated, the facts to be accounted",to,rstl_1886_0012.txt,txt_rstl
own observations these facts go to prove,to,rstl_1886_0007.txt,txt_rstl
of such curious facts as the skulls,as,rstl_1877_0015.txt,txt_rstl
from 8uch meagre facts as the above,as,rstl_1877_0018.txt,txt_rstl
function as the facts imply should everywhere,as,rstl_1877_0018.txt,txt_rstl
"account for the facts ; because, as",as,rstl_1877_0018.txt,txt_rstl
"then, all the facts as concisely as",as,rstl_1880_0007.txt,txt_rstl
"Nevertheless, as the facts which the hypotbesis",as,rstl_1880_0007.txt,txt_rstl
speculation on such facts as those which,as,rstl_1880_0007.txt,txt_rstl
category of physiological facts as the case,as,rstl_1880_0007.txt,txt_rstl
forasmuch as the facts on which my,as,rstl_1880_0007.txt,txt_rstl
"And, as additional facts confirmatory of the",as,rstl_1880_0007.txt,txt_rstl
but as the facts there given have,as,rstl_1880_0008.txt,txt_rstl
accordance with these facts as to the,as,rstl_1880_0010.txt,txt_rstl
forty vessels. These facts show that as,as,rstl_1881_0003.txt,txt_rstl
"the Coal-measures, such facts as I have",as,rstl_1881_0003.txt,txt_rstl
"Illustrate the same facts as Tracings 8-11,",as,rstl_1882_0023.txt,txt_rstl
as to observed facts connected with that,as,rstl_1882_0024.txt,txt_rstl
erect trees. The facts 80 far as,as,rstl_1882_0013.txt,txt_rstl
as few new facts occurred in the,as,rstl_1882_0013.txt,txt_rstl
as do the facts in regard to,as,rstl_1882_0029.txt,txt_rstl
express the experimental facts as far as,as,rstl_1884_0016.txt,txt_rstl
"as other similar facts narrated, 8erve to",as,rstl_1884_0020.txt,txt_rstl
"as strong, more facts will presently be",as,rstl_1885_0017.txt,txt_rstl
Hence the principal facts to be gathered,be,rstl_1877_0018.txt,txt_rstl
correctly. = These facts may also be,be,rstl_1877_0018.txt,txt_rstl
curious class of facts to be dealt,be,rstl_1877_0018.txt,txt_rstl
OF MEDUS®E. 717 facts to be detailed,be,rstl_1877_0018.txt,txt_rstl
it. Although many facts which could be,be,rstl_1879_0073.txt,txt_rstl
2. 29. These facts will be better,be,rstl_1879_0078.txt,txt_rstl
"millim. pressure. The facts can, however, be",be,rstl_1881_0007.txt,txt_rstl
COPPER. 1141 Several facts require to be,be,rstl_1882_0027.txt,txt_rstl
a variety of facts can be brought,be,rstl_1882_0024.txt,txt_rstl
"notes these new facts will be stated,",be,rstl_1882_0013.txt,txt_rstl
area. The above facts may be confirmed,be,rstl_1882_0015.txt,txt_rstl
"region, the following facts may be readily",be,rstl_1882_0015.txt,txt_rstl
"exemplified, The preceding facts may be summed",be,rstl_1882_0002.txt,txt_rstl
"review of the facts will be given,",be,rstl_1883_0024.txt,txt_rstl
be questionable. The facts of this experiment,be,rstl_1884_0020.txt,txt_rstl
"as strong, more facts will presently be",be,rstl_1885_0017.txt,txt_rstl
"Briefly stated, the facts to be accounted",be,rstl_1886_0012.txt,txt_rstl
furnished by the facts brought to light,by,rstl_1877_0005.txt,txt_rstl
to render the facts safe by laborious,by,rstl_1877_0005.txt,txt_rstl
interpretations of those facts secure by close,by,rstl_1877_0005.txt,txt_rstl
"we express dynamical facts by it, and",by,rstl_1877_0002.txt,txt_rstl
g by the facts that the first,by,rstl_1877_0018.txt,txt_rstl
importance of any facts established by these,by,rstl_1877_0018.txt,txt_rstl
is confirmed by facts incidentally mentioned by,by,rstl_1879_0077.txt,txt_rstl
by the experimental facts already stated. In,by,rstl_1879_0066.txt,txt_rstl
marked and important facts discovered by GRAHAM,by,rstl_1879_0078.txt,txt_rstl
overlooked the following facts given by us,by,rstl_1880_0008.txt,txt_rstl
both by the facts which they already,by,rstl_1880_0010.txt,txt_rstl
upon 8ome interesting facts observed by them,by,rstl_1881_0016.txt,txt_rstl
"implied by these facts is, however, rendered",by,rstl_1881_0019.txt,txt_rstl
"indicated by the facts that, 1st, if",by,rstl_1881_0019.txt,txt_rstl
by the following facts — 1. The,by,rstl_1882_0024.txt,txt_rstl
By comparing these facts with those already,by,rstl_1882_0002.txt,txt_rstl
supported by two facts :— (1) In,by,rstl_1882_0008.txt,txt_rstl
knowledge of the facts by Cavs in,by,rstl_1882_0003.txt,txt_rstl
explained the foregoing facts by the presence,by,rstl_1883_0027.txt,txt_rstl
"Lacaze-DuTaERs, with the facts presented by Alcyonarians.",by,rstl_1883_0024.txt,txt_rstl
"other Aleyonaria, The facts presented by the",by,rstl_1883_0024.txt,txt_rstl
the explosion. The facts already discovered by,by,rstl_1884_0022.txt,txt_rstl
determination by the Facts of embryology. In,by,rstl_1886_0018.txt,txt_rstl
furnished by the facts brought to light,by,rstl_1877_0005.txt,txt_rstl
to render the facts safe by laborious,by,rstl_1877_0005.txt,txt_rstl
interpretations of those facts secure by close,by,rstl_1877_0005.txt,txt_rstl
"we express dynamical facts by it, and",by,rstl_1877_0002.txt,txt_rstl
g by the facts that the first,by,rstl_1877_0018.txt,txt_rstl
importance of any facts established by these,by,rstl_1877_0018.txt,txt_rstl
is confirmed by facts incidentally mentioned by,by,rstl_1879_0077.txt,txt_rstl
by the experimental facts already stated. In,by,rstl_1879_0066.txt,txt_rstl
marked and important facts discovered by GRAHAM,by,rstl_1879_0078.txt,txt_rstl
overlooked the following facts given by us,by,rstl_1880_0008.txt,txt_rstl
both by the facts which they already,by,rstl_1880_0010.txt,txt_rstl
upon 8ome interesting facts observed by them,by,rstl_1881_0016.txt,txt_rstl
"implied by these facts is, however, rendered",by,rstl_1881_0019.txt,txt_rstl
"indicated by the facts that, 1st, if",by,rstl_1881_0019.txt,txt_rstl
by the following facts — 1. The,by,rstl_1882_0024.txt,txt_rstl
By comparing these facts with those already,by,rstl_1882_0002.txt,txt_rstl
supported by two facts :— (1) In,by,rstl_1882_0008.txt,txt_rstl
knowledge of the facts by Cavs in,by,rstl_1882_0003.txt,txt_rstl
explained the foregoing facts by the presence,by,rstl_1883_0027.txt,txt_rstl
"Lacaze-DuTaERs, with the facts presented by Alcyonarians.",by,rstl_1883_0024.txt,txt_rstl
"other Aleyonaria, The facts presented by the",by,rstl_1883_0024.txt,txt_rstl
the explosion. The facts already discovered by,by,rstl_1884_0022.txt,txt_rstl
determination by the Facts of embryology. In,by,rstl_1886_0018.txt,txt_rstl
furnished by the facts brought to light,by,rstl_1877_0005.txt,txt_rstl
to render the facts safe by laborious,by,rstl_1877_0005.txt,txt_rstl
interpretations of those facts secure by close,by,rstl_1877_0005.txt,txt_rstl
"we express dynamical facts by it, and",by,rstl_1877_0002.txt,txt_rstl
g by the facts that the first,by,rstl_1877_0018.txt,txt_rstl
importance of any facts established by these,by,rstl_1877_0018.txt,txt_rstl
is confirmed by facts incidentally mentioned by,by,rstl_1879_0077.txt,txt_rstl
by the experimental facts already stated. In,by,rstl_1879_0066.txt,txt_rstl
marked and important facts discovered by GRAHAM,by,rstl_1879_0078.txt,txt_rstl
overlooked the following facts given by us,by,rstl_1880_0008.txt,txt_rstl
both by the facts which they already,by,rstl_1880_0010.txt,txt_rstl
upon 8ome interesting facts observed by them,by,rstl_1881_0016.txt,txt_rstl
"implied by these facts is, however, rendered",by,rstl_1881_0019.txt,txt_rstl
"indicated by the facts that, 1st, if",by,rstl_1881_0019.txt,txt_rstl
by the following facts — 1. The,by,rstl_1882_0024.txt,txt_rstl
By comparing these facts with those already,by,rstl_1882_0002.txt,txt_rstl
supported by two facts :— (1) In,by,rstl_1882_0008.txt,txt_rstl
knowledge of the facts by Cavs in,by,rstl_1882_0003.txt,txt_rstl
explained the foregoing facts by the presence,by,rstl_1883_0027.txt,txt_rstl
"Lacaze-DuTaERs, with the facts presented by Alcyonarians.",by,rstl_1883_0024.txt,txt_rstl
"other Aleyonaria, The facts presented by the",by,rstl_1883_0024.txt,txt_rstl
the explosion. The facts already discovered by,by,rstl_1884_0022.txt,txt_rstl
determination by the Facts of embryology. In,by,rstl_1886_0018.txt,txt_rstl
furnished by the facts brought to light,by,rstl_1877_0005.txt,txt_rstl
to render the facts safe by laborious,by,rstl_1877_0005.txt,txt_rstl
interpretations of those facts secure by close,by,rstl_1877_0005.txt,txt_rstl
"we express dynamical facts by it, and",by,rstl_1877_0002.txt,txt_rstl
g by the facts that the first,by,rstl_1877_0018.txt,txt_rstl
importance of any facts established by these,by,rstl_1877_0018.txt,txt_rstl
is confirmed by facts incidentally mentioned by,by,rstl_1879_0077.txt,txt_rstl
by the experimental facts already stated. In,by,rstl_1879_0066.txt,txt_rstl
marked and important facts discovered by GRAHAM,by,rstl_1879_0078.txt,txt_rstl
overlooked the following facts given by us,by,rstl_1880_0008.txt,txt_rstl
both by the facts which they already,by,rstl_1880_0010.txt,txt_rstl
upon 8ome interesting facts observed by them,by,rstl_1881_0016.txt,txt_rstl
"implied by these facts is, however, rendered",by,rstl_1881_0019.txt,txt_rstl
"indicated by the facts that, 1st, if",by,rstl_1881_0019.txt,txt_rstl
by the following facts — 1. The,by,rstl_1882_0024.txt,txt_rstl
By comparing these facts with those already,by,rstl_1882_0002.txt,txt_rstl
supported by two facts :— (1) In,by,rstl_1882_0008.txt,txt_rstl
knowledge of the facts by Cavs in,by,rstl_1882_0003.txt,txt_rstl
explained the foregoing facts by the presence,by,rstl_1883_0027.txt,txt_rstl
"Lacaze-DuTaERs, with the facts presented by Alcyonarians.",by,rstl_1883_0024.txt,txt_rstl
"other Aleyonaria, The facts presented by the",by,rstl_1883_0024.txt,txt_rstl
the explosion. The facts already discovered by,by,rstl_1884_0022.txt,txt_rstl
determination by the Facts of embryology. In,by,rstl_1886_0018.txt,txt_rstl
once that these facts afforded a solid,that,rstl_1877_0002.txt,txt_rstl
g by the facts that the first,that,rstl_1877_0018.txt,txt_rstl
view are the facts that the first,that,rstl_1877_0018.txt,txt_rstl
doubt that the facts concerning Tiaropsis indicans,that,rstl_1877_0018.txt,txt_rstl
and of these facts the first that,that,rstl_1877_0018.txt,txt_rstl
"put on these facts is, that every",that,rstl_1877_0018.txt,txt_rstl
8een that the facts harmonize equally well,that,rstl_1877_0018.txt,txt_rstl
From the above facts we ee that,that,rstl_1879_0069.txt,txt_rstl
think that the facts are decidedly in,that,rstl_1879_0062.txt,txt_rstl
most accordant with facts or not. That,that,rstl_1879_0062.txt,txt_rstl
all the peculiar facts that have been,that,rstl_1879_0078.txt,txt_rstl
before. That these facts are remarkable no,that,rstl_1880_0007.txt,txt_rstl
on that of facts which are better,that,rstl_1880_0007.txt,txt_rstl
evident that these facts are of considerable,that,rstl_1880_0007.txt,txt_rstl
is obvious that facts special to anyone,that,rstl_1880_0010.txt,txt_rstl
seen that the facts guggest an interesting,that,rstl_1880_0010.txt,txt_rstl
of our observed facts to determine. That,that,rstl_1880_0010.txt,txt_rstl
