Context,Word,File,Directory
BODY. 195 experimental facts in a more,experimental,rstb_1912_0006.txt,txt_rstb
represents the experimental facts in an extremely,experimental,rstb_1912_0006.txt,txt_rstb
out by experimental facts (such as the,experimental,rsta_1912_0012.txt,txt_rsta
of the experimental facts (described in Part,experimental,rsta_1914_0014.txt,txt_rsta
of the experimental facts obtained in Part,experimental,rsta_1914_0014.txt,txt_rsta
of the experimental facts presently to be,experimental,rstb_1915_0004.txt,txt_rstb
deduction from experimental facts to obtain a,experimental,rsta_1915_0003.txt,txt_rsta
to actual physical facts arising from experimental,experimental,rsta_1916_0009.txt,txt_rsta
theory those experimental facts which have led,experimental,rsta_1918_0009.txt,txt_rsta
most significant experimental facts bearing on the,experimental,rsta_1918_0009.txt,txt_rsta
express the experimental facts exceedingly well for,experimental,rsta_1918_0009.txt,txt_rsta
deduction from experimental facts which record the,experimental,rsta_1920_0008.txt,txt_rsta
with the actual facts than the others.,actual,rsta_1912_0012.txt,txt_rsta
"of the actual facts may lead, as",actual,rsta_1913_0008.txt,txt_rsta
of the actual facts will show that,actual,rsta_1913_0008.txt,txt_rsta
actual details and facts which may be,actual,rstb_1914_0014.txt,txt_rstb
"directly with actual facts of observation. Incidentally,",actual,rstb_1915_0007.txt,txt_rstb
to actual physical facts arising from experimental,actual,rsta_1916_0009.txt,txt_rsta
"press, two important facts bearing on the",important,rstb_1912_0009.txt,txt_rstb
are four important facts to be borne,important,rstb_1914_0009.txt,txt_rstb
the most important facts in the chain,important,rstb_1916_0010.txt,txt_rstb
But other important facts are brought out,important,rsta_1918_0007.txt,txt_rsta
by the following facts derived from a,following,rstb_1912_0007.txt,txt_rstb
5.) The following facts appear from the,following,rsta_1912_0006.txt,txt_rsta
does the following facts may be quoted.,following,rsta_1912_0006.txt,txt_rsta
learn the following facts within the region,following,rsta_1912_0002.txt,txt_rsta
learn the following facts :— 1. All,following,rsta_1912_0002.txt,txt_rsta
by the following facts concerning the monoclonal,following,rstb_1914_0020.txt,txt_rstb
by the following facts :— (1) Ina,following,rstb_1914_0020.txt,txt_rstb
but the following facts should be noted,following,rstb_1914_0016.txt,txt_rstb
following : two facts :— ¢ *,following,rstb_1916_0007.txt,txt_rstb
from the following facts :— (a) Microscopical,following,rstb_1916_0011.txt,txt_rstb
by the following facts :-— 1. The,following,rstb_1916_0011.txt,txt_rstb
it the following facts become clear :—,following,rsta_1918_0006.txt,txt_rsta
by the following facts :— 1. That,following,rstb_1920_0001.txt,txt_rstb
years these physiological facts have come to,these,rstb_1912_0004.txt,txt_rstb
inference from these facts appears-to be that,these,rstb_1913_0004.txt,txt_rstb
view of these facts it does not,these,rstb_1913_0006.txt,txt_rstb
"case. With these facts before us, it",these,rsta_1913_0008.txt,txt_rsta
focal length. These facts are well known,these,rsta_1913_0005.txt,txt_rsta
such experiments. These facts alone would dismiss,these,rstb_1914_0005.txt,txt_rstb
statement of these facts is deemed sufficient.,these,rstb_1914_0007.txt,txt_rstb
"13, 65. These facts immediately suggest a",these,rstb_1914_0007.txt,txt_rstb
and 23). These facts add considerable complications,these,rstb_1914_0010.txt,txt_rstb
and phosphates. These facts show that “a,these,rstb_1914_0013.txt,txt_rstb
development. On these facts the supposition was,these,rstb_1914_0014.txt,txt_rstb
accordance with these facts so thoroughly demonstrated,these,rstb_1914_0011.txt,txt_rstb
We interpret these facts as evidences that,these,rstb_1914_0019.txt,txt_rstb
to explain these facts by reference to,these,rstb_1914_0009.txt,txt_rstb
bearing of these facts on the .,these,rstb_1914_0018.txt,txt_rstb
"If confirmed, these facts would fall in",these,rstb_1914_0008.txt,txt_rstb
Some of these facts have been incorporated,these,rstb_1914_0008.txt,txt_rstb
29). If these facts are compared with,these,rstb_1914_0016.txt,txt_rstb
the series. These facts strengthen the evidence,these,rstb_1914_0016.txt,txt_rstb
hours.t These & facts clearly show that,these,rsta_1914_0007.txt,txt_rsta
intensity. Although these facts are obvious the,these,rsta_1914_0008.txt,txt_rsta
"these and other facts one may reasonably,",these,rstb_1915_0007.txt,txt_rstb
"3, All these facts go together to",these,rstb_1915_0007.txt,txt_rstb
true that these facts have chiefly been,these,rstb_1915_0007.txt,txt_rstb
of 5:4. These facts cannot be explained,these,rstb_1915_0007.txt,txt_rstb
"XX shows these facts summarised, and goes",these,rstb_1915_0007.txt,txt_rstb
entirely disappeared. These facts are very simply,these,rsta_1915_0009.txt,txt_rsta
spherical divergence. These facts suggest emphatically that,these,rsta_1915_0004.txt,txt_rsta
five. Taking these facts together it seems,these,rstb_1916_0004.txt,txt_rstb
passed off. These facts are shown in,these,rstb_1916_0004.txt,txt_rstb
the megasporophylls. These facts seem to further,these,rstb_1916_0003.txt,txt_rstb
"far as these facts lead, therefore, they",these,rstb_1916_0008.txt,txt_rstb
its disappearance. These facts seem to me,these,rstb_1916_0007.txt,txt_rstb
absent. Evidently these facts may help us,these,rstb_1916_0006.txt,txt_rstb
basketwork. These chief facts are illustrated in,these,rstb_1916_0006.txt,txt_rstb
levograms. Now these facts are not new,these,rstb_1916_0006.txt,txt_rstb
will render these facts clear. The density,these,rsta_1916_0001.txt,txt_rsta
to represent the facts in these extreme,these,rsta_1916_0006.txt,txt_rsta
"plane posteriorly. These facts suggest that, on",these,rstb_1918_0010.txt,txt_rstb
Englishman illustrates these facts graphically. The characteristic,these,rstb_1918_0010.txt,txt_rstb
drawn from these facts are of the,these,rstb_1918_0010.txt,txt_rstb
"therefore, from these facts is that, notwithstanding",these,rstb_1918_0010.txt,txt_rstb
curve depicting these facts is well known.,these,rsta_1918_0003.txt,txt_rsta
be detected. These facts of observation show,these,rsta_1918_0003.txt,txt_rsta
the list. These facts give some support,these,rsta_1918_0007.txt,txt_rsta
a {100}. These facts will be rendered,these,rsta_1918_0006.txt,txt_rsta
218 When these facts had been ascertained,these,rstb_1920_0003.txt,txt_rstb
“Where do these facts point? A moment’s,these,rsta_1920_0008.txt,txt_rsta
"spectral construction, such facts as these may",these,rsta_1920_0010.txt,txt_rsta
obtained increases. These facts confirm the theory,these,rstb_1921_0005.txt,txt_rstb
are incorrect. These facts need not be,these,rstb_1921_0002.txt,txt_rstb
same conclusion. These facts about Podocarpus are,these,rstb_1921_0007.txt,txt_rstb
small. All these facts are evidently in,these,rsta_1921_0006.txt,txt_rsta
"one specimen, ‘The facts observed certainly suggest",observed,rstb_1912_0007.txt,txt_rstb
applied to the facts observed by us,observed,rstb_1913_0006.txt,txt_rstb
to explain the facts observed on Pike’s,observed,rstb_1913_0006.txt,txt_rstb
of carbon. The facts observed with the,observed,rsta_1915_0010.txt,txt_rsta
"what the observed facts really are. Second,",observed,rsta_1915_0004.txt,txt_rsta
explained by the facts observed in other,observed,rstb_1918_0006.txt,txt_rstb
explain the observed facts of the phenomenon.,observed,rstb_1920_0002.txt,txt_rstb
accord with observed facts than the one,observed,rstb_1920_0010.txt,txt_rstb
illustration of the facts observed are treated,observed,rstb_1921_0008.txt,txt_rstb
and the observed facts are compared with,observed,rsta_1921_0011.txt,txt_rsta
the reverse. The facts presented above make,above,rstb_1914_0001.txt,txt_rstb
have stated the facts above at some,above,rstb_1914_0008.txt,txt_rstb
"now, the above facts be combined with",above,rsta_1915_0010.txt,txt_rsta
That the above facts do not really,above,rsta_1915_0010.txt,txt_rsta
"from the above facts :— (1) That,",above,rsta_1915_0011.txt,txt_rsta
bearing of the facts above set forth,above,rstb_1916_0001.txt,txt_rstb
to regard the facts above set forth,above,rstb_1916_0001.txt,txt_rstb
probably more. The facts recorded above suggest,above,rstb_1920_0001.txt,txt_rstb
"some extent, the facts described above in",above,rstb_1921_0002.txt,txt_rstb
to explain the facts described above for,above,rstb_1921_0002.txt,txt_rstb
below. The above facts indicate the lines,above,rsta_1921_0010.txt,txt_rsta
"perfected hook-beaked form, facts which may suggest",may,rstb_1912_0009.txt,txt_rstb
does the following facts may be quoted.,may,rsta_1912_0006.txt,txt_rsta
"of the actual facts may lead, as",may,rsta_1913_0008.txt,txt_rsta
revision of the facts of observation may,may,rstb_1914_0014.txt,txt_rstb
actual details and facts which may be,may,rstb_1914_0014.txt,txt_rstb
"these and other facts one may reasonably,",may,rstb_1915_0007.txt,txt_rstb
may represent the facts it can have,may,rsta_1915_0004.txt,txt_rsta
From the foregoing facts we may conclude,may,rstb_1916_0002.txt,txt_rstb
absent. Evidently these facts may help us,may,rstb_1916_0006.txt,txt_rstb
least. [The principal facts which may be,may,rsta_1918_0009.txt,txt_rsta
"spectral construction, such facts as these may",may,rsta_1920_0010.txt,txt_rsta
years these physiological facts have come to,have,rstb_1912_0004.txt,txt_rstb
"number, and the facts have been sufficiently",have,rstb_1913_0002.txt,txt_rstb
we have the facts that the direction,have,rstb_1914_0019.txt,txt_rstb
have stated the facts above at some,have,rstb_1914_0008.txt,txt_rstb
Some of these facts have been incorporated,have,rstb_1914_0008.txt,txt_rstb
reflect upon the facts that have been,have,rstb_1915_0007.txt,txt_rstb
bearings of the facts that have been,have,rstb_1915_0007.txt,txt_rstb
support from the facts which have been,have,rstb_1915_0007.txt,txt_rstb
true that these facts have chiefly been,have,rstb_1915_0007.txt,txt_rstb
with the interesting facts which have been,have,rstb_1915_0007.txt,txt_rstb
may represent the facts it can have,have,rsta_1915_0004.txt,txt_rsta
Results. The general facts which have been,have,rsta_1915_0003.txt,txt_rsta
now to the facts which have led,have,rstb_1916_0004.txt,txt_rstb
theory those experimental facts which have led,have,rsta_1918_0009.txt,txt_rsta
"since then, certain facts have been established",have,rsta_1918_0009.txt,txt_rsta
results. The established facts which have an,have,rsta_1918_0009.txt,txt_rsta
have found are facts which must be,have,rsta_1918_0007.txt,txt_rsta
the light of facts which have since,have,rstb_1921_0007.txt,txt_rstb
the reservoir. The facts recorded are derived,are,rstb_1912_0002.txt,txt_rstb
focal length. These facts are well known,are,rsta_1913_0005.txt,txt_rsta
"itself, however, the facts are sufficiently simple",are,rstb_1914_0014.txt,txt_rstb
but the main facts are still somewhat,are,rstb_1914_0014.txt,txt_rstb
are four important facts to be borne,are,rstb_1914_0009.txt,txt_rstb
indicated by various facts which are fully,are,rstb_1914_0008.txt,txt_rstb
circumstances are the facts (1) that the,are,rstb_1914_0016.txt,txt_rstb
29). If these facts are compared with,are,rstb_1914_0016.txt,txt_rstb
nervous system. Parallel facts are to be,are,rstb_1914_0016.txt,txt_rstb
intensity. Although these facts are obvious the,are,rsta_1914_0008.txt,txt_rsta
far as the facts are concerned I,are,rstb_1915_0001.txt,txt_rstb
know; but the facts are very striking.,are,rstb_1915_0007.txt,txt_rstb
entirely disappeared. These facts are very simply,are,rsta_1915_0009.txt,txt_rsta
"preference to hydrogen,t facts which are at",are,rsta_1915_0010.txt,txt_rsta
passed off. These facts are shown in,are,rstb_1916_0004.txt,txt_rstb
basketwork. These chief facts are illustrated in,are,rstb_1916_0006.txt,txt_rstb
levograms. Now these facts are not new,are,rstb_1916_0006.txt,txt_rstb
drawn from these facts are of the,are,rstb_1918_0010.txt,txt_rstb
on till further facts are considered. When,are,rsta_1918_0003.txt,txt_rsta
But other important facts are brought out,are,rsta_1918_0007.txt,txt_rsta
have found are facts which must be,are,rsta_1918_0007.txt,txt_rsta
answered that the facts are confined to,are,rstb_1920_0004.txt,txt_rstb
"Cretaceous Cheilostomes, the facts are as follows.",are,rstb_1920_0004.txt,txt_rstb
"which genus the facts are not known,",are,rstb_1920_0001.txt,txt_rstb
far as the facts are shown. Laceocephalus,are,rstb_1920_0001.txt,txt_rstb
nutrition they receive—the facts are indeed to,are,rstb_1920_0002.txt,txt_rstb
accordance with the facts that are at,are,rstb_1920_0002.txt,txt_rstb
believed that the facts already known are,are,rstb_1920_0010.txt,txt_rstb
of cleavage. “These facts are suggestive. The,are,rsta_1920_0008.txt,txt_rsta
are incorrect. These facts need not be,are,rstb_1921_0002.txt,txt_rstb
same conclusion. These facts about Podocarpus are,are,rstb_1921_0007.txt,txt_rstb
(1915) has published facts which are of,are,rstb_1921_0007.txt,txt_rstb
illustration of the facts observed are treated,are,rstb_1921_0008.txt,txt_rstb
and the observed facts are compared with,are,rsta_1921_0011.txt,txt_rsta
small. All these facts are evidently in,are,rsta_1921_0006.txt,txt_rsta
"perfected hook-beaked form, facts which may suggest",which,rstb_1912_0009.txt,txt_rstb
"I hope, observational facts about which there",which,rsta_1912_0006.txt,txt_rsta
both of which facts would appreciably affect,which,rsta_1913_0001.txt,txt_rsta
some other mammals; facts which he maintains,which,rstb_1914_0006.txt,txt_rstb
us of certain facts which suggest that,which,rstb_1914_0006.txt,txt_rstb
"of summer, which facts account for the",which,rstb_1914_0003.txt,txt_rstb
way of definite facts on which to,which,rstb_1914_0007.txt,txt_rstb
actual details and facts which may be,which,rstb_1914_0014.txt,txt_rstb
indicated by various facts which are fully,which,rstb_1914_0008.txt,txt_rstb
support from the facts which have been,which,rstb_1915_0007.txt,txt_rstb
with the interesting facts which have been,which,rstb_1915_0007.txt,txt_rstb
"Foraminifera, records three facts which in my",which,rstb_1915_0005.txt,txt_rstb
"preference to hydrogen,t facts which are at",which,rsta_1915_0010.txt,txt_rsta
Results. The general facts which have been,which,rsta_1915_0003.txt,txt_rsta
now to the facts which have led,which,rstb_1916_0004.txt,txt_rstb
this treatment ; facts which at once,which,rsta_1916_0008.txt,txt_rsta
theory those experimental facts which have led,which,rsta_1918_0009.txt,txt_rsta
results. The established facts which have an,which,rsta_1918_0009.txt,txt_rsta
least. [The principal facts which may be,which,rsta_1918_0009.txt,txt_rsta
have found are facts which must be,which,rsta_1918_0007.txt,txt_rsta
"which represents the facts moderately well, though",which,rsta_1919_0001.txt,txt_rsta
"which genus the facts are not known,",which,rstb_1920_0001.txt,txt_rstb
deduction from experimental facts which record the,which,rsta_1920_0008.txt,txt_rsta
the light of facts which have since,which,rstb_1921_0007.txt,txt_rstb
(1915) has published facts which are of,which,rstb_1921_0007.txt,txt_rstb
by the following facts derived from a,from,rstb_1912_0007.txt,txt_rstb
conclusions from the facts ascertained in this,from,rstb_1912_0004.txt,txt_rstb
5.) The following facts appear from the,from,rsta_1912_0006.txt,txt_rsta
inference from these facts appears-to be that,from,rstb_1913_0004.txt,txt_rstb
afforded from the facts that the relationships,from,rsta_1913_0002.txt,txt_rsta
"from (1) the facts of development (McNan,",from,rstb_1914_0014.txt,txt_rstb
support from the facts which have been,from,rstb_1915_0007.txt,txt_rstb
; from such facts can be deduced,from,rsta_1915_0010.txt,txt_rsta
"from the above facts :— (1) That,",from,rsta_1915_0011.txt,txt_rsta
deduction from experimental facts to obtain a,from,rsta_1915_0003.txt,txt_rsta
From the foregoing facts we may conclude,from,rstb_1916_0002.txt,txt_rstb
from the following facts :— (a) Microscopical,from,rstb_1916_0011.txt,txt_rstb
to actual physical facts arising from experimental,from,rsta_1916_0009.txt,txt_rsta
drawn from these facts are of the,from,rstb_1918_0010.txt,txt_rstb
"therefore, from these facts is that, notwithstanding",from,rstb_1918_0010.txt,txt_rstb
"ascertained from the facts of geological distribution,",from,rstb_1920_0010.txt,txt_rstb
deduction from experimental facts which record the,from,rsta_1920_0008.txt,txt_rsta
"possible, from the facts for wood, to",from,rstb_1921_0002.txt,txt_rstb
agreement with the facts derived from the,from,rstb_1921_0002.txt,txt_rstb
in relation to facts derived from the,from,rstb_1921_0002.txt,txt_rstb
inference from these facts appears-to be that,that,rstb_1913_0004.txt,txt_rstb
afforded from the facts that the relationships,that,rsta_1913_0002.txt,txt_rsta
of the actual facts will show that,that,rsta_1913_0008.txt,txt_rsta
us of certain facts which suggest that,that,rstb_1914_0006.txt,txt_rstb
and phosphates. These facts show that “a,that,rstb_1914_0013.txt,txt_rstb
We interpret these facts as evidences that,that,rstb_1914_0019.txt,txt_rstb
we have the facts that the direction,that,rstb_1914_0019.txt,txt_rstb
"excluded by the facts stated above, that",that,rstb_1914_0008.txt,txt_rstb
"(p. 224). Other facts show, however, that",that,rstb_1914_0016.txt,txt_rstb
circumstances are the facts (1) that the,that,rstb_1914_0016.txt,txt_rstb
hours.t These & facts clearly show that,that,rsta_1914_0007.txt,txt_rsta
fit the striking facts that the species,that,rstb_1915_0007.txt,txt_rstb
reflect upon the facts that have been,that,rstb_1915_0007.txt,txt_rstb
bearings of the facts that have been,that,rstb_1915_0007.txt,txt_rstb
true that these facts have chiefly been,that,rstb_1915_0007.txt,txt_rstb
That the above facts do not really,that,rsta_1915_0010.txt,txt_rsta
spherical divergence. These facts suggest emphatically that,that,rsta_1915_0004.txt,txt_rsta
on Cervical Thymus.—The facts that in certain,that,rstb_1916_0001.txt,txt_rstb
that the chief facts relating to each,that,rsta_1919_0001.txt,txt_rsta
answered that the facts are confined to,that,rstb_1920_0004.txt,txt_rstb
by the following facts :— 1. That,that,rstb_1920_0001.txt,txt_rstb
accordance with the facts that are at,that,rstb_1920_0002.txt,txt_rstb
believed that the facts already known are,that,rstb_1920_0010.txt,txt_rstb
"considerations, and of facts that will appear",that,rstb_1920_0010.txt,txt_rstb
"inconsistent with the facts for most gases,",with,rsta_1912_0012.txt,txt_rsta
with the actual facts than the others.,with,rsta_1912_0012.txt,txt_rsta
view with the facts now before us.,with,rstb_1913_0001.txt,txt_rstb
dealt with the facts underlying the increase,with,rstb_1913_0006.txt,txt_rstb
"case. With these facts before us, it",with,rsta_1913_0008.txt,txt_rsta
accordance with these facts so thoroughly demonstrated,with,rstb_1914_0011.txt,txt_rstb
29). If these facts are compared with,with,rstb_1914_0016.txt,txt_rstb
conflict with ascertained facts :— ENTEROPNEUSTS. ASTERIDS.,with,rstb_1914_0016.txt,txt_rstb
"will express the facts with any accuracy,",with,rsta_1914_0016.txt,txt_rsta
"directly with actual facts of observation. Incidentally,",with,rstb_1915_0007.txt,txt_rstb
with the interesting facts which have been,with,rstb_1915_0007.txt,txt_rstb
"now, the above facts be combined with",with,rsta_1915_0010.txt,txt_rsta
of carbon. The facts observed with the,with,rsta_1915_0010.txt,txt_rsta
taken with other facts to support their,with,rstb_1916_0007.txt,txt_rstb
an illustration. The facts with regard to,with,rsta_1919_0006.txt,txt_rsta
accordance with the facts that are at,with,rstb_1920_0002.txt,txt_rstb
accord with observed facts than the one,with,rstb_1920_0010.txt,txt_rstb
agreement with the facts derived from the,with,rstb_1921_0002.txt,txt_rstb
and the observed facts are compared with,with,rsta_1921_0011.txt,txt_rsta
the reservoir. The facts recorded are derived,the,rstb_1912_0002.txt,txt_rstb
represents the experimental facts in an extremely,the,rstb_1912_0006.txt,txt_rstb
bearing of the facts upon the interpretation,the,rstb_1912_0007.txt,txt_rstb
by the following facts derived from a,the,rstb_1912_0007.txt,txt_rstb
"press, two important facts bearing on the",the,rstb_1912_0009.txt,txt_rstb
times. Whilst the facts as to the,the,rstb_1912_0009.txt,txt_rstb
conclusions from the facts ascertained in this,the,rstb_1912_0004.txt,txt_rstb
5.) The following facts appear from the,the,rsta_1912_0006.txt,txt_rsta
flowing stream. The facts brought to light,the,rsta_1912_0006.txt,txt_rsta
representation of the facts disclosed in the,the,rsta_1912_0006.txt,txt_rsta
does the following facts may be quoted.,the,rsta_1912_0006.txt,txt_rsta
represent the real facts at all adequately.,the,rsta_1912_0012.txt,txt_rsta
out by experimental facts (such as the,the,rsta_1912_0012.txt,txt_rsta
"inconsistent with the facts for most gases,",the,rsta_1912_0012.txt,txt_rsta
with the actual facts than the others.,the,rsta_1912_0012.txt,txt_rsta
learn the following facts within the region,the,rsta_1912_0002.txt,txt_rsta
learn the following facts :— 1. All,the,rsta_1912_0002.txt,txt_rsta
"number, and the facts have been sufficiently",the,rstb_1913_0002.txt,txt_rstb
view with the facts now before us.,the,rstb_1913_0001.txt,txt_rstb
contradicted by the facts enunciated in the,the,rstb_1913_0001.txt,txt_rstb
"consideration of the facts enumerated above, I",the,rstb_1913_0001.txt,txt_rstb
applied to the facts observed by us,the,rstb_1913_0006.txt,txt_rstb
to explain the facts observed on Pike’s,the,rstb_1913_0006.txt,txt_rstb
dealt with the facts underlying the increase,the,rstb_1913_0006.txt,txt_rstb
consideration of the facts in the two,the,rstb_1913_0006.txt,txt_rstb
afforded from the facts that the relationships,the,rsta_1913_0002.txt,txt_rsta
"of the actual facts may lead, as",the,rsta_1913_0008.txt,txt_rsta
of the actual facts will show that,the,rsta_1913_0008.txt,txt_rsta
whether the new facts throw any new,the,rstb_1914_0002.txt,txt_rstb
"of summer, which facts account for the",the,rstb_1914_0003.txt,txt_rstb
of the few facts at his command,the,rstb_1914_0007.txt,txt_rstb
watch for further facts on the subject,the,rstb_1914_0007.txt,txt_rstb
fairly by the facts produced in the,the,rstb_1914_0007.txt,txt_rstb
the reverse. The facts presented above make,the,rstb_1914_0001.txt,txt_rstb
revision of the facts of observation may,the,rstb_1914_0014.txt,txt_rstb
statement of the facts is necessary. Considering,the,rstb_1914_0014.txt,txt_rstb
statement of the facts of observation (ef.,the,rstb_1914_0014.txt,txt_rstb
"itself, however, the facts are sufficiently simple",the,rstb_1914_0014.txt,txt_rstb
but the main facts are still somewhat,the,rstb_1914_0014.txt,txt_rstb
weakened by the facts of development. It,the,rstb_1914_0014.txt,txt_rstb
"from (1) the facts of development (McNan,",the,rstb_1914_0014.txt,txt_rstb
development. On these facts the supposition was,the,rstb_1914_0014.txt,txt_rstb
expresses all the facts available. During the,the,rstb_1914_0014.txt,txt_rstb
latter ease. The facts then would be,the,rstb_1914_0011.txt,txt_rstb
of the true facts can be given.,the,rstb_1914_0004.txt,txt_rstb
we have the facts that the direction,the,rstb_1914_0019.txt,txt_rstb
by the following facts concerning the monoclonal,the,rstb_1914_0020.txt,txt_rstb
by the following facts :— (1) Ina,the,rstb_1914_0020.txt,txt_rstb
bearing of these facts on the .,the,rstb_1914_0018.txt,txt_rstb
different lumen. The facts concerning our Kalymma,the,rstb_1914_0018.txt,txt_rstb
court by the facts of distribution. On,the,rstb_1914_0008.txt,txt_rstb
have stated the facts above at some,the,rstb_1914_0008.txt,txt_rstb
ECHINOIDS. 329 The facts recorded in the,the,rstb_1914_0008.txt,txt_rstb
"excluded by the facts stated above, that",the,rstb_1914_0008.txt,txt_rstb
345-6). The main facts of its development,the,rstb_1914_0016.txt,txt_rstb
circumstances are the facts (1) that the,the,rstb_1914_0016.txt,txt_rstb
but the following facts should be noted,the,rstb_1914_0016.txt,txt_rstb
the series. These facts strengthen the evidence,the,rstb_1914_0016.txt,txt_rstb
"as regards the facts thus mentioned, this",the,rsta_1914_0020.txt,txt_rsta
"representation of the facts at low temperature,",the,rsta_1914_0021.txt,txt_rsta
"will express the facts with any accuracy,",the,rsta_1914_0016.txt,txt_rsta
of the experimental facts (described in Part,the,rsta_1914_0014.txt,txt_rsta
of the experimental facts obtained in Part,the,rsta_1914_0014.txt,txt_rsta
The principal known facts regarding the lunar,the,rsta_1914_0007.txt,txt_rsta
intensity. Although these facts are obvious the,the,rsta_1914_0008.txt,txt_rsta
land. The present facts seem to lead,the,rstb_1915_0001.txt,txt_rstb
far as the facts are concerned I,the,rstb_1915_0001.txt,txt_rstb
to express the facts (those of J.,the,rstb_1915_0002.txt,txt_rstb
account for the facts up to a,the,rstb_1915_0002.txt,txt_rstb
of the experimental facts presently to be,the,rstb_1915_0004.txt,txt_rstb
"botany. Incidentally, the facts about to be",the,rstb_1915_0007.txt,txt_rstb
know; but the facts are very striking.,the,rstb_1915_0007.txt,txt_rstb
fit the striking facts that the species,the,rstb_1915_0007.txt,txt_rstb
reflect upon the facts that have been,the,rstb_1915_0007.txt,txt_rstb
bearings of the facts that have been,the,rstb_1915_0007.txt,txt_rstb
support from the facts which have been,the,rstb_1915_0007.txt,txt_rstb
do so. The facts of distribution would,the,rstb_1915_0007.txt,txt_rstb
with the interesting facts which have been,the,rstb_1915_0007.txt,txt_rstb
bearing of the facts here brought up,the,rstb_1915_0007.txt,txt_rstb
bearing on the facts ascertained in this,the,rstb_1915_0009.txt,txt_rstb
involves both the facts just stated. We,the,rsta_1915_0009.txt,txt_rsta
