Context,Word,File,Directory
"vegetation, but no facts Sat discovered afford",but,rstl_1880_0014.txt,txt_rstl
but as the facts there given have,but,rstl_1880_0008.txt,txt_rstl
effect. But these facts afford no clue,but,rstl_1882_0002.txt,txt_rstl
; but the facts which I have,but,rstl_1882_0003.txt,txt_rstl
but while the facts in the life-history,but,rstl_1882_0003.txt,txt_rstl
"fig. 43), but facts exist to render",but,rstl_1883_0016.txt,txt_rstl
"do, but these facts 8nggest the further",but,rstl_1883_0011.txt,txt_rstl
"mined, But the facts demonstrated show that",but,rstl_1884_0020.txt,txt_rstl
lesion. But negative facts of great importance,but,rstl_1884_0020.txt,txt_rstl
have but few facts which serve to,but,rstl_1884_0005.txt,txt_rstl
of such curious facts as the skulls,the,rstl_1877_0015.txt,txt_rstl
furnished by the facts brought to light,the,rstl_1877_0005.txt,txt_rstl
to render the facts safe by laborious,the,rstl_1877_0005.txt,txt_rstl
record all the facts which my studies,the,rstl_1877_0007.txt,txt_rstl
consequences with the facts to which the,the,rstl_1877_0002.txt,txt_rstl
object to the facts on which these,the,rstl_1877_0002.txt,txt_rstl
agreement with the facts which we wish,the,rstl_1877_0002.txt,txt_rstl
the range of facts accessible to our,the,rstl_1877_0002.txt,txt_rstl
facts. Now the facts to which this,the,rstl_1877_0002.txt,txt_rstl
of oxygen. The facts here stated are,the,rstl_1877_0002.txt,txt_rstl
"us the following facts — SIR B,",the,rstl_1877_0002.txt,txt_rstl
Hence the principal facts to be gathered,the,rstl_1877_0018.txt,txt_rstl
from 8uch meagre facts as the above,the,rstl_1877_0018.txt,txt_rstl
g by the facts that the first,the,rstl_1877_0018.txt,txt_rstl
view are the facts that the first,the,rstl_1877_0018.txt,txt_rstl
also observed the facts mentioned in this,the,rstl_1877_0018.txt,txt_rstl
of the main facts which were detailed,the,rstl_1877_0018.txt,txt_rstl
"suppress, because the facts of which it",the,rstl_1877_0018.txt,txt_rstl
all the other facts which are detailed,the,rstl_1877_0018.txt,txt_rstl
"serics, all the facts and inferences which",the,rstl_1877_0018.txt,txt_rstl
the nectocalyx*. These facts clearly point to,the,rstl_1877_0018.txt,txt_rstl
doubt that the facts concerning Tiaropsis indicans,the,rstl_1877_0018.txt,txt_rstl
function as the facts imply should everywhere,the,rstl_1877_0018.txt,txt_rstl
"element, 2 the facts before us would",the,rstl_1877_0018.txt,txt_rstl
in mind the facts already adduced with,the,rstl_1877_0018.txt,txt_rstl
"account for the facts ; because, as",the,rstl_1877_0018.txt,txt_rstl
and of these facts the first that,the,rstl_1877_0018.txt,txt_rstl
lation. These complementary facts clearly prove the,the,rstl_1877_0018.txt,txt_rstl
of the analogous facts which we have,the,rstl_1877_0018.txt,txt_rstl
which the above facts supplied to my,the,rstl_1877_0018.txt,txt_rstl
to sea-water. These facts how the extreme,the,rstl_1877_0018.txt,txt_rstl
8een that the facts harmonize equally well,the,rstl_1877_0018.txt,txt_rstl
"And, conversely, the facts of inhibition are",the,rstl_1877_0018.txt,txt_rstl
to explain the facts ; for although,the,rstl_1877_0018.txt,txt_rstl
"the Crozets, | facts from which Mr.",the,rstl_1879_0003.txt,txt_rstl
From the above facts we ee that,the,rstl_1879_0069.txt,txt_rstl
"2,500 feet. The facts may seem somewhat",the,rstl_1879_0077.txt,txt_rstl
shore action. The facts admit however of,the,rstl_1879_0077.txt,txt_rstl
of the older facts on a firmer,the,rstl_1879_0062.txt,txt_rstl
think that the facts are decidedly in,the,rstl_1879_0062.txt,txt_rstl
antagonistic to known facts in the assumption,the,rstl_1879_0062.txt,txt_rstl
-8pectrum. The following facts seem to me,the,rstl_1879_0062.txt,txt_rstl
"If, therefore, astronomical facts should confirm the",the,rstl_1879_0073.txt,txt_rstl
by the experimental facts already stated. In,the,rstl_1879_0066.txt,txt_rstl
of these experimental facts leads to the,the,rstl_1879_0066.txt,txt_rstl
the most important facts favouring this conelu-,the,rstl_1879_0066.txt,txt_rstl
all the peculiar facts that have been,the,rstl_1879_0078.txt,txt_rstl
"also, the chief facts which remained to",the,rstl_1880_0024.txt,txt_rstl
"* the following facts were elicited, The",the,rstl_1880_0003.txt,txt_rstl
many of the facts regarding relative areas,the,rstl_1880_0003.txt,txt_rstl
briefly the chiefs facts of interest which,the,rstl_1880_0003.txt,txt_rstl
of the main facts which were detailed,the,rstl_1880_0007.txt,txt_rstl
subsection RE The facts of which it,the,rstl_1880_0007.txt,txt_rstl
all the other facts which are detailed,the,rstl_1880_0007.txt,txt_rstl
"geries, all the facts and inferences which",the,rstl_1880_0007.txt,txt_rstl
of the main facts regarding artificial rhythm,the,rstl_1880_0007.txt,txt_rstl
"then, all the facts as concisely as",the,rstl_1880_0007.txt,txt_rstl
to regard the facts of artificial rhythm,the,rstl_1880_0007.txt,txt_rstl
"Nevertheless, as the facts which the hypotbesis",the,rstl_1880_0007.txt,txt_rstl
"thus accepted, the facts which ib is",the,rstl_1880_0007.txt,txt_rstl
to meet the facts of a rhythm,the,rstl_1880_0007.txt,txt_rstl
number of other facts of the firs},the,rstl_1880_0007.txt,txt_rstl
to interpret the facts in the case,the,rstl_1880_0007.txt,txt_rstl
ciremmnstances. The only facts which still remain,the,rstl_1880_0007.txt,txt_rstl
detail all the facts I have been,the,rstl_1880_0007.txt,txt_rstl
category of physiological facts as the case,the,rstl_1880_0007.txt,txt_rstl
detailed all the facts which I have,the,rstl_1880_0007.txt,txt_rstl
attaching to these facts arises from the,the,rstl_1880_0007.txt,txt_rstl
principally on the facts which have been,the,rstl_1880_0007.txt,txt_rstl
"interpretation of the facts cannot, I think,",the,rstl_1880_0007.txt,txt_rstl
must incorporate the facts and inferences which,the,rstl_1880_0007.txt,txt_rstl
forasmuch as the facts on which my,the,rstl_1880_0007.txt,txt_rstl
"of course, the facts were normal ;",the,rstl_1880_0007.txt,txt_rstl
"my mind, the facts seem rather to",the,rstl_1880_0007.txt,txt_rstl
bearing on the facts of natural rhythm.,the,rstl_1880_0007.txt,txt_rstl
"And, as additional facts confirmatory of the",the,rstl_1880_0007.txt,txt_rstl
hand the ascertained facts appear rather to,the,rstl_1880_0004.txt,txt_rstl
overlooked the following facts given by us,the,rstl_1880_0008.txt,txt_rstl
work.” The above facts and remarks would,the,rstl_1880_0008.txt,txt_rstl
but as the facts there given have,the,rstl_1880_0008.txt,txt_rstl
add the following facts gathered from an,the,rstl_1880_0016.txt,txt_rstl
and the experimental facts upon which these,the,rstl_1880_0016.txt,txt_rstl
experity b mental facts which in the,the,rstl_1880_0016.txt,txt_rstl
both by the facts which they already,the,rstl_1880_0010.txt,txt_rstl
go beyond the facts more special to,the,rstl_1880_0010.txt,txt_rstl
later years. The facts relating to the,the,rstl_1880_0010.txt,txt_rstl
consideration of the facts enumerated can leave,the,rstl_1880_0010.txt,txt_rstl
seen that the facts guggest an interesting,the,rstl_1880_0010.txt,txt_rstl
consistent with the facts adduced in Table,the,rstl_1880_0010.txt,txt_rstl
accordance with these facts as to the,the,rstl_1880_0010.txt,txt_rstl
consistent with the facts which have been,the,rstl_1880_0010.txt,txt_rstl
to notice the facts bearing upon them.,the,rstl_1880_0010.txt,txt_rstl
serous glands the facts known are not,the,rstl_1881_0016.txt,txt_rstl
mention the main facts which show that,the,rstl_1881_0016.txt,txt_rstl
the cell-protoplasm. The facts we have at,the,rstl_1881_0016.txt,txt_rstl
STIMULATION. 1. GENERAL FACTS OF STIMULATION.—All the,the,rstl_1881_0019.txt,txt_rstl
nob affected. These facts prove that the,the,rstl_1881_0019.txt,txt_rstl
"indicated by the facts that, 1st, if",the,rstl_1881_0019.txt,txt_rstl
of the observed facts in the solar,the,rstl_1881_0009.txt,txt_rstl
remarkable series of facts indicating the Lycopodiaceous,the,rstl_1881_0003.txt,txt_rstl
"the Coal-measures, such facts as I have",the,rstl_1881_0003.txt,txt_rstl
confirm the alleged facts nor accept the,the,rstl_1881_0003.txt,txt_rstl
"millim. pressure. The facts can, however, be",the,rstl_1881_0007.txt,txt_rstl
at first. These facts indicate in the,the,rstl_1882_0023.txt,txt_rstl
the rough A facts in spite of,the,rstl_1882_0023.txt,txt_rstl
"Illustrate the same facts as Tracings 8-11,",the,rstl_1882_0023.txt,txt_rstl
the base. These facts show that direct,the,rstl_1882_0024.txt,txt_rstl
by the following facts — 1. The,the,rstl_1882_0024.txt,txt_rstl
pressure. Z The facts which have just,the,rstl_1882_0024.txt,txt_rstl
"nerve, when the facts only show in",the,rstl_1882_0024.txt,txt_rstl
to give the facts upon which the,the,rstl_1882_0024.txt,txt_rstl
not reconcile the facts observed. Calculation shows,the,rstl_1882_0012.txt,txt_rstl
; and the facts were further confirmed,the,rstl_1882_0026.txt,txt_rstl
and other 8upposed facts about it. The,the,rstl_1882_0026.txt,txt_rstl
"on two main facts : the first,",the,rstl_1882_0026.txt,txt_rstl
"contrary, all the facts point to its",the,rstl_1882_0026.txt,txt_rstl
"clearness, the new facts obtained from the",the,rstl_1882_0013.txt,txt_rstl
erect trees. The facts 80 far as,the,rstl_1882_0013.txt,txt_rstl
Snails. The additional facts obtained in relation,the,rstl_1882_0013.txt,txt_rstl
as few new facts occurred in the,the,rstl_1882_0013.txt,txt_rstl
area. The above facts may be confirmed,the,rstl_1882_0015.txt,txt_rstl
brain the following facts T have repeatedly,the,rstl_1882_0015.txt,txt_rstl
"region, the following facts may be readily",the,rstl_1882_0015.txt,txt_rstl
medulla. The above facts enable me to,the,rstl_1882_0015.txt,txt_rstl
of all the facts I have been,the,rstl_1882_0004.txt,txt_rstl
two sets of facts relating to the,the,rstl_1882_0002.txt,txt_rstl
"exemplified, The preceding facts may be summed",the,rstl_1882_0002.txt,txt_rstl
To observe these facts the current of,the,rstl_1882_0002.txt,txt_rstl
consistent with the facts observed to say,the,rstl_1882_0002.txt,txt_rstl
interpretation of the facts which would admit,the,rstl_1882_0008.txt,txt_rstl
holds that the facts aro in —,the,rstl_1882_0008.txt,txt_rstl
these now well-known facts to enable the,the,rstl_1882_0008.txt,txt_rstl
us know the facts of the case.,the,rstl_1882_0008.txt,txt_rstl
"the Teleostei, the facts just recorded with",the,rstl_1882_0008.txt,txt_rstl
and the only facts which I have,the,rstl_1882_0003.txt,txt_rstl
I think the facts justify the statement,the,rstl_1882_0003.txt,txt_rstl
; but the facts which I have,the,rstl_1882_0003.txt,txt_rstl
All the exsential facts and opinions may,the,rstl_1882_0003.txt,txt_rstl
"then, that the facts indicate that c",the,rstl_1882_0003.txt,txt_rstl
review of the facts which have been,the,rstl_1882_0003.txt,txt_rstl
"Prawn, and the facts regarding its metamorphosis",the,rstl_1882_0003.txt,txt_rstl
knowledge of the facts by Cavs in,the,rstl_1882_0003.txt,txt_rstl
but while the facts in the life-history,the,rstl_1882_0003.txt,txt_rstl
to express the facts of the metamorphosis,the,rstl_1882_0003.txt,txt_rstl
relation between the facts which have been,the,rstl_1882_0003.txt,txt_rstl
higher Decapods. The facts which have been,the,rstl_1882_0003.txt,txt_rstl
"find that the facts of embryology, if",the,rstl_1882_0003.txt,txt_rstl
account for the facts which are supposed,the,rstl_1882_0003.txt,txt_rstl
explanation of the facts E recorded lies,the,rstl_1882_0029.txt,txt_rstl
many of the facts we have to,the,rstl_1882_0029.txt,txt_rstl
bearing of these facts on the question,the,rstl_1882_0029.txt,txt_rstl
"and, in the facts adduced, we have",the,rstl_1882_0029.txt,txt_rstl
to appreciate the facts in reference to,the,rstl_1882_0029.txt,txt_rstl
record of the facts relating to the,the,rstl_1882_0029.txt,txt_rstl
"From the various facts adduced, it is",the,rstl_1882_0029.txt,txt_rstl
as do the facts in regard to,the,rstl_1882_0029.txt,txt_rstl
them. The main facts relating to the,the,rstl_1882_0029.txt,txt_rstl
explained the foregoing facts by the presence,the,rstl_1883_0027.txt,txt_rstl
"(25, 33). Chemical facts connected with the",the,rstl_1883_0027.txt,txt_rstl
36. Certain chemical facts concerning the behaviour,the,rstl_1883_0027.txt,txt_rstl
explanation of the facts ; that the,the,rstl_1883_0026.txt,txt_rstl
films. The observed facts were in accordance,the,rstl_1883_0020.txt,txt_rstl
"here described, the facts of their appearing",the,rstl_1883_0016.txt,txt_rstl
"Taking all the facts into account, the",the,rstl_1883_0016.txt,txt_rstl
"the two following facts : first, that",the,rstl_1883_0014.txt,txt_rstl
"vessels, The known facts of enlargement in",the,rstl_1883_0011.txt,txt_rstl
Do not the facts jus mentioned increase,the,rstl_1883_0011.txt,txt_rstl
"do, but these facts 8nggest the further",the,rstl_1883_0011.txt,txt_rstl
most of the facts we are looking,the,rstl_1883_0010.txt,txt_rstl
"review of the facts will be given,",the,rstl_1883_0024.txt,txt_rstl
to review the facts in comparison with,the,rstl_1883_0024.txt,txt_rstl
a number of facts which Sindicate the,the,rstl_1883_0024.txt,txt_rstl
"Lacaze-DuTaERs, with the facts presented by Alcyonarians.",the,rstl_1883_0024.txt,txt_rstl
"other Aleyonaria, The facts presented by the",the,rstl_1883_0024.txt,txt_rstl
of the following facts — 1. In,the,rstl_1883_0001.txt,txt_rstl
the known experimental facts in accordance with,the,rstl_1884_0016.txt,txt_rstl
express the experimental facts as far as,the,rstl_1884_0016.txt,txt_rstl
might bring interesting facts to light. The,the,rstl_1884_0021.txt,txt_rstl
account for the facts observed. I conclude,the,rstl_1884_0022.txt,txt_rstl
mixture increases. These facts account for the,the,rstl_1884_0022.txt,txt_rstl
oxygen. The same facts also account for,the,rstl_1884_0022.txt,txt_rstl
the surface. These facts permit the question,the,rstl_1884_0022.txt,txt_rstl
the explosion. The facts already discovered by,the,rstl_1884_0022.txt,txt_rstl
"other Eases, the facts related show that",the,rstl_1884_0020.txt,txt_rstl
the brain revealed facts of great importance,the,rstl_1884_0020.txt,txt_rstl
"mined, But the facts demonstrated show that",the,rstl_1884_0020.txt,txt_rstl
right. þ The facts of Experiment 23,the,rstl_1884_0020.txt,txt_rstl
be questionable. The facts of this experiment,the,rstl_1884_0020.txt,txt_rstl
38290. The following facts point to their,the,rstl_1884_0005.txt,txt_rstl
pole. The following facts have been established,the,rstl_1884_0005.txt,txt_rstl
of all the facts of the case.,the,rstl_1884_0003.txt,txt_rstl
of the above facts we can hardly,the,rstl_1885_0017.txt,txt_rstl
that the chief facts thus far acquired,the,rstl_1885_0012.txt,txt_rstl
of all the facts regarding «- 5,the,rstl_1885_0014.txt,txt_rstl
attention to the facts that whenever present,the,rstl_1885_0011.txt,txt_rstl
light the following facts among others —,the,rstl_1885_0011.txt,txt_rstl
"the patient. These facts are well known,",the,rstl_1885_0009.txt,txt_rstl
"account of the facts (1) that, with",the,rstl_1885_0010.txt,txt_rstl
determination by the Facts of embryology. In,the,rstl_1886_0018.txt,txt_rstl
view of the facts which experiment has,the,rstl_1886_0017.txt,txt_rstl
together the various facts which constitute all,the,rstl_1886_0017.txt,txt_rstl
demonstrated the following facts :— A vertical,the,rstl_1886_0012.txt,txt_rstl
"bearing on the facts here recorded, ]",the,rstl_1886_0012.txt,txt_rstl
"Briefly stated, the facts to be accounted",the,rstl_1886_0012.txt,txt_rstl
agreement with the facts deseribed in this,the,rstl_1886_0012.txt,txt_rstl
and if the facts described in this,the,rstl_1886_0007.txt,txt_rstl
of such curious facts as the skulls,the,rstl_1877_0015.txt,txt_rstl
furnished by the facts brought to light,the,rstl_1877_0005.txt,txt_rstl
to render the facts safe by laborious,the,rstl_1877_0005.txt,txt_rstl
record all the facts which my studies,the,rstl_1877_0007.txt,txt_rstl
consequences with the facts to which the,the,rstl_1877_0002.txt,txt_rstl
object to the facts on which these,the,rstl_1877_0002.txt,txt_rstl
agreement with the facts which we wish,the,rstl_1877_0002.txt,txt_rstl
the range of facts accessible to our,the,rstl_1877_0002.txt,txt_rstl
facts. Now the facts to which this,the,rstl_1877_0002.txt,txt_rstl
of oxygen. The facts here stated are,the,rstl_1877_0002.txt,txt_rstl
"us the following facts — SIR B,",the,rstl_1877_0002.txt,txt_rstl
Hence the principal facts to be gathered,the,rstl_1877_0018.txt,txt_rstl
from 8uch meagre facts as the above,the,rstl_1877_0018.txt,txt_rstl
g by the facts that the first,the,rstl_1877_0018.txt,txt_rstl
view are the facts that the first,the,rstl_1877_0018.txt,txt_rstl
also observed the facts mentioned in this,the,rstl_1877_0018.txt,txt_rstl
of the main facts which were detailed,the,rstl_1877_0018.txt,txt_rstl
"suppress, because the facts of which it",the,rstl_1877_0018.txt,txt_rstl
all the other facts which are detailed,the,rstl_1877_0018.txt,txt_rstl
"serics, all the facts and inferences which",the,rstl_1877_0018.txt,txt_rstl
the nectocalyx*. These facts clearly point to,the,rstl_1877_0018.txt,txt_rstl
doubt that the facts concerning Tiaropsis indicans,the,rstl_1877_0018.txt,txt_rstl
function as the facts imply should everywhere,the,rstl_1877_0018.txt,txt_rstl
"element, 2 the facts before us would",the,rstl_1877_0018.txt,txt_rstl
in mind the facts already adduced with,the,rstl_1877_0018.txt,txt_rstl
"account for the facts ; because, as",the,rstl_1877_0018.txt,txt_rstl
and of these facts the first that,the,rstl_1877_0018.txt,txt_rstl
lation. These complementary facts clearly prove the,the,rstl_1877_0018.txt,txt_rstl
of the analogous facts which we have,the,rstl_1877_0018.txt,txt_rstl
which the above facts supplied to my,the,rstl_1877_0018.txt,txt_rstl
to sea-water. These facts how the extreme,the,rstl_1877_0018.txt,txt_rstl
8een that the facts harmonize equally well,the,rstl_1877_0018.txt,txt_rstl
"And, conversely, the facts of inhibition are",the,rstl_1877_0018.txt,txt_rstl
to explain the facts ; for although,the,rstl_1877_0018.txt,txt_rstl
"the Crozets, | facts from which Mr.",the,rstl_1879_0003.txt,txt_rstl
From the above facts we ee that,the,rstl_1879_0069.txt,txt_rstl
"2,500 feet. The facts may seem somewhat",the,rstl_1879_0077.txt,txt_rstl
shore action. The facts admit however of,the,rstl_1879_0077.txt,txt_rstl
of the older facts on a firmer,the,rstl_1879_0062.txt,txt_rstl
think that the facts are decidedly in,the,rstl_1879_0062.txt,txt_rstl
antagonistic to known facts in the assumption,the,rstl_1879_0062.txt,txt_rstl
-8pectrum. The following facts seem to me,the,rstl_1879_0062.txt,txt_rstl
"If, therefore, astronomical facts should confirm the",the,rstl_1879_0073.txt,txt_rstl
by the experimental facts already stated. In,the,rstl_1879_0066.txt,txt_rstl
of these experimental facts leads to the,the,rstl_1879_0066.txt,txt_rstl
the most important facts favouring this conelu-,the,rstl_1879_0066.txt,txt_rstl
all the peculiar facts that have been,the,rstl_1879_0078.txt,txt_rstl
"also, the chief facts which remained to",the,rstl_1880_0024.txt,txt_rstl
"* the following facts were elicited, The",the,rstl_1880_0003.txt,txt_rstl
many of the facts regarding relative areas,the,rstl_1880_0003.txt,txt_rstl
briefly the chiefs facts of interest which,the,rstl_1880_0003.txt,txt_rstl
of the main facts which were detailed,the,rstl_1880_0007.txt,txt_rstl
subsection RE The facts of which it,the,rstl_1880_0007.txt,txt_rstl
all the other facts which are detailed,the,rstl_1880_0007.txt,txt_rstl
"geries, all the facts and inferences which",the,rstl_1880_0007.txt,txt_rstl
of the main facts regarding artificial rhythm,the,rstl_1880_0007.txt,txt_rstl
"then, all the facts as concisely as",the,rstl_1880_0007.txt,txt_rstl
to regard the facts of artificial rhythm,the,rstl_1880_0007.txt,txt_rstl
"Nevertheless, as the facts which the hypotbesis",the,rstl_1880_0007.txt,txt_rstl
"thus accepted, the facts which ib is",the,rstl_1880_0007.txt,txt_rstl
to meet the facts of a rhythm,the,rstl_1880_0007.txt,txt_rstl
number of other facts of the firs},the,rstl_1880_0007.txt,txt_rstl
to interpret the facts in the case,the,rstl_1880_0007.txt,txt_rstl
ciremmnstances. The only facts which still remain,the,rstl_1880_0007.txt,txt_rstl
detail all the facts I have been,the,rstl_1880_0007.txt,txt_rstl
category of physiological facts as the case,the,rstl_1880_0007.txt,txt_rstl
detailed all the facts which I have,the,rstl_1880_0007.txt,txt_rstl
attaching to these facts arises from the,the,rstl_1880_0007.txt,txt_rstl
principally on the facts which have been,the,rstl_1880_0007.txt,txt_rstl
"interpretation of the facts cannot, I think,",the,rstl_1880_0007.txt,txt_rstl
must incorporate the facts and inferences which,the,rstl_1880_0007.txt,txt_rstl
forasmuch as the facts on which my,the,rstl_1880_0007.txt,txt_rstl
"of course, the facts were normal ;",the,rstl_1880_0007.txt,txt_rstl
"my mind, the facts seem rather to",the,rstl_1880_0007.txt,txt_rstl
bearing on the facts of natural rhythm.,the,rstl_1880_0007.txt,txt_rstl
"And, as additional facts confirmatory of the",the,rstl_1880_0007.txt,txt_rstl
hand the ascertained facts appear rather to,the,rstl_1880_0004.txt,txt_rstl
overlooked the following facts given by us,the,rstl_1880_0008.txt,txt_rstl
work.” The above facts and remarks would,the,rstl_1880_0008.txt,txt_rstl
but as the facts there given have,the,rstl_1880_0008.txt,txt_rstl
add the following facts gathered from an,the,rstl_1880_0016.txt,txt_rstl
and the experimental facts upon which these,the,rstl_1880_0016.txt,txt_rstl
experity b mental facts which in the,the,rstl_1880_0016.txt,txt_rstl
both by the facts which they already,the,rstl_1880_0010.txt,txt_rstl
go beyond the facts more special to,the,rstl_1880_0010.txt,txt_rstl
later years. The facts relating to the,the,rstl_1880_0010.txt,txt_rstl
consideration of the facts enumerated can leave,the,rstl_1880_0010.txt,txt_rstl
seen that the facts guggest an interesting,the,rstl_1880_0010.txt,txt_rstl
consistent with the facts adduced in Table,the,rstl_1880_0010.txt,txt_rstl
accordance with these facts as to the,the,rstl_1880_0010.txt,txt_rstl
consistent with the facts which have been,the,rstl_1880_0010.txt,txt_rstl
to notice the facts bearing upon them.,the,rstl_1880_0010.txt,txt_rstl
serous glands the facts known are not,the,rstl_1881_0016.txt,txt_rstl
mention the main facts which show that,the,rstl_1881_0016.txt,txt_rstl
the cell-protoplasm. The facts we have at,the,rstl_1881_0016.txt,txt_rstl
STIMULATION. 1. GENERAL FACTS OF STIMULATION.—All the,the,rstl_1881_0019.txt,txt_rstl
nob affected. These facts prove that the,the,rstl_1881_0019.txt,txt_rstl
"indicated by the facts that, 1st, if",the,rstl_1881_0019.txt,txt_rstl
of the observed facts in the solar,the,rstl_1881_0009.txt,txt_rstl
remarkable series of facts indicating the Lycopodiaceous,the,rstl_1881_0003.txt,txt_rstl
"the Coal-measures, such facts as I have",the,rstl_1881_0003.txt,txt_rstl
confirm the alleged facts nor accept the,the,rstl_1881_0003.txt,txt_rstl
"millim. pressure. The facts can, however, be",the,rstl_1881_0007.txt,txt_rstl
at first. These facts indicate in the,the,rstl_1882_0023.txt,txt_rstl
the rough A facts in spite of,the,rstl_1882_0023.txt,txt_rstl
"Illustrate the same facts as Tracings 8-11,",the,rstl_1882_0023.txt,txt_rstl
the base. These facts show that direct,the,rstl_1882_0024.txt,txt_rstl
by the following facts — 1. The,the,rstl_1882_0024.txt,txt_rstl
pressure. Z The facts which have just,the,rstl_1882_0024.txt,txt_rstl
"nerve, when the facts only show in",the,rstl_1882_0024.txt,txt_rstl
to give the facts upon which the,the,rstl_1882_0024.txt,txt_rstl
not reconcile the facts observed. Calculation shows,the,rstl_1882_0012.txt,txt_rstl
; and the facts were further confirmed,the,rstl_1882_0026.txt,txt_rstl
and other 8upposed facts about it. The,the,rstl_1882_0026.txt,txt_rstl
"on two main facts : the first,",the,rstl_1882_0026.txt,txt_rstl
"contrary, all the facts point to its",the,rstl_1882_0026.txt,txt_rstl
"clearness, the new facts obtained from the",the,rstl_1882_0013.txt,txt_rstl
erect trees. The facts 80 far as,the,rstl_1882_0013.txt,txt_rstl
Snails. The additional facts obtained in relation,the,rstl_1882_0013.txt,txt_rstl
as few new facts occurred in the,the,rstl_1882_0013.txt,txt_rstl
area. The above facts may be confirmed,the,rstl_1882_0015.txt,txt_rstl
brain the following facts T have repeatedly,the,rstl_1882_0015.txt,txt_rstl
"region, the following facts may be readily",the,rstl_1882_0015.txt,txt_rstl
medulla. The above facts enable me to,the,rstl_1882_0015.txt,txt_rstl
of all the facts I have been,the,rstl_1882_0004.txt,txt_rstl
two sets of facts relating to the,the,rstl_1882_0002.txt,txt_rstl
"exemplified, The preceding facts may be summed",the,rstl_1882_0002.txt,txt_rstl
To observe these facts the current of,the,rstl_1882_0002.txt,txt_rstl
consistent with the facts observed to say,the,rstl_1882_0002.txt,txt_rstl
interpretation of the facts which would admit,the,rstl_1882_0008.txt,txt_rstl
holds that the facts aro in —,the,rstl_1882_0008.txt,txt_rstl
these now well-known facts to enable the,the,rstl_1882_0008.txt,txt_rstl
us know the facts of the case.,the,rstl_1882_0008.txt,txt_rstl
"the Teleostei, the facts just recorded with",the,rstl_1882_0008.txt,txt_rstl
and the only facts which I have,the,rstl_1882_0003.txt,txt_rstl
I think the facts justify the statement,the,rstl_1882_0003.txt,txt_rstl
; but the facts which I have,the,rstl_1882_0003.txt,txt_rstl
All the exsential facts and opinions may,the,rstl_1882_0003.txt,txt_rstl
"then, that the facts indicate that c",the,rstl_1882_0003.txt,txt_rstl
review of the facts which have been,the,rstl_1882_0003.txt,txt_rstl
"Prawn, and the facts regarding its metamorphosis",the,rstl_1882_0003.txt,txt_rstl
knowledge of the facts by Cavs in,the,rstl_1882_0003.txt,txt_rstl
