Context,Word,File,Directory
"now, the above facts be combined with",the,rsta_1915_0010.txt,txt_rsta
"hydroxylation theory, the facts comprised under (1)",the,rsta_1915_0010.txt,txt_rsta
of carbon. The facts observed with the,the,rsta_1915_0010.txt,txt_rsta
That the above facts do not really,the,rsta_1915_0010.txt,txt_rsta
"carbon. Indeed, the facts harmonise very well",the,rsta_1915_0010.txt,txt_rsta
"from the above facts :— (1) That,",the,rsta_1915_0011.txt,txt_rsta
"what the observed facts really are. Second,",the,rsta_1915_0004.txt,txt_rsta
may represent the facts it can have,the,rsta_1915_0004.txt,txt_rsta
Results. The general facts which have been,the,rsta_1915_0003.txt,txt_rsta
From the foregoing facts we may conclude,the,rstb_1916_0002.txt,txt_rstb
now to the facts which have led,the,rstb_1916_0004.txt,txt_rstb
the megasporophylls. These facts seem to further,the,rstb_1916_0003.txt,txt_rstb
they confirm the facts and theories already,the,rstb_1916_0010.txt,txt_rstb
the most important facts in the chain,the,rstb_1916_0010.txt,txt_rstb
from the following facts :— (a) Microscopical,the,rstb_1916_0011.txt,txt_rstb
by the following facts :-— 1. The,the,rstb_1916_0011.txt,txt_rstb
bearing of the facts above set forth,the,rstb_1916_0001.txt,txt_rstb
to regard the facts above set forth,the,rstb_1916_0001.txt,txt_rstb
of all the facts brought to light,the,rsta_1916_0001.txt,txt_rsta
will render these facts clear. The density,the,rsta_1916_0001.txt,txt_rsta
to represent the facts in these extreme,the,rsta_1916_0006.txt,txt_rsta
the result. The facts thus suggest the,the,rstb_1918_0006.txt,txt_rstb
explained by the facts observed in other,the,rstb_1918_0006.txt,txt_rstb
than 600. The facts just described throw,the,rstb_1918_0006.txt,txt_rstb
"untenable, and the facts further seem to",the,rstb_1918_0006.txt,txt_rstb
phenomena. The developmental facts presented later in,the,rstb_1918_0008.txt,txt_rstb
Englishman illustrates these facts graphically. The characteristic,the,rstb_1918_0010.txt,txt_rstb
drawn from these facts are of the,the,rstb_1918_0010.txt,txt_rstb
"of the anatomical facts here set forth,",the,rstb_1918_0010.txt,txt_rstb
most significant experimental facts bearing on the,the,rsta_1918_0009.txt,txt_rsta
results. The established facts which have an,the,rsta_1918_0009.txt,txt_rsta
express the experimental facts exceedingly well for,the,rsta_1918_0009.txt,txt_rsta
the list. These facts give some support,the,rsta_1918_0007.txt,txt_rsta
it the following facts become clear :—,the,rsta_1918_0006.txt,txt_rsta
the most remarkable facts brought to light,the,rsta_1918_0006.txt,txt_rsta
an illustration. The facts with regard to,the,rsta_1919_0006.txt,txt_rsta
account for the facts in a way,the,rsta_1919_0001.txt,txt_rsta
that the chief facts relating to each,the,rsta_1919_0001.txt,txt_rsta
the principal relevant facts regarding the daily,the,rsta_1919_0001.txt,txt_rsta
"which represents the facts moderately well, though",the,rsta_1919_0001.txt,txt_rsta
be equalised. The facts relating to the,the,rstb_1920_0003.txt,txt_rstb
against another. The facts seem to indicate,the,rstb_1920_0003.txt,txt_rstb
answered that the facts are confined to,the,rstb_1920_0004.txt,txt_rstb
"Cretaceous Cheilostomes, the facts are as follows.",the,rstb_1920_0004.txt,txt_rstb
out some further facts about the ribs,the,rstb_1920_0001.txt,txt_rstb
"which genus the facts are not known,",the,rstb_1920_0001.txt,txt_rstb
by the following facts :— 1. That,the,rstb_1920_0001.txt,txt_rstb
far as the facts are shown. Laceocephalus,the,rstb_1920_0001.txt,txt_rstb
"description of the facts in Amblystoma, has",the,rstb_1920_0001.txt,txt_rstb
probably more. The facts recorded above suggest,the,rstb_1920_0001.txt,txt_rstb
account for the facts observed. A provisional,the,rstb_1920_0002.txt,txt_rstb
accordance with the facts that are at,the,rstb_1920_0002.txt,txt_rstb
explain the observed facts of the phenomenon.,the,rstb_1920_0002.txt,txt_rstb
believed that the facts already known are,the,rstb_1920_0010.txt,txt_rstb
out the morphogenetic facts clearly. Whether this,the,rstb_1920_0010.txt,txt_rstb
accord with observed facts than the one,the,rstb_1920_0010.txt,txt_rstb
"ascertained from the facts of geological distribution,",the,rstb_1920_0010.txt,txt_rstb
the light of facts and morphogenetic tendencies,the,rstb_1920_0010.txt,txt_rstb
representation of the facts has led to,the,rsta_1920_0008.txt,txt_rsta
deduction from experimental facts which record the,the,rsta_1920_0008.txt,txt_rsta
of cleavage. “These facts are suggestive. The,the,rsta_1920_0008.txt,txt_rsta
of the new facts brought to light,the,rsta_1920_0010.txt,txt_rsta
of the new facts to guide a,the,rsta_1920_0010.txt,txt_rsta
obtained increases. These facts confirm the theory,the,rstb_1921_0005.txt,txt_rstb
"possible, from the facts for wood, to",the,rstb_1921_0002.txt,txt_rstb
to relate the facts of the mechanical,the,rstb_1921_0002.txt,txt_rstb
Potarisep Lica. The facts regarding the nature,the,rstb_1921_0002.txt,txt_rstb
the specimen. The facts for Ash and,the,rstb_1921_0002.txt,txt_rstb
"fig. 16), The facts for the tension",the,rstb_1921_0002.txt,txt_rstb
"some extent, the facts described above in",the,rstb_1921_0002.txt,txt_rstb
agreement with the facts derived from the,the,rstb_1921_0002.txt,txt_rstb
to explain the facts described above for,the,rstb_1921_0002.txt,txt_rstb
in relation to facts derived from the,the,rstb_1921_0002.txt,txt_rstb
of origin. Certain facts relevant to the,the,rstb_1921_0003.txt,txt_rstb
Mutations. The essential facts in the preceding,the,rstb_1921_0003.txt,txt_rstb
hypothesis fits the facts and explains them,the,rstb_1921_0003.txt,txt_rstb
stands. As the facts present themselves to,the,rstb_1921_0003.txt,txt_rstb
oxygen consumed. The facts seem to us,the,rstb_1921_0001.txt,txt_rstb
the light of facts which have since,the,rstb_1921_0007.txt,txt_rstb
"| However, the facts at our disposal",the,rstb_1921_0007.txt,txt_rstb
not accessible. The facts as here elucidated,the,rstb_1921_0008.txt,txt_rstb
and co-ordinating the facts in a scheme,the,rstb_1921_0008.txt,txt_rstb
illustration of the facts observed are treated,the,rstb_1921_0008.txt,txt_rstb
and the observed facts are compared with,the,rsta_1921_0011.txt,txt_rsta
below. The above facts indicate the lines,the,rsta_1921_0010.txt,txt_rsta
the reservoir. The facts recorded are derived,the,rstb_1912_0002.txt,txt_rstb
represents the experimental facts in an extremely,the,rstb_1912_0006.txt,txt_rstb
bearing of the facts upon the interpretation,the,rstb_1912_0007.txt,txt_rstb
by the following facts derived from a,the,rstb_1912_0007.txt,txt_rstb
"press, two important facts bearing on the",the,rstb_1912_0009.txt,txt_rstb
times. Whilst the facts as to the,the,rstb_1912_0009.txt,txt_rstb
conclusions from the facts ascertained in this,the,rstb_1912_0004.txt,txt_rstb
5.) The following facts appear from the,the,rsta_1912_0006.txt,txt_rsta
flowing stream. The facts brought to light,the,rsta_1912_0006.txt,txt_rsta
representation of the facts disclosed in the,the,rsta_1912_0006.txt,txt_rsta
does the following facts may be quoted.,the,rsta_1912_0006.txt,txt_rsta
represent the real facts at all adequately.,the,rsta_1912_0012.txt,txt_rsta
out by experimental facts (such as the,the,rsta_1912_0012.txt,txt_rsta
"inconsistent with the facts for most gases,",the,rsta_1912_0012.txt,txt_rsta
with the actual facts than the others.,the,rsta_1912_0012.txt,txt_rsta
learn the following facts within the region,the,rsta_1912_0002.txt,txt_rsta
learn the following facts :— 1. All,the,rsta_1912_0002.txt,txt_rsta
"number, and the facts have been sufficiently",the,rstb_1913_0002.txt,txt_rstb
view with the facts now before us.,the,rstb_1913_0001.txt,txt_rstb
contradicted by the facts enunciated in the,the,rstb_1913_0001.txt,txt_rstb
"consideration of the facts enumerated above, I",the,rstb_1913_0001.txt,txt_rstb
applied to the facts observed by us,the,rstb_1913_0006.txt,txt_rstb
to explain the facts observed on Pike’s,the,rstb_1913_0006.txt,txt_rstb
dealt with the facts underlying the increase,the,rstb_1913_0006.txt,txt_rstb
consideration of the facts in the two,the,rstb_1913_0006.txt,txt_rstb
afforded from the facts that the relationships,the,rsta_1913_0002.txt,txt_rsta
"of the actual facts may lead, as",the,rsta_1913_0008.txt,txt_rsta
of the actual facts will show that,the,rsta_1913_0008.txt,txt_rsta
whether the new facts throw any new,the,rstb_1914_0002.txt,txt_rstb
"of summer, which facts account for the",the,rstb_1914_0003.txt,txt_rstb
of the few facts at his command,the,rstb_1914_0007.txt,txt_rstb
watch for further facts on the subject,the,rstb_1914_0007.txt,txt_rstb
fairly by the facts produced in the,the,rstb_1914_0007.txt,txt_rstb
the reverse. The facts presented above make,the,rstb_1914_0001.txt,txt_rstb
revision of the facts of observation may,the,rstb_1914_0014.txt,txt_rstb
statement of the facts is necessary. Considering,the,rstb_1914_0014.txt,txt_rstb
statement of the facts of observation (ef.,the,rstb_1914_0014.txt,txt_rstb
"itself, however, the facts are sufficiently simple",the,rstb_1914_0014.txt,txt_rstb
but the main facts are still somewhat,the,rstb_1914_0014.txt,txt_rstb
weakened by the facts of development. It,the,rstb_1914_0014.txt,txt_rstb
"from (1) the facts of development (McNan,",the,rstb_1914_0014.txt,txt_rstb
development. On these facts the supposition was,the,rstb_1914_0014.txt,txt_rstb
expresses all the facts available. During the,the,rstb_1914_0014.txt,txt_rstb
latter ease. The facts then would be,the,rstb_1914_0011.txt,txt_rstb
of the true facts can be given.,the,rstb_1914_0004.txt,txt_rstb
we have the facts that the direction,the,rstb_1914_0019.txt,txt_rstb
by the following facts concerning the monoclonal,the,rstb_1914_0020.txt,txt_rstb
by the following facts :— (1) Ina,the,rstb_1914_0020.txt,txt_rstb
bearing of these facts on the .,the,rstb_1914_0018.txt,txt_rstb
different lumen. The facts concerning our Kalymma,the,rstb_1914_0018.txt,txt_rstb
court by the facts of distribution. On,the,rstb_1914_0008.txt,txt_rstb
have stated the facts above at some,the,rstb_1914_0008.txt,txt_rstb
ECHINOIDS. 329 The facts recorded in the,the,rstb_1914_0008.txt,txt_rstb
"excluded by the facts stated above, that",the,rstb_1914_0008.txt,txt_rstb
345-6). The main facts of its development,the,rstb_1914_0016.txt,txt_rstb
circumstances are the facts (1) that the,the,rstb_1914_0016.txt,txt_rstb
but the following facts should be noted,the,rstb_1914_0016.txt,txt_rstb
the series. These facts strengthen the evidence,the,rstb_1914_0016.txt,txt_rstb
"as regards the facts thus mentioned, this",the,rsta_1914_0020.txt,txt_rsta
"representation of the facts at low temperature,",the,rsta_1914_0021.txt,txt_rsta
"will express the facts with any accuracy,",the,rsta_1914_0016.txt,txt_rsta
of the experimental facts (described in Part,the,rsta_1914_0014.txt,txt_rsta
of the experimental facts obtained in Part,the,rsta_1914_0014.txt,txt_rsta
The principal known facts regarding the lunar,the,rsta_1914_0007.txt,txt_rsta
intensity. Although these facts are obvious the,the,rsta_1914_0008.txt,txt_rsta
land. The present facts seem to lead,the,rstb_1915_0001.txt,txt_rstb
far as the facts are concerned I,the,rstb_1915_0001.txt,txt_rstb
to express the facts (those of J.,the,rstb_1915_0002.txt,txt_rstb
account for the facts up to a,the,rstb_1915_0002.txt,txt_rstb
of the experimental facts presently to be,the,rstb_1915_0004.txt,txt_rstb
"botany. Incidentally, the facts about to be",the,rstb_1915_0007.txt,txt_rstb
know; but the facts are very striking.,the,rstb_1915_0007.txt,txt_rstb
fit the striking facts that the species,the,rstb_1915_0007.txt,txt_rstb
reflect upon the facts that have been,the,rstb_1915_0007.txt,txt_rstb
bearings of the facts that have been,the,rstb_1915_0007.txt,txt_rstb
support from the facts which have been,the,rstb_1915_0007.txt,txt_rstb
do so. The facts of distribution would,the,rstb_1915_0007.txt,txt_rstb
with the interesting facts which have been,the,rstb_1915_0007.txt,txt_rstb
bearing of the facts here brought up,the,rstb_1915_0007.txt,txt_rstb
bearing on the facts ascertained in this,the,rstb_1915_0009.txt,txt_rstb
involves both the facts just stated. We,the,rsta_1915_0009.txt,txt_rsta
"now, the above facts be combined with",the,rsta_1915_0010.txt,txt_rsta
"hydroxylation theory, the facts comprised under (1)",the,rsta_1915_0010.txt,txt_rsta
of carbon. The facts observed with the,the,rsta_1915_0010.txt,txt_rsta
That the above facts do not really,the,rsta_1915_0010.txt,txt_rsta
"carbon. Indeed, the facts harmonise very well",the,rsta_1915_0010.txt,txt_rsta
"from the above facts :— (1) That,",the,rsta_1915_0011.txt,txt_rsta
"what the observed facts really are. Second,",the,rsta_1915_0004.txt,txt_rsta
may represent the facts it can have,the,rsta_1915_0004.txt,txt_rsta
Results. The general facts which have been,the,rsta_1915_0003.txt,txt_rsta
From the foregoing facts we may conclude,the,rstb_1916_0002.txt,txt_rstb
now to the facts which have led,the,rstb_1916_0004.txt,txt_rstb
the megasporophylls. These facts seem to further,the,rstb_1916_0003.txt,txt_rstb
they confirm the facts and theories already,the,rstb_1916_0010.txt,txt_rstb
the most important facts in the chain,the,rstb_1916_0010.txt,txt_rstb
from the following facts :— (a) Microscopical,the,rstb_1916_0011.txt,txt_rstb
by the following facts :-— 1. The,the,rstb_1916_0011.txt,txt_rstb
bearing of the facts above set forth,the,rstb_1916_0001.txt,txt_rstb
to regard the facts above set forth,the,rstb_1916_0001.txt,txt_rstb
of all the facts brought to light,the,rsta_1916_0001.txt,txt_rsta
will render these facts clear. The density,the,rsta_1916_0001.txt,txt_rsta
to represent the facts in these extreme,the,rsta_1916_0006.txt,txt_rsta
the result. The facts thus suggest the,the,rstb_1918_0006.txt,txt_rstb
explained by the facts observed in other,the,rstb_1918_0006.txt,txt_rstb
than 600. The facts just described throw,the,rstb_1918_0006.txt,txt_rstb
"untenable, and the facts further seem to",the,rstb_1918_0006.txt,txt_rstb
phenomena. The developmental facts presented later in,the,rstb_1918_0008.txt,txt_rstb
Englishman illustrates these facts graphically. The characteristic,the,rstb_1918_0010.txt,txt_rstb
drawn from these facts are of the,the,rstb_1918_0010.txt,txt_rstb
"of the anatomical facts here set forth,",the,rstb_1918_0010.txt,txt_rstb
most significant experimental facts bearing on the,the,rsta_1918_0009.txt,txt_rsta
results. The established facts which have an,the,rsta_1918_0009.txt,txt_rsta
express the experimental facts exceedingly well for,the,rsta_1918_0009.txt,txt_rsta
the list. These facts give some support,the,rsta_1918_0007.txt,txt_rsta
it the following facts become clear :—,the,rsta_1918_0006.txt,txt_rsta
the most remarkable facts brought to light,the,rsta_1918_0006.txt,txt_rsta
an illustration. The facts with regard to,the,rsta_1919_0006.txt,txt_rsta
account for the facts in a way,the,rsta_1919_0001.txt,txt_rsta
that the chief facts relating to each,the,rsta_1919_0001.txt,txt_rsta
the principal relevant facts regarding the daily,the,rsta_1919_0001.txt,txt_rsta
"which represents the facts moderately well, though",the,rsta_1919_0001.txt,txt_rsta
be equalised. The facts relating to the,the,rstb_1920_0003.txt,txt_rstb
against another. The facts seem to indicate,the,rstb_1920_0003.txt,txt_rstb
answered that the facts are confined to,the,rstb_1920_0004.txt,txt_rstb
"Cretaceous Cheilostomes, the facts are as follows.",the,rstb_1920_0004.txt,txt_rstb
out some further facts about the ribs,the,rstb_1920_0001.txt,txt_rstb
"which genus the facts are not known,",the,rstb_1920_0001.txt,txt_rstb
by the following facts :— 1. That,the,rstb_1920_0001.txt,txt_rstb
far as the facts are shown. Laceocephalus,the,rstb_1920_0001.txt,txt_rstb
"description of the facts in Amblystoma, has",the,rstb_1920_0001.txt,txt_rstb
probably more. The facts recorded above suggest,the,rstb_1920_0001.txt,txt_rstb
account for the facts observed. A provisional,the,rstb_1920_0002.txt,txt_rstb
accordance with the facts that are at,the,rstb_1920_0002.txt,txt_rstb
explain the observed facts of the phenomenon.,the,rstb_1920_0002.txt,txt_rstb
believed that the facts already known are,the,rstb_1920_0010.txt,txt_rstb
out the morphogenetic facts clearly. Whether this,the,rstb_1920_0010.txt,txt_rstb
accord with observed facts than the one,the,rstb_1920_0010.txt,txt_rstb
"ascertained from the facts of geological distribution,",the,rstb_1920_0010.txt,txt_rstb
the light of facts and morphogenetic tendencies,the,rstb_1920_0010.txt,txt_rstb
representation of the facts has led to,the,rsta_1920_0008.txt,txt_rsta
deduction from experimental facts which record the,the,rsta_1920_0008.txt,txt_rsta
of cleavage. “These facts are suggestive. The,the,rsta_1920_0008.txt,txt_rsta
of the new facts brought to light,the,rsta_1920_0010.txt,txt_rsta
of the new facts to guide a,the,rsta_1920_0010.txt,txt_rsta
obtained increases. These facts confirm the theory,the,rstb_1921_0005.txt,txt_rstb
"possible, from the facts for wood, to",the,rstb_1921_0002.txt,txt_rstb
to relate the facts of the mechanical,the,rstb_1921_0002.txt,txt_rstb
Potarisep Lica. The facts regarding the nature,the,rstb_1921_0002.txt,txt_rstb
the specimen. The facts for Ash and,the,rstb_1921_0002.txt,txt_rstb
"fig. 16), The facts for the tension",the,rstb_1921_0002.txt,txt_rstb
"some extent, the facts described above in",the,rstb_1921_0002.txt,txt_rstb
agreement with the facts derived from the,the,rstb_1921_0002.txt,txt_rstb
to explain the facts described above for,the,rstb_1921_0002.txt,txt_rstb
in relation to facts derived from the,the,rstb_1921_0002.txt,txt_rstb
of origin. Certain facts relevant to the,the,rstb_1921_0003.txt,txt_rstb
Mutations. The essential facts in the preceding,the,rstb_1921_0003.txt,txt_rstb
hypothesis fits the facts and explains them,the,rstb_1921_0003.txt,txt_rstb
stands. As the facts present themselves to,the,rstb_1921_0003.txt,txt_rstb
oxygen consumed. The facts seem to us,the,rstb_1921_0001.txt,txt_rstb
the light of facts which have since,the,rstb_1921_0007.txt,txt_rstb
"| However, the facts at our disposal",the,rstb_1921_0007.txt,txt_rstb
not accessible. The facts as here elucidated,the,rstb_1921_0008.txt,txt_rstb
and co-ordinating the facts in a scheme,the,rstb_1921_0008.txt,txt_rstb
illustration of the facts observed are treated,the,rstb_1921_0008.txt,txt_rstb
and the observed facts are compared with,the,rsta_1921_0011.txt,txt_rsta
below. The above facts indicate the lines,the,rsta_1921_0010.txt,txt_rsta
represent the real facts at all adequately.,at,rsta_1912_0012.txt,txt_rsta
a number of facts emerge at once.,at,rsta_1913_0002.txt,txt_rsta
of the few facts at his command,at,rstb_1914_0007.txt,txt_rstb
have stated the facts above at some,at,rstb_1914_0008.txt,txt_rstb
"representation of the facts at low temperature,",at,rsta_1914_0021.txt,txt_rsta
"preference to hydrogen,t facts which are at",at,rsta_1915_0010.txt,txt_rsta
this treatment ; facts which at once,at,rsta_1916_0008.txt,txt_rsta
accordance with the facts that are at,at,rstb_1920_0002.txt,txt_rstb
"| However, the facts at our disposal",at,rstb_1921_0007.txt,txt_rstb
by the following facts derived from a,by,rstb_1912_0007.txt,txt_rstb
out by experimental facts (such as the,by,rsta_1912_0012.txt,txt_rsta
contradicted by the facts enunciated in the,by,rstb_1913_0001.txt,txt_rstb
applied to the facts observed by us,by,rstb_1913_0006.txt,txt_rstb
fairly by the facts produced in the,by,rstb_1914_0007.txt,txt_rstb
weakened by the facts of development. It,by,rstb_1914_0014.txt,txt_rstb
to explain these facts by reference to,by,rstb_1914_0009.txt,txt_rstb
by the following facts concerning the monoclonal,by,rstb_1914_0020.txt,txt_rstb
by the following facts :— (1) Ina,by,rstb_1914_0020.txt,txt_rstb
court by the facts of distribution. On,by,rstb_1914_0008.txt,txt_rstb
indicated by various facts which are fully,by,rstb_1914_0008.txt,txt_rstb
"excluded by the facts stated above, that",by,rstb_1914_0008.txt,txt_rstb
by the following facts :-— 1. The,by,rstb_1916_0011.txt,txt_rstb
explained by the facts observed in other,by,rstb_1918_0006.txt,txt_rstb
by the following facts :— 1. That,by,rstb_1920_0001.txt,txt_rstb
view of these facts it does not,it,rstb_1913_0006.txt,txt_rstb
"case. With these facts before us, it",it,rsta_1913_0008.txt,txt_rsta
weakened by the facts of development. It,it,rstb_1914_0014.txt,txt_rstb
may represent the facts it can have,it,rsta_1915_0004.txt,txt_rsta
five. Taking these facts together it seems,it,rstb_1916_0004.txt,txt_rstb
it the following facts become clear :—,it,rsta_1918_0006.txt,txt_rsta
"inconsistent with the facts for most gases,",for,rsta_1912_0012.txt,txt_rsta
"of summer, which facts account for the",for,rstb_1914_0003.txt,txt_rstb
watch for further facts on the subject,for,rstb_1914_0007.txt,txt_rstb
account for the facts up to a,for,rstb_1915_0002.txt,txt_rstb
express the experimental facts exceedingly well for,for,rsta_1918_0009.txt,txt_rsta
account for the facts in a way,for,rsta_1919_0001.txt,txt_rsta
account for the facts observed. A provisional,for,rstb_1920_0002.txt,txt_rstb
"possible, from the facts for wood, to",for,rstb_1921_0002.txt,txt_rstb
the specimen. The facts for Ash and,for,rstb_1921_0002.txt,txt_rstb
"fig. 16), The facts for the tension",for,rstb_1921_0002.txt,txt_rstb
to explain the facts described above for,for,rstb_1921_0002.txt,txt_rstb
"inconsistent with the facts for most gases,",for,rsta_1912_0012.txt,txt_rsta
"of summer, which facts account for the",for,rstb_1914_0003.txt,txt_rstb
watch for further facts on the subject,for,rstb_1914_0007.txt,txt_rstb
account for the facts up to a,for,rstb_1915_0002.txt,txt_rstb
express the experimental facts exceedingly well for,for,rsta_1918_0009.txt,txt_rsta
account for the facts in a way,for,rsta_1919_0001.txt,txt_rsta
account for the facts observed. A provisional,for,rstb_1920_0002.txt,txt_rstb
"possible, from the facts for wood, to",for,rstb_1921_0002.txt,txt_rstb
the specimen. The facts for Ash and,for,rstb_1921_0002.txt,txt_rstb
"fig. 16), The facts for the tension",for,rstb_1921_0002.txt,txt_rstb
to explain the facts described above for,for,rstb_1921_0002.txt,txt_rstb
times. Whilst the facts as to the,to,rstb_1912_0009.txt,txt_rstb
years these physiological facts have come to,to,rstb_1912_0004.txt,txt_rstb
flowing stream. The facts brought to light,to,rsta_1912_0006.txt,txt_rsta
applied to the facts observed by us,to,rstb_1913_0006.txt,txt_rstb
to explain the facts observed on Pike’s,to,rstb_1913_0006.txt,txt_rstb
way of definite facts on which to,to,rstb_1914_0007.txt,txt_rstb
to force all facts into a R,to,rstb_1914_0014.txt,txt_rstb
to explain these facts by reference to,to,rstb_1914_0009.txt,txt_rstb
are four important facts to be borne,to,rstb_1914_0009.txt,txt_rstb
a number of facts seem to point,to,rstb_1914_0008.txt,txt_rstb
nervous system. Parallel facts are to be,to,rstb_1914_0016.txt,txt_rstb
land. The present facts seem to lead,to,rstb_1915_0001.txt,txt_rstb
to express the facts (those of J.,to,rstb_1915_0002.txt,txt_rstb
account for the facts up to a,to,rstb_1915_0002.txt,txt_rstb
of the experimental facts presently to be,to,rstb_1915_0004.txt,txt_rstb
"botany. Incidentally, the facts about to be",to,rstb_1915_0007.txt,txt_rstb
"3, All these facts go together to",to,rstb_1915_0007.txt,txt_rstb
"preference to hydrogen,t facts which are at",to,rsta_1915_0010.txt,txt_rsta
highest pressures. Such facts point to a,to,rsta_1915_0010.txt,txt_rsta
deduction from experimental facts to obtain a,to,rsta_1915_0003.txt,txt_rsta
now to the facts which have led,to,rstb_1916_0004.txt,txt_rstb
the megasporophylls. These facts seem to further,to,rstb_1916_0003.txt,txt_rstb
its disappearance. These facts seem to me,to,rstb_1916_0007.txt,txt_rstb
taken with other facts to support their,to,rstb_1916_0007.txt,txt_rstb
a 25. Many facts combine to show,to,rstb_1916_0007.txt,txt_rstb
to regard the facts above set forth,to,rstb_1916_0001.txt,txt_rstb
to actual physical facts arising from experimental,to,rsta_1916_0009.txt,txt_rsta
of all the facts brought to light,to,rsta_1916_0001.txt,txt_rsta
to represent the facts in these extreme,to,rsta_1916_0006.txt,txt_rsta
"untenable, and the facts further seem to",to,rstb_1918_0006.txt,txt_rstb
the most remarkable facts brought to light,to,rsta_1918_0006.txt,txt_rsta
an illustration. The facts with regard to,to,rsta_1919_0006.txt,txt_rsta
that the chief facts relating to each,to,rsta_1919_0001.txt,txt_rsta
be equalised. The facts relating to the,to,rstb_1920_0003.txt,txt_rstb
against another. The facts seem to indicate,to,rstb_1920_0003.txt,txt_rstb
answered that the facts are confined to,to,rstb_1920_0004.txt,txt_rstb
to present our facts in an intelligible,to,rstb_1920_0004.txt,txt_rstb
"to make our facts more intelligible. Now,",to,rstb_1920_0004.txt,txt_rstb
to add some facts to those previously,to,rstb_1920_0001.txt,txt_rstb
nutrition they receive—the facts are indeed to,to,rstb_1920_0002.txt,txt_rstb
representation of the facts has led to,to,rsta_1920_0008.txt,txt_rsta
of the new facts brought to light,to,rsta_1920_0010.txt,txt_rsta
of the new facts to guide a,to,rsta_1920_0010.txt,txt_rsta
"possible, from the facts for wood, to",to,rstb_1921_0002.txt,txt_rstb
to relate the facts of the mechanical,to,rstb_1921_0002.txt,txt_rstb
to explain the facts described above for,to,rstb_1921_0002.txt,txt_rstb
in relation to facts derived from the,to,rstb_1921_0002.txt,txt_rstb
of origin. Certain facts relevant to the,to,rstb_1921_0003.txt,txt_rstb
stands. As the facts present themselves to,to,rstb_1921_0003.txt,txt_rstb
oxygen consumed. The facts seem to us,to,rstb_1921_0001.txt,txt_rstb
publication appeared few facts were added to,to,rstb_1921_0009.txt,txt_rstb
"press, two important facts bearing on the",on,rstb_1912_0009.txt,txt_rstb
