Context,Collocate,File,Directory,Year,Frequency Filter
Itis quite/possible that when the facts shall-have|been/more precisely/Jetermined; it may prove'that-neither,the,rstl_1853_0019.txt,txt_rstl,1853,18
the grey substance. From these facts he calcu- lates that the,the,rstl_1853_0013.txt,txt_rstl,1853,18
signification of several of the facts with which we have thus,the,rstl_1853_0015.txt,txt_rstl,1853,18
"bodies, corresponding with the fixed facts of the Tubulariade, is also",the,rstl_1853_0015.txt,txt_rstl,1853,18
now compare the fixed ovigerous facts of the marine genera. Tt,the,rstl_1853_0015.txt,txt_rstl,1853,18
"In the marine Tubulariadae, the facts in question consist; of a",the,rstl_1853_0015.txt,txt_rstl,1853,18
one'of the most'striking of the facts which he has 86 skilfully,the,rstl_1853_0015.txt,txt_rstl,1853,18
"bodies produced in the fixed facts only as © bulbille,” by",the,rstl_1853_0015.txt,txt_rstl,1853,18
bodies contained in the fixed facts are undoubtedly not gemm@ but,the,rstl_1853_0015.txt,txt_rstl,1853,18
The conelusion to which the facts s0nght to be demonstrated in,the,rstl_1853_0015.txt,txt_rstl,1853,18
"Campanularia, than with the ovigerous facts of the Tubu- V lariade.",the,rstl_1853_0015.txt,txt_rstl,1853,18
"from, that of the ovigerous facts of Coryne, 1. c. 382",the,rstl_1853_0015.txt,txt_rstl,1853,18
"of the embryo; the enclosing facts have become ruptured, and the",the,rstl_1853_0015.txt,txt_rstl,1853,18
of a periodical character: the facts appear to be important materials,the,rstl_1853_0006.txt,txt_rstl,1853,18
"the plate, we learn many facts regarding the temperature at Toronto,",the,rstl_1853_0005.txt,txt_rstl,1853,18
"con- Sideration of the foregoing facts will, we think, lead to",the,rstl_1853_0004.txt,txt_rstl,1853,18
"A consideration of the foregoing facts will, we think, lead to",the,rstl_1853_0004.txt,txt_rstl,1853,18
a due regard to the facts presented by the development of,the,rstl_1853_0002.txt,txt_rstl,1853,18
it. The parietes of these facts are glandular. A long ©,the,rstl_1853_0002.txt,txt_rstl,1853,18
to bring into prominence some facts in the anatomy of the,the,rstl_1853_0002.txt,txt_rstl,1853,18
667). Again :—* From the facts which have just been stated,the,rstl_1853_0002.txt,txt_rstl,1853,18
supracesophageal position of the auditory facts in Nudibranchiatata merely arises from,the,rstl_1853_0002.txt,txt_rstl,1853,18
"is one of the earliest facts in molluscons development, and it",the,rstl_1853_0002.txt,txt_rstl,1853,18
circulation in the Mollusca. The facts I MR. T. H. HUXLEY,the,rstl_1853_0002.txt,txt_rstl,1853,18
according to the species. These facts are well shown both in,the,rstl_1853_0010.txt,txt_rstl,1853,18
of maturity in both. These facts seem to lead to the,the,rstl_1853_0010.txt,txt_rstl,1853,18
fair then toinfer from these facts that the completion of the,the,rstl_1853_0010.txt,txt_rstl,1853,18
embryo was produced. S These facts then support the statement already,the,rstl_1853_0010.txt,txt_rstl,1853,18
"well be supposed that the facts just mentioned were exceedingly puzzling,",the,rstl_1853_0010.txt,txt_rstl,1853,18
Invertebrata. A comparison of the facts in the two divisions of,the,rstl_1853_0010.txt,txt_rstl,1853,18
agent in all animals. The facts already mentioned coincide with this,the,rstl_1853_0010.txt,txt_rstl,1853,18
to be drawn from the facts of natural impregnation in the,the,rstl_1853_0010.txt,txt_rstl,1853,18
force in the spermatozoon. The facts now 8tated of penetration by,the,rstl_1853_0010.txt,txt_rstl,1853,18
"fecundation, we have, in the facts now referred to, much reason",the,rstl_1853_0010.txt,txt_rstl,1853,18
"tions, together with the chief facts connected with the occurrence of",the,rstl_1854_0014.txt,txt_rstl,1854,18
organs of respiration. From the facts which I have already succeeded,the,rstl_1854_0014.txt,txt_rstl,1854,18
"also cases of phthisis. These facts possess the greatest interest, and",the,rstl_1854_0014.txt,txt_rstl,1854,18
then the whole of the facts and observations recorded in this,the,rstl_1854_0014.txt,txt_rstl,1854,18
accurate conclusion that the observed facts may justify. For all practical,the,rstl_1854_0013.txt,txt_rstl,1854,18
all of which the same facts could be noted. The segmentation,the,rstl_1854_0009.txt,txt_rstl,1854,18
"fecundating fluid. . From the facts stated above, and before detailed",the,rstl_1854_0009.txt,txt_rstl,1854,18
"these were confirmatory of the facts before stated, as the variation",the,rstl_1854_0009.txt,txt_rstl,1854,18
the same metal. The same facts deprive the latter part of,the,rstl_1854_0001.txt,txt_rstl,1854,18
to occasion osmose. The newer facts to be related also increase,the,rstl_1854_0008.txt,txt_rstl,1854,18
similar degree of diffusibility*. The facts appear to afford a strong,the,rstl_1854_0008.txt,txt_rstl,1854,18
tried in the search for facts which might throw light on,the,rstl_1854_0008.txt,txt_rstl,1854,18
"its explanation, with many other facts of the subject, till fuller",the,rstl_1854_0008.txt,txt_rstl,1854,18
"the Nautilus, that the auditory facts of the ex- tinct Tetrabranchiata",the,rstl_1855_0012.txt,txt_rstl,1855,18
spoken of its length. These facts will explain the results of,the,rstl_1855_0010.txt,txt_rstl,1855,18
"to complete, and as the facts elicited in reference to cast",the,rstl_1855_0009.txt,txt_rstl,1855,18
1855. Ir is among the facts in chemical science which admit,the,rstl_1855_0008.txt,txt_rstl,1855,18
which appears to represent the facts with a con- siderable degree,the,rstl_1855_0002.txt,txt_rstl,1855,18
law here deduced represents the facts of the case. The value,the,rstl_1855_0002.txt,txt_rstl,1855,18
does not sufficiently express the facts to say that the bar,the,rstl_1855_0001.txt,txt_rstl,1855,18
the same agent. Supposing these facts to have been known to,the,rstl_1855_0001.txt,txt_rstl,1855,18
the manner in which these facts have been explained. © La,the,rstl_1855_0001.txt,txt_rstl,1855,18
a more grave one. The facts are as follows :— the,the,rstl_1855_0001.txt,txt_rstl,1855,18
from pole to pole. The facts observed by M. MaTTEvcer seem,the,rstl_1855_0001.txt,txt_rstl,1855,18
"M. MarTevecr, and converted the facts upon which the objection is",the,rstl_1855_0001.txt,txt_rstl,1855,18
critical review of all the facts of the case which at,the,rstl_1855_0017.txt,txt_rstl,1855,18
"proved, by the comparison of facts then to be addaced from",the,rstl_1856_0027.txt,txt_rstl,1856,18
"now, we review the principal facts relating to the structure of",the,rstl_1856_0027.txt,txt_rstl,1856,18
"growth; on which inquiry, the facts which I have now brought",the,rstl_1856_0027.txt,txt_rstl,1856,18
based on an order of facts relating to the economy of,the,rstl_1856_0027.txt,txt_rstl,1856,18
by critical examinations of the facts already accumulated. These menoirs I,the,rstl_1856_0020.txt,txt_rstl,1856,18
LIONEL BEALE ON THE These facts appear to me to militate,the,rstl_1856_0017.txt,txt_rstl,1856,18
"any other explanation of the facts I have observed, or of",the,rstl_1856_0017.txt,txt_rstl,1856,18
"which presumption was corroborated by facts adduced in the £ame communication,",the,rstl_1856_0016.txt,txt_rstl,1856,18
conclusively established by the following facts :—In all the spirit-specimens which,the,rstl_1856_0012.txt,txt_rstl,1856,18
"are in harmony with the facts of observation. All the Orbitolites,",the,rstl_1856_0012.txt,txt_rstl,1856,18
"kind, may be cited the facts mentioned by Dr. J. D.",the,rstl_1856_0012.txt,txt_rstl,1856,18
inch to crush them. These facts show the great superiority of,the,rstl_1857_0039.txt,txt_rstl,1857,18
"No. 19), regarding the principal facts detailed in the present memoir,",the,rstl_1857_0028.txt,txt_rstl,1857,18
stroma ; but if the facts T have stated be not,the,rstl_1857_0027.txt,txt_rstl,1857,18
prevented further publication of the facts at that time; but I,the,rstl_1857_0017.txt,txt_rstl,1857,18
a parallel to the curious facts thus established we must look,the,rstl_1857_0015.txt,txt_rstl,1857,18
"writes, © a multitude of facts which scem to necessitate the",the,rstl_1857_0016.txt,txt_rstl,1857,18
an imperfect acquaintance with the facts must necessarily render to some,the,rstl_1857_0016.txt,txt_rstl,1857,18
rigorous demonstration of the principal facts and laws of muscular electri-,the,rstl_1857_0010.txt,txt_rstl,1857,18
clear explanation of several important facts of muscular electricity. The first,the,rstl_1857_0010.txt,txt_rstl,1857,18
"electricity. The first of these facts is, that a differential current",the,rstl_1857_0010.txt,txt_rstl,1857,18
they are con- tained in facts formed by the condensation of,the,rstl_1857_0009.txt,txt_rstl,1857,18
"of the heart, these adventitious facts are strong and well-defined, whilst",the,rstl_1857_0009.txt,txt_rstl,1857,18
"Z5th in breadth. The next facts requiring especial notice, are those",the,rstl_1857_0009.txt,txt_rstl,1857,18
"this respect. 2 From the facts that have just been mentioned,",the,rstl_1857_0009.txt,txt_rstl,1857,18
"inference I deduce from these facts is, first, that the animals",the,rstl_1857_0009.txt,txt_rstl,1857,18
"process in different cases, the facts observed by LEUCKART are in",the,rstl_1857_0009.txt,txt_rstl,1857,18
"from a Tenia-embryo. Finally, the facts made known in this communication",the,rstl_1857_0009.txt,txt_rstl,1857,18
close coincidence between all the facts of light and the physical,the,rstl_1857_0011.txt,txt_rstl,1857,18
supposition leaves many of the facts either imperfectly explained or untouched.,the,rstl_1857_0011.txt,txt_rstl,1857,18
undecided for the present. The facts to be hereafter mentioned as,the,rstl_1857_0007.txt,txt_rstl,1857,18
"eggs require impregnation, and the facts bearing on this $ub- Ject",the,rstl_1857_0007.txt,txt_rstl,1857,18
appears strictly comparable to the facts which have been obseryed in,the,rstl_1857_0007.txt,txt_rstl,1857,18
"ing Tables, to consider the facts they present, and their results.",the,rstl_1857_0004.txt,txt_rstl,1857,18
faces in the quadrant (111...211). Facts presented by these Tables —The,the,rstl_1857_0004.txt,txt_rstl,1857,18
; The anterior and posterior facts alternate in their contraction and,in,rstl_1848_0007.txt,txt_rstl,1848,18
":—the collec- tion of the facts then known, given in the",in,rstl_1848_0001.txt,txt_rstl,1848,18
"spermatozoa are developed in pyriform facts opening externally, and that the",in,rstl_1849_0022.txt,txt_rstl,1849,18
"45. The contents of the facts are spermatozoa, and cells in",in,rstl_1849_0022.txt,txt_rstl,1849,18
the spermatozoa deve- Joped in facts connected with the inner ©,in,rstl_1849_0022.txt,txt_rstl,1849,18
conelusions are deducible from the facts stated in the pre- ceding,in,rstl_1849_0022.txt,txt_rstl,1849,18
"original corium ||.” Summary —The facts described in this communication will,",in,rstl_1849_0015.txt,txt_rstl,1849,18
which the accuracy of the facts stated in this paper are,in,rstl_1850_0027.txt,txt_rstl,1850,18
of conducting electricity. All the facts which have been adduced in,in,rstl_1850_0037.txt,txt_rstl,1850,18
adducing in support of it facts which are s0 well known,in,rstl_1850_0037.txt,txt_rstl,1850,18
scarcely neces- sary to accumulate facts in support of a position,in,rstl_1850_0037.txt,txt_rstl,1850,18
"my *Odontography* ©, that the facts detailed in How's paper were",in,rstl_1850_0025.txt,txt_rstl,1850,18
"express, in a few lines, facts in Comparative Anatomy which would",in,rstl_1850_0025.txt,txt_rstl,1850,18
terpretation of some of the facts described in the Memoir on,in,rstl_1850_0019.txt,txt_rstl,1850,18
in the text. + The facts dexcribed in the text are,in,rstl_1850_0019.txt,txt_rstl,1850,18
condition. There are even well-known facts of great importance in this,in,rstl_1850_0038.txt,txt_rstl,1850,18
"wooden standards, * Several important facts and improvements in the construction",in,rstl_1850_0036.txt,txt_rstl,1850,18
"strength, and exhibits several important facts in connection with the construction",in,rstl_1850_0036.txt,txt_rstl,1850,18
a striking coincidence in the facts tending to establish the principle,in,rstl_1850_0036.txt,txt_rstl,1850,18
"which will be found the facts more in detail, and which",in,rstl_1850_0036.txt,txt_rstl,1850,18
is not perfectly hardened. The facts which are recorded in the,in,rstl_1850_0029.txt,txt_rstl,1850,18
shall venture to state some facts in connection with this point,in,rstl_1850_0009.txt,txt_rstl,1850,18
form of heat: from these facts I considered myself justified in,in,rstl_1850_0004.txt,txt_rstl,1850,18
"as it did, upon the facts observed in the formation of",in,rstl_1850_0006.txt,txt_rstl,1850,18
desirable the acquisition of additional facts in support of the position,in,rstl_1850_0006.txt,txt_rstl,1850,18
in perfect harmony with the facts at pre- E 8ent in,in,rstl_1850_0006.txt,txt_rstl,1850,18
"have their foundation possibly in facts of this kind, 8. Diffusion",in,rstl_1850_0001.txt,txt_rstl,1850,18
the 21st of May. These facts Dr. Butsr recorded in a,in,rstl_1850_0016.txt,txt_rstl,1850,18
"therefore, a few of the facts brought forward in this paper",in,rstl_1851_0029.txt,txt_rstl,1851,18
following summary of the principal facts described in this paper may,in,rstl_1851_0029.txt,txt_rstl,1851,18
the respiratory cavity. The spermatic facts lie loosely in a dilatation,in,rstl_1851_0027.txt,txt_rstl,1851,18
"present chapter; but, as the facts have been Stated in part,",in,rstl_1851_0002.txt,txt_rstl,1851,18
"present chapter; but, as the facts have been Stated in part,",in,rstl_1851_0002.txt,txt_rstl,1851,18
As an expression of the facts for use in applying them,in,rstl_1851_0006.txt,txt_rstl,1851,18
"in the germinal vesicle, the facts observed in the ova of",in,rstl_1851_0011.txt,txt_rstl,1851,18
was not in accordance with facts I had very long been,in,rstl_1851_0011.txt,txt_rstl,1851,18
uniform in the interior. These facts ap- peared to be conelusive,in,rstl_1851_0011.txt,txt_rstl,1851,18
"which are objectionable from the facts shown in Dr. Frericns' analyses,",in,rstl_1851_0011.txt,txt_rstl,1851,18
"in common either between the facts or arguments therein given, and",in,rstl_1852_0024.txt,txt_rstl,1852,18
a current of fluid-sand. 'These facts are here noticed in historic,in,rstl_1852_0024.txt,txt_rstl,1852,18
"in the true-blood. From these facts the physiologist may state, that",in,rstl_1852_0024.txt,txt_rstl,1852,18
secretion in living animals. The facts which the experiments related in,in,rstl_1852_0016.txt,txt_rstl,1852,18
am of opinion that the facts detailed in this paper are,in,rstl_1852_0005.txt,txt_rstl,1852,18
placed in juxtaposition with the facts already elicited by more able,in,rstl_1852_0005.txt,txt_rstl,1852,18
"the vast mass of accumulated facts in electrical science, and likely",in,rstl_1852_0008.txt,txt_rstl,1852,18
"disturbance in different years, the facts which present themselves most obviously",in,rstl_1852_0009.txt,txt_rstl,1852,18
"In the marine Tubulariadae, the facts in question consist; of a",in,rstl_1853_0015.txt,txt_rstl,1853,18
"bodies produced in the fixed facts only as © bulbille,” by",in,rstl_1853_0015.txt,txt_rstl,1853,18
bodies contained in the fixed facts are undoubtedly not gemm@ but,in,rstl_1853_0015.txt,txt_rstl,1853,18
The conelusion to which the facts s0nght to be demonstrated in,in,rstl_1853_0015.txt,txt_rstl,1853,18
"Hobarton. We may expect, from facts already known, some agreement in",in,rstl_1853_0006.txt,txt_rstl,1853,18
"in considering what of new facts it contains, as of snhordinate",in,rstl_1853_0002.txt,txt_rstl,1853,18
to bring into prominence some facts in the anatomy of the,in,rstl_1853_0002.txt,txt_rstl,1853,18
supracesophageal position of the auditory facts in Nudibranchiatata merely arises from,in,rstl_1853_0002.txt,txt_rstl,1853,18
"is one of the earliest facts in molluscons development, and it",in,rstl_1853_0002.txt,txt_rstl,1853,18
circulation in the Mollusca. The facts I MR. T. H. HUXLEY,in,rstl_1853_0002.txt,txt_rstl,1853,18
according to the species. These facts are well shown both in,in,rstl_1853_0010.txt,txt_rstl,1853,18
of maturity in both. These facts seem to lead to the,in,rstl_1853_0010.txt,txt_rstl,1853,18
structure to be fecundated. These facts deserve consideration in connexion with,in,rstl_1853_0010.txt,txt_rstl,1853,18
"also Mr. Hexrrey$%, have noticed facts in regard to that of",in,rstl_1853_0010.txt,txt_rstl,1853,18
Invertebrata. A comparison of the facts in the two divisions of,in,rstl_1853_0010.txt,txt_rstl,1853,18
agent in all animals. The facts already mentioned coincide with this,in,rstl_1853_0010.txt,txt_rstl,1853,18
to be drawn from the facts of natural impregnation in the,in,rstl_1853_0010.txt,txt_rstl,1853,18
force in the spermatozoon. The facts now 8tated of penetration by,in,rstl_1853_0010.txt,txt_rstl,1853,18
"fecundation, we have, in the facts now referred to, much reason",in,rstl_1853_0010.txt,txt_rstl,1853,18
then the whole of the facts and observations recorded in this,in,rstl_1854_0014.txt,txt_rstl,1854,18
tried in the search for facts which might throw light on,in,rstl_1854_0008.txt,txt_rstl,1854,18
"to complete, and as the facts elicited in reference to cast",in,rstl_1855_0009.txt,txt_rstl,1855,18
1855. Ir is among the facts in chemical science which admit,in,rstl_1855_0008.txt,txt_rstl,1855,18
the manner in which these facts have been explained. © La,in,rstl_1855_0001.txt,txt_rstl,1855,18
"which presumption was corroborated by facts adduced in the £ame communication,",in,rstl_1856_0016.txt,txt_rstl,1856,18
not only established several important facts in regard to its minute,in,rstl_1856_0012.txt,txt_rstl,1856,18
"are in harmony with the facts of observation. All the Orbitolites,",in,rstl_1856_0012.txt,txt_rstl,1856,18
"No. 19), regarding the principal facts detailed in the present memoir,",in,rstl_1857_0028.txt,txt_rstl,1857,18
they are con- tained in facts formed by the condensation of,in,rstl_1857_0009.txt,txt_rstl,1857,18
"Z5th in breadth. The next facts requiring especial notice, are those",in,rstl_1857_0009.txt,txt_rstl,1857,18
"process in different cases, the facts observed by LEUCKART are in",in,rstl_1857_0009.txt,txt_rstl,1857,18
"from a Tenia-embryo. Finally, the facts made known in this communication",in,rstl_1857_0009.txt,txt_rstl,1857,18
appears strictly comparable to the facts which have been obseryed in,in,rstl_1857_0007.txt,txt_rstl,1857,18
faces in the quadrant (111...211). Facts presented by these Tables —The,in,rstl_1857_0004.txt,txt_rstl,1857,18
; The anterior and posterior facts alternate in their contraction and,in,rstl_1848_0007.txt,txt_rstl,1848,18
":—the collec- tion of the facts then known, given in the",in,rstl_1848_0001.txt,txt_rstl,1848,18
"spermatozoa are developed in pyriform facts opening externally, and that the",in,rstl_1849_0022.txt,txt_rstl,1849,18
"45. The contents of the facts are spermatozoa, and cells in",in,rstl_1849_0022.txt,txt_rstl,1849,18
the spermatozoa deve- Joped in facts connected with the inner ©,in,rstl_1849_0022.txt,txt_rstl,1849,18
conelusions are deducible from the facts stated in the pre- ceding,in,rstl_1849_0022.txt,txt_rstl,1849,18
"original corium ||.” Summary —The facts described in this communication will,",in,rstl_1849_0015.txt,txt_rstl,1849,18
which the accuracy of the facts stated in this paper are,in,rstl_1850_0027.txt,txt_rstl,1850,18
of conducting electricity. All the facts which have been adduced in,in,rstl_1850_0037.txt,txt_rstl,1850,18
adducing in support of it facts which are s0 well known,in,rstl_1850_0037.txt,txt_rstl,1850,18
scarcely neces- sary to accumulate facts in support of a position,in,rstl_1850_0037.txt,txt_rstl,1850,18
"my *Odontography* ©, that the facts detailed in How's paper were",in,rstl_1850_0025.txt,txt_rstl,1850,18
"express, in a few lines, facts in Comparative Anatomy which would",in,rstl_1850_0025.txt,txt_rstl,1850,18
terpretation of some of the facts described in the Memoir on,in,rstl_1850_0019.txt,txt_rstl,1850,18
in the text. + The facts dexcribed in the text are,in,rstl_1850_0019.txt,txt_rstl,1850,18
condition. There are even well-known facts of great importance in this,in,rstl_1850_0038.txt,txt_rstl,1850,18
"wooden standards, * Several important facts and improvements in the construction",in,rstl_1850_0036.txt,txt_rstl,1850,18
"strength, and exhibits several important facts in connection with the construction",in,rstl_1850_0036.txt,txt_rstl,1850,18
a striking coincidence in the facts tending to establish the principle,in,rstl_1850_0036.txt,txt_rstl,1850,18
"which will be found the facts more in detail, and which",in,rstl_1850_0036.txt,txt_rstl,1850,18
is not perfectly hardened. The facts which are recorded in the,in,rstl_1850_0029.txt,txt_rstl,1850,18
shall venture to state some facts in connection with this point,in,rstl_1850_0009.txt,txt_rstl,1850,18
form of heat: from these facts I considered myself justified in,in,rstl_1850_0004.txt,txt_rstl,1850,18
"as it did, upon the facts observed in the formation of",in,rstl_1850_0006.txt,txt_rstl,1850,18
desirable the acquisition of additional facts in support of the position,in,rstl_1850_0006.txt,txt_rstl,1850,18
in perfect harmony with the facts at pre- E 8ent in,in,rstl_1850_0006.txt,txt_rstl,1850,18
"have their foundation possibly in facts of this kind, 8. Diffusion",in,rstl_1850_0001.txt,txt_rstl,1850,18
the 21st of May. These facts Dr. Butsr recorded in a,in,rstl_1850_0016.txt,txt_rstl,1850,18
"therefore, a few of the facts brought forward in this paper",in,rstl_1851_0029.txt,txt_rstl,1851,18
following summary of the principal facts described in this paper may,in,rstl_1851_0029.txt,txt_rstl,1851,18
the respiratory cavity. The spermatic facts lie loosely in a dilatation,in,rstl_1851_0027.txt,txt_rstl,1851,18
"present chapter; but, as the facts have been Stated in part,",in,rstl_1851_0002.txt,txt_rstl,1851,18
"present chapter; but, as the facts have been Stated in part,",in,rstl_1851_0002.txt,txt_rstl,1851,18
As an expression of the facts for use in applying them,in,rstl_1851_0006.txt,txt_rstl,1851,18
"in the germinal vesicle, the facts observed in the ova of",in,rstl_1851_0011.txt,txt_rstl,1851,18
was not in accordance with facts I had very long been,in,rstl_1851_0011.txt,txt_rstl,1851,18
uniform in the interior. These facts ap- peared to be conelusive,in,rstl_1851_0011.txt,txt_rstl,1851,18
"which are objectionable from the facts shown in Dr. Frericns' analyses,",in,rstl_1851_0011.txt,txt_rstl,1851,18
"in common either between the facts or arguments therein given, and",in,rstl_1852_0024.txt,txt_rstl,1852,18
a current of fluid-sand. 'These facts are here noticed in historic,in,rstl_1852_0024.txt,txt_rstl,1852,18
"in the true-blood. From these facts the physiologist may state, that",in,rstl_1852_0024.txt,txt_rstl,1852,18
secretion in living animals. The facts which the experiments related in,in,rstl_1852_0016.txt,txt_rstl,1852,18
am of opinion that the facts detailed in this paper are,in,rstl_1852_0005.txt,txt_rstl,1852,18
placed in juxtaposition with the facts already elicited by more able,in,rstl_1852_0005.txt,txt_rstl,1852,18
"the vast mass of accumulated facts in electrical science, and likely",in,rstl_1852_0008.txt,txt_rstl,1852,18
"disturbance in different years, the facts which present themselves most obviously",in,rstl_1852_0009.txt,txt_rstl,1852,18
"In the marine Tubulariadae, the facts in question consist; of a",in,rstl_1853_0015.txt,txt_rstl,1853,18
"bodies produced in the fixed facts only as © bulbille,” by",in,rstl_1853_0015.txt,txt_rstl,1853,18
bodies contained in the fixed facts are undoubtedly not gemm@ but,in,rstl_1853_0015.txt,txt_rstl,1853,18
The conelusion to which the facts s0nght to be demonstrated in,in,rstl_1853_0015.txt,txt_rstl,1853,18
"Hobarton. We may expect, from facts already known, some agreement in",in,rstl_1853_0006.txt,txt_rstl,1853,18
"in considering what of new facts it contains, as of snhordinate",in,rstl_1853_0002.txt,txt_rstl,1853,18
to bring into prominence some facts in the anatomy of the,in,rstl_1853_0002.txt,txt_rstl,1853,18
supracesophageal position of the auditory facts in Nudibranchiatata merely arises from,in,rstl_1853_0002.txt,txt_rstl,1853,18
"is one of the earliest facts in molluscons development, and it",in,rstl_1853_0002.txt,txt_rstl,1853,18
circulation in the Mollusca. The facts I MR. T. H. HUXLEY,in,rstl_1853_0002.txt,txt_rstl,1853,18
according to the species. These facts are well shown both in,in,rstl_1853_0010.txt,txt_rstl,1853,18
of maturity in both. These facts seem to lead to the,in,rstl_1853_0010.txt,txt_rstl,1853,18
structure to be fecundated. These facts deserve consideration in connexion with,in,rstl_1853_0010.txt,txt_rstl,1853,18
"also Mr. Hexrrey$%, have noticed facts in regard to that of",in,rstl_1853_0010.txt,txt_rstl,1853,18
Invertebrata. A comparison of the facts in the two divisions of,in,rstl_1853_0010.txt,txt_rstl,1853,18
agent in all animals. The facts already mentioned coincide with this,in,rstl_1853_0010.txt,txt_rstl,1853,18
to be drawn from the facts of natural impregnation in the,in,rstl_1853_0010.txt,txt_rstl,1853,18
force in the spermatozoon. The facts now 8tated of penetration by,in,rstl_1853_0010.txt,txt_rstl,1853,18
"fecundation, we have, in the facts now referred to, much reason",in,rstl_1853_0010.txt,txt_rstl,1853,18
then the whole of the facts and observations recorded in this,in,rstl_1854_0014.txt,txt_rstl,1854,18
tried in the search for facts which might throw light on,in,rstl_1854_0008.txt,txt_rstl,1854,18
"to complete, and as the facts elicited in reference to cast",in,rstl_1855_0009.txt,txt_rstl,1855,18
1855. Ir is among the facts in chemical science which admit,in,rstl_1855_0008.txt,txt_rstl,1855,18
the manner in which these facts have been explained. © La,in,rstl_1855_0001.txt,txt_rstl,1855,18
"which presumption was corroborated by facts adduced in the £ame communication,",in,rstl_1856_0016.txt,txt_rstl,1856,18
