Context,Collocate,File,Directory,Year,Frequency Filter
combination with that substance. These facts led me to suspect that,these,rstl_1848_0010.txt,txt_rstl,1848,18
(fig. 1.2-3). These posterior deep facts are immediately behind the external,these,rstl_1848_0007.txt,txt_rstl,1848,18
combines these and many other facts respecting the tides into a,these,rstl_1848_0001.txt,txt_rstl,1848,18
pass through the tissue. These facts of course do away with,these,rstl_1849_0023.txt,txt_rstl,1849,18
"and teeth of Macropoma. These facts (if correctly interpreted, and T",these,rstl_1849_0023.txt,txt_rstl,1849,18
very desirable to test these facts by further experiments. (47.) The,these,rstl_1850_0035.txt,txt_rstl,1850,18
"less frequently performed*. With these facts before us, we can scarcely",these,rstl_1850_0037.txt,txt_rstl,1850,18
which it is a consequence. Facts corresponding to these cases of,these,rstl_1850_0038.txt,txt_rstl,1850,18
"vol, xi. 251. + These facts have been cited by L1zn16",these,rstl_1850_0038.txt,txt_rstl,1850,18
"the impression made by these facts upon TatnaRD, who first discovered",these,rstl_1850_0038.txt,txt_rstl,1850,18
the scientific conception of these facts from the electro- chemical point,these,rstl_1850_0038.txt,txt_rstl,1850,18
supplies an explanation of these facts at once adequate and imple;,these,rstl_1850_0038.txt,txt_rstl,1850,18
"always present, being dissolved. These facts are contrary to the usual",these,rstl_1850_0038.txt,txt_rstl,1850,18
"may express these facts, the facts themselves are the 8ame. We",these,rstl_1850_0038.txt,txt_rstl,1850,18
"24 : 16'5, From these facts it is evident that the",these,rstl_1850_0036.txt,txt_rstl,1850,18
of the plates. From these facts I would infer that single,these,rstl_1850_0036.txt,txt_rstl,1850,18
"of the bars. These interesting facts are of considerable value, as",these,rstl_1850_0036.txt,txt_rstl,1850,18
to the optic lobes. These facts I think are of some,these,rstl_1850_0009.txt,txt_rstl,1850,18
form of heat: from these facts I considered myself justified in,these,rstl_1850_0004.txt,txt_rstl,1850,18
the 21st of May. These facts Dr. Butsr recorded in a,these,rstl_1850_0016.txt,txt_rstl,1850,18
and 367 inches respectively. These facts suggest caution to all ob-,these,rstl_1850_0016.txt,txt_rstl,1850,18
which I had taken. These facts I bave since endeavoured to,these,rstl_1851_0017.txt,txt_rstl,1851,18
comparing these with the £ facts of the natural history and,these,rstl_1851_0011.txt,txt_rstl,1851,18
the whole produced embryos. These facts proved that the ova employed,these,rstl_1851_0011.txt,txt_rstl,1851,18
of the area germinativa. These facts sufficiently prove the great influence,these,rstl_1851_0011.txt,txt_rstl,1851,18
uniform in the interior. These facts ap- peared to be conelusive,these,rstl_1851_0011.txt,txt_rstl,1851,18
and to show from these facts that a non-production of the,these,rstl_1851_0011.txt,txt_rstl,1851,18
"embryos had been produced. These facts seemed to show, precisely as",these,rstl_1851_0011.txt,txt_rstl,1851,18
"perhaps always unpro- ductive. These facts lead us to inquire, whether",these,rstl_1851_0011.txt,txt_rstl,1851,18
by these two illustrious anatomists. Facts will now be adduced which,these,rstl_1852_0024.txt,txt_rstl,1852,18
or peritoneal chamber. These indisputable facts establish conclusively the view which,these,rstl_1852_0024.txt,txt_rstl,1852,18
"in the true-blood. From these facts the physiologist may state, that",these,rstl_1852_0024.txt,txt_rstl,1852,18
at a considerable distance. The facts noticed by these authors are,these,rstl_1852_0001.txt,txt_rstl,1852,18
"a few scattered spermatozoa, These facts are the developed spermatophora+, and",these,rstl_1852_0014.txt,txt_rstl,1852,18
© fair inference from these facts following ; that a large,these,rstl_1852_0014.txt,txt_rstl,1852,18
the grey substance. From these facts he calcu- lates that the,these,rstl_1853_0013.txt,txt_rstl,1853,18
it. The parietes of these facts are glandular. A long ©,these,rstl_1853_0002.txt,txt_rstl,1853,18
according to the species. These facts are well shown both in,these,rstl_1853_0010.txt,txt_rstl,1853,18
of maturity in both. These facts seem to lead to the,these,rstl_1853_0010.txt,txt_rstl,1853,18
fair then toinfer from these facts that the completion of the,these,rstl_1853_0010.txt,txt_rstl,1853,18
embryo was produced. S These facts then support the statement already,these,rstl_1853_0010.txt,txt_rstl,1853,18
structure to be fecundated. These facts deserve consideration in connexion with,these,rstl_1853_0010.txt,txt_rstl,1853,18
S influence supplied. S These facts lead us to some further,these,rstl_1853_0010.txt,txt_rstl,1853,18
"also cases of phthisis. These facts possess the greatest interest, and",these,rstl_1854_0014.txt,txt_rstl,1854,18
"these were confirmatory of the facts before stated, as the variation",these,rstl_1854_0009.txt,txt_rstl,1854,18
spoken of its length. These facts will explain the results of,these,rstl_1855_0010.txt,txt_rstl,1855,18
"; but these prove other facts also ; and first, that",these,rstl_1855_0005.txt,txt_rstl,1855,18
the same agent. Supposing these facts to have been known to,these,rstl_1855_0001.txt,txt_rstl,1855,18
the manner in which these facts have been explained. © La,these,rstl_1855_0001.txt,txt_rstl,1855,18
by critical examinations of the facts already accumulated. These menoirs I,these,rstl_1856_0020.txt,txt_rstl,1856,18
LIONEL BEALE ON THE These facts appear to me to militate,these,rstl_1856_0017.txt,txt_rstl,1856,18
a like kind. Among these facts were several that became of,these,rstl_1856_0012.txt,txt_rstl,1856,18
"identical properties. Connecting all these facts together, it clearly follows,— That",these,rstl_1856_0001.txt,txt_rstl,1856,18
inch to crush them. These facts show the great superiority of,these,rstl_1857_0039.txt,txt_rstl,1857,18
moment de leur formation.” These facts appear to be totally at,these,rstl_1857_0016.txt,txt_rstl,1857,18
"electricity. The first of these facts is, that a differential current",these,rstl_1857_0010.txt,txt_rstl,1857,18
"of the heart, these adventitious facts are strong and well-defined, whilst",these,rstl_1857_0009.txt,txt_rstl,1857,18
"fibres, still I think these facts render it highly probable that",these,rstl_1857_0009.txt,txt_rstl,1857,18
"inference I deduce from these facts is, first, that the animals",these,rstl_1857_0009.txt,txt_rstl,1857,18
faces in the quadrant (111...211). Facts presented by these Tables —The,these,rstl_1857_0004.txt,txt_rstl,1857,18
angles. With regard to these facts no difference of opinion can,these,rstl_1857_0004.txt,txt_rstl,1857,18
pletely set aside by the facts and arguments which have been,been,rstl_1848_0019.txt,txt_rstl,1848,18
"probable, has by the same facts and arguments been proved to",been,rstl_1848_0019.txt,txt_rstl,1848,18
the true explanation of the facts which have been thus pointed,been,rstl_1849_0012.txt,txt_rstl,1849,18
"been thus pointed out, the facts themselves are highly deserving of",been,rstl_1849_0012.txt,txt_rstl,1849,18
of conducting electricity. All the facts which have been adduced in,been,rstl_1850_0037.txt,txt_rstl,1850,18
the ready comprehension of the facts which have been recorded by,been,rstl_1850_0025.txt,txt_rstl,1850,18
means of them. Had those facts been explained by ineans of,been,rstl_1850_0025.txt,txt_rstl,1850,18
"vol, xi. 251. + These facts have been cited by L1zn16",been,rstl_1850_0038.txt,txt_rstl,1850,18
from the great mass of facts which have now been collected,been,rstl_1850_0010.txt,txt_rstl,1850,18
"with alkaline lyes. —From the facts which haye been previously stated,",been,rstl_1850_0003.txt,txt_rstl,1850,18
"volatile organic bases. From the facts which have been now stated,",been,rstl_1850_0003.txt,txt_rstl,1850,18
"present chapter; but, as the facts have been Stated in part,",been,rstl_1851_0002.txt,txt_rstl,1851,18
"present chapter; but, as the facts have been Stated in part,",been,rstl_1851_0002.txt,txt_rstl,1851,18
was not in accordance with facts I had very long been,been,rstl_1851_0011.txt,txt_rstl,1851,18
"embryos had been produced. These facts seemed to show, precisely as",been,rstl_1851_0011.txt,txt_rstl,1851,18
for of what value are facts until they have been made,been,rstl_1853_0002.txt,txt_rstl,1853,18
667). Again :—* From the facts which have just been stated,been,rstl_1853_0002.txt,txt_rstl,1853,18
the same agent. Supposing these facts to have been known to,been,rstl_1855_0001.txt,txt_rstl,1855,18
the manner in which these facts have been explained. © La,been,rstl_1855_0001.txt,txt_rstl,1855,18
"this respect. 2 From the facts that have just been mentioned,",been,rstl_1857_0009.txt,txt_rstl,1857,18
appears strictly comparable to the facts which have been obseryed in,been,rstl_1857_0007.txt,txt_rstl,1857,18
pletely set aside by the facts and arguments which have been,have,rstl_1848_0019.txt,txt_rstl,1848,18
"a given point belonged. The facts that I have stated lead,",have,rstl_1849_0021.txt,txt_rstl,1849,18
the true explanation of the facts which have been thus pointed,have,rstl_1849_0012.txt,txt_rstl,1849,18
of conducting electricity. All the facts which have been adduced in,have,rstl_1850_0037.txt,txt_rstl,1850,18
the ready comprehension of the facts which have been recorded by,have,rstl_1850_0025.txt,txt_rstl,1850,18
"vol, xi. 251. + These facts have been cited by L1zn16",have,rstl_1850_0038.txt,txt_rstl,1850,18
theory of this action. The facts I have just mentioned gave,have,rstl_1850_0038.txt,txt_rstl,1850,18
IV. we have some curious facts illustrative of the necessity and,have,rstl_1850_0036.txt,txt_rstl,1850,18
from the great mass of facts which have now been collected,have,rstl_1850_0010.txt,txt_rstl,1850,18
"volatile organic bases. From the facts which have been now stated,",have,rstl_1850_0003.txt,txt_rstl,1850,18
"have their foundation possibly in facts of this kind, 8. Diffusion",have,rstl_1850_0001.txt,txt_rstl,1850,18
"confirm, from European localities, the facts I have stated respecting the",have,rstl_1850_0016.txt,txt_rstl,1850,18
with the more facility to facts and views that have heretofore,have,rstl_1851_0005.txt,txt_rstl,1851,18
"present chapter; but, as the facts have been Stated in part,",have,rstl_1851_0002.txt,txt_rstl,1851,18
"present chapter; but, as the facts have been Stated in part,",have,rstl_1851_0002.txt,txt_rstl,1851,18
"with this subject, because the facts I have ascertained regarding it",have,rstl_1852_0001.txt,txt_rstl,1852,18
signification of several of the facts with which we have thus,have,rstl_1853_0015.txt,txt_rstl,1853,18
"of the embryo; the enclosing facts have become ruptured, and the",have,rstl_1853_0015.txt,txt_rstl,1853,18
for of what value are facts until they have been made,have,rstl_1853_0002.txt,txt_rstl,1853,18
667). Again :—* From the facts which have just been stated,have,rstl_1853_0002.txt,txt_rstl,1853,18
"also Mr. Hexrrey$%, have noticed facts in regard to that of",have,rstl_1853_0010.txt,txt_rstl,1853,18
organs of respiration. From the facts which I have already succeeded,have,rstl_1854_0014.txt,txt_rstl,1854,18
experiments have therefore elicited three facts as regards beams formed of,have,rstl_1855_0009.txt,txt_rstl,1855,18
the same agent. Supposing these facts to have been known to,have,rstl_1855_0001.txt,txt_rstl,1855,18
the manner in which these facts have been explained. © La,have,rstl_1855_0001.txt,txt_rstl,1855,18
"growth; on which inquiry, the facts which I have now brought",have,rstl_1856_0027.txt,txt_rstl,1856,18
"any other explanation of the facts I have observed, or of",have,rstl_1856_0017.txt,txt_rstl,1856,18
stroma ; but if the facts T have stated be not,have,rstl_1857_0027.txt,txt_rstl,1857,18
"this respect. 2 From the facts that have just been mentioned,",have,rstl_1857_0009.txt,txt_rstl,1857,18
appears strictly comparable to the facts which have been obseryed in,have,rstl_1857_0007.txt,txt_rstl,1857,18
(fig. 1.2-3). These posterior deep facts are immediately behind the external,are,rstl_1848_0007.txt,txt_rstl,1848,18
is open; while the posterior facts that are emptied when the,are,rstl_1848_0007.txt,txt_rstl,1848,18
as we cannot know what facts are designated by such terms,are,rstl_1848_0001.txt,txt_rstl,1848,18
"spermatozoa are developed in pyriform facts opening externally, and that the",are,rstl_1849_0022.txt,txt_rstl,1849,18
"45. The contents of the facts are spermatozoa, and cells in",are,rstl_1849_0022.txt,txt_rstl,1849,18
conelusions are deducible from the facts stated in the pre- ceding,are,rstl_1849_0022.txt,txt_rstl,1849,18
quoted. The following are the facts relative to the nervous supply,are,rstl_1849_0003.txt,txt_rstl,1849,18
"been thus pointed out, the facts themselves are highly deserving of",are,rstl_1849_0012.txt,txt_rstl,1849,18
which the accuracy of the facts stated in this paper are,are,rstl_1850_0027.txt,txt_rstl,1850,18
adducing in support of it facts which are s0 well known,are,rstl_1850_0037.txt,txt_rstl,1850,18
in the text. + The facts dexcribed in the text are,are,rstl_1850_0019.txt,txt_rstl,1850,18
condition. There are even well-known facts of great importance in this,are,rstl_1850_0038.txt,txt_rstl,1850,18
"always present, being dissolved. These facts are contrary to the usual",are,rstl_1850_0038.txt,txt_rstl,1850,18
"may express these facts, the facts themselves are the 8ame. We",are,rstl_1850_0038.txt,txt_rstl,1850,18
the purpose of collecting the facts on which are founded the,are,rstl_1850_0036.txt,txt_rstl,1850,18
"of the bars. These interesting facts are of considerable value, as",are,rstl_1850_0036.txt,txt_rstl,1850,18
is not perfectly hardened. The facts which are recorded in the,are,rstl_1850_0029.txt,txt_rstl,1850,18
to the optic lobes. These facts I think are of some,are,rstl_1850_0009.txt,txt_rstl,1850,18
"vertex to coccyx, the same facts are as plainly obseryed =",are,rstl_1850_0007.txt,txt_rstl,1850,18
it extremely desirable that the facts which are to be Q,are,rstl_1851_0032.txt,txt_rstl,1851,18
phenomena of magnetism those elementary facts which are to serve for,are,rstl_1851_0002.txt,txt_rstl,1851,18
We are forced by unequivocal facts to admit that the fourth,are,rstl_1851_0017.txt,txt_rstl,1851,18
phenomena of magnetism those elementary facts which are to serve for,are,rstl_1851_0002.txt,txt_rstl,1851,18
during impregnation. —But although the facts now mentioned are 80 opposed,are,rstl_1851_0011.txt,txt_rstl,1851,18
"which are objectionable from the facts shown in Dr. Frericns' analyses,",are,rstl_1851_0011.txt,txt_rstl,1851,18
"as they are by the facts already known, they must, occasion",are,rstl_1852_0020.txt,txt_rstl,1852,18
a current of fluid-sand. 'These facts are here noticed in historic,are,rstl_1852_0024.txt,txt_rstl,1852,18
am of opinion that the facts detailed in this paper are,are,rstl_1852_0005.txt,txt_rstl,1852,18
less remarkable than are the facts which they combine to indi-,are,rstl_1852_0009.txt,txt_rstl,1852,18
are bound to receive the facts which may appear to indicate,are,rstl_1852_0009.txt,txt_rstl,1852,18
at a considerable distance. The facts noticed by these authors are,are,rstl_1852_0001.txt,txt_rstl,1852,18
"a few scattered spermatozoa, These facts are the developed spermatophora+, and",are,rstl_1852_0014.txt,txt_rstl,1852,18
bodies contained in the fixed facts are undoubtedly not gemm@ but,are,rstl_1853_0015.txt,txt_rstl,1853,18
for of what value are facts until they have been made,are,rstl_1853_0002.txt,txt_rstl,1853,18
it. The parietes of these facts are glandular. A long ©,are,rstl_1853_0002.txt,txt_rstl,1853,18
according to the species. These facts are well shown both in,are,rstl_1853_0010.txt,txt_rstl,1853,18
a more grave one. The facts are as follows :— the,are,rstl_1855_0001.txt,txt_rstl,1855,18
"are in harmony with the facts of observation. All the Orbitolites,",are,rstl_1856_0012.txt,txt_rstl,1856,18
they are con- tained in facts formed by the condensation of,are,rstl_1857_0009.txt,txt_rstl,1857,18
"of the heart, these adventitious facts are strong and well-defined, whilst",are,rstl_1857_0009.txt,txt_rstl,1857,18
"Z5th in breadth. The next facts requiring especial notice, are those",are,rstl_1857_0009.txt,txt_rstl,1857,18
confined myself entirely to such facts as are 80 obvious and,are,rstl_1857_0009.txt,txt_rstl,1857,18
"process in different cases, the facts observed by LEUCKART are in",are,rstl_1857_0009.txt,txt_rstl,1857,18
pletely set aside by the facts and arguments which have been,which,rstl_1848_0019.txt,txt_rstl,1848,18
on looking however into such facts as I can gather which,which,rstl_1848_0011.txt,txt_rstl,1848,18
exactly the reverse of the facts which take place at the,which,rstl_1848_0008.txt,txt_rstl,1848,18
the true explanation of the facts which have been thus pointed,which,rstl_1849_0012.txt,txt_rstl,1849,18
which the accuracy of the facts stated in this paper are,which,rstl_1850_0027.txt,txt_rstl,1850,18
of conducting electricity. All the facts which have been adduced in,which,rstl_1850_0037.txt,txt_rstl,1850,18
adducing in support of it facts which are s0 well known,which,rstl_1850_0037.txt,txt_rstl,1850,18
he now proceeds to adduce facts which appear to him adequate,which,rstl_1850_0037.txt,txt_rstl,1850,18
"fabric that manifests it. The facts already cited, which show how",which,rstl_1850_0037.txt,txt_rstl,1850,18
"express, in a few lines, facts in Comparative Anatomy which would",which,rstl_1850_0025.txt,txt_rstl,1850,18
the ready comprehension of the facts which have been recorded by,which,rstl_1850_0025.txt,txt_rstl,1850,18
which it is a consequence. Facts corresponding to these cases of,which,rstl_1850_0038.txt,txt_rstl,1850,18
the purpose of collecting the facts on which are founded the,which,rstl_1850_0036.txt,txt_rstl,1850,18
"which will be found the facts more in detail, and which",which,rstl_1850_0036.txt,txt_rstl,1850,18
this conclusion : and the facts on which it was based,which,rstl_1850_0011.txt,txt_rstl,1850,18
is not perfectly hardened. The facts which are recorded in the,which,rstl_1850_0029.txt,txt_rstl,1850,18
from the great mass of facts which have now been collected,which,rstl_1850_0010.txt,txt_rstl,1850,18
"with alkaline lyes. —From the facts which haye been previously stated,",which,rstl_1850_0003.txt,txt_rstl,1850,18
"volatile organic bases. From the facts which have been now stated,",which,rstl_1850_0003.txt,txt_rstl,1850,18
it extremely desirable that the facts which are to be Q,which,rstl_1851_0032.txt,txt_rstl,1851,18
"of this paper, that those facts only which were verified by",which,rstl_1851_0029.txt,txt_rstl,1851,18
being a contractile tissue. The facts which seem to militate against,which,rstl_1851_0010.txt,txt_rstl,1851,18
phenomena of magnetism those elementary facts which are to serve for,which,rstl_1851_0002.txt,txt_rstl,1851,18
former inquiry had elicited several facts which I was unable to,which,rstl_1851_0017.txt,txt_rstl,1851,18
which I had taken. These facts I bave since endeavoured to,which,rstl_1851_0017.txt,txt_rstl,1851,18
phenomena of magnetism those elementary facts which are to serve for,which,rstl_1851_0002.txt,txt_rstl,1851,18
produce rapidly a body of facts on which philosophers may proceed,which,rstl_1851_0006.txt,txt_rstl,1851,18
"think, is rendered certain by facts now shown, which escaped the",which,rstl_1851_0011.txt,txt_rstl,1851,18
"which are objectionable from the facts shown in Dr. Frericns' analyses,",which,rstl_1851_0011.txt,txt_rstl,1851,18
by these two illustrious anatomists. Facts will now be adduced which,which,rstl_1852_0024.txt,txt_rstl,1852,18
or peritoneal chamber. These indisputable facts establish conclusively the view which,which,rstl_1852_0024.txt,txt_rstl,1852,18
this bold =tatement by the facts which already my own labours,which,rstl_1852_0024.txt,txt_rstl,1852,18
secretion in living animals. The facts which the experiments related in,which,rstl_1852_0016.txt,txt_rstl,1852,18
"disturbance in different years, the facts which present themselves most obviously",which,rstl_1852_0009.txt,txt_rstl,1852,18
less remarkable than are the facts which they combine to indi-,which,rstl_1852_0009.txt,txt_rstl,1852,18
are bound to receive the facts which may appear to indicate,which,rstl_1852_0009.txt,txt_rstl,1852,18
"which has reference to experimental facts and not to hypotheses only,",which,rstl_1852_0004.txt,txt_rstl,1852,18
signification of several of the facts with which we have thus,which,rstl_1853_0015.txt,txt_rstl,1853,18
one'of the most'striking of the facts which he has 86 skilfully,which,rstl_1853_0015.txt,txt_rstl,1853,18
The conelusion to which the facts s0nght to be demonstrated in,which,rstl_1853_0015.txt,txt_rstl,1853,18
667). Again :—* From the facts which have just been stated,which,rstl_1853_0002.txt,txt_rstl,1853,18
organs of respiration. From the facts which I have already succeeded,which,rstl_1854_0014.txt,txt_rstl,1854,18
all of which the same facts could be noted. The segmentation,which,rstl_1854_0009.txt,txt_rstl,1854,18
tried in the search for facts which might throw light on,which,rstl_1854_0008.txt,txt_rstl,1854,18
1855. Ir is among the facts in chemical science which admit,which,rstl_1855_0008.txt,txt_rstl,1855,18
which appears to represent the facts with a con- siderable degree,which,rstl_1855_0002.txt,txt_rstl,1855,18
the manner in which these facts have been explained. © La,which,rstl_1855_0001.txt,txt_rstl,1855,18
"M. MarTevecr, and converted the facts upon which the objection is",which,rstl_1855_0001.txt,txt_rstl,1855,18
critical review of all the facts of the case which at,which,rstl_1855_0017.txt,txt_rstl,1855,18
"growth; on which inquiry, the facts which I have now brought",which,rstl_1856_0027.txt,txt_rstl,1856,18
"which presumption was corroborated by facts adduced in the £ame communication,",which,rstl_1856_0016.txt,txt_rstl,1856,18
conclusively established by the following facts :—In all the spirit-specimens which,which,rstl_1856_0012.txt,txt_rstl,1856,18
not premature to search for facts which may serve as starting-points,which,rstl_1857_0019.txt,txt_rstl,1857,18
"writes, © a multitude of facts which scem to necessitate the",which,rstl_1857_0016.txt,txt_rstl,1857,18
appears strictly comparable to the facts which have been obseryed in,which,rstl_1857_0007.txt,txt_rstl,1857,18
on looking however into such facts as I can gather which,i,rstl_1848_0011.txt,txt_rstl,1848,18
"of the ante- rior superior facts (1), and, I conceive, constrict",i,rstl_1848_0007.txt,txt_rstl,1848,18
"a given point belonged. The facts that I have stated lead,",i,rstl_1849_0021.txt,txt_rstl,1849,18
"District, as far as the facts then ascertained would permit. I",i,rstl_1849_0017.txt,txt_rstl,1849,18
theory of this action. The facts I have just mentioned gave,i,rstl_1850_0038.txt,txt_rstl,1850,18
of the plates. From these facts I would infer that single,i,rstl_1850_0036.txt,txt_rstl,1850,18
to the optic lobes. These facts I think are of some,i,rstl_1850_0009.txt,txt_rstl,1850,18
form of heat: from these facts I considered myself justified in,i,rstl_1850_0004.txt,txt_rstl,1850,18
"confirm, from European localities, the facts I have stated respecting the",i,rstl_1850_0016.txt,txt_rstl,1850,18
former inquiry had elicited several facts which I was unable to,i,rstl_1851_0017.txt,txt_rstl,1851,18
which I had taken. These facts I bave since endeavoured to,i,rstl_1851_0017.txt,txt_rstl,1851,18
was not in accordance with facts I had very long been,i,rstl_1851_0011.txt,txt_rstl,1851,18
"Remarks—An examination of the preceding facts will, I think, justify me",i,rstl_1852_0005.txt,txt_rstl,1852,18
"with this subject, because the facts I have ascertained regarding it",i,rstl_1852_0001.txt,txt_rstl,1852,18
circulation in the Mollusca. The facts I MR. T. H. HUXLEY,i,rstl_1853_0002.txt,txt_rstl,1853,18
organs of respiration. From the facts which I have already succeeded,i,rstl_1854_0014.txt,txt_rstl,1854,18
"growth; on which inquiry, the facts which I have now brought",i,rstl_1856_0027.txt,txt_rstl,1856,18
by critical examinations of the facts already accumulated. These menoirs I,i,rstl_1856_0020.txt,txt_rstl,1856,18
"any other explanation of the facts I have observed, or of",i,rstl_1856_0017.txt,txt_rstl,1856,18
prevented further publication of the facts at that time; but I,i,rstl_1857_0017.txt,txt_rstl,1857,18
"fibres, still I think these facts render it highly probable that",i,rstl_1857_0009.txt,txt_rstl,1857,18
"inference I deduce from these facts is, first, that the animals",i,rstl_1857_0009.txt,txt_rstl,1857,18
conelusions are deducible from the facts stated in the pre- ceding,from,rstl_1849_0022.txt,txt_rstl,1849,18
"The conclusions drawn from the facts given are, that the Sus",from,rstl_1850_0025.txt,txt_rstl,1850,18
"is generically distinetf. From the facts before us, our knowledge of",from,rstl_1850_0019.txt,txt_rstl,1850,18
the scientific conception of these facts from the electro- chemical point,from,rstl_1850_0038.txt,txt_rstl,1850,18
"24 : 16'5, From these facts it is evident that the",from,rstl_1850_0036.txt,txt_rstl,1850,18
of the plates. From these facts I would infer that single,from,rstl_1850_0036.txt,txt_rstl,1850,18
"alone, it appears from the facts already recorded, that iron is",from,rstl_1850_0036.txt,txt_rstl,1850,18
from the great mass of facts which have now been collected,from,rstl_1850_0010.txt,txt_rstl,1850,18
"volatile organic bases. From the facts which have been now stated,",from,rstl_1850_0003.txt,txt_rstl,1850,18
form of heat: from these facts I considered myself justified in,from,rstl_1850_0004.txt,txt_rstl,1850,18
"confirm, from European localities, the facts I have stated respecting the",from,rstl_1850_0016.txt,txt_rstl,1850,18
may be inferred from the facts of its structure. Being filled,from,rstl_1851_0011.txt,txt_rstl,1851,18
