Context,Collocate,File,Directory,Year,Frequency Filter
The following explanation of these facts may be suggested. The surface,these,rstb_1935_0007.txt,txt_rstb,1935,18
"of the diatom. Taking these facts into con- sideration, it would",these,rstb_1935_0008.txt,txt_rstb,1935,18
rapidity necessary in regeneration. These facts tend to show that the,these,rstb_1935_0014.txt,txt_rstb,1935,18
"partly atrophied organ. With these facts in mind, the special granules",these,rstb_1935_0010.txt,txt_rstb,1935,18
"less of a peak. These facts may possibly indicate that, at",these,rsta_1935_0013.txt,txt_rsta,1935,18
"in the engine. , These facts and all the experiments described",these,rsta_1935_0013.txt,txt_rsta,1935,18
"to those after. With these facts as a basis, there has",these,rstb_1936_0010.txt,txt_rstb,1936,18
"In view of all these facts it is apparent, as Dopps",these,rstb_1936_0012.txt,txt_rstb,1936,18
DisPLAy In view of such facts as these it is easy,these,rstb_1936_0012.txt,txt_rstb,1936,18
of the valve. With these facts in mind we are in,these,rstb_1937_0002.txt,txt_rstb,1937,18
than in April. All these facts show that there is no,these,rstb_1937_0008.txt,txt_rstb,1937,18
the median line. All these facts dispose of Heymons’s objection quite,these,rstb_1937_0003.txt,txt_rstb,1937,18
"of the genital ducts. These facts give support to the view,",these,rstb_1937_0003.txt,txt_rstb,1937,18
"between these conditions and the facts recorded above for Amphioxus, for",these,rstb_1937_0013.txt,txt_rstb,1937,18
hygroscopic tent of saliva. These facts seem to indicate that the,these,rstb_1937_0001.txt,txt_rstb,1937,18
molars. So far as these facts are of value they would,these,rstb_1937_0015.txt,txt_rstb,1937,18
H.X. respectively. Taking all these facts into consideration I think that,these,rstb_1937_0015.txt,txt_rstb,1937,18
"well defined, is small. These facts are tabu- lated at the",these,rstb_1937_0005.txt,txt_rstb,1937,18
the Australian brain does. These facts make one hopeful that a,these,rstb_1937_0005.txt,txt_rstb,1937,18
one another in echelon. These facts were patent to both GunnincHaAM,these,rstb_1937_0005.txt,txt_rstb,1937,18
"die Leibeshéhle gelangen”, but no facts support these speculations. SEDGWICK (1909)",these,rstb_1938_0001.txt,txt_rstb,1938,18
any apical system known. The facts seem to be that these,these,rstb_1938_0003.txt,txt_rstb,1938,18
"with X° or X"", These facts should inspire caution before invoking",these,rstb_1938_0004.txt,txt_rstb,1938,18
virulent type of reaction. These facts led to the view ITS,these,rstb_1938_0004.txt,txt_rstb,1938,18
expected were anti-bodies concerned. These facts suggest that when a living,these,rstb_1938_0004.txt,txt_rstb,1938,18
series covered them unconformably. These facts were ascertained by inspection from,these,rstb_1938_0002.txt,txt_rstb,1938,18
type (p. 54). From these facts we may make the further,these,rstb_1938_0002.txt,txt_rstb,1938,18
the direction of Montserrat. These facts taken together suggest that the,these,rsta_1938_0002.txt,txt_rsta,1938,18
"occurrence of this earthquake. These facts should not, however, be allowed",these,rsta_1938_0002.txt,txt_rsta,1938,18
of workers has contributed. Certain facts about all these types are,these,rstb_1939_0007.txt,txt_rstb,1939,18
obvious conclusions arising from these facts are: (1) That the length,these,rstb_1939_0007.txt,txt_rstb,1939,18
"seems however, clear from the facts for Osmunda. { These results",these,rstb_1939_0007.txt,txt_rstb,1939,18
at strepsitene. II. From these facts it is postulated that the,these,rstb_1939_0007.txt,txt_rstb,1939,18
the presence of Trias. These facts strongly suggest that the Lower,these,rsta_1940_0008.txt,txt_rsta,1940,18
the corresponding simple form. These facts suggest that we have here,these,rstb_1941_0001.txt,txt_rstb,1941,18
was no longer reversible. These facts are in agreement with other,these,rstb_1941_0001.txt,txt_rstb,1941,18
in its first year. These facts are interesting in view of,these,rstb_1942_0002.txt,txt_rstb,1942,18
"detail, and concerned with the facts that in Callorhynchus, (i) there",that,rstb_1935_0001.txt,txt_rstb,1935,18
"(1931), who shows that the facts are consistent with the theory",that,rstb_1935_0011.txt,txt_rstb,1935,18
rapidity necessary in regeneration. These facts tend to show that the,that,rstb_1935_0014.txt,txt_rstb,1935,18
with tissues undergoing calcification. The facts that Turcutnr does not appear,that,rstb_1935_0010.txt,txt_rstb,1935,18
accumulation of yolk are the facts that such accumulation above the,that,rstb_1935_0013.txt,txt_rstb,1935,18
"the “‘ peroxides,” certain experimental facts indicated that organic peroxides might",that,rsta_1935_0013.txt,txt_rsta,1935,18
genus the epicardia or perivisceral facts are so small that they,that,rstb_1936_0002.txt,txt_rstb,1936,18
offers striking proof of the facts disputed by previous authors that,that,rstb_1936_0006.txt,txt_rstb,1936,18
qualifications. I mention the above facts to show that even in,that,rstb_1937_0008.txt,txt_rstb,1937,18
than in April. All these facts show that there is no,that,rstb_1937_0008.txt,txt_rstb,1937,18
1.—at 15 m. depth. The facts that in the sea Chaetoceros,that,rstb_1937_0008.txt,txt_rstb,1937,18
"concludes that the “‘ preantennulary facts in Carausius, lying at the",that,rstb_1937_0003.txt,txt_rstb,1937,18
hygroscopic tent of saliva. These facts seem to indicate that the,that,rstb_1937_0001.txt,txt_rstb,1937,18
"alternative methods of presenting the facts were considered. The first, that",that,rstb_1937_0014.txt,txt_rstb,1937,18
"appropriate section, so that the facts relating to any particular tissue",that,rstb_1937_0014.txt,txt_rstb,1937,18
H.X. respectively. Taking all these facts into consideration I think that,that,rstb_1937_0015.txt,txt_rstb,1937,18
the Australian brain does. These facts make one hopeful that a,that,rstb_1937_0005.txt,txt_rstb,1937,18
any apical system known. The facts seem to be that these,that,rstb_1938_0003.txt,txt_rstb,1938,18
"partial survival may occur, the facts indicate that the oviposition response",that,rstb_1938_0005.txt,txt_rstb,1938,18
expected were anti-bodies concerned. These facts suggest that when a living,that,rstb_1938_0004.txt,txt_rstb,1938,18
the direction of Montserrat. These facts taken together suggest that the,that,rsta_1938_0002.txt,txt_rsta,1938,18
obvious conclusions arising from these facts are: (1) That the length,that,rstb_1939_0007.txt,txt_rstb,1939,18
is nevertheless true that such facts as there are cannot easily,that,rstb_1939_0007.txt,txt_rstb,1939,18
at strepsitene. II. From these facts it is postulated that the,that,rstb_1939_0007.txt,txt_rstb,1939,18
"is absent, that the kidney facts of the two sides do",that,rstb_1939_0005.txt,txt_rstb,1939,18
One of the most striking facts which emerge is that when,that,rsta_1939_0009.txt,txt_rsta,1939,18
"sufficient to represent the observed facts with high accuracy, so that",that,rsta_1939_0004.txt,txt_rsta,1939,18
to suggest that the nasal facts may have been situated in,that,rstb_1940_0004.txt,txt_rstb,1940,18
the presence of Trias. These facts strongly suggest that the Lower,that,rsta_1940_0008.txt,txt_rsta,1940,18
the corresponding simple form. These facts suggest that we have here,that,rstb_1941_0001.txt,txt_rstb,1941,18
"required for melanin formation, the facts support the idea that we",that,rstb_1941_0001.txt,txt_rstb,1941,18
which will fit the known facts is that the precociously developing,that,rstb_1942_0002.txt,txt_rstb,1942,18
of laterally beneath the nasal facts as in other forms. Here,as,rstb_1935_0001.txt,txt_rstb,1935,18
"as had been thought. The facts that, in addition to reputed",as,rstb_1935_0011.txt,txt_rstb,1935,18
each side as the peribranchial facts come into contact with the,as,rstb_1935_0013.txt,txt_rstb,1935,18
"Taken as a whole, the facts presented in the preceding sections",as,rstb_1935_0013.txt,txt_rstb,1935,18
"right and left, the perivisceral facts or epicardia, as they exist",as,rstb_1936_0002.txt,txt_rstb,1936,18
"of development as the epicardial facts in Ciona. Moreover, the renal",as,rstb_1936_0002.txt,txt_rstb,1936,18
"to those after. With these facts as a basis, there has",as,rstb_1936_0010.txt,txt_rstb,1936,18
"In view of all these facts it is apparent, as Dopps",as,rstb_1936_0012.txt,txt_rstb,1936,18
DisPLAy In view of such facts as these it is easy,as,rstb_1936_0012.txt,txt_rstb,1936,18
as a series of small facts sunk within the epithelium. Their,as,rstb_1937_0011.txt,txt_rstb,1937,18
to be made from the facts as known at present. On,as,rstb_1937_0004.txt,txt_rstb,1937,18
in Tables I—III. The outstanding facts are as follows: (1) No,as,rstb_1937_0008.txt,txt_rstb,1937,18
"to his erroneous interpretation of facts than to reality, as he",as,rstb_1937_0007.txt,txt_rstb,1937,18
"the existing theoretical views, such facts may be enlightening, for as",as,rstb_1937_0012.txt,txt_rstb,1937,18
molars. So far as these facts are of value they would,as,rstb_1937_0015.txt,txt_rstb,1937,18
"control. As regards Montserrat, the facts can be explained more simply",as,rstb_1938_0002.txt,txt_rstb,1938,18
is nevertheless true that such facts as there are cannot easily,as,rstb_1939_0007.txt,txt_rstb,1939,18
seemed profitable to publish the facts as they stand in the,as,rstb_1939_0007.txt,txt_rstb,1939,18
describes and figures as pollen facts (and certainly look like them),as,rstb_1941_0004.txt,txt_rstb,1941,18
in small sori. The pollen facts are shaped as in the,as,rstb_1941_0004.txt,txt_rstb,1941,18
"detail, and concerned with the facts that in Callorhynchus, (i) there",with,rstb_1935_0001.txt,txt_rstb,1935,18
"(1931), who shows that the facts are consistent with the theory",with,rstb_1935_0011.txt,txt_rstb,1935,18
are at variance with well-established facts in other secretory cells. VOL.,with,rstb_1935_0010.txt,txt_rstb,1935,18
"partly atrophied organ. With these facts in mind, the special granules",with,rstb_1935_0010.txt,txt_rstb,1935,18
with tissues undergoing calcification. The facts that Turcutnr does not appear,with,rstb_1935_0010.txt,txt_rstb,1935,18
each side as the peribranchial facts come into contact with the,with,rstb_1935_0013.txt,txt_rstb,1935,18
followed probably much later by facts fused and nares with hypophysis,with,rstb_1935_0015.txt,txt_rstb,1935,18
"The capillary tubes, with the facts depending from them, were immersed",with,rsta_1935_0018.txt,txt_rsta,1935,18
to be reconciled with the facts which ’ have been set,with,rsta_1935_0013.txt,txt_rsta,1935,18
"is in agreement with the facts observed by von Kocu (1882,",with,rstb_1936_0007.txt,txt_rstb,1936,18
"to those after. With these facts as a basis, there has",with,rstb_1936_0010.txt,txt_rstb,1936,18
of the valve. With these facts in mind we are in,with,rstb_1937_0002.txt,txt_rstb,1937,18
manner on to the coelomic facts where they become associated with,with,rstb_1937_0003.txt,txt_rstb,1937,18
71) does not harmonize with facts observed during the post-embryonic development,with,rstb_1937_0007.txt,txt_rstb,1937,18
harmony with the above. Two facts so far stand out :,with,rstb_1937_0005.txt,txt_rstb,1937,18
"with X° or X"", These facts should inspire caution before invoking",with,rstb_1938_0004.txt,txt_rstb,1938,18
have brought to light new facts of importance. In- fection with,with,rstb_1938_0004.txt,txt_rstb,1938,18
one of the most far-reaching facts with which modern cytology has,with,rstb_1939_0007.txt,txt_rstb,1939,18
Better agreement with the experimental facts is obtained with the empirical,with,rsta_1939_0004.txt,txt_rsta,1939,18
"sufficient to represent the observed facts with high accuracy, so that",with,rsta_1939_0004.txt,txt_rsta,1939,18
not agree with the experimental facts obtained from compressibility measurements on,with,rsta_1939_0004.txt,txt_rsta,1939,18
was no longer reversible. These facts are in agreement with other,with,rstb_1941_0001.txt,txt_rstb,1941,18
are crowded with sessile pollen facts which appear to be arranged,with,rstb_1941_0004.txt,txt_rstb,1941,18
"Williamsoniella, but with the new facts much of this becomes obsolete.",with,rstb_1944_0001.txt,txt_rstb,1944,18
"(1931), who shows that the facts are consistent with the theory",are,rstb_1935_0011.txt,txt_rstb,1935,18
"conclusions are supported by the facts of regeneration in other phyla,",are,rstb_1935_0014.txt,txt_rstb,1935,18
are at variance with well-established facts in other secretory cells. VOL.,are,rstb_1935_0010.txt,txt_rstb,1935,18
accumulation of yolk are the facts that such accumulation above the,are,rstb_1935_0013.txt,txt_rstb,1935,18
"6, and 7. The following facts are outstanding. Aldehydes.—With Shell petrol",are,rsta_1935_0013.txt,txt_rsta,1935,18
genus the epicardia or perivisceral facts are so small that they,are,rstb_1936_0002.txt,txt_rstb,1936,18
"openings are lost, the two facts fuse to form a single",are,rstb_1936_0002.txt,txt_rstb,1936,18
are invariably crowded. The two facts of (a) the barbs on,are,rstb_1936_0006.txt,txt_rstb,1936,18
of the valve. With these facts in mind we are in,are,rstb_1937_0002.txt,txt_rstb,1937,18
in Tables I—III. The outstanding facts are as follows: (1) No,are,rstb_1937_0008.txt,txt_rstb,1937,18
cells accompanying each moult. The facts given by Wacner are insufficient,are,rstb_1937_0007.txt,txt_rstb,1937,18
molars. So far as these facts are of value they would,are,rstb_1937_0015.txt,txt_rstb,1937,18
in any way to the facts they are supposed to explain”’.,are,rstb_1937_0005.txt,txt_rstb,1937,18
"well defined, is small. These facts are tabu- lated at the",are,rstb_1937_0005.txt,txt_rstb,1937,18
the living and non-living. The facts are there: we must adjust,are,rstb_1938_0004.txt,txt_rstb,1938,18
of workers has contributed. Certain facts about all these types are,are,rstb_1939_0007.txt,txt_rstb,1939,18
impossible unless and until the facts regarding it are fully known.,are,rstb_1939_0007.txt,txt_rstb,1939,18
is nevertheless true that such facts as there are cannot easily,are,rstb_1939_0007.txt,txt_rstb,1939,18
was no longer reversible. These facts are in agreement with other,are,rstb_1941_0001.txt,txt_rstb,1941,18
are crowded with sessile pollen facts which appear to be arranged,are,rstb_1941_0004.txt,txt_rstb,1941,18
in small sori. The pollen facts are shaped as in the,are,rstb_1941_0004.txt,txt_rstb,1941,18
noticed. The sporangia are finger-shaped facts about 1-2 x 0-7 mm.;,are,rstb_1941_0004.txt,txt_rstb,1941,18
in its first year. These facts are interesting in view of,are,rstb_1942_0002.txt,txt_rstb,1942,18
"faintly marked outlines. The pollen facts are distinctly cutinized, their walls",are,rstb_1944_0001.txt,txt_rstb,1944,18
"detail, and concerned with the facts that in Callorhynchus, (i) there",the,rstb_1935_0001.txt,txt_rstb,1935,18
grow dorsally between the nasal facts instead of laterally beneath the,the,rstb_1935_0001.txt,txt_rstb,1935,18
of laterally beneath the nasal facts as in other forms. Here,the,rstb_1935_0001.txt,txt_rstb,1935,18
The following explanation of these facts may be suggested. The surface,the,rstb_1935_0007.txt,txt_rstb,1935,18
"quite possible that, if the facts were more fully known, this",the,rstb_1935_0007.txt,txt_rstb,1935,18
"of the diatom. Taking these facts into con- sideration, it would",the,rstb_1935_0008.txt,txt_rstb,1935,18
the prototroch a pair of facts is formed by invaginations of,the,rstb_1935_0008.txt,txt_rstb,1935,18
ectoderm and form small spherical facts at the sides of the,the,rstb_1935_0008.txt,txt_rstb,1935,18
VULGATA 113 the anterior mantle facts at each side of the,the,rstb_1935_0008.txt,txt_rstb,1935,18
and the walls of the facts become thinner. No trace can,the,rstb_1935_0008.txt,txt_rstb,1935,18
"as had been thought. The facts that, in addition to reputed",the,rstb_1935_0011.txt,txt_rstb,1935,18
different breeds. “From the foregoing facts we see in how astonishing,the,rstb_1935_0011.txt,txt_rstb,1935,18
"(1931), who shows that the facts are consistent with the theory",the,rstb_1935_0011.txt,txt_rstb,1935,18
disproved not only by the facts already cited in Oenothera but,the,rstb_1935_0012.txt,txt_rstb,1935,18
and epididymides descend into scrotal facts at the onset of the,the,rstb_1935_0016.txt,txt_rstb,1935,18
rapidity necessary in regeneration. These facts tend to show that the,the,rstb_1935_0014.txt,txt_rstb,1935,18
"conclusions are supported by the facts of regeneration in other phyla,",the,rstb_1935_0014.txt,txt_rstb,1935,18
relatively indifferent cell types. The facts so far presented throw light,the,rstb_1935_0014.txt,txt_rstb,1935,18
"partly atrophied organ. With these facts in mind, the special granules",the,rstb_1935_0010.txt,txt_rstb,1935,18
with tissues undergoing calcification. The facts that Turcutnr does not appear,the,rstb_1935_0010.txt,txt_rstb,1935,18
accumulation of yolk are the facts that such accumulation above the,the,rstb_1935_0013.txt,txt_rstb,1935,18
each side as the peribranchial facts come into contact with the,the,rstb_1935_0013.txt,txt_rstb,1935,18
"the fusion of the peribranchial facts to form the atrium, although",the,rstb_1935_0013.txt,txt_rstb,1935,18
IN TUNICATE DEVELOPMENT The peribranchial facts invaginate separately and later fuse,the,rstb_1935_0013.txt,txt_rstb,1935,18
"the other Didemnids, the peribranchial facts invaginate separately, but at an",the,rstb_1935_0013.txt,txt_rstb,1935,18
"Taken as a whole, the facts presented in the preceding sections",the,rstb_1935_0013.txt,txt_rstb,1935,18
This is confirmed by the facts recorded in a previous study,the,rstb_1935_0013.txt,txt_rstb,1935,18
"guard against carbon dioxide. The facts were made of nitro-cotton, and",the,rsta_1935_0018.txt,txt_rsta,1935,18
"The capillary tubes, with the facts depending from them, were immersed",the,rsta_1935_0018.txt,txt_rsta,1935,18
in order to elucidate certain facts revealed during the course of,the,rsta_1935_0013.txt,txt_rsta,1935,18
"6, and 7. The following facts are outstanding. Aldehydes.—With Shell petrol",the,rsta_1935_0013.txt,txt_rsta,1935,18
"the “‘ peroxides,” certain experimental facts indicated that organic peroxides might",the,rsta_1935_0013.txt,txt_rsta,1935,18
"in the engine. , These facts and all the experiments described",the,rsta_1935_0013.txt,txt_rsta,1935,18
"doubtfulf ; but taking all facts into consideration, the first process",the,rsta_1935_0013.txt,txt_rsta,1935,18
to consider some of those facts which bear on S the,the,rsta_1935_0013.txt,txt_rsta,1935,18
to be reconciled with the facts which ’ have been set,the,rsta_1935_0013.txt,txt_rsta,1935,18
the openings of the perivisceral facts (epicardia) into the pharynx ;,the,rstb_1936_0002.txt,txt_rstb,1936,18
showing the pair of perivisceral facts or epicardia descending around the,the,rstb_1936_0002.txt,txt_rstb,1936,18
"sac or pharynx, the two facts fuse to form a single",the,rstb_1936_0002.txt,txt_rstb,1936,18
genus the epicardia or perivisceral facts are so small that they,the,rstb_1936_0002.txt,txt_rstb,1936,18
"right and left, the perivisceral facts or epicardia, as they exist",the,rstb_1936_0002.txt,txt_rstb,1936,18
"of development as the epicardial facts in Ciona. Moreover, the renal",the,rstb_1936_0002.txt,txt_rstb,1936,18
the transformation of the perivisceral facts or epicardia into a renal,the,rstb_1936_0002.txt,txt_rstb,1936,18
"openings are lost, the two facts fuse to form a single",the,rstb_1936_0002.txt,txt_rstb,1936,18
"the mammalian vomer, and the facts now known about the structure",the,rstb_1936_0001.txt,txt_rstb,1936,18
"is in agreement with the facts observed by von Kocu (1882,",the,rstb_1936_0007.txt,txt_rstb,1936,18
the log difference. The following facts may be noted : (a),the,rstb_1936_0010.txt,txt_rstb,1936,18
"ROONWAL and the preantennary coelom facts in Carausius (Dixippus) morosus (Orthoptera,",the,rstb_1936_0011.txt,txt_rstb,1936,18
offers striking proof of the facts disputed by previous authors that,the,rstb_1936_0006.txt,txt_rstb,1936,18
are invariably crowded. The two facts of (a) the barbs on,the,rstb_1936_0006.txt,txt_rstb,1936,18
state briefly the main known facts concerning the part played by,the,rstb_1936_0012.txt,txt_rstb,1936,18
is no clear evidence. The facts have been well presented by,the,rstb_1936_0012.txt,txt_rstb,1936,18
factors. Murpuy also records some facts about the periodic breeding of,the,rstb_1936_0012.txt,txt_rstb,1936,18
"is, however, contrary to the facts presented in this paper,* unless",the,rstb_1937_0010.txt,txt_rstb,1937,18
of the valve. With these facts in mind we are in,the,rstb_1937_0002.txt,txt_rstb,1937,18
as a series of small facts sunk within the epithelium. Their,the,rstb_1937_0011.txt,txt_rstb,1937,18
"stress, e.g. in the style facts noted above, and here such",the,rstb_1937_0011.txt,txt_rstb,1937,18
which corroborate and extend the facts ascertained from the three specimens,the,rstb_1937_0004.txt,txt_rstb,1937,18
any discussion here of the facts described above. They afford the,the,rstb_1937_0004.txt,txt_rstb,1937,18
is beyond my competence. The facts ascertained regarding the flora will,the,rstb_1937_0004.txt,txt_rstb,1937,18
seems highly improbable. The further facts now known regarding the plant,the,rstb_1937_0004.txt,txt_rstb,1937,18
to be made from the facts as known at present. On,the,rstb_1937_0004.txt,txt_rstb,1937,18
qualifications. I mention the above facts to show that even in,the,rstb_1937_0008.txt,txt_rstb,1937,18
in Tables I—III. The outstanding facts are as follows: (1) No,the,rstb_1937_0008.txt,txt_rstb,1937,18
1.—at 15 m. depth. The facts that in the sea Chaetoceros,the,rstb_1937_0008.txt,txt_rstb,1937,18
"median walls of the coelomic facts (figs. 3 and 5, Plate",the,rstb_1937_0003.txt,txt_rstb,1937,18
"of regarding the labral coelom facts of Carausius morosus (W1ESMANN, 1926)",the,rstb_1937_0003.txt,txt_rstb,1937,18
"concludes that the “‘ preantennulary facts in Carausius, lying at the",the,rstb_1937_0003.txt,txt_rstb,1937,18
"clearly resemble the lower preantennulary facts of Hemimysis, Spider, etc.” ,",the,rstb_1937_0003.txt,txt_rstb,1937,18
the so- called labral coelomic facts of Carausius correspond to the,the,rstb_1937_0003.txt,txt_rstb,1937,18
the median line. All these facts dispose of Heymons’s objection quite,the,rstb_1937_0003.txt,txt_rstb,1937,18
manner on to the coelomic facts where they become associated with,the,rstb_1937_0003.txt,txt_rstb,1937,18
"of the genital ducts. These facts give support to the view,",the,rstb_1937_0003.txt,txt_rstb,1937,18
cells accompanying each moult. The facts given by Wacner are insufficient,the,rstb_1937_0007.txt,txt_rstb,1937,18
71) does not harmonize with facts observed during the post-embryonic development,the,rstb_1937_0007.txt,txt_rstb,1937,18
"In the light of the facts to be described below, the",the,rstb_1937_0013.txt,txt_rstb,1937,18
"between these conditions and the facts recorded above for Amphioxus, for",the,rstb_1937_0013.txt,txt_rstb,1937,18
hygroscopic tent of saliva. These facts seem to indicate that the,the,rstb_1937_0001.txt,txt_rstb,1937,18
is afforded by the following facts :— 1. The prothoracic spiracles,the,rstb_1937_0001.txt,txt_rstb,1937,18
"Naer’s conclusion and the ontogenetic facts for Haliotis, for in this",the,rstb_1937_0012.txt,txt_rstb,1937,18
"the existing theoretical views, such facts may be enlightening, for as",the,rstb_1937_0012.txt,txt_rstb,1937,18
possible bearing of the ontogenetic facts upon phylogenetic theories is discussed.,the,rstb_1937_0012.txt,txt_rstb,1937,18
"alternative methods of presenting the facts were considered. The first, that",the,rstb_1937_0014.txt,txt_rstb,1937,18
"appropriate section, so that the facts relating to any particular tissue",the,rstb_1937_0014.txt,txt_rstb,1937,18
in any way to the facts they are supposed to explain”’.,the,rstb_1937_0005.txt,txt_rstb,1937,18
"well defined, is small. These facts are tabu- lated at the",the,rstb_1937_0005.txt,txt_rstb,1937,18
the Australian brain does. These facts make one hopeful that a,the,rstb_1937_0005.txt,txt_rstb,1937,18
brain mentioned above. When the facts concerning the medial occipital region,the,rstb_1937_0005.txt,txt_rstb,1937,18
inferior is definitely established. The facts become striking by comparing the,the,rstb_1937_0005.txt,txt_rstb,1937,18
harmony with the above. Two facts so far stand out :,the,rstb_1937_0005.txt,txt_rstb,1937,18
races. Many interesting and suggestive facts emerge. In the lateral occipital,the,rstb_1937_0005.txt,txt_rstb,1937,18
this juncture. The most significant facts arising from the work of,the,rsta_1937_0007.txt,txt_rsta,1937,18
any apical system known. The facts seem to be that these,the,rstb_1938_0003.txt,txt_rstb,1938,18
"partial survival may occur, the facts indicate that the oviposition response",the,rstb_1938_0005.txt,txt_rstb,1938,18
virulent type of reaction. These facts led to the view ITS,the,rstb_1938_0004.txt,txt_rstb,1938,18
independent of mitotic activity. The facts so far recorded relating to,the,rstb_1938_0004.txt,txt_rstb,1938,18
the living and non-living. The facts are there: we must adjust,the,rstb_1938_0004.txt,txt_rstb,1938,18
"control. As regards Montserrat, the facts can be explained more simply",the,rstb_1938_0002.txt,txt_rstb,1938,18
"embayed valleys, because of the facts mentioned in the last paragraph,",the,rstb_1938_0002.txt,txt_rstb,1938,18
type (p. 54). From these facts we may make the further,the,rstb_1938_0002.txt,txt_rstb,1938,18
"hypotheses would account for the facts that, in Montserrat, pumice always",the,rstb_1938_0002.txt,txt_rstb,1938,18
"by alarming events. From the facts at our disposal, however, there",the,rstb_1938_0002.txt,txt_rstb,1938,18
the direction of Montserrat. These facts taken together suggest that the,the,rsta_1938_0002.txt,txt_rsta,1938,18
one of the most far-reaching facts with which modern cytology has,the,rstb_1939_0007.txt,txt_rstb,1939,18
