Context,Collocate,File,Directory,Year,Frequency Filter
impossible unless and until the facts regarding it are fully known.,the,rstb_1939_0007.txt,txt_rstb,1939,18
observations on the type of facts to be used. Certain subjects,the,rstb_1939_0007.txt,txt_rstb,1939,18
obvious conclusions arising from these facts are: (1) That the length,the,rstb_1939_0007.txt,txt_rstb,1939,18
"seems however, clear from the facts for Osmunda. { These results",the,rstb_1939_0007.txt,txt_rstb,1939,18
"in the discussion, but no facts have so far been found",the,rstb_1939_0007.txt,txt_rstb,1939,18
In the light of the facts presented above it would appear,the,rstb_1939_0007.txt,txt_rstb,1939,18
here to account for the facts of chromosome elasticity. It should,the,rstb_1939_0007.txt,txt_rstb,1939,18
possible the validity of the facts which have been used. This,the,rstb_1939_0007.txt,txt_rstb,1939,18
seemed profitable to publish the facts as they stand in the,the,rstb_1939_0007.txt,txt_rstb,1939,18
It is therefore to the facts in this paper rather than,the,rstb_1939_0007.txt,txt_rstb,1939,18
"and ammoniated smears), the following facts among others have been elucidated:",the,rstb_1939_0007.txt,txt_rstb,1939,18
at strepsitene. II. From these facts it is postulated that the,the,rstb_1939_0007.txt,txt_rstb,1939,18
"Stempell (1899) and of the facts presented in this paper, to",the,rstb_1939_0005.txt,txt_rstb,1939,18
"is absent, that the kidney facts of the two sides do",the,rstb_1939_0005.txt,txt_rstb,1939,18
made to sum up the facts which have definitely emerged for,the,rsta_1939_0009.txt,txt_rsta,1939,18
"here included, however, establishes the facts more definitely. The last row",the,rsta_1939_0009.txt,txt_rsta,1939,18
One of the most striking facts which emerge is that when,the,rsta_1939_0009.txt,txt_rsta,1939,18
Better agreement with the experimental facts is obtained with the empirical,the,rsta_1939_0004.txt,txt_rsta,1939,18
particularly successful in correlating the facts when a liquid passes to,the,rsta_1939_0004.txt,txt_rsta,1939,18
"sufficient to represent the observed facts with high accuracy, so that",the,rsta_1939_0004.txt,txt_rsta,1939,18
not agree with the experimental facts obtained from compressibility measurements on,the,rsta_1939_0004.txt,txt_rsta,1939,18
One of the most important facts still to be discovered about,the,rstb_1940_0004.txt,txt_rstb,1940,18
to suggest that the nasal facts may have been situated in,the,rstb_1940_0004.txt,txt_rstb,1940,18
necessary to re-examine both the facts and the lines of reasoning.,the,rstb_1940_0002.txt,txt_rstb,1940,18
the presence of Trias. These facts strongly suggest that the Lower,the,rsta_1940_0008.txt,txt_rsta,1940,18
the corresponding simple form. These facts suggest that we have here,the,rstb_1941_0001.txt,txt_rstb,1941,18
"required for melanin formation, the facts support the idea that we",the,rstb_1941_0001.txt,txt_rstb,1941,18
in small sori. The pollen facts are shaped as in the,the,rstb_1941_0004.txt,txt_rstb,1941,18
noticed. The sporangia are finger-shaped facts about 1-2 x 0-7 mm.;,the,rstb_1941_0004.txt,txt_rstb,1941,18
"Cycads.) Although all the pollen facts had dehisced, the pollen was",the,rstb_1941_0004.txt,txt_rstb,1941,18
fertile and also provided new facts regarding the branching of the,the,rstb_1942_0001.txt,txt_rstb,1942,18
which will fit the known facts is that the precociously developing,the,rstb_1942_0002.txt,txt_rstb,1942,18
an explanation for several peculiar facts about the activities of young,the,rstb_1942_0002.txt,txt_rstb,1942,18
"Williamsoniella, but with the new facts much of this becomes obsolete.",the,rstb_1944_0001.txt,txt_rstb,1944,18
of the appendages and pollen facts lying above have been removed,the,rstb_1944_0001.txt,txt_rstb,1944,18
"faintly marked outlines. The pollen facts are distinctly cutinized, their walls",the,rstb_1944_0001.txt,txt_rstb,1944,18
show no definite cells. The facts appear to have opened by,the,rstb_1944_0001.txt,txt_rstb,1944,18
"furrow lie scattered in pollen facts and over the sporophylls, and",the,rstb_1944_0001.txt,txt_rstb,1944,18
"detail, and concerned with the facts that in Callorhynchus, (i) there",the,rstb_1935_0001.txt,txt_rstb,1935,18
grow dorsally between the nasal facts instead of laterally beneath the,the,rstb_1935_0001.txt,txt_rstb,1935,18
of laterally beneath the nasal facts as in other forms. Here,the,rstb_1935_0001.txt,txt_rstb,1935,18
The following explanation of these facts may be suggested. The surface,the,rstb_1935_0007.txt,txt_rstb,1935,18
"quite possible that, if the facts were more fully known, this",the,rstb_1935_0007.txt,txt_rstb,1935,18
"of the diatom. Taking these facts into con- sideration, it would",the,rstb_1935_0008.txt,txt_rstb,1935,18
the prototroch a pair of facts is formed by invaginations of,the,rstb_1935_0008.txt,txt_rstb,1935,18
ectoderm and form small spherical facts at the sides of the,the,rstb_1935_0008.txt,txt_rstb,1935,18
VULGATA 113 the anterior mantle facts at each side of the,the,rstb_1935_0008.txt,txt_rstb,1935,18
and the walls of the facts become thinner. No trace can,the,rstb_1935_0008.txt,txt_rstb,1935,18
"as had been thought. The facts that, in addition to reputed",the,rstb_1935_0011.txt,txt_rstb,1935,18
different breeds. “From the foregoing facts we see in how astonishing,the,rstb_1935_0011.txt,txt_rstb,1935,18
"(1931), who shows that the facts are consistent with the theory",the,rstb_1935_0011.txt,txt_rstb,1935,18
disproved not only by the facts already cited in Oenothera but,the,rstb_1935_0012.txt,txt_rstb,1935,18
and epididymides descend into scrotal facts at the onset of the,the,rstb_1935_0016.txt,txt_rstb,1935,18
rapidity necessary in regeneration. These facts tend to show that the,the,rstb_1935_0014.txt,txt_rstb,1935,18
"conclusions are supported by the facts of regeneration in other phyla,",the,rstb_1935_0014.txt,txt_rstb,1935,18
relatively indifferent cell types. The facts so far presented throw light,the,rstb_1935_0014.txt,txt_rstb,1935,18
"partly atrophied organ. With these facts in mind, the special granules",the,rstb_1935_0010.txt,txt_rstb,1935,18
with tissues undergoing calcification. The facts that Turcutnr does not appear,the,rstb_1935_0010.txt,txt_rstb,1935,18
accumulation of yolk are the facts that such accumulation above the,the,rstb_1935_0013.txt,txt_rstb,1935,18
each side as the peribranchial facts come into contact with the,the,rstb_1935_0013.txt,txt_rstb,1935,18
"the fusion of the peribranchial facts to form the atrium, although",the,rstb_1935_0013.txt,txt_rstb,1935,18
IN TUNICATE DEVELOPMENT The peribranchial facts invaginate separately and later fuse,the,rstb_1935_0013.txt,txt_rstb,1935,18
"the other Didemnids, the peribranchial facts invaginate separately, but at an",the,rstb_1935_0013.txt,txt_rstb,1935,18
"Taken as a whole, the facts presented in the preceding sections",the,rstb_1935_0013.txt,txt_rstb,1935,18
This is confirmed by the facts recorded in a previous study,the,rstb_1935_0013.txt,txt_rstb,1935,18
"guard against carbon dioxide. The facts were made of nitro-cotton, and",the,rsta_1935_0018.txt,txt_rsta,1935,18
"The capillary tubes, with the facts depending from them, were immersed",the,rsta_1935_0018.txt,txt_rsta,1935,18
in order to elucidate certain facts revealed during the course of,the,rsta_1935_0013.txt,txt_rsta,1935,18
"6, and 7. The following facts are outstanding. Aldehydes.—With Shell petrol",the,rsta_1935_0013.txt,txt_rsta,1935,18
"the “‘ peroxides,” certain experimental facts indicated that organic peroxides might",the,rsta_1935_0013.txt,txt_rsta,1935,18
"in the engine. , These facts and all the experiments described",the,rsta_1935_0013.txt,txt_rsta,1935,18
"doubtfulf ; but taking all facts into consideration, the first process",the,rsta_1935_0013.txt,txt_rsta,1935,18
to consider some of those facts which bear on S the,the,rsta_1935_0013.txt,txt_rsta,1935,18
to be reconciled with the facts which ’ have been set,the,rsta_1935_0013.txt,txt_rsta,1935,18
the openings of the perivisceral facts (epicardia) into the pharynx ;,the,rstb_1936_0002.txt,txt_rstb,1936,18
showing the pair of perivisceral facts or epicardia descending around the,the,rstb_1936_0002.txt,txt_rstb,1936,18
"sac or pharynx, the two facts fuse to form a single",the,rstb_1936_0002.txt,txt_rstb,1936,18
genus the epicardia or perivisceral facts are so small that they,the,rstb_1936_0002.txt,txt_rstb,1936,18
"right and left, the perivisceral facts or epicardia, as they exist",the,rstb_1936_0002.txt,txt_rstb,1936,18
"of development as the epicardial facts in Ciona. Moreover, the renal",the,rstb_1936_0002.txt,txt_rstb,1936,18
the transformation of the perivisceral facts or epicardia into a renal,the,rstb_1936_0002.txt,txt_rstb,1936,18
"openings are lost, the two facts fuse to form a single",the,rstb_1936_0002.txt,txt_rstb,1936,18
"the mammalian vomer, and the facts now known about the structure",the,rstb_1936_0001.txt,txt_rstb,1936,18
"is in agreement with the facts observed by von Kocu (1882,",the,rstb_1936_0007.txt,txt_rstb,1936,18
the log difference. The following facts may be noted : (a),the,rstb_1936_0010.txt,txt_rstb,1936,18
"ROONWAL and the preantennary coelom facts in Carausius (Dixippus) morosus (Orthoptera,",the,rstb_1936_0011.txt,txt_rstb,1936,18
offers striking proof of the facts disputed by previous authors that,the,rstb_1936_0006.txt,txt_rstb,1936,18
are invariably crowded. The two facts of (a) the barbs on,the,rstb_1936_0006.txt,txt_rstb,1936,18
state briefly the main known facts concerning the part played by,the,rstb_1936_0012.txt,txt_rstb,1936,18
is no clear evidence. The facts have been well presented by,the,rstb_1936_0012.txt,txt_rstb,1936,18
factors. Murpuy also records some facts about the periodic breeding of,the,rstb_1936_0012.txt,txt_rstb,1936,18
"is, however, contrary to the facts presented in this paper,* unless",the,rstb_1937_0010.txt,txt_rstb,1937,18
of the valve. With these facts in mind we are in,the,rstb_1937_0002.txt,txt_rstb,1937,18
as a series of small facts sunk within the epithelium. Their,the,rstb_1937_0011.txt,txt_rstb,1937,18
"stress, e.g. in the style facts noted above, and here such",the,rstb_1937_0011.txt,txt_rstb,1937,18
which corroborate and extend the facts ascertained from the three specimens,the,rstb_1937_0004.txt,txt_rstb,1937,18
any discussion here of the facts described above. They afford the,the,rstb_1937_0004.txt,txt_rstb,1937,18
is beyond my competence. The facts ascertained regarding the flora will,the,rstb_1937_0004.txt,txt_rstb,1937,18
seems highly improbable. The further facts now known regarding the plant,the,rstb_1937_0004.txt,txt_rstb,1937,18
to be made from the facts as known at present. On,the,rstb_1937_0004.txt,txt_rstb,1937,18
qualifications. I mention the above facts to show that even in,the,rstb_1937_0008.txt,txt_rstb,1937,18
in Tables I—III. The outstanding facts are as follows: (1) No,the,rstb_1937_0008.txt,txt_rstb,1937,18
1.—at 15 m. depth. The facts that in the sea Chaetoceros,the,rstb_1937_0008.txt,txt_rstb,1937,18
"median walls of the coelomic facts (figs. 3 and 5, Plate",the,rstb_1937_0003.txt,txt_rstb,1937,18
"of regarding the labral coelom facts of Carausius morosus (W1ESMANN, 1926)",the,rstb_1937_0003.txt,txt_rstb,1937,18
"concludes that the “‘ preantennulary facts in Carausius, lying at the",the,rstb_1937_0003.txt,txt_rstb,1937,18
"clearly resemble the lower preantennulary facts of Hemimysis, Spider, etc.” ,",the,rstb_1937_0003.txt,txt_rstb,1937,18
the so- called labral coelomic facts of Carausius correspond to the,the,rstb_1937_0003.txt,txt_rstb,1937,18
the median line. All these facts dispose of Heymons’s objection quite,the,rstb_1937_0003.txt,txt_rstb,1937,18
manner on to the coelomic facts where they become associated with,the,rstb_1937_0003.txt,txt_rstb,1937,18
"of the genital ducts. These facts give support to the view,",the,rstb_1937_0003.txt,txt_rstb,1937,18
cells accompanying each moult. The facts given by Wacner are insufficient,the,rstb_1937_0007.txt,txt_rstb,1937,18
71) does not harmonize with facts observed during the post-embryonic development,the,rstb_1937_0007.txt,txt_rstb,1937,18
"In the light of the facts to be described below, the",the,rstb_1937_0013.txt,txt_rstb,1937,18
"between these conditions and the facts recorded above for Amphioxus, for",the,rstb_1937_0013.txt,txt_rstb,1937,18
hygroscopic tent of saliva. These facts seem to indicate that the,the,rstb_1937_0001.txt,txt_rstb,1937,18
is afforded by the following facts :— 1. The prothoracic spiracles,the,rstb_1937_0001.txt,txt_rstb,1937,18
"Naer’s conclusion and the ontogenetic facts for Haliotis, for in this",the,rstb_1937_0012.txt,txt_rstb,1937,18
"the existing theoretical views, such facts may be enlightening, for as",the,rstb_1937_0012.txt,txt_rstb,1937,18
possible bearing of the ontogenetic facts upon phylogenetic theories is discussed.,the,rstb_1937_0012.txt,txt_rstb,1937,18
"alternative methods of presenting the facts were considered. The first, that",the,rstb_1937_0014.txt,txt_rstb,1937,18
"appropriate section, so that the facts relating to any particular tissue",the,rstb_1937_0014.txt,txt_rstb,1937,18
in any way to the facts they are supposed to explain”’.,the,rstb_1937_0005.txt,txt_rstb,1937,18
"well defined, is small. These facts are tabu- lated at the",the,rstb_1937_0005.txt,txt_rstb,1937,18
the Australian brain does. These facts make one hopeful that a,the,rstb_1937_0005.txt,txt_rstb,1937,18
brain mentioned above. When the facts concerning the medial occipital region,the,rstb_1937_0005.txt,txt_rstb,1937,18
inferior is definitely established. The facts become striking by comparing the,the,rstb_1937_0005.txt,txt_rstb,1937,18
harmony with the above. Two facts so far stand out :,the,rstb_1937_0005.txt,txt_rstb,1937,18
races. Many interesting and suggestive facts emerge. In the lateral occipital,the,rstb_1937_0005.txt,txt_rstb,1937,18
this juncture. The most significant facts arising from the work of,the,rsta_1937_0007.txt,txt_rsta,1937,18
any apical system known. The facts seem to be that these,the,rstb_1938_0003.txt,txt_rstb,1938,18
"partial survival may occur, the facts indicate that the oviposition response",the,rstb_1938_0005.txt,txt_rstb,1938,18
virulent type of reaction. These facts led to the view ITS,the,rstb_1938_0004.txt,txt_rstb,1938,18
independent of mitotic activity. The facts so far recorded relating to,the,rstb_1938_0004.txt,txt_rstb,1938,18
the living and non-living. The facts are there: we must adjust,the,rstb_1938_0004.txt,txt_rstb,1938,18
"control. As regards Montserrat, the facts can be explained more simply",the,rstb_1938_0002.txt,txt_rstb,1938,18
"embayed valleys, because of the facts mentioned in the last paragraph,",the,rstb_1938_0002.txt,txt_rstb,1938,18
type (p. 54). From these facts we may make the further,the,rstb_1938_0002.txt,txt_rstb,1938,18
"hypotheses would account for the facts that, in Montserrat, pumice always",the,rstb_1938_0002.txt,txt_rstb,1938,18
"by alarming events. From the facts at our disposal, however, there",the,rstb_1938_0002.txt,txt_rstb,1938,18
the direction of Montserrat. These facts taken together suggest that the,the,rsta_1938_0002.txt,txt_rsta,1938,18
one of the most far-reaching facts with which modern cytology has,the,rstb_1939_0007.txt,txt_rstb,1939,18
impossible unless and until the facts regarding it are fully known.,the,rstb_1939_0007.txt,txt_rstb,1939,18
observations on the type of facts to be used. Certain subjects,the,rstb_1939_0007.txt,txt_rstb,1939,18
obvious conclusions arising from these facts are: (1) That the length,the,rstb_1939_0007.txt,txt_rstb,1939,18
"seems however, clear from the facts for Osmunda. { These results",the,rstb_1939_0007.txt,txt_rstb,1939,18
"in the discussion, but no facts have so far been found",the,rstb_1939_0007.txt,txt_rstb,1939,18
In the light of the facts presented above it would appear,the,rstb_1939_0007.txt,txt_rstb,1939,18
here to account for the facts of chromosome elasticity. It should,the,rstb_1939_0007.txt,txt_rstb,1939,18
possible the validity of the facts which have been used. This,the,rstb_1939_0007.txt,txt_rstb,1939,18
seemed profitable to publish the facts as they stand in the,the,rstb_1939_0007.txt,txt_rstb,1939,18
It is therefore to the facts in this paper rather than,the,rstb_1939_0007.txt,txt_rstb,1939,18
"and ammoniated smears), the following facts among others have been elucidated:",the,rstb_1939_0007.txt,txt_rstb,1939,18
at strepsitene. II. From these facts it is postulated that the,the,rstb_1939_0007.txt,txt_rstb,1939,18
"Stempell (1899) and of the facts presented in this paper, to",the,rstb_1939_0005.txt,txt_rstb,1939,18
"is absent, that the kidney facts of the two sides do",the,rstb_1939_0005.txt,txt_rstb,1939,18
made to sum up the facts which have definitely emerged for,the,rsta_1939_0009.txt,txt_rsta,1939,18
"here included, however, establishes the facts more definitely. The last row",the,rsta_1939_0009.txt,txt_rsta,1939,18
One of the most striking facts which emerge is that when,the,rsta_1939_0009.txt,txt_rsta,1939,18
Better agreement with the experimental facts is obtained with the empirical,the,rsta_1939_0004.txt,txt_rsta,1939,18
particularly successful in correlating the facts when a liquid passes to,the,rsta_1939_0004.txt,txt_rsta,1939,18
"sufficient to represent the observed facts with high accuracy, so that",the,rsta_1939_0004.txt,txt_rsta,1939,18
not agree with the experimental facts obtained from compressibility measurements on,the,rsta_1939_0004.txt,txt_rsta,1939,18
One of the most important facts still to be discovered about,the,rstb_1940_0004.txt,txt_rstb,1940,18
to suggest that the nasal facts may have been situated in,the,rstb_1940_0004.txt,txt_rstb,1940,18
necessary to re-examine both the facts and the lines of reasoning.,the,rstb_1940_0002.txt,txt_rstb,1940,18
the presence of Trias. These facts strongly suggest that the Lower,the,rsta_1940_0008.txt,txt_rsta,1940,18
the corresponding simple form. These facts suggest that we have here,the,rstb_1941_0001.txt,txt_rstb,1941,18
"required for melanin formation, the facts support the idea that we",the,rstb_1941_0001.txt,txt_rstb,1941,18
in small sori. The pollen facts are shaped as in the,the,rstb_1941_0004.txt,txt_rstb,1941,18
noticed. The sporangia are finger-shaped facts about 1-2 x 0-7 mm.;,the,rstb_1941_0004.txt,txt_rstb,1941,18
"Cycads.) Although all the pollen facts had dehisced, the pollen was",the,rstb_1941_0004.txt,txt_rstb,1941,18
fertile and also provided new facts regarding the branching of the,the,rstb_1942_0001.txt,txt_rstb,1942,18
which will fit the known facts is that the precociously developing,the,rstb_1942_0002.txt,txt_rstb,1942,18
an explanation for several peculiar facts about the activities of young,the,rstb_1942_0002.txt,txt_rstb,1942,18
"Williamsoniella, but with the new facts much of this becomes obsolete.",the,rstb_1944_0001.txt,txt_rstb,1944,18
of the appendages and pollen facts lying above have been removed,the,rstb_1944_0001.txt,txt_rstb,1944,18
"faintly marked outlines. The pollen facts are distinctly cutinized, their walls",the,rstb_1944_0001.txt,txt_rstb,1944,18
show no definite cells. The facts appear to have opened by,the,rstb_1944_0001.txt,txt_rstb,1944,18
"furrow lie scattered in pollen facts and over the sporophylls, and",the,rstb_1944_0001.txt,txt_rstb,1944,18
"as had been thought. The facts that, in addition to reputed",to,rstb_1935_0011.txt,txt_rstb,1935,18
rapidity necessary in regeneration. These facts tend to show that the,to,rstb_1935_0014.txt,txt_rstb,1935,18
"the fusion of the peribranchial facts to form the atrium, although",to,rstb_1935_0013.txt,txt_rstb,1935,18
in order to elucidate certain facts revealed during the course of,to,rsta_1935_0013.txt,txt_rsta,1935,18
to consider some of those facts which bear on S the,to,rsta_1935_0013.txt,txt_rsta,1935,18
to be reconciled with the facts which ’ have been set,to,rsta_1935_0013.txt,txt_rsta,1935,18
"sac or pharynx, the two facts fuse to form a single",to,rstb_1936_0002.txt,txt_rstb,1936,18
"openings are lost, the two facts fuse to form a single",to,rstb_1936_0002.txt,txt_rstb,1936,18
"to those after. With these facts as a basis, there has",to,rstb_1936_0010.txt,txt_rstb,1936,18
"is, however, contrary to the facts presented in this paper,* unless",to,rstb_1937_0010.txt,txt_rstb,1937,18
to be made from the facts as known at present. On,to,rstb_1937_0004.txt,txt_rstb,1937,18
has added a number of facts of botanical interest to our,to,rstb_1937_0004.txt,txt_rstb,1937,18
qualifications. I mention the above facts to show that even in,to,rstb_1937_0008.txt,txt_rstb,1937,18
the so- called labral coelomic facts of Carausius correspond to the,to,rstb_1937_0003.txt,txt_rstb,1937,18
manner on to the coelomic facts where they become associated with,to,rstb_1937_0003.txt,txt_rstb,1937,18
"of the genital ducts. These facts give support to the view,",to,rstb_1937_0003.txt,txt_rstb,1937,18
"to his erroneous interpretation of facts than to reality, as he",to,rstb_1937_0007.txt,txt_rstb,1937,18
"In the light of the facts to be described below, the",to,rstb_1937_0013.txt,txt_rstb,1937,18
hygroscopic tent of saliva. These facts seem to indicate that the,to,rstb_1937_0001.txt,txt_rstb,1937,18
"appropriate section, so that the facts relating to any particular tissue",to,rstb_1937_0014.txt,txt_rstb,1937,18
in any way to the facts they are supposed to explain”’.,to,rstb_1937_0005.txt,txt_rstb,1937,18
one another in echelon. These facts were patent to both GunnincHaAM,to,rstb_1937_0005.txt,txt_rstb,1937,18
any apical system known. The facts seem to be that these,to,rstb_1938_0003.txt,txt_rstb,1938,18
virulent type of reaction. These facts led to the view ITS,to,rstb_1938_0004.txt,txt_rstb,1938,18
have brought to light new facts of importance. In- fection with,to,rstb_1938_0004.txt,txt_rstb,1938,18
independent of mitotic activity. The facts so far recorded relating to,to,rstb_1938_0004.txt,txt_rstb,1938,18
observations on the type of facts to be used. Certain subjects,to,rstb_1939_0007.txt,txt_rstb,1939,18
clear some very simple geometrical facts relating to spiral objects in,to,rstb_1939_0007.txt,txt_rstb,1939,18
no significant basis of new facts seems to underlie such a,to,rstb_1939_0007.txt,txt_rstb,1939,18
here to account for the facts of chromosome elasticity. It should,to,rstb_1939_0007.txt,txt_rstb,1939,18
"and Sax, but gave no facts of any kind to support",to,rstb_1939_0007.txt,txt_rstb,1939,18
seemed profitable to publish the facts as they stand in the,to,rstb_1939_0007.txt,txt_rstb,1939,18
It is therefore to the facts in this paper rather than,to,rstb_1939_0007.txt,txt_rstb,1939,18
"Stempell (1899) and of the facts presented in this paper, to",to,rstb_1939_0005.txt,txt_rstb,1939,18
made to sum up the facts which have definitely emerged for,to,rsta_1939_0009.txt,txt_rsta,1939,18
particularly successful in correlating the facts when a liquid passes to,to,rsta_1939_0004.txt,txt_rsta,1939,18
"sufficient to represent the observed facts with high accuracy, so that",to,rsta_1939_0004.txt,txt_rsta,1939,18
One of the most important facts still to be discovered about,to,rstb_1940_0004.txt,txt_rstb,1940,18
to suggest that the nasal facts may have been situated in,to,rstb_1940_0004.txt,txt_rstb,1940,18
necessary to re-examine both the facts and the lines of reasoning.,to,rstb_1940_0002.txt,txt_rstb,1940,18
are crowded with sessile pollen facts which appear to be arranged,to,rstb_1941_0004.txt,txt_rstb,1941,18
show no definite cells. The facts appear to have opened by,to,rstb_1944_0001.txt,txt_rstb,1944,18
"detail, and concerned with the facts that in Callorhynchus, (i) there",in,rstb_1935_0001.txt,txt_rstb,1935,18
of laterally beneath the nasal facts as in other forms. Here,in,rstb_1935_0001.txt,txt_rstb,1935,18
"first put forward, few special facts could be adduced in its",in,rstb_1935_0011.txt,txt_rstb,1935,18
"as had been thought. The facts that, in addition to reputed",in,rstb_1935_0011.txt,txt_rstb,1935,18
different breeds. “From the foregoing facts we see in how astonishing,in,rstb_1935_0011.txt,txt_rstb,1935,18
disproved not only by the facts already cited in Oenothera but,in,rstb_1935_0012.txt,txt_rstb,1935,18
rapidity necessary in regeneration. These facts tend to show that the,in,rstb_1935_0014.txt,txt_rstb,1935,18
"conclusions are supported by the facts of regeneration in other phyla,",in,rstb_1935_0014.txt,txt_rstb,1935,18
are at variance with well-established facts in other secretory cells. VOL.,in,rstb_1935_0010.txt,txt_rstb,1935,18
"partly atrophied organ. With these facts in mind, the special granules",in,rstb_1935_0010.txt,txt_rstb,1935,18
IN TUNICATE DEVELOPMENT The peribranchial facts invaginate separately and later fuse,in,rstb_1935_0013.txt,txt_rstb,1935,18
"Taken as a whole, the facts presented in the preceding sections",in,rstb_1935_0013.txt,txt_rstb,1935,18
This is confirmed by the facts recorded in a previous study,in,rstb_1935_0013.txt,txt_rstb,1935,18
in order to elucidate certain facts revealed during the course of,in,rsta_1935_0013.txt,txt_rsta,1935,18
"in the engine. , These facts and all the experiments described",in,rsta_1935_0013.txt,txt_rsta,1935,18
"of development as the epicardial facts in Ciona. Moreover, the renal",in,rstb_1936_0002.txt,txt_rstb,1936,18
"is in agreement with the facts observed by von Kocu (1882,",in,rstb_1936_0007.txt,txt_rstb,1936,18
"Rugosa, and explains many puzzling facts in other genera. Morphology and",in,rstb_1936_0007.txt,txt_rstb,1936,18
"ROONWAL and the preantennary coelom facts in Carausius (Dixippus) morosus (Orthoptera,",in,rstb_1936_0011.txt,txt_rstb,1936,18
"In view of all these facts it is apparent, as Dopps",in,rstb_1936_0012.txt,txt_rstb,1936,18
DisPLAy In view of such facts as these it is easy,in,rstb_1936_0012.txt,txt_rstb,1936,18
"is, however, contrary to the facts presented in this paper,* unless",in,rstb_1937_0010.txt,txt_rstb,1937,18
