Context,Collocate,File,Directory,Year,Frequency Filter
in her [there being two facts did not prevent the total.,the,rstl_1784_0040.txt,txt_rstl,1784,9
of the ſtraw-coloured (ilk. ©. Facts ſimilar to theſe are obſervable,the,rstl_1786_0016.txt,txt_rstl,1786,9
"ſhall take care that the facts ſhall be faithfully deſcribed, and",the,rstl_1787_0015.txt,txt_rstl,1787,9
"is by the accumulation of facts f this kind, and efpecially",the,rstl_1788_0020.txt,txt_rstl,1788,9
"So ""2b of the above-mentioned faCts were obſerved in the Fear",the,rstl_1788_0011.txt,txt_rstl,1788,9
