Context,Collocate,File,Directory,Year,Frequency Filter
less remarkable than are the facts which they combine to indi-,the,rstl_1852_0009.txt,txt_rstl,1852,18
are bound to receive the facts which may appear to indicate,the,rstl_1852_0009.txt,txt_rstl,1852,18
"epoch is traceable. Now the facts of the solar spots, as",the,rstl_1852_0009.txt,txt_rstl,1852,18
"with this subject, because the facts I have ascertained regarding it",the,rstl_1852_0001.txt,txt_rstl,1852,18
at a considerable distance. The facts noticed by these authors are,the,rstl_1852_0001.txt,txt_rstl,1852,18
"a few scattered spermatozoa, These facts are the developed spermatophora+, and",the,rstl_1852_0014.txt,txt_rstl,1852,18
Itis quite/possible that when the facts shall-have|been/more precisely/Jetermined; it may prove'that-neither,the,rstl_1853_0019.txt,txt_rstl,1853,18
the grey substance. From these facts he calcu- lates that the,the,rstl_1853_0013.txt,txt_rstl,1853,18
signification of several of the facts with which we have thus,the,rstl_1853_0015.txt,txt_rstl,1853,18
"bodies, corresponding with the fixed facts of the Tubulariade, is also",the,rstl_1853_0015.txt,txt_rstl,1853,18
now compare the fixed ovigerous facts of the marine genera. Tt,the,rstl_1853_0015.txt,txt_rstl,1853,18
"In the marine Tubulariadae, the facts in question consist; of a",the,rstl_1853_0015.txt,txt_rstl,1853,18
one'of the most'striking of the facts which he has 86 skilfully,the,rstl_1853_0015.txt,txt_rstl,1853,18
"bodies produced in the fixed facts only as © bulbille,” by",the,rstl_1853_0015.txt,txt_rstl,1853,18
bodies contained in the fixed facts are undoubtedly not gemm@ but,the,rstl_1853_0015.txt,txt_rstl,1853,18
The conelusion to which the facts s0nght to be demonstrated in,the,rstl_1853_0015.txt,txt_rstl,1853,18
"Campanularia, than with the ovigerous facts of the Tubu- V lariade.",the,rstl_1853_0015.txt,txt_rstl,1853,18
"from, that of the ovigerous facts of Coryne, 1. c. 382",the,rstl_1853_0015.txt,txt_rstl,1853,18
"of the embryo; the enclosing facts have become ruptured, and the",the,rstl_1853_0015.txt,txt_rstl,1853,18
of a periodical character: the facts appear to be important materials,the,rstl_1853_0006.txt,txt_rstl,1853,18
"the plate, we learn many facts regarding the temperature at Toronto,",the,rstl_1853_0005.txt,txt_rstl,1853,18
"con- Sideration of the foregoing facts will, we think, lead to",the,rstl_1853_0004.txt,txt_rstl,1853,18
"A consideration of the foregoing facts will, we think, lead to",the,rstl_1853_0004.txt,txt_rstl,1853,18
a due regard to the facts presented by the development of,the,rstl_1853_0002.txt,txt_rstl,1853,18
it. The parietes of these facts are glandular. A long ©,the,rstl_1853_0002.txt,txt_rstl,1853,18
to bring into prominence some facts in the anatomy of the,the,rstl_1853_0002.txt,txt_rstl,1853,18
667). Again :—* From the facts which have just been stated,the,rstl_1853_0002.txt,txt_rstl,1853,18
supracesophageal position of the auditory facts in Nudibranchiatata merely arises from,the,rstl_1853_0002.txt,txt_rstl,1853,18
"is one of the earliest facts in molluscons development, and it",the,rstl_1853_0002.txt,txt_rstl,1853,18
circulation in the Mollusca. The facts I MR. T. H. HUXLEY,the,rstl_1853_0002.txt,txt_rstl,1853,18
according to the species. These facts are well shown both in,the,rstl_1853_0010.txt,txt_rstl,1853,18
of maturity in both. These facts seem to lead to the,the,rstl_1853_0010.txt,txt_rstl,1853,18
fair then toinfer from these facts that the completion of the,the,rstl_1853_0010.txt,txt_rstl,1853,18
embryo was produced. S These facts then support the statement already,the,rstl_1853_0010.txt,txt_rstl,1853,18
"well be supposed that the facts just mentioned were exceedingly puzzling,",the,rstl_1853_0010.txt,txt_rstl,1853,18
Invertebrata. A comparison of the facts in the two divisions of,the,rstl_1853_0010.txt,txt_rstl,1853,18
agent in all animals. The facts already mentioned coincide with this,the,rstl_1853_0010.txt,txt_rstl,1853,18
to be drawn from the facts of natural impregnation in the,the,rstl_1853_0010.txt,txt_rstl,1853,18
force in the spermatozoon. The facts now 8tated of penetration by,the,rstl_1853_0010.txt,txt_rstl,1853,18
"fecundation, we have, in the facts now referred to, much reason",the,rstl_1853_0010.txt,txt_rstl,1853,18
"tions, together with the chief facts connected with the occurrence of",the,rstl_1854_0014.txt,txt_rstl,1854,18
organs of respiration. From the facts which I have already succeeded,the,rstl_1854_0014.txt,txt_rstl,1854,18
"also cases of phthisis. These facts possess the greatest interest, and",the,rstl_1854_0014.txt,txt_rstl,1854,18
then the whole of the facts and observations recorded in this,the,rstl_1854_0014.txt,txt_rstl,1854,18
accurate conclusion that the observed facts may justify. For all practical,the,rstl_1854_0013.txt,txt_rstl,1854,18
all of which the same facts could be noted. The segmentation,the,rstl_1854_0009.txt,txt_rstl,1854,18
"fecundating fluid. . From the facts stated above, and before detailed",the,rstl_1854_0009.txt,txt_rstl,1854,18
"these were confirmatory of the facts before stated, as the variation",the,rstl_1854_0009.txt,txt_rstl,1854,18
the same metal. The same facts deprive the latter part of,the,rstl_1854_0001.txt,txt_rstl,1854,18
to occasion osmose. The newer facts to be related also increase,the,rstl_1854_0008.txt,txt_rstl,1854,18
similar degree of diffusibility*. The facts appear to afford a strong,the,rstl_1854_0008.txt,txt_rstl,1854,18
tried in the search for facts which might throw light on,the,rstl_1854_0008.txt,txt_rstl,1854,18
"its explanation, with many other facts of the subject, till fuller",the,rstl_1854_0008.txt,txt_rstl,1854,18
"the Nautilus, that the auditory facts of the ex- tinct Tetrabranchiata",the,rstl_1855_0012.txt,txt_rstl,1855,18
spoken of its length. These facts will explain the results of,the,rstl_1855_0010.txt,txt_rstl,1855,18
"to complete, and as the facts elicited in reference to cast",the,rstl_1855_0009.txt,txt_rstl,1855,18
1855. Ir is among the facts in chemical science which admit,the,rstl_1855_0008.txt,txt_rstl,1855,18
which appears to represent the facts with a con- siderable degree,the,rstl_1855_0002.txt,txt_rstl,1855,18
law here deduced represents the facts of the case. The value,the,rstl_1855_0002.txt,txt_rstl,1855,18
does not sufficiently express the facts to say that the bar,the,rstl_1855_0001.txt,txt_rstl,1855,18
the same agent. Supposing these facts to have been known to,the,rstl_1855_0001.txt,txt_rstl,1855,18
the manner in which these facts have been explained. © La,the,rstl_1855_0001.txt,txt_rstl,1855,18
a more grave one. The facts are as follows :— the,the,rstl_1855_0001.txt,txt_rstl,1855,18
from pole to pole. The facts observed by M. MaTTEvcer seem,the,rstl_1855_0001.txt,txt_rstl,1855,18
"M. MarTevecr, and converted the facts upon which the objection is",the,rstl_1855_0001.txt,txt_rstl,1855,18
critical review of all the facts of the case which at,the,rstl_1855_0017.txt,txt_rstl,1855,18
"proved, by the comparison of facts then to be addaced from",the,rstl_1856_0027.txt,txt_rstl,1856,18
"now, we review the principal facts relating to the structure of",the,rstl_1856_0027.txt,txt_rstl,1856,18
"growth; on which inquiry, the facts which I have now brought",the,rstl_1856_0027.txt,txt_rstl,1856,18
based on an order of facts relating to the economy of,the,rstl_1856_0027.txt,txt_rstl,1856,18
by critical examinations of the facts already accumulated. These menoirs I,the,rstl_1856_0020.txt,txt_rstl,1856,18
LIONEL BEALE ON THE These facts appear to me to militate,the,rstl_1856_0017.txt,txt_rstl,1856,18
"any other explanation of the facts I have observed, or of",the,rstl_1856_0017.txt,txt_rstl,1856,18
"which presumption was corroborated by facts adduced in the £ame communication,",the,rstl_1856_0016.txt,txt_rstl,1856,18
conclusively established by the following facts :—In all the spirit-specimens which,the,rstl_1856_0012.txt,txt_rstl,1856,18
"are in harmony with the facts of observation. All the Orbitolites,",the,rstl_1856_0012.txt,txt_rstl,1856,18
"kind, may be cited the facts mentioned by Dr. J. D.",the,rstl_1856_0012.txt,txt_rstl,1856,18
inch to crush them. These facts show the great superiority of,the,rstl_1857_0039.txt,txt_rstl,1857,18
"No. 19), regarding the principal facts detailed in the present memoir,",the,rstl_1857_0028.txt,txt_rstl,1857,18
stroma ; but if the facts T have stated be not,the,rstl_1857_0027.txt,txt_rstl,1857,18
prevented further publication of the facts at that time; but I,the,rstl_1857_0017.txt,txt_rstl,1857,18
a parallel to the curious facts thus established we must look,the,rstl_1857_0015.txt,txt_rstl,1857,18
"writes, © a multitude of facts which scem to necessitate the",the,rstl_1857_0016.txt,txt_rstl,1857,18
an imperfect acquaintance with the facts must necessarily render to some,the,rstl_1857_0016.txt,txt_rstl,1857,18
rigorous demonstration of the principal facts and laws of muscular electri-,the,rstl_1857_0010.txt,txt_rstl,1857,18
clear explanation of several important facts of muscular electricity. The first,the,rstl_1857_0010.txt,txt_rstl,1857,18
"electricity. The first of these facts is, that a differential current",the,rstl_1857_0010.txt,txt_rstl,1857,18
they are con- tained in facts formed by the condensation of,the,rstl_1857_0009.txt,txt_rstl,1857,18
"of the heart, these adventitious facts are strong and well-defined, whilst",the,rstl_1857_0009.txt,txt_rstl,1857,18
"Z5th in breadth. The next facts requiring especial notice, are those",the,rstl_1857_0009.txt,txt_rstl,1857,18
"this respect. 2 From the facts that have just been mentioned,",the,rstl_1857_0009.txt,txt_rstl,1857,18
"inference I deduce from these facts is, first, that the animals",the,rstl_1857_0009.txt,txt_rstl,1857,18
"process in different cases, the facts observed by LEUCKART are in",the,rstl_1857_0009.txt,txt_rstl,1857,18
"from a Tenia-embryo. Finally, the facts made known in this communication",the,rstl_1857_0009.txt,txt_rstl,1857,18
close coincidence between all the facts of light and the physical,the,rstl_1857_0011.txt,txt_rstl,1857,18
supposition leaves many of the facts either imperfectly explained or untouched.,the,rstl_1857_0011.txt,txt_rstl,1857,18
undecided for the present. The facts to be hereafter mentioned as,the,rstl_1857_0007.txt,txt_rstl,1857,18
"eggs require impregnation, and the facts bearing on this $ub- Ject",the,rstl_1857_0007.txt,txt_rstl,1857,18
appears strictly comparable to the facts which have been obseryed in,the,rstl_1857_0007.txt,txt_rstl,1857,18
"ing Tables, to consider the facts they present, and their results.",the,rstl_1857_0004.txt,txt_rstl,1857,18
faces in the quadrant (111...211). Facts presented by these Tables —The,the,rstl_1857_0004.txt,txt_rstl,1857,18
pletely set aside by the facts and arguments which have been,the,rstl_1848_0019.txt,txt_rstl,1848,18
"probable, has by the same facts and arguments been proved to",the,rstl_1848_0019.txt,txt_rstl,1848,18
lowing experiment containing the principal facts worthy of notice will be,the,rstl_1848_0017.txt,txt_rstl,1848,18
and the bearing of the facts described on the still mooted,the,rstl_1848_0012.txt,txt_rstl,1848,18
"4, a.]* According to the facts at present known, the chambered",the,rstl_1848_0012.txt,txt_rstl,1848,18
the erystalline mineral matter. The facts above described appear to me,the,rstl_1848_0012.txt,txt_rstl,1848,18
(fig. 1.2-3). These posterior deep facts are immediately behind the external,the,rstl_1848_0007.txt,txt_rstl,1848,18
compress and empty the anterior facts likewise expand the blow-hole ;,the,rstl_1848_0007.txt,txt_rstl,1848,18
is clear that the anterior facts that may be filled when,the,rstl_1848_0007.txt,txt_rstl,1848,18
is open; while the posterior facts that are emptied when the,the,rstl_1848_0007.txt,txt_rstl,1848,18
; The anterior and posterior facts alternate in their contraction and,the,rstl_1848_0007.txt,txt_rstl,1848,18
muscles that act upon the facts and the passages of the,the,rstl_1848_0007.txt,txt_rstl,1848,18
two posterior facts. Membranous. The facts communicate with the nasal canal.,the,rstl_1848_0007.txt,txt_rstl,1848,18
Society). Compressors of the posterior facts (3). No. 20. Fig. 1,the,rstl_1848_0007.txt,txt_rstl,1848,18
"of the ante- rior superior facts (1), and, I conceive, constrict",the,rstl_1848_0007.txt,txt_rstl,1848,18
very close approximation to the facts of nature. There is a,the,rstl_1848_0008.txt,txt_rstl,1848,18
exactly the reverse of the facts which take place at the,the,rstl_1848_0008.txt,txt_rstl,1848,18
as to include the following facts of observation :— (1.) The,the,rstl_1848_0001.txt,txt_rstl,1848,18
irregularity or complexity of the facts themselves. With regard to the,the,rstl_1848_0001.txt,txt_rstl,1848,18
":—the collec- tion of the facts then known, given in the",the,rstl_1848_0001.txt,txt_rstl,1848,18
combines these and many other facts respecting the tides into a,the,rstl_1848_0001.txt,txt_rstl,1848,18
"a given point belonged. The facts that I have stated lead,",the,rstl_1849_0021.txt,txt_rstl,1849,18
"District, as far as the facts then ascertained would permit. I",the,rstl_1849_0017.txt,txt_rstl,1849,18
"about three years ago. The facts previously on record, with few",the,rstl_1849_0017.txt,txt_rstl,1849,18
"spermatozoa are developed in pyriform facts opening externally, and that the",the,rstl_1849_0022.txt,txt_rstl,1849,18
"45. The contents of the facts are spermatozoa, and cells in",the,rstl_1849_0022.txt,txt_rstl,1849,18
THE MEDUSZE. openings of the facts could be perceived : the,the,rstl_1849_0022.txt,txt_rstl,1849,18
could be perceived : the facts were filled with spermatozoa with,the,rstl_1849_0022.txt,txt_rstl,1849,18
the spermatozoa deve- Joped in facts connected with the inner ©,the,rstl_1849_0022.txt,txt_rstl,1849,18
conelusions are deducible from the facts stated in the pre- ceding,the,rstl_1849_0022.txt,txt_rstl,1849,18
quoted. The following are the facts relative to the nervous supply,the,rstl_1849_0003.txt,txt_rstl,1849,18
to ganoid seales.” The new facts brought forward by Professor Owex,the,rstl_1849_0023.txt,txt_rstl,1849,18
hope and believe that the facts about to be brought forward,the,rstl_1849_0023.txt,txt_rstl,1849,18
"THE MICROSCOPIC STRUCTURE OP THE facts is, that Mr. Quzekerr's objection",the,rstl_1849_0023.txt,txt_rstl,1849,18
pass through the tissue. These facts of course do away with,the,rstl_1849_0023.txt,txt_rstl,1849,18
the true explanation of the facts which have been thus pointed,the,rstl_1849_0012.txt,txt_rstl,1849,18
"been thus pointed out, the facts themselves are highly deserving of",the,rstl_1849_0012.txt,txt_rstl,1849,18
very desirable to test these facts by further experiments. (47.) The,the,rstl_1850_0035.txt,txt_rstl,1850,18
which the accuracy of the facts stated in this paper are,the,rstl_1850_0027.txt,txt_rstl,1850,18
and the accumulation of various facts relative to the existence of,the,rstl_1850_0037.txt,txt_rstl,1850,18
of conducting electricity. All the facts which have been adduced in,the,rstl_1850_0037.txt,txt_rstl,1850,18
and may instance the following facts as examples. 1. According to,the,rstl_1850_0037.txt,txt_rstl,1850,18
animals. A comparison of the facts relating to the geographical distribution,the,rstl_1850_0037.txt,txt_rstl,1850,18
"is no less remarkable, The facts determined by the experiments of",the,rstl_1850_0037.txt,txt_rstl,1850,18
"fabric that manifests it. The facts already cited, which show how",the,rstl_1850_0037.txt,txt_rstl,1850,18
"afforded by the generally admitted facts of Physiological science*, than to",the,rstl_1850_0037.txt,txt_rstl,1850,18
"The conclusions drawn from the facts given are, that the Sus",the,rstl_1850_0025.txt,txt_rstl,1850,18
"my *Odontography* ©, that the facts detailed in How's paper were",the,rstl_1850_0025.txt,txt_rstl,1850,18
and to add the additional facts and illustrations of the peculiarities,the,rstl_1850_0025.txt,txt_rstl,1850,18
the ready comprehension of the facts which have been recorded by,the,rstl_1850_0025.txt,txt_rstl,1850,18
terpretation of some of the facts described in the Memoir on,the,rstl_1850_0019.txt,txt_rstl,1850,18
intended to express concisely the facts described. With regard to the,the,rstl_1850_0019.txt,txt_rstl,1850,18
"is generically distinetf. From the facts before us, our knowledge of",the,rstl_1850_0019.txt,txt_rstl,1850,18
"the palzeontologist, since the new facts herein described tend to remove",the,rstl_1850_0019.txt,txt_rstl,1850,18
in the text. + The facts dexcribed in the text are,the,rstl_1850_0019.txt,txt_rstl,1850,18
draw a distinetion between two facts s0 very similar as the,the,rstl_1850_0038.txt,txt_rstl,1850,18
"the impression made by these facts upon TatnaRD, who first discovered",the,rstl_1850_0038.txt,txt_rstl,1850,18
the scientific conception of these facts from the electro- chemical point,the,rstl_1850_0038.txt,txt_rstl,1850,18
"always present, being dissolved. These facts are contrary to the usual",the,rstl_1850_0038.txt,txt_rstl,1850,18
theory of this action. The facts I have just mentioned gave,the,rstl_1850_0038.txt,txt_rstl,1850,18
"may express these facts, the facts themselves are the 8ame. We",the,rstl_1850_0038.txt,txt_rstl,1850,18
"part, the absence of acknowledged facts relative to the strength and",the,rstl_1850_0036.txt,txt_rstl,1850,18
"wooden standards, * Several important facts and improvements in the construction",the,rstl_1850_0036.txt,txt_rstl,1850,18
the purpose of collecting the facts on which are founded the,the,rstl_1850_0036.txt,txt_rstl,1850,18
"24 : 16'5, From these facts it is evident that the",the,rstl_1850_0036.txt,txt_rstl,1850,18
of the plates. From these facts I would infer that single,the,rstl_1850_0036.txt,txt_rstl,1850,18
"strength, and exhibits several important facts in connection with the construction",the,rstl_1850_0036.txt,txt_rstl,1850,18
a striking coincidence in the facts tending to establish the principle,the,rstl_1850_0036.txt,txt_rstl,1850,18
"alone, it appears from the facts already recorded, that iron is",the,rstl_1850_0036.txt,txt_rstl,1850,18
"which will be found the facts more in detail, and which",the,rstl_1850_0036.txt,txt_rstl,1850,18
IV. we have some curious facts illustrative of the necessity and,the,rstl_1850_0036.txt,txt_rstl,1850,18
"of the bars. These interesting facts are of considerable value, as",the,rstl_1850_0036.txt,txt_rstl,1850,18
be negatived. Summary —From the facts described he following inferences result,the,rstl_1850_0017.txt,txt_rstl,1850,18
this conclusion : and the facts on which it was based,the,rstl_1850_0011.txt,txt_rstl,1850,18
is not perfectly hardened. The facts which are recorded in the,the,rstl_1850_0029.txt,txt_rstl,1850,18
to the optic lobes. These facts I think are of some,the,rstl_1850_0009.txt,txt_rstl,1850,18
from the great mass of facts which have now been collected,the,rstl_1850_0010.txt,txt_rstl,1850,18
assist the recollection of the facts regarding the annual variation of,the,rstl_1850_0010.txt,txt_rstl,1850,18
"with alkaline lyes. —From the facts which haye been previously stated,",the,rstl_1850_0003.txt,txt_rstl,1850,18
"volatile organic bases. From the facts which have been now stated,",the,rstl_1850_0003.txt,txt_rstl,1850,18
a synopsis of all the facts supporting the view of BerzerLws.,the,rstl_1850_0006.txt,txt_rstl,1850,18
under a general view the facts acquired up to the moment,the,rstl_1850_0006.txt,txt_rstl,1850,18
"as it did, upon the facts observed in the formation of",the,rstl_1850_0006.txt,txt_rstl,1850,18
desirable the acquisition of additional facts in support of the position,the,rstl_1850_0006.txt,txt_rstl,1850,18
in perfect harmony with the facts at pre- E 8ent in,the,rstl_1850_0006.txt,txt_rstl,1850,18
"vertex to coccyx, the same facts are as plainly obseryed =",the,rstl_1850_0007.txt,txt_rstl,1850,18
"right auricle ; but the facts seem to bear another explanation,",the,rstl_1850_0007.txt,txt_rstl,1850,18
to the determination of new facts and the enlargement of my,the,rstl_1850_0001.txt,txt_rstl,1850,18
the 21st of May. These facts Dr. Butsr recorded in a,the,rstl_1850_0016.txt,txt_rstl,1850,18
corrections. The whole of the facts connected with the meteorology of,the,rstl_1850_0016.txt,txt_rstl,1850,18
Bungalow and Cantonment Hospital. The facts show how necessary is a,the,rstl_1850_0016.txt,txt_rstl,1850,18
"confirm, from European localities, the facts I have stated respecting the",the,rstl_1850_0016.txt,txt_rstl,1850,18
it extremely desirable that the facts which are to be Q,the,rstl_1851_0032.txt,txt_rstl,1851,18
"circum- S stances may permit, facts of the same class obtained",the,rstl_1851_0032.txt,txt_rstl,1851,18
the means of generalizing the facts of the = Annual and,the,rstl_1851_0032.txt,txt_rstl,1851,18
"a correct representation of the facts of nature. MAGNETIC DECLINATION, AT",the,rstl_1851_0032.txt,txt_rstl,1851,18
of what would be the facts of the Annual and Diurnal,the,rstl_1851_0032.txt,txt_rstl,1851,18
practical considerations snggested by the facts now under notice. 1. Recent,the,rstl_1851_0032.txt,txt_rstl,1851,18
"1850. By reflecting on certain facts connected with the respiratory movements,",the,rstl_1851_0029.txt,txt_rstl,1851,18
"therefore, a few of the facts brought forward in this paper",the,rstl_1851_0029.txt,txt_rstl,1851,18
following summary of the principal facts described in this paper may,the,rstl_1851_0029.txt,txt_rstl,1851,18
a means of colligating the facts (for at best it can,the,rstl_1851_0027.txt,txt_rstl,1851,18
the respiratory cavity. The spermatic facts lie loosely in a dilatation,the,rstl_1851_0027.txt,txt_rstl,1851,18
with the more facility to facts and views that have heretofore,the,rstl_1851_0005.txt,txt_rstl,1851,18
"at Toronto and Hobarton, the facts appear to be that the",the,rstl_1851_0005.txt,txt_rstl,1851,18
"advanced, besides agreeing with the facts regarding the direction of the",the,rstl_1851_0005.txt,txt_rstl,1851,18
being a contractile tissue. The facts which seem to militate against,the,rstl_1851_0010.txt,txt_rstl,1851,18
"present chapter; but, as the facts have been Stated in part,",the,rstl_1851_0002.txt,txt_rstl,1851,18
We are forced by unequivocal facts to admit that the fourth,the,rstl_1851_0017.txt,txt_rstl,1851,18
"present chapter; but, as the facts have been Stated in part,",the,rstl_1851_0002.txt,txt_rstl,1851,18
As an expression of the facts for use in applying them,the,rstl_1851_0006.txt,txt_rstl,1851,18
comparing these with the £ facts of the natural history and,the,rstl_1851_0011.txt,txt_rstl,1851,18
may be inferred from the facts of its structure. Being filled,the,rstl_1851_0011.txt,txt_rstl,1851,18
"in the germinal vesicle, the facts observed in the ova of",the,rstl_1851_0011.txt,txt_rstl,1851,18
the whole produced embryos. These facts proved that the ova employed,the,rstl_1851_0011.txt,txt_rstl,1851,18
of the area germinativa. These facts sufficiently prove the great influence,the,rstl_1851_0011.txt,txt_rstl,1851,18
"think, is rendered certain by facts now shown, which escaped the",the,rstl_1851_0011.txt,txt_rstl,1851,18
during impregnation. —But although the facts now mentioned are 80 opposed,the,rstl_1851_0011.txt,txt_rstl,1851,18
uniform in the interior. These facts ap- peared to be conelusive,the,rstl_1851_0011.txt,txt_rstl,1851,18
"was necessary to confirm the facts ascertained by chemical investigation, by",the,rstl_1851_0011.txt,txt_rstl,1851,18
"which are objectionable from the facts shown in Dr. Frericns' analyses,",the,rstl_1851_0011.txt,txt_rstl,1851,18
and to show from these facts that a non-production of the,the,rstl_1851_0011.txt,txt_rstl,1851,18
recapitulate briefly some of the facts and views derived from the,the,rstl_1851_0011.txt,txt_rstl,1851,18
did s0 well with the facts elicited during the oute of,the,rstl_1852_0020.txt,txt_rstl,1852,18
"as they are by the facts already known, they must, occasion",the,rstl_1852_0020.txt,txt_rstl,1852,18
"in common either between the facts or arguments therein given, and",the,rstl_1852_0024.txt,txt_rstl,1852,18
or peritoneal chamber. These indisputable facts establish conclusively the view which,the,rstl_1852_0024.txt,txt_rstl,1852,18
this bold =tatement by the facts which already my own labours,the,rstl_1852_0024.txt,txt_rstl,1852,18
"in the true-blood. From these facts the physiologist may state, that",the,rstl_1852_0024.txt,txt_rstl,1852,18
secretion in living animals. The facts which the experiments related in,the,rstl_1852_0016.txt,txt_rstl,1852,18
"4). A consideration of the facts thus presented to notice, led",the,rstl_1852_0005.txt,txt_rstl,1852,18
"Remarks—An examination of the preceding facts will, I think, justify me",the,rstl_1852_0005.txt,txt_rstl,1852,18
am of opinion that the facts detailed in this paper are,the,rstl_1852_0005.txt,txt_rstl,1852,18
placed in juxtaposition with the facts already elicited by more able,the,rstl_1852_0005.txt,txt_rstl,1852,18
"consistent with the generally known facts con- nected with the discharge,",the,rstl_1852_0008.txt,txt_rstl,1852,18
"the vast mass of accumulated facts in electrical science, and likely",the,rstl_1852_0008.txt,txt_rstl,1852,18
"atmosphere corre- Sponds with the facts registered by observers, is a",the,rstl_1852_0012.txt,txt_rstl,1852,18
"disturbance in different years, the facts which present themselves most obviously",the,rstl_1852_0009.txt,txt_rstl,1852,18
less remarkable than are the facts which they combine to indi-,the,rstl_1852_0009.txt,txt_rstl,1852,18
are bound to receive the facts which may appear to indicate,the,rstl_1852_0009.txt,txt_rstl,1852,18
"epoch is traceable. Now the facts of the solar spots, as",the,rstl_1852_0009.txt,txt_rstl,1852,18
"with this subject, because the facts I have ascertained regarding it",the,rstl_1852_0001.txt,txt_rstl,1852,18
at a considerable distance. The facts noticed by these authors are,the,rstl_1852_0001.txt,txt_rstl,1852,18
