Context,Word,File,Directory
"of sections, but the available facts seem to indicate that the",that,rstb_1932_0010.txt,txt_rstb
with that of Htapteris. These facts raise questions of nomenclature and,that,rstb_1932_0010.txt,txt_rstb
year. In view of these facts it seemed probable that the,that,rstb_1932_0012.txt,txt_rstb
"for a time, but the facts rather suggest that there is",that,rstb_1932_0003.txt,txt_rstb
is on account of these facts that Kurz found the Chinese,that,rstb_1932_0007.txt,txt_rstb
"explanation is supported by the facts already mentioned, that the I,a",that,rstb_1932_0019.txt,txt_rstb
"29, section 18. But these facts do not show that the",that,rstb_1932_0019.txt,txt_rstb
In view of all these facts it appears highly probable that,that,rstb_1932_0016.txt,txt_rstb
"in its position, in the facts that it often becomes fleshy,",that,rstb_1932_0016.txt,txt_rstb
considers that “ the observed facts accord more with such a,that,rstb_1932_0002.txt,txt_rstb
"great interest, -” Now the facts of development demonstrate conclusively that",that,rstb_1932_0002.txt,txt_rstb
"so or not, the important facts remain that in both the",that,rstb_1932_0002.txt,txt_rstb
"is completely implanted, but the facts that the outer margin of",that,rstb_1932_0002.txt,txt_rstb
"however, that certain morpho- logical facts do not, at the moment,",that,rstb_1932_0002.txt,txt_rstb
"TUTTON ON DETERMINATION OF The facts that the #,-inch intervals for",that,rsta_1932_0008.txt,txt_rsta
"wave-length of H,, from the facts that the yard contains 1393290-5",that,rsta_1932_0008.txt,txt_rsta
"not so much on the facts mentioned by him, but that",that,rsta_1932_0007.txt,txt_rsta
OF THE CEREBRUM. Despite these facts it seems improbable that this,that,rstb_1934_0001.txt,txt_rstb
"Fig. 3 reveals the remarkable facts that DH, and DHy may",that,rstb_1934_0004.txt,txt_rstb
hypha. In conjunction with these facts it should be recalled that,that,rstb_1934_0004.txt,txt_rstb
"1926, 1927), so that the facts need only brief description, the",that,rstb_1934_0009.txt,txt_rstb
is perfectly true that the facts of eye-muscle development in birds,that,rstb_1934_0009.txt,txt_rstb
"Moreover, in addition to the facts that the extrinsic eye-muscles are",that,rstb_1934_0009.txt,txt_rstb
nature. ‘Taking into account the facts that the fifth nerve already,that,rstb_1934_0015.txt,txt_rstb
of its posterior canals. The facts that its compen- satory reactions,that,rstb_1934_0019.txt,txt_rstb
It is thought that the facts here recorded will be of,that,rstb_1934_0018.txt,txt_rstb
essentially the same. From these facts one may conclude that a,that,rstb_1934_0018.txt,txt_rstb
is sharply defined. Two significant facts are observed : (a) that,that,rstb_1934_0018.txt,txt_rstb
in the field. But certain facts show that conditions in the,that,rstb_1934_0018.txt,txt_rstb
attainment of definitive form. No facts contrary to the view that,that,rstb_1934_0016.txt,txt_rstb
to account for the observed facts only by supposing that in,that,rsta_1934_0018.txt,txt_rsta
"dimensions. Finally, among the curious facts noted was that for all",that,rsta_1934_0009.txt,txt_rsta
"detail, and concerned with the facts that in Callorhynchus, (i) there",that,rstb_1935_0001.txt,txt_rstb
"(1931), who shows that the facts are consistent with the theory",that,rstb_1935_0011.txt,txt_rstb
rapidity necessary in regeneration. These facts tend to show that the,that,rstb_1935_0014.txt,txt_rstb
with tissues undergoing calcification. The facts that Turcutnr does not appear,that,rstb_1935_0010.txt,txt_rstb
accumulation of yolk are the facts that such accumulation above the,that,rstb_1935_0013.txt,txt_rstb
"the “‘ peroxides,” certain experimental facts indicated that organic peroxides might",that,rsta_1935_0013.txt,txt_rsta
offers striking proof of the facts disputed by previous authors that,that,rstb_1936_0006.txt,txt_rstb
qualifications. I mention the above facts to show that even in,that,rstb_1937_0008.txt,txt_rstb
than in April. All these facts show that there is no,that,rstb_1937_0008.txt,txt_rstb
1.—at 15 m. depth. The facts that in the sea Chaetoceros,that,rstb_1937_0008.txt,txt_rstb
hygroscopic tent of saliva. These facts seem to indicate that the,that,rstb_1937_0001.txt,txt_rstb
"alternative methods of presenting the facts were considered. The first, that",that,rstb_1937_0014.txt,txt_rstb
"appropriate section, so that the facts relating to any particular tissue",that,rstb_1937_0014.txt,txt_rstb
H.X. respectively. Taking all these facts into consideration I think that,that,rstb_1937_0015.txt,txt_rstb
the Australian brain does. These facts make one hopeful that a,that,rstb_1937_0005.txt,txt_rstb
any apical system known. The facts seem to be that these,that,rstb_1938_0003.txt,txt_rstb
"partial survival may occur, the facts indicate that the oviposition response",that,rstb_1938_0005.txt,txt_rstb
expected were anti-bodies concerned. These facts suggest that when a living,that,rstb_1938_0004.txt,txt_rstb
the direction of Montserrat. These facts taken together suggest that the,that,rsta_1938_0002.txt,txt_rsta
the parent stem. ‘These are facts of importance in a reconstruction,of,rstb_1929_0001.txt,txt_rstb
question of specific identity the facts do not seem to conflict,of,rstb_1929_0001.txt,txt_rstb
—One of the most interesting facts about C. australis is its,of,rstb_1929_0001.txt,txt_rstb
Linkage of Chromosomes. Several notable facts regarding the pairing and linkage,of,rstb_1929_0007.txt,txt_rstb
Vessel System. With only the facts furnished by my investigation of,of,rstb_1929_0006.txt,txt_rstb
"in structure and contents. The facts of comparative anatomy, as may",of,rstb_1929_0006.txt,txt_rstb
"some extent suggested by the facts of embryology. It is, of",of,rstb_1929_0006.txt,txt_rstb
If Sapm’s interpretation of the facts of the early ontogeny are,of,rstb_1929_0006.txt,txt_rstb
"class Echinoidea, some of the facts brought forward in the papers",of,rstb_1929_0005.txt,txt_rstb
(dry flora). H Two significant facts come to light:—(q) pairs of,of,rstb_1929_0003.txt,txt_rstb
"fully-viewed atoms, then the observed facts correspond to a kind of",of,rsta_1929_0010.txt,txt_rsta
work by deriving some geometrical facts of quite general interest. Notation.—For,of,rsta_1929_0008.txt,txt_rsta
ay ‘Making use of these facts we see that the variable,of,rsta_1929_0002.txt,txt_rsta
termination on account of the facts that the arteries were not,of,rstb_1930_0001.txt,txt_rstb
"in view of the new facts brought to light, that it",of,rstb_1930_0011.txt,txt_rstb
has ably summed up the facts and extended the application of,of,rstb_1930_0011.txt,txt_rstb
the conclusion drawn from the facts of leaf-trace development. I confess,of,rstb_1930_0011.txt,txt_rstb
generally distinct types of stem. Facts of this kind are a,of,rstb_1930_0011.txt,txt_rstb
brought out a number of facts which are supposed to indicate,of,rstb_1930_0005.txt,txt_rstb
method of procedure * The facts that the cells are not,of,rsta_1930_0004.txt,txt_rsta
by the consistent body of facts regarding their shape and the,of,rstb_1931_0003.txt,txt_rstb
the case of Zoslerophyllum additional facts required for comparison are recorded,of,rstb_1931_0003.txt,txt_rstb
on larval emergence. All these facts support the conclusion of Dre,of,rstb_1931_0001.txt,txt_rstb
types of early plant-remains. The facts ascer- tained also have their,of,rstb_1931_0009.txt,txt_rstb
the stem. Another set of facts concerns the terminal region. It,of,rstb_1931_0009.txt,txt_rstb
clothed with secretory emergences. The facts given in the body of,of,rstb_1931_0009.txt,txt_rstb
cases our knowledge of the facts is incomplete and needs to,of,rstb_1931_0009.txt,txt_rstb
detailed knowledge of the pertinent facts for these and other early,of,rstb_1931_0009.txt,txt_rstb
"is of value. The few facts regarding the sporangia, spores and",of,rstb_1931_0009.txt,txt_rstb
(6) The bearings of these facts are indicated and briefly discussed.,of,rstb_1931_0009.txt,txt_rstb
The possible explanation of these facts we shall discuss later in,of,rstb_1931_0010.txt,txt_rstb
The majority of these discrepant facts can be brought under one,of,rstb_1931_0002.txt,txt_rstb
"reasonable explanation of the primary facts of our line-breeding and crossing,",of,rstb_1931_0002.txt,txt_rstb
9E The summary of the facts of these crossing experiments with,of,rstb_1931_0002.txt,txt_rstb
drawn from this series of facts is that a high <,of,rstb_1931_0002.txt,txt_rstb
"consequence of the following “ facts of observation,” as he calls",of,rstb_1932_0001.txt,txt_rstb
that most of the main facts of phyllotaxis can be explained,of,rstb_1932_0001.txt,txt_rstb
"consequences, if four so-called “ facts of observation ” are taken",of,rstb_1932_0001.txt,txt_rstb
at least one group of facts of which Van Irerson has,of,rstb_1932_0001.txt,txt_rstb
brief description of the new facts and then to discuss their,of,rstb_1932_0010.txt,txt_rstb
"of sections, but the available facts seem to indicate that the",of,rstb_1932_0010.txt,txt_rstb
7). Diagnosis.—In view of the facts now described we may re-define,of,rstb_1932_0010.txt,txt_rstb
in spite of all these facts the closed peripheral loops of,of,rstb_1932_0010.txt,txt_rstb
of the anatomy has revealed facts of a very unexpected nature.,of,rstb_1932_0010.txt,txt_rstb
with that of Htapteris. These facts raise questions of nomenclature and,of,rstb_1932_0010.txt,txt_rstb
year. In view of these facts it seemed probable that the,of,rstb_1932_0012.txt,txt_rstb
is on account of these facts that Kurz found the Chinese,of,rstb_1932_0007.txt,txt_rstb
3. Although some of the facts mentioned may induce us to,of,rstb_1932_0007.txt,txt_rstb
with some certainty. Thus the facts of association are strongly in,of,rstb_1932_0016.txt,txt_rstb
In view of all these facts it appears highly probable that,of,rstb_1932_0016.txt,txt_rstb
of the Corystospermacez we find facts of considerable interest. The seed-bearing,of,rstb_1932_0016.txt,txt_rstb
forms and also on the facts of association. 15. A new,of,rstb_1932_0016.txt,txt_rstb
"find another explanation of the facts established by us, and to",of,rstb_1932_0002.txt,txt_rstb
us see how the known facts of its development help us,of,rstb_1932_0002.txt,txt_rstb
"great interest, -” Now the facts of development demonstrate conclusively that",of,rstb_1932_0002.txt,txt_rstb
"in face of all the facts furnished by comparative embryology, the",of,rstb_1932_0002.txt,txt_rstb
which are collected the known facts relating to the form of,of,rstb_1932_0002.txt,txt_rstb
"is completely implanted, but the facts that the outer margin of",of,rstb_1932_0002.txt,txt_rstb
the basis of the known facts concerning their development :— Anthropoidea,of,rstb_1932_0002.txt,txt_rstb
of these and other like facts must remain over for future,of,rstb_1932_0002.txt,txt_rstb
this paper further illustrate these facts (in spite of the fact,of,rstb_1932_0020.txt,txt_rstb
"capable of accounting for the facts so far observed, the banded",of,rsta_1932_0010.txt,txt_rsta
"TUTTON ON DETERMINATION OF The facts that the #,-inch intervals for",of,rsta_1932_0008.txt,txt_rsta
"wave-length of H,, from the facts that the yard contains 1393290-5",of,rsta_1932_0008.txt,txt_rsta
"keep it within reasonable compass. Facts of considerable interest were discovered,",of,rsta_1932_0007.txt,txt_rsta
the opportunity of establishing these facts and proving by the resources,of,rsta_1932_0007.txt,txt_rsta
"modes of presentation of the facts of colour mixture, and in",of,rsta_1932_0005.txt,txt_rsta
Every new group of observed facts must be put in its,of,rsta_1932_0005.txt,txt_rsta
"character, x, of the observed facts would arise if the hypothesis",of,rsta_1933_0009.txt,txt_rsta
"character, x, of the observed facts were properly chosen—were, in fact,",of,rsta_1933_0009.txt,txt_rsta
"character, x, of the observed facts ; if « > 2»",of,rsta_1933_0009.txt,txt_rsta
view. The explanation of these facts is seen in the slender,of,rstb_1934_0001.txt,txt_rstb
OF THE CEREBRUM. Despite these facts it seems improbable that this,of,rstb_1934_0001.txt,txt_rstb
pallor. In view of these facts no general statement concerning the,of,rstb_1934_0002.txt,txt_rstb
of this mechanism the following facts must be considered : (a),of,rstb_1934_0002.txt,txt_rstb
Marsuauti. The recognition of these facts adds particular importance to the,of,rstb_1934_0010.txt,txt_rstb
is perfectly true that the facts of eye-muscle development in birds,of,rstb_1934_0009.txt,txt_rstb
one of the most interesting facts elucidated by Hayek (1924) is,of,rstb_1934_0009.txt,txt_rstb
radial file of tracheids. These facts are contrary to a method,of,rstb_1934_0017.txt,txt_rstb
disturbance—especially as many of the facts have already been recorded and,of,rstb_1934_0019.txt,txt_rstb
in the same way. These facts of themselves practically dispose of,of,rstb_1934_0019.txt,txt_rstb
of its posterior canals. The facts that its compen- satory reactions,of,rstb_1934_0019.txt,txt_rstb
It is thought that the facts here recorded will be of,of,rstb_1934_0018.txt,txt_rstb
the statistical study of the facts we have received much valued,of,rstb_1934_0018.txt,txt_rstb
"chance). But when all the facts are considered, the effect of",of,rstb_1934_0018.txt,txt_rstb
0-204 24-68 29 -62 Several facts of importance emerge from Tables,of,rstb_1934_0018.txt,txt_rstb
"lighter puparia, but the following facts are available. Puparia of Glossina",of,rstb_1934_0018.txt,txt_rstb
is at variance with the facts of development. In the first,of,rstb_1934_0016.txt,txt_rstb
attainment of definitive form. No facts contrary to the view that,of,rstb_1934_0016.txt,txt_rstb
of the aortic arches. Several facts of the manner in which,of,rstb_1934_0016.txt,txt_rstb
; an explanation of the facts is put forward. The meteorological,of,rsta_1934_0008.txt,txt_rsta
is one of the basic facts in the study of hair,of,rsta_1934_0010.txt,txt_rsta
The following explanation of these facts may be suggested. The surface,of,rstb_1935_0007.txt,txt_rstb
"of the diatom. Taking these facts into con- sideration, it would",of,rstb_1935_0008.txt,txt_rstb
"conclusions are supported by the facts of regeneration in other phyla,",of,rstb_1935_0014.txt,txt_rstb
accumulation of yolk are the facts that such accumulation above the,of,rstb_1935_0013.txt,txt_rstb
in order to elucidate certain facts revealed during the course of,of,rsta_1935_0013.txt,txt_rsta
"less of a peak. These facts may possibly indicate that, at",of,rsta_1935_0013.txt,txt_rsta
to consider some of those facts which bear on S the,of,rsta_1935_0013.txt,txt_rsta
offers striking proof of the facts disputed by previous authors that,of,rstb_1936_0006.txt,txt_rstb
are invariably crowded. The two facts of (a) the barbs on,of,rstb_1936_0006.txt,txt_rstb
"In view of all these facts it is apparent, as Dopps",of,rstb_1936_0012.txt,txt_rstb
DisPLAy In view of such facts as these it is easy,of,rstb_1936_0012.txt,txt_rstb
factors. Murpuy also records some facts about the periodic breeding of,of,rstb_1936_0012.txt,txt_rstb
of the valve. With these facts in mind we are in,of,rstb_1937_0002.txt,txt_rstb
any discussion here of the facts described above. They afford the,of,rstb_1937_0004.txt,txt_rstb
has added a number of facts of botanical interest to our,of,rstb_1937_0004.txt,txt_rstb
the median line. All these facts dispose of Heymons’s objection quite,of,rstb_1937_0003.txt,txt_rstb
"of the genital ducts. These facts give support to the view,",of,rstb_1937_0003.txt,txt_rstb
"to his erroneous interpretation of facts than to reality, as he",of,rstb_1937_0007.txt,txt_rstb
"In the light of the facts to be described below, the",of,rstb_1937_0013.txt,txt_rstb
hygroscopic tent of saliva. These facts seem to indicate that the,of,rstb_1937_0001.txt,txt_rstb
possible bearing of the ontogenetic facts upon phylogenetic theories is discussed.,of,rstb_1937_0012.txt,txt_rstb
"alternative methods of presenting the facts were considered. The first, that",of,rstb_1937_0014.txt,txt_rstb
molars. So far as these facts are of value they would,of,rstb_1937_0015.txt,txt_rstb
this juncture. The most significant facts arising from the work of,of,rsta_1937_0007.txt,txt_rsta
"though we cannot offer any facts in support of it, except",of,rstb_1938_0001.txt,txt_rstb
of Dr Bather. It contained facts which had been agreed upon,of,rstb_1938_0003.txt,txt_rstb
virulent type of reaction. These facts led to the view ITS,of,rstb_1938_0004.txt,txt_rstb
have brought to light new facts of importance. In- fection with,of,rstb_1938_0004.txt,txt_rstb
independent of mitotic activity. The facts so far recorded relating to,of,rstb_1938_0004.txt,txt_rstb
"embayed valleys, because of the facts mentioned in the last paragraph,",of,rstb_1938_0002.txt,txt_rstb
the direction of Montserrat. These facts taken together suggest that the,of,rsta_1938_0002.txt,txt_rsta
"occurrence of this earthquake. These facts should not, however, be allowed",of,rsta_1938_0002.txt,txt_rsta
the parent stem. ‘These are facts of importance in a reconstruction,of,rstb_1929_0001.txt,txt_rstb
question of specific identity the facts do not seem to conflict,of,rstb_1929_0001.txt,txt_rstb
—One of the most interesting facts about C. australis is its,of,rstb_1929_0001.txt,txt_rstb
Linkage of Chromosomes. Several notable facts regarding the pairing and linkage,of,rstb_1929_0007.txt,txt_rstb
Vessel System. With only the facts furnished by my investigation of,of,rstb_1929_0006.txt,txt_rstb
"in structure and contents. The facts of comparative anatomy, as may",of,rstb_1929_0006.txt,txt_rstb
"some extent suggested by the facts of embryology. It is, of",of,rstb_1929_0006.txt,txt_rstb
If Sapm’s interpretation of the facts of the early ontogeny are,of,rstb_1929_0006.txt,txt_rstb
"class Echinoidea, some of the facts brought forward in the papers",of,rstb_1929_0005.txt,txt_rstb
(dry flora). H Two significant facts come to light:—(q) pairs of,of,rstb_1929_0003.txt,txt_rstb
"fully-viewed atoms, then the observed facts correspond to a kind of",of,rsta_1929_0010.txt,txt_rsta
work by deriving some geometrical facts of quite general interest. Notation.—For,of,rsta_1929_0008.txt,txt_rsta
ay ‘Making use of these facts we see that the variable,of,rsta_1929_0002.txt,txt_rsta
termination on account of the facts that the arteries were not,of,rstb_1930_0001.txt,txt_rstb
"in view of the new facts brought to light, that it",of,rstb_1930_0011.txt,txt_rstb
has ably summed up the facts and extended the application of,of,rstb_1930_0011.txt,txt_rstb
the conclusion drawn from the facts of leaf-trace development. I confess,of,rstb_1930_0011.txt,txt_rstb
generally distinct types of stem. Facts of this kind are a,of,rstb_1930_0011.txt,txt_rstb
brought out a number of facts which are supposed to indicate,of,rstb_1930_0005.txt,txt_rstb
method of procedure * The facts that the cells are not,of,rsta_1930_0004.txt,txt_rsta
by the consistent body of facts regarding their shape and the,of,rstb_1931_0003.txt,txt_rstb
the case of Zoslerophyllum additional facts required for comparison are recorded,of,rstb_1931_0003.txt,txt_rstb
on larval emergence. All these facts support the conclusion of Dre,of,rstb_1931_0001.txt,txt_rstb
types of early plant-remains. The facts ascer- tained also have their,of,rstb_1931_0009.txt,txt_rstb
the stem. Another set of facts concerns the terminal region. It,of,rstb_1931_0009.txt,txt_rstb
clothed with secretory emergences. The facts given in the body of,of,rstb_1931_0009.txt,txt_rstb
cases our knowledge of the facts is incomplete and needs to,of,rstb_1931_0009.txt,txt_rstb
detailed knowledge of the pertinent facts for these and other early,of,rstb_1931_0009.txt,txt_rstb
"is of value. The few facts regarding the sporangia, spores and",of,rstb_1931_0009.txt,txt_rstb
(6) The bearings of these facts are indicated and briefly discussed.,of,rstb_1931_0009.txt,txt_rstb
The possible explanation of these facts we shall discuss later in,of,rstb_1931_0010.txt,txt_rstb
The majority of these discrepant facts can be brought under one,of,rstb_1931_0002.txt,txt_rstb
"reasonable explanation of the primary facts of our line-breeding and crossing,",of,rstb_1931_0002.txt,txt_rstb
9E The summary of the facts of these crossing experiments with,of,rstb_1931_0002.txt,txt_rstb
drawn from this series of facts is that a high <,of,rstb_1931_0002.txt,txt_rstb
"consequence of the following “ facts of observation,” as he calls",of,rstb_1932_0001.txt,txt_rstb
that most of the main facts of phyllotaxis can be explained,of,rstb_1932_0001.txt,txt_rstb
"consequences, if four so-called “ facts of observation ” are taken",of,rstb_1932_0001.txt,txt_rstb
at least one group of facts of which Van Irerson has,of,rstb_1932_0001.txt,txt_rstb
brief description of the new facts and then to discuss their,of,rstb_1932_0010.txt,txt_rstb
"of sections, but the available facts seem to indicate that the",of,rstb_1932_0010.txt,txt_rstb
7). Diagnosis.—In view of the facts now described we may re-define,of,rstb_1932_0010.txt,txt_rstb
in spite of all these facts the closed peripheral loops of,of,rstb_1932_0010.txt,txt_rstb
of the anatomy has revealed facts of a very unexpected nature.,of,rstb_1932_0010.txt,txt_rstb
with that of Htapteris. These facts raise questions of nomenclature and,of,rstb_1932_0010.txt,txt_rstb
year. In view of these facts it seemed probable that the,of,rstb_1932_0012.txt,txt_rstb
is on account of these facts that Kurz found the Chinese,of,rstb_1932_0007.txt,txt_rstb
3. Although some of the facts mentioned may induce us to,of,rstb_1932_0007.txt,txt_rstb
with some certainty. Thus the facts of association are strongly in,of,rstb_1932_0016.txt,txt_rstb
In view of all these facts it appears highly probable that,of,rstb_1932_0016.txt,txt_rstb
of the Corystospermacez we find facts of considerable interest. The seed-bearing,of,rstb_1932_0016.txt,txt_rstb
forms and also on the facts of association. 15. A new,of,rstb_1932_0016.txt,txt_rstb
"find another explanation of the facts established by us, and to",of,rstb_1932_0002.txt,txt_rstb
us see how the known facts of its development help us,of,rstb_1932_0002.txt,txt_rstb
"great interest, -” Now the facts of development demonstrate conclusively that",of,rstb_1932_0002.txt,txt_rstb
"in face of all the facts furnished by comparative embryology, the",of,rstb_1932_0002.txt,txt_rstb
which are collected the known facts relating to the form of,of,rstb_1932_0002.txt,txt_rstb
"is completely implanted, but the facts that the outer margin of",of,rstb_1932_0002.txt,txt_rstb
the basis of the known facts concerning their development :— Anthropoidea,of,rstb_1932_0002.txt,txt_rstb
of these and other like facts must remain over for future,of,rstb_1932_0002.txt,txt_rstb
this paper further illustrate these facts (in spite of the fact,of,rstb_1932_0020.txt,txt_rstb
"capable of accounting for the facts so far observed, the banded",of,rsta_1932_0010.txt,txt_rsta
"TUTTON ON DETERMINATION OF The facts that the #,-inch intervals for",of,rsta_1932_0008.txt,txt_rsta
"wave-length of H,, from the facts that the yard contains 1393290-5",of,rsta_1932_0008.txt,txt_rsta
"keep it within reasonable compass. Facts of considerable interest were discovered,",of,rsta_1932_0007.txt,txt_rsta
the opportunity of establishing these facts and proving by the resources,of,rsta_1932_0007.txt,txt_rsta
"modes of presentation of the facts of colour mixture, and in",of,rsta_1932_0005.txt,txt_rsta
Every new group of observed facts must be put in its,of,rsta_1932_0005.txt,txt_rsta
"character, x, of the observed facts would arise if the hypothesis",of,rsta_1933_0009.txt,txt_rsta
"character, x, of the observed facts were properly chosen—were, in fact,",of,rsta_1933_0009.txt,txt_rsta
"character, x, of the observed facts ; if « > 2»",of,rsta_1933_0009.txt,txt_rsta
view. The explanation of these facts is seen in the slender,of,rstb_1934_0001.txt,txt_rstb
OF THE CEREBRUM. Despite these facts it seems improbable that this,of,rstb_1934_0001.txt,txt_rstb
pallor. In view of these facts no general statement concerning the,of,rstb_1934_0002.txt,txt_rstb
of this mechanism the following facts must be considered : (a),of,rstb_1934_0002.txt,txt_rstb
Marsuauti. The recognition of these facts adds particular importance to the,of,rstb_1934_0010.txt,txt_rstb
is perfectly true that the facts of eye-muscle development in birds,of,rstb_1934_0009.txt,txt_rstb
one of the most interesting facts elucidated by Hayek (1924) is,of,rstb_1934_0009.txt,txt_rstb
radial file of tracheids. These facts are contrary to a method,of,rstb_1934_0017.txt,txt_rstb
disturbance—especially as many of the facts have already been recorded and,of,rstb_1934_0019.txt,txt_rstb
in the same way. These facts of themselves practically dispose of,of,rstb_1934_0019.txt,txt_rstb
of its posterior canals. The facts that its compen- satory reactions,of,rstb_1934_0019.txt,txt_rstb
It is thought that the facts here recorded will be of,of,rstb_1934_0018.txt,txt_rstb
the statistical study of the facts we have received much valued,of,rstb_1934_0018.txt,txt_rstb
"chance). But when all the facts are considered, the effect of",of,rstb_1934_0018.txt,txt_rstb
0-204 24-68 29 -62 Several facts of importance emerge from Tables,of,rstb_1934_0018.txt,txt_rstb
"lighter puparia, but the following facts are available. Puparia of Glossina",of,rstb_1934_0018.txt,txt_rstb
is at variance with the facts of development. In the first,of,rstb_1934_0016.txt,txt_rstb
attainment of definitive form. No facts contrary to the view that,of,rstb_1934_0016.txt,txt_rstb
of the aortic arches. Several facts of the manner in which,of,rstb_1934_0016.txt,txt_rstb
; an explanation of the facts is put forward. The meteorological,of,rsta_1934_0008.txt,txt_rsta
is one of the basic facts in the study of hair,of,rsta_1934_0010.txt,txt_rsta
