Context,Word,File,Directory
the terminal carboxyl group. These facts prove conclusively that Substance “,the,rstb_1931_0027.txt,txt_rstb
"consequence of the following “ facts of observation,” as he calls",the,rstb_1932_0001.txt,txt_rstb
"and in accordance with the facts that could be ascertained, it",the,rstb_1932_0001.txt,txt_rstb
arose on the apex. These facts indicate that there is in,the,rstb_1932_0001.txt,txt_rstb
that most of the main facts of phyllotaxis can be explained,the,rstb_1932_0001.txt,txt_rstb
"approximation when tested against the facts observed, and, besides being informative,",the,rstb_1932_0005.txt,txt_rstb
"is welcome in itself, the facts now brought to light are",the,rstb_1932_0010.txt,txt_rstb
brief description of the new facts and then to discuss their,the,rstb_1932_0010.txt,txt_rstb
"of sections, but the available facts seem to indicate that the",the,rstb_1932_0010.txt,txt_rstb
7). Diagnosis.—In view of the facts now described we may re-define,the,rstb_1932_0010.txt,txt_rstb
"considered till we know the facts better. + Diarch roots, with",the,rstb_1932_0010.txt,txt_rstb
to the Botry- chioxylon. The facts now brought forward make this,the,rstb_1932_0010.txt,txt_rstb
in spite of all these facts the closed peripheral loops of,the,rstb_1932_0010.txt,txt_rstb
of the anatomy has revealed facts of a very unexpected nature.,the,rstb_1932_0010.txt,txt_rstb
year. In view of these facts it seemed probable that the,the,rstb_1932_0012.txt,txt_rstb
"for a time, but the facts rather suggest that there is",the,rstb_1932_0003.txt,txt_rstb
endoderm seems to fit the facts best. The question should be,the,rstb_1932_0003.txt,txt_rstb
On the convexity the following facts may be noted In the,the,rstb_1932_0007.txt,txt_rstb
is on account of these facts that Kurz found the Chinese,the,rstb_1932_0007.txt,txt_rstb
distinct brachycephalics. Corresponding with these facts the temporal lobe is somewhat,the,rstb_1932_0007.txt,txt_rstb
3. Although some of the facts mentioned may induce us to,the,rstb_1932_0007.txt,txt_rstb
"explanation is supported by the facts already mentioned, that the I,a",the,rstb_1932_0019.txt,txt_rstb
"29, section 18. But these facts do not show that the",the,rstb_1932_0019.txt,txt_rstb
"alternative is favoured by the facts concerning I, discussed on pp.",the,rstb_1932_0019.txt,txt_rstb
perhaps slightly more. The relevant facts are recorded and discussed in,the,rstb_1932_0019.txt,txt_rstb
with some certainty. Thus the facts of association are strongly in,the,rstb_1932_0016.txt,txt_rstb
of the Corystospermacez we find facts of considerable interest. The seed-bearing,the,rstb_1932_0016.txt,txt_rstb
"in its position, in the facts that it often becomes fleshy,",the,rstb_1932_0016.txt,txt_rstb
forms and also on the facts of association. 15. A new,the,rstb_1932_0016.txt,txt_rstb
"allantoic sac. Having established these facts for Loris, we took the",the,rstb_1932_0002.txt,txt_rstb
considers that “ the observed facts accord more with such a,the,rstb_1932_0002.txt,txt_rstb
"find another explanation of the facts established by us, and to",the,rstb_1932_0002.txt,txt_rstb
us see how the known facts of its development help us,the,rstb_1932_0002.txt,txt_rstb
"great interest, -” Now the facts of development demonstrate conclusively that",the,rstb_1932_0002.txt,txt_rstb
"in face of all the facts furnished by comparative embryology, the",the,rstb_1932_0002.txt,txt_rstb
is amply substantiated by the facts and considerations set forth in,the,rstb_1932_0002.txt,txt_rstb
"so or not, the important facts remain that in both the",the,rstb_1932_0002.txt,txt_rstb
which are collected the known facts relating to the form of,the,rstb_1932_0002.txt,txt_rstb
"is completely implanted, but the facts that the outer margin of",the,rstb_1932_0002.txt,txt_rstb
recognised by the systematist. The facts and considerations I have adduced,the,rstb_1932_0002.txt,txt_rstb
the basis of the known facts concerning their development :— Anthropoidea,the,rstb_1932_0002.txt,txt_rstb
"however, that certain morpho- logical facts do not, at the moment,",the,rstb_1932_0002.txt,txt_rstb
been sectioned and the following facts are revealed :—The ventral cushion,the,rstb_1932_0020.txt,txt_rstb
this paper further illustrate these facts (in spite of the fact,the,rstb_1932_0020.txt,txt_rstb
"feature here revealed. The main facts were known before, but the",the,rstb_1932_0020.txt,txt_rstb
"capable of accounting for the facts so far observed, the banded",the,rsta_1932_0010.txt,txt_rsta
"No. 27). Taking the foregoing facts and circumstances as a whole,",the,rsta_1932_0010.txt,txt_rsta
"TUTTON ON DETERMINATION OF The facts that the #,-inch intervals for",the,rsta_1932_0008.txt,txt_rsta
"wave-length of H,, from the facts that the yard contains 1393290-5",the,rsta_1932_0008.txt,txt_rsta
"not so much on the facts mentioned by him, but that",the,rsta_1932_0007.txt,txt_rsta
the opportunity of establishing these facts and proving by the resources,the,rsta_1932_0007.txt,txt_rsta
"modes of presentation of the facts of colour mixture, and in",the,rsta_1932_0005.txt,txt_rsta
"plate (see Section 4). The facts suggest that, though a surface",the,rsta_1932_0001.txt,txt_rsta
must account for four curious facts :— (1) The distance h,the,rsta_1932_0001.txt,txt_rsta
23. (ii) To fit the facts the relatively long range force,the,rsta_1932_0001.txt,txt_rsta
(146). We note the following facts : TueoreM XXIV.—Under a purely,the,rsta_1933_0012.txt,txt_rsta
"character, x, of the observed facts would arise if the hypothesis",the,rsta_1933_0009.txt,txt_rsta
"character, x, of the observed facts were properly chosen—were, in fact,",the,rsta_1933_0009.txt,txt_rsta
"character, x, of the observed facts ; if « > 2»",the,rsta_1933_0009.txt,txt_rsta
"statistical practice, when the observed facts are described as “‘ samples,”",the,rsta_1933_0009.txt,txt_rsta
view. The explanation of these facts is seen in the slender,the,rstb_1934_0001.txt,txt_rstb
OF THE CEREBRUM. Despite these facts it seems improbable that this,the,rstb_1934_0001.txt,txt_rstb
"parieto-occipitalis is, if the above facts are valid, the upper end",the,rstb_1934_0001.txt,txt_rstb
to overlook the many interesting facts concerning colour change in this,the,rstb_1934_0002.txt,txt_rstb
pallor. In view of these facts no general statement concerning the,the,rstb_1934_0002.txt,txt_rstb
of this mechanism the following facts must be considered : (a),the,rstb_1934_0002.txt,txt_rstb
"Fig. 3 reveals the remarkable facts that DH, and DHy may",the,rstb_1934_0004.txt,txt_rstb
old. These similarities in experimental facts suggest a correspondence in the,the,rstb_1934_0004.txt,txt_rstb
Marsuauti. The recognition of these facts adds particular importance to the,the,rstb_1934_0010.txt,txt_rstb
feature on the vertex. These facts are very clearly demonstrated in,the,rstb_1934_0010.txt,txt_rstb
"23-6; Pithecanthropus, 42-8. The foregoing facts serve to demonstrate that, aside",the,rstb_1934_0003.txt,txt_rstb
"1926, 1927), so that the facts need only brief description, the",the,rstb_1934_0009.txt,txt_rstb
is perfectly true that the facts of eye-muscle development in birds,the,rstb_1934_0009.txt,txt_rstb
"Moreover, in addition to the facts that the extrinsic eye-muscles are",the,rstb_1934_0009.txt,txt_rstb
"the trunk, there are certain facts which speak directly for the",the,rstb_1934_0009.txt,txt_rstb
one of the most interesting facts elucidated by Hayek (1924) is,the,rstb_1934_0009.txt,txt_rstb
nature. ‘Taking into account the facts that the fifth nerve already,the,rstb_1934_0015.txt,txt_rstb
the temporary symmetrical posture. These facts throw a new light on,the,rstb_1934_0019.txt,txt_rstb
disturbance—especially as many of the facts have already been recorded and,the,rstb_1934_0019.txt,txt_rstb
in the same way. These facts of themselves practically dispose of,the,rstb_1934_0019.txt,txt_rstb
of its posterior canals. The facts that its compen- satory reactions,the,rstb_1934_0019.txt,txt_rstb
It is thought that the facts here recorded will be of,the,rstb_1934_0018.txt,txt_rstb
the statistical study of the facts we have received much valued,the,rstb_1934_0018.txt,txt_rstb
"LEWIS to set out the facts first, and to consider their",the,rstb_1934_0018.txt,txt_rstb
divergence between the ‘“ observed” facts and what would be “expected,the,rstb_1934_0018.txt,txt_rstb
essentially the same. From these facts one may conclude that a,the,rstb_1934_0018.txt,txt_rstb
per 100 female-days ; the facts for the two species are,the,rstb_1934_0018.txt,txt_rstb
"chance). But when all the facts are considered, the effect of",the,rstb_1934_0018.txt,txt_rstb
"and widely, fig. 4. The facts given in Table XIV show",the,rstb_1934_0018.txt,txt_rstb
"lighter puparia, but the following facts are available. Puparia of Glossina",the,rstb_1934_0018.txt,txt_rstb
"the graph for which no facts are available ; moreover, when",the,rstb_1934_0018.txt,txt_rstb
"occurs in Glossina, and the facts in Table XIII appear to",the,rstb_1934_0018.txt,txt_rstb
in the field. But certain facts show that conditions in the,the,rstb_1934_0018.txt,txt_rstb
is at variance with the facts of development. In the first,the,rstb_1934_0016.txt,txt_rstb
attainment of definitive form. No facts contrary to the view that,the,rstb_1934_0016.txt,txt_rstb
of the aortic arches. Several facts of the manner in which,the,rstb_1934_0016.txt,txt_rstb
to account for the observed facts only by supposing that in,the,rsta_1934_0018.txt,txt_rsta
"is in accord with the facts because, as has already been",the,rsta_1934_0018.txt,txt_rsta
; an explanation of the facts is put forward. The meteorological,the,rsta_1934_0008.txt,txt_rsta
"dimensions. Finally, among the curious facts noted was that for all",the,rsta_1934_0009.txt,txt_rsta
fracture oceurs. With these interesting facts on record regarding the behaviour,the,rsta_1934_0009.txt,txt_rsta
detail the experi- 1) mental facts and arguments leading up to,the,rsta_1934_0010.txt,txt_rsta
is one of the basic facts in the study of hair,the,rsta_1934_0010.txt,txt_rsta
"not in agreement with the facts at true equilibrium, and the",the,rsta_1934_0014.txt,txt_rsta
"detail, and concerned with the facts that in Callorhynchus, (i) there",the,rstb_1935_0001.txt,txt_rstb
The following explanation of these facts may be suggested. The surface,the,rstb_1935_0007.txt,txt_rstb
"quite possible that, if the facts were more fully known, this",the,rstb_1935_0007.txt,txt_rstb
"of the diatom. Taking these facts into con- sideration, it would",the,rstb_1935_0008.txt,txt_rstb
"as had been thought. The facts that, in addition to reputed",the,rstb_1935_0011.txt,txt_rstb
different breeds. “From the foregoing facts we see in how astonishing,the,rstb_1935_0011.txt,txt_rstb
"(1931), who shows that the facts are consistent with the theory",the,rstb_1935_0011.txt,txt_rstb
disproved not only by the facts already cited in Oenothera but,the,rstb_1935_0012.txt,txt_rstb
rapidity necessary in regeneration. These facts tend to show that the,the,rstb_1935_0014.txt,txt_rstb
"conclusions are supported by the facts of regeneration in other phyla,",the,rstb_1935_0014.txt,txt_rstb
relatively indifferent cell types. The facts so far presented throw light,the,rstb_1935_0014.txt,txt_rstb
"partly atrophied organ. With these facts in mind, the special granules",the,rstb_1935_0010.txt,txt_rstb
with tissues undergoing calcification. The facts that Turcutnr does not appear,the,rstb_1935_0010.txt,txt_rstb
accumulation of yolk are the facts that such accumulation above the,the,rstb_1935_0013.txt,txt_rstb
"Taken as a whole, the facts presented in the preceding sections",the,rstb_1935_0013.txt,txt_rstb
This is confirmed by the facts recorded in a previous study,the,rstb_1935_0013.txt,txt_rstb
in order to elucidate certain facts revealed during the course of,the,rsta_1935_0013.txt,txt_rsta
"6, and 7. The following facts are outstanding. Aldehydes.—With Shell petrol",the,rsta_1935_0013.txt,txt_rsta
"the “‘ peroxides,” certain experimental facts indicated that organic peroxides might",the,rsta_1935_0013.txt,txt_rsta
"in the engine. , These facts and all the experiments described",the,rsta_1935_0013.txt,txt_rsta
"doubtfulf ; but taking all facts into consideration, the first process",the,rsta_1935_0013.txt,txt_rsta
to consider some of those facts which bear on S the,the,rsta_1935_0013.txt,txt_rsta
to be reconciled with the facts which ’ have been set,the,rsta_1935_0013.txt,txt_rsta
"the mammalian vomer, and the facts now known about the structure",the,rstb_1936_0001.txt,txt_rstb
"is in agreement with the facts observed by von Kocu (1882,",the,rstb_1936_0007.txt,txt_rstb
the log difference. The following facts may be noted : (a),the,rstb_1936_0010.txt,txt_rstb
offers striking proof of the facts disputed by previous authors that,the,rstb_1936_0006.txt,txt_rstb
are invariably crowded. The two facts of (a) the barbs on,the,rstb_1936_0006.txt,txt_rstb
state briefly the main known facts concerning the part played by,the,rstb_1936_0012.txt,txt_rstb
is no clear evidence. The facts have been well presented by,the,rstb_1936_0012.txt,txt_rstb
factors. Murpuy also records some facts about the periodic breeding of,the,rstb_1936_0012.txt,txt_rstb
"is, however, contrary to the facts presented in this paper,* unless",the,rstb_1937_0010.txt,txt_rstb
of the valve. With these facts in mind we are in,the,rstb_1937_0002.txt,txt_rstb
which corroborate and extend the facts ascertained from the three specimens,the,rstb_1937_0004.txt,txt_rstb
any discussion here of the facts described above. They afford the,the,rstb_1937_0004.txt,txt_rstb
is beyond my competence. The facts ascertained regarding the flora will,the,rstb_1937_0004.txt,txt_rstb
seems highly improbable. The further facts now known regarding the plant,the,rstb_1937_0004.txt,txt_rstb
to be made from the facts as known at present. On,the,rstb_1937_0004.txt,txt_rstb
qualifications. I mention the above facts to show that even in,the,rstb_1937_0008.txt,txt_rstb
in Tables I—III. The outstanding facts are as follows: (1) No,the,rstb_1937_0008.txt,txt_rstb
1.—at 15 m. depth. The facts that in the sea Chaetoceros,the,rstb_1937_0008.txt,txt_rstb
the median line. All these facts dispose of Heymons’s objection quite,the,rstb_1937_0003.txt,txt_rstb
"of the genital ducts. These facts give support to the view,",the,rstb_1937_0003.txt,txt_rstb
cells accompanying each moult. The facts given by Wacner are insufficient,the,rstb_1937_0007.txt,txt_rstb
71) does not harmonize with facts observed during the post-embryonic development,the,rstb_1937_0007.txt,txt_rstb
"In the light of the facts to be described below, the",the,rstb_1937_0013.txt,txt_rstb
"between these conditions and the facts recorded above for Amphioxus, for",the,rstb_1937_0013.txt,txt_rstb
hygroscopic tent of saliva. These facts seem to indicate that the,the,rstb_1937_0001.txt,txt_rstb
is afforded by the following facts :— 1. The prothoracic spiracles,the,rstb_1937_0001.txt,txt_rstb
"Naer’s conclusion and the ontogenetic facts for Haliotis, for in this",the,rstb_1937_0012.txt,txt_rstb
"the existing theoretical views, such facts may be enlightening, for as",the,rstb_1937_0012.txt,txt_rstb
possible bearing of the ontogenetic facts upon phylogenetic theories is discussed.,the,rstb_1937_0012.txt,txt_rstb
"alternative methods of presenting the facts were considered. The first, that",the,rstb_1937_0014.txt,txt_rstb
"appropriate section, so that the facts relating to any particular tissue",the,rstb_1937_0014.txt,txt_rstb
in any way to the facts they are supposed to explain”’.,the,rstb_1937_0005.txt,txt_rstb
"well defined, is small. These facts are tabu- lated at the",the,rstb_1937_0005.txt,txt_rstb
the Australian brain does. These facts make one hopeful that a,the,rstb_1937_0005.txt,txt_rstb
brain mentioned above. When the facts concerning the medial occipital region,the,rstb_1937_0005.txt,txt_rstb
inferior is definitely established. The facts become striking by comparing the,the,rstb_1937_0005.txt,txt_rstb
harmony with the above. Two facts so far stand out :,the,rstb_1937_0005.txt,txt_rstb
races. Many interesting and suggestive facts emerge. In the lateral occipital,the,rstb_1937_0005.txt,txt_rstb
this juncture. The most significant facts arising from the work of,the,rsta_1937_0007.txt,txt_rsta
any apical system known. The facts seem to be that these,the,rstb_1938_0003.txt,txt_rstb
"partial survival may occur, the facts indicate that the oviposition response",the,rstb_1938_0005.txt,txt_rstb
virulent type of reaction. These facts led to the view ITS,the,rstb_1938_0004.txt,txt_rstb
independent of mitotic activity. The facts so far recorded relating to,the,rstb_1938_0004.txt,txt_rstb
the living and non-living. The facts are there: we must adjust,the,rstb_1938_0004.txt,txt_rstb
"control. As regards Montserrat, the facts can be explained more simply",the,rstb_1938_0002.txt,txt_rstb
"embayed valleys, because of the facts mentioned in the last paragraph,",the,rstb_1938_0002.txt,txt_rstb
type (p. 54). From these facts we may make the further,the,rstb_1938_0002.txt,txt_rstb
"hypotheses would account for the facts that, in Montserrat, pumice always",the,rstb_1938_0002.txt,txt_rstb
"by alarming events. From the facts at our disposal, however, there",the,rstb_1938_0002.txt,txt_rstb
the direction of Montserrat. These facts taken together suggest that the,the,rsta_1938_0002.txt,txt_rsta
in that vicinity. If these facts form a basis for judg-,for,rstb_1929_0004.txt,txt_rstb
that a reason for these facts is to be found in,for,rsta_1929_0001.txt,txt_rsta
2). A reason for these facts is to be found in,for,rsta_1929_0001.txt,txt_rsta
as a true vomer. Later facts revealed good reasons for considering,for,rstb_1930_0008.txt,txt_rstb
the case of Zoslerophyllum additional facts required for comparison are recorded,for,rstb_1931_0003.txt,txt_rstb
higher in the series. These facts afford substantial evidence for regarding,for,rstb_1931_0007.txt,txt_rstb
"order to indicate how the facts for Psilophyton, by adding to",for,rstb_1931_0009.txt,txt_rstb
detailed knowledge of the pertinent facts for these and other early,for,rstb_1931_0009.txt,txt_rstb
"for a time, but the facts rather suggest that there is",for,rstb_1932_0003.txt,txt_rstb
"allantoic sac. Having established these facts for Loris, we took the",for,rstb_1932_0002.txt,txt_rstb
of these and other like facts must remain over for future,for,rstb_1932_0002.txt,txt_rstb
"capable of accounting for the facts so far observed, the banded",for,rsta_1932_0010.txt,txt_rsta
"TUTTON ON DETERMINATION OF The facts that the #,-inch intervals for",for,rsta_1932_0008.txt,txt_rsta
must account for four curious facts :— (1) The distance h,for,rsta_1932_0001.txt,txt_rsta
"the trunk, there are certain facts which speak directly for the",for,rstb_1934_0009.txt,txt_rstb
not unsuitable for either species. Facts relating to reproduction are also,for,rstb_1934_0018.txt,txt_rstb
per 100 female-days ; the facts for the two species are,for,rstb_1934_0018.txt,txt_rstb
"the graph for which no facts are available ; moreover, when",for,rstb_1934_0018.txt,txt_rstb
to account for the observed facts only by supposing that in,for,rsta_1934_0018.txt,txt_rsta
"dimensions. Finally, among the curious facts noted was that for all",for,rsta_1934_0009.txt,txt_rsta
"between these conditions and the facts recorded above for Amphioxus, for",for,rstb_1937_0013.txt,txt_rstb
"Naer’s conclusion and the ontogenetic facts for Haliotis, for in this",for,rstb_1937_0012.txt,txt_rstb
"the existing theoretical views, such facts may be enlightening, for as",for,rstb_1937_0012.txt,txt_rstb
"hypotheses would account for the facts that, in Montserrat, pumice always",for,rstb_1938_0002.txt,txt_rstb
a view suggested by certain facts presently to be described. (ii),to,rstb_1929_0001.txt,txt_rstb
question of specific identity the facts do not seem to conflict,to,rstb_1929_0001.txt,txt_rstb
"first place, to confirm the facts recorded in Lophius in some",to,rstb_1929_0006.txt,txt_rstb
again less in quantity. These facts point to the conclusion that,to,rstb_1929_0006.txt,txt_rstb
Clypeastroida ” (p. 481). Two facts tend to support Hawxins’ view,to,rstb_1929_0005.txt,txt_rstb
the Spatangoids. Two embryo- logical facts seem to be in keeping,to,rstb_1929_0005.txt,txt_rstb
(dry flora). H Two significant facts come to light:—(q) pairs of,to,rstb_1929_0003.txt,txt_rstb
plate is formed- 8 ‘These facts led Gaver to the conclusion,to,rstb_1929_0009.txt,txt_rstb
"chance to give the old facts new relation- ships. This monograph,",to,rstb_1929_0004.txt,txt_rstb
"fully-viewed atoms, then the observed facts correspond to a kind of",to,rsta_1929_0010.txt,txt_rsta
that a reason for these facts is to be found in,to,rsta_1929_0001.txt,txt_rsta
2). A reason for these facts is to be found in,to,rsta_1929_0001.txt,txt_rsta
more in accord with morphological facts if it were made to,to,rstb_1930_0001.txt,txt_rstb
to defer interpretation until these facts are more numerous and capable,to,rstb_1930_0003.txt,txt_rstb
able to ascertain any further facts bearing upon the point at,to,rstb_1930_0011.txt,txt_rstb
"in view of the new facts brought to light, that it",to,rstb_1930_0011.txt,txt_rstb
brought out a number of facts which are supposed to indicate,to,rstb_1930_0005.txt,txt_rstb
"” Bu—1 V Using these facts to define @,,, Bins Ys",to,rsta_1930_0009.txt,txt_rsta
[%a-p19 (% 1 a) These facts are sufficient to determine all,to,rsta_1930_0009.txt,txt_rsta
to refer to some incidental facts which were disclosed during the,to,rsta_1930_0001.txt,txt_rsta
regard to the epipharynx the facts that it arises as a,to,rstb_1931_0001.txt,txt_rstb
than “ leaves.” Some other facts give further support to this,to,rstb_1931_0009.txt,txt_rstb
"order to indicate how the facts for Psilophyton, by adding to",to,rstb_1931_0009.txt,txt_rstb
cases our knowledge of the facts is incomplete and needs to,to,rstb_1931_0009.txt,txt_rstb
have rightly assumed that these facts are not to be under-,to,rstb_1931_0008.txt,txt_rstb
"with, the head-process. Whilst these facts seem to be quite certain,",to,rstb_1931_0010.txt,txt_rstb
is associated with K-ness. Our facts are very similar to those,to,rstb_1931_0002.txt,txt_rstb
"is welcome in itself, the facts now brought to light are",to,rstb_1932_0010.txt,txt_rstb
brief description of the new facts and then to discuss their,to,rstb_1932_0010.txt,txt_rstb
"of sections, but the available facts seem to indicate that the",to,rstb_1932_0010.txt,txt_rstb
to the Botry- chioxylon. The facts now brought forward make this,to,rstb_1932_0010.txt,txt_rstb
endoderm seems to fit the facts best. The question should be,to,rstb_1932_0003.txt,txt_rstb
3. Although some of the facts mentioned may induce us to,to,rstb_1932_0007.txt,txt_rstb
"however, to observe accurately certain facts which can be plotted in",to,rstb_1932_0017.txt,txt_rstb
"allantoic (umbilical) vessels, certain remarkable facts came to light. We found",to,rstb_1932_0002.txt,txt_rstb
"find another explanation of the facts established by us, and to",to,rstb_1932_0002.txt,txt_rstb
"86 and 235, certain noteworthy facts are brought to light. Both",to,rstb_1932_0002.txt,txt_rstb
which are collected the known facts relating to the form of,to,rstb_1932_0002.txt,txt_rstb
23. (ii) To fit the facts the relatively long range force,to,rsta_1932_0001.txt,txt_rsta
to overlook the many interesting facts concerning colour change in this,to,rstb_1934_0002.txt,txt_rstb
"An attempt to correlate these facts was unsuccessful, since DH, developed",to,rstb_1934_0004.txt,txt_rstb
Marsuauti. The recognition of these facts adds particular importance to the,to,rstb_1934_0010.txt,txt_rstb
shales (fig. 31). These geological facts were well known to Dr.,to,rstb_1934_0003.txt,txt_rstb
"23-6; Pithecanthropus, 42-8. The foregoing facts serve to demonstrate that, aside",to,rstb_1934_0003.txt,txt_rstb
"Moreover, in addition to the facts that the extrinsic eye-muscles are",to,rstb_1934_0009.txt,txt_rstb
radial file of tracheids. These facts are contrary to a method,to,rstb_1934_0017.txt,txt_rstb
"LEWIS to set out the facts first, and to consider their",to,rstb_1934_0018.txt,txt_rstb
not unsuitable for either species. Facts relating to reproduction are also,to,rstb_1934_0018.txt,txt_rstb
in early April. Very few facts relating to Glossina submorsitans are,to,rstb_1934_0018.txt,txt_rstb
"11 to 93%, though more facts would be welcome (p.192). It",to,rstb_1934_0018.txt,txt_rstb
"occurs in Glossina, and the facts in Table XIII appear to",to,rstb_1934_0018.txt,txt_rstb
attainment of definitive form. No facts contrary to the view that,to,rstb_1934_0016.txt,txt_rstb
to account for the observed facts only by supposing that in,to,rsta_1934_0018.txt,txt_rsta
detail the experi- 1) mental facts and arguments leading up to,to,rsta_1934_0010.txt,txt_rsta
"as had been thought. The facts that, in addition to reputed",to,rstb_1935_0011.txt,txt_rstb
rapidity necessary in regeneration. These facts tend to show that the,to,rstb_1935_0014.txt,txt_rstb
in order to elucidate certain facts revealed during the course of,to,rsta_1935_0013.txt,txt_rsta
to consider some of those facts which bear on S the,to,rsta_1935_0013.txt,txt_rsta
to be reconciled with the facts which ’ have been set,to,rsta_1935_0013.txt,txt_rsta
"to those after. With these facts as a basis, there has",to,rstb_1936_0010.txt,txt_rstb
"is, however, contrary to the facts presented in this paper,* unless",to,rstb_1937_0010.txt,txt_rstb
to be made from the facts as known at present. On,to,rstb_1937_0004.txt,txt_rstb
has added a number of facts of botanical interest to our,to,rstb_1937_0004.txt,txt_rstb
qualifications. I mention the above facts to show that even in,to,rstb_1937_0008.txt,txt_rstb
