Context,Word,File,Directory
"(loc. cit.) states, “ These facts suggest initial heterospory, but they",suggest,rstb_1929_0001.txt,txt_rstb
cells as in Clepsydropsis. These facts suggest that the organ may,suggest,rstb_1929_0001.txt,txt_rstb
present in the Primates. These facts suggest the following conclusions :—,suggest,rstb_1930_0009.txt,txt_rstb
bands in their relations. The facts suggest that the head-process was,suggest,rstb_1931_0010.txt,txt_rstb
numerous fine test extensions. These facts taken together suggest that the,suggest,rstb_1931_0006.txt,txt_rstb
"for a time, but the facts rather suggest that there is",suggest,rstb_1932_0003.txt,txt_rstb
"plate (see Section 4). The facts suggest that, though a surface",suggest,rsta_1932_0001.txt,txt_rsta
old. These similarities in experimental facts suggest a correspondence in the,suggest,rstb_1934_0004.txt,txt_rstb
expected were anti-bodies concerned. These facts suggest that when a living,suggest,rstb_1938_0004.txt,txt_rstb
the direction of Montserrat. These facts taken together suggest that the,suggest,rsta_1938_0002.txt,txt_rsta
present in the Primates. These facts suggest the following conclusions :—,following,rstb_1930_0009.txt,txt_rstb
"is not satisfactory, the following facts could be recognised. The head-process",following,rstb_1931_0010.txt,txt_rstb
is based on the following facts :— (1) Trawrra-Mosca states that,following,rstb_1931_0018.txt,txt_rstb
"consequence of the following “ facts of observation,” as he calls",following,rstb_1932_0001.txt,txt_rstb
On the convexity the following facts may be noted In the,following,rstb_1932_0007.txt,txt_rstb
been sectioned and the following facts are revealed :—The ventral cushion,following,rstb_1932_0020.txt,txt_rstb
(146). We note the following facts : TueoreM XXIV.—Under a purely,following,rsta_1933_0012.txt,txt_rsta
of this mechanism the following facts must be considered : (a),following,rstb_1934_0002.txt,txt_rstb
"lighter puparia, but the following facts are available. Puparia of Glossina",following,rstb_1934_0018.txt,txt_rstb
The following explanation of these facts may be suggested. The surface,following,rstb_1935_0007.txt,txt_rstb
"6, and 7. The following facts are outstanding. Aldehydes.—With Shell petrol",following,rsta_1935_0013.txt,txt_rsta
the log difference. The following facts may be noted : (a),following,rstb_1936_0010.txt,txt_rstb
is afforded by the following facts :— 1. The prothoracic spiracles,following,rstb_1937_0001.txt,txt_rstb
"(loc. cit.) states, “ These facts suggest initial heterospory, but they",these,rstb_1929_0001.txt,txt_rstb
cells as in Clepsydropsis. These facts suggest that the organ may,these,rstb_1929_0001.txt,txt_rstb
again less in quantity. These facts point to the conclusion that,these,rstb_1929_0006.txt,txt_rstb
in that vicinity. If these facts form a basis for judg-,these,rstb_1929_0004.txt,txt_rstb
"$’,4 and Q. From these facts we deduce the follow- ing:",these,rsta_1929_0008.txt,txt_rsta
ay ‘Making use of these facts we see that the variable,these,rsta_1929_0002.txt,txt_rsta
that a reason for these facts is to be found in,these,rsta_1929_0001.txt,txt_rsta
2). A reason for these facts is to be found in,these,rsta_1929_0001.txt,txt_rsta
to defer interpretation until these facts are more numerous and capable,these,rstb_1930_0003.txt,txt_rstb
"grow, or that both these facts hold good. WuU..LIAMs (1908) gave",these,rstb_1930_0004.txt,txt_rstb
present in the Primates. These facts suggest the following conclusions :—,these,rstb_1930_0009.txt,txt_rstb
"” Bu—1 V Using these facts to define @,,, Bins Ys",these,rsta_1930_0009.txt,txt_rsta
[%a-p19 (% 1 a) These facts are sufficient to determine all,these,rsta_1930_0009.txt,txt_rsta
higher in the series. These facts afford substantial evidence for regarding,these,rstb_1931_0007.txt,txt_rstb
on larval emergence. All these facts support the conclusion of Dre,these,rstb_1931_0001.txt,txt_rstb
detailed knowledge of the pertinent facts for these and other early,these,rstb_1931_0009.txt,txt_rstb
(6) The bearings of these facts are indicated and briefly discussed.,these,rstb_1931_0009.txt,txt_rstb
have rightly assumed that these facts are not to be under-,these,rstb_1931_0008.txt,txt_rstb
The possible explanation of these facts we shall discuss later in,these,rstb_1931_0010.txt,txt_rstb
"with, the head-process. Whilst these facts seem to be quite certain,",these,rstb_1931_0010.txt,txt_rstb
numerous fine test extensions. These facts taken together suggest that the,these,rstb_1931_0006.txt,txt_rstb
"Taking these considerations with the facts known in mammalia (Lirscuurz, 1924),",these,rstb_1931_0005.txt,txt_rstb
The majority of these discrepant facts can be brought under one,these,rstb_1931_0002.txt,txt_rstb
9E The summary of the facts of these crossing experiments with,these,rstb_1931_0002.txt,txt_rstb
Ola We conclude from these facts that dextral break-throughs are probably,these,rstb_1931_0002.txt,txt_rstb
the terminal carboxyl group. These facts prove conclusively that Substance “,these,rstb_1931_0027.txt,txt_rstb
"were accidentally slightly oblique, these facts indicate that I,, when deprived",these,rstb_1932_0001.txt,txt_rstb
arose on the apex. These facts indicate that there is in,these,rstb_1932_0001.txt,txt_rstb
in spite of all these facts the closed peripheral loops of,these,rstb_1932_0010.txt,txt_rstb
with that of Htapteris. These facts raise questions of nomenclature and,these,rstb_1932_0010.txt,txt_rstb
year. In view of these facts it seemed probable that the,these,rstb_1932_0012.txt,txt_rstb
is on account of these facts that Kurz found the Chinese,these,rstb_1932_0007.txt,txt_rstb
distinct brachycephalics. Corresponding with these facts the temporal lobe is somewhat,these,rstb_1932_0007.txt,txt_rstb
"29, section 18. But these facts do not show that the",these,rstb_1932_0019.txt,txt_rstb
In view of all these facts it appears highly probable that,these,rstb_1932_0016.txt,txt_rstb
"allantoic sac. Having established these facts for Loris, we took the",these,rstb_1932_0002.txt,txt_rstb
of these and other like facts must remain over for future,these,rstb_1932_0002.txt,txt_rstb
this paper further illustrate these facts (in spite of the fact,these,rstb_1932_0020.txt,txt_rstb
the opportunity of establishing these facts and proving by the resources,these,rsta_1932_0007.txt,txt_rsta
about 20° ; both these facts are about what might be,these,rsta_1932_0007.txt,txt_rsta
view. The explanation of these facts is seen in the slender,these,rstb_1934_0001.txt,txt_rstb
OF THE CEREBRUM. Despite these facts it seems improbable that this,these,rstb_1934_0001.txt,txt_rstb
pallor. In view of these facts no general statement concerning the,these,rstb_1934_0002.txt,txt_rstb
"An attempt to correlate these facts was unsuccessful, since DH, developed",these,rstb_1934_0004.txt,txt_rstb
hypha. In conjunction with these facts it should be recalled that,these,rstb_1934_0004.txt,txt_rstb
old. These similarities in experimental facts suggest a correspondence in the,these,rstb_1934_0004.txt,txt_rstb
Marsuauti. The recognition of these facts adds particular importance to the,these,rstb_1934_0010.txt,txt_rstb
feature on the vertex. These facts are very clearly demonstrated in,these,rstb_1934_0010.txt,txt_rstb
shales (fig. 31). These geological facts were well known to Dr.,these,rstb_1934_0003.txt,txt_rstb
radial file of tracheids. These facts are contrary to a method,these,rstb_1934_0017.txt,txt_rstb
the temporary symmetrical posture. These facts throw a new light on,these,rstb_1934_0019.txt,txt_rstb
in the same way. These facts of themselves practically dispose of,these,rstb_1934_0019.txt,txt_rstb
essentially the same. From these facts one may conclude that a,these,rstb_1934_0018.txt,txt_rstb
fracture oceurs. With these interesting facts on record regarding the behaviour,these,rsta_1934_0009.txt,txt_rsta
The following explanation of these facts may be suggested. The surface,these,rstb_1935_0007.txt,txt_rstb
"of the diatom. Taking these facts into con- sideration, it would",these,rstb_1935_0008.txt,txt_rstb
rapidity necessary in regeneration. These facts tend to show that the,these,rstb_1935_0014.txt,txt_rstb
"partly atrophied organ. With these facts in mind, the special granules",these,rstb_1935_0010.txt,txt_rstb
"less of a peak. These facts may possibly indicate that, at",these,rsta_1935_0013.txt,txt_rsta
"in the engine. , These facts and all the experiments described",these,rsta_1935_0013.txt,txt_rsta
"to those after. With these facts as a basis, there has",these,rstb_1936_0010.txt,txt_rstb
"In view of all these facts it is apparent, as Dopps",these,rstb_1936_0012.txt,txt_rstb
DisPLAy In view of such facts as these it is easy,these,rstb_1936_0012.txt,txt_rstb
of the valve. With these facts in mind we are in,these,rstb_1937_0002.txt,txt_rstb
than in April. All these facts show that there is no,these,rstb_1937_0008.txt,txt_rstb
the median line. All these facts dispose of Heymons’s objection quite,these,rstb_1937_0003.txt,txt_rstb
"of the genital ducts. These facts give support to the view,",these,rstb_1937_0003.txt,txt_rstb
"between these conditions and the facts recorded above for Amphioxus, for",these,rstb_1937_0013.txt,txt_rstb
hygroscopic tent of saliva. These facts seem to indicate that the,these,rstb_1937_0001.txt,txt_rstb
molars. So far as these facts are of value they would,these,rstb_1937_0015.txt,txt_rstb
H.X. respectively. Taking all these facts into consideration I think that,these,rstb_1937_0015.txt,txt_rstb
"well defined, is small. These facts are tabu- lated at the",these,rstb_1937_0005.txt,txt_rstb
the Australian brain does. These facts make one hopeful that a,these,rstb_1937_0005.txt,txt_rstb
one another in echelon. These facts were patent to both GunnincHaAM,these,rstb_1937_0005.txt,txt_rstb
"die Leibeshéhle gelangen”, but no facts support these speculations. SEDGWICK (1909)",these,rstb_1938_0001.txt,txt_rstb
any apical system known. The facts seem to be that these,these,rstb_1938_0003.txt,txt_rstb
"with X° or X"", These facts should inspire caution before invoking",these,rstb_1938_0004.txt,txt_rstb
virulent type of reaction. These facts led to the view ITS,these,rstb_1938_0004.txt,txt_rstb
expected were anti-bodies concerned. These facts suggest that when a living,these,rstb_1938_0004.txt,txt_rstb
series covered them unconformably. These facts were ascertained by inspection from,these,rstb_1938_0002.txt,txt_rstb
type (p. 54). From these facts we may make the further,these,rstb_1938_0002.txt,txt_rstb
the direction of Montserrat. These facts taken together suggest that the,these,rsta_1938_0002.txt,txt_rsta
"occurrence of this earthquake. These facts should not, however, be allowed",these,rsta_1938_0002.txt,txt_rsta
"efferent component vessels. From the facts observed in Lophius, I put",observed,rstb_1929_0006.txt,txt_rstb
on all fours with the facts observed in greater detail in,observed,rstb_1929_0006.txt,txt_rstb
"This seems likely from the facts observed in the Cod, and",observed,rstb_1929_0006.txt,txt_rstb
"I am assuming from the facts observed in Teleosteans, the lymphatic",observed,rstb_1929_0006.txt,txt_rstb
A STELLAR ATMOSPHERE. The observed facts are that hydrogen shows a,observed,rsta_1929_0010.txt,txt_rsta
"fully-viewed atoms, then the observed facts correspond to a kind of",observed,rsta_1929_0010.txt,txt_rsta
"model consistent with certain observed facts ; it may suffice, with",observed,rsta_1930_0010.txt,txt_rsta
considers that “ the observed facts accord more with such a,observed,rstb_1932_0002.txt,txt_rstb
Every new group of observed facts must be put in its,observed,rsta_1932_0005.txt,txt_rsta
"character, x, of the observed facts would arise if the hypothesis",observed,rsta_1933_0009.txt,txt_rsta
"character, x, of the observed facts were properly chosen—were, in fact,",observed,rsta_1933_0009.txt,txt_rsta
"character, x, of the observed facts ; if « > 2»",observed,rsta_1933_0009.txt,txt_rsta
"statistical practice, when the observed facts are described as “‘ samples,”",observed,rsta_1933_0009.txt,txt_rsta
is sharply defined. Two significant facts are observed : (a) that,observed,rstb_1934_0018.txt,txt_rstb
to account for the observed facts only by supposing that in,observed,rsta_1934_0018.txt,txt_rsta
"is in agreement with the facts observed by von Kocu (1882,",observed,rstb_1936_0007.txt,txt_rstb
71) does not harmonize with facts observed during the post-embryonic development,observed,rstb_1937_0007.txt,txt_rstb
"efferent component vessels. From the facts observed in Lophius, I put",observed,rstb_1929_0006.txt,txt_rstb
on all fours with the facts observed in greater detail in,observed,rstb_1929_0006.txt,txt_rstb
"This seems likely from the facts observed in the Cod, and",observed,rstb_1929_0006.txt,txt_rstb
"I am assuming from the facts observed in Teleosteans, the lymphatic",observed,rstb_1929_0006.txt,txt_rstb
A STELLAR ATMOSPHERE. The observed facts are that hydrogen shows a,observed,rsta_1929_0010.txt,txt_rsta
"fully-viewed atoms, then the observed facts correspond to a kind of",observed,rsta_1929_0010.txt,txt_rsta
"model consistent with certain observed facts ; it may suffice, with",observed,rsta_1930_0010.txt,txt_rsta
considers that “ the observed facts accord more with such a,observed,rstb_1932_0002.txt,txt_rstb
Every new group of observed facts must be put in its,observed,rsta_1932_0005.txt,txt_rsta
"character, x, of the observed facts would arise if the hypothesis",observed,rsta_1933_0009.txt,txt_rsta
"character, x, of the observed facts were properly chosen—were, in fact,",observed,rsta_1933_0009.txt,txt_rsta
"character, x, of the observed facts ; if « > 2»",observed,rsta_1933_0009.txt,txt_rsta
"statistical practice, when the observed facts are described as “‘ samples,”",observed,rsta_1933_0009.txt,txt_rsta
is sharply defined. Two significant facts are observed : (a) that,observed,rstb_1934_0018.txt,txt_rstb
to account for the observed facts only by supposing that in,observed,rsta_1934_0018.txt,txt_rsta
"is in agreement with the facts observed by von Kocu (1882,",observed,rstb_1936_0007.txt,txt_rstb
71) does not harmonize with facts observed during the post-embryonic development,observed,rstb_1937_0007.txt,txt_rstb
a view suggested by certain facts presently to be described. (ii),certain,rstb_1929_0001.txt,txt_rstb
"model consistent with certain observed facts ; it may suffice, with",certain,rsta_1930_0010.txt,txt_rsta
"however, to observe accurately certain facts which can be plotted in",certain,rstb_1932_0017.txt,txt_rstb
"allantoic (umbilical) vessels, certain remarkable facts came to light. We found",certain,rstb_1932_0002.txt,txt_rstb
"86 and 235, certain noteworthy facts are brought to light. Both",certain,rstb_1932_0002.txt,txt_rstb
"however, that certain morpho- logical facts do not, at the moment,",certain,rstb_1932_0002.txt,txt_rstb
"the trunk, there are certain facts which speak directly for the",certain,rstb_1934_0009.txt,txt_rstb
in the field. But certain facts show that conditions in the,certain,rstb_1934_0018.txt,txt_rstb
in order to elucidate certain facts revealed during the course of,certain,rsta_1935_0013.txt,txt_rsta
"the “‘ peroxides,” certain experimental facts indicated that organic peroxides might",certain,rsta_1935_0013.txt,txt_rsta
has been necessitated by certain facts recently discovered by myself and,certain,rstb_1936_0011.txt,txt_rstb
a view suggested by certain facts presently to be described. (ii),view,rstb_1929_0001.txt,txt_rstb
Clypeastroida ” (p. 481). Two facts tend to support Hawxins’ view,view,rstb_1929_0005.txt,txt_rstb
"in view of the new facts brought to light, that it",view,rstb_1930_0011.txt,txt_rstb
7). Diagnosis.—In view of the facts now described we may re-define,view,rstb_1932_0010.txt,txt_rstb
year. In view of these facts it seemed probable that the,view,rstb_1932_0012.txt,txt_rstb
In view of all these facts it appears highly probable that,view,rstb_1932_0016.txt,txt_rstb
pallor. In view of these facts no general statement concerning the,view,rstb_1934_0002.txt,txt_rstb
attainment of definitive form. No facts contrary to the view that,view,rstb_1934_0016.txt,txt_rstb
"In view of all these facts it is apparent, as Dopps",view,rstb_1936_0012.txt,txt_rstb
DisPLAy In view of such facts as these it is easy,view,rstb_1936_0012.txt,txt_rstb
virulent type of reaction. These facts led to the view ITS,view,rstb_1938_0004.txt,txt_rstb
"efferent component vessels. From the facts observed in Lophius, I put",observed,rstb_1929_0006.txt,txt_rstb
on all fours with the facts observed in greater detail in,observed,rstb_1929_0006.txt,txt_rstb
"This seems likely from the facts observed in the Cod, and",observed,rstb_1929_0006.txt,txt_rstb
"I am assuming from the facts observed in Teleosteans, the lymphatic",observed,rstb_1929_0006.txt,txt_rstb
A STELLAR ATMOSPHERE. The observed facts are that hydrogen shows a,observed,rsta_1929_0010.txt,txt_rsta
"fully-viewed atoms, then the observed facts correspond to a kind of",observed,rsta_1929_0010.txt,txt_rsta
"model consistent with certain observed facts ; it may suffice, with",observed,rsta_1930_0010.txt,txt_rsta
considers that “ the observed facts accord more with such a,observed,rstb_1932_0002.txt,txt_rstb
Every new group of observed facts must be put in its,observed,rsta_1932_0005.txt,txt_rsta
"character, x, of the observed facts would arise if the hypothesis",observed,rsta_1933_0009.txt,txt_rsta
"character, x, of the observed facts were properly chosen—were, in fact,",observed,rsta_1933_0009.txt,txt_rsta
"character, x, of the observed facts ; if « > 2»",observed,rsta_1933_0009.txt,txt_rsta
"statistical practice, when the observed facts are described as “‘ samples,”",observed,rsta_1933_0009.txt,txt_rsta
is sharply defined. Two significant facts are observed : (a) that,observed,rstb_1934_0018.txt,txt_rstb
to account for the observed facts only by supposing that in,observed,rsta_1934_0018.txt,txt_rsta
"is in agreement with the facts observed by von Kocu (1882,",observed,rstb_1936_0007.txt,txt_rstb
71) does not harmonize with facts observed during the post-embryonic development,observed,rstb_1937_0007.txt,txt_rstb
"efferent component vessels. From the facts observed in Lophius, I put",observed,rstb_1929_0006.txt,txt_rstb
on all fours with the facts observed in greater detail in,observed,rstb_1929_0006.txt,txt_rstb
"This seems likely from the facts observed in the Cod, and",observed,rstb_1929_0006.txt,txt_rstb
"I am assuming from the facts observed in Teleosteans, the lymphatic",observed,rstb_1929_0006.txt,txt_rstb
A STELLAR ATMOSPHERE. The observed facts are that hydrogen shows a,observed,rsta_1929_0010.txt,txt_rsta
"fully-viewed atoms, then the observed facts correspond to a kind of",observed,rsta_1929_0010.txt,txt_rsta
"model consistent with certain observed facts ; it may suffice, with",observed,rsta_1930_0010.txt,txt_rsta
considers that “ the observed facts accord more with such a,observed,rstb_1932_0002.txt,txt_rstb
Every new group of observed facts must be put in its,observed,rsta_1932_0005.txt,txt_rsta
"character, x, of the observed facts would arise if the hypothesis",observed,rsta_1933_0009.txt,txt_rsta
"character, x, of the observed facts were properly chosen—were, in fact,",observed,rsta_1933_0009.txt,txt_rsta
"character, x, of the observed facts ; if « > 2»",observed,rsta_1933_0009.txt,txt_rsta
"statistical practice, when the observed facts are described as “‘ samples,”",observed,rsta_1933_0009.txt,txt_rsta
is sharply defined. Two significant facts are observed : (a) that,observed,rstb_1934_0018.txt,txt_rstb
to account for the observed facts only by supposing that in,observed,rsta_1934_0018.txt,txt_rsta
"is in agreement with the facts observed by von Kocu (1882,",observed,rstb_1936_0007.txt,txt_rstb
71) does not harmonize with facts observed during the post-embryonic development,observed,rstb_1937_0007.txt,txt_rstb
on all fours with the facts observed in greater detail in,all,rstb_1929_0006.txt,txt_rstb
[%a-p19 (% 1 a) These facts are sufficient to determine all,all,rsta_1930_0009.txt,txt_rsta
on larval emergence. All these facts support the conclusion of Dre,all,rstb_1931_0001.txt,txt_rstb
in spite of all these facts the closed peripheral loops of,all,rstb_1932_0010.txt,txt_rstb
In view of all these facts it appears highly probable that,all,rstb_1932_0016.txt,txt_rstb
"in face of all the facts furnished by comparative embryology, the",all,rstb_1932_0002.txt,txt_rstb
"chance). But when all the facts are considered, the effect of",all,rstb_1934_0018.txt,txt_rstb
"dimensions. Finally, among the curious facts noted was that for all",all,rsta_1934_0009.txt,txt_rsta
"in the engine. , These facts and all the experiments described",all,rsta_1935_0013.txt,txt_rsta
"doubtfulf ; but taking all facts into consideration, the first process",all,rsta_1935_0013.txt,txt_rsta
"In view of all these facts it is apparent, as Dopps",all,rstb_1936_0012.txt,txt_rstb
than in April. All these facts show that there is no,all,rstb_1937_0008.txt,txt_rstb
the median line. All these facts dispose of Heymons’s objection quite,all,rstb_1937_0003.txt,txt_rstb
H.X. respectively. Taking all these facts into consideration I think that,all,rstb_1937_0015.txt,txt_rstb
"axis. But now that the facts are known, a symmetrical disposition",that,rstb_1929_0001.txt,txt_rstb
cells as in Clepsydropsis. These facts suggest that the organ may,that,rstb_1929_0001.txt,txt_rstb
again less in quantity. These facts point to the conclusion that,that,rstb_1929_0006.txt,txt_rstb
Gaupp’s theory would fit the facts provided that a satisfactory explanation,that,rstb_1929_0009.txt,txt_rstb
in that vicinity. If these facts form a basis for judg-,that,rstb_1929_0004.txt,txt_rstb
"is generally conceded, then the facts presented might hint that the",that,rstb_1929_0004.txt,txt_rstb
A STELLAR ATMOSPHERE. The observed facts are that hydrogen shows a,that,rsta_1929_0010.txt,txt_rsta
ay ‘Making use of these facts we see that the variable,that,rsta_1929_0002.txt,txt_rsta
that a reason for these facts is to be found in,that,rsta_1929_0001.txt,txt_rsta
termination on account of the facts that the arteries were not,that,rstb_1930_0001.txt,txt_rstb
"grow, or that both these facts hold good. WuU..LIAMs (1908) gave",that,rstb_1930_0004.txt,txt_rstb
beruhe.” In his opinion two facts show that this is not,that,rstb_1930_0004.txt,txt_rstb
"in view of the new facts brought to light, that it",that,rstb_1930_0011.txt,txt_rstb
method of procedure * The facts that the cells are not,that,rsta_1930_0004.txt,txt_rsta
regard to the epipharynx the facts that it arises as a,that,rstb_1931_0001.txt,txt_rstb
have rightly assumed that these facts are not to be under-,that,rstb_1931_0008.txt,txt_rstb
bands in their relations. The facts suggest that the head-process was,that,rstb_1931_0010.txt,txt_rstb
is based on the following facts :— (1) Trawrra-Mosca states that,that,rstb_1931_0018.txt,txt_rstb
is evident from the above facts that the biochemically interesting fungi,that,rstb_1931_0017.txt,txt_rstb
"this was based on the facts that the viviparous species, Molgula",that,rstb_1931_0006.txt,txt_rstb
numerous fine test extensions. These facts taken together suggest that the,that,rstb_1931_0006.txt,txt_rstb
that degree) that the essential facts could best be explained by,that,rstb_1931_0002.txt,txt_rstb
fits pretty well with the facts that there is a limiting,that,rstb_1931_0002.txt,txt_rstb
drawn from this series of facts is that a high <,that,rstb_1931_0002.txt,txt_rstb
Ola We conclude from these facts that dextral break-throughs are probably,that,rstb_1931_0002.txt,txt_rstb
be assumed from the foregoing facts it appears that the oxidation,that,rstb_1931_0025.txt,txt_rstb
the terminal carboxyl group. These facts prove conclusively that Substance “,that,rstb_1931_0027.txt,txt_rstb
"and in accordance with the facts that could be ascertained, it",that,rstb_1932_0001.txt,txt_rstb
"were accidentally slightly oblique, these facts indicate that I,, when deprived",that,rstb_1932_0001.txt,txt_rstb
arose on the apex. These facts indicate that there is in,that,rstb_1932_0001.txt,txt_rstb
that most of the main facts of phyllotaxis can be explained,that,rstb_1932_0001.txt,txt_rstb
"of sections, but the available facts seem to indicate that the",that,rstb_1932_0010.txt,txt_rstb
with that of Htapteris. These facts raise questions of nomenclature and,that,rstb_1932_0010.txt,txt_rstb
year. In view of these facts it seemed probable that the,that,rstb_1932_0012.txt,txt_rstb
"for a time, but the facts rather suggest that there is",that,rstb_1932_0003.txt,txt_rstb
is on account of these facts that Kurz found the Chinese,that,rstb_1932_0007.txt,txt_rstb
"explanation is supported by the facts already mentioned, that the I,a",that,rstb_1932_0019.txt,txt_rstb
"29, section 18. But these facts do not show that the",that,rstb_1932_0019.txt,txt_rstb
In view of all these facts it appears highly probable that,that,rstb_1932_0016.txt,txt_rstb
"in its position, in the facts that it often becomes fleshy,",that,rstb_1932_0016.txt,txt_rstb
considers that “ the observed facts accord more with such a,that,rstb_1932_0002.txt,txt_rstb
"great interest, -” Now the facts of development demonstrate conclusively that",that,rstb_1932_0002.txt,txt_rstb
"so or not, the important facts remain that in both the",that,rstb_1932_0002.txt,txt_rstb
"is completely implanted, but the facts that the outer margin of",that,rstb_1932_0002.txt,txt_rstb
"however, that certain morpho- logical facts do not, at the moment,",that,rstb_1932_0002.txt,txt_rstb
"TUTTON ON DETERMINATION OF The facts that the #,-inch intervals for",that,rsta_1932_0008.txt,txt_rsta
"wave-length of H,, from the facts that the yard contains 1393290-5",that,rsta_1932_0008.txt,txt_rsta
