Context,Word,File,Directory
of this mechanism the following facts must be considered : (a),the,rstb_1934_0002.txt,txt_rstb
"Fig. 3 reveals the remarkable facts that DH, and DHy may",the,rstb_1934_0004.txt,txt_rstb
old. These similarities in experimental facts suggest a correspondence in the,the,rstb_1934_0004.txt,txt_rstb
Marsuauti. The recognition of these facts adds particular importance to the,the,rstb_1934_0010.txt,txt_rstb
feature on the vertex. These facts are very clearly demonstrated in,the,rstb_1934_0010.txt,txt_rstb
"23-6; Pithecanthropus, 42-8. The foregoing facts serve to demonstrate that, aside",the,rstb_1934_0003.txt,txt_rstb
"1926, 1927), so that the facts need only brief description, the",the,rstb_1934_0009.txt,txt_rstb
is perfectly true that the facts of eye-muscle development in birds,the,rstb_1934_0009.txt,txt_rstb
"Moreover, in addition to the facts that the extrinsic eye-muscles are",the,rstb_1934_0009.txt,txt_rstb
"the trunk, there are certain facts which speak directly for the",the,rstb_1934_0009.txt,txt_rstb
one of the most interesting facts elucidated by Hayek (1924) is,the,rstb_1934_0009.txt,txt_rstb
nature. ‘Taking into account the facts that the fifth nerve already,the,rstb_1934_0015.txt,txt_rstb
the temporary symmetrical posture. These facts throw a new light on,the,rstb_1934_0019.txt,txt_rstb
disturbance—especially as many of the facts have already been recorded and,the,rstb_1934_0019.txt,txt_rstb
in the same way. These facts of themselves practically dispose of,the,rstb_1934_0019.txt,txt_rstb
of its posterior canals. The facts that its compen- satory reactions,the,rstb_1934_0019.txt,txt_rstb
It is thought that the facts here recorded will be of,the,rstb_1934_0018.txt,txt_rstb
the statistical study of the facts we have received much valued,the,rstb_1934_0018.txt,txt_rstb
"LEWIS to set out the facts first, and to consider their",the,rstb_1934_0018.txt,txt_rstb
divergence between the ‘“ observed” facts and what would be “expected,the,rstb_1934_0018.txt,txt_rstb
essentially the same. From these facts one may conclude that a,the,rstb_1934_0018.txt,txt_rstb
per 100 female-days ; the facts for the two species are,the,rstb_1934_0018.txt,txt_rstb
"chance). But when all the facts are considered, the effect of",the,rstb_1934_0018.txt,txt_rstb
"and widely, fig. 4. The facts given in Table XIV show",the,rstb_1934_0018.txt,txt_rstb
"lighter puparia, but the following facts are available. Puparia of Glossina",the,rstb_1934_0018.txt,txt_rstb
"the graph for which no facts are available ; moreover, when",the,rstb_1934_0018.txt,txt_rstb
"occurs in Glossina, and the facts in Table XIII appear to",the,rstb_1934_0018.txt,txt_rstb
in the field. But certain facts show that conditions in the,the,rstb_1934_0018.txt,txt_rstb
is at variance with the facts of development. In the first,the,rstb_1934_0016.txt,txt_rstb
attainment of definitive form. No facts contrary to the view that,the,rstb_1934_0016.txt,txt_rstb
of the aortic arches. Several facts of the manner in which,the,rstb_1934_0016.txt,txt_rstb
to account for the observed facts only by supposing that in,the,rsta_1934_0018.txt,txt_rsta
"is in accord with the facts because, as has already been",the,rsta_1934_0018.txt,txt_rsta
; an explanation of the facts is put forward. The meteorological,the,rsta_1934_0008.txt,txt_rsta
"dimensions. Finally, among the curious facts noted was that for all",the,rsta_1934_0009.txt,txt_rsta
fracture oceurs. With these interesting facts on record regarding the behaviour,the,rsta_1934_0009.txt,txt_rsta
detail the experi- 1) mental facts and arguments leading up to,the,rsta_1934_0010.txt,txt_rsta
is one of the basic facts in the study of hair,the,rsta_1934_0010.txt,txt_rsta
"not in agreement with the facts at true equilibrium, and the",the,rsta_1934_0014.txt,txt_rsta
"detail, and concerned with the facts that in Callorhynchus, (i) there",the,rstb_1935_0001.txt,txt_rstb
The following explanation of these facts may be suggested. The surface,the,rstb_1935_0007.txt,txt_rstb
"quite possible that, if the facts were more fully known, this",the,rstb_1935_0007.txt,txt_rstb
"of the diatom. Taking these facts into con- sideration, it would",the,rstb_1935_0008.txt,txt_rstb
"as had been thought. The facts that, in addition to reputed",the,rstb_1935_0011.txt,txt_rstb
different breeds. “From the foregoing facts we see in how astonishing,the,rstb_1935_0011.txt,txt_rstb
"(1931), who shows that the facts are consistent with the theory",the,rstb_1935_0011.txt,txt_rstb
disproved not only by the facts already cited in Oenothera but,the,rstb_1935_0012.txt,txt_rstb
rapidity necessary in regeneration. These facts tend to show that the,the,rstb_1935_0014.txt,txt_rstb
"conclusions are supported by the facts of regeneration in other phyla,",the,rstb_1935_0014.txt,txt_rstb
relatively indifferent cell types. The facts so far presented throw light,the,rstb_1935_0014.txt,txt_rstb
"partly atrophied organ. With these facts in mind, the special granules",the,rstb_1935_0010.txt,txt_rstb
with tissues undergoing calcification. The facts that Turcutnr does not appear,the,rstb_1935_0010.txt,txt_rstb
accumulation of yolk are the facts that such accumulation above the,the,rstb_1935_0013.txt,txt_rstb
"Taken as a whole, the facts presented in the preceding sections",the,rstb_1935_0013.txt,txt_rstb
This is confirmed by the facts recorded in a previous study,the,rstb_1935_0013.txt,txt_rstb
in order to elucidate certain facts revealed during the course of,the,rsta_1935_0013.txt,txt_rsta
"6, and 7. The following facts are outstanding. Aldehydes.—With Shell petrol",the,rsta_1935_0013.txt,txt_rsta
"the “‘ peroxides,” certain experimental facts indicated that organic peroxides might",the,rsta_1935_0013.txt,txt_rsta
"in the engine. , These facts and all the experiments described",the,rsta_1935_0013.txt,txt_rsta
"doubtfulf ; but taking all facts into consideration, the first process",the,rsta_1935_0013.txt,txt_rsta
to consider some of those facts which bear on S the,the,rsta_1935_0013.txt,txt_rsta
to be reconciled with the facts which ’ have been set,the,rsta_1935_0013.txt,txt_rsta
"the mammalian vomer, and the facts now known about the structure",the,rstb_1936_0001.txt,txt_rstb
"is in agreement with the facts observed by von Kocu (1882,",the,rstb_1936_0007.txt,txt_rstb
the log difference. The following facts may be noted : (a),the,rstb_1936_0010.txt,txt_rstb
offers striking proof of the facts disputed by previous authors that,the,rstb_1936_0006.txt,txt_rstb
are invariably crowded. The two facts of (a) the barbs on,the,rstb_1936_0006.txt,txt_rstb
state briefly the main known facts concerning the part played by,the,rstb_1936_0012.txt,txt_rstb
is no clear evidence. The facts have been well presented by,the,rstb_1936_0012.txt,txt_rstb
factors. Murpuy also records some facts about the periodic breeding of,the,rstb_1936_0012.txt,txt_rstb
"is, however, contrary to the facts presented in this paper,* unless",the,rstb_1937_0010.txt,txt_rstb
of the valve. With these facts in mind we are in,the,rstb_1937_0002.txt,txt_rstb
which corroborate and extend the facts ascertained from the three specimens,the,rstb_1937_0004.txt,txt_rstb
any discussion here of the facts described above. They afford the,the,rstb_1937_0004.txt,txt_rstb
is beyond my competence. The facts ascertained regarding the flora will,the,rstb_1937_0004.txt,txt_rstb
seems highly improbable. The further facts now known regarding the plant,the,rstb_1937_0004.txt,txt_rstb
to be made from the facts as known at present. On,the,rstb_1937_0004.txt,txt_rstb
qualifications. I mention the above facts to show that even in,the,rstb_1937_0008.txt,txt_rstb
in Tables I—III. The outstanding facts are as follows: (1) No,the,rstb_1937_0008.txt,txt_rstb
1.—at 15 m. depth. The facts that in the sea Chaetoceros,the,rstb_1937_0008.txt,txt_rstb
the median line. All these facts dispose of Heymons’s objection quite,the,rstb_1937_0003.txt,txt_rstb
"of the genital ducts. These facts give support to the view,",the,rstb_1937_0003.txt,txt_rstb
cells accompanying each moult. The facts given by Wacner are insufficient,the,rstb_1937_0007.txt,txt_rstb
71) does not harmonize with facts observed during the post-embryonic development,the,rstb_1937_0007.txt,txt_rstb
"In the light of the facts to be described below, the",the,rstb_1937_0013.txt,txt_rstb
"between these conditions and the facts recorded above for Amphioxus, for",the,rstb_1937_0013.txt,txt_rstb
hygroscopic tent of saliva. These facts seem to indicate that the,the,rstb_1937_0001.txt,txt_rstb
is afforded by the following facts :— 1. The prothoracic spiracles,the,rstb_1937_0001.txt,txt_rstb
"Naer’s conclusion and the ontogenetic facts for Haliotis, for in this",the,rstb_1937_0012.txt,txt_rstb
"the existing theoretical views, such facts may be enlightening, for as",the,rstb_1937_0012.txt,txt_rstb
possible bearing of the ontogenetic facts upon phylogenetic theories is discussed.,the,rstb_1937_0012.txt,txt_rstb
"alternative methods of presenting the facts were considered. The first, that",the,rstb_1937_0014.txt,txt_rstb
"appropriate section, so that the facts relating to any particular tissue",the,rstb_1937_0014.txt,txt_rstb
in any way to the facts they are supposed to explain”’.,the,rstb_1937_0005.txt,txt_rstb
"well defined, is small. These facts are tabu- lated at the",the,rstb_1937_0005.txt,txt_rstb
the Australian brain does. These facts make one hopeful that a,the,rstb_1937_0005.txt,txt_rstb
brain mentioned above. When the facts concerning the medial occipital region,the,rstb_1937_0005.txt,txt_rstb
inferior is definitely established. The facts become striking by comparing the,the,rstb_1937_0005.txt,txt_rstb
harmony with the above. Two facts so far stand out :,the,rstb_1937_0005.txt,txt_rstb
races. Many interesting and suggestive facts emerge. In the lateral occipital,the,rstb_1937_0005.txt,txt_rstb
this juncture. The most significant facts arising from the work of,the,rsta_1937_0007.txt,txt_rsta
any apical system known. The facts seem to be that these,the,rstb_1938_0003.txt,txt_rstb
"partial survival may occur, the facts indicate that the oviposition response",the,rstb_1938_0005.txt,txt_rstb
virulent type of reaction. These facts led to the view ITS,the,rstb_1938_0004.txt,txt_rstb
independent of mitotic activity. The facts so far recorded relating to,the,rstb_1938_0004.txt,txt_rstb
the living and non-living. The facts are there: we must adjust,the,rstb_1938_0004.txt,txt_rstb
"control. As regards Montserrat, the facts can be explained more simply",the,rstb_1938_0002.txt,txt_rstb
"embayed valleys, because of the facts mentioned in the last paragraph,",the,rstb_1938_0002.txt,txt_rstb
type (p. 54). From these facts we may make the further,the,rstb_1938_0002.txt,txt_rstb
"hypotheses would account for the facts that, in Montserrat, pumice always",the,rstb_1938_0002.txt,txt_rstb
"by alarming events. From the facts at our disposal, however, there",the,rstb_1938_0002.txt,txt_rstb
the direction of Montserrat. These facts taken together suggest that the,the,rsta_1938_0002.txt,txt_rsta
"no doubt was erect. ‘The facts suggested, at the time, the",the,rstb_1929_0001.txt,txt_rstb
the parent stem. ‘These are facts of importance in a reconstruction,the,rstb_1929_0001.txt,txt_rstb
the foliage. But with the facts at our disposal it is,the,rstb_1929_0001.txt,txt_rstb
"axis. But now that the facts are known, a symmetrical disposition",the,rstb_1929_0001.txt,txt_rstb
"the older petioles. Viewing the facts as they are, and they",the,rstb_1929_0001.txt,txt_rstb
cells as in Clepsydropsis. These facts suggest that the organ may,the,rstb_1929_0001.txt,txt_rstb
question of specific identity the facts do not seem to conflict,the,rstb_1929_0001.txt,txt_rstb
—One of the most interesting facts about C. australis is its,the,rstb_1929_0001.txt,txt_rstb
Linkage of Chromosomes. Several notable facts regarding the pairing and linkage,the,rstb_1929_0007.txt,txt_rstb
"efferent component vessels. From the facts observed in Lophius, I put",the,rstb_1929_0006.txt,txt_rstb
"first place, to confirm the facts recorded in Lophius in some",the,rstb_1929_0006.txt,txt_rstb
on all fours with the facts observed in greater detail in,the,rstb_1929_0006.txt,txt_rstb
Vessel System. With only the facts furnished by my investigation of,the,rstb_1929_0006.txt,txt_rstb
again less in quantity. These facts point to the conclusion that,the,rstb_1929_0006.txt,txt_rstb
"This seems likely from the facts observed in the Cod, and",the,rstb_1929_0006.txt,txt_rstb
"origin and morphological status. The facts so far ascertained show clearly,",the,rstb_1929_0006.txt,txt_rstb
"anatomy and embryology, but the facts : regarding them set forth",the,rstb_1929_0006.txt,txt_rstb
"think, at variance with the facts revealed by comparative anatomy and",the,rstb_1929_0006.txt,txt_rstb
"in structure and contents. The facts of comparative anatomy, as may",the,rstb_1929_0006.txt,txt_rstb
"some extent suggested by the facts of embryology. It is, of",the,rstb_1929_0006.txt,txt_rstb
"the embryo, and also the facts shown by a comparative study",the,rstb_1929_0006.txt,txt_rstb
If Sapm’s interpretation of the facts of the early ontogeny are,the,rstb_1929_0006.txt,txt_rstb
"I am assuming from the facts observed in Teleosteans, the lymphatic",the,rstb_1929_0006.txt,txt_rstb
"class Echinoidea, some of the facts brought forward in the papers",the,rstb_1929_0005.txt,txt_rstb
the Spatangoids. Two embryo- logical facts seem to be in keeping,the,rstb_1929_0005.txt,txt_rstb
plate is formed- 8 ‘These facts led Gaver to the conclusion,the,rstb_1929_0009.txt,txt_rstb
Gaupp’s theory would fit the facts provided that a satisfactory explanation,the,rstb_1929_0009.txt,txt_rstb
"chance to give the old facts new relation- ships. This monograph,",the,rstb_1929_0004.txt,txt_rstb
"is generally conceded, then the facts presented might hint that the",the,rstb_1929_0004.txt,txt_rstb
A STELLAR ATMOSPHERE. The observed facts are that hydrogen shows a,the,rsta_1929_0010.txt,txt_rsta
"fully-viewed atoms, then the observed facts correspond to a kind of",the,rsta_1929_0010.txt,txt_rsta
"$’,4 and Q. From these facts we deduce the follow- ing:",the,rsta_1929_0008.txt,txt_rsta
ay ‘Making use of these facts we see that the variable,the,rsta_1929_0002.txt,txt_rsta
the result does not represent facts when weak fields are employed.,the,rsta_1929_0002.txt,txt_rsta
termination on account of the facts that the arteries were not,the,rstb_1930_0001.txt,txt_rstb
able to ascertain any further facts bearing upon the point at,the,rstb_1930_0011.txt,txt_rstb
into details over the structural facts described by Scuunk and SrenzeL.,the,rstb_1930_0011.txt,txt_rstb
"in view of the new facts brought to light, that it",the,rstb_1930_0011.txt,txt_rstb
has ably summed up the facts and extended the application of,the,rstb_1930_0011.txt,txt_rstb
the conclusion drawn from the facts of leaf-trace development. I confess,the,rstb_1930_0011.txt,txt_rstb
present in the Primates. These facts suggest the following conclusions :—,the,rstb_1930_0009.txt,txt_rstb
is borne out by the facts adduced here. In my previous,the,rstb_1930_0005.txt,txt_rstb
method of procedure * The facts that the cells are not,the,rsta_1930_0004.txt,txt_rsta
to refer to some incidental facts which were disclosed during the,the,rsta_1930_0001.txt,txt_rsta
"smooth curve would represent the facts better, but any errors introduced",the,rsta_1930_0001.txt,txt_rsta
by the consistent body of facts regarding their shape and the,the,rstb_1931_0003.txt,txt_rstb
the case of Zoslerophyllum additional facts required for comparison are recorded,the,rstb_1931_0003.txt,txt_rstb
higher in the series. These facts afford substantial evidence for regarding,the,rstb_1931_0007.txt,txt_rstb
on larval emergence. All these facts support the conclusion of Dre,the,rstb_1931_0001.txt,txt_rstb
regard to the epipharynx the facts that it arises as a,the,rstb_1931_0001.txt,txt_rstb
types of early plant-remains. The facts ascer- tained also have their,the,rstb_1931_0009.txt,txt_rstb
the name Psilophyton princeps. The facts ascertained from the specimens available,the,rstb_1931_0009.txt,txt_rstb
the stem. Another set of facts concerns the terminal region. It,the,rstb_1931_0009.txt,txt_rstb
clothed with secretory emergences. The facts given in the body of,the,rstb_1931_0009.txt,txt_rstb
Norway and France the corresponding facts have not yet been ascertained,the,rstb_1931_0009.txt,txt_rstb
"order to indicate how the facts for Psilophyton, by adding to",the,rstb_1931_0009.txt,txt_rstb
cases our knowledge of the facts is incomplete and needs to,the,rstb_1931_0009.txt,txt_rstb
detailed knowledge of the pertinent facts for these and other early,the,rstb_1931_0009.txt,txt_rstb
"is of value. The few facts regarding the sporangia, spores and",the,rstb_1931_0009.txt,txt_rstb
(6) The bearings of these facts are indicated and briefly discussed.,the,rstb_1931_0009.txt,txt_rstb
The possible explanation of these facts we shall discuss later in,the,rstb_1931_0010.txt,txt_rstb
bands in their relations. The facts suggest that the head-process was,the,rstb_1931_0010.txt,txt_rstb
"is not satisfactory, the following facts could be recognised. The head-process",the,rstb_1931_0010.txt,txt_rstb
"with, the head-process. Whilst these facts seem to be quite certain,",the,rstb_1931_0010.txt,txt_rstb
is based on the following facts :— (1) Trawrra-Mosca states that,the,rstb_1931_0018.txt,txt_rstb
is evident from the above facts that the biochemically interesting fungi,the,rstb_1931_0017.txt,txt_rstb
"this was based on the facts that the viviparous species, Molgula",the,rstb_1931_0006.txt,txt_rstb
numerous fine test extensions. These facts taken together suggest that the,the,rstb_1931_0006.txt,txt_rstb
closer still. Summarising the principal facts and conclusions so far reached,the,rstb_1931_0006.txt,txt_rstb
"Taking these considerations with the facts known in mammalia (Lirscuurz, 1924),",the,rstb_1931_0005.txt,txt_rstb
that degree) that the essential facts could best be explained by,the,rstb_1931_0002.txt,txt_rstb
The majority of these discrepant facts can be brought under one,the,rstb_1931_0002.txt,txt_rstb
"wilds with E dextrals. The facts are suspicious, but it is",the,rstb_1931_0002.txt,txt_rstb
"reasonable explanation of the primary facts of our line-breeding and crossing,",the,rstb_1931_0002.txt,txt_rstb
"factors does not satisfy the facts any better, and on the",the,rstb_1931_0002.txt,txt_rstb
might be present. The main facts about the occurrence and behaviour,the,rstb_1931_0002.txt,txt_rstb
fits pretty well with the facts that there is a limiting,the,rstb_1931_0002.txt,txt_rstb
9E The summary of the facts of these crossing experiments with,the,rstb_1931_0002.txt,txt_rstb
them as a whole the facts fit pretty well with the,the,rstb_1931_0002.txt,txt_rstb
be assumed from the foregoing facts it appears that the oxidation,the,rstb_1931_0025.txt,txt_rstb
the terminal carboxyl group. These facts prove conclusively that Substance “,the,rstb_1931_0027.txt,txt_rstb
"consequence of the following “ facts of observation,” as he calls",the,rstb_1932_0001.txt,txt_rstb
"and in accordance with the facts that could be ascertained, it",the,rstb_1932_0001.txt,txt_rstb
arose on the apex. These facts indicate that there is in,the,rstb_1932_0001.txt,txt_rstb
that most of the main facts of phyllotaxis can be explained,the,rstb_1932_0001.txt,txt_rstb
"approximation when tested against the facts observed, and, besides being informative,",the,rstb_1932_0005.txt,txt_rstb
"is welcome in itself, the facts now brought to light are",the,rstb_1932_0010.txt,txt_rstb
brief description of the new facts and then to discuss their,the,rstb_1932_0010.txt,txt_rstb
"of sections, but the available facts seem to indicate that the",the,rstb_1932_0010.txt,txt_rstb
7). Diagnosis.—In view of the facts now described we may re-define,the,rstb_1932_0010.txt,txt_rstb
"considered till we know the facts better. + Diarch roots, with",the,rstb_1932_0010.txt,txt_rstb
to the Botry- chioxylon. The facts now brought forward make this,the,rstb_1932_0010.txt,txt_rstb
in spite of all these facts the closed peripheral loops of,the,rstb_1932_0010.txt,txt_rstb
of the anatomy has revealed facts of a very unexpected nature.,the,rstb_1932_0010.txt,txt_rstb
year. In view of these facts it seemed probable that the,the,rstb_1932_0012.txt,txt_rstb
"for a time, but the facts rather suggest that there is",the,rstb_1932_0003.txt,txt_rstb
endoderm seems to fit the facts best. The question should be,the,rstb_1932_0003.txt,txt_rstb
On the convexity the following facts may be noted In the,the,rstb_1932_0007.txt,txt_rstb
is on account of these facts that Kurz found the Chinese,the,rstb_1932_0007.txt,txt_rstb
distinct brachycephalics. Corresponding with these facts the temporal lobe is somewhat,the,rstb_1932_0007.txt,txt_rstb
3. Although some of the facts mentioned may induce us to,the,rstb_1932_0007.txt,txt_rstb
"explanation is supported by the facts already mentioned, that the I,a",the,rstb_1932_0019.txt,txt_rstb
"29, section 18. But these facts do not show that the",the,rstb_1932_0019.txt,txt_rstb
"alternative is favoured by the facts concerning I, discussed on pp.",the,rstb_1932_0019.txt,txt_rstb
perhaps slightly more. The relevant facts are recorded and discussed in,the,rstb_1932_0019.txt,txt_rstb
with some certainty. Thus the facts of association are strongly in,the,rstb_1932_0016.txt,txt_rstb
of the Corystospermacez we find facts of considerable interest. The seed-bearing,the,rstb_1932_0016.txt,txt_rstb
"in its position, in the facts that it often becomes fleshy,",the,rstb_1932_0016.txt,txt_rstb
forms and also on the facts of association. 15. A new,the,rstb_1932_0016.txt,txt_rstb
"allantoic sac. Having established these facts for Loris, we took the",the,rstb_1932_0002.txt,txt_rstb
considers that “ the observed facts accord more with such a,the,rstb_1932_0002.txt,txt_rstb
"find another explanation of the facts established by us, and to",the,rstb_1932_0002.txt,txt_rstb
us see how the known facts of its development help us,the,rstb_1932_0002.txt,txt_rstb
"great interest, -” Now the facts of development demonstrate conclusively that",the,rstb_1932_0002.txt,txt_rstb
"in face of all the facts furnished by comparative embryology, the",the,rstb_1932_0002.txt,txt_rstb
is amply substantiated by the facts and considerations set forth in,the,rstb_1932_0002.txt,txt_rstb
"so or not, the important facts remain that in both the",the,rstb_1932_0002.txt,txt_rstb
which are collected the known facts relating to the form of,the,rstb_1932_0002.txt,txt_rstb
"is completely implanted, but the facts that the outer margin of",the,rstb_1932_0002.txt,txt_rstb
recognised by the systematist. The facts and considerations I have adduced,the,rstb_1932_0002.txt,txt_rstb
the basis of the known facts concerning their development :— Anthropoidea,the,rstb_1932_0002.txt,txt_rstb
"however, that certain morpho- logical facts do not, at the moment,",the,rstb_1932_0002.txt,txt_rstb
been sectioned and the following facts are revealed :—The ventral cushion,the,rstb_1932_0020.txt,txt_rstb
this paper further illustrate these facts (in spite of the fact,the,rstb_1932_0020.txt,txt_rstb
"feature here revealed. The main facts were known before, but the",the,rstb_1932_0020.txt,txt_rstb
"capable of accounting for the facts so far observed, the banded",the,rsta_1932_0010.txt,txt_rsta
"No. 27). Taking the foregoing facts and circumstances as a whole,",the,rsta_1932_0010.txt,txt_rsta
"TUTTON ON DETERMINATION OF The facts that the #,-inch intervals for",the,rsta_1932_0008.txt,txt_rsta
"wave-length of H,, from the facts that the yard contains 1393290-5",the,rsta_1932_0008.txt,txt_rsta
"not so much on the facts mentioned by him, but that",the,rsta_1932_0007.txt,txt_rsta
the opportunity of establishing these facts and proving by the resources,the,rsta_1932_0007.txt,txt_rsta
"modes of presentation of the facts of colour mixture, and in",the,rsta_1932_0005.txt,txt_rsta
"plate (see Section 4). The facts suggest that, though a surface",the,rsta_1932_0001.txt,txt_rsta
must account for four curious facts :— (1) The distance h,the,rsta_1932_0001.txt,txt_rsta
23. (ii) To fit the facts the relatively long range force,the,rsta_1932_0001.txt,txt_rsta
(146). We note the following facts : TueoreM XXIV.—Under a purely,the,rsta_1933_0012.txt,txt_rsta
"character, x, of the observed facts would arise if the hypothesis",the,rsta_1933_0009.txt,txt_rsta
"character, x, of the observed facts were properly chosen—were, in fact,",the,rsta_1933_0009.txt,txt_rsta
"character, x, of the observed facts ; if « > 2»",the,rsta_1933_0009.txt,txt_rsta
"statistical practice, when the observed facts are described as “‘ samples,”",the,rsta_1933_0009.txt,txt_rsta
view. The explanation of these facts is seen in the slender,the,rstb_1934_0001.txt,txt_rstb
OF THE CEREBRUM. Despite these facts it seems improbable that this,the,rstb_1934_0001.txt,txt_rstb
"parieto-occipitalis is, if the above facts are valid, the upper end",the,rstb_1934_0001.txt,txt_rstb
to overlook the many interesting facts concerning colour change in this,the,rstb_1934_0002.txt,txt_rstb
pallor. In view of these facts no general statement concerning the,the,rstb_1934_0002.txt,txt_rstb
of this mechanism the following facts must be considered : (a),the,rstb_1934_0002.txt,txt_rstb
"Fig. 3 reveals the remarkable facts that DH, and DHy may",the,rstb_1934_0004.txt,txt_rstb
old. These similarities in experimental facts suggest a correspondence in the,the,rstb_1934_0004.txt,txt_rstb
Marsuauti. The recognition of these facts adds particular importance to the,the,rstb_1934_0010.txt,txt_rstb
feature on the vertex. These facts are very clearly demonstrated in,the,rstb_1934_0010.txt,txt_rstb
