Context,Collocate,File,Directory,Year,Frequency Filter
"this be the cause, the fact is indisputable in the observations,",be,rstl_1835_0007.txt,txt_rstl,1835,12
and it may be in fact referred to the combinations containing,be,rstl_1826_0031.txt,txt_rstl,1826,12
"muscles, 0. that of this fact there cannot be a doubt.",be,rstl_1826_0016.txt,txt_rstl,1826,12
these circumstances ; yet in fact there seemed to be no,be,rstl_1826_0014.txt,txt_rstl,1826,12
"whatever be the canse, the fact is certain, though at complete",be,rstl_1828_0022.txt,txt_rstl,1828,12
importance ; since 8uch a fact would be in direct opposition,be,rstl_1828_0019.txt,txt_rstl,1828,12
dissolved. Evidence of the same fact may be derived from the,be,rstl_1830_0022.txt,txt_rstl,1830,12
"to be strengthened by a fact I have noticed, that the",be,rstl_1831_0012.txt,txt_rstl,1831,12
"magnetism of rotation, seems in fact to be * In estimating",be,rstl_1831_0005.txt,txt_rstl,1831,12
the influence be exerted. This fact seems materially to distinguish the,be,rstl_1831_0005.txt,txt_rstl,1831,12
"In metallic bodies, however, the fact appears to be very de-",be,rstl_1831_0005.txt,txt_rstl,1831,12
may be proved by the fact that the other two layers,be,rstl_1833_0032.txt,txt_rstl,1833,12
"speedily rubbed off. Such a fact would be readily observyed, as",be,rstl_1833_0032.txt,txt_rstl,1833,12
able to perceive a single fact which could be brought forward,be,rstl_1833_0030.txt,txt_rstl,1833,12
but a knowledge of one fact may be of service in,be,rstl_1833_0013.txt,txt_rstl,1833,12
at the changed pole. This fact may be obseryed by turning,be,rstl_1833_0006.txt,txt_rstl,1833,12
"such appears to be the fact (697.), dependent upon a law,",be,rstl_1834_0008.txt,txt_rstl,1834,12
be as- sured of the fact by the corresponding movements of,be,rstl_1835_0012.txt,txt_rstl,1835,12
"this be the cause, the fact is indisputable in the observations,",be,rstl_1835_0007.txt,txt_rstl,1835,12
as at first ; and-this fact is very properly adduced in,as,rstl_1826_0033.txt,txt_rstl,1826,12
quite conclusive as to the fact of the compound solar rays,as,rstl_1826_0020.txt,txt_rstl,1826,12
"a mixed atmosphere, which in fact as a whole, consisted of",as,rstl_1826_0017.txt,txt_rstl,1826,12
"far as I know, the fact has not been previously obseryed;",as,rstl_1828_0022.txt,txt_rstl,1828,12
had snch eyidence of the fact as to leave no doubt,as,rstl_1828_0011.txt,txt_rstl,1828,12
10”. The approximation is in fact of the same order as,as,rstl_1832_0002.txt,txt_rstl,1832,12
"speedily rubbed off. Such a fact would be readily observyed, as",as,rstl_1833_0032.txt,txt_rstl,1833,12
"the mere nervo-muscular fibre. This fact will snggest the propriety, as",as,rstl_1833_0028.txt,txt_rstl,1833,12
"body, and converts them in fact S into protuberances, s0 as",as,rstl_1833_0021.txt,txt_rstl,1833,12
"that as it may, the fact that an appearance, exactly resembling",as,rstl_1833_0021.txt,txt_rstl,1833,12
"chemical action, and is in fact quoting the experiment as the",as,rstl_1834_0022.txt,txt_rstl,1834,12
"established as a matter of fact amongst gases and yapours, extends",as,rstl_1834_0007.txt,txt_rstl,1834,12
this last quantity being in fact the same as the reciprocal,as,rstl_1835_0014.txt,txt_rstl,1835,12
as at first ; and-this fact is very properly adduced in,as,rstl_1826_0033.txt,txt_rstl,1826,12
quite conclusive as to the fact of the compound solar rays,as,rstl_1826_0020.txt,txt_rstl,1826,12
"a mixed atmosphere, which in fact as a whole, consisted of",as,rstl_1826_0017.txt,txt_rstl,1826,12
"far as I know, the fact has not been previously obseryed;",as,rstl_1828_0022.txt,txt_rstl,1828,12
had snch eyidence of the fact as to leave no doubt,as,rstl_1828_0011.txt,txt_rstl,1828,12
10”. The approximation is in fact of the same order as,as,rstl_1832_0002.txt,txt_rstl,1832,12
"speedily rubbed off. Such a fact would be readily observyed, as",as,rstl_1833_0032.txt,txt_rstl,1833,12
"the mere nervo-muscular fibre. This fact will snggest the propriety, as",as,rstl_1833_0028.txt,txt_rstl,1833,12
"body, and converts them in fact S into protuberances, s0 as",as,rstl_1833_0021.txt,txt_rstl,1833,12
"that as it may, the fact that an appearance, exactly resembling",as,rstl_1833_0021.txt,txt_rstl,1833,12
"chemical action, and is in fact quoting the experiment as the",as,rstl_1834_0022.txt,txt_rstl,1834,12
"established as a matter of fact amongst gases and yapours, extends",as,rstl_1834_0007.txt,txt_rstl,1834,12
this last quantity being in fact the same as the reciprocal,as,rstl_1835_0014.txt,txt_rstl,1835,12
the measure of the observed fact was from four to eight.,the,rstl_1826_0034.txt,txt_rstl,1826,12
might impress on it. The fact of the direction of the,the,rstl_1826_0034.txt,txt_rstl,1826,12
"and shows, that the observed fact is not influenced by the",the,rstl_1826_0034.txt,txt_rstl,1826,12
state in this paper the fact of such a retrograde motion,the,rstl_1826_0034.txt,txt_rstl,1826,12
alkali from pure water. The fact was asserted by MM. Pac-,the,rstl_1826_0031.txt,txt_rstl,1826,12
and it may be in fact referred to the combinations containing,the,rstl_1826_0031.txt,txt_rstl,1826,12
"place, the accuracy of the fact ; and, secondly, if. verified,",the,rstl_1826_0030.txt,txt_rstl,1826,12
Thus it appears that the fact stated by M. Dz La,the,rstl_1826_0030.txt,txt_rstl,1826,12
entire. This tube is in fact left behind in the progress,the,rstl_1826_0029.txt,txt_rstl,1826,12
it is supplied by the fact that many naked animals of,the,rstl_1826_0029.txt,txt_rstl,1826,12
unable to perceive how. the fact connected with the other specimen,the,rstl_1826_0029.txt,txt_rstl,1826,12
"rest, the discovery of a fact proving magnetic influ- ence in",the,rstl_1826_0020.txt,txt_rstl,1826,12
quite conclusive as to the fact of the compound solar rays,the,rstl_1826_0020.txt,txt_rstl,1826,12
action. In surgical operations the fact is forced upon our attention,the,rstl_1826_0016.txt,txt_rstl,1826,12
the addition of water. The fact indicates that the affinity of,the,rstl_1826_0015.txt,txt_rstl,1826,12
"a friend, who communicated the fact to myself. The instrument is",the,rstl_1826_0006.txt,txt_rstl,1826,12
sweep in 1785 confirms the fact of the angle made by,the,rstl_1826_0001.txt,txt_rstl,1826,12
of 1824 was founded. The fact of a great diminution of,the,rstl_1826_0003.txt,txt_rstl,1826,12
The confirmation however of this fact is now of but se-,the,rstl_1827_0021.txt,txt_rstl,1827,12
still wanting to place the fact beyond the power of controversy,the,rstl_1827_0016.txt,txt_rstl,1827,12
from the heated body.* This fact which he has established both,the,rstl_1827_0016.txt,txt_rstl,1827,12
the microscope. The first new fact discovered in the course of,the,rstl_1827_0009.txt,txt_rstl,1827,12
trunks of the arteries. Another fact was discovered ; that during,the,rstl_1827_0009.txt,txt_rstl,1827,12
we have made. The singular fact of pearls having their origin,the,rstl_1827_0007.txt,txt_rstl,1827,12
"in Paris ; but the fact is, the period respecting the",the,rstl_1827_0007.txt,txt_rstl,1827,12
he did not wish the fact to rest upon his own,the,rstl_1827_0007.txt,txt_rstl,1827,12
wire. Having clearly ascertained the fact that the effect produced on,the,rstl_1828_0023.txt,txt_rstl,1828,12
"better than others, is a fact known to the earliest electricians",the,rstl_1828_0022.txt,txt_rstl,1828,12
"same results, will place this fact beyond the possibility of doubt.",the,rstl_1828_0022.txt,txt_rstl,1828,12
"whatever be the canse, the fact is certain, though at complete",the,rstl_1828_0022.txt,txt_rstl,1828,12
"far as I know, the fact has not been previously obseryed;",the,rstl_1828_0022.txt,txt_rstl,1828,12
"to the experi- ments. The fact however, which is stated to",the,rstl_1828_0019.txt,txt_rstl,1828,12
; nor is there any fact or any of the cireumstances,the,rstl_1828_0012.txt,txt_rstl,1828,12
had snch eyidence of the fact as to leave no doubt,the,rstl_1828_0011.txt,txt_rstl,1828,12
an imperfect conductor. The same fact is proved by the electric,the,rstl_1829_0032.txt,txt_rstl,1829,12
"all fleshiness'and substance; and in fact wasted to mere skin, the",the,rstl_1829_0029.txt,txt_rstl,1829,12
App1TI0NaL NoTE.—As the most important fact in this paper is that,the,rstl_1829_0029.txt,txt_rstl,1829,12
"the prismatic images, yet the fact aboye described seems to show",the,rstl_1829_0028.txt,txt_rstl,1829,12
"in the stomach, is a fact now admitted by all who",the,rstl_1829_0017.txt,txt_rstl,1829,12
"facie obvious, from the known fact that when z is a",the,rstl_1829_0019.txt,txt_rstl,1829,12
"surprisxed me; but though the fact was new, and the ex-",the,rstl_1829_0020.txt,txt_rstl,1829,12
"patients, however sin- gular the fact may appear, an inclination to",the,rstl_1830_0028.txt,txt_rstl,1830,12
hypothesis accords with the interesting fact lately announced ;—of Professor Hansreen,the,rstl_1830_0027.txt,txt_rstl,1830,12
that he had communicated the fact of the existence of iodine,the,rstl_1830_0019.txt,txt_rstl,1830,12
also loth to question the fact (stated on good authority) of,the,rstl_1830_0019.txt,txt_rstl,1830,12
"the description, but is in fact extremely simple after a little",the,rstl_1830_0022.txt,txt_rstl,1830,12
"Zinc, inflaming. The most remarkable fact displayed by the preceding comparison",the,rstl_1830_0022.txt,txt_rstl,1830,12
dissolved. Evidence of the same fact may be derived from the,the,rstl_1830_0022.txt,txt_rstl,1830,12
the full admission of this fact does not invalidate the results,the,rstl_1830_0008.txt,txt_rstl,1830,12
progress by them ; a fact fully proved by the cireumstance,the,rstl_1830_0002.txt,txt_rstl,1830,12
yet fully assured of the fact which is necessary to this,the,rstl_1830_0002.txt,txt_rstl,1830,12
"magnet, the following curious | fact presented itself to my notice.",the,rstl_1831_0029.txt,txt_rstl,1831,12
"present ; every year in fact increasing the amount, and rendering",the,rstl_1831_0014.txt,txt_rstl,1831,12
"courses steered, which is in fact always the case in a",the,rstl_1831_0014.txt,txt_rstl,1831,12
"the varying height marked in fact by the time, we may",the,rstl_1831_0013.txt,txt_rstl,1831,12
"to be strengthened by a fact I have noticed, that the",the,rstl_1831_0012.txt,txt_rstl,1831,12
"touching the string, which simple fact I am induced to mention",the,rstl_1831_0010.txt,txt_rstl,1831,12
"this integration, which is in fact merely an extension of the",the,rstl_1831_0016.txt,txt_rstl,1831,12
"produced. These effects are in fact the same with those described,",the,rstl_1831_0018.txt,txt_rstl,1831,12
superficial undulating portion reposed. In fact it matters not to the,the,rstl_1831_0018.txt,txt_rstl,1831,12
"with the exception of the fact last mentioned, which I had",the,rstl_1831_0007.txt,txt_rstl,1831,12
"instead of subtractive; and in fact the whole operation is reversed,",the,rstl_1831_0011.txt,txt_rstl,1831,12
in view the following interesting fact ; viz. the influence of,the,rstl_1831_0005.txt,txt_rstl,1831,12
the influence be exerted. This fact seems materially to distinguish the,the,rstl_1831_0005.txt,txt_rstl,1831,12
"In metallic bodies, however, the fact appears to be very de-",the,rstl_1831_0005.txt,txt_rstl,1831,12
the bar: it is in fact owing to this circumstance that,the,rstl_1831_0005.txt,txt_rstl,1831,12
"than the ordinary mercurial barometers,—a fact which he considers only to",the,rstl_1832_0025.txt,txt_rstl,1832,12
"upon the subject, is the fact pointed out by the observations",the,rstl_1832_0024.txt,txt_rstl,1832,12
pene- tration is effected. The fact itself is noticed by Praxy,the,rstl_1832_0022.txt,txt_rstl,1832,12
piece ; and is in fact the tube into which the,the,rstl_1832_0020.txt,txt_rstl,1832,12
"*, Having thus ascertained the fact that the influence of the",the,rstl_1832_0020.txt,txt_rstl,1832,12
"the thicker ones. Till this fact is more fully ascertained, we",the,rstl_1832_0020.txt,txt_rstl,1832,12
This certainly agrees with the fact much more nearly than might,the,rstl_1832_0020.txt,txt_rstl,1832,12
with the same plane. This fact has probably hitherto escaped de-,the,rstl_1832_0020.txt,txt_rstl,1832,12
"are readily discernible. But, the fact is rendered $till more evident",the,rstl_1832_0020.txt,txt_rstl,1832,12
experiments : which was in fact the reason for adopting the,the,rstl_1832_0020.txt,txt_rstl,1832,12
"the respiration is diminished. This fact was first determined, in regard",the,rstl_1832_0017.txt,txt_rstl,1832,12
Of the Irritability. The single fact of a power of sustaining,the,rstl_1832_0017.txt,txt_rstl,1832,12
"my former paper, and the fact is one of its most",the,rstl_1832_0017.txt,txt_rstl,1832,12
"of digestion, and in the fact of omit- ting to take",the,rstl_1832_0017.txt,txt_rstl,1832,12
reviviscence from that state. The fact of the fatal influence of,the,rstl_1832_0017.txt,txt_rstl,1832,12
perfect explanation from the additional fact of the augmented irritability or,the,rstl_1832_0017.txt,txt_rstl,1832,12
classes. But the most remarkable fact deducible from this reasoning is,the,rstl_1832_0016.txt,txt_rstl,1832,12
"through its operation, do in fact give the greatest force and",the,rstl_1832_0015.txt,txt_rstl,1832,12
"the fine metallic points, a fact which shows that the decomposition",the,rstl_1832_0014.txt,txt_rstl,1832,12
seemed most remarkable was the fact that the water in the,the,rstl_1832_0014.txt,txt_rstl,1832,12
out. It is an interesting fact that the gastric nerves are,the,rstl_1832_0013.txt,txt_rstl,1832,12
and from the ma- terial fact of its being in the,the,rstl_1832_0012.txt,txt_rstl,1832,12
"the contrary direction resulted; the fact being, that in the first",the,rstl_1832_0006.txt,txt_rstl,1832,12
of proving or disproving the fact that the deciduous mem- brane,the,rstl_1832_0004.txt,txt_rstl,1832,12
(12] which terms are in fact given in the deyelopment of,the,rstl_1832_0002.txt,txt_rstl,1832,12
10”. The approximation is in fact of the same order as,the,rstl_1832_0002.txt,txt_rstl,1832,12
volume of the Principia. In fact R= == +8 cos (2A,the,rstl_1832_0002.txt,txt_rstl,1832,12
have myself observed the same fact in the eggs of several,the,rstl_1833_0032.txt,txt_rstl,1833,12
"also are reyersed, but the fact is not easily observed, except",the,rstl_1833_0032.txt,txt_rstl,1833,12
may be proved by the fact that the other two layers,the,rstl_1833_0032.txt,txt_rstl,1833,12
"that the volutions are in fact formed of three coats, each",the,rstl_1833_0032.txt,txt_rstl,1833,12
"scar jtself also demonstrates the fact of the revolution, its hinder",the,rstl_1833_0032.txt,txt_rstl,1833,12
much reliance on the mere fact of their presence or absence,the,rstl_1833_0032.txt,txt_rstl,1833,12
the observation of the above fact induces me to giye credit,the,rstl_1833_0032.txt,txt_rstl,1833,12
"of the poles, express the fact generally, rather than give any",the,rstl_1833_0030.txt,txt_rstl,1833,12
"there of that, except the fact that the matters evolved collect",the,rstl_1833_0030.txt,txt_rstl,1833,12
"plest possible ; but the fact is against his theory, and",the,rstl_1833_0030.txt,txt_rstl,1833,12
"made the wonder, is in fact the essential condition of transfer",the,rstl_1833_0030.txt,txt_rstl,1833,12
most satisfactory manner with the fact of an element or substance,the,rstl_1833_0030.txt,txt_rstl,1833,12
of the reflex arc. The fact of the frequent occurrence of,the,rstl_1833_0028.txt,txt_rstl,1833,12
"the mere nervo-muscular fibre. This fact will snggest the propriety, as",the,rstl_1833_0028.txt,txt_rstl,1833,12
no wise vitiated by the fact noticed by Dr. ProuT. But,the,rstl_1833_0023.txt,txt_rstl,1833,12
"P.D. has been observed, the fact is indicated by dotted lines.",the,rstl_1833_0021.txt,txt_rstl,1833,12
"that as it may, the fact that an appearance, exactly resembling",the,rstl_1833_0021.txt,txt_rstl,1833,12
"by time. 6. Although the fact itself, abstractedly considered, may not",the,rstl_1833_0019.txt,txt_rstl,1833,12
or less with steel. The fact of iron retaining a trifling,the,rstl_1833_0019.txt,txt_rstl,1833,12
"root of the length. The fact is, M. BecquerEL has deduced",the,rstl_1833_0017.txt,txt_rstl,1833,12
"Sir Humenry Davy explains this fact by saying, © that the",the,rstl_1833_0016.txt,txt_rstl,1833,12
is confirmed by the observed fact of the stronger odour exhaled,the,rstl_1833_0016.txt,txt_rstl,1833,12
"of subarseniate. It is a fact of extraordinary interest, that the",the,rstl_1833_0015.txt,txt_rstl,1833,12
600?. The salt became in fact very nearly anhydrous. Now on,the,rstl_1833_0015.txt,txt_rstl,1833,12
of high water is the fact which is most important for,the,rstl_1833_0013.txt,txt_rstl,1833,12
"great rapidity, though it in fact moves slower than the tide-wave",the,rstl_1833_0013.txt,txt_rstl,1833,12
physiologists have led us. The fact on which this inference is,the,rstl_1833_0007.txt,txt_rstl,1833,12
"spinal marrow, however improbable the fact may at first sight appear,",the,rstl_1833_0007.txt,txt_rstl,1833,12
unequivocal proof of such a fact to induce its belief. The,the,rstl_1833_0007.txt,txt_rstl,1833,12
"intervention of the nerves, a fact which is well ascer- tained,",the,rstl_1833_0007.txt,txt_rstl,1833,12
"conclusion then from the foregoing fact is unavoidable, that the neryous",the,rstl_1833_0007.txt,txt_rstl,1833,12
"but adds, that © in fact the resemblance is not complete,”",the,rstl_1833_0006.txt,txt_rstl,1833,12
at the changed pole. This fact may be obseryed by turning,the,rstl_1833_0006.txt,txt_rstl,1833,12
"the process of solution, a fact particularly exposed in my paper",the,rstl_1834_0030.txt,txt_rstl,1834,12
from the parent. The principal fact on which I found this,the,rstl_1834_0026.txt,txt_rstl,1834,12
by some authors? The above fact would seem to indicate that,the,rstl_1834_0026.txt,txt_rstl,1834,12
"persist in the trials, the fact that the torpedinal electricity passes",the,rstl_1834_0026.txt,txt_rstl,1834,12
crus cerebri ; * In fact all the columns which form,the,rstl_1834_0023.txt,txt_rstl,1834,12
"chemical action, and is in fact quoting the experiment as the",the,rstl_1834_0022.txt,txt_rstl,1834,12
"condition. This, generally, is the fact described by RiTTer, Martanini, and",the,rstl_1834_0022.txt,txt_rstl,1834,12
"I think, apparent, from the fact that in the Bee, the",the,rstl_1834_0021.txt,txt_rstl,1834,12
from the ganglia. Another striking fact indicative of their separate function,the,rstl_1834_0021.txt,txt_rstl,1834,12
"nerves, there is a curious fact relating to the terminal pair,",the,rstl_1834_0021.txt,txt_rstl,1834,12
"the commencement of an interesting fact before alluded to, the for-",the,rstl_1834_0021.txt,txt_rstl,1834,12
has been adduced establishes the fact that the mammary foetus at,the,rstl_1834_0019.txt,txt_rstl,1834,12
"is a remarkable and interesting fact that in the Sloth, in",the,rstl_1834_0019.txt,txt_rstl,1834,12
HR g's (TY.) and in fact the parabolic form of the,the,rstl_1834_0017.txt,txt_rstl,1834,12
"bodies, and the like. This fact seems to have hitherto escaped",the,rstl_1834_0016.txt,txt_rstl,1834,12
"of the stars seem in fact to be, if anything, rather",the,rstl_1834_0013.txt,txt_rstl,1834,12
obtained. The approximations were in fact carried much further by M.,the,rstl_1834_0010.txt,txt_rstl,1834,12
to actual decomposition. Upon this fact is founded much of the,the,rstl_1834_0008.txt,txt_rstl,1834,12
"such appears to be the fact (697.), dependent upon a law,",the,rstl_1834_0008.txt,txt_rstl,1834,12
"solid body by the simple fact of attenuation, and is highest",the,rstl_1834_0007.txt,txt_rstl,1834,12
"the moon's transit, is in fact principally a table of the",the,rstl_1834_0004.txt,txt_rstl,1834,12
"of a fluid, are in fact the results of its motion",the,rstl_1834_0004.txt,txt_rstl,1834,12
having first made known the fact of the Brachyura of the,the,rstl_1835_0023.txt,txt_rstl,1835,12
entirely on such evidence. The fact of their not having thus,the,rstl_1835_0021.txt,txt_rstl,1835,12
and that such is the fact is proved by the following,the,rstl_1835_0021.txt,txt_rstl,1835,12
to DuTrocner until after the fact had been fully ascertained by,the,rstl_1835_0021.txt,txt_rstl,1835,12
by the water. If the fact is 80 in regard to,the,rstl_1835_0020.txt,txt_rstl,1835,12
the surrounding air. This important fact is now well ascertained. On,the,rstl_1835_0020.txt,txt_rstl,1835,12
which is cheliferous ; the fact that the Zoea has distinct,the,rstl_1835_0019.txt,txt_rstl,1835,12
to the universality of the fact of metamorphosis taking place in,the,rstl_1835_0019.txt,txt_rstl,1835,12
"of these inquiries, from the fact that five large folio plates",the,rstl_1835_0019.txt,txt_rstl,1835,12
"certain phenomena, he discovered a fact in the structure which diverted",the,rstl_1835_0015.txt,txt_rstl,1835,12
this last quantity being in fact the same as the reciprocal,the,rstl_1835_0014.txt,txt_rstl,1835,12
six monsoons; and the same fact was observed at Kotgherry on,the,rstl_1835_0012.txt,txt_rstl,1835,12
but on the whole the fact of their oc- currence during,the,rstl_1835_0012.txt,txt_rstl,1835,12
"of its existence, since the fact of the rapid, constant, and",the,rstl_1835_0012.txt,txt_rstl,1835,12
"comparatively a low range, in fact the month of July has",the,rstl_1835_0012.txt,txt_rstl,1835,12
"their labours had verified the fact established by HumBorpr, that the",the,rstl_1835_0012.txt,txt_rstl,1835,12
"than at Poona, is in fact greater. The mean of three",the,rstl_1835_0012.txt,txt_rstl,1835,12
observations at 2416 feet. One fact is very re- markable; the,the,rstl_1835_0012.txt,txt_rstl,1835,12
glass; and I deemed the fact sufficiently curious to induce me,the,rstl_1835_0012.txt,txt_rstl,1835,12
fields seem to establish the fact of the local charac- ter,the,rstl_1835_0012.txt,txt_rstl,1835,12
be as- sured of the fact by the corresponding movements of,the,rstl_1835_0012.txt,txt_rstl,1835,12
interrupting them : the anomalons fact of the mean diurnal oscillations,the,rstl_1835_0012.txt,txt_rstl,1835,12
latitude at Madras : the fact of the diurnal tides at,the,rstl_1835_0012.txt,txt_rstl,1835,12
fact. The inferences from this fact are very important ; for,the,rstl_1835_0007.txt,txt_rstl,1835,12
"this be the cause, the fact is indisputable in the observations,",the,rstl_1835_0007.txt,txt_rstl,1835,12
"particular pains to ascertain the fact with certainty, A wire of",the,rstl_1835_0005.txt,txt_rstl,1835,12
"also have increased. 1073. The fact is, that under many variations",the,rstl_1835_0005.txt,txt_rstl,1835,12
"Proceeding, however, upon the known fact that electric currents of great",the,rstl_1835_0005.txt,txt_rstl,1835,12
"earthquakes and yolcanos, that the fact appeared to require more than",the,rstl_1835_0002.txt,txt_rstl,1835,12
been laid dry; but the fact is that it fills a,the,rstl_1835_0002.txt,txt_rstl,1835,12
of sand and gravel. The fact of finding the recent shells,the,rstl_1835_0002.txt,txt_rstl,1835,12
"in the confirmation of the fact afforded by artificial marks, for",the,rstl_1835_0002.txt,txt_rstl,1835,12
"must have heen decomposed. The fact recorded by M. BroNGNIarm was,",the,rstl_1835_0002.txt,txt_rstl,1835,12
the measure of the observed fact was from four to eight.,the,rstl_1826_0034.txt,txt_rstl,1826,12
might impress on it. The fact of the direction of the,the,rstl_1826_0034.txt,txt_rstl,1826,12
"and shows, that the observed fact is not influenced by the",the,rstl_1826_0034.txt,txt_rstl,1826,12
state in this paper the fact of such a retrograde motion,the,rstl_1826_0034.txt,txt_rstl,1826,12
alkali from pure water. The fact was asserted by MM. Pac-,the,rstl_1826_0031.txt,txt_rstl,1826,12
and it may be in fact referred to the combinations containing,the,rstl_1826_0031.txt,txt_rstl,1826,12
"place, the accuracy of the fact ; and, secondly, if. verified,",the,rstl_1826_0030.txt,txt_rstl,1826,12
Thus it appears that the fact stated by M. Dz La,the,rstl_1826_0030.txt,txt_rstl,1826,12
entire. This tube is in fact left behind in the progress,the,rstl_1826_0029.txt,txt_rstl,1826,12
it is supplied by the fact that many naked animals of,the,rstl_1826_0029.txt,txt_rstl,1826,12
unable to perceive how. the fact connected with the other specimen,the,rstl_1826_0029.txt,txt_rstl,1826,12
"rest, the discovery of a fact proving magnetic influ- ence in",the,rstl_1826_0020.txt,txt_rstl,1826,12
quite conclusive as to the fact of the compound solar rays,the,rstl_1826_0020.txt,txt_rstl,1826,12
action. In surgical operations the fact is forced upon our attention,the,rstl_1826_0016.txt,txt_rstl,1826,12
the addition of water. The fact indicates that the affinity of,the,rstl_1826_0015.txt,txt_rstl,1826,12
"a friend, who communicated the fact to myself. The instrument is",the,rstl_1826_0006.txt,txt_rstl,1826,12
sweep in 1785 confirms the fact of the angle made by,the,rstl_1826_0001.txt,txt_rstl,1826,12
of 1824 was founded. The fact of a great diminution of,the,rstl_1826_0003.txt,txt_rstl,1826,12
The confirmation however of this fact is now of but se-,the,rstl_1827_0021.txt,txt_rstl,1827,12
still wanting to place the fact beyond the power of controversy,the,rstl_1827_0016.txt,txt_rstl,1827,12
from the heated body.* This fact which he has established both,the,rstl_1827_0016.txt,txt_rstl,1827,12
the microscope. The first new fact discovered in the course of,the,rstl_1827_0009.txt,txt_rstl,1827,12
trunks of the arteries. Another fact was discovered ; that during,the,rstl_1827_0009.txt,txt_rstl,1827,12
we have made. The singular fact of pearls having their origin,the,rstl_1827_0007.txt,txt_rstl,1827,12
"in Paris ; but the fact is, the period respecting the",the,rstl_1827_0007.txt,txt_rstl,1827,12
he did not wish the fact to rest upon his own,the,rstl_1827_0007.txt,txt_rstl,1827,12
wire. Having clearly ascertained the fact that the effect produced on,the,rstl_1828_0023.txt,txt_rstl,1828,12
"better than others, is a fact known to the earliest electricians",the,rstl_1828_0022.txt,txt_rstl,1828,12
