Context,Collocate,File,Directory,Year,Frequency Filter
volume of the Principia. In fact R= == +8 cos (2A,the,rstl_1832_0002.txt,txt_rstl,1832,12
have myself observed the same fact in the eggs of several,the,rstl_1833_0032.txt,txt_rstl,1833,12
"also are reyersed, but the fact is not easily observed, except",the,rstl_1833_0032.txt,txt_rstl,1833,12
may be proved by the fact that the other two layers,the,rstl_1833_0032.txt,txt_rstl,1833,12
"that the volutions are in fact formed of three coats, each",the,rstl_1833_0032.txt,txt_rstl,1833,12
"scar jtself also demonstrates the fact of the revolution, its hinder",the,rstl_1833_0032.txt,txt_rstl,1833,12
much reliance on the mere fact of their presence or absence,the,rstl_1833_0032.txt,txt_rstl,1833,12
the observation of the above fact induces me to giye credit,the,rstl_1833_0032.txt,txt_rstl,1833,12
"of the poles, express the fact generally, rather than give any",the,rstl_1833_0030.txt,txt_rstl,1833,12
"there of that, except the fact that the matters evolved collect",the,rstl_1833_0030.txt,txt_rstl,1833,12
"plest possible ; but the fact is against his theory, and",the,rstl_1833_0030.txt,txt_rstl,1833,12
"made the wonder, is in fact the essential condition of transfer",the,rstl_1833_0030.txt,txt_rstl,1833,12
most satisfactory manner with the fact of an element or substance,the,rstl_1833_0030.txt,txt_rstl,1833,12
of the reflex arc. The fact of the frequent occurrence of,the,rstl_1833_0028.txt,txt_rstl,1833,12
"the mere nervo-muscular fibre. This fact will snggest the propriety, as",the,rstl_1833_0028.txt,txt_rstl,1833,12
no wise vitiated by the fact noticed by Dr. ProuT. But,the,rstl_1833_0023.txt,txt_rstl,1833,12
"P.D. has been observed, the fact is indicated by dotted lines.",the,rstl_1833_0021.txt,txt_rstl,1833,12
"that as it may, the fact that an appearance, exactly resembling",the,rstl_1833_0021.txt,txt_rstl,1833,12
"by time. 6. Although the fact itself, abstractedly considered, may not",the,rstl_1833_0019.txt,txt_rstl,1833,12
or less with steel. The fact of iron retaining a trifling,the,rstl_1833_0019.txt,txt_rstl,1833,12
"root of the length. The fact is, M. BecquerEL has deduced",the,rstl_1833_0017.txt,txt_rstl,1833,12
"Sir Humenry Davy explains this fact by saying, © that the",the,rstl_1833_0016.txt,txt_rstl,1833,12
is confirmed by the observed fact of the stronger odour exhaled,the,rstl_1833_0016.txt,txt_rstl,1833,12
"of subarseniate. It is a fact of extraordinary interest, that the",the,rstl_1833_0015.txt,txt_rstl,1833,12
600?. The salt became in fact very nearly anhydrous. Now on,the,rstl_1833_0015.txt,txt_rstl,1833,12
of high water is the fact which is most important for,the,rstl_1833_0013.txt,txt_rstl,1833,12
"great rapidity, though it in fact moves slower than the tide-wave",the,rstl_1833_0013.txt,txt_rstl,1833,12
physiologists have led us. The fact on which this inference is,the,rstl_1833_0007.txt,txt_rstl,1833,12
"spinal marrow, however improbable the fact may at first sight appear,",the,rstl_1833_0007.txt,txt_rstl,1833,12
unequivocal proof of such a fact to induce its belief. The,the,rstl_1833_0007.txt,txt_rstl,1833,12
"intervention of the nerves, a fact which is well ascer- tained,",the,rstl_1833_0007.txt,txt_rstl,1833,12
"conclusion then from the foregoing fact is unavoidable, that the neryous",the,rstl_1833_0007.txt,txt_rstl,1833,12
"but adds, that © in fact the resemblance is not complete,”",the,rstl_1833_0006.txt,txt_rstl,1833,12
at the changed pole. This fact may be obseryed by turning,the,rstl_1833_0006.txt,txt_rstl,1833,12
"the process of solution, a fact particularly exposed in my paper",the,rstl_1834_0030.txt,txt_rstl,1834,12
from the parent. The principal fact on which I found this,the,rstl_1834_0026.txt,txt_rstl,1834,12
by some authors? The above fact would seem to indicate that,the,rstl_1834_0026.txt,txt_rstl,1834,12
"persist in the trials, the fact that the torpedinal electricity passes",the,rstl_1834_0026.txt,txt_rstl,1834,12
crus cerebri ; * In fact all the columns which form,the,rstl_1834_0023.txt,txt_rstl,1834,12
"chemical action, and is in fact quoting the experiment as the",the,rstl_1834_0022.txt,txt_rstl,1834,12
"condition. This, generally, is the fact described by RiTTer, Martanini, and",the,rstl_1834_0022.txt,txt_rstl,1834,12
"I think, apparent, from the fact that in the Bee, the",the,rstl_1834_0021.txt,txt_rstl,1834,12
from the ganglia. Another striking fact indicative of their separate function,the,rstl_1834_0021.txt,txt_rstl,1834,12
"nerves, there is a curious fact relating to the terminal pair,",the,rstl_1834_0021.txt,txt_rstl,1834,12
"the commencement of an interesting fact before alluded to, the for-",the,rstl_1834_0021.txt,txt_rstl,1834,12
has been adduced establishes the fact that the mammary foetus at,the,rstl_1834_0019.txt,txt_rstl,1834,12
"is a remarkable and interesting fact that in the Sloth, in",the,rstl_1834_0019.txt,txt_rstl,1834,12
HR g's (TY.) and in fact the parabolic form of the,the,rstl_1834_0017.txt,txt_rstl,1834,12
"bodies, and the like. This fact seems to have hitherto escaped",the,rstl_1834_0016.txt,txt_rstl,1834,12
"of the stars seem in fact to be, if anything, rather",the,rstl_1834_0013.txt,txt_rstl,1834,12
obtained. The approximations were in fact carried much further by M.,the,rstl_1834_0010.txt,txt_rstl,1834,12
to actual decomposition. Upon this fact is founded much of the,the,rstl_1834_0008.txt,txt_rstl,1834,12
"such appears to be the fact (697.), dependent upon a law,",the,rstl_1834_0008.txt,txt_rstl,1834,12
"solid body by the simple fact of attenuation, and is highest",the,rstl_1834_0007.txt,txt_rstl,1834,12
"the moon's transit, is in fact principally a table of the",the,rstl_1834_0004.txt,txt_rstl,1834,12
"of a fluid, are in fact the results of its motion",the,rstl_1834_0004.txt,txt_rstl,1834,12
having first made known the fact of the Brachyura of the,the,rstl_1835_0023.txt,txt_rstl,1835,12
entirely on such evidence. The fact of their not having thus,the,rstl_1835_0021.txt,txt_rstl,1835,12
and that such is the fact is proved by the following,the,rstl_1835_0021.txt,txt_rstl,1835,12
to DuTrocner until after the fact had been fully ascertained by,the,rstl_1835_0021.txt,txt_rstl,1835,12
by the water. If the fact is 80 in regard to,the,rstl_1835_0020.txt,txt_rstl,1835,12
the surrounding air. This important fact is now well ascertained. On,the,rstl_1835_0020.txt,txt_rstl,1835,12
which is cheliferous ; the fact that the Zoea has distinct,the,rstl_1835_0019.txt,txt_rstl,1835,12
to the universality of the fact of metamorphosis taking place in,the,rstl_1835_0019.txt,txt_rstl,1835,12
"of these inquiries, from the fact that five large folio plates",the,rstl_1835_0019.txt,txt_rstl,1835,12
"certain phenomena, he discovered a fact in the structure which diverted",the,rstl_1835_0015.txt,txt_rstl,1835,12
this last quantity being in fact the same as the reciprocal,the,rstl_1835_0014.txt,txt_rstl,1835,12
six monsoons; and the same fact was observed at Kotgherry on,the,rstl_1835_0012.txt,txt_rstl,1835,12
but on the whole the fact of their oc- currence during,the,rstl_1835_0012.txt,txt_rstl,1835,12
"of its existence, since the fact of the rapid, constant, and",the,rstl_1835_0012.txt,txt_rstl,1835,12
"comparatively a low range, in fact the month of July has",the,rstl_1835_0012.txt,txt_rstl,1835,12
"their labours had verified the fact established by HumBorpr, that the",the,rstl_1835_0012.txt,txt_rstl,1835,12
"than at Poona, is in fact greater. The mean of three",the,rstl_1835_0012.txt,txt_rstl,1835,12
observations at 2416 feet. One fact is very re- markable; the,the,rstl_1835_0012.txt,txt_rstl,1835,12
glass; and I deemed the fact sufficiently curious to induce me,the,rstl_1835_0012.txt,txt_rstl,1835,12
fields seem to establish the fact of the local charac- ter,the,rstl_1835_0012.txt,txt_rstl,1835,12
be as- sured of the fact by the corresponding movements of,the,rstl_1835_0012.txt,txt_rstl,1835,12
interrupting them : the anomalons fact of the mean diurnal oscillations,the,rstl_1835_0012.txt,txt_rstl,1835,12
latitude at Madras : the fact of the diurnal tides at,the,rstl_1835_0012.txt,txt_rstl,1835,12
fact. The inferences from this fact are very important ; for,the,rstl_1835_0007.txt,txt_rstl,1835,12
"this be the cause, the fact is indisputable in the observations,",the,rstl_1835_0007.txt,txt_rstl,1835,12
"particular pains to ascertain the fact with certainty, A wire of",the,rstl_1835_0005.txt,txt_rstl,1835,12
"also have increased. 1073. The fact is, that under many variations",the,rstl_1835_0005.txt,txt_rstl,1835,12
"Proceeding, however, upon the known fact that electric currents of great",the,rstl_1835_0005.txt,txt_rstl,1835,12
"earthquakes and yolcanos, that the fact appeared to require more than",the,rstl_1835_0002.txt,txt_rstl,1835,12
been laid dry; but the fact is that it fills a,the,rstl_1835_0002.txt,txt_rstl,1835,12
of sand and gravel. The fact of finding the recent shells,the,rstl_1835_0002.txt,txt_rstl,1835,12
"in the confirmation of the fact afforded by artificial marks, for",the,rstl_1835_0002.txt,txt_rstl,1835,12
"must have heen decomposed. The fact recorded by M. BroNGNIarm was,",the,rstl_1835_0002.txt,txt_rstl,1835,12
"and shows, that the observed fact is not influenced by the",that,rstl_1826_0034.txt,txt_rstl,1826,12
of soda. It is a fact that zine and platinum become,that,rstl_1826_0031.txt,txt_rstl,1826,12
Thus it appears that the fact stated by M. Dz La,that,rstl_1826_0030.txt,txt_rstl,1826,12
it is supplied by the fact that many naked animals of,that,rstl_1826_0029.txt,txt_rstl,1826,12
"heated body. It is a fact ascertained, that when blood is",that,rstl_1826_0018.txt,txt_rstl,1826,12
"muscles, 0. that of this fact there cannot be a doubt.",that,rstl_1826_0016.txt,txt_rstl,1826,12
the addition of water. The fact indicates that the affinity of,that,rstl_1826_0015.txt,txt_rstl,1826,12
"greatly deranged mine, was a fact that considerably sur- prised me.",that,rstl_1827_0017.txt,txt_rstl,1827,12
trunks of the arteries. Another fact was discovered ; that during,that,rstl_1827_0009.txt,txt_rstl,1827,12
wire. Having clearly ascertained the fact that the effect produced on,that,rstl_1828_0023.txt,txt_rstl,1828,12
cloud. It is a well-known fact that imperfect conductors become tolerably,that,rstl_1828_0022.txt,txt_rstl,1828,12
"only furnished me with one fact new to myself; namely, that",that,rstl_1828_0007.txt,txt_rstl,1828,12
App1TI0NaL NoTE.—As the most important fact in this paper is that,that,rstl_1829_0029.txt,txt_rstl,1829,12
"I was led to this fact by observing, that when a",that,rstl_1829_0027.txt,txt_rstl,1829,12
of yoluntary motion is a fact generally admitted ; and that,that,rstl_1829_0024.txt,txt_rstl,1829,12
"facie obvious, from the known fact that when z is a",that,rstl_1829_0019.txt,txt_rstl,1829,12
cannot but think that a fact of such im- portance in,that,rstl_1830_0025.txt,txt_rstl,1830,12
that he had communicated the fact of the existence of iodine,that,rstl_1830_0019.txt,txt_rstl,1830,12
"to be strengthened by a fact I have noticed, that the",that,rstl_1831_0012.txt,txt_rstl,1831,12
"experiments also a very remarkable fact was discovered ; namely, that",that,rstl_1831_0007.txt,txt_rstl,1831,12
the bar: it is in fact owing to this circumstance that,that,rstl_1831_0005.txt,txt_rstl,1831,12
"*, Having thus ascertained the fact that the influence of the",that,rstl_1832_0020.txt,txt_rstl,1832,12
reviviscence from that state. The fact of the fatal influence of,that,rstl_1832_0017.txt,txt_rstl,1832,12
"the fine metallic points, a fact which shows that the decomposition",that,rstl_1832_0014.txt,txt_rstl,1832,12
seemed most remarkable was the fact that the water in the,that,rstl_1832_0014.txt,txt_rstl,1832,12
out. It is an interesting fact that the gastric nerves are,that,rstl_1832_0013.txt,txt_rstl,1832,12
"the contrary direction resulted; the fact being, that in the first",that,rstl_1832_0006.txt,txt_rstl,1832,12
of proving or disproving the fact that the deciduous mem- brane,that,rstl_1832_0004.txt,txt_rstl,1832,12
may be proved by the fact that the other two layers,that,rstl_1833_0032.txt,txt_rstl,1833,12
It is remarkable that this fact should not have been before,that,rstl_1833_0032.txt,txt_rstl,1833,12
"that the volutions are in fact formed of three coats, each",that,rstl_1833_0032.txt,txt_rstl,1833,12
"there of that, except the fact that the matters evolved collect",that,rstl_1833_0030.txt,txt_rstl,1833,12
nebulz ; and that in fact there is hardly any branch,that,rstl_1833_0021.txt,txt_rstl,1833,12
"that as it may, the fact that an appearance, exactly resembling",that,rstl_1833_0021.txt,txt_rstl,1833,12
"Sir Humenry Davy explains this fact by saying, © that the",that,rstl_1833_0016.txt,txt_rstl,1833,12
"of subarseniate. It is a fact of extraordinary interest, that the",that,rstl_1833_0015.txt,txt_rstl,1833,12
of that influence. In another fact we find an additional objection,that,rstl_1833_0007.txt,txt_rstl,1833,12
do we pos8ess a single fact to prove that there are,that,rstl_1833_0007.txt,txt_rstl,1833,12
"that they are not in fact stimulants to that fibre, but",that,rstl_1833_0007.txt,txt_rstl,1833,12
"conclusion then from the foregoing fact is unavoidable, that the neryous",that,rstl_1833_0007.txt,txt_rstl,1833,12
"but adds, that © in fact the resemblance is not complete,”",that,rstl_1833_0006.txt,txt_rstl,1833,12
by some authors? The above fact would seem to indicate that,that,rstl_1834_0026.txt,txt_rstl,1834,12
"persist in the trials, the fact that the torpedinal electricity passes",that,rstl_1834_0026.txt,txt_rstl,1834,12
"I think, apparent, from the fact that in the Bee, the",that,rstl_1834_0021.txt,txt_rstl,1834,12
has been adduced establishes the fact that the mammary foetus at,that,rstl_1834_0019.txt,txt_rstl,1834,12
"is a remarkable and interesting fact that in the Sloth, in",that,rstl_1834_0019.txt,txt_rstl,1834,12
"moon, we find that in fact its amount is different at",that,rstl_1834_0004.txt,txt_rstl,1834,12
and that such is the fact is proved by the following,that,rstl_1835_0021.txt,txt_rstl,1835,12
which is cheliferous ; the fact that the Zoea has distinct,that,rstl_1835_0019.txt,txt_rstl,1835,12
"of these inquiries, from the fact that five large folio plates",that,rstl_1835_0019.txt,txt_rstl,1835,12
will show that a similar fact has been ob- served among,that,rstl_1835_0018.txt,txt_rstl,1835,12
"their labours had verified the fact established by HumBorpr, that the",that,rstl_1835_0012.txt,txt_rstl,1835,12
"also have increased. 1073. The fact is, that under many variations",that,rstl_1835_0005.txt,txt_rstl,1835,12
"Proceeding, however, upon the known fact that electric currents of great",that,rstl_1835_0005.txt,txt_rstl,1835,12
"earthquakes and yolcanos, that the fact appeared to require more than",that,rstl_1835_0002.txt,txt_rstl,1835,12
been laid dry; but the fact is that it fills a,that,rstl_1835_0002.txt,txt_rstl,1835,12
"and shows, that the observed fact is not influenced by the",that,rstl_1826_0034.txt,txt_rstl,1826,12
of soda. It is a fact that zine and platinum become,that,rstl_1826_0031.txt,txt_rstl,1826,12
Thus it appears that the fact stated by M. Dz La,that,rstl_1826_0030.txt,txt_rstl,1826,12
it is supplied by the fact that many naked animals of,that,rstl_1826_0029.txt,txt_rstl,1826,12
"heated body. It is a fact ascertained, that when blood is",that,rstl_1826_0018.txt,txt_rstl,1826,12
"muscles, 0. that of this fact there cannot be a doubt.",that,rstl_1826_0016.txt,txt_rstl,1826,12
the addition of water. The fact indicates that the affinity of,that,rstl_1826_0015.txt,txt_rstl,1826,12
"greatly deranged mine, was a fact that considerably sur- prised me.",that,rstl_1827_0017.txt,txt_rstl,1827,12
trunks of the arteries. Another fact was discovered ; that during,that,rstl_1827_0009.txt,txt_rstl,1827,12
wire. Having clearly ascertained the fact that the effect produced on,that,rstl_1828_0023.txt,txt_rstl,1828,12
cloud. It is a well-known fact that imperfect conductors become tolerably,that,rstl_1828_0022.txt,txt_rstl,1828,12
"only furnished me with one fact new to myself; namely, that",that,rstl_1828_0007.txt,txt_rstl,1828,12
App1TI0NaL NoTE.—As the most important fact in this paper is that,that,rstl_1829_0029.txt,txt_rstl,1829,12
"I was led to this fact by observing, that when a",that,rstl_1829_0027.txt,txt_rstl,1829,12
of yoluntary motion is a fact generally admitted ; and that,that,rstl_1829_0024.txt,txt_rstl,1829,12
"facie obvious, from the known fact that when z is a",that,rstl_1829_0019.txt,txt_rstl,1829,12
cannot but think that a fact of such im- portance in,that,rstl_1830_0025.txt,txt_rstl,1830,12
that he had communicated the fact of the existence of iodine,that,rstl_1830_0019.txt,txt_rstl,1830,12
"to be strengthened by a fact I have noticed, that the",that,rstl_1831_0012.txt,txt_rstl,1831,12
"experiments also a very remarkable fact was discovered ; namely, that",that,rstl_1831_0007.txt,txt_rstl,1831,12
the bar: it is in fact owing to this circumstance that,that,rstl_1831_0005.txt,txt_rstl,1831,12
"*, Having thus ascertained the fact that the influence of the",that,rstl_1832_0020.txt,txt_rstl,1832,12
reviviscence from that state. The fact of the fatal influence of,that,rstl_1832_0017.txt,txt_rstl,1832,12
"the fine metallic points, a fact which shows that the decomposition",that,rstl_1832_0014.txt,txt_rstl,1832,12
seemed most remarkable was the fact that the water in the,that,rstl_1832_0014.txt,txt_rstl,1832,12
out. It is an interesting fact that the gastric nerves are,that,rstl_1832_0013.txt,txt_rstl,1832,12
"the contrary direction resulted; the fact being, that in the first",that,rstl_1832_0006.txt,txt_rstl,1832,12
of proving or disproving the fact that the deciduous mem- brane,that,rstl_1832_0004.txt,txt_rstl,1832,12
may be proved by the fact that the other two layers,that,rstl_1833_0032.txt,txt_rstl,1833,12
It is remarkable that this fact should not have been before,that,rstl_1833_0032.txt,txt_rstl,1833,12
"that the volutions are in fact formed of three coats, each",that,rstl_1833_0032.txt,txt_rstl,1833,12
"there of that, except the fact that the matters evolved collect",that,rstl_1833_0030.txt,txt_rstl,1833,12
nebulz ; and that in fact there is hardly any branch,that,rstl_1833_0021.txt,txt_rstl,1833,12
"that as it may, the fact that an appearance, exactly resembling",that,rstl_1833_0021.txt,txt_rstl,1833,12
"Sir Humenry Davy explains this fact by saying, © that the",that,rstl_1833_0016.txt,txt_rstl,1833,12
"of subarseniate. It is a fact of extraordinary interest, that the",that,rstl_1833_0015.txt,txt_rstl,1833,12
of that influence. In another fact we find an additional objection,that,rstl_1833_0007.txt,txt_rstl,1833,12
do we pos8ess a single fact to prove that there are,that,rstl_1833_0007.txt,txt_rstl,1833,12
"that they are not in fact stimulants to that fibre, but",that,rstl_1833_0007.txt,txt_rstl,1833,12
"conclusion then from the foregoing fact is unavoidable, that the neryous",that,rstl_1833_0007.txt,txt_rstl,1833,12
"but adds, that © in fact the resemblance is not complete,”",that,rstl_1833_0006.txt,txt_rstl,1833,12
by some authors? The above fact would seem to indicate that,that,rstl_1834_0026.txt,txt_rstl,1834,12
"persist in the trials, the fact that the torpedinal electricity passes",that,rstl_1834_0026.txt,txt_rstl,1834,12
"I think, apparent, from the fact that in the Bee, the",that,rstl_1834_0021.txt,txt_rstl,1834,12
has been adduced establishes the fact that the mammary foetus at,that,rstl_1834_0019.txt,txt_rstl,1834,12
"is a remarkable and interesting fact that in the Sloth, in",that,rstl_1834_0019.txt,txt_rstl,1834,12
"moon, we find that in fact its amount is different at",that,rstl_1834_0004.txt,txt_rstl,1834,12
and that such is the fact is proved by the following,that,rstl_1835_0021.txt,txt_rstl,1835,12
which is cheliferous ; the fact that the Zoea has distinct,that,rstl_1835_0019.txt,txt_rstl,1835,12
"of these inquiries, from the fact that five large folio plates",that,rstl_1835_0019.txt,txt_rstl,1835,12
will show that a similar fact has been ob- served among,that,rstl_1835_0018.txt,txt_rstl,1835,12
"their labours had verified the fact established by HumBorpr, that the",that,rstl_1835_0012.txt,txt_rstl,1835,12
"also have increased. 1073. The fact is, that under many variations",that,rstl_1835_0005.txt,txt_rstl,1835,12
"Proceeding, however, upon the known fact that electric currents of great",that,rstl_1835_0005.txt,txt_rstl,1835,12
"earthquakes and yolcanos, that the fact appeared to require more than",that,rstl_1835_0002.txt,txt_rstl,1835,12
been laid dry; but the fact is that it fills a,that,rstl_1835_0002.txt,txt_rstl,1835,12
as at first ; and-this fact is very properly adduced in,as,rstl_1826_0033.txt,txt_rstl,1826,12
quite conclusive as to the fact of the compound solar rays,as,rstl_1826_0020.txt,txt_rstl,1826,12
"a mixed atmosphere, which in fact as a whole, consisted of",as,rstl_1826_0017.txt,txt_rstl,1826,12
"far as I know, the fact has not been previously obseryed;",as,rstl_1828_0022.txt,txt_rstl,1828,12
had snch eyidence of the fact as to leave no doubt,as,rstl_1828_0011.txt,txt_rstl,1828,12
10”. The approximation is in fact of the same order as,as,rstl_1832_0002.txt,txt_rstl,1832,12
"speedily rubbed off. Such a fact would be readily observyed, as",as,rstl_1833_0032.txt,txt_rstl,1833,12
"the mere nervo-muscular fibre. This fact will snggest the propriety, as",as,rstl_1833_0028.txt,txt_rstl,1833,12
"body, and converts them in fact S into protuberances, s0 as",as,rstl_1833_0021.txt,txt_rstl,1833,12
"that as it may, the fact that an appearance, exactly resembling",as,rstl_1833_0021.txt,txt_rstl,1833,12
"chemical action, and is in fact quoting the experiment as the",as,rstl_1834_0022.txt,txt_rstl,1834,12
"established as a matter of fact amongst gases and yapours, extends",as,rstl_1834_0007.txt,txt_rstl,1834,12
this last quantity being in fact the same as the reciprocal,as,rstl_1835_0014.txt,txt_rstl,1835,12
as at first ; and-this fact is very properly adduced in,as,rstl_1826_0033.txt,txt_rstl,1826,12
quite conclusive as to the fact of the compound solar rays,as,rstl_1826_0020.txt,txt_rstl,1826,12
"a mixed atmosphere, which in fact as a whole, consisted of",as,rstl_1826_0017.txt,txt_rstl,1826,12
"far as I know, the fact has not been previously obseryed;",as,rstl_1828_0022.txt,txt_rstl,1828,12
had snch eyidence of the fact as to leave no doubt,as,rstl_1828_0011.txt,txt_rstl,1828,12
10”. The approximation is in fact of the same order as,as,rstl_1832_0002.txt,txt_rstl,1832,12
"speedily rubbed off. Such a fact would be readily observyed, as",as,rstl_1833_0032.txt,txt_rstl,1833,12
"the mere nervo-muscular fibre. This fact will snggest the propriety, as",as,rstl_1833_0028.txt,txt_rstl,1833,12
"body, and converts them in fact S into protuberances, s0 as",as,rstl_1833_0021.txt,txt_rstl,1833,12
"that as it may, the fact that an appearance, exactly resembling",as,rstl_1833_0021.txt,txt_rstl,1833,12
"chemical action, and is in fact quoting the experiment as the",as,rstl_1834_0022.txt,txt_rstl,1834,12
"established as a matter of fact amongst gases and yapours, extends",as,rstl_1834_0007.txt,txt_rstl,1834,12
this last quantity being in fact the same as the reciprocal,as,rstl_1835_0014.txt,txt_rstl,1835,12
"difficult E to conceive a fact short of absolute demonstration, which",which,rstl_1826_0029.txt,txt_rstl,1826,12
"a mixed atmosphere, which in fact as a whole, consisted of",which,rstl_1826_0017.txt,txt_rstl,1826,12
from the heated body.* This fact which he has established both,which,rstl_1827_0016.txt,txt_rstl,1827,12
"to the experi- ments. The fact however, which is stated to",which,rstl_1828_0019.txt,txt_rstl,1828,12
"These trials sufficiently prove a fact which was otherwise apparent, —that",which,rstl_1830_0014.txt,txt_rstl,1830,12
yet fully assured of the fact which is necessary to this,which,rstl_1830_0002.txt,txt_rstl,1830,12
which is 1.6. But in fact a small change of position,which,rstl_1831_0027.txt,txt_rstl,1831,12
"courses steered, which is in fact always the case in a",which,rstl_1831_0014.txt,txt_rstl,1831,12
"touching the string, which simple fact I am induced to mention",which,rstl_1831_0010.txt,txt_rstl,1831,12
"this integration, which is in fact merely an extension of the",which,rstl_1831_0016.txt,txt_rstl,1831,12
"with the exception of the fact last mentioned, which I had",which,rstl_1831_0007.txt,txt_rstl,1831,12
"52m, which did not in fact occur, and give no tide",which,rstl_1832_0026.txt,txt_rstl,1832,12
"than the ordinary mercurial barometers,—a fact which he considers only to",which,rstl_1832_0025.txt,txt_rstl,1832,12
piece ; and is in fact the tube into which the,which,rstl_1832_0020.txt,txt_rstl,1832,12
experiments : which was in fact the reason for adopting the,which,rstl_1832_0020.txt,txt_rstl,1832,12
air without pain ; a fact which receives an interesting and,which,rstl_1832_0017.txt,txt_rstl,1832,12
"the fine metallic points, a fact which shows that the decomposition",which,rstl_1832_0014.txt,txt_rstl,1832,12
us to account for a fact in electro-magnetism which has never,which,rstl_1832_0014.txt,txt_rstl,1832,12
(12] which terms are in fact given in the deyelopment of,which,rstl_1832_0002.txt,txt_rstl,1832,12
R. These terms are in fact multiplied by n which is,which,rstl_1832_0002.txt,txt_rstl,1832,12
able to perceive a single fact which could be brought forward,which,rstl_1833_0030.txt,txt_rstl,1833,12
"(but which is in = fact a finite quantity,) is added",which,rstl_1833_0020.txt,txt_rstl,1833,12
of high water is the fact which is most important for,which,rstl_1833_0013.txt,txt_rstl,1833,12
physiologists have led us. The fact on which this inference is,which,rstl_1833_0007.txt,txt_rstl,1833,12
"intervention of the nerves, a fact which is well ascer- tained,",which,rstl_1833_0007.txt,txt_rstl,1833,12
