Context,Word,File,Directory
"atmospheric air, These facts are in harmony",these,rstl_1861_0001.txt,txt_rstl
"aperture. Keeping these facts in view, it",these,rstl_1861_0029.txt,txt_rstl
statement of these facts it should be,these,rstl_1861_0024.txt,txt_rstl
doubt that these facts are evidence of,these,rstl_1862_0042.txt,txt_rstl
"and as these facts have been observed,",these,rstl_1862_0038.txt,txt_rstl
above this. These facts may be explained,these,rstl_1862_0040.txt,txt_rstl
like rocks. These facts point towards the,these,rstl_1862_0033.txt,txt_rstl
"acid (83.); these facts also indicate that,",these,rstl_1862_0020.txt,txt_rstl
London values. These facts all indicate the,these,rstl_1862_0013.txt,txt_rstl
cold. From these facts we learn another,these,rstl_1862_0001.txt,txt_rstl
"Now, keeping these facts in view, let",these,rstl_1863_0030.txt,txt_rstl
the other.” These facts were in full,these,rstl_1864_0006.txt,txt_rstl
at these singular facts ; but I,these,rstl_1864_0009.txt,txt_rstl
deduced from these facts that two distinctly,these,rstl_1864_0018.txt,txt_rstl
recently submitted these facts to the Anthropological,these,rstl_1864_0015.txt,txt_rstl
from the preceding facts are these ;—First.,these,rstl_1864_0015.txt,txt_rstl
freezing-point. AI these facts together leave hardly,these,rstl_1865_0004.txt,txt_rstl
"process. Bearing these facts in mind, we",these,rstl_1866_0012.txt,txt_rstl
reasoning upon these facts by their aid.,these,rstl_1866_0026.txt,txt_rstl
operated upon. These facts surely afford strong,these,rstl_1866_0014.txt,txt_rstl
between these two facts I am unable,these,rstl_1866_0021.txt,txt_rstl
meh importance. These facts show that M.,these,rstl_1866_0021.txt,txt_rstl
"explanation of these facts at present, as",these,rstl_1867_0015.txt,txt_rstl
bo These few facts may for the,these,rstl_1867_0015.txt,txt_rstl
remainder. Of these facts he gives the,these,rstl_1867_0018.txt,txt_rstl
"attention to these facts because, as has",these,rstl_1867_0003.txt,txt_rstl
rapid tremor. These facts strongly suggest the,these,rstl_1867_0014.txt,txt_rstl
These in i facts have been fully,these,rstl_1868_0010.txt,txt_rstl
some of these facts M. VULeran thinks,these,rstl_1868_0010.txt,txt_rstl
bring these striking facts forward at once.,these,rstl_1869_0015.txt,txt_rstl
Do not these facts appear to demonstrate,these,rstl_1869_0017.txt,txt_rstl
"research. These new facts required new discussion,",these,rstl_1869_0006.txt,txt_rstl
"Henscnr, places these facts in a more",these,rstl_1869_0001.txt,txt_rstl
of the commonest facts of observation. These,these,rstl_1870_0019.txt,txt_rstl
because the two facts with which we,which,rstl_1861_0008.txt,txt_rstl
of the principal facts which are contained,which,rstl_1861_0030.txt,txt_rstl
the most important facts with Which we,which,rstl_1861_0024.txt,txt_rstl
are we without facts which give some,which,rstl_1862_0042.txt,txt_rstl
and many other facts which I have,which,rstl_1862_0038.txt,txt_rstl
substances; and the facts which have been,which,rstl_1862_0040.txt,txt_rstl
"conclusion which such facts permit is, that",which,rstl_1862_0040.txt,txt_rstl
Two of the facts which I have,which,rstl_1862_0040.txt,txt_rstl
"yet complete, the facts which have already",which,rstl_1862_0012.txt,txt_rstl
to which the facts diseussed inevitably lead;,which,rstl_1862_0019.txt,txt_rstl
a class of facts which surprised and,which,rstl_1862_0008.txt,txt_rstl
combination of the facts which would be,which,rstl_1863_0030.txt,txt_rstl
are justified by facts which have been,which,rstl_1863_0026.txt,txt_rstl
"both works, the facts which had been",which,rstl_1864_0006.txt,txt_rstl
solutions of various facts which have hitherto,which,rstl_1864_0009.txt,txt_rstl
which the-anato- mical facts render tenable. 'The,which,rstl_1865_0007.txt,txt_rstl
I have adduced facts which render it,which,rstl_1865_0007.txt,txt_rstl
life. X The facts which I regard,which,rstl_1865_0007.txt,txt_rstl
wishing-principally <o find facts which could serve,which,rstl_1865_0004.txt,txt_rstl
a class of facts with which he,which,rstl_1866_0026.txt,txt_rstl
sion of the facts with which the,which,rstl_1866_0026.txt,txt_rstl
in which the facts are regarded. From,which,rstl_1866_0026.txt,txt_rstl
a body of facts which subsequent research,which,rstl_1866_0024.txt,txt_rstl
"as to the facts which he records,",which,rstl_1866_0024.txt,txt_rstl
attention to the facts which may be,which,rstl_1867_0015.txt,txt_rstl
"to investigate the facts in question, which",which,rstl_1867_0018.txt,txt_rstl
propositions the leading facts which have been,which,rstl_1868_0025.txt,txt_rstl
possible the leading facts which have been,which,rstl_1868_0025.txt,txt_rstl
point out the facts <= which were,which,rstl_1868_0025.txt,txt_rstl
although from certain facts which had been,which,rstl_1868_0025.txt,txt_rstl
of all the facts which I had,which,rstl_1868_0025.txt,txt_rstl
and 147. The facts which seem to,which,rstl_1868_0004.txt,txt_rstl
and the incontroyertible facts on which it,which,rstl_1868_0014.txt,txt_rstl
new and important facts which I have,which,rstl_1868_0010.txt,txt_rstl
quota to the facts upon which the,which,rstl_1869_0031.txt,txt_rstl
most important new facts at which T,which,rstl_1869_0013.txt,txt_rstl
a class of facts which contradict it.,which,rstl_1870_0019.txt,txt_rstl
study of the facts which surround us,which,rstl_1870_0009.txt,txt_rstl
"writer, that the facts which have now",which,rstl_1870_0008.txt,txt_rstl
drawn from the facts observed. The author,from,rstl_1862_0041.txt,txt_rstl
"drawn from the facts demonstrated is, that",from,rstl_1862_0038.txt,txt_rstl
"draw from the facts related, for my",from,rstl_1862_0012.txt,txt_rstl
from the observed facts that ice did,from,rstl_1862_0034.txt,txt_rstl
cold. From these facts we learn another,from,rstl_1862_0001.txt,txt_rstl
conclusion from the facts established by expe-,from,rstl_1863_0001.txt,txt_rstl
deduced from these facts that two distinctly,from,rstl_1864_0018.txt,txt_rstl
from the = facts above recorded. 2,from,rstl_1864_0015.txt,txt_rstl
from the preceding facts are these ;—First.,from,rstl_1864_0015.txt,txt_rstl
evident from the facts and is borne,from,rstl_1864_0007.txt,txt_rstl
"from a few facts noticed, it appears",from,rstl_1864_0007.txt,txt_rstl
"evident from the facts recorded by ARAGo®,",from,rstl_1864_0007.txt,txt_rstl
deduced from experimental facts of three kinds,from,rstl_1865_0008.txt,txt_rstl
in which the facts are regarded. From,from,rstl_1866_0026.txt,txt_rstl
"both from the facts here recorded, and",from,rstl_1867_0014.txt,txt_rstl
from the following facts :— | pinot,from,rstl_1868_0029.txt,txt_rstl
infer from the facts above mentioned that,from,rstl_1868_0025.txt,txt_rstl
although from certain facts which had been,from,rstl_1868_0025.txt,txt_rstl
widely from the facts made known by,from,rstl_1868_0014.txt,txt_rstl
widely from the facts in the southern,from,rstl_1868_0014.txt,txt_rstl
"deduction from the facts 80 obvious, that",from,rstl_1869_0011.txt,txt_rstl
the transition from facts isolated to facts,from,rstl_1870_0013.txt,txt_rstl
because the two facts with which we,the,rstl_1861_0008.txt,txt_rstl
discussing the crude facts that have accumulated,the,rstl_1861_0008.txt,txt_rstl
"presence of the facts before us, and",the,rstl_1861_0008.txt,txt_rstl
to arrange the facts in some degree,the,rstl_1861_0008.txt,txt_rstl
"may be, the facts above cited remain",the,rstl_1861_0001.txt,txt_rstl
to the above facts and considerations stands,the,rstl_1861_0027.txt,txt_rstl
Report on the Facts of Earthquake Phenomena”,the,rstl_1861_0028.txt,txt_rstl
"273 The foregoing facts prove that, whilst",the,rstl_1861_0030.txt,txt_rstl
of the principal facts which are contained,the,rstl_1861_0030.txt,txt_rstl
EARLY HISTORY. Tas facts at the present,the,rstl_1861_0024.txt,txt_rstl
for us the facts that common +,the,rstl_1861_0024.txt,txt_rstl
the most important facts with Which we,the,rstl_1861_0024.txt,txt_rstl
by the actual facts of agricultural production.,the,rstl_1861_0024.txt,txt_rstl
"other hand, the facts adduced afford a",the,rstl_1861_0024.txt,txt_rstl
far as the facts we have already,the,rstl_1861_0024.txt,txt_rstl
to meet the facts of the case.,the,rstl_1862_0042.txt,txt_rstl
irrespective of the facts that the bottom,the,rstl_1862_0042.txt,txt_rstl
drawn from the facts observed. The author,the,rstl_1862_0041.txt,txt_rstl
"true, the new facts must be receiyed,",the,rstl_1862_0038.txt,txt_rstl
"drawn from the facts demonstrated is, that",the,rstl_1862_0038.txt,txt_rstl
system. 11. The facts and conclusions aboye,the,rstl_1862_0038.txt,txt_rstl
substances; and the facts which have been,the,rstl_1862_0040.txt,txt_rstl
Two of the facts which I have,the,rstl_1862_0040.txt,txt_rstl
Ficus. The following facts indicate that the,the,rstl_1862_0043.txt,txt_rstl
like rocks. These facts point towards the,the,rstl_1862_0033.txt,txt_rstl
that all the facts are consistent with,the,rstl_1862_0013.txt,txt_rstl
London values. These facts all indicate the,the,rstl_1862_0013.txt,txt_rstl
"draw from the facts related, for my",the,rstl_1862_0012.txt,txt_rstl
"yet complete, the facts which have already",the,rstl_1862_0012.txt,txt_rstl
from the observed facts that ice did,the,rstl_1862_0034.txt,txt_rstl
the evidence of facts in fayour of,the,rstl_1862_0034.txt,txt_rstl
any leading observed facts of the veined,the,rstl_1862_0034.txt,txt_rstl
to which the facts diseussed inevitably lead;,the,rstl_1862_0019.txt,txt_rstl
"as all the facts declare, radiation and",the,rstl_1862_0008.txt,txt_rstl
history. And the facts of the imbibition,the,rstl_1862_0035.txt,txt_rstl
combination of the facts which would be,the,rstl_1863_0030.txt,txt_rstl
comparison of the facts of the solar-diurnal,the,rstl_1863_0030.txt,txt_rstl
to consider the facts of the solar-diurnal,the,rstl_1863_0030.txt,txt_rstl
"aforesaid limits, the facts thus referred to",the,rstl_1863_0030.txt,txt_rstl
aspects of the facts upon physical explanations,the,rstl_1863_0030.txt,txt_rstl
absolutely astatic. The facts of the solar-diurnal,the,rstl_1863_0030.txt,txt_rstl
"important of the facts of observation. Second,",the,rstl_1863_0029.txt,txt_rstl
to arrange the facts of observation 80,the,rstl_1863_0026.txt,txt_rstl
"truth of the facts brought forward, although",the,rstl_1863_0026.txt,txt_rstl
and considering the facts observed in other,the,rstl_1863_0026.txt,txt_rstl
"it to the facts of gascous diffusion,",the,rstl_1863_0017.txt,txt_rstl
perfectly with the facts of observation at,the,rstl_1863_0011.txt,txt_rstl
conclusion from the facts established by expe-,the,rstl_1863_0001.txt,txt_rstl
the equator. The facts thus made known,the,rstl_1863_0012.txt,txt_rstl
the other.” These facts were in full,the,rstl_1864_0006.txt,txt_rstl
"both works, the facts which had been",the,rstl_1864_0006.txt,txt_rstl
8ideration of the facts elicited by this,the,rstl_1864_0006.txt,txt_rstl
harmony of the facts manifested by the,the,rstl_1864_0006.txt,txt_rstl
"paper, moreover, the facts established by experiment",the,rstl_1864_0005.txt,txt_rstl
find the following facts :—The radiative power,the,rstl_1864_0009.txt,txt_rstl
"alloys, the following facts are worth mentioning,—their",the,rstl_1864_0004.txt,txt_rstl
the more important facts ascer- tained by,the,rstl_1864_0014.txt,txt_rstl
subsequently. Summary of Facts established in the,the,rstl_1864_0014.txt,txt_rstl
apexf. Recapitulation of facts connected with the,the,rstl_1864_0014.txt,txt_rstl
recently submitted these facts to the Anthropological,the,rstl_1864_0015.txt,txt_rstl
and of the facts elicited by the,the,rstl_1864_0015.txt,txt_rstl
from the = facts above recorded. 2,the,rstl_1864_0015.txt,txt_rstl
from the preceding facts are these ;—First.,the,rstl_1864_0015.txt,txt_rstl
physical phenomena. The facts I sought on,the,rstl_1864_0007.txt,txt_rstl
far are the facts in accordance with,the,rstl_1864_0007.txt,txt_rstl
noticed the same facts in almost all,the,rstl_1864_0007.txt,txt_rstl
the other remarkable facts con- nected with,the,rstl_1864_0007.txt,txt_rstl
evident from the facts and is borne,the,rstl_1864_0007.txt,txt_rstl
"evident from the facts recorded by ARAGo®,",the,rstl_1864_0007.txt,txt_rstl
afford the capital facts noted under the,the,rstl_1865_0015.txt,txt_rstl
reviewing all the facts observed I should,the,rstl_1865_0015.txt,txt_rstl
remark the following facts of im portance,the,rstl_1865_0007.txt,txt_rstl
life. X The facts which I regard,the,rstl_1865_0007.txt,txt_rstl
the indi- vidual facts might s0on be,the,rstl_1865_0016.txt,txt_rstl
to explain the facts by assuming the,the,rstl_1865_0008.txt,txt_rstl
Reduced Momentum. The facts of the induction,the,rstl_1865_0008.txt,txt_rstl
"the only known facts about electric currents,",the,rstl_1865_0008.txt,txt_rstl
may view the facts regarding the moon's,the,rstl_1866_0019.txt,txt_rstl
"expression of the facts of their science,",the,rstl_1866_0026.txt,txt_rstl
chemistry especially the facts are 80 numerous,the,rstl_1866_0026.txt,txt_rstl
"of the exact facts of chemistry, and",the,rstl_1866_0026.txt,txt_rstl
"relative to the facts before us, and",the,rstl_1866_0026.txt,txt_rstl
with the known facts of gaseous combination.,the,rstl_1866_0026.txt,txt_rstl
"And, lastly, the facts are not even",the,rstl_1866_0026.txt,txt_rstl
improbable; and the facts admit of an,the,rstl_1866_0026.txt,txt_rstl
sion of the facts with which the,the,rstl_1866_0026.txt,txt_rstl
in which the facts are regarded. From,the,rstl_1866_0026.txt,txt_rstl
"weights, and the facts of the science",the,rstl_1866_0026.txt,txt_rstl
negatived by the facts already stated as,the,rstl_1866_0024.txt,txt_rstl
"as to the facts which he records,",the,rstl_1866_0024.txt,txt_rstl
results with the facts observed and recorded,the,rstl_1866_0020.txt,txt_rstl
good. And the facts revealed by the,the,rstl_1866_0021.txt,txt_rstl
notice a few facts concerning the 2nesis,the,rstl_1866_0021.txt,txt_rstl
the most interesting facts that has yet,the,rstl_1866_0021.txt,txt_rstl
of resisting the facts of prolonged and,the,rstl_1866_0021.txt,txt_rstl
few inter- sting facts concerning the extreme,the,rstl_1866_0021.txt,txt_rstl
the many new facts revealed concerning their,the,rstl_1866_0021.txt,txt_rstl
trust that the facts already elicited are,the,rstl_1867_0020.txt,txt_rstl
attention to the facts which may be,the,rstl_1867_0015.txt,txt_rstl
recognize in the facts Zbove pointed out,the,rstl_1867_0015.txt,txt_rstl
bo These few facts may for the,the,rstl_1867_0015.txt,txt_rstl
connexion of the facts *. [Note.—In the,the,rstl_1867_0018.txt,txt_rstl
diastolic intervals the facts of previous servations,the,rstl_1867_0018.txt,txt_rstl
is exercised. The facts indicate that the,the,rstl_1867_0018.txt,txt_rstl
contractions*. 5 The facts related in the,the,rstl_1867_0018.txt,txt_rstl
"to investigate the facts in question, which",the,rstl_1867_0018.txt,txt_rstl
remainder. Of these facts he gives the,the,rstl_1867_0018.txt,txt_rstl
expiration than the facts warrant. EXPLANATION OF,the,rstl_1867_0018.txt,txt_rstl
rapid tremor. These facts strongly suggest the,the,rstl_1867_0014.txt,txt_rstl
"both from the facts here recorded, and",the,rstl_1867_0014.txt,txt_rstl
"described, and the facts eestablished by investigating",the,rstl_1867_0011.txt,txt_rstl
are the principal facts demonstrated by the,the,rstl_1867_0011.txt,txt_rstl
from the following facts :— | pinot,the,rstl_1868_0029.txt,txt_rstl
both of the facts and of this,the,rstl_1868_0027.txt,txt_rstl
proving that the facts are exactly met,the,rstl_1868_0016.txt,txt_rstl
account for the facts mentioned by Las.,the,rstl_1868_0017.txt,txt_rstl
and other smilar facts «how that the,the,rstl_1868_0021.txt,txt_rstl
propositions the leading facts which have been,the,rstl_1868_0025.txt,txt_rstl
possible the leading facts which have been,the,rstl_1868_0025.txt,txt_rstl
infer from the facts above mentioned that,the,rstl_1868_0025.txt,txt_rstl
to some interesting facts connected with the,the,rstl_1868_0025.txt,txt_rstl
point out the facts <= which were,the,rstl_1868_0025.txt,txt_rstl
of all the facts which I had,the,rstl_1868_0025.txt,txt_rstl
8uit best the facts observed; and the,the,rstl_1868_0011.txt,txt_rstl
own to contribute facts toward the survey,the,rstl_1868_0011.txt,txt_rstl
and 147. The facts which seem to,the,rstl_1868_0004.txt,txt_rstl
results with the facts recorded in the,the,rstl_1868_0014.txt,txt_rstl
"the two observe facts strictly synchronize, the",the,rstl_1868_0014.txt,txt_rstl
widely from the facts made known by,the,rstl_1868_0014.txt,txt_rstl
to render the facts « observation in,the,rstl_1868_0014.txt,txt_rstl
widely from the facts in the southern,the,rstl_1868_0014.txt,txt_rstl
and the incontroyertible facts on which it,the,rstl_1868_0014.txt,txt_rstl
regarded the known facts of the Declination,the,rstl_1868_0014.txt,txt_rstl
+ investigate the facts independently of any,the,rstl_1868_0010.txt,txt_rstl
by the anatomical facts alone. On the,the,rstl_1868_0010.txt,txt_rstl
there are several facts in the known,the,rstl_1869_0023.txt,txt_rstl
s8upported by the facts of the case.,the,rstl_1869_0023.txt,txt_rstl
inconsistent with the facts disclosed by a,the,rstl_1869_0031.txt,txt_rstl
quota to the facts upon which the,the,rstl_1869_0031.txt,txt_rstl
enabled to adduce facts showing that the,the,rstl_1869_0020.txt,txt_rstl
of the foregoing facts of the human,the,rstl_1869_0018.txt,txt_rstl
"then, the following facts are established :—",the,rstl_1869_0015.txt,txt_rstl
have the following facts to place side,the,rstl_1869_0015.txt,txt_rstl
gun-cotton. The foregoing facts appear to point,the,rstl_1869_0017.txt,txt_rstl
Although the foregoing facts appear to afford,the,rstl_1869_0017.txt,txt_rstl
together with the facts regarding the behayiour,the,rstl_1869_0017.txt,txt_rstl
the more important facts of this kind,the,rstl_1869_0017.txt,txt_rstl
new and interesting facts connected with the,the,rstl_1869_0013.txt,txt_rstl
"deduction from the facts 80 obvious, that",the,rstl_1869_0011.txt,txt_rstl
No. II. [Some facts as to the,the,rstl_1869_0006.txt,txt_rstl
the following two facts may be regarded,the,rstl_1869_0001.txt,txt_rstl
of the commonest facts of observation. These,the,rstl_1870_0019.txt,txt_rstl
comets *. 'These facts render the statement,the,rstl_1870_0019.txt,txt_rstl
study of the facts which surround us,the,rstl_1870_0009.txt,txt_rstl
"necessity that the facts * See Eras,",the,rstl_1870_0009.txt,txt_rstl
"probably represent the facts only imperfectly, and",the,rstl_1870_0009.txt,txt_rstl
"PaRRy). The striking facts of gradual increase,",the,rstl_1870_0013.txt,txt_rstl
"derangement, all the facts of the case",the,rstl_1870_0013.txt,txt_rstl
the transition from facts isolated to facts,the,rstl_1870_0013.txt,txt_rstl
facts isolated to facts linked by the,the,rstl_1870_0013.txt,txt_rstl
among the many facts imprinted on a,the,rstl_1870_0010.txt,txt_rstl
the balance of facts is more in,the,rstl_1870_0007.txt,txt_rstl
"writer, that the facts which have now",the,rstl_1870_0008.txt,txt_rstl
expression of the facts will be obtained,the,rstl_1870_0008.txt,txt_rstl
connexion with the facts brought forward in,the,rstl_1870_0008.txt,txt_rstl
because the two facts with which we,the,rstl_1861_0008.txt,txt_rstl
discussing the crude facts that have accumulated,the,rstl_1861_0008.txt,txt_rstl
"presence of the facts before us, and",the,rstl_1861_0008.txt,txt_rstl
to arrange the facts in some degree,the,rstl_1861_0008.txt,txt_rstl
"may be, the facts above cited remain",the,rstl_1861_0001.txt,txt_rstl
to the above facts and considerations stands,the,rstl_1861_0027.txt,txt_rstl
Report on the Facts of Earthquake Phenomena”,the,rstl_1861_0028.txt,txt_rstl
"273 The foregoing facts prove that, whilst",the,rstl_1861_0030.txt,txt_rstl
of the principal facts which are contained,the,rstl_1861_0030.txt,txt_rstl
EARLY HISTORY. Tas facts at the present,the,rstl_1861_0024.txt,txt_rstl
for us the facts that common +,the,rstl_1861_0024.txt,txt_rstl
the most important facts with Which we,the,rstl_1861_0024.txt,txt_rstl
by the actual facts of agricultural production.,the,rstl_1861_0024.txt,txt_rstl
"other hand, the facts adduced afford a",the,rstl_1861_0024.txt,txt_rstl
far as the facts we have already,the,rstl_1861_0024.txt,txt_rstl
to meet the facts of the case.,the,rstl_1862_0042.txt,txt_rstl
irrespective of the facts that the bottom,the,rstl_1862_0042.txt,txt_rstl
drawn from the facts observed. The author,the,rstl_1862_0041.txt,txt_rstl
"true, the new facts must be receiyed,",the,rstl_1862_0038.txt,txt_rstl
"drawn from the facts demonstrated is, that",the,rstl_1862_0038.txt,txt_rstl
system. 11. The facts and conclusions aboye,the,rstl_1862_0038.txt,txt_rstl
substances; and the facts which have been,the,rstl_1862_0040.txt,txt_rstl
Two of the facts which I have,the,rstl_1862_0040.txt,txt_rstl
Ficus. The following facts indicate that the,the,rstl_1862_0043.txt,txt_rstl
like rocks. These facts point towards the,the,rstl_1862_0033.txt,txt_rstl
that all the facts are consistent with,the,rstl_1862_0013.txt,txt_rstl
London values. These facts all indicate the,the,rstl_1862_0013.txt,txt_rstl
"draw from the facts related, for my",the,rstl_1862_0012.txt,txt_rstl
"yet complete, the facts which have already",the,rstl_1862_0012.txt,txt_rstl
from the observed facts that ice did,the,rstl_1862_0034.txt,txt_rstl
the evidence of facts in fayour of,the,rstl_1862_0034.txt,txt_rstl
any leading observed facts of the veined,the,rstl_1862_0034.txt,txt_rstl
to which the facts diseussed inevitably lead;,the,rstl_1862_0019.txt,txt_rstl
"as all the facts declare, radiation and",the,rstl_1862_0008.txt,txt_rstl
history. And the facts of the imbibition,the,rstl_1862_0035.txt,txt_rstl
combination of the facts which would be,the,rstl_1863_0030.txt,txt_rstl
comparison of the facts of the solar-diurnal,the,rstl_1863_0030.txt,txt_rstl
to consider the facts of the solar-diurnal,the,rstl_1863_0030.txt,txt_rstl
"aforesaid limits, the facts thus referred to",the,rstl_1863_0030.txt,txt_rstl
aspects of the facts upon physical explanations,the,rstl_1863_0030.txt,txt_rstl
absolutely astatic. The facts of the solar-diurnal,the,rstl_1863_0030.txt,txt_rstl
"important of the facts of observation. Second,",the,rstl_1863_0029.txt,txt_rstl
to arrange the facts of observation 80,the,rstl_1863_0026.txt,txt_rstl
"truth of the facts brought forward, although",the,rstl_1863_0026.txt,txt_rstl
and considering the facts observed in other,the,rstl_1863_0026.txt,txt_rstl
"it to the facts of gascous diffusion,",the,rstl_1863_0017.txt,txt_rstl
perfectly with the facts of observation at,the,rstl_1863_0011.txt,txt_rstl
conclusion from the facts established by expe-,the,rstl_1863_0001.txt,txt_rstl
the equator. The facts thus made known,the,rstl_1863_0012.txt,txt_rstl
the other.” These facts were in full,the,rstl_1864_0006.txt,txt_rstl
"both works, the facts which had been",the,rstl_1864_0006.txt,txt_rstl
8ideration of the facts elicited by this,the,rstl_1864_0006.txt,txt_rstl
harmony of the facts manifested by the,the,rstl_1864_0006.txt,txt_rstl
"paper, moreover, the facts established by experiment",the,rstl_1864_0005.txt,txt_rstl
find the following facts :—The radiative power,the,rstl_1864_0009.txt,txt_rstl
"alloys, the following facts are worth mentioning,—their",the,rstl_1864_0004.txt,txt_rstl
the more important facts ascer- tained by,the,rstl_1864_0014.txt,txt_rstl
subsequently. Summary of Facts established in the,the,rstl_1864_0014.txt,txt_rstl
apexf. Recapitulation of facts connected with the,the,rstl_1864_0014.txt,txt_rstl
recently submitted these facts to the Anthropological,the,rstl_1864_0015.txt,txt_rstl
and of the facts elicited by the,the,rstl_1864_0015.txt,txt_rstl
from the = facts above recorded. 2,the,rstl_1864_0015.txt,txt_rstl
from the preceding facts are these ;—First.,the,rstl_1864_0015.txt,txt_rstl
physical phenomena. The facts I sought on,the,rstl_1864_0007.txt,txt_rstl
far are the facts in accordance with,the,rstl_1864_0007.txt,txt_rstl
noticed the same facts in almost all,the,rstl_1864_0007.txt,txt_rstl
the other remarkable facts con- nected with,the,rstl_1864_0007.txt,txt_rstl
evident from the facts and is borne,the,rstl_1864_0007.txt,txt_rstl
"evident from the facts recorded by ARAGo®,",the,rstl_1864_0007.txt,txt_rstl
afford the capital facts noted under the,the,rstl_1865_0015.txt,txt_rstl
reviewing all the facts observed I should,the,rstl_1865_0015.txt,txt_rstl
remark the following facts of im portance,the,rstl_1865_0007.txt,txt_rstl
life. X The facts which I regard,the,rstl_1865_0007.txt,txt_rstl
the indi- vidual facts might s0on be,the,rstl_1865_0016.txt,txt_rstl
to explain the facts by assuming the,the,rstl_1865_0008.txt,txt_rstl
Reduced Momentum. The facts of the induction,the,rstl_1865_0008.txt,txt_rstl
"the only known facts about electric currents,",the,rstl_1865_0008.txt,txt_rstl
may view the facts regarding the moon's,the,rstl_1866_0019.txt,txt_rstl
"expression of the facts of their science,",the,rstl_1866_0026.txt,txt_rstl
chemistry especially the facts are 80 numerous,the,rstl_1866_0026.txt,txt_rstl
"of the exact facts of chemistry, and",the,rstl_1866_0026.txt,txt_rstl
"relative to the facts before us, and",the,rstl_1866_0026.txt,txt_rstl
with the known facts of gaseous combination.,the,rstl_1866_0026.txt,txt_rstl
"And, lastly, the facts are not even",the,rstl_1866_0026.txt,txt_rstl
improbable; and the facts admit of an,the,rstl_1866_0026.txt,txt_rstl
sion of the facts with which the,the,rstl_1866_0026.txt,txt_rstl
in which the facts are regarded. From,the,rstl_1866_0026.txt,txt_rstl
"weights, and the facts of the science",the,rstl_1866_0026.txt,txt_rstl
negatived by the facts already stated as,the,rstl_1866_0024.txt,txt_rstl
"as to the facts which he records,",the,rstl_1866_0024.txt,txt_rstl
results with the facts observed and recorded,the,rstl_1866_0020.txt,txt_rstl
