Context,Word,File,Directory
new and interesting facts connected with the,the,rstl_1869_0013.txt,txt_rstl
"deduction from the facts 80 obvious, that",the,rstl_1869_0011.txt,txt_rstl
No. II. [Some facts as to the,the,rstl_1869_0006.txt,txt_rstl
the following two facts may be regarded,the,rstl_1869_0001.txt,txt_rstl
of the commonest facts of observation. These,the,rstl_1870_0019.txt,txt_rstl
comets *. 'These facts render the statement,the,rstl_1870_0019.txt,txt_rstl
study of the facts which surround us,the,rstl_1870_0009.txt,txt_rstl
"necessity that the facts * See Eras,",the,rstl_1870_0009.txt,txt_rstl
"probably represent the facts only imperfectly, and",the,rstl_1870_0009.txt,txt_rstl
"PaRRy). The striking facts of gradual increase,",the,rstl_1870_0013.txt,txt_rstl
"derangement, all the facts of the case",the,rstl_1870_0013.txt,txt_rstl
the transition from facts isolated to facts,the,rstl_1870_0013.txt,txt_rstl
facts isolated to facts linked by the,the,rstl_1870_0013.txt,txt_rstl
among the many facts imprinted on a,the,rstl_1870_0010.txt,txt_rstl
the balance of facts is more in,the,rstl_1870_0007.txt,txt_rstl
"writer, that the facts which have now",the,rstl_1870_0008.txt,txt_rstl
expression of the facts will be obtained,the,rstl_1870_0008.txt,txt_rstl
connexion with the facts brought forward in,the,rstl_1870_0008.txt,txt_rstl
