Context,Word,File,Directory
great number of facts in proof of,of,Unknown,Unknown
the recommendation of facts to support and,of,Unknown,Unknown
Many of these faCts are colleQted together,of,Unknown,Unknown
some of the facts hereafter de- scribed.,of,Unknown,Unknown
"fiderable number of facts and experiments, and",of,Unknown,Unknown
the recommendation of facts to support and,the,Unknown,Unknown
These were the facts strongly attested by,the,Unknown,Unknown
"absolutely determined, and facts prove. the contrary",the,Unknown,Unknown
reasons for the facts alleged to be,the,Unknown,Unknown
to them. The facts therein mentioned have,the,Unknown,Unknown
to them. The facts therein mentioned have,the,Unknown,Unknown
some of the facts hereafter de- scribed.,the,Unknown,Unknown
that the several facts therein contained are,the,Unknown,Unknown
