Context,Word,File,Directory
"first. These contradictory facts may, I apprehend,",these,Unknown,Unknown
discovery of these facts established this elastic,these,rstl_1792_0019.txt,txt_rstl
derived from these facts and 268 Dr.,these,Unknown,Unknown
"from all these facts reasonable to suppose,",these,Unknown,Unknown
of any new facts relative to these,these,Unknown,Unknown
carnivorous. From these facts | we $should,these,Unknown,Unknown
breathe in. These facts will appear still,these,Unknown,Unknown
which demonstrate these facts will be laid,these,rstl_1794_0005.txt,txt_rstl
Having supported these facts by the evidence,these,Unknown,Unknown
"When all these facts are considered, it",these,Unknown,Unknown
are black. These facts seem sufficient to,these,Unknown,Unknown
"gas, both these facts were sufficiently apparent",these,rstl_1797_0020.txt,txt_rstl
"composed. To these facts we may add,",these,Unknown,Unknown
in reconciling these facts to impregnation by,these,Unknown,Unknown
conse- quence. These facts militate strongly against,these,Unknown,Unknown
"the accumulation of facts f this kind,",of,Unknown,Unknown
of the above-mentioned faCts were observed in,of,Unknown,Unknown
discovery of these facts established this elastic,of,rstl_1792_0019.txt,txt_rstl
of any new facts relative to these,of,Unknown,Unknown
important of the facts recorded in the,of,Unknown,Unknown
A variety of facts of a similar,of,Unknown,Unknown
brought to light facts of importance in,of,Unknown,Unknown
the list of facts we are ac-,of,Unknown,Unknown
"A. variety of facts which prove this,",of,Unknown,Unknown
ad- duce some facts in favour of,of,rstl_1796_0001.txt,txt_rstl
summary of the facts that are establiched,of,rstl_1797_0020.txt,txt_rstl
some of those facts relating to it,of,rstl_1797_0013.txt,txt_rstl
mass of counter- facts poured out against,of,Unknown,Unknown
accession of new facts to our present,of,Unknown,Unknown
and to collecting facts out of which,of,Unknown,Unknown
aQtuat and particular facts are brought to,to,Unknown,Unknown
"from all these facts reasonable to suppose,",to,Unknown,Unknown
of any new facts relative to these,to,Unknown,Unknown
stated all the facts relative to phosphorescent,to,rstl_1792_0006.txt,txt_rstl
therefore examine what facts we have to,to,Unknown,Unknown
negatively: the following facts seem to substantiate,to,Unknown,Unknown
7 II. Some Facts relative to the,to,rstl_1794_0005.txt,txt_rstl
to state the facts respecting this humour,to,rstl_1794_0005.txt,txt_rstl
relations to other facts formerly known. TI,to,rstl_1795_0014.txt,txt_rstl
observed a few facts relating to the,to,rstl_1795_0013.txt,txt_rstl
to communicate the facts and observations to,to,rstl_1795_0012.txt,txt_rstl
consider the following facts to have been,to,Unknown,Unknown
"to establish the facts themselves, in doing",to,Unknown,Unknown
brought to light facts of importance in,to,Unknown,Unknown
are black. These facts seem sufficient to,to,Unknown,Unknown
some of those facts relating to it,to,rstl_1797_0013.txt,txt_rstl
"composed. To these facts we may add,",to,Unknown,Unknown
in reconciling these facts to impregnation by,to,Unknown,Unknown
"to state the facts in detail, sceing",to,Unknown,Unknown
accession of new facts to our present,to,Unknown,Unknown
and to collecting facts out of which,to,Unknown,Unknown
"the accumulation of facts f this kind,",the,Unknown,Unknown
of the above-mentioned faCts were observed in,the,Unknown,Unknown
1989. Among the facts adduced by Dis,the,Unknown,Unknown
"not ascertained the facts with equal satisfaction,",the,rstl_1792_0019.txt,txt_rstl
day: and the facts and appearances have,the,Unknown,Unknown
mine. The threefollowing facts appear much against,the,Unknown,Unknown
stated all the facts relative to phosphorescent,the,rstl_1792_0006.txt,txt_rstl
important of the facts recorded in the,the,Unknown,Unknown
negatively: the following facts seem to substantiate,the,Unknown,Unknown
7 II. Some Facts relative to the,the,rstl_1794_0005.txt,txt_rstl
to state the facts respecting this humour,the,rstl_1794_0005.txt,txt_rstl
the few additional facts contained in this,the,rstl_1795_0013.txt,txt_rstl
observed a few facts relating to the,the,rstl_1795_0013.txt,txt_rstl
render the simple facts I have here,the,rstl_1795_0013.txt,txt_rstl
"experiments, because the facts seem too few",the,rstl_1795_0013.txt,txt_rstl
to communicate the facts and observations to,the,rstl_1795_0012.txt,txt_rstl
"with impartiality the facts already ascertained, and",the,Unknown,Unknown
satisfied by the facts and arguments adduced,the,Unknown,Unknown
consider the following facts to have been,the,Unknown,Unknown
Having supported these facts by the evidence,the,Unknown,Unknown
"to establish the facts themselves, in doing",the,Unknown,Unknown
the list of facts we are ac-,the,Unknown,Unknown
since all the facts I have been,the,rstl_1796_0001.txt,txt_rstl
relating several miscellaneous facts respecting the colour,the,Unknown,Unknown
54+ + Similar facts respecting the deterioration,the,rstl_1797_0020.txt,txt_rstl
summary of the facts that are establiched,the,rstl_1797_0020.txt,txt_rstl
"any rate, the facts here being the",the,Unknown,Unknown
for s0ome important facts on the structure,the,Unknown,Unknown
"to state the facts in detail, sceing",the,Unknown,Unknown
fore us. The facts are already in,the,Unknown,Unknown
certain well established facts on the subject,the,Unknown,Unknown
