Context,Word,File,Directory
Sci. 1874). The fact that the development,the,Unknown,Unknown
special capsule. In fact the tooth-germs are,the,Unknown,Unknown
remarkable from the fact that the epithelial,the,Unknown,Unknown
to demonstrate this fact in the intestine,the,Unknown,Unknown
due to the fact that the epithelium,the,Unknown,Unknown
"the villi, a fact which has been",the,Unknown,Unknown
the epithelium. This fact was described by,the,Unknown,Unknown
"reticulum, in the fact that it does",the,Unknown,Unknown
implied by the fact that the more,the,rstl_1876_0006.txt,txt_rstl
proved by the fact that when a,the,rstl_1876_0006.txt,txt_rstl
due to the fact of its having,the,rstl_1876_0006.txt,txt_rstl
"the speed, a fact which was very",the,rstl_1876_0006.txt,txt_rstl
recognition of the fact that hardness tends,the,rstl_1876_0006.txt,txt_rstl
"which is in fact the more interesting,",the,Unknown,Unknown
be independent. In fact the equivalence of,the,Unknown,Unknown
attention to the fact that the cells,the,Unknown,Unknown
in extent. The fact of this continuity,the,Unknown,Unknown
partly to the fact that a number,the,Unknown,Unknown
partly to the fact that the attachment,the,Unknown,Unknown
arises from the fact that the connective-tissue,the,Unknown,Unknown
"elements, and the fact that Professor Roscor",the,Unknown,Unknown
"255 OE The fact that, in a",the,Unknown,Unknown
enhanced by the fact that vanadium possesses,the,Unknown,Unknown
"mind, therefore, the fact that the full",the,Unknown,Unknown
"itself. Further, the fact that vanadium does",the,Unknown,Unknown
and by the fact that other centres,the,Unknown,Unknown
ame colour. The fact that the work,the,Unknown,Unknown
due to the fact that a 8mall,the,Unknown,Unknown
due to the fact that crushing the,the,Unknown,Unknown
made for the fact that in this,the,Unknown,Unknown
how strongly this fact points to the,the,Unknown,Unknown
evidence of the fact that it is,the,Unknown,Unknown
the following invariable fact :!—At whatever point,the,Unknown,Unknown
as remarkable a fact in the case,the,Unknown,Unknown
"poisons, from the fact that, in water",the,Unknown,Unknown
highly interest- ing fact that the convulsions,the,Unknown,Unknown
tolerance. Now the fact that between these,the,Unknown,Unknown
by the additional fact that at whatever,the,Unknown,Unknown
reconcile with the fact that some specimens,the,Unknown,Unknown
me from the fact that up to,the,Unknown,Unknown
for by the fact that the journal,the,Unknown,Unknown
"view of the fact ""that the physiological",the,Unknown,Unknown
add the curious fact that very frequently,the,Unknown,Unknown
"myself by the fact which he states,",the,Unknown,Unknown
"be an unmeaning fact that, whilst the",the,Unknown,Unknown
hyoidean element. The fact that the stapes,the,Unknown,Unknown
it). Even the fact that this tract,the,Unknown,Unknown
” plate. The fact is that the,the,Unknown,Unknown
"Aleyonarian structure the fact is less exceptional,",the,Unknown,Unknown
"simmtlicher Madreporarien.” The fact was well known,",the,Unknown,Unknown
"however, where the fact is published (he",the,Unknown,Unknown
certain of the fact in 80 small,the,Unknown,Unknown
berichte.” A remarkable fact is that the,the,Unknown,Unknown
rians; and the fact that paired series,the,Unknown,Unknown
"to Sarcophyton, the fact that compound colonies",the,Unknown,Unknown
"of Sarcophyton, the fact that four of",the,Unknown,Unknown
already mentioned the fact that these vascular,the,Unknown,Unknown
cit.) to the fact that whilst in,the,Unknown,Unknown
this from the fact that in the,the,Unknown,Unknown
should regard the fact of their producing,the,Unknown,Unknown
interest in the fact that it purports,the,Unknown,Unknown
proved by the fact that exposed tubes,the,Unknown,Unknown
electric lamp.” In fact the experiments on,the,Unknown,Unknown
"expresses the soberest fact Indeed, taking the",the,Unknown,Unknown
of by organisms—a fact obyiously the same,the,Unknown,Unknown
statement of this fact before the Royal,the,Unknown,Unknown
founded on the fact that a virus,the,Unknown,Unknown
"formula, which in fact represents the degree",which,Unknown,Unknown
there are in fact cases in which,which,Unknown,Unknown
which expresses the fact the logarithms of,which,Unknown,Unknown
shown by the fact that eggs which,which,Unknown,Unknown
which are in fact satisfied by the,which,Unknown,Unknown
which is i fact the inner side,which,Unknown,Unknown
"which the same fact is stated, was",which,Unknown,Unknown
"aggre- gated sand-grains,—a fact which may be",which,rstl_1869_0031.txt,txt_rstl
been already noticed—a fact which alone would,which,Unknown,Unknown
as possible —a fact which implies that,which,Unknown,Unknown
"12, which in fact represents p the",which,Unknown,Unknown
which is in fact an identity. T7.,which,Unknown,Unknown
"which is in fact the line w=0,",which,Unknown,Unknown
which is in fact identical with the,which,Unknown,Unknown
which is in fact its most important,which,Unknown,Unknown
"the next minimum,—a fact which has, we",which,Unknown,Unknown
than as a fact from which we,which,Unknown,Unknown
face. The anatomical fact which the change,which,Unknown,Unknown
further confirm the fact which we then,which,Unknown,Unknown
the Deyonian beds—a fact which shows that,which,Unknown,Unknown
affords no solitary fact upon which such,which,Unknown,Unknown
(-) are in fact the instances which,which,Unknown,Unknown
surface of reyolution—a fact which with the,which,Unknown,Unknown
which are in fact the conditions for,which,Unknown,Unknown
"one species, which fact is important, since",which,Unknown,Unknown
which was in fact obtained in this,which,Unknown,Unknown
which is in fact the modular equation.,which,Unknown,Unknown
correlated is a fact about which I,which,Unknown,Unknown
to you a fact which T have,which,Unknown,Unknown
phenomenon of segmentation—a fact which renders it,which,Unknown,Unknown
"which is in fact (24), he does",which,Unknown,Unknown
be presently described—a fact which alone would,which,rstl_1875_0009.txt,txt_rstl
animals is a fact which ought to,which,Unknown,Unknown
which is in fact the value obtained,which,Unknown,Unknown
"0), which in fact coincides with the",which,Unknown,Unknown
which is in fact the extension to,which,Unknown,Unknown
and easily verified fact of which =,which,Unknown,Unknown
poisonous snake. In fact the description which,which,Unknown,Unknown
"the villi, a fact which has been",which,Unknown,Unknown
their use. Another fact which I do,which,rstl_1876_0006.txt,txt_rstl
"the speed, a fact which was very",which,rstl_1876_0006.txt,txt_rstl
"which is in fact the more interesting,",which,Unknown,Unknown
"myself by the fact which he states,",which,Unknown,Unknown
"cessors, being in fact that of the",in,Unknown,Unknown
It is in fact the homologue of,in,Unknown,Unknown
"in truth, the fact that they have",in,Unknown,Unknown
"formula, which in fact represents the degree",in,Unknown,Unknown
"support from the fact that, in those",in,rstl_1867_0006.txt,txt_rstl
"Vishes, is in fact the 8quamosal. A",in,Unknown,Unknown
upper surface in fact projecting 3 inches,in,Unknown,Unknown
"satisfactorily determined; in fact T,=T+153-42+0-30. . ....",in,Unknown,Unknown
curve would in fact pass off to,in,rstl_1867_0002.txt,txt_rstl
9=0. We in fact have x8nd—ycos/= min,in,rstl_1867_0002.txt,txt_rstl
that we in fact have V=2TU. 9.,in,rstl_1867_0002.txt,txt_rstl
point is in fact equivalent to two,in,rstl_1867_0002.txt,txt_rstl
+y*=1 ; in fact for m<4 (that,in,rstl_1867_0002.txt,txt_rstl
z=+ being in fact the point of,in,rstl_1867_0002.txt,txt_rstl
it is in fact a triple tangent.,in,rstl_1867_0002.txt,txt_rstl
themselves auxiliars; in fact for given values,in,Unknown,Unknown
illustration is in fact unnecessary. 267. I,in,Unknown,Unknown
"discussion is in fact almost, independent of",in,Unknown,Unknown
©; we in fact have a==(0+2(8—#+2p—4) (6+2)*(p—3),in,Unknown,Unknown
certain limits. In fact drawing upwards from,in,Unknown,Unknown
satisfied (which in fact can be done,in,Unknown,Unknown
"that we in fact have 81(#+1)= Y(4—8),",in,Unknown,Unknown
function has in fact the 12 values,in,Unknown,Unknown
"then he in fact finds (X, Y)",in,Unknown,Unknown
T-=A7A is in fact equivalent to the,in,Unknown,Unknown
Tt is in fact by means of,in,Unknown,Unknown
"equation is in fact a*(a?, y”)""=0, (n=mp+e),",in,Unknown,Unknown
there are in fact cases in which,in,Unknown,Unknown
its value in fact is &h =,in,Unknown,Unknown
"d), it in fact gives A a=(a,b,",in,Unknown,Unknown
"the ro-ordinates in fact are. T©=—J6Y, y=",in,Unknown,Unknown
the most extraordinary fact brought out in,in,Unknown,Unknown
"curvilinear, and in fact spiral, or, more",in,Unknown,Unknown
"heart *, In fact the fibres of",in,Unknown,Unknown
"direction; they in fact cross each other,",in,Unknown,Unknown
ARRANGEMENTS within. In fact if a cylinder,in,Unknown,Unknown
There is in fact no breach of,in,Unknown,Unknown
due to the fact that in a,in,Unknown,Unknown
to be the fact in Gasterosteus. In,in,Unknown,Unknown
attention to this fact in his lectures,in,Unknown,Unknown
and in the fact that the posterior,in,Unknown,Unknown
"resistances, and in fact done everything except",in,rstl_1868_0027.txt,txt_rstl
OC) is in fact given in the,in,Unknown,Unknown
which are in fact satisfied by the,in,Unknown,Unknown
altogether true. In fact the results from,in,Unknown,Unknown
Zcos is in fact not one of,in,Unknown,Unknown
there is in fact no evidence of,in,Unknown,Unknown
"suwms do in fact vanish, and we",in,rstl_1868_0007.txt,txt_rstl
velocity ; in fact the difference in,in,Unknown,Unknown
ment have in fact occasioned the greater,in,rstl_1868_0011.txt,txt_rstl
sections being in fact random points on,in,Unknown,Unknown
it is in fact easy to show,in,Unknown,Unknown
"it accurate, in fact every available hour",in,Unknown,Unknown
intensity ; in fact the only proof,in,Unknown,Unknown
the nebula— in fact immersed in the,in,Unknown,Unknown
scarcely visible; in fact its boundaries were,in,Unknown,Unknown
light ; in fact it was scarcely,in,Unknown,Unknown
"=24D, being in fact the most general",in,Unknown,Unknown
correspondence ; in fact to a ava,in,Unknown,Unknown
"this, as in fact already remarked, is",in,Unknown,Unknown
it is in fact to be regarded,in,Unknown,Unknown
of 9; in fact in these last,in,Unknown,Unknown
"phosphorus, and this fact in _itself serves",in,Unknown,Unknown
case is in fact included in that,in,Unknown,Unknown
of are in fact She ratios of,in,Unknown,Unknown
(this is in fact the ordinary theory,in,Unknown,Unknown
given curye; in fact according as the,in,Unknown,Unknown
is =4; in fact to find the,in,Unknown,Unknown
the Bipoint-locus; in fact to each point,in,Unknown,Unknown
discussion s in fact what is done,in,Unknown,Unknown
as being in fact the point-pair formed,in,Unknown,Unknown
as being in fact the line-pair formed,in,Unknown,Unknown
cases are in fact thus solved in,in,Unknown,Unknown
"a cusp, in fact meets the curve",in,Unknown,Unknown
"the cusp, in fact there meets it",in,Unknown,Unknown
coefficient = in fact since the number,in,Unknown,Unknown
given conic; in fact the system is,in,Unknown,Unknown
the conic; in fact the system is,in,Unknown,Unknown
this is in fact the case. In,in,Unknown,Unknown
are arbitrary. In fact these yalues give,in,Unknown,Unknown
side is in fact found to be,in,Unknown,Unknown
"+y2=0, is in fact (0, —4i@, 2(464—",in,Unknown,Unknown
e=0 is in fact a point on,in,Unknown,Unknown
this is in fact an equation of,in,Unknown,Unknown
numerical coefficients; in fact from the last,in,Unknown,Unknown
"last described, in fact both appeared to",in,Unknown,Unknown
"improbable, but in fact impossible, as from",in,Unknown,Unknown
pig- ment. In fact turacin is a,in,Unknown,Unknown
portion becomes in fact the commencement of,in,rstl_1869_0031.txt,txt_rstl
"first announced this fact in 1863, I",in,rstl_1869_0021.txt,txt_rstl
"tube form in fact an air-thermometer, the",in,rstl_1869_0025.txt,txt_rstl
40. But the fact that substances in,in,rstl_1869_0025.txt,txt_rstl
heats is in fact due to the,in,rstl_1869_0025.txt,txt_rstl
contradiction is in fact a coincidence appears,in,rstl_1869_0025.txt,txt_rstl
of water. In fact the specitic heat,in,Unknown,Unknown
foregoing paper; in fact all the characters,in,Unknown,Unknown
"substances, whether in fact these experiments have",in,Unknown,Unknown
les in the fact that it not,in,rstl_1869_0032.txt,txt_rstl
I found in fact (although I did,in,Unknown,Unknown
spectra were in fact snperposed. In the,in,Unknown,Unknown
manner from the fact that in certain,in,rstl_1869_0013.txt,txt_rstl
"quartic scroll. In fact (se First Memoir,",in,Unknown,Unknown
"80 that in fact the scroll, tenth",in,Unknown,Unknown
in evidence the fact that the reciprocal,in,Unknown,Unknown
"theory is in fact indicated in Sa1aox,",in,Unknown,Unknown
curve is in fact for a surface,in,Unknown,Unknown
it is in fact the conic of,in,Unknown,Unknown
"j=1, is in fact mentioned in Sa1aoN;",in,Unknown,Unknown
"//=1, is in fact a torsal plane",in,Unknown,Unknown
"y%—22%=0, a*—2w=0, in fact the before-men- tioned",in,Unknown,Unknown
line ; in fact by what precedes,in,Unknown,Unknown
investigation is in fact really inappli- cable,in,Unknown,Unknown
"errors, and in fact only referred one",in,Unknown,Unknown
part in Didus—a fact not perhaps s0,in,Unknown,Unknown
"in Didus, a fact Apparently arising from",in,Unknown,Unknown
"about by the fact that, in founding",in,Unknown,Unknown
"is in the fact recorded by LxGvar,",in,Unknown,Unknown
found it in fact to be confined,in,Unknown,Unknown
to furnishes in fact a store of,in,Unknown,Unknown
(this is in fact the distinction of,in,Unknown,Unknown
order 27. In fact each plane through,in,Unknown,Unknown
lines are in fact the axes—viz. the,in,Unknown,Unknown
"o' being in fact o'=12—2//—3;/—4B', There are,",in,Unknown,Unknown
the process in fact obtain the equation,in,Unknown,Unknown
"12, which in fact represents p the",in,Unknown,Unknown
the curve in fact coinciding with the,in,Unknown,Unknown
which is in fact an identity. T7.,in,Unknown,Unknown
factors being in fact each =@*. SP,in,Unknown,Unknown
"Y)*, thus in fact working out the",in,Unknown,Unknown
"which is in fact the line w=0,",in,Unknown,Unknown
reciprocal surface in fact shows that the,in,Unknown,Unknown
octic ; in fact for the first,in,Unknown,Unknown
7 times; in fact on the &,in,Unknown,Unknown
have j/=0. In fact for the first,in,Unknown,Unknown
"curve, being in fact points B', and",in,Unknown,Unknown
equations may in fact be written Y*+Y?,in,Unknown,Unknown
spinode curve; in fact for the transversal,in,Unknown,Unknown
C=8. ie In fact combining the equations,in,Unknown,Unknown
4 conics; in fact from the preceding,in,Unknown,Unknown
the surface; in fact attending only to,in,Unknown,Unknown
"sextic are in fact XZ+Y*=0, X*+Z*=0, 80",in,Unknown,Unknown
is V'=3. In fact the form of,in,Unknown,Unknown
—6Y | In fact from the equations,in,Unknown,Unknown
CUBIC SURFACES. In fact in the reciprocal,in,Unknown,Unknown
this is in fact STEINER's quartic surface.,in,Unknown,Unknown
equations may in fact be written :,in,Unknown,Unknown
numbers representing in fact a different object.,in,Unknown,Unknown
ordinary one-twelfth. In fact these researches appear,in,Unknown,Unknown
"of in the fact that, for equal",in,Unknown,Unknown
"logic, and in fact any logic must",in,Unknown,Unknown
which is in fact identical with the,in,Unknown,Unknown
sky.” 2 In fact it was impoxsible,in,Unknown,Unknown
itself illuminated. In fact the cloud was,in,Unknown,Unknown
inches was in fact used); to take,in,Unknown,Unknown
what does in fact take place in,in,rstl_1870_0009.txt,txt_rstl
become infinite; in fact it is easy,in,rstl_1870_0009.txt,txt_rstl
right); and in fact they are not,in,Unknown,Unknown
stone is in fact a fragment of,in,Unknown,Unknown
"we cannot in fact accurately do, there",in,Unknown,Unknown
desired mineral; in fact half a gramme,in,Unknown,Unknown
it has in fact passed over. The,in,Unknown,Unknown
process must in fact be repeated s0,in,Unknown,Unknown
which is in fact its most important,in,Unknown,Unknown
minute quantities; in fact on a few,in,Unknown,Unknown
analysis generally. In fact whenever we are,in,Unknown,Unknown
"determine, they in fact constitute, the aggre-",in,Unknown,Unknown
relation. 32. In fact consider a /-fold,in,Unknown,Unknown
tion is in fact to be considered,in,Unknown,Unknown
indefinitely small; in fact whatever the magnitudes,in,Unknown,Unknown
increments are in fact proportional to the,in,Unknown,Unknown
Recent investigations in fact tend to the,in,Unknown,Unknown
displacement may in fact be = referred,in,Unknown,Unknown
allude to the fact that in the,in,Unknown,Unknown
"two bones. In fact the writer supposed,",in,Unknown,Unknown
altogether remark- able fact is that in,in,Unknown,Unknown
"locality, and in fact a specimen from",in,rstl_1871_0015.txt,txt_rstl
crystal face. In fact the faces thus,in,rstl_1871_0015.txt,txt_rstl
crystal C. In fact the faces of,in,rstl_1871_0015.txt,txt_rstl
"augitic mineral, in fact | one with",in,rstl_1871_0015.txt,txt_rstl
it was. In fact the selection out,in,rstl_1871_0015.txt,txt_rstl
*. : In fact the olivine found,in,rstl_1871_0015.txt,txt_rstl
DF.(X—3)z as in fact giving a heterotypic,in,Unknown,Unknown
"they were in fact found directly, and",in,Unknown,Unknown
this is in fact the value given,in,Unknown,Unknown
and we in fact have iden- tically,in,Unknown,Unknown
easy. I in fact first obtained the,in,Unknown,Unknown
"strated the same fact in his memoir,",in,Unknown,Unknown
"extremities, being in fact elongated modi- fications",in,Unknown,Unknown
It has in fact been a rather,in,Unknown,Unknown
lies in the fact that the stems,in,Unknown,Unknown
extent ; in fact 0 partially as,in,Unknown,Unknown
"on is the fact that, in the",in,Unknown,Unknown
fabric is in fact exposed bon ships,in,Unknown,Unknown
"consists in the fact that, throughout the",in,Unknown,Unknown
upper-deck battery. This fact also accounts in,in,Unknown,Unknown
"purpose, remarking the fact that in Plate",in,Unknown,Unknown
"taken, and in fact for all ships",in,Unknown,Unknown
did before; in fact the small loop,in,Unknown,Unknown
drawn to the fact that - in,in,Unknown,Unknown
solution ; in fact it may be,in,Unknown,Unknown
still water; in fact on the first,in,Unknown,Unknown
a hogging-strain. In fact for five-sixths of,in,Unknown,Unknown
found in the fact that the maximum,in,Unknown,Unknown
"attention to the fact that in all,",in,Unknown,Unknown
have in this fact an illustration of,in,Unknown,Unknown
"attention, is in fact nothing but the",in,Unknown,Unknown
rectum ; in fact it may be,in,Unknown,Unknown
fundamental note. In fact we THE HON.,in,Unknown,Unknown
same degree; in fact the condensation must,in,Unknown,Unknown
circular form. In fact for a given,in,Unknown,Unknown
the case. In fact it is meaningless,in,Unknown,Unknown
"Table 1., in fact about double, whether",in,Unknown,Unknown
in question. The fact is that the,in,Unknown,Unknown
notation is in fact more PROFESSOR CAYLEY'S,in,Unknown,Unknown
"p, is in fact =—+E(B,CY*+2B?; and 80",in,Unknown,Unknown
we have in fact the 6 derived,in,Unknown,Unknown
(-) are in fact the instances which,in,Unknown,Unknown
is; and in fact in a more,in,Unknown,Unknown
tuberous roots”. In fact the parallel and,in,rstl_1871_0010.txt,txt_rstl
+ This well-known fact in comparative odontology,in,rstl_1871_0010.txt,txt_rstl
"quadric A(8—A)+p(S—B)+o(S'—0)+e($—D), In fact this is equivalent",in,Unknown,Unknown
the conic. In fact if the sphere,in,Unknown,Unknown
5; and in fact the two surfaces,in,Unknown,Unknown
"Bicirculars;” and in fact it was geometrically,",in,Unknown,Unknown
cut orthogonally. In fact the relation 1-R=0,in,Unknown,Unknown
"0, and in fact Dr. Sa1Mox's direct",in,Unknown,Unknown
are coincident; in fact the section of,in,Unknown,Unknown
pencil U+FV. In fact the polar lines,in,Unknown,Unknown
W ; in fact the sphere Q,in,Unknown,Unknown
"axes, being in fact true for any",in,Unknown,Unknown
them all. In fact it will be,in,Unknown,Unknown
of them. In fact the solution of,in,Unknown,Unknown
which are in fact the conditions for,in,Unknown,Unknown
"be regarded. In fact if &, Þ,",in,Unknown,Unknown
it is in fact incorrect. The reason,in,rstl_1872_0005.txt,txt_rstl
gain a new fact in the history,in,Unknown,Unknown
appears in the fact that the two,in,Unknown,Unknown
exists in the fact that the S,in,Unknown,Unknown
lies in the fact that the leaf-scars,in,rstl_1872_0010.txt,txt_rstl
explained by the fact that in the,in,rstl_1872_0010.txt,txt_rstl
"found in the fact that, when a",in,rstl_1872_0010.txt,txt_rstl
identity ought in fact to 2xist in,in,Unknown,Unknown
"found in the fact that, as will",in,Unknown,Unknown
"refracting, yet, in fact (owing no doubt",in,Unknown,Unknown
"simpler, exhibiting in fact only the four",in,Unknown,Unknown
heating-ecffect ; in fact the difference was,in,Unknown,Unknown
any part. In fact the following corrections,in,Unknown,Unknown
in point of fact »=60 þ is,in,Unknown,Unknown
lies in the fact that the moon's,in,Unknown,Unknown
this is in fact a relation involving,in,rstl_1873_0005.txt,txt_rstl
generic distinction. In fact all the Eocene,in,Unknown,Unknown
"not four—being in fact didactyle, like the",in,Unknown,Unknown
consists in the fact that the distal,in,Unknown,Unknown
seen by the fact that in the,in,Unknown,Unknown
lies in the fact that all its,in,Unknown,Unknown
; and in fact there exists in,in,Unknown,Unknown
the trapezoid—a new fact in the history,in,Unknown,Unknown
inter- polated. In fact we bave a,in,Unknown,Unknown
column. Z In fact while the materials,in,Unknown,Unknown
to contain the fact that in those,in,Unknown,Unknown
to be observed) fact without calling in,in,Unknown,Unknown
found in the fact that the assigned,in,Unknown,Unknown
and south. In fact they have the,in,Unknown,Unknown
hill is in fact traversed by a,in,Unknown,Unknown
Flint-knife Gallery; in fact in e basin-shaped,in,Unknown,Unknown
"right side, in fact fits 80 exactly",in,Unknown,Unknown
"leg-bones, and in fact rtly overlapping the",in,Unknown,Unknown
"and Porous, in fact closely resembling the",in,Unknown,Unknown
"priscus belong in fact to Ursus feroz*,",in,Unknown,Unknown
and in the fact its having been,in,Unknown,Unknown
"I overlooked the fact that, in order",in,rstl_1874_0020.txt,txt_rstl
not homogeneous; in fact only the ratios,in,rstl_1874_0020.txt,txt_rstl
"but in the fact that, in order",in,Unknown,Unknown
"owing to the fact that, in order",in,Unknown,Unknown
diminished by the fact that in the,in,rstl_1874_0019.txt,txt_rstl
is an important fact in reference to,in,rstl_1874_0019.txt,txt_rstl
the edge; in fact assuming a very,in,Unknown,Unknown
referred to. In fact the only practical,in,Unknown,Unknown
with calcium. In fact I had such,in,Unknown,Unknown
"differentiation s0ught, the fact that in the",in,Unknown,Unknown
*. * In fact this was 80.,in,rstl_1874_0012.txt,txt_rstl
"Tomatodontotherium, and in fact to occupy an",in,Unknown,Unknown
quartic equation; in fact from the original,in,Unknown,Unknown
satisfy (as in fact they should) the,in,Unknown,Unknown
"y=kz, 3=kÞ; in fact 8ubstituting these values,",in,Unknown,Unknown
quintic one; in fact the equation F*«*=0?Z?,in,Unknown,Unknown
"of F&, In fact the second equation",in,Unknown,Unknown
these being in fact the values of,in,Unknown,Unknown
which was in fact obtained in this,in,Unknown,Unknown
values are in fact given as transcendental,in,Unknown,Unknown
"we have in fact (6,01): .. (v,—v,)",in,Unknown,Unknown
v is in fact one of a,in,Unknown,Unknown
which is in fact the modular equation.,in,Unknown,Unknown
by v*—+*; in fact the equation may,in,Unknown,Unknown
This is in fact an identity ;,in,Unknown,Unknown
root &=1); in fact the term in,in,Unknown,Unknown
order 292; in fact the intersections of,in,Unknown,Unknown
There is in fact no such grouping,in,Unknown,Unknown
and we in fact have B(2+a) __a(2+a)®,in,Unknown,Unknown
"we can in fact express z, y,",in,Unknown,Unknown
=1); we in fact have 2=—a =,in,Unknown,Unknown
= 4+» In fact the standard of,in,Unknown,Unknown
accordance with the fact demonstrated in that,in,Unknown,Unknown
for by the fact that in the,in,Unknown,Unknown
appears from the fact that in the,in,Unknown,Unknown
an important additional fact pointing in the,in,Unknown,Unknown
differ in the fact that only alternate,in,Unknown,Unknown
I mentioned this fact in the presence,in,Unknown,Unknown
myself observed this fact in the case,in,Unknown,Unknown
same manner. This fact in the habits,in,Unknown,Unknown
"fig. 2), in fact in every way",in,Unknown,Unknown
on the supposed fact that whilst in,in,Unknown,Unknown
structure- less; in fact it exactly resembles,in,Unknown,Unknown
stress on the fact that in Ommatoplea,in,Unknown,Unknown
"longitudinal fibres, in fact bear the same",in,Unknown,Unknown
point to the fact that in all,in,Unknown,Unknown
perceptible in the fact that the mean,in,Unknown,Unknown
infer from this fact that in a,in,Unknown,Unknown
to establish the fact in a satisfactory,in,Unknown,Unknown
in point of fact for our purpose,in,Unknown,Unknown
"which is in fact (24), he does",in,Unknown,Unknown
in point of fact this equation (as,in,Unknown,Unknown
already mentioned this fact in my first,in,rstl_1875_0018.txt,txt_rstl
in proving the fact of repulsion resulting,in,rstl_1875_0018.txt,txt_rstl
In point of fact the thin layer,in,rstl_1875_0009.txt,txt_rstl
; but in fact I do not,in,Unknown,Unknown
"the error in fact was not great,",in,Unknown,Unknown
hemisphere. The important fact noted in Exp.,in,Unknown,Unknown
indicated by the fact that monkeys in,in,Unknown,Unknown
"of g. In fact if, in order",in,Unknown,Unknown
"GREEN, being in fact the fundamental theorem",in,Unknown,Unknown
"P exceeding, in fact far exceeding, R;",in,Unknown,Unknown
