Context,Word,File,Directory
shown by the fact first pointed out,the,Unknown,Unknown
vanadium of Brrzrius).—The fact that the lemon-yellow-coloured,the,Unknown,Unknown
of the aboye-noticed fact to have been,the,Unknown,Unknown
give special solutions—in fact the yery notion,the,Unknown,Unknown
(this is in fact the ordinary theory,the,Unknown,Unknown
given curye; in fact according as the,the,Unknown,Unknown
is =4; in fact to find the,the,Unknown,Unknown
the Bipoint-locus; in fact to each point,the,Unknown,Unknown
as being in fact the point-pair formed,the,Unknown,Unknown
as being in fact the line-pair formed,the,Unknown,Unknown
"a cusp, in fact meets the curve",the,Unknown,Unknown
"the cusp, in fact there meets it",the,Unknown,Unknown
coefficient = in fact since the number,the,Unknown,Unknown
given conic; in fact the system is,the,Unknown,Unknown
the conic; in fact the system is,the,Unknown,Unknown
this is in fact the case. In,the,Unknown,Unknown
numerical coefficients; in fact from the last,the,Unknown,Unknown
evidenced by the fact that t] odontoid,the,Unknown,Unknown
"much larger, i fact forming the greater",the,Unknown,Unknown
account for the fact that the muscles,the,Unknown,Unknown
which is i fact the inner side,the,Unknown,Unknown
is an interesting fact that the hypoglossal,the,Unknown,Unknown
pointed out the fact that the descending,the,Unknown,Unknown
"which the same fact is stated, was",the,Unknown,Unknown
coupled with the fact already made use,the,rstl_1869_0028.txt,txt_rstl
explained by the fact that the metal,the,rstl_1869_0028.txt,txt_rstl
although from the fact that many of,the,Unknown,Unknown
masses : the fact that methyl-normeconin was,the,Unknown,Unknown
Tables demonstrate the fact that exposure to,the,rstl_1869_0023.txt,txt_rstl
"Now the further fact may be added,",the,rstl_1869_0023.txt,txt_rstl
portion becomes in fact the commencement of,the,rstl_1869_0031.txt,txt_rstl
;—in point of fact the animal dies,the,rstl_1869_0031.txt,txt_rstl
due to the fact of their having,the,rstl_1869_0031.txt,txt_rstl
"force, that the fact of additional pressure",the,rstl_1869_0021.txt,txt_rstl
"to explain the fact observed, that even",the,rstl_1869_0025.txt,txt_rstl
"tube form in fact an air-thermometer, the",the,rstl_1869_0025.txt,txt_rstl
40. But the fact that substances in,the,rstl_1869_0025.txt,txt_rstl
heats is in fact due to the,the,rstl_1869_0025.txt,txt_rstl
"gly- cerine. ""This fact forcibly suggests the",the,rstl_1869_0025.txt,txt_rstl
discoyery and the fact of the extinction,the,Unknown,Unknown
owing to the fact that a globular,the,Unknown,Unknown
of water. In fact the specitic heat,the,Unknown,Unknown
foregoing paper; in fact all the characters,the,Unknown,Unknown
deductions beyond the fact that they relate,the,Unknown,Unknown
les in the fact that it not,the,rstl_1869_0032.txt,txt_rstl
entirely to the fact that the firss,the,Unknown,Unknown
spectra were in fact snperposed. In the,the,Unknown,Unknown
"November, when the fact of the widening",the,Unknown,Unknown
strengthened by the fact that diligent sweeping,the,Unknown,Unknown
arises from the fact that the only,the,Unknown,Unknown
illustrated by the fact that a concussion,the,Unknown,Unknown
due to the fact that experiments on,the,Unknown,Unknown
with gun-cotton. The fact that the violent,the,Unknown,Unknown
"extent, for the fact that the detonation",the,Unknown,Unknown
part to the fact that the proportion,the,Unknown,Unknown
manner from the fact that in certain,the,rstl_1869_0013.txt,txt_rstl
is a remarkable fact that the rudiments,the,rstl_1869_0013.txt,txt_rstl
"80 that in fact the scroll, tenth",the,Unknown,Unknown
in evidence the fact that the reciprocal,the,Unknown,Unknown
it is in fact the conic of,the,Unknown,Unknown
"y%—22%=0, a*—2w=0, in fact the before-men- tioned",the,Unknown,Unknown
singular lines (in fact for all the,the,Unknown,Unknown
for by the fact that during an,the,Unknown,Unknown
qualified by the fact that the after-,the,Unknown,Unknown
declination- * The fact that this is,the,Unknown,Unknown
for by the fact that fluoride of,the,Unknown,Unknown
as to the fact of the island,the,Unknown,Unknown
of the curious fact that the specimens,the,Unknown,Unknown
"about by the fact that, in founding",the,Unknown,Unknown
"is in the fact recorded by LxGvar,",the,Unknown,Unknown
of preservation. Tn fact the slabs from,the,Unknown,Unknown
the moors. Tho fact that they are,the,Unknown,Unknown
"therefore invisible, the fact being that the",the,Unknown,Unknown
(this is in fact the distinction of,the,Unknown,Unknown
lines are in fact the axes—viz. the,the,Unknown,Unknown
the process in fact obtain the equation,the,Unknown,Unknown
"12, which in fact represents p the",the,Unknown,Unknown
the curve in fact coinciding with the,the,Unknown,Unknown
"Y)*, thus in fact working out the",the,Unknown,Unknown
"which is in fact the line w=0,",the,Unknown,Unknown
reciprocal surface in fact shows that the,the,Unknown,Unknown
octic ; in fact for the first,the,Unknown,Unknown
7 times; in fact on the &,the,Unknown,Unknown
have j/=0. In fact for the first,the,Unknown,Unknown
spinode curve; in fact for the transversal,the,Unknown,Unknown
C=8. ie In fact combining the equations,the,Unknown,Unknown
4 conics; in fact from the preceding,the,Unknown,Unknown
the surface; in fact attending only to,the,Unknown,Unknown
is V'=3. In fact the form of,the,Unknown,Unknown
—6Y | In fact from the equations,the,Unknown,Unknown
CUBIC SURFACES. In fact in the reciprocal,the,Unknown,Unknown
by the simple fact that a conyex,the,Unknown,Unknown
the horizon. The fact that the curve,the,Unknown,Unknown
"of in the fact that, for equal",the,Unknown,Unknown
often deplored the fact that though these,the,Unknown,Unknown
which is in fact identical with the,the,Unknown,Unknown
proved by the fact that both with,the,Unknown,Unknown
laid upon the fact that the same,the,Unknown,Unknown
to apply this fact to the solution,the,Unknown,Unknown
"liquid condition, the fact of the liquid",the,Unknown,Unknown
itself illuminated. In fact the cloud was,the,Unknown,Unknown
confirmation of the fact that the liquid,the,Unknown,Unknown
to establish the fact that there is,the,Unknown,Unknown
it has in fact passed over. The,the,Unknown,Unknown
doubt by the fact that transparent sections,the,Unknown,Unknown
further investigation. The fact of the Osbornite,the,Unknown,Unknown
"determine, they in fact constitute, the aggre-",the,Unknown,Unknown
indefinitely small; in fact whatever the magnitudes,the,Unknown,Unknown
increments are in fact proportional to the,the,Unknown,Unknown
arises from the fact that Paris is,the,Unknown,Unknown
Recent investigations in fact tend to the,the,Unknown,Unknown
allude to the fact that in the,the,Unknown,Unknown
for by the fact that the days,the,Unknown,Unknown
"first instance, the fact of the variability",the,Unknown,Unknown
"the next minimum,—a fact which has, we",the,Unknown,Unknown
the other two—in fact the curye has,the,Unknown,Unknown
due to the fact that large groups,the,Unknown,Unknown
"two bones. In fact the writer supposed,",the,Unknown,Unknown
"is a remarkable fact that, while the",the,Unknown,Unknown
a well recognized fact that the skull,the,Unknown,Unknown
face. The anatomical fact which the change,the,Unknown,Unknown
harmony with the fact that no Ape,the,Unknown,Unknown
evident from the fact that photo- graphs,the,Unknown,Unknown
and with the fact that the former,the,Unknown,Unknown
further confirm the fact which we then,the,Unknown,Unknown
crystal face. In fact the faces thus,the,rstl_1871_0015.txt,txt_rstl
crystal C. In fact the faces of,the,rstl_1871_0015.txt,txt_rstl
it was. In fact the selection out,the,rstl_1871_0015.txt,txt_rstl
*. : In fact the olivine found,the,rstl_1871_0015.txt,txt_rstl
the hypothesis. The fact that Sthe anomalous,the,Unknown,Unknown
this is in fact the value given,the,Unknown,Unknown
easy. I in fact first obtained the,the,Unknown,Unknown
the Deyonian beds—a fact which shows that,the,Unknown,Unknown
olid and unbroken—a fact demonstrated by the,the,Unknown,Unknown
"strated the same fact in his memoir,",the,Unknown,Unknown
an inter- esting fact that the specimen,the,Unknown,Unknown
it because the fact was disputed at,the,Unknown,Unknown
"me. Consequently the fact must be admitted,",the,Unknown,Unknown
"fig. 2, a fact favouring the idea",the,Unknown,Unknown
lies in the fact that the stems,the,Unknown,Unknown
"figure illustrates the fact that, with a",the,Unknown,Unknown
certain from the fact that mossing or,the,Unknown,Unknown
"adduced, Furthermore, the fact that the greater",the,Unknown,Unknown
"on is the fact that, in the",the,Unknown,Unknown
"to the additional fact that porous bodies,",the,Unknown,Unknown
and the old fact has been restated,the,Unknown,Unknown
seen from the fact that he asumes,the,Unknown,Unknown
"consists in the fact that, throughout the",the,Unknown,Unknown
infer from the fact that at present,the,Unknown,Unknown
illustrated by She fact that the foremost,the,Unknown,Unknown
follows from the fact that the Seurve,the,Unknown,Unknown
"purpose, remarking the fact that in Plate",the,Unknown,Unknown
account of the fact that the curve,the,Unknown,Unknown
did before; in fact the small loop,the,Unknown,Unknown
account of the fact WEIGHT AND SUPPORT,the,Unknown,Unknown
due to the fact that she is,the,Unknown,Unknown
thus indicating the fact that about 30,the,Unknown,Unknown
"before, notwithstanding the fact that at 80me",the,Unknown,Unknown
account of the fact that they are,the,Unknown,Unknown
briefly to the fact that no ship,the,Unknown,Unknown
account of the fact that when the,the,Unknown,Unknown
drawn to the fact that - in,the,Unknown,Unknown
illustration of the fact that it may,the,Unknown,Unknown
have noticed the fact that the strains,the,Unknown,Unknown
arose from the fact that he considered,the,Unknown,Unknown
still water; in fact on the first,the,Unknown,Unknown
account of the fact that n the,the,Unknown,Unknown
the wave-hollows. The fact that the excess,the,Unknown,Unknown
found in the fact that the maximum,the,Unknown,Unknown
hogging; and this fact prevents the material,the,Unknown,Unknown
account of the fact that the changes,the,Unknown,Unknown
"attention to the fact that in all,",the,Unknown,Unknown
by the water—in fact suspended by the,the,Unknown,Unknown
account of the fact that such positions,the,Unknown,Unknown
account of the fact that we are,the,Unknown,Unknown
attention to the fact that when aground,the,Unknown,Unknown
due to the fact that the centres,the,Unknown,Unknown
reason for this fact being that the,the,Unknown,Unknown
yomer. From the fact that the vomer,the,Unknown,Unknown
"attention, is in fact nothing but the",the,Unknown,Unknown
"same time, the fact that individual yariations",the,Unknown,Unknown
out by the fact that it is,the,Unknown,Unknown
the most important fact Zin favour of,the,Unknown,Unknown
bearing of this fact upon the further,the,Unknown,Unknown
reason of the fact that the theory,the,Unknown,Unknown
fundamental note. In fact we THE HON.,the,Unknown,Unknown
same degree; in fact the condensation must,the,Unknown,Unknown
measure on the fact that the quantity,the,Unknown,Unknown
the case. In fact it is meaningless,the,Unknown,Unknown
in question. The fact is that the,the,Unknown,Unknown
we have in fact the 6 derived,the,Unknown,Unknown
(-) are in fact the instances which,the,Unknown,Unknown
OF AUSTRALIA. The fact is patent; but,the,rstl_1871_0010.txt,txt_rstl
tuberous roots”. In fact the parallel and,the,rstl_1871_0010.txt,txt_rstl
"question is, the fact of an addi-",the,rstl_1871_0010.txt,txt_rstl
AUSTRALIA. 257 This fact invalidates the averment,the,rstl_1871_0010.txt,txt_rstl
few matters of fact and mensuration. The,the,rstl_1871_0010.txt,txt_rstl
arises from the fact that the foremost,the,Unknown,Unknown
and again. The fact is that the,the,Unknown,Unknown
arises from the fact that dehiscence commences,the,Unknown,Unknown
arises from the fact that it has,the,Unknown,Unknown
though faint. The fact that the higher,the,Unknown,Unknown
the conic. In fact if the sphere,the,Unknown,Unknown
5; and in fact the two surfaces,the,Unknown,Unknown
cut orthogonally. In fact the relation 1-R=0,the,Unknown,Unknown
implied by the fact of the four,the,Unknown,Unknown
are coincident; in fact the section of,the,Unknown,Unknown
appears from the fact that the inyerse,the,Unknown,Unknown
surface of reyolution—a fact which with the,the,Unknown,Unknown
pencil U+FV. In fact the polar lines,the,Unknown,Unknown
sollows from the fact that the bisectors,the,Unknown,Unknown
W ; in fact the sphere Q,the,Unknown,Unknown
of them. In fact the solution of,the,Unknown,Unknown
which are in fact the conditions for,the,Unknown,Unknown
to me the fact of 80 large,the,Unknown,Unknown
it is in fact incorrect. The reason,the,rstl_1872_0005.txt,txt_rstl
gain a new fact in the history,the,Unknown,Unknown
"allied), the presumed fact of the restriction",the,Unknown,Unknown
established the interesting fact that the lower,the,Unknown,Unknown
appearance is the fact that clusters of,the,Unknown,Unknown
"one, to the fact that transverse sections",the,Unknown,Unknown
appears in the fact that the two,the,Unknown,Unknown
infer from this fact that at the,the,Unknown,Unknown
ignorance of the fact that the medul-,the,Unknown,Unknown
cells. Remembering the fact that a Diplozylon,the,Unknown,Unknown
attention to the fact that the foliar,the,Unknown,Unknown
exists in the fact that the S,the,Unknown,Unknown
the cylinder. The fact of these growths,the,Unknown,Unknown
established the important fact that ozone is,the,Unknown,Unknown
follow from the fact that the pole,the,Unknown,Unknown
"be 80, the fact that a matured",the,rstl_1872_0010.txt,txt_rstl
and that the fact explains why we,the,rstl_1872_0010.txt,txt_rstl
due to the fact that the section,the,rstl_1872_0010.txt,txt_rstl
"the Halonia. The fact is, T have",the,rstl_1872_0010.txt,txt_rstl
lies in the fact that the leaf-scars,the,rstl_1872_0010.txt,txt_rstl
explained by the fact that in the,the,rstl_1872_0010.txt,txt_rstl
"found in the fact that, when a",the,rstl_1872_0010.txt,txt_rstl
present is the fact that he believes,the,rstl_1872_0010.txt,txt_rstl
"together with the fact just stated, leave",the,rstl_1872_0010.txt,txt_rstl
"Vertebrates,” the only fact noticed regarding the",the,rstl_1872_0008.txt,txt_rstl
costal origin. The fact of this muscle,the,rstl_1872_0008.txt,txt_rstl
also by the fact that it is,the,rstl_1872_0008.txt,txt_rstl
testimony to the fact that at that,the,Unknown,Unknown
* The same fact may be observed,the,Unknown,Unknown
is dim. 'The fact that the bright,the,Unknown,Unknown
"found in the fact that, as will",the,Unknown,Unknown
"surfaces—considering, from the fact of its similar",the,Unknown,Unknown
drawn from the fact that indentations of,the,Unknown,Unknown
SPECTRUM-ANALYSIS Table. The fact may then be,the,Unknown,Unknown
"simpler, exhibiting in fact only the four",the,Unknown,Unknown
"visible, and the fact of these compounds",the,Unknown,Unknown
due to the fact that the spectram,the,Unknown,Unknown
attention to the. fact that the metalloids,the,Unknown,Unknown
combined with the fact that the errors,the,Unknown,Unknown
anticipated from the fact that >the calculated,the,Unknown,Unknown
principally to the fact of the nitrate,the,Unknown,Unknown
heating-ecffect ; in fact the difference was,the,Unknown,Unknown
any part. In fact the following corrections,the,Unknown,Unknown
well as the fact that the exceptionally,the,Unknown,Unknown
"1871*, the latter fact might perhaps have",the,Unknown,Unknown
"ariscs from the fact that Z6rixuR, 8ince",the,Unknown,Unknown
lies in the fact that the moon's,the,Unknown,Unknown
connexion with the fact just stated and,the,Unknown,Unknown
state that the fact that the re-reversal,the,Unknown,Unknown
such * The fact that the curve,the,rstl_1873_0001.txt,txt_rstl
pointed out the fact that right-handed rotations,the,rstl_1873_0001.txt,txt_rstl
due to the fact that the daily,the,rstl_1873_0001.txt,txt_rstl
brings out the fact here mentioned very,the,rstl_1873_0001.txt,txt_rstl
; and the fact scems to point,the,rstl_1873_0001.txt,txt_rstl
yaluable results. The fact that the hypothesis,the,rstl_1873_0001.txt,txt_rstl
partly of the fact that these larger,the,Unknown,Unknown
the bark. This fact alone demonstrates one,the,Unknown,Unknown
"and the further fact remains, that we",the,Unknown,Unknown
confirmation from the fact _ 80 long,the,Unknown,Unknown
already mentioned the fact that I have,the,Unknown,Unknown
attention to the fact that a specimen,the,Unknown,Unknown
the chemicals employed—a fact that has hitherto,the,Unknown,Unknown
prior stage the fact that the prootic,the,Unknown,Unknown
depends upon the fact that the *culmen,the,Unknown,Unknown
and on the fact of their having,the,Unknown,Unknown
generic distinction. In fact all the Eocene,the,Unknown,Unknown
"animals, as the fact of having four-lobed",the,Unknown,Unknown
"not four—being in fact didactyle, like the",the,Unknown,Unknown
consists in the fact that the distal,the,Unknown,Unknown
seen by the fact that in the,the,Unknown,Unknown
This is another fact testifying to the,the,Unknown,Unknown
the seemingly adverse fact that the reduced,the,Unknown,Unknown
"common form, the fact must, appear as",the,Unknown,Unknown
lies in the fact that all its,the,Unknown,Unknown
owing to the fact that the posterior,the,Unknown,Unknown
"conclusion, as the fact seemed too singular,",the,Unknown,Unknown
owing to the fact that the Hogs,the,Unknown,Unknown
reader to the fact that these two,the,Unknown,Unknown
the trapezoid—a new fact in the history,the,Unknown,Unknown
"doubtful? I6.nok the fact eloquent enough, that,",the,Unknown,Unknown
owing to the fact that the second,the,Unknown,Unknown
to be the fact upon considerations wholly,the,Unknown,Unknown
mathematician has the fact before him; volcanoes,the,Unknown,Unknown
to support the fact that our earth,the,Unknown,Unknown
is a remarkable fact that the western,the,Unknown,Unknown
the very general fact of western flanks,the,Unknown,Unknown
column. Z In fact while the materials,the,Unknown,Unknown
& priori the fact could scarcely be,the,Unknown,Unknown
to contain the fact that in those,the,Unknown,Unknown
found in the fact that the assigned,the,Unknown,Unknown
not overstating the fact to say that,the,Unknown,Unknown
"Inferences from the fact discovered,” —although these",the,Unknown,Unknown
and south. In fact they have the,the,Unknown,Unknown
well as the fact that the blocks,the,Unknown,Unknown
partly to the fact that the latter,the,Unknown,Unknown
dne to the fact that there the,the,Unknown,Unknown
"previously disturbed, the Fact site is uncertain.",the,Unknown,Unknown
intermediate 8izes. Tn fact the two forms,the,Unknown,Unknown
we consider the fact that the dental,the,Unknown,Unknown
"leg-bones, and in fact rtly overlapping the",the,Unknown,Unknown
"and Porous, in fact closely resembling the",the,Unknown,Unknown
points to the fact that the ©,the,Unknown,Unknown
accounts for the fact by their separate,the,Unknown,Unknown
rise. Though the fact of I@ variations,the,Unknown,Unknown
and in the fact its having been,the,Unknown,Unknown
"I overlooked the fact that, in order",the,rstl_1874_0020.txt,txt_rstl
this from the fact that on any,the,rstl_1874_0020.txt,txt_rstl
not homogeneous; in fact only the ratios,the,rstl_1874_0020.txt,txt_rstl
"but in the fact that, in order",the,Unknown,Unknown
"owing to the fact that, in order",the,Unknown,Unknown
tion to the fact that hitherto there,the,rstl_1874_0014.txt,txt_rstl
arose from the fact that we have,the,rstl_1874_0014.txt,txt_rstl
"or not, the fact has been clearly",the,rstl_1874_0014.txt,txt_rstl
dwells on the fact that Peripatus has,the,Unknown,Unknown
the most remarkable fact is the wide,the,Unknown,Unknown
ventral nerve-cords. The fact was considered remarkable,the,Unknown,Unknown
remarkable now. The fact shuts off at,the,Unknown,Unknown
diminished by the fact that in the,the,rstl_1874_0019.txt,txt_rstl
"clearly demonstrating the fact that those appendages,",the,rstl_1874_0019.txt,txt_rstl
the edge; in fact assuming a very,the,Unknown,Unknown
attaches to the fact that while one,the,Unknown,Unknown
referred to. In fact the only practical,the,Unknown,Unknown
"but of the fact that many, if",the,Unknown,Unknown
"differentiation s0ught, the fact that in the",the,Unknown,Unknown
"to the EZ fact that, 80 far",the,Unknown,Unknown
due to the fact that albuminoid matter,the,rstl_1874_0012.txt,txt_rstl
drawn from the fact that when a,the,Unknown,Unknown
bring forward the fact that the movement,the,Unknown,Unknown
agrees with the fact that terrestrial magnetic,the,Unknown,Unknown
quite conspicuous. The fact that the magnitudes,the,Unknown,Unknown
9598 with the fact that a 8uwitably,the,Unknown,Unknown
quartic equation; in fact from the original,the,Unknown,Unknown
"U=0, U'=0 (in fact the point «=0,",the,Unknown,Unknown
satisfy (as in fact they should) the,the,Unknown,Unknown
quintic one; in fact the equation F*«*=0?Z?,the,Unknown,Unknown
"of F&, In fact the second equation",the,Unknown,Unknown
these being in fact the values of,the,Unknown,Unknown
"assuming, as the fact is, that these",the,Unknown,Unknown
which is in fact the modular equation.,the,Unknown,Unknown
by v*—+*; in fact the equation may,the,Unknown,Unknown
root &=1); in fact the term in,the,Unknown,Unknown
order 292; in fact the intersections of,the,Unknown,Unknown
as the bare fact of the decomposition,the,Unknown,Unknown
= 4+» In fact the standard of,the,Unknown,Unknown
accordance with the fact demonstrated in that,the,Unknown,Unknown
contrast to the fact demonstrated by the,the,Unknown,Unknown
added to the fact that it is,the,Unknown,Unknown
"employed, and the fact that detonation was",the,Unknown,Unknown
involve hazard. The fact that the previous,the,Unknown,Unknown
increased by the fact that their vertical,the,Unknown,Unknown
"directed to the fact that, amongst the",the,Unknown,Unknown
for by the fact that nearly every,the,Unknown,Unknown
for by the fact that in the,the,Unknown,Unknown
appears from the fact that in the,the,Unknown,Unknown
"Zquisetacew, the above fact might be deemed",the,Unknown,Unknown
an important additional fact pointing in the,the,Unknown,Unknown
differ in the fact that only alternate,the,Unknown,Unknown
also to the fact that the largest,the,Unknown,Unknown
sustained by the fact that T possess,the,Unknown,Unknown
referred to the fact that the ligneous,the,Unknown,Unknown
attention to the fact that some species,the,Unknown,Unknown
apparent became the fact that the evidence,the,Unknown,Unknown
proved by the fact that thus far,the,Unknown,Unknown
account for the fact that the enfeeblement,the,Unknown,Unknown
I mentioned this fact in the presence,the,Unknown,Unknown
me the following fact :—* Our workmen's,the,Unknown,Unknown
of France. The fact that Mr. TroucuToN,the,Unknown,Unknown
favour is the fact that the flash,the,Unknown,Unknown
himself recounts the fact of his having,the,Unknown,Unknown
refers to the fact that aquatic Planarians,the,Unknown,Unknown
myself observed this fact in the case,the,Unknown,Unknown
due to the fact that T did,the,Unknown,Unknown
same manner. This fact in the habits,the,Unknown,Unknown
on the supposed fact that whilst in,the,Unknown,Unknown
conclusion. The great fact to be borne,the,Unknown,Unknown
stress on the fact that in Ommatoplea,the,Unknown,Unknown
"longitudinal fibres, in fact bear the same",the,Unknown,Unknown
relief by the fact that they are,the,Unknown,Unknown
explained by the fact that the nerve-ganglia,the,Unknown,Unknown
point to the fact that in all,the,Unknown,Unknown
"preparations, from the fact that it remains",the,Unknown,Unknown
"tertiary aggregates, the fact would surely come",the,Unknown,Unknown
"west winds, the fact remains, that at,",the,Unknown,Unknown
the year: this fact leads me to,the,Unknown,Unknown
"; and the fact already noticed, that",the,Unknown,Unknown
perceptible in the fact that the mean,the,Unknown,Unknown
also from the fact that tho adopted,the,Unknown,Unknown
insufficiently considered the fact that a high,the,Unknown,Unknown
to establish the fact in a satisfactory,the,Unknown,Unknown
detected beyond the fact that the mature,the,Unknown,Unknown
"observations, and the fact that the appearances",the,Unknown,Unknown
consequence of the fact that (47) only,the,Unknown,Unknown
in proving the fact of repulsion resulting,the,rstl_1875_0018.txt,txt_rstl
evidenced by the fact of the lines,the,rstl_1875_0018.txt,txt_rstl
drawn from the fact that the repulsion,the,rstl_1875_0018.txt,txt_rstl
owing to the fact that it was,the,Unknown,Unknown
In point of fact the thin layer,the,rstl_1875_0009.txt,txt_rstl
and by the fact that the two,the,rstl_1875_0009.txt,txt_rstl
be referred the fact that at May,the,Unknown,Unknown
"due to the fact that while «/,",the,Unknown,Unknown
"the error in fact was not great,",the,Unknown,Unknown
"TI state the fact thus briefly, notwithstanding",the,rstl_1875_0003.txt,txt_rstl
"interest once the fact has been announced,",the,rstl_1875_0003.txt,txt_rstl
testified by the fact that they continue,the,Unknown,Unknown
to 8ignify the fact of conscious discrimination,the,Unknown,Unknown
as to the fact of blindness being,the,Unknown,Unknown
hemisphere. The important fact noted in Exp.,the,Unknown,Unknown
"time, however, the fact is again noted",the,Unknown,Unknown
(besides confirming the fact of loss of,the,Unknown,Unknown
owing to the fact that reflex reaction,the,Unknown,Unknown
indicated by the fact that monkeys in,the,Unknown,Unknown
shown by the fact that a certain,the,Unknown,Unknown
evidenced by the fact that the animal,the,Unknown,Unknown
further illustrates the fact that when the,the,Unknown,Unknown
occurs. Beyond the fact of loss of,the,Unknown,Unknown
account for the fact that equally severe,the,Unknown,Unknown
