Context,Word,File,Directory
is monobasic. The fact that opi- Zanic,that,rstl_1867_0022.txt,txt_rstl
taken of the fact that it is,that,rstl_1867_0022.txt,txt_rstl
"cessors, being in fact that of the",that,Unknown,Unknown
such as the fact that the permanent,that,Unknown,Unknown
"in truth, the fact that they have",that,Unknown,Unknown
explained by the fact that the observations,that,Unknown,Unknown
muscle employed.” The fact that this musele,that,Unknown,Unknown
depending on the fact that the plane,that,Unknown,Unknown
that we in fact have V=2TU. 9.,that,rstl_1867_0002.txt,txt_rstl
"that we in fact have 81(#+1)= Y(4—8),",that,Unknown,Unknown
expression representing the fact that if is,that,Unknown,Unknown
evident from the fact that the same,that,Unknown,Unknown
Q 55. The fact that a large,that,Unknown,Unknown
remarkable from the fact that they have,that,Unknown,Unknown
I overlooked the fact that = is,that,Unknown,Unknown
out the important fact that the fibres,that,Unknown,Unknown
"number, from the fact that the authors",that,Unknown,Unknown
connexion with the fact that the fibres,that,Unknown,Unknown
shown by the fact that they sometimes,that,Unknown,Unknown
"part, to the fact that all the",that,Unknown,Unknown
seen by the fact that the acid,that,Unknown,Unknown
this increase. The fact that young ovarian,that,Unknown,Unknown
due to the fact that in a,that,Unknown,Unknown
shown by the fact that eggs which,that,Unknown,Unknown
experiment a. The fact that water was,that,Unknown,Unknown
explained by the fact that there were,that,Unknown,Unknown
shown by the fact that they do,that,Unknown,Unknown
stating the undoubted fact that the projection,that,Unknown,Unknown
and in the fact that the posterior,that,Unknown,Unknown
pubis. 7. The fact that the length,that,Unknown,Unknown
P . The fact that either the,that,Unknown,Unknown
"evidenced by the fact above mentioned, that",that,rstl_1868_0029.txt,txt_rstl
into account the fact that the section,that,rstl_1868_0027.txt,txt_rstl
arose from the fact that when the,that,rstl_1868_0027.txt,txt_rstl
error from the fact that at high,that,Unknown,Unknown
dependent on the fact that the ray,that,Unknown,Unknown
"The most remarkable fact is, that the",that,Unknown,Unknown
| but the fact that this is,that,Unknown,Unknown
becomes turbid. The fact that ammonia altered,that,Unknown,Unknown
"Thirdly, that the fact of reducing-agents developing,",that,Unknown,Unknown
is a curious fact that when carbonic,that,Unknown,Unknown
by nitrites. The fact that the loose,that,Unknown,Unknown
attributable to the fact that the Leyden,that,Unknown,Unknown
"suggested by the fact that the latter,",that,Unknown,Unknown
"E,=354* 29. zing fact that while at",that,Unknown,Unknown
is a suggestive fact that should not,that,Unknown,Unknown
"96), but the fact is, that the",that,Unknown,Unknown
pointed out the fact that the mineral,that,Unknown,Unknown
VANADIUM. El The fact that these older,that,Unknown,Unknown
"been gtated, the fact that one-third of",that,Unknown,Unknown
vanadium of Brrzrius).—The fact that the lemon-yellow-coloured,that,Unknown,Unknown
case is in fact included in that,that,Unknown,Unknown
evidenced by the fact that t] odontoid,that,Unknown,Unknown
account for the fact that the muscles,that,Unknown,Unknown
is an interesting fact that the hypoglossal,that,Unknown,Unknown
pointed out the fact that the descending,that,Unknown,Unknown
explained by the fact that the metal,that,rstl_1869_0028.txt,txt_rstl
although from the fact that many of,that,Unknown,Unknown
masses : the fact that methyl-normeconin was,that,Unknown,Unknown
Tables demonstrate the fact that exposure to,that,rstl_1869_0023.txt,txt_rstl
a rather remarkable fact that growing cinchona,that,rstl_1869_0023.txt,txt_rstl
"force, that the fact of additional pressure",that,rstl_1869_0021.txt,txt_rstl
"to explain the fact observed, that even",that,rstl_1869_0025.txt,txt_rstl
40. But the fact that substances in,that,rstl_1869_0025.txt,txt_rstl
owing to the fact that a globular,that,Unknown,Unknown
deductions beyond the fact that they relate,that,Unknown,Unknown
les in the fact that it not,that,rstl_1869_0032.txt,txt_rstl
entirely to the fact that the firss,that,Unknown,Unknown
strengthened by the fact that diligent sweeping,that,Unknown,Unknown
arises from the fact that the only,that,Unknown,Unknown
illustrated by the fact that a concussion,that,Unknown,Unknown
due to the fact that experiments on,that,Unknown,Unknown
with gun-cotton. The fact that the violent,that,Unknown,Unknown
"extent, for the fact that the detonation",that,Unknown,Unknown
part to the fact that the proportion,that,Unknown,Unknown
manner from the fact that in certain,that,rstl_1869_0013.txt,txt_rstl
is a remarkable fact that the rudiments,that,rstl_1869_0013.txt,txt_rstl
"80 that in fact the scroll, tenth",that,Unknown,Unknown
in evidence the fact that the reciprocal,that,Unknown,Unknown
for by the fact that during an,that,Unknown,Unknown
qualified by the fact that the after-,that,Unknown,Unknown
declination- * The fact that this is,that,Unknown,Unknown
for by the fact that fluoride of,that,Unknown,Unknown
of the curious fact that the specimens,that,Unknown,Unknown
the moors. Tho fact that they are,that,Unknown,Unknown
"therefore invisible, the fact being that the",that,Unknown,Unknown
as possible —a fact which implies that,that,Unknown,Unknown
reciprocal surface in fact shows that the,that,Unknown,Unknown
by the simple fact that a conyex,that,Unknown,Unknown
the horizon. The fact that the curve,that,Unknown,Unknown
often deplored the fact that though these,that,Unknown,Unknown
proved by the fact that both with,that,Unknown,Unknown
laid upon the fact that the same,that,Unknown,Unknown
confirmation of the fact that the liquid,that,Unknown,Unknown
to establish the fact that there is,that,Unknown,Unknown
doubt by the fact that transparent sections,that,Unknown,Unknown
arises from the fact that Paris is,that,Unknown,Unknown
allude to the fact that in the,that,Unknown,Unknown
for by the fact that the days,that,Unknown,Unknown
due to the fact that large groups,that,Unknown,Unknown
altogether remark- able fact is that in,that,Unknown,Unknown
a well recognized fact that the skull,that,Unknown,Unknown
remarkable and important fact that this is,that,Unknown,Unknown
harmony with the fact that no Ape,that,Unknown,Unknown
evident from the fact that photo- graphs,that,Unknown,Unknown
and with the fact that the former,that,Unknown,Unknown
the hypothesis. The fact that Sthe anomalous,that,Unknown,Unknown
the Deyonian beds—a fact which shows that,that,Unknown,Unknown
illustration of tho fact that this pith,that,Unknown,Unknown
an inter- esting fact that the specimen,that,Unknown,Unknown
lies in the fact that the stems,that,Unknown,Unknown
certain from the fact that mossing or,that,Unknown,Unknown
"adduced, Furthermore, the fact that the greater",that,Unknown,Unknown
"to the additional fact that porous bodies,",that,Unknown,Unknown
seen from the fact that he asumes,that,Unknown,Unknown
infer from the fact that at present,that,Unknown,Unknown
illustrated by She fact that the foremost,that,Unknown,Unknown
follows from the fact that the Seurve,that,Unknown,Unknown
"purpose, remarking the fact that in Plate",that,Unknown,Unknown
account of the fact that the curve,that,Unknown,Unknown
due to the fact that she is,that,Unknown,Unknown
80 that this fact has not much,that,Unknown,Unknown
thus indicating the fact that about 30,that,Unknown,Unknown
"before, notwithstanding the fact that at 80me",that,Unknown,Unknown
account of the fact that they are,that,Unknown,Unknown
briefly to the fact that no ship,that,Unknown,Unknown
account of the fact that when the,that,Unknown,Unknown
drawn to the fact that - in,that,Unknown,Unknown
illustration of the fact that it may,that,Unknown,Unknown
have noticed the fact that the strains,that,Unknown,Unknown
arose from the fact that he considered,that,Unknown,Unknown
account of the fact that n the,that,Unknown,Unknown
the wave-hollows. The fact that the excess,that,Unknown,Unknown
found in the fact that the maximum,that,Unknown,Unknown
account of the fact that the changes,that,Unknown,Unknown
"attention to the fact that in all,",that,Unknown,Unknown
account of the fact that such positions,that,Unknown,Unknown
account of the fact that we are,that,Unknown,Unknown
attention to the fact that when aground,that,Unknown,Unknown
due to the fact that the centres,that,Unknown,Unknown
reason for this fact being that the,that,Unknown,Unknown
yomer. From the fact that the vomer,that,Unknown,Unknown
"same time, the fact that individual yariations",that,Unknown,Unknown
out by the fact that it is,that,Unknown,Unknown
reason of the fact that the theory,that,Unknown,Unknown
measure on the fact that the quantity,that,Unknown,Unknown
in question. The fact is that the,that,Unknown,Unknown
arises from the fact that the foremost,that,Unknown,Unknown
and again. The fact is that the,that,Unknown,Unknown
arises from the fact that dehiscence commences,that,Unknown,Unknown
arises from the fact that it has,that,Unknown,Unknown
though faint. The fact that the higher,that,Unknown,Unknown
appears from the fact that the inyerse,that,Unknown,Unknown
sollows from the fact that the bisectors,that,Unknown,Unknown
established the interesting fact that the lower,that,Unknown,Unknown
appearance is the fact that clusters of,that,Unknown,Unknown
"one, to the fact that transverse sections",that,Unknown,Unknown
appears in the fact that the two,that,Unknown,Unknown
infer from this fact that at the,that,Unknown,Unknown
ignorance of the fact that the medul-,that,Unknown,Unknown
cells. Remembering the fact that a Diplozylon,that,Unknown,Unknown
attention to the fact that the foliar,that,Unknown,Unknown
exists in the fact that the S,that,Unknown,Unknown
established the important fact that ozone is,that,Unknown,Unknown
follow from the fact that the pole,that,Unknown,Unknown
"be 80, the fact that a matured",that,rstl_1872_0010.txt,txt_rstl
and that the fact explains why we,that,rstl_1872_0010.txt,txt_rstl
due to the fact that the section,that,rstl_1872_0010.txt,txt_rstl
"connected, Eyery new fact that we discoyer",that,rstl_1872_0010.txt,txt_rstl
lies in the fact that the leaf-scars,that,rstl_1872_0010.txt,txt_rstl
explained by the fact that in the,that,rstl_1872_0010.txt,txt_rstl
presume that this fact is to be,that,rstl_1872_0010.txt,txt_rstl
present is the fact that he believes,that,rstl_1872_0010.txt,txt_rstl
also by the fact that it is,that,rstl_1872_0008.txt,txt_rstl
testimony to the fact that at that,that,Unknown,Unknown
is dim. 'The fact that the bright,that,Unknown,Unknown
drawn from the fact that indentations of,that,Unknown,Unknown
due to the fact that the spectram,that,Unknown,Unknown
attention to the. fact that the metalloids,that,Unknown,Unknown
combined with the fact that the errors,that,Unknown,Unknown
anticipated from the fact that >the calculated,that,Unknown,Unknown
well as the fact that the exceptionally,that,Unknown,Unknown
"ariscs from the fact that Z6rixuR, 8ince",that,Unknown,Unknown
lies in the fact that the moon's,that,Unknown,Unknown
state that the fact that the re-reversal,that,Unknown,Unknown
such * The fact that the curve,that,rstl_1873_0001.txt,txt_rstl
pointed out the fact that right-handed rotations,that,rstl_1873_0001.txt,txt_rstl
due to the fact that the daily,that,rstl_1873_0001.txt,txt_rstl
yaluable results. The fact that the hypothesis,that,rstl_1873_0001.txt,txt_rstl
partly of the fact that these larger,that,Unknown,Unknown
"and the further fact remains, that we",that,Unknown,Unknown
already mentioned the fact that I have,that,Unknown,Unknown
attention to the fact that a specimen,that,Unknown,Unknown
the chemicals employed—a fact that has hitherto,that,Unknown,Unknown
prior stage the fact that the prootic,that,Unknown,Unknown
depends upon the fact that the *culmen,that,Unknown,Unknown
consists in the fact that the distal,that,Unknown,Unknown
seen by the fact that in the,that,Unknown,Unknown
the seemingly adverse fact that the reduced,that,Unknown,Unknown
lies in the fact that all its,that,Unknown,Unknown
owing to the fact that the posterior,that,Unknown,Unknown
owing to the fact that the Hogs,that,Unknown,Unknown
reader to the fact that these two,that,Unknown,Unknown
owing to the fact that the second,that,Unknown,Unknown
to support the fact that our earth,that,Unknown,Unknown
is a remarkable fact that the western,that,Unknown,Unknown
to contain the fact that in those,that,Unknown,Unknown
found in the fact that the assigned,that,Unknown,Unknown
not overstating the fact to say that,that,Unknown,Unknown
well as the fact that the blocks,that,Unknown,Unknown
partly to the fact that the latter,that,Unknown,Unknown
dne to the fact that there the,that,Unknown,Unknown
we consider the fact that the dental,that,Unknown,Unknown
points to the fact that the ©,that,Unknown,Unknown
this from the fact that on any,that,rstl_1874_0020.txt,txt_rstl
tion to the fact that hitherto there,that,rstl_1874_0014.txt,txt_rstl
arose from the fact that we have,that,rstl_1874_0014.txt,txt_rstl
dwells on the fact that Peripatus has,that,Unknown,Unknown
diminished by the fact that in the,that,rstl_1874_0019.txt,txt_rstl
"clearly demonstrating the fact that those appendages,",that,rstl_1874_0019.txt,txt_rstl
attaches to the fact that while one,that,Unknown,Unknown
"but of the fact that many, if",that,Unknown,Unknown
"to exist, that fact was © indicated.",that,Unknown,Unknown
"differentiation s0ught, the fact that in the",that,Unknown,Unknown
due to the fact that albuminoid matter,that,rstl_1874_0012.txt,txt_rstl
drawn from the fact that when a,that,Unknown,Unknown
bring forward the fact that the movement,that,Unknown,Unknown
agrees with the fact that terrestrial magnetic,that,Unknown,Unknown
quite conspicuous. The fact that the magnitudes,that,Unknown,Unknown
9598 with the fact that a 8uwitably,that,Unknown,Unknown
"assuming, as the fact is, that these",that,Unknown,Unknown
accordance with the fact demonstrated in that,that,Unknown,Unknown
added to the fact that it is,that,Unknown,Unknown
"employed, and the fact that detonation was",that,Unknown,Unknown
involve hazard. The fact that the previous,that,Unknown,Unknown
a further curious fact that no vacant,that,Unknown,Unknown
increased by the fact that their vertical,that,Unknown,Unknown
for by the fact that nearly every,that,Unknown,Unknown
for by the fact that in the,that,Unknown,Unknown
appears from the fact that in the,that,Unknown,Unknown
differ in the fact that only alternate,that,Unknown,Unknown
also to the fact that the largest,that,Unknown,Unknown
sustained by the fact that T possess,that,Unknown,Unknown
referred to the fact that the ligneous,that,Unknown,Unknown
attention to the fact that some species,that,Unknown,Unknown
apparent became the fact that the evidence,that,Unknown,Unknown
proved by the fact that thus far,that,Unknown,Unknown
account for the fact that the enfeeblement,that,Unknown,Unknown
of France. The fact that Mr. TroucuToN,that,Unknown,Unknown
favour is the fact that the flash,that,Unknown,Unknown
refers to the fact that aquatic Planarians,that,Unknown,Unknown
due to the fact that T did,that,Unknown,Unknown
on the supposed fact that whilst in,that,Unknown,Unknown
stress on the fact that in Ommatoplea,that,Unknown,Unknown
relief by the fact that they are,that,Unknown,Unknown
explained by the fact that the nerve-ganglia,that,Unknown,Unknown
point to the fact that in all,that,Unknown,Unknown
"preparations, from the fact that it remains",that,Unknown,Unknown
"west winds, the fact remains, that at,",that,Unknown,Unknown
"; and the fact already noticed, that",that,Unknown,Unknown
perceptible in the fact that the mean,that,Unknown,Unknown
infer from this fact that in a,that,Unknown,Unknown
also from the fact that tho adopted,that,Unknown,Unknown
insufficiently considered the fact that a high,that,Unknown,Unknown
detected beyond the fact that the mature,that,Unknown,Unknown
"observations, and the fact that the appearances",that,Unknown,Unknown
consequence of the fact that (47) only,that,Unknown,Unknown
drawn from the fact that the repulsion,that,rstl_1875_0018.txt,txt_rstl
owing to the fact that it was,that,Unknown,Unknown
and by the fact that the two,that,rstl_1875_0009.txt,txt_rstl
be referred the fact that at May,that,Unknown,Unknown
"due to the fact that while «/,",that,Unknown,Unknown
testified by the fact that they continue,that,Unknown,Unknown
owing to the fact that reflex reaction,that,Unknown,Unknown
indicated by the fact that monkeys in,that,Unknown,Unknown
shown by the fact that a certain,that,Unknown,Unknown
evidenced by the fact that the animal,that,Unknown,Unknown
further illustrates the fact that when the,that,Unknown,Unknown
account for the fact that equally severe,that,Unknown,Unknown
death. But the fact that for many,that,Unknown,Unknown
chiefly by the fact that they were,that,Unknown,Unknown
8hown by the fact that they become,that,Unknown,Unknown
"extent, by the fact that I found",that,Unknown,Unknown
deduced from the fact that they possess,that,Unknown,Unknown
evinced by the fact that the interpapillary,that,Unknown,Unknown
snpported by the fact that the lymph-corpuscles,that,Unknown,Unknown
only in the fact that a single,that,Unknown,Unknown
Weimar. ' The fact that the development,that,Unknown,Unknown
inferred from the fact that it is,that,Unknown,Unknown
and from the fact that I possessed,that,Unknown,Unknown
grape-bunch in the fact that the eggs,that,Unknown,Unknown
viz. in the fact that it is,that,Unknown,Unknown
better known the fact that the tempe-,that,Unknown,Unknown
confirmed by the fact that Gavr-Lussac himself,that,Unknown,Unknown
ascribed to the fact that the proportion,that,Unknown,Unknown
ascribable to the fact that the deflagration,that,Unknown,Unknown
accordance with the fact that the proportion,that,Unknown,Unknown
"chiefly upon the fact that powder, especially",that,Unknown,Unknown
due to the fact that with the,that,Unknown,Unknown
by the well-known fact that in short,that,Unknown,Unknown
due to the fact that the coal,that,Unknown,Unknown
detail with the fact that two internal,that,rstl_1876_0027.txt,txt_rstl
measurements. 4. The fact that the estimated,that,Unknown,Unknown
preceding statements. The fact that the effect,that,Unknown,Unknown
difficult by the fact that the water-jet,that,rstl_1876_0023.txt,txt_rstl
stress on the fact that the cells,that,rstl_1876_0021.txt,txt_rstl
shown by the fact that these cups,that,rstl_1876_0021.txt,txt_rstl
evident from the fact that the density,that,Unknown,Unknown
in mind the fact that the differences,that,rstl_1876_0016.txt,txt_rstl
I attribute the fact that the first,that,Unknown,Unknown
attention to the fact that in no,that,Unknown,Unknown
and pistols. This fact suggests that these,that,Unknown,Unknown
surprising in the fact that the wind,that,Unknown,Unknown
proved by the fact that the light,that,Unknown,Unknown
to establish the fact that the variations,that,Unknown,Unknown
notice immediately the fact that the moon's,that,Unknown,Unknown
has noticed the fact that great disturbances,that,Unknown,Unknown
and alcohol. The fact that gases like,that,Unknown,Unknown
of the singular fact that the air-manometer,that,Unknown,Unknown
alluded to; the fact that the Papilla,that,Unknown,Unknown
Sci. 1874). The fact that the development,that,Unknown,Unknown
remarkable from the fact that the epithelial,that,Unknown,Unknown
due to the fact that the epithelium,that,Unknown,Unknown
"reticulum, in the fact that it does",that,Unknown,Unknown
aware that this fact has been previously,that,rstl_1876_0006.txt,txt_rstl
implied by the fact that the more,that,rstl_1876_0006.txt,txt_rstl
proved by the fact that when a,that,rstl_1876_0006.txt,txt_rstl
recognition of the fact that hardness tends,that,rstl_1876_0006.txt,txt_rstl
attention to the fact that the cells,that,Unknown,Unknown
partly to the fact that a number,that,Unknown,Unknown
partly to the fact that the attachment,that,Unknown,Unknown
arises from the fact that the connective-tissue,that,Unknown,Unknown
"elements, and the fact that Professor Roscor",that,Unknown,Unknown
enhanced by the fact that vanadium possesses,that,Unknown,Unknown
"mind, therefore, the fact that the full",that,Unknown,Unknown
"itself. Further, the fact that vanadium does",that,Unknown,Unknown
and by the fact that other centres,that,Unknown,Unknown
ame colour. The fact that the work,that,Unknown,Unknown
due to the fact that a 8mall,that,Unknown,Unknown
due to the fact that crushing the,that,Unknown,Unknown
made for the fact that in this,that,Unknown,Unknown
evidence of the fact that it is,that,Unknown,Unknown
highly interest- ing fact that the convulsions,that,Unknown,Unknown
tolerance. Now the fact that between these,that,Unknown,Unknown
by the additional fact that at whatever,that,Unknown,Unknown
reconcile with the fact that some specimens,that,Unknown,Unknown
me from the fact that up to,that,Unknown,Unknown
for by the fact that the journal,that,Unknown,Unknown
add the curious fact that very frequently,that,Unknown,Unknown
hyoidean element. The fact that the stapes,that,Unknown,Unknown
it). Even the fact that this tract,that,Unknown,Unknown
” plate. The fact is that the,that,Unknown,Unknown
berichte.” A remarkable fact is that the,that,Unknown,Unknown
rians; and the fact that paired series,that,Unknown,Unknown
"to Sarcophyton, the fact that compound colonies",that,Unknown,Unknown
"of Sarcophyton, the fact that four of",that,Unknown,Unknown
already mentioned the fact that these vascular,that,Unknown,Unknown
cit.) to the fact that whilst in,that,Unknown,Unknown
this from the fact that in the,that,Unknown,Unknown
interest in the fact that it purports,that,Unknown,Unknown
proved by the fact that exposed tubes,that,Unknown,Unknown
is a remarkable fact that typhoid fever,that,Unknown,Unknown
founded on the fact that a virus,that,Unknown,Unknown
"cessors, being in fact that of the",in,Unknown,Unknown
It is in fact the homologue of,in,Unknown,Unknown
"in truth, the fact that they have",in,Unknown,Unknown
"formula, which in fact represents the degree",in,Unknown,Unknown
"support from the fact that, in those",in,rstl_1867_0006.txt,txt_rstl
"Vishes, is in fact the 8quamosal. A",in,Unknown,Unknown
upper surface in fact projecting 3 inches,in,Unknown,Unknown
"satisfactorily determined; in fact T,=T+153-42+0-30. . ....",in,Unknown,Unknown
curve would in fact pass off to,in,rstl_1867_0002.txt,txt_rstl
9=0. We in fact have x8nd—ycos/= min,in,rstl_1867_0002.txt,txt_rstl
that we in fact have V=2TU. 9.,in,rstl_1867_0002.txt,txt_rstl
point is in fact equivalent to two,in,rstl_1867_0002.txt,txt_rstl
+y*=1 ; in fact for m<4 (that,in,rstl_1867_0002.txt,txt_rstl
z=+ being in fact the point of,in,rstl_1867_0002.txt,txt_rstl
it is in fact a triple tangent.,in,rstl_1867_0002.txt,txt_rstl
themselves auxiliars; in fact for given values,in,Unknown,Unknown
illustration is in fact unnecessary. 267. I,in,Unknown,Unknown
"discussion is in fact almost, independent of",in,Unknown,Unknown
©; we in fact have a==(0+2(8—#+2p—4) (6+2)*(p—3),in,Unknown,Unknown
certain limits. In fact drawing upwards from,in,Unknown,Unknown
satisfied (which in fact can be done,in,Unknown,Unknown
"that we in fact have 81(#+1)= Y(4—8),",in,Unknown,Unknown
function has in fact the 12 values,in,Unknown,Unknown
"then he in fact finds (X, Y)",in,Unknown,Unknown
T-=A7A is in fact equivalent to the,in,Unknown,Unknown
Tt is in fact by means of,in,Unknown,Unknown
"equation is in fact a*(a?, y”)""=0, (n=mp+e),",in,Unknown,Unknown
there are in fact cases in which,in,Unknown,Unknown
its value in fact is &h =,in,Unknown,Unknown
"d), it in fact gives A a=(a,b,",in,Unknown,Unknown
"the ro-ordinates in fact are. T©=—J6Y, y=",in,Unknown,Unknown
the most extraordinary fact brought out in,in,Unknown,Unknown
"curvilinear, and in fact spiral, or, more",in,Unknown,Unknown
"heart *, In fact the fibres of",in,Unknown,Unknown
"direction; they in fact cross each other,",in,Unknown,Unknown
ARRANGEMENTS within. In fact if a cylinder,in,Unknown,Unknown
There is in fact no breach of,in,Unknown,Unknown
due to the fact that in a,in,Unknown,Unknown
to be the fact in Gasterosteus. In,in,Unknown,Unknown
attention to this fact in his lectures,in,Unknown,Unknown
and in the fact that the posterior,in,Unknown,Unknown
"resistances, and in fact done everything except",in,rstl_1868_0027.txt,txt_rstl
OC) is in fact given in the,in,Unknown,Unknown
which are in fact satisfied by the,in,Unknown,Unknown
altogether true. In fact the results from,in,Unknown,Unknown
Zcos is in fact not one of,in,Unknown,Unknown
there is in fact no evidence of,in,Unknown,Unknown
"suwms do in fact vanish, and we",in,rstl_1868_0007.txt,txt_rstl
velocity ; in fact the difference in,in,Unknown,Unknown
ment have in fact occasioned the greater,in,rstl_1868_0011.txt,txt_rstl
sections being in fact random points on,in,Unknown,Unknown
it is in fact easy to show,in,Unknown,Unknown
"it accurate, in fact every available hour",in,Unknown,Unknown
intensity ; in fact the only proof,in,Unknown,Unknown
the nebula— in fact immersed in the,in,Unknown,Unknown
scarcely visible; in fact its boundaries were,in,Unknown,Unknown
light ; in fact it was scarcely,in,Unknown,Unknown
"=24D, being in fact the most general",in,Unknown,Unknown
correspondence ; in fact to a ava,in,Unknown,Unknown
"this, as in fact already remarked, is",in,Unknown,Unknown
it is in fact to be regarded,in,Unknown,Unknown
of 9; in fact in these last,in,Unknown,Unknown
"phosphorus, and this fact in _itself serves",in,Unknown,Unknown
case is in fact included in that,in,Unknown,Unknown
of are in fact She ratios of,in,Unknown,Unknown
(this is in fact the ordinary theory,in,Unknown,Unknown
given curye; in fact according as the,in,Unknown,Unknown
is =4; in fact to find the,in,Unknown,Unknown
