Context,Word,File,Directory
On a review of the facts stated in the course of,stated,rstl_1841_0018.txt,txt_rstl
the eggs ; but the facts now about to be stated,stated,rstl_1841_0012.txt,txt_rstl
"baryta, and others, confirm the facts already stated ; viz. that",stated,rstl_1843_0003.txt,txt_rstl
the urine alkaline; and from facts which have been stated to,stated,rstl_1845_0015.txt,txt_rstl
easily accounted for by the facts already stated of irregular composition,stated,rstl_1845_0006.txt,txt_rstl
"a sulphate, &c. : the facts stated are suffi- cient to",stated,rstl_1846_0012.txt,txt_rstl
"a given point belonged. The facts that I have stated lead,",stated,rstl_1849_0021.txt,txt_rstl
conelusions are deducible from the facts stated in the pre- ceding,stated,rstl_1849_0022.txt,txt_rstl
which the accuracy of the facts stated in this paper are,stated,rstl_1850_0027.txt,txt_rstl
"confirm, from European localities, the facts I have stated respecting the",stated,rstl_1850_0016.txt,txt_rstl
"resolved. Notwithstanding these differences, however, facts mentioned by authors regarding the",these,rstl_1841_0017.txt,txt_rstl
"is not 80 much these facts to which I ask attention,",these,rstl_1841_0018.txt,txt_rstl
61 and 62. 63. Such facts as these appear to warrant,these,rstl_1841_0018.txt,txt_rstl
"from morning till night. These facts are perfectly normal*, and are",these,rstl_1842_0015.txt,txt_rstl
itself (fig. 14. c). These facts seem further to show that,these,rstl_1843_0013.txt,txt_rstl
with the orifices. From these facts it would appear that the,these,rstl_1843_0013.txt,txt_rstl
divisions of Myriapoda. These additional facts fully accord with the already,these,rstl_1843_0013.txt,txt_rstl
my observations were discontinued. These facts sufficiently show that a power,these,rstl_1844_0009.txt,txt_rstl
"was every reason, with these facts before us, to expect that",these,rstl_1844_0003.txt,txt_rstl
"of lead in Solution. These facts are well known, and prove",these,rstl_1844_0002.txt,txt_rstl
"exclusion of the anion. These facts are, we believe, irreconcilable with",these,rstl_1844_0001.txt,txt_rstl
"fix the attention. These are facts which, when the true physical",these,rstl_1844_0007.txt,txt_rstl
From the sum of these facts I am again forced to,these,rstl_1845_0012.txt,txt_rstl
"From the whole of these facts I was led to conclude,",these,rstl_1845_0013.txt,txt_rstl
at a knowledge of these facts I have repeated and varied,these,rstl_1845_0013.txt,txt_rstl
this moment in analysing these facts ; it is sufficient at,these,rstl_1845_0013.txt,txt_rstl
our own country. 3rdly. These facts place in rather a new,these,rstl_1845_0007.txt,txt_rstl
see the application of these facts to the vocal apparatus. We,these,rstl_1846_0028.txt,txt_rstl
were expiratory. These were the facts ; | I could not,these,rstl_1846_0027.txt,txt_rstl
"effusion rate. But, before these facts were ascertained this jet became",these,rstl_1846_0029.txt,txt_rstl
to 089 inch. As the facts shown by these observations are,these,rstl_1846_0020.txt,txt_rstl
vessels in the neighbourhood. These facts were demonstrated by preparations at,these,rstl_1846_0017.txt,txt_rstl
"hyponitric acid, &. From these facts it appears that nitric acid",these,rstl_1846_0012.txt,txt_rstl
"the entire organ, These same facts are verified also by including",these,rstl_1847_0014.txt,txt_rstl
combination with that substance. These facts led me to suspect that,these,rstl_1848_0010.txt,txt_rstl
combines these and many other facts respecting the tides into a,these,rstl_1848_0001.txt,txt_rstl
pass through the tissue. These facts of course do away with,these,rstl_1849_0023.txt,txt_rstl
"and teeth of Macropoma. These facts (if correctly interpreted, and T",these,rstl_1849_0023.txt,txt_rstl
very desirable to test these facts by further experiments. (47.) The,these,rstl_1850_0035.txt,txt_rstl
"less frequently performed*. With these facts before us, we can scarcely",these,rstl_1850_0037.txt,txt_rstl
which it is a consequence. Facts corresponding to these cases of,these,rstl_1850_0038.txt,txt_rstl
"vol, xi. 251. + These facts have been cited by L1zn16",these,rstl_1850_0038.txt,txt_rstl
"the impression made by these facts upon TatnaRD, who first discovered",these,rstl_1850_0038.txt,txt_rstl
the scientific conception of these facts from the electro- chemical point,these,rstl_1850_0038.txt,txt_rstl
supplies an explanation of these facts at once adequate and imple;,these,rstl_1850_0038.txt,txt_rstl
"always present, being dissolved. These facts are contrary to the usual",these,rstl_1850_0038.txt,txt_rstl
"may express these facts, the facts themselves are the 8ame. We",these,rstl_1850_0038.txt,txt_rstl
"24 : 16'5, From these facts it is evident that the",these,rstl_1850_0036.txt,txt_rstl
of the plates. From these facts I would infer that single,these,rstl_1850_0036.txt,txt_rstl
"of the bars. These interesting facts are of considerable value, as",these,rstl_1850_0036.txt,txt_rstl
to the optic lobes. These facts I think are of some,these,rstl_1850_0009.txt,txt_rstl
form of heat: from these facts I considered myself justified in,these,rstl_1850_0004.txt,txt_rstl
the 21st of May. These facts Dr. Butsr recorded in a,these,rstl_1850_0016.txt,txt_rstl
and 367 inches respectively. These facts suggest caution to all ob-,these,rstl_1850_0016.txt,txt_rstl
"as ** wseless,” —but also facts which go to corroborate some",some,rstl_1841_0018.txt,txt_rstl
"protochloride of palladium developes some facts of considerable interest, It is",some,rstl_1842_0016.txt,txt_rstl
"of a Postscript, some additional facts illustrative of the singular properties",some,rstl_1842_0013.txt,txt_rstl
"lead, to some new valuable facts or natural relations. Reviewing the",some,rstl_1843_0009.txt,txt_rstl
"by publication some of the facts which I also have obtained,",some,rstl_1843_0004.txt,txt_rstl
however to some of the facts connected with observations at different,some,rstl_1845_0010.txt,txt_rstl
"TI have, however, some other facts to mention which will demonstrate",some,rstl_1846_0012.txt,txt_rstl
expression can be given to facts which does not involve some,some,rstl_1847_0002.txt,txt_rstl
and Fovcavrr observed some remarkable facts of the same kind on,some,rstl_1847_0004.txt,txt_rstl
terpretation of some of the facts described in the Memoir on,some,rstl_1850_0019.txt,txt_rstl
IV. we have some curious facts illustrative of the necessity and,some,rstl_1850_0036.txt,txt_rstl
to the optic lobes. These facts I think are of some,some,rstl_1850_0009.txt,txt_rstl
shall venture to state some facts in connection with this point,some,rstl_1850_0009.txt,txt_rstl
the eggs ; but the facts now about to be stated,now,rstl_1841_0012.txt,txt_rstl
"will be seen that the facts I have now to mention,",now,rstl_1841_0019.txt,txt_rstl
nucleated cells. But the other facts now men- tioned+; I believe,now,rstl_1841_0019.txt,txt_rstl
and Sepia: and the additional facts which we have now unexpectedly,now,rstl_1844_0006.txt,txt_rstl
"certain thermal effect, the general facts now established will not be",now,rstl_1844_0002.txt,txt_rstl
this instance adopted. Now the facts and observations detailed in the,now,rstl_1845_0007.txt,txt_rstl
to the bearing of the facts I have now related on,now,rstl_1846_0005.txt,txt_rstl
"and the bearing of the facts now related, to dis- sent",now,rstl_1846_0025.txt,txt_rstl
"secrefory portion+. From all the facts which have been now related,",now,rstl_1846_0025.txt,txt_rstl
"The very singular and unexpected facts now detailed, merit attention and",now,rstl_1847_0011.txt,txt_rstl
he now proceeds to adduce facts which appear to him adequate,now,rstl_1850_0037.txt,txt_rstl
from the great mass of facts which have now been collected,now,rstl_1850_0010.txt,txt_rstl
"volatile organic bases. From the facts which have been now stated,",now,rstl_1850_0003.txt,txt_rstl
"is not 80 much these facts to which I ask attention,",i,rstl_1841_0018.txt,txt_rstl
"I explain it, and from facts above mentioned, showing that blood-corpuscles",i,rstl_1841_0018.txt,txt_rstl
"will be seen that the facts I have now to mention,",i,rstl_1841_0019.txt,txt_rstl
nucleated cells. But the other facts now men- tioned+; I believe,i,rstl_1841_0019.txt,txt_rstl
I in pos- ses8ion of facts connected with the process of,i,rstl_1841_0019.txt,txt_rstl
higher tribes of animals. 'These facts I had the honour of,i,rstl_1842_0014.txt,txt_rstl
"will I think elucidate sevyeral facts already known, but, as it",i,rstl_1842_0008.txt,txt_rstl
"in- deed as with many facts recorded in this memoir, I",i,rstl_1842_0008.txt,txt_rstl
"explained, I believe, by the facts above mentioned: as well as",i,rstl_1842_0008.txt,txt_rstl
"by publication some of the facts which I also have obtained,",i,rstl_1843_0004.txt,txt_rstl
and liver in the latter; facts which I regard as new,i,rstl_1843_0013.txt,txt_rstl
"I was examining it, the facts were still more satisfac- tory.",i,rstl_1844_0009.txt,txt_rstl
"the whole tenor of voltaic facts and genera] experience.” 24, I",i,rstl_1844_0003.txt,txt_rstl
From the sum of these facts I am again forced to,i,rstl_1845_0012.txt,txt_rstl
of the happy temperate mean.:..Some facts which I sball have presently,i,rstl_1845_0014.txt,txt_rstl
"From the whole of these facts I was led to conclude,",i,rstl_1845_0013.txt,txt_rstl
at a knowledge of these facts I have repeated and varied,i,rstl_1845_0013.txt,txt_rstl
present to deduce from the facts which I have laid before,i,rstl_1845_0007.txt,txt_rstl
"be drawn from all the facts described in this paper, I",i,rstl_1846_0004.txt,txt_rstl
to the bearing of the facts I have now related on,i,rstl_1846_0005.txt,txt_rstl
were expiratory. These were the facts ; | I could not,i,rstl_1846_0027.txt,txt_rstl
The following are a few facts which I have collected on,i,rstl_1846_0013.txt,txt_rstl
"are to investigations into the facts of terrestrial mag- netism, I",i,rstl_1846_0018.txt,txt_rstl
I would here recall the facts discovered by M. Loxcer and,i,rstl_1847_0013.txt,txt_rstl
"there may be in the facts I have communicated, is the",i,rstl_1847_0002.txt,txt_rstl
"as I do to the facts themselves, though I consider it",i,rstl_1847_0002.txt,txt_rstl
"Although, as applied to the facts detailed, I attached no further",i,rstl_1847_0002.txt,txt_rstl
"of founding this opinion on facts of a different kind, I",i,rstl_1847_0004.txt,txt_rstl
on looking however into such facts as I can gather which,i,rstl_1848_0011.txt,txt_rstl
"a given point belonged. The facts that I have stated lead,",i,rstl_1849_0021.txt,txt_rstl
"District, as far as the facts then ascertained would permit. I",i,rstl_1849_0017.txt,txt_rstl
theory of this action. The facts I have just mentioned gave,i,rstl_1850_0038.txt,txt_rstl
of the plates. From these facts I would infer that single,i,rstl_1850_0036.txt,txt_rstl
to the optic lobes. These facts I think are of some,i,rstl_1850_0009.txt,txt_rstl
form of heat: from these facts I considered myself justified in,i,rstl_1850_0004.txt,txt_rstl
"confirm, from European localities, the facts I have stated respecting the",i,rstl_1850_0016.txt,txt_rstl
have added but few new facts in this department of my,have,rstl_1841_0015.txt,txt_rstl
have noticed the important additional facts of the detection of the,have,rstl_1841_0012.txt,txt_rstl
"period just mentioned, any additional facts have been published, relating to",have,rstl_1841_0019.txt,txt_rstl
"will be seen that the facts I have now to mention,",have,rstl_1841_0019.txt,txt_rstl
"seems to have especial reference}. Facts will be hereafter mentioned, which",have,rstl_1842_0008.txt,txt_rstl
of the physical sciences the facts of observation and experiment have,have,rstl_1843_0014.txt,txt_rstl
"by publication some of the facts which I also have obtained,",have,rstl_1843_0004.txt,txt_rstl
"the attention of physiologists, certain facts appear, nevertheless, to have been",have,rstl_1843_0013.txt,txt_rstl
is however one of several facts which have presented themselves in,have,rstl_1843_0011.txt,txt_rstl
we have before us certain facts connected with the action of,have,rstl_1844_0003.txt,txt_rstl
and Sepia: and the additional facts which we have now unexpectedly,have,rstl_1844_0006.txt,txt_rstl
of the happy temperate mean.:..Some facts which I sball have presently,have,rstl_1845_0014.txt,txt_rstl
the urine alkaline; and from facts which have been stated to,have,rstl_1845_0015.txt,txt_rstl
at a knowledge of these facts I have repeated and varied,have,rstl_1845_0013.txt,txt_rstl
present to deduce from the facts which I have laid before,have,rstl_1845_0007.txt,txt_rstl
to the bearing of the facts I have now related on,have,rstl_1846_0005.txt,txt_rstl
"T have suggested of the facts described be '> correct, and",have,rstl_1846_0024.txt,txt_rstl
"secrefory portion+. From all the facts which have been now related,",have,rstl_1846_0025.txt,txt_rstl
The following are a few facts which I have collected on,have,rstl_1846_0013.txt,txt_rstl
"there may be in the facts I have communicated, is the",have,rstl_1847_0002.txt,txt_rstl
pletely set aside by the facts and arguments which have been,have,rstl_1848_0019.txt,txt_rstl
"a given point belonged. The facts that I have stated lead,",have,rstl_1849_0021.txt,txt_rstl
the true explanation of the facts which have been thus pointed,have,rstl_1849_0012.txt,txt_rstl
of conducting electricity. All the facts which have been adduced in,have,rstl_1850_0037.txt,txt_rstl
the ready comprehension of the facts which have been recorded by,have,rstl_1850_0025.txt,txt_rstl
"vol, xi. 251. + These facts have been cited by L1zn16",have,rstl_1850_0038.txt,txt_rstl
theory of this action. The facts I have just mentioned gave,have,rstl_1850_0038.txt,txt_rstl
IV. we have some curious facts illustrative of the necessity and,have,rstl_1850_0036.txt,txt_rstl
from the great mass of facts which have now been collected,have,rstl_1850_0010.txt,txt_rstl
"volatile organic bases. From the facts which have been now stated,",have,rstl_1850_0003.txt,txt_rstl
"have their foundation possibly in facts of this kind, 8. Diffusion",have,rstl_1850_0001.txt,txt_rstl
"confirm, from European localities, the facts I have stated respecting the",have,rstl_1850_0016.txt,txt_rstl
corpuscles of the blood. Those facts were of a character which,which,rstl_1841_0018.txt,txt_rstl
"is not 80 much these facts to which I ask attention,",which,rstl_1841_0018.txt,txt_rstl
"as ** wseless,” —but also facts which go to corroborate some",which,rstl_1841_0018.txt,txt_rstl
'The following are the leading facts which the preceding researches upon,which,rstl_1841_0015.txt,txt_rstl
'The conclusions to which the facts detailed in this paper seem,which,rstl_1841_0012.txt,txt_rstl
"seems to have especial reference}. Facts will be hereafter mentioned, which",which,rstl_1842_0008.txt,txt_rstl
"by publication some of the facts which I also have obtained,",which,rstl_1843_0004.txt,txt_rstl
and liver in the latter; facts which I regard as new,which,rstl_1843_0013.txt,txt_rstl
is however one of several facts which have presented themselves in,which,rstl_1843_0011.txt,txt_rstl
and Sepia: and the additional facts which we have now unexpectedly,which,rstl_1844_0006.txt,txt_rstl
by an important class of facts which next fell under our,which,rstl_1844_0001.txt,txt_rstl
place distinctly before our minds facts of which the explanation mnst,which,rstl_1844_0007.txt,txt_rstl
of the happy temperate mean.:..Some facts which I sball have presently,which,rstl_1845_0014.txt,txt_rstl
the urine alkaline; and from facts which have been stated to,which,rstl_1845_0015.txt,txt_rstl
upon the truth of the facts on which the doctrine of,which,rstl_1845_0007.txt,txt_rstl
present to deduce from the facts which I have laid before,which,rstl_1845_0007.txt,txt_rstl
"great, addition made to the facts and considerations which tend to",which,rstl_1846_0001.txt,txt_rstl
"secrefory portion+. From all the facts which have been now related,",which,rstl_1846_0025.txt,txt_rstl
are at least founded on facts which are incontrovertibly established. DescRIPTION,which,rstl_1846_0028.txt,txt_rstl
The following are a few facts which I have collected on,which,rstl_1846_0013.txt,txt_rstl
"TI have, however, some other facts to mention which will demonstrate",which,rstl_1846_0012.txt,txt_rstl
expression can be given to facts which does not involve some,which,rstl_1847_0002.txt,txt_rstl
be an extensive series of facts which afford Strong hope of,which,rstl_1847_0002.txt,txt_rstl
medium. Thus Mr. Grove adduces facts from which it appears that,which,rstl_1847_0004.txt,txt_rstl
pletely set aside by the facts and arguments which have been,which,rstl_1848_0019.txt,txt_rstl
on looking however into such facts as I can gather which,which,rstl_1848_0011.txt,txt_rstl
exactly the reverse of the facts which take place at the,which,rstl_1848_0008.txt,txt_rstl
the true explanation of the facts which have been thus pointed,which,rstl_1849_0012.txt,txt_rstl
which the accuracy of the facts stated in this paper are,which,rstl_1850_0027.txt,txt_rstl
of conducting electricity. All the facts which have been adduced in,which,rstl_1850_0037.txt,txt_rstl
adducing in support of it facts which are s0 well known,which,rstl_1850_0037.txt,txt_rstl
he now proceeds to adduce facts which appear to him adequate,which,rstl_1850_0037.txt,txt_rstl
"fabric that manifests it. The facts already cited, which show how",which,rstl_1850_0037.txt,txt_rstl
"express, in a few lines, facts in Comparative Anatomy which would",which,rstl_1850_0025.txt,txt_rstl
the ready comprehension of the facts which have been recorded by,which,rstl_1850_0025.txt,txt_rstl
which it is a consequence. Facts corresponding to these cases of,which,rstl_1850_0038.txt,txt_rstl
the purpose of collecting the facts on which are founded the,which,rstl_1850_0036.txt,txt_rstl
"which will be found the facts more in detail, and which",which,rstl_1850_0036.txt,txt_rstl
this conclusion : and the facts on which it was based,which,rstl_1850_0011.txt,txt_rstl
is not perfectly hardened. The facts which are recorded in the,which,rstl_1850_0029.txt,txt_rstl
from the great mass of facts which have now been collected,which,rstl_1850_0010.txt,txt_rstl
"with alkaline lyes. —From the facts which haye been previously stated,",which,rstl_1850_0003.txt,txt_rstl
"volatile organic bases. From the facts which have been now stated,",which,rstl_1850_0003.txt,txt_rstl
"period just mentioned, any additional facts have been published, relating to",been,rstl_1841_0019.txt,txt_rstl
"the attention of physiologists, certain facts appear, nevertheless, to have been",been,rstl_1843_0013.txt,txt_rstl
the urine alkaline; and from facts which have been stated to,been,rstl_1845_0015.txt,txt_rstl
"secrefory portion+. From all the facts which have been now related,",been,rstl_1846_0025.txt,txt_rstl
pletely set aside by the facts and arguments which have been,been,rstl_1848_0019.txt,txt_rstl
"probable, has by the same facts and arguments been proved to",been,rstl_1848_0019.txt,txt_rstl
the true explanation of the facts which have been thus pointed,been,rstl_1849_0012.txt,txt_rstl
"been thus pointed out, the facts themselves are highly deserving of",been,rstl_1849_0012.txt,txt_rstl
of conducting electricity. All the facts which have been adduced in,been,rstl_1850_0037.txt,txt_rstl
the ready comprehension of the facts which have been recorded by,been,rstl_1850_0025.txt,txt_rstl
means of them. Had those facts been explained by ineans of,been,rstl_1850_0025.txt,txt_rstl
"vol, xi. 251. + These facts have been cited by L1zn16",been,rstl_1850_0038.txt,txt_rstl
from the great mass of facts which have now been collected,been,rstl_1850_0010.txt,txt_rstl
"with alkaline lyes. —From the facts which haye been previously stated,",been,rstl_1850_0003.txt,txt_rstl
"volatile organic bases. From the facts which have been now stated,",been,rstl_1850_0003.txt,txt_rstl
'The following are the leading facts which the preceding researches upon,are,rstl_1841_0015.txt,txt_rstl
with great difficulty that the facts connected with them are ascertained.,are,rstl_1841_0012.txt,txt_rstl
"this time to speculate, without facts that are $till wanted regarding",are,rstl_1841_0019.txt,txt_rstl
"from morning till night. These facts are perfectly normal*, and are",are,rstl_1842_0015.txt,txt_rstl
incorrect. 2. The preceding negative facts are not without their value,are,rstl_1844_0003.txt,txt_rstl
that there are any experimental facts to prove whether this tension,are,rstl_1844_0003.txt,txt_rstl
"of lead in Solution. These facts are well known, and prove",are,rstl_1844_0002.txt,txt_rstl
"fix the attention. These are facts which, when the true physical",are,rstl_1844_0007.txt,txt_rstl
"considerations. 2417. Such are the facts which, in addition to those",are,rstl_1846_0004.txt,txt_rstl
are at least founded on facts which are incontrovertibly established. DescRIPTION,are,rstl_1846_0028.txt,txt_rstl
to 089 inch. As the facts shown by these observations are,are,rstl_1846_0020.txt,txt_rstl
The following are a few facts which I have collected on,are,rstl_1846_0013.txt,txt_rstl
"are to investigations into the facts of terrestrial mag- netism, I",are,rstl_1846_0018.txt,txt_rstl
"a sulphate, &c. : the facts stated are suffi- cient to",are,rstl_1846_0012.txt,txt_rstl
"the entire organ, These same facts are verified also by including",are,rstl_1847_0014.txt,txt_rstl
"the combustible gases, but the facts are far too few to",are,rstl_1847_0001.txt,txt_rstl
as we cannot know what facts are designated by such terms,are,rstl_1848_0001.txt,txt_rstl
conelusions are deducible from the facts stated in the pre- ceding,are,rstl_1849_0022.txt,txt_rstl
quoted. The following are the facts relative to the nervous supply,are,rstl_1849_0003.txt,txt_rstl
"been thus pointed out, the facts themselves are highly deserving of",are,rstl_1849_0012.txt,txt_rstl
which the accuracy of the facts stated in this paper are,are,rstl_1850_0027.txt,txt_rstl
adducing in support of it facts which are s0 well known,are,rstl_1850_0037.txt,txt_rstl
in the text. + The facts dexcribed in the text are,are,rstl_1850_0019.txt,txt_rstl
condition. There are even well-known facts of great importance in this,are,rstl_1850_0038.txt,txt_rstl
"always present, being dissolved. These facts are contrary to the usual",are,rstl_1850_0038.txt,txt_rstl
"may express these facts, the facts themselves are the 8ame. We",are,rstl_1850_0038.txt,txt_rstl
the purpose of collecting the facts on which are founded the,are,rstl_1850_0036.txt,txt_rstl
"of the bars. These interesting facts are of considerable value, as",are,rstl_1850_0036.txt,txt_rstl
is not perfectly hardened. The facts which are recorded in the,are,rstl_1850_0029.txt,txt_rstl
to the optic lobes. These facts I think are of some,are,rstl_1850_0009.txt,txt_rstl
"vertex to coccyx, the same facts are as plainly observed =",are,rstl_1850_0007.txt,txt_rstl
"I explain it, and from facts above mentioned, showing that blood-corpuscles",from,rstl_1841_0018.txt,txt_rstl
"be naturally deduced from the facts demonstrated in the foregoing dissections,—",from,rstl_1841_0015.txt,txt_rstl
"from morning till night. These facts are perfectly normal*, and are",from,rstl_1842_0015.txt,txt_rstl
"whole, it appears from the facts and reasonings of this paper,",from,rstl_1842_0015.txt,txt_rstl
with the orifices. From these facts it would appear that the,from,rstl_1843_0013.txt,txt_rstl
"differ 80 widely from the facts in the southern latitudes, shows",from,rstl_1844_0007.txt,txt_rstl
From the sum of these facts I am again forced to,from,rstl_1845_0012.txt,txt_rstl
the urine alkaline; and from facts which have been stated to,from,rstl_1845_0015.txt,txt_rstl
"From the whole of these facts I was led to conclude,",from,rstl_1845_0013.txt,txt_rstl
present to deduce from the facts which I have laid before,from,rstl_1845_0007.txt,txt_rstl
"formed :— From the ordinary facts of the tides, it seems",from,rstl_1845_0001.txt,txt_rstl
"be drawn from all the facts described in this paper, I",from,rstl_1846_0004.txt,txt_rstl
"secrefory portion+. From all the facts which have been now related,",from,rstl_1846_0025.txt,txt_rstl
"say, the greatest number of facts possible from the smallest number",from,rstl_1846_0026.txt,txt_rstl
"hyponitric acid, &. From these facts it appears that nitric acid",from,rstl_1846_0012.txt,txt_rstl
"is generated. 5 From the facts above stated, it appears that",from,rstl_1846_0012.txt,txt_rstl
"July and August. From the facts here brought forward, it may",from,rstl_1847_0006.txt,txt_rstl
medium. Thus Mr. Grove adduces facts from which it appears that,from,rstl_1847_0004.txt,txt_rstl
conelusions are deducible from the facts stated in the pre- ceding,from,rstl_1849_0022.txt,txt_rstl
"The conclusions drawn from the facts given are, that the Sus",from,rstl_1850_0025.txt,txt_rstl
"is generically distinetf. From the facts before us, our knowledge of",from,rstl_1850_0019.txt,txt_rstl
the scientific conception of these facts from the electro- chemical point,from,rstl_1850_0038.txt,txt_rstl
"24 : 16'5, From these facts it is evident that the",from,rstl_1850_0036.txt,txt_rstl
of the plates. From these facts I would infer that single,from,rstl_1850_0036.txt,txt_rstl
"alone, it appears from the facts already recorded, that iron is",from,rstl_1850_0036.txt,txt_rstl
from the great mass of facts which have now been collected,from,rstl_1850_0010.txt,txt_rstl
"volatile organic bases. From the facts which have been now stated,",from,rstl_1850_0003.txt,txt_rstl
form of heat: from these facts I considered myself justified in,from,rstl_1850_0004.txt,txt_rstl
"confirm, from European localities, the facts I have stated respecting the",from,rstl_1850_0016.txt,txt_rstl
"I explain it, and from facts above mentioned, showing that blood-corpuscles",that,rstl_1841_0018.txt,txt_rstl
of the embryo that the facts ascertained appear to be of,that,rstl_1841_0012.txt,txt_rstl
