Context,Word,File,Directory
"in conjunction with many preceding facts and arguments, to show that",to,rstl_1840_0004.txt,txt_rstl
results > To meet such facts it must be bent about,to,rstl_1840_0004.txt,txt_rstl
METALLIC CONTACT. 115 observations and facts to show the number of,to,rstl_1840_0004.txt,txt_rstl
"but reservedly expressed, that the facts were favourable to the theory",to,rstl_1840_0004.txt,txt_rstl
"considered as hitherto undecided. The facts about to be tated, however,",to,rstl_1840_0002.txt,txt_rstl
"of no small interest. The facts I am about to recite,",to,rstl_1840_0002.txt,txt_rstl
"is not 80 much these facts to which I ask attention,",to,rstl_1841_0018.txt,txt_rstl
"as ** wseless,” —but also facts which go to corroborate some",to,rstl_1841_0018.txt,txt_rstl
61 and 62. 63. Such facts as these appear to warrant,to,rstl_1841_0018.txt,txt_rstl
the eggs ; but the facts now about to be stated,to,rstl_1841_0012.txt,txt_rstl
entirely overlooked many most important facts in regard to the production,to,rstl_1841_0012.txt,txt_rstl
'The conclusions to which the facts detailed in this paper seem,to,rstl_1841_0012.txt,txt_rstl
of the embryo that the facts ascertained appear to be of,to,rstl_1841_0012.txt,txt_rstl
"period just mentioned, any additional facts have been published, relating to",to,rstl_1841_0019.txt,txt_rstl
"will be seen that the facts I have now to mention,",to,rstl_1841_0019.txt,txt_rstl
"find that, while bringing forward facts opposed to the views of",to,rstl_1841_0019.txt,txt_rstl
"this time to speculate, without facts that are $till wanted regarding",to,rstl_1841_0019.txt,txt_rstl
more accurately to agree with facts ; and I have ventured,with,rstl_1833_0030.txt,txt_rstl
with the immense collection of facts belonging to this branch of,with,rstl_1833_0030.txt,txt_rstl
consideration beyond that of insulated facts or mere details. Impressed with,with,rstl_1833_0028.txt,txt_rstl
altogether. * Having observed these facts in connexion with the reflex,with,rstl_1833_0028.txt,txt_rstl
at variance with all the facts and experiments detailed in the,with,rstl_1833_0028.txt,txt_rstl
"the world, and with other facts probably still to be revealed,",with,rstl_1833_0019.txt,txt_rstl
strict accordance with the observed facts of the influence of colour,with,rstl_1833_0016.txt,txt_rstl
began to accumulate ; which facts harmonized with my observations made,with,rstl_1834_0029.txt,txt_rstl
to reconcile the lately ascertained facts respecting the mammary glands with,with,rstl_1834_0028.txt,txt_rstl
"founded, nor compatible with the facts which I have brought forward.",with,rstl_1834_0027.txt,txt_rstl
the slightest degree with the facts which can be brought to,with,rstl_1834_0008.txt,txt_rstl
"subsequent, memoirs will prove. The facts connected with the metamorphosis in",with,rstl_1835_0023.txt,txt_rstl
"upon the inquiry. Still, these facts combined with observations relative to",with,rstl_1835_0013.txt,txt_rstl
"expect, I think the few facts bearing upon this subject with",with,rstl_1835_0005.txt,txt_rstl
"with the fundamental laws and facts of electrical science, that I",with,rstl_1835_0005.txt,txt_rstl
functions. When we connect these facts with that of the longitudinal,with,rstl_1836_0026.txt,txt_rstl
be unimportant to review such facts connected with this point as,with,rstl_1836_0022.txt,txt_rstl
susceptible. In accordance with these facts a per- fectly insulating disc,with,rstl_1836_0022.txt,txt_rstl
"of these, which with other facts immediately to be noticed, render",with,rstl_1836_0028.txt,txt_rstl
accordance with all the other facts which have been stated respecting,with,rstl_1836_0020.txt,txt_rstl
"8tate the whole of those facts with their various bearings, which",with,rstl_1836_0020.txt,txt_rstl
"of the equilibrium-theory with the facts (assuming « = 2"") is",with,rstl_1836_0014.txt,txt_rstl
"own mind with the new facts and reasonings which they contain,",with,rstl_1836_0012.txt,txt_rstl
cells are lined. With the facts before us of the progressive,with,rstl_1837_0024.txt,txt_rstl
and together with many other facts connected with the physiology of,with,rstl_1837_0019.txt,txt_rstl
means of ascertaining all the facts connected with the temperature of,with,rstl_1837_0019.txt,txt_rstl
"also beautifully accord with the facts ascertained, and the views deduced",with,rstl_1837_0019.txt,txt_rstl
high degrees of temperature. The facts connected with the presumed plethoric,with,rstl_1837_0019.txt,txt_rstl
the Winter. The many curious facts connected with the production of,with,rstl_1837_0019.txt,txt_rstl
"with much less rapidity. These facts are shown in the observations,",with,rstl_1837_0019.txt,txt_rstl
explained by reference to the facts connected with the production of,with,rstl_1837_0019.txt,txt_rstl
per minute. These are interesting facts as connected with the power,with,rstl_1837_0019.txt,txt_rstl
"increased during respiration? With these facts in consideration, and looking at",with,rstl_1837_0019.txt,txt_rstl
thirty-four beats per minute. These facts therefore are in accordance with,with,rstl_1837_0019.txt,txt_rstl
"in the same. With these facts before us, we are enabled",with,rstl_1838_0021.txt,txt_rstl
alternate differently. There are some facts intimately connected with the subject,with,rstl_1838_0019.txt,txt_rstl
becoming acquainted with the known facts on animal development and other,with,rstl_1838_0016.txt,txt_rstl
"but with all the known facts of common induction, conduction, and",with,rstl_1838_0008.txt,txt_rstl
in accordance with Mr. Harris's facts and conclusions respecting the resistance,with,rstl_1838_0008.txt,txt_rstl
"I think, in contradiction with facts (511, &c.). It appears to",with,rstl_1838_0009.txt,txt_rstl
"the ac- cordance of known facts with it, but in the",with,rstl_1838_0002.txt,txt_rstl
perfectly in accordance with the facts observed in the deviations and,with,rstl_1839_0014.txt,txt_rstl
with a number of new facts observed by the author. {,with,rstl_1839_0021.txt,txt_rstl
the obser- vation of the facts was with me long anterior,with,rstl_1840_0013.txt,txt_rstl
in the perception of experimental facts not wholly coinciding with Sir,with,rstl_1840_0013.txt,txt_rstl
"be seen on comparing the facts about to be recorded, with",with,rstl_1840_0024.txt,txt_rstl
"memoir in con- nexion with facts recorded in my Jast, it",with,rstl_1840_0024.txt,txt_rstl
theory may agree with the facts is necessary : $till it,with,rstl_1840_0003.txt,txt_rstl
"to the platinum, and the facts mainly as with iron. But",with,rstl_1840_0003.txt,txt_rstl
"in conjunction with many preceding facts and arguments, to show that",with,rstl_1840_0004.txt,txt_rstl
of urea 6 Whether these facts have any connexion with the,with,rstl_1840_0002.txt,txt_rstl
"preceding remarks, combined with the facts and arguments advanced in my",with,rstl_1841_0009.txt,txt_rstl
entirely in accordance with the facts subse- quently ascertained respecting the,with,rstl_1841_0012.txt,txt_rstl
with great difficulty that the facts connected with them are ascertained.,with,rstl_1841_0012.txt,txt_rstl
I in pos- ses8ion of facts connected with the process of,with,rstl_1841_0019.txt,txt_rstl
more accurately to agree with facts ; and I have ventured,with,rstl_1833_0030.txt,txt_rstl
with the immense collection of facts belonging to this branch of,with,rstl_1833_0030.txt,txt_rstl
consideration beyond that of insulated facts or mere details. Impressed with,with,rstl_1833_0028.txt,txt_rstl
altogether. * Having observed these facts in connexion with the reflex,with,rstl_1833_0028.txt,txt_rstl
at variance with all the facts and experiments detailed in the,with,rstl_1833_0028.txt,txt_rstl
"the world, and with other facts probably still to be revealed,",with,rstl_1833_0019.txt,txt_rstl
strict accordance with the observed facts of the influence of colour,with,rstl_1833_0016.txt,txt_rstl
began to accumulate ; which facts harmonized with my observations made,with,rstl_1834_0029.txt,txt_rstl
to reconcile the lately ascertained facts respecting the mammary glands with,with,rstl_1834_0028.txt,txt_rstl
"founded, nor compatible with the facts which I have brought forward.",with,rstl_1834_0027.txt,txt_rstl
the slightest degree with the facts which can be brought to,with,rstl_1834_0008.txt,txt_rstl
"subsequent, memoirs will prove. The facts connected with the metamorphosis in",with,rstl_1835_0023.txt,txt_rstl
"upon the inquiry. Still, these facts combined with observations relative to",with,rstl_1835_0013.txt,txt_rstl
"expect, I think the few facts bearing upon this subject with",with,rstl_1835_0005.txt,txt_rstl
"with the fundamental laws and facts of electrical science, that I",with,rstl_1835_0005.txt,txt_rstl
functions. When we connect these facts with that of the longitudinal,with,rstl_1836_0026.txt,txt_rstl
be unimportant to review such facts connected with this point as,with,rstl_1836_0022.txt,txt_rstl
susceptible. In accordance with these facts a per- fectly insulating disc,with,rstl_1836_0022.txt,txt_rstl
"of these, which with other facts immediately to be noticed, render",with,rstl_1836_0028.txt,txt_rstl
accordance with all the other facts which have been stated respecting,with,rstl_1836_0020.txt,txt_rstl
"8tate the whole of those facts with their various bearings, which",with,rstl_1836_0020.txt,txt_rstl
"of the equilibrium-theory with the facts (assuming « = 2"") is",with,rstl_1836_0014.txt,txt_rstl
"own mind with the new facts and reasonings which they contain,",with,rstl_1836_0012.txt,txt_rstl
cells are lined. With the facts before us of the progressive,with,rstl_1837_0024.txt,txt_rstl
and together with many other facts connected with the physiology of,with,rstl_1837_0019.txt,txt_rstl
means of ascertaining all the facts connected with the temperature of,with,rstl_1837_0019.txt,txt_rstl
"also beautifully accord with the facts ascertained, and the views deduced",with,rstl_1837_0019.txt,txt_rstl
high degrees of temperature. The facts connected with the presumed plethoric,with,rstl_1837_0019.txt,txt_rstl
the Winter. The many curious facts connected with the production of,with,rstl_1837_0019.txt,txt_rstl
"with much less rapidity. These facts are shown in the observations,",with,rstl_1837_0019.txt,txt_rstl
explained by reference to the facts connected with the production of,with,rstl_1837_0019.txt,txt_rstl
per minute. These are interesting facts as connected with the power,with,rstl_1837_0019.txt,txt_rstl
"increased during respiration? With these facts in consideration, and looking at",with,rstl_1837_0019.txt,txt_rstl
thirty-four beats per minute. These facts therefore are in accordance with,with,rstl_1837_0019.txt,txt_rstl
"in the same. With these facts before us, we are enabled",with,rstl_1838_0021.txt,txt_rstl
alternate differently. There are some facts intimately connected with the subject,with,rstl_1838_0019.txt,txt_rstl
becoming acquainted with the known facts on animal development and other,with,rstl_1838_0016.txt,txt_rstl
"but with all the known facts of common induction, conduction, and",with,rstl_1838_0008.txt,txt_rstl
in accordance with Mr. Harris's facts and conclusions respecting the resistance,with,rstl_1838_0008.txt,txt_rstl
"I think, in contradiction with facts (511, &c.). It appears to",with,rstl_1838_0009.txt,txt_rstl
"the ac- cordance of known facts with it, but in the",with,rstl_1838_0002.txt,txt_rstl
perfectly in accordance with the facts observed in the deviations and,with,rstl_1839_0014.txt,txt_rstl
with a number of new facts observed by the author. {,with,rstl_1839_0021.txt,txt_rstl
the obser- vation of the facts was with me long anterior,with,rstl_1840_0013.txt,txt_rstl
in the perception of experimental facts not wholly coinciding with Sir,with,rstl_1840_0013.txt,txt_rstl
"be seen on comparing the facts about to be recorded, with",with,rstl_1840_0024.txt,txt_rstl
"memoir in con- nexion with facts recorded in my Jast, it",with,rstl_1840_0024.txt,txt_rstl
theory may agree with the facts is necessary : $till it,with,rstl_1840_0003.txt,txt_rstl
"to the platinum, and the facts mainly as with iron. But",with,rstl_1840_0003.txt,txt_rstl
"in conjunction with many preceding facts and arguments, to show that",with,rstl_1840_0004.txt,txt_rstl
of urea 6 Whether these facts have any connexion with the,with,rstl_1840_0002.txt,txt_rstl
"preceding remarks, combined with the facts and arguments advanced in my",with,rstl_1841_0009.txt,txt_rstl
entirely in accordance with the facts subse- quently ascertained respecting the,with,rstl_1841_0012.txt,txt_rstl
with great difficulty that the facts connected with them are ascertained.,with,rstl_1841_0012.txt,txt_rstl
I in pos- ses8ion of facts connected with the process of,with,rstl_1841_0019.txt,txt_rstl
was not aware of the facts stated in M. Du Buart's,in,rstl_1832_0020.txt,txt_rstl
immediately incommoded or injured. These facts I have observed in the,in,rstl_1832_0017.txt,txt_rstl
afford many explanations of the facts detailed in the extraordinary works,in,rstl_1832_0016.txt,txt_rstl
"point out particularly hereafter. The facts in regard to the irritability,",in,rstl_1832_0016.txt,txt_rstl
Induction. 140. WHEN the general facts described in the former paper,in,rstl_1832_0007.txt,txt_rstl
"water (495.), already quoted, for facts illustrating these views in the",in,rstl_1833_0030.txt,txt_rstl
deprived of its encephalon. 'The facts are these: in the entire,in,rstl_1833_0028.txt,txt_rstl
affords evidence of many important facts in physiology. It proves that,in,rstl_1833_0028.txt,txt_rstl
altogether. * Having observed these facts in connexion with the reflex,in,rstl_1833_0028.txt,txt_rstl
"a totally new order of facts in pathology, and to lead",in,rstl_1833_0028.txt,txt_rstl
"qui nous Echappe #,” The facts which have been detailed in",in,rstl_1833_0028.txt,txt_rstl
&c. However some of the facts detailed in this paper may,in,rstl_1833_0028.txt,txt_rstl
"spinalis. In like manner, the facts relative to the irritability were",in,rstl_1833_0028.txt,txt_rstl
at variance with all the facts and experiments detailed in the,in,rstl_1833_0028.txt,txt_rstl
action in this order of facts has not been demonstrated to,in,rstl_1833_0028.txt,txt_rstl
and know of no recorded facts in which the influence of,in,rstl_1833_0016.txt,txt_rstl
a necessary inference from the facts stated in the last paper,in,rstl_1833_0009.txt,txt_rstl
stated or referred to the facts which prove that in all,in,rstl_1833_0009.txt,txt_rstl
is much less 80. The facts stated in the paper just,in,rstl_1833_0009.txt,txt_rstl
"in this function. Besides, the facts which have been laid before",in,rstl_1833_0009.txt,txt_rstl
the increasing affection * Such facts are adduced in the paper,in,rstl_1833_0009.txt,txt_rstl
"admitted, from the statement of facts made in the paper just",in,rstl_1833_0007.txt,txt_rstl
"in possession of no other facts on the subject, we should",in,rstl_1833_0007.txt,txt_rstl
have been limited to such facts as would assist in establishing,in,rstl_1834_0029.txt,txt_rstl
"in an easterly direction, are facts long known and commonly observed.",in,rstl_1834_0029.txt,txt_rstl
noticed. And there are certain facts which are hardly in accordance,in,rstl_1834_0027.txt,txt_rstl
little usefulness ; for what facts are there in favour of,in,rstl_1834_0027.txt,txt_rstl
"a closed membrane. From the facts given in the preceding tables,",in,rstl_1834_0026.txt,txt_rstl
by the majority of the facts adduced in this paper. The,in,rstl_1834_0026.txt,txt_rstl
anatomist to attempt demonstrating these facts in the recent brain ;,in,rstl_1834_0023.txt,txt_rstl
be new in physiology. The facts being only such as presented,in,rstl_1834_0020.txt,txt_rstl
"hitherto done, a class of facts essentially involved in the subject",in,rstl_1834_0016.txt,txt_rstl
to me that the various facts ascertained in the course of,in,rstl_1834_0012.txt,txt_rstl
current. As I want the facts in illustration of the distinction,in,rstl_1834_0008.txt,txt_rstl
there is an immensity of facts which justify us in believing,in,rstl_1834_0008.txt,txt_rstl
"subsequent, memoirs will prove. The facts connected with the metamorphosis in",in,rstl_1835_0023.txt,txt_rstl
"which, in addition to the facts adduced in his first memoir,",in,rstl_1835_0019.txt,txt_rstl
in as much as the facts subsequently stated respecting the ova,in,rstl_1835_0019.txt,txt_rstl
to refer to the conclusive facts subsequently stated in proof that,in,rstl_1835_0019.txt,txt_rstl
have noted in foreign countries facts similar to those which I,in,rstl_1835_0018.txt,txt_rstl
"may be inferred from seyeral facts mentioned in this memoir, that",in,rstl_1835_0002.txt,txt_rstl
the conclusions deducible from the facts and observations stated in the,in,rstl_1836_0025.txt,txt_rstl
susceptible. In accordance with these facts a per- fectly insulating disc,in,rstl_1836_0022.txt,txt_rstl
of five classes of geological facts already alluded to in the,in,rstl_1836_0028.txt,txt_rstl
"functions, as appears from the facts stated in a paper which",in,rstl_1836_0020.txt,txt_rstl
common. IT appears from the facts adduced in my paper on,in,rstl_1836_0020.txt,txt_rstl
any such agents. When the facts adduced in the paper just,in,rstl_1836_0020.txt,txt_rstl
"system, as appears from the facts stated in my paper on",in,rstl_1836_0020.txt,txt_rstl
"prevail in all*, From the facts just referred to we easily",in,rstl_1836_0020.txt,txt_rstl
"mervyeilleuse puissance,” If the preceding facts be kept in view, it",in,rstl_1836_0020.txt,txt_rstl
FROM the whole of the facts referred to in the preceding,in,rstl_1836_0020.txt,txt_rstl
"and (I believe, from the facts stated in the foregoing paper,",in,rstl_1836_0020.txt,txt_rstl
in possession of the leading facts appertaining to the influence of,in,rstl_1836_0015.txt,txt_rstl
"but it appears in the facts themselves. For instance, if we",in,rstl_1837_0016.txt,txt_rstl
a great number of curious facts in fluid motion are established,in,rstl_1837_0009.txt,txt_rstl
"with much less rapidity. These facts are shown in the observations,",in,rstl_1837_0019.txt,txt_rstl
"increased during respiration? With these facts in consideration, and looking at",in,rstl_1837_0019.txt,txt_rstl
peculiarly noted as cold-blooded. 'These facts con- * This is in,in,rstl_1837_0019.txt,txt_rstl
thirty-four beats per minute. These facts therefore are in accordance with,in,rstl_1837_0019.txt,txt_rstl
"in the same. With these facts before us, we are enabled",in,rstl_1838_0021.txt,txt_rstl
this opinion by the curious facts alluded to in \ 14.,in,rstl_1838_0019.txt,txt_rstl
"Vobservation++.” I trust that the facts mentioned in the preceding pages,",in,rstl_1838_0016.txt,txt_rstl
"I may add, that such facts tend in part to reconcile",in,rstl_1838_0015.txt,txt_rstl
being merely an expression of facts and truths in nature being,in,rstl_1838_0015.txt,txt_rstl
"I hope that, considering the facts and investigations contained in the",in,rstl_1838_0008.txt,txt_rstl
in accordance with Mr. Harris's facts and conclusions respecting the resistance,in,rstl_1838_0008.txt,txt_rstl
"I think, in contradiction with facts (511, &c.). It appears to",in,rstl_1838_0009.txt,txt_rstl
"the ac- cordance of known facts with it, but in the",in,rstl_1838_0002.txt,txt_rstl
of fluids. 13. Since these facts furnish some evidence in fayour,in,rstl_1839_0015.txt,txt_rstl
perfectly in accordance with the facts observed in the deviations and,in,rstl_1839_0014.txt,txt_rstl
physiology. That in the main facts I have not erred seems,in,rstl_1839_0021.txt,txt_rstl
this memoir; but from the facts recorded in it—and more particularly,in,rstl_1839_0021.txt,txt_rstl
recapitulation of sevyeral of the facts recorded in this memoir; viz.,in,rstl_1839_0021.txt,txt_rstl
"trace.” Now if, from the facts made known in the present",in,rstl_1839_0021.txt,txt_rstl
to a few of the facts recorded in the foregoing and,in,rstl_1839_0021.txt,txt_rstl
mentioned ; and if those facts should be found in any,in,rstl_1839_0021.txt,txt_rstl
"about 350 feet. Considering the facts given in this paper, it",in,rstl_1839_0005.txt,txt_rstl
view. It appears from the facts given by Mr. Lys in,in,rstl_1839_0005.txt,txt_rstl
may be inferred from the facts collected by Mr. Smrz in,in,rstl_1839_0005.txt,txt_rstl
"also be inferred, from the facts given in that paper, that",in,rstl_1839_0005.txt,txt_rstl
"June 4, 1840. Tre principal facts recorded in the following memoir",in,rstl_1840_0025.txt,txt_rstl
1 have now to record facts which in some of the,in,rstl_1840_0025.txt,txt_rstl
within the cylinder. But certain facts communicated in my Third Series,in,rstl_1840_0025.txt,txt_rstl
functions of those tissnes. 'The facts made known in the present,in,rstl_1840_0025.txt,txt_rstl
in these early papers. Those facts I am now desirous of,in,rstl_1840_0014.txt,txt_rstl
in the perception of experimental facts not wholly coinciding with Sir,in,rstl_1840_0013.txt,txt_rstl
"memoir in con- nexion with facts recorded in my Jast, it",in,rstl_1840_0024.txt,txt_rstl
"have now to state, that facts observed in the pre- sent",in,rstl_1840_0024.txt,txt_rstl
is a © eytoblast.” And facts made known in the foregoing,in,rstl_1840_0024.txt,txt_rstl
in the parent cell.” The facts recorded in the present memoir,in,rstl_1840_0024.txt,txt_rstl
"18, 1840. 431. Should the facts made known in the foregoing",in,rstl_1840_0024.txt,txt_rstl
it must be by the facts made known in this memoir—affects,in,rstl_1840_0024.txt,txt_rstl
"zealous in his production of facts and arguments, from the year",in,rstl_1840_0003.txt,txt_rstl
entering into detail and multiplying facts in a proportion far beyond,in,rstl_1840_0003.txt,txt_rstl
"in opposition to the foregoing facts and conclusions is, to say",in,rstl_1840_0003.txt,txt_rstl
"in conjunction with many preceding facts and arguments, to show that",in,rstl_1840_0004.txt,txt_rstl
"of M. Dacuerre's discovery. The facts themselves, in the present state",in,rstl_1840_0002.txt,txt_rstl
"time, a number of interesting facts have been en- countered in",in,rstl_1840_0002.txt,txt_rstl
"preceding remarks, combined with the facts and arguments advanced in my",in,rstl_1841_0009.txt,txt_rstl
On a review of the facts stated in the course of,in,rstl_1841_0018.txt,txt_rstl
granules of the yelk. The facts recorded in the foregoing memoir,in,rstl_1841_0018.txt,txt_rstl
"be naturally deduced from the facts demonstrated in the foregoing dissections,—",in,rstl_1841_0015.txt,txt_rstl
have added but few new facts in this department of my,in,rstl_1841_0015.txt,txt_rstl
entirely overlooked many most important facts in regard to the production,in,rstl_1841_0012.txt,txt_rstl
'The conclusions to which the facts detailed in this paper seem,in,rstl_1841_0012.txt,txt_rstl
entirely in accordance with the facts subse- quently ascertained respecting the,in,rstl_1841_0012.txt,txt_rstl
"the oyum. Moreover, the few facts detailed in this paper show",in,rstl_1841_0012.txt,txt_rstl
produce such division. 97. But facts recorded in several of my,in,rstl_1841_0019.txt,txt_rstl
as fibrous tissues. 174. Other facts observable in an examination of,in,rstl_1841_0019.txt,txt_rstl
I in pos- ses8ion of facts connected with the process of,in,rstl_1841_0019.txt,txt_rstl
was not aware of the facts stated in M. Du Buart's,in,rstl_1832_0020.txt,txt_rstl
immediately incommoded or injured. These facts I have observed in the,in,rstl_1832_0017.txt,txt_rstl
afford many explanations of the facts detailed in the extraordinary works,in,rstl_1832_0016.txt,txt_rstl
"point out particularly hereafter. The facts in regard to the irritability,",in,rstl_1832_0016.txt,txt_rstl
Induction. 140. WHEN the general facts described in the former paper,in,rstl_1832_0007.txt,txt_rstl
"water (495.), already quoted, for facts illustrating these views in the",in,rstl_1833_0030.txt,txt_rstl
deprived of its encephalon. 'The facts are these: in the entire,in,rstl_1833_0028.txt,txt_rstl
affords evidence of many important facts in physiology. It proves that,in,rstl_1833_0028.txt,txt_rstl
altogether. * Having observed these facts in connexion with the reflex,in,rstl_1833_0028.txt,txt_rstl
"a totally new order of facts in pathology, and to lead",in,rstl_1833_0028.txt,txt_rstl
"qui nous Echappe #,” The facts which have been detailed in",in,rstl_1833_0028.txt,txt_rstl
&c. However some of the facts detailed in this paper may,in,rstl_1833_0028.txt,txt_rstl
"spinalis. In like manner, the facts relative to the irritability were",in,rstl_1833_0028.txt,txt_rstl
at variance with all the facts and experiments detailed in the,in,rstl_1833_0028.txt,txt_rstl
action in this order of facts has not been demonstrated to,in,rstl_1833_0028.txt,txt_rstl
and know of no recorded facts in which the influence of,in,rstl_1833_0016.txt,txt_rstl
a necessary inference from the facts stated in the last paper,in,rstl_1833_0009.txt,txt_rstl
stated or referred to the facts which prove that in all,in,rstl_1833_0009.txt,txt_rstl
is much less 80. The facts stated in the paper just,in,rstl_1833_0009.txt,txt_rstl
"in this function. Besides, the facts which have been laid before",in,rstl_1833_0009.txt,txt_rstl
the increasing affection * Such facts are adduced in the paper,in,rstl_1833_0009.txt,txt_rstl
"admitted, from the statement of facts made in the paper just",in,rstl_1833_0007.txt,txt_rstl
"in possession of no other facts on the subject, we should",in,rstl_1833_0007.txt,txt_rstl
have been limited to such facts as would assist in establishing,in,rstl_1834_0029.txt,txt_rstl
"in an easterly direction, are facts long known and commonly observed.",in,rstl_1834_0029.txt,txt_rstl
noticed. And there are certain facts which are hardly in accordance,in,rstl_1834_0027.txt,txt_rstl
little usefulness ; for what facts are there in favour of,in,rstl_1834_0027.txt,txt_rstl
"a closed membrane. From the facts given in the preceding tables,",in,rstl_1834_0026.txt,txt_rstl
