Context,Word,File,Directory
however to some of the facts connected with observations at different,to,rstl_1845_0010.txt,txt_rstl
present to deduce from the facts which I have laid before,to,rstl_1845_0007.txt,txt_rstl
"general tenor of the preceding facts and observations, to maintain with",to,rstl_1845_0007.txt,txt_rstl
"great, addition made to the facts and considerations which tend to",to,rstl_1846_0001.txt,txt_rstl
acknow- ledge M. Becarzrr's important facts and labours in reference to,to,rstl_1846_0003.txt,txt_rstl
"equatorial position : and the facts with regard to bodies generally,",to,rstl_1846_0003.txt,txt_rstl
could be lowered sufficiently. The facts just described appear to me,to,rstl_1846_0004.txt,txt_rstl
"considerations. 2417. Such are the facts which, in addition to those",to,rstl_1846_0004.txt,txt_rstl
to the bearing of the facts I have now related on,to,rstl_1846_0005.txt,txt_rstl
"and the bearing of the facts now related, to dis- sent",to,rstl_1846_0025.txt,txt_rstl
reduced to the two following facts :— 1. 'The electric discharge,to,rstl_1846_0026.txt,txt_rstl
see the application of these facts to the vocal apparatus. We,to,rstl_1846_0028.txt,txt_rstl
to 089 inch. As the facts shown by these observations are,to,rstl_1846_0020.txt,txt_rstl
play of forces. The following facts appear to me quite conclu-,to,rstl_1846_0013.txt,txt_rstl
present ; the seemingly opposed facts showing the glacier to be,to,rstl_1846_0015.txt,txt_rstl
"are to investigations into the facts of terrestrial mag- netism, I",to,rstl_1846_0018.txt,txt_rstl
"a sulphate, &c. : the facts stated are suffi- cient to",to,rstl_1846_0012.txt,txt_rstl
"TI have, however, some other facts to mention which will demonstrate",to,rstl_1846_0012.txt,txt_rstl
am able to prove by facts of a very positive nature.,to,rstl_1847_0017.txt,txt_rstl
"as I do to the facts themselves, though I consider it",to,rstl_1847_0002.txt,txt_rstl
expression can be given to facts which does not involve some,to,rstl_1847_0002.txt,txt_rstl
"Although, as applied to the facts detailed, I attached no further",to,rstl_1847_0002.txt,txt_rstl
of a sufficient number of facts to decide on the direction,to,rstl_1847_0009.txt,txt_rstl
"the combustible gases, but the facts are far too few to",to,rstl_1847_0001.txt,txt_rstl
"probable, has by the same facts and arguments been proved to",to,rstl_1848_0019.txt,txt_rstl
"4, a.]* According to the facts at present known, the chambered",to,rstl_1848_0012.txt,txt_rstl
the erystalline mineral matter. The facts above described appear to me,to,rstl_1848_0012.txt,txt_rstl
combination with that substance. These facts led me to suspect that,to,rstl_1848_0010.txt,txt_rstl
very close approximation to the facts of nature. There is a,to,rstl_1848_0008.txt,txt_rstl
as to include the following facts of observation :— (1.) The,to,rstl_1848_0001.txt,txt_rstl
irregularity or complexity of the facts themselves. With regard to the,to,rstl_1848_0001.txt,txt_rstl
quoted. The following are the facts relative to the nervous supply,to,rstl_1849_0003.txt,txt_rstl
to ganoid seales.” The new facts brought forward by Professor Owex,to,rstl_1849_0023.txt,txt_rstl
hope and believe that the facts about to be brought forward,to,rstl_1849_0023.txt,txt_rstl
rule of never publishing any facts relating to electro-physiology without having,to,rstl_1850_0032.txt,txt_rstl
very desirable to test these facts by further experiments. (47.) The,to,rstl_1850_0035.txt,txt_rstl
and the accumulation of various facts relative to the existence of,to,rstl_1850_0037.txt,txt_rstl
he now proceeds to adduce facts which appear to him adequate,to,rstl_1850_0037.txt,txt_rstl
scarcely neces- sary to accumulate facts in support of a position,to,rstl_1850_0037.txt,txt_rstl
and may instance the following facts as examples. 1. According to,to,rstl_1850_0037.txt,txt_rstl
animals. A comparison of the facts relating to the geographical distribution,to,rstl_1850_0037.txt,txt_rstl
"afforded by the generally admitted facts of Physiological science*, than to",to,rstl_1850_0037.txt,txt_rstl
and to add the additional facts and illustrations of the peculiarities,to,rstl_1850_0025.txt,txt_rstl
intended to express concisely the facts described. With regard to the,to,rstl_1850_0019.txt,txt_rstl
"the palzeontologist, since the new facts herein described tend to remove",to,rstl_1850_0019.txt,txt_rstl
which it is a consequence. Facts corresponding to these cases of,to,rstl_1850_0038.txt,txt_rstl
"always present, being dissolved. These facts are contrary to the usual",to,rstl_1850_0038.txt,txt_rstl
"part, the absence of acknowledged facts relative to the strength and",to,rstl_1850_0036.txt,txt_rstl
this process. We possess no facts or experiments calculated to establisb,to,rstl_1850_0036.txt,txt_rstl
a striking coincidence in the facts tending to establish the principle,to,rstl_1850_0036.txt,txt_rstl
descriptions and figures of snch facts as will suffice to establish,to,rstl_1850_0017.txt,txt_rstl
to the optic lobes. These facts I think are of some,to,rstl_1850_0009.txt,txt_rstl
shall venture to state some facts in connection with this point,to,rstl_1850_0009.txt,txt_rstl
under a general view the facts acquired up to the moment,to,rstl_1850_0006.txt,txt_rstl
"vertex to coccyx, the same facts are as plainly observed =",to,rstl_1850_0007.txt,txt_rstl
"right auricle ; but the facts seem to bear another explanation,",to,rstl_1850_0007.txt,txt_rstl
to the determination of new facts and the enlargement of my,to,rstl_1850_0001.txt,txt_rstl
and 367 inches respectively. These facts suggest caution to all ob-,to,rstl_1850_0016.txt,txt_rstl
"enhances the value of any facts bearing on this obscure point,",on,rstl_1841_0009.txt,txt_rstl
On a review of the facts stated in the course of,on,rstl_1841_0018.txt,txt_rstl
remarks founded on the foregoing facts and speculations. 1. The bile,on,rstl_1842_0005.txt,txt_rstl
an investigator to record the facts he DR. MARTIN BARRY ON,on,rstl_1842_0008.txt,txt_rstl
upon the truth of the facts on which the doctrine of,on,rstl_1845_0007.txt,txt_rstl
to the bearing of the facts I have now related on,on,rstl_1846_0005.txt,txt_rstl
are at least founded on facts which are incontrovertibly established. DescRIPTION,on,rstl_1846_0028.txt,txt_rstl
The following are a few facts which I have collected on,on,rstl_1846_0013.txt,txt_rstl
"refresbing his memory. The real facts are, that on the 6th",on,rstl_1846_0008.txt,txt_rstl
of a certain number of facts lately discovered on the electricity,on,rstl_1847_0014.txt,txt_rstl
and Fovcavrr observed some remarkable facts of the same kind on,on,rstl_1847_0004.txt,txt_rstl
"of founding this opinion on facts of a different kind, I",on,rstl_1847_0004.txt,txt_rstl
of a sufficient number of facts to decide on the direction,on,rstl_1847_0009.txt,txt_rstl
and the bearing of the facts described on the still mooted,on,rstl_1848_0012.txt,txt_rstl
on looking however into such facts as I can gather which,on,rstl_1848_0011.txt,txt_rstl
"about three years ago. The facts previously on record, with few",on,rstl_1849_0017.txt,txt_rstl
terpretation of some of the facts described in the Memoir on,on,rstl_1850_0019.txt,txt_rstl
the purpose of collecting the facts on which are founded the,on,rstl_1850_0036.txt,txt_rstl
this conclusion : and the facts on which it was based,on,rstl_1850_0011.txt,txt_rstl
"enhances the value of any facts bearing on this obscure point,",of,rstl_1841_0009.txt,txt_rstl
corpuscles of the blood. Those facts were of a character which,of,rstl_1841_0018.txt,txt_rstl
On a review of the facts stated in the course of,of,rstl_1841_0018.txt,txt_rstl
granules of the yelk. The facts recorded in the foregoing memoir,of,rstl_1841_0018.txt,txt_rstl
have added but few new facts in this department of my,of,rstl_1841_0015.txt,txt_rstl
of the embryo that the facts ascertained appear to be of,of,rstl_1841_0012.txt,txt_rstl
have noticed the important additional facts of the detection of the,of,rstl_1841_0012.txt,txt_rstl
produce such division. 97. But facts recorded in several of my,of,rstl_1841_0019.txt,txt_rstl
as fibrous tissues. 174. Other facts observable in an examination of,of,rstl_1841_0019.txt,txt_rstl
"find that, while bringing forward facts opposed to the views of",of,rstl_1841_0019.txt,txt_rstl
I in pos- ses8ion of facts connected with the process of,of,rstl_1841_0019.txt,txt_rstl
higher tribes of animals. 'These facts I had the honour of,of,rstl_1842_0014.txt,txt_rstl
"protochloride of palladium developes some facts of considerable interest, It is",of,rstl_1842_0016.txt,txt_rstl
"of a Postscript, some additional facts illustrative of the singular properties",of,rstl_1842_0013.txt,txt_rstl
of Extinction. 84. Many familiar facts connected with the extinction of,of,rstl_1842_0015.txt,txt_rstl
"doubt, almost any series of facts might be re- presented, and",of,rstl_1842_0015.txt,txt_rstl
"whole, it appears from the facts and reasonings of this paper,",of,rstl_1842_0015.txt,txt_rstl
Insecta (a kind of Caterpillar). Facts observed in the Formation and,of,rstl_1842_0008.txt,txt_rstl
the same mode of origin. Facts observed in the Structure of,of,rstl_1842_0008.txt,txt_rstl
saw the objects in question. Facts observed in the Coagulation of,of,rstl_1842_0008.txt,txt_rstl
of the physical sciences the facts of observation and experiment have,of,rstl_1843_0014.txt,txt_rstl
relation is confirmed by the facts detailed in the paper of,of,rstl_1843_0009.txt,txt_rstl
the whole tenor of voltaic facts and general experience. Another point,of,rstl_1843_0009.txt,txt_rstl
"by publication some of the facts which I also have obtained,",of,rstl_1843_0004.txt,txt_rstl
"the attention of physiologists, certain facts appear, nevertheless, to have been",of,rstl_1843_0013.txt,txt_rstl
divisions of Myriapoda. These additional facts fully accord with the already,of,rstl_1843_0013.txt,txt_rstl
is however one of several facts which have presented themselves in,of,rstl_1843_0011.txt,txt_rstl
"the whole tenor of voltaic facts and genera] experience.” 24, I",of,rstl_1844_0003.txt,txt_rstl
we have before us certain facts connected with the action of,of,rstl_1844_0003.txt,txt_rstl
"of lead in Solution. These facts are well known, and prove",of,rstl_1844_0002.txt,txt_rstl
by an important class of facts which next fell under our,of,rstl_1844_0001.txt,txt_rstl
"exclusion of the anion. These facts are, we believe, irreconcilable with",of,rstl_1844_0001.txt,txt_rstl
place distinctly before our minds facts of which the explanation mnst,of,rstl_1844_0007.txt,txt_rstl
From the sum of these facts I am again forced to,of,rstl_1845_0012.txt,txt_rstl
of the happy temperate mean.:..Some facts which I sball have presently,of,rstl_1845_0014.txt,txt_rstl
"From the whole of these facts I was led to conclude,",of,rstl_1845_0013.txt,txt_rstl
at a knowledge of these facts I have repeated and varied,of,rstl_1845_0013.txt,txt_rstl
and the explanation of the facts is as follows :— Whatever,of,rstl_1845_0013.txt,txt_rstl
described a long series of facts relative to the cireumstances that,of,rstl_1845_0013.txt,txt_rstl
simplest interpretation of all the facts discovered by myself ; it,of,rstl_1845_0011.txt,txt_rstl
however to some of the facts connected with observations at different,of,rstl_1845_0010.txt,txt_rstl
easily accounted for by the facts already stated of irregular composition,of,rstl_1845_0006.txt,txt_rstl
upon the truth of the facts on which the doctrine of,of,rstl_1845_0007.txt,txt_rstl
of reconciling it with many facts or opinions that seemed current,of,rstl_1845_0007.txt,txt_rstl
"general tenor of the preceding facts and observations, to maintain with",of,rstl_1845_0007.txt,txt_rstl
"the development of the principal facts of diurnal tide. Finally, that",of,rstl_1845_0001.txt,txt_rstl
"formed :— From the ordinary facts of the tides, it seems",of,rstl_1845_0001.txt,txt_rstl
to the bearing of the facts I have now related on,of,rstl_1846_0005.txt,txt_rstl
"T have suggested of the facts described be '> correct, and",of,rstl_1846_0024.txt,txt_rstl
"and the bearing of the facts now related, to dis- sent",of,rstl_1846_0025.txt,txt_rstl
"say, the greatest number of facts possible from the smallest number",of,rstl_1846_0026.txt,txt_rstl
see the application of these facts to the vocal apparatus. We,of,rstl_1846_0028.txt,txt_rstl
collections of Ganglia.—From the foregoing facts it will appear that a,of,rstl_1846_0017.txt,txt_rstl
a correct statement of the facts *. My attention was at,of,rstl_1846_0013.txt,txt_rstl
play of forces. The following facts appear to me quite conclu-,of,rstl_1846_0013.txt,txt_rstl
"are to investigations into the facts of terrestrial mag- netism, I",of,rstl_1846_0018.txt,txt_rstl
of a certain number of facts lately discovered on the electricity,of,rstl_1847_0014.txt,txt_rstl
of expo- sition of the facts in this memoir will be,of,rstl_1847_0014.txt,txt_rstl
"Virginia, adding several other analogous facts confirming the theory of a",of,rstl_1847_0017.txt,txt_rstl
am able to prove by facts of a very positive nature.,of,rstl_1847_0017.txt,txt_rstl
fixation of mercurial vapour. The facts pointed out by M. Gavpin,of,rstl_1847_0017.txt,txt_rstl
be an extensive series of facts which afford Strong hope of,of,rstl_1847_0002.txt,txt_rstl
and Fovcavrr observed some remarkable facts of the same kind on,of,rstl_1847_0004.txt,txt_rstl
"of founding this opinion on facts of a different kind, I",of,rstl_1847_0004.txt,txt_rstl
of a sufficient number of facts to decide on the direction,of,rstl_1847_0009.txt,txt_rstl
lowing experiment containing the principal facts worthy of notice will be,of,rstl_1848_0017.txt,txt_rstl
and the bearing of the facts described on the still mooted,of,rstl_1848_0012.txt,txt_rstl
very close approximation to the facts of nature. There is a,of,rstl_1848_0008.txt,txt_rstl
exactly the reverse of the facts which take place at the,of,rstl_1848_0008.txt,txt_rstl
as to include the following facts of observation :— (1.) The,of,rstl_1848_0001.txt,txt_rstl
irregularity or complexity of the facts themselves. With regard to the,of,rstl_1848_0001.txt,txt_rstl
":—the collec- tion of the facts then known, given in the",of,rstl_1848_0001.txt,txt_rstl
pass through the tissue. These facts of course do away with,of,rstl_1849_0023.txt,txt_rstl
"and teeth of Macropoma. These facts (if correctly interpreted, and T",of,rstl_1849_0023.txt,txt_rstl
the true explanation of the facts which have been thus pointed,of,rstl_1849_0012.txt,txt_rstl
"been thus pointed out, the facts themselves are highly deserving of",of,rstl_1849_0012.txt,txt_rstl
rule of never publishing any facts relating to electro-physiology without having,of,rstl_1850_0032.txt,txt_rstl
which the accuracy of the facts stated in this paper are,of,rstl_1850_0027.txt,txt_rstl
and of theaccumn- lation. of facts which. more or less distinctly,of,rstl_1850_0037.txt,txt_rstl
and the accumulation of various facts relative to the existence of,of,rstl_1850_0037.txt,txt_rstl
of conducting electricity. All the facts which have been adduced in,of,rstl_1850_0037.txt,txt_rstl
adducing in support of it facts which are s0 well known,of,rstl_1850_0037.txt,txt_rstl
scarcely neces- sary to accumulate facts in support of a position,of,rstl_1850_0037.txt,txt_rstl
animals. A comparison of the facts relating to the geographical distribution,of,rstl_1850_0037.txt,txt_rstl
"is no less remarkable, The facts determined by the experiments of",of,rstl_1850_0037.txt,txt_rstl
"afforded by the generally admitted facts of Physiological science*, than to",of,rstl_1850_0037.txt,txt_rstl
and to add the additional facts and illustrations of the peculiarities,of,rstl_1850_0025.txt,txt_rstl
the ready comprehension of the facts which have been recorded by,of,rstl_1850_0025.txt,txt_rstl
means of them. Had those facts been explained by ineans of,of,rstl_1850_0025.txt,txt_rstl
terpretation of some of the facts described in the Memoir on,of,rstl_1850_0019.txt,txt_rstl
"is generically distinetf. From the facts before us, our knowledge of",of,rstl_1850_0019.txt,txt_rstl
condition. There are even well-known facts of great importance in this,of,rstl_1850_0038.txt,txt_rstl
which it is a consequence. Facts corresponding to these cases of,of,rstl_1850_0038.txt,txt_rstl
the scientific conception of these facts from the electro- chemical point,of,rstl_1850_0038.txt,txt_rstl
supplies an explanation of these facts at once adequate and imple;,of,rstl_1850_0038.txt,txt_rstl
theory of this action. The facts I have just mentioned gave,of,rstl_1850_0038.txt,txt_rstl
"part, the absence of acknowledged facts relative to the strength and",of,rstl_1850_0036.txt,txt_rstl
the purpose of collecting the facts on which are founded the,of,rstl_1850_0036.txt,txt_rstl
of the plates. From these facts I would infer that single,of,rstl_1850_0036.txt,txt_rstl
IV. we have some curious facts illustrative of the necessity and,of,rstl_1850_0036.txt,txt_rstl
"of the bars. These interesting facts are of considerable value, as",of,rstl_1850_0036.txt,txt_rstl
descriptions and figures of snch facts as will suffice to establish,of,rstl_1850_0017.txt,txt_rstl
to the optic lobes. These facts I think are of some,of,rstl_1850_0009.txt,txt_rstl
from the great mass of facts which have now been collected,of,rstl_1850_0010.txt,txt_rstl
assist the recollection of the facts regarding the annual variation of,of,rstl_1850_0010.txt,txt_rstl
form of heat: from these facts I considered myself justified in,of,rstl_1850_0004.txt,txt_rstl
a synopsis of all the facts supporting the view of BerzerLws.,of,rstl_1850_0006.txt,txt_rstl
"as it did, upon the facts observed in the formation of",of,rstl_1850_0006.txt,txt_rstl
desirable the acquisition of additional facts in support of the position,of,rstl_1850_0006.txt,txt_rstl
"have their foundation possibly in facts of this kind, 8. Diffusion",of,rstl_1850_0001.txt,txt_rstl
to the determination of new facts and the enlargement of my,of,rstl_1850_0001.txt,txt_rstl
the 21st of May. These facts Dr. Butsr recorded in a,of,rstl_1850_0016.txt,txt_rstl
"observations being a record of facts only without deductions or comment,",of,rstl_1850_0016.txt,txt_rstl
corrections. The whole of the facts connected with the meteorology of,of,rstl_1850_0016.txt,txt_rstl
"enhances the value of any facts bearing on this obscure point,",of,rstl_1841_0009.txt,txt_rstl
corpuscles of the blood. Those facts were of a character which,of,rstl_1841_0018.txt,txt_rstl
On a review of the facts stated in the course of,of,rstl_1841_0018.txt,txt_rstl
granules of the yelk. The facts recorded in the foregoing memoir,of,rstl_1841_0018.txt,txt_rstl
have added but few new facts in this department of my,of,rstl_1841_0015.txt,txt_rstl
of the embryo that the facts ascertained appear to be of,of,rstl_1841_0012.txt,txt_rstl
have noticed the important additional facts of the detection of the,of,rstl_1841_0012.txt,txt_rstl
produce such division. 97. But facts recorded in several of my,of,rstl_1841_0019.txt,txt_rstl
as fibrous tissues. 174. Other facts observable in an examination of,of,rstl_1841_0019.txt,txt_rstl
"find that, while bringing forward facts opposed to the views of",of,rstl_1841_0019.txt,txt_rstl
I in pos- ses8ion of facts connected with the process of,of,rstl_1841_0019.txt,txt_rstl
higher tribes of animals. 'These facts I had the honour of,of,rstl_1842_0014.txt,txt_rstl
"protochloride of palladium developes some facts of considerable interest, It is",of,rstl_1842_0016.txt,txt_rstl
"of a Postscript, some additional facts illustrative of the singular properties",of,rstl_1842_0013.txt,txt_rstl
of Extinction. 84. Many familiar facts connected with the extinction of,of,rstl_1842_0015.txt,txt_rstl
"doubt, almost any series of facts might be re- presented, and",of,rstl_1842_0015.txt,txt_rstl
"whole, it appears from the facts and reasonings of this paper,",of,rstl_1842_0015.txt,txt_rstl
Insecta (a kind of Caterpillar). Facts observed in the Formation and,of,rstl_1842_0008.txt,txt_rstl
the same mode of origin. Facts observed in the Structure of,of,rstl_1842_0008.txt,txt_rstl
saw the objects in question. Facts observed in the Coagulation of,of,rstl_1842_0008.txt,txt_rstl
of the physical sciences the facts of observation and experiment have,of,rstl_1843_0014.txt,txt_rstl
relation is confirmed by the facts detailed in the paper of,of,rstl_1843_0009.txt,txt_rstl
the whole tenor of voltaic facts and general experience. Another point,of,rstl_1843_0009.txt,txt_rstl
"by publication some of the facts which I also have obtained,",of,rstl_1843_0004.txt,txt_rstl
"the attention of physiologists, certain facts appear, nevertheless, to have been",of,rstl_1843_0013.txt,txt_rstl
divisions of Myriapoda. These additional facts fully accord with the already,of,rstl_1843_0013.txt,txt_rstl
is however one of several facts which have presented themselves in,of,rstl_1843_0011.txt,txt_rstl
"the whole tenor of voltaic facts and genera] experience.” 24, I",of,rstl_1844_0003.txt,txt_rstl
we have before us certain facts connected with the action of,of,rstl_1844_0003.txt,txt_rstl
"of lead in Solution. These facts are well known, and prove",of,rstl_1844_0002.txt,txt_rstl
by an important class of facts which next fell under our,of,rstl_1844_0001.txt,txt_rstl
"exclusion of the anion. These facts are, we believe, irreconcilable with",of,rstl_1844_0001.txt,txt_rstl
place distinctly before our minds facts of which the explanation mnst,of,rstl_1844_0007.txt,txt_rstl
From the sum of these facts I am again forced to,of,rstl_1845_0012.txt,txt_rstl
of the happy temperate mean.:..Some facts which I sball have presently,of,rstl_1845_0014.txt,txt_rstl
"From the whole of these facts I was led to conclude,",of,rstl_1845_0013.txt,txt_rstl
at a knowledge of these facts I have repeated and varied,of,rstl_1845_0013.txt,txt_rstl
and the explanation of the facts is as follows :— Whatever,of,rstl_1845_0013.txt,txt_rstl
described a long series of facts relative to the cireumstances that,of,rstl_1845_0013.txt,txt_rstl
simplest interpretation of all the facts discovered by myself ; it,of,rstl_1845_0011.txt,txt_rstl
however to some of the facts connected with observations at different,of,rstl_1845_0010.txt,txt_rstl
easily accounted for by the facts already stated of irregular composition,of,rstl_1845_0006.txt,txt_rstl
upon the truth of the facts on which the doctrine of,of,rstl_1845_0007.txt,txt_rstl
of reconciling it with many facts or opinions that seemed current,of,rstl_1845_0007.txt,txt_rstl
"general tenor of the preceding facts and observations, to maintain with",of,rstl_1845_0007.txt,txt_rstl
"the development of the principal facts of diurnal tide. Finally, that",of,rstl_1845_0001.txt,txt_rstl
"formed :— From the ordinary facts of the tides, it seems",of,rstl_1845_0001.txt,txt_rstl
to the bearing of the facts I have now related on,of,rstl_1846_0005.txt,txt_rstl
"T have suggested of the facts described be '> correct, and",of,rstl_1846_0024.txt,txt_rstl
"and the bearing of the facts now related, to dis- sent",of,rstl_1846_0025.txt,txt_rstl
"say, the greatest number of facts possible from the smallest number",of,rstl_1846_0026.txt,txt_rstl
see the application of these facts to the vocal apparatus. We,of,rstl_1846_0028.txt,txt_rstl
collections of Ganglia.—From the foregoing facts it will appear that a,of,rstl_1846_0017.txt,txt_rstl
a correct statement of the facts *. My attention was at,of,rstl_1846_0013.txt,txt_rstl
play of forces. The following facts appear to me quite conclu-,of,rstl_1846_0013.txt,txt_rstl
"are to investigations into the facts of terrestrial mag- netism, I",of,rstl_1846_0018.txt,txt_rstl
of a certain number of facts lately discovered on the electricity,of,rstl_1847_0014.txt,txt_rstl
of expo- sition of the facts in this memoir will be,of,rstl_1847_0014.txt,txt_rstl
"Virginia, adding several other analogous facts confirming the theory of a",of,rstl_1847_0017.txt,txt_rstl
am able to prove by facts of a very positive nature.,of,rstl_1847_0017.txt,txt_rstl
fixation of mercurial vapour. The facts pointed out by M. Gavpin,of,rstl_1847_0017.txt,txt_rstl
be an extensive series of facts which afford Strong hope of,of,rstl_1847_0002.txt,txt_rstl
and Fovcavrr observed some remarkable facts of the same kind on,of,rstl_1847_0004.txt,txt_rstl
"of founding this opinion on facts of a different kind, I",of,rstl_1847_0004.txt,txt_rstl
of a sufficient number of facts to decide on the direction,of,rstl_1847_0009.txt,txt_rstl
lowing experiment containing the principal facts worthy of notice will be,of,rstl_1848_0017.txt,txt_rstl
and the bearing of the facts described on the still mooted,of,rstl_1848_0012.txt,txt_rstl
very close approximation to the facts of nature. There is a,of,rstl_1848_0008.txt,txt_rstl
exactly the reverse of the facts which take place at the,of,rstl_1848_0008.txt,txt_rstl
as to include the following facts of observation :— (1.) The,of,rstl_1848_0001.txt,txt_rstl
irregularity or complexity of the facts themselves. With regard to the,of,rstl_1848_0001.txt,txt_rstl
":—the collec- tion of the facts then known, given in the",of,rstl_1848_0001.txt,txt_rstl
pass through the tissue. These facts of course do away with,of,rstl_1849_0023.txt,txt_rstl
"and teeth of Macropoma. These facts (if correctly interpreted, and T",of,rstl_1849_0023.txt,txt_rstl
the true explanation of the facts which have been thus pointed,of,rstl_1849_0012.txt,txt_rstl
"been thus pointed out, the facts themselves are highly deserving of",of,rstl_1849_0012.txt,txt_rstl
rule of never publishing any facts relating to electro-physiology without having,of,rstl_1850_0032.txt,txt_rstl
which the accuracy of the facts stated in this paper are,of,rstl_1850_0027.txt,txt_rstl
and of theaccumn- lation. of facts which. more or less distinctly,of,rstl_1850_0037.txt,txt_rstl
and the accumulation of various facts relative to the existence of,of,rstl_1850_0037.txt,txt_rstl
