Context,Word,File,Directory
based on a number of facts concerning the relations of the,the,rstb_1926_0009.txt,txt_rstb
the light of these new facts shows that very probably the,the,rstb_1927_0004.txt,txt_rstb
(1907-09). ‘A Study of some Facts and Theories bearing upon the,the,rstb_1927_0005.txt,txt_rstb
"present in Lophius. From the facts at our disposal it seems,",the,rstb_1927_0001.txt,txt_rstb
"researches, the whole of the facts set forth above, I think",the,rstb_1927_0001.txt,txt_rstb
"one can judge from the facts ascertained, there are in Lophius",the,rstb_1927_0001.txt,txt_rstb
cells of Type II. These facts demonstrate that the function of,the,rstb_1927_0008.txt,txt_rstb
"never been confirmed, and the facts put forward earlier in this",the,rstb_1927_0008.txt,txt_rstb
those of extrinsic fibres. The facts that the neurones of Type,the,rstb_1927_0008.txt,txt_rstb
in the some of the facts mentioned in this Section. ‘,the,rstb_1927_0002.txt,txt_rstb
to add anything to the facts already published ; the length,the,rstb_1927_0002.txt,txt_rstb
as only approximations to the facts of geographical distribution. Thus a,the,rstb_1927_0002.txt,txt_rstb
use being made of the facts that the law of energy,the,rsta_1927_0002.txt,txt_rsta
these air-breathing fishes the following facts should be carefully noticed :—,the,rstb_1928_0003.txt,txt_rstb
"appear then from, the observed facts that the frequency gradient associated",the,rstb_1928_0001.txt,txt_rstb
negative or positive correlation. The facts that plants of moist habitats,the,rstb_1928_0001.txt,txt_rstb
intrasclerotomic (= intervertebral) position. These facts explain the paired character of,the,rstb_1928_0006.txt,txt_rstb
"conclusion, then, to which the facts seem to point is that",the,rstb_1928_0002.txt,txt_rstb
can be placed on the facts in Hemimysis. ‘The anus pushes,the,rstb_1928_0008.txt,txt_rstb
using an index law. These facts illustrate the great importance of,the,rsta_1928_0009.txt,txt_rsta
"proportions is given below, the facts being recorded for convenience in",the,rsta_1928_0007.txt,txt_rsta
changed by 0-6 u. The facts appeared to point to some,the,rsta_1928_0007.txt,txt_rsta
secondary positive pulse. Thus the facts that the portion of curve,the,rsta_1928_0002.txt,txt_rsta
"no doubt was erect. ‘The facts suggested, at the time, the",the,rstb_1929_0001.txt,txt_rstb
the parent stem. ‘These are facts of importance in a reconstruction,the,rstb_1929_0001.txt,txt_rstb
the foliage. But with the facts at our disposal it is,the,rstb_1929_0001.txt,txt_rstb
"axis. But now that the facts are known, a symmetrical disposition",the,rstb_1929_0001.txt,txt_rstb
"the older petioles. Viewing the facts as they are, and they",the,rstb_1929_0001.txt,txt_rstb
cells as in Clepsydropsis. These facts suggest that the organ may,the,rstb_1929_0001.txt,txt_rstb
question of specific identity the facts do not seem to conflict,the,rstb_1929_0001.txt,txt_rstb
—One of the most interesting facts about C. australis is its,the,rstb_1929_0001.txt,txt_rstb
Linkage of Chromosomes. Several notable facts regarding the pairing and linkage,the,rstb_1929_0007.txt,txt_rstb
"efferent component vessels. From the facts observed in Lophius, I put",the,rstb_1929_0006.txt,txt_rstb
"first place, to confirm the facts recorded in Lophius in some",the,rstb_1929_0006.txt,txt_rstb
on all fours with the facts observed in greater detail in,the,rstb_1929_0006.txt,txt_rstb
Vessel System. With only the facts furnished by my investigation of,the,rstb_1929_0006.txt,txt_rstb
again less in quantity. These facts point to the conclusion that,the,rstb_1929_0006.txt,txt_rstb
"This seems likely from the facts observed in the Cod, and",the,rstb_1929_0006.txt,txt_rstb
"origin and morphological status. The facts so far ascertained show clearly,",the,rstb_1929_0006.txt,txt_rstb
"anatomy and embryology, but the facts : regarding them set forth",the,rstb_1929_0006.txt,txt_rstb
"think, at variance with the facts revealed by comparative anatomy and",the,rstb_1929_0006.txt,txt_rstb
"in structure and contents. The facts of comparative anatomy, as may",the,rstb_1929_0006.txt,txt_rstb
"some extent suggested by the facts of embryology. It is, of",the,rstb_1929_0006.txt,txt_rstb
"the embryo, and also the facts shown by a comparative study",the,rstb_1929_0006.txt,txt_rstb
If Sapm’s interpretation of the facts of the early ontogeny are,the,rstb_1929_0006.txt,txt_rstb
"I am assuming from the facts observed in Teleosteans, the lymphatic",the,rstb_1929_0006.txt,txt_rstb
"class Echinoidea, some of the facts brought forward in the papers",the,rstb_1929_0005.txt,txt_rstb
the Spatangoids. Two embryo- logical facts seem to be in keeping,the,rstb_1929_0005.txt,txt_rstb
plate is formed- 8 ‘These facts led Gaver to the conclusion,the,rstb_1929_0009.txt,txt_rstb
Gaupp’s theory would fit the facts provided that a satisfactory explanation,the,rstb_1929_0009.txt,txt_rstb
"chance to give the old facts new relation- ships. This monograph,",the,rstb_1929_0004.txt,txt_rstb
"is generally conceded, then the facts presented might hint that the",the,rstb_1929_0004.txt,txt_rstb
A STELLAR ATMOSPHERE. The observed facts are that hydrogen shows a,the,rsta_1929_0010.txt,txt_rsta
"fully-viewed atoms, then the observed facts correspond to a kind of",the,rsta_1929_0010.txt,txt_rsta
"$’,4 and Q. From these facts we deduce the follow- ing:",the,rsta_1929_0008.txt,txt_rsta
ay ‘Making use of these facts we see that the variable,the,rsta_1929_0002.txt,txt_rsta
the result does not represent facts when weak fields are employed.,the,rsta_1929_0002.txt,txt_rsta
282 / 218 When these facts had been ascertained the obvious,the,rstb_1920_0003.txt,txt_rstb
effect will be equalised. The facts relating to the epidemic of,the,rstb_1920_0003.txt,txt_rstb
may afford against another. The facts seem to indicate that this,the,rstb_1920_0003.txt,txt_rstb
may be answered that the facts are confined to the diagnoses,the,rstb_1920_0004.txt,txt_rstb
"in the Cretaceous Cheilostomes, the facts are as follows. The skeletal",the,rstb_1920_0004.txt,txt_rstb
(39) made out some further facts about the ribs and lower,the,rstb_1920_0001.txt,txt_rstb
allows me to add some facts to those previously recorded. The,the,rstb_1920_0001.txt,txt_rstb
"Cyclotosaurus in which genus the facts are not known, they do",the,rstb_1920_0001.txt,txt_rstb
is indicated by the following facts :— 1. That a single,the,rstb_1920_0001.txt,txt_rstb
"Eryops, so far as the facts are shown. Laceocephalus is intermediate",the,rstb_1920_0001.txt,txt_rstb
"a detailed description of the facts in Amblystoma, has recently been",the,rstb_1920_0001.txt,txt_rstb
"many, and probably more. The facts recorded above suggest that the",the,rstb_1920_0001.txt,txt_rstb
"advanced to account for the facts observed. A provisional hypothesis, based",the,rstb_1920_0002.txt,txt_rstb
to the nutrition they receive—the facts are indeed to the contrary.,the,rstb_1920_0002.txt,txt_rstb
equally in accordance with the facts that are at present available.,the,rstb_1920_0002.txt,txt_rstb
parasitaire ” explain the observed facts of the phenomenon. The Mendelian,the,rstb_1920_0002.txt,txt_rstb
it is believed that the facts already known are here first,the,rstb_1920_0010.txt,txt_rstb
to bring out the morphogenetic facts clearly. Whether this was due,the,rstb_1920_0010.txt,txt_rstb
less in accord with observed facts than the one indicated above.,the,rstb_1920_0010.txt,txt_rstb
"the foregoing considerations, and of facts that will appear during 422",the,rstb_1920_0010.txt,txt_rstb
"can be ascertained from the facts of geological distribution, the Pygasteridze",the,rstb_1920_0010.txt,txt_rstb
"possible, in the light of facts and morphogenetic tendencies as yet",the,rstb_1920_0010.txt,txt_rstb
Such a representation of the facts has led to the recognition,the,rsta_1920_0008.txt,txt_rsta
in indirect deduction from experimental facts which record the change of,the,rsta_1920_0008.txt,txt_rsta
clean plane of cleavage. “These facts are suggestive. The crystals here,the,rsta_1920_0008.txt,txt_rsta
further research of the new facts brought to light in the,the,rsta_1920_0010.txt,txt_rsta
the power of the new facts to guide a search even,the,rsta_1920_0010.txt,txt_rsta
of work obtained increases. These facts confirm the theory discussed in,the,rstb_1921_0005.txt,txt_rstb
"has been possible, from the facts for wood, to frame a",the,rstb_1921_0002.txt,txt_rstb
to attempt to relate the facts of the mechanical properties of,the,rstb_1921_0002.txt,txt_rstb
Woop Towarps Potarisep Lica. The facts regarding the nature of the,the,rstb_1921_0002.txt,txt_rstb
"part of the specimen. The facts for Ash and for Spruce,",the,rstb_1921_0002.txt,txt_rstb
"(Plate 4, fig. 16), The facts for the tension failures of",the,rstb_1921_0002.txt,txt_rstb
"use, to some extent, the facts described above in support of",the,rstb_1921_0002.txt,txt_rstb
in general agreement with the facts derived from the microscopic appearances,the,rstb_1921_0002.txt,txt_rstb
conception necessary to explain the facts described above for wood. It,the,rstb_1921_0002.txt,txt_rstb
almost solely in relation to facts derived from the study of,the,rstb_1921_0002.txt,txt_rstb
"its point of origin. Certain facts relevant to the foregoing must,",the,rstb_1921_0003.txt,txt_rstb
of Recorded Mutations. The essential facts in the preceding pages may,the,rstb_1921_0003.txt,txt_rstb
Such a hypothesis fits the facts and explains them as I,the,rstb_1921_0003.txt,txt_rstb
"it now stands. As the facts present themselves to me, avenues",the,rstb_1921_0003.txt,txt_rstb
to the oxygen consumed. The facts seem to us capable of,the,rstb_1921_0001.txt,txt_rstb
to the same conclusion. These facts about Podocarpus are not here,the,rstb_1921_0007.txt,txt_rstb
": in the light of facts which have since been observed,",the,rstb_1921_0007.txt,txt_rstb
"the Abietinem. | However, the facts at our disposal do not",the,rstb_1921_0007.txt,txt_rstb
after Porrer’s publication appeared few facts were added to the existing,the,rstb_1921_0009.txt,txt_rstb
"series was not accessible. The facts as here elucidated are, however,",the,rstb_1921_0008.txt,txt_rstb
in expressing and co-ordinating the facts in a scheme that adequately,the,rstb_1921_0008.txt,txt_rstb
"drawn in illustration of the facts observed are treated rather diagrammatically,",the,rstb_1921_0008.txt,txt_rstb
"various angles, and the observed facts are compared with what would",the,rsta_1921_0011.txt,txt_rsta
§ 4.3 below. The above facts indicate the lines on which,the,rsta_1921_0010.txt,txt_rsta
Since the number of independent facts supplied in 2x 2 312,the,rsta_1922_0009.txt,txt_rsta
"greater than the number of facts sought, much of the information",the,rsta_1922_0009.txt,txt_rsta
"close, having regard to the facts that (i.) the linear law",the,rsta_1922_0008.txt,txt_rsta
"OF There are therefore two facts to explain. First, the existence",the,rsta_1922_0004.txt,txt_rsta
"larvee. There were, however, several facts which spoke against the theory",the,rstb_1923_0004.txt,txt_rstb
"stages, when the paucity of facts gives freer play to the",the,rstb_1923_0004.txt,txt_rstb
"eel, as indicated by the facts now ascertained. During the autumn",the,rstb_1923_0004.txt,txt_rstb
theory will best describe the facts ? With regard to the,the,rstb_1923_0002.txt,txt_rstb
and in its absence. The facts are the direct converse of,the,rstb_1923_0006.txt,txt_rstb
"to experimental error, the main facts stand out: (1) that there",the,rstb_1923_0008.txt,txt_rstb
Blood at Rest. Whilst the facts given above are a mere,the,rstb_1923_0008.txt,txt_rstb
pointed out that the observed facts might be met on the,the,rstb_1923_0008.txt,txt_rstb
to put upon the above facts seems to be the following,the,rstb_1923_0008.txt,txt_rstb
such general accordance with the facts should have sprung to birth,the,rsta_1923_0006.txt,txt_rsta
"qualitative descrip- tion of the facts observed. When, however, the observations",the,rsta_1923_0003.txt,txt_rsta
celluloid will account for the facts observed. This heterogeneity may be,the,rsta_1923_0003.txt,txt_rsta
we cannot account for the facts observed on this theory if,the,rsta_1923_0003.txt,txt_rsta
the load is decreased. These facts have an important bearing on,the,rsta_1923_0003.txt,txt_rsta
at above. From all these facts the conclusion may be drawn,the,rsta_1923_0004.txt,txt_rsta
of temperature. Hence the preceding facts may be summarised as follows:,the,rsta_1923_0004.txt,txt_rsta
just described establish the following facts :— 1. That the specialised,the,rstb_1924_0001.txt,txt_rstb
"of Trachinus draco, establishes the facts that the venom is both",the,rstb_1924_0001.txt,txt_rstb
same nature occur. All these facts lead up to the inevitable,the,rstb_1924_0004.txt,txt_rstb
"liane stem structure, then other facts support the hypothesis that the",the,rstb_1924_0004.txt,txt_rstb
"the main xylem ring), other facts have come to light which",the,rstb_1924_0004.txt,txt_rstb
arisen by mutation. From the facts which research upon isolated stocks,the,rstb_1924_0005.txt,txt_rstb
"is concerned, With the main facts in hand, it appears that",the,rstb_1924_0005.txt,txt_rstb
"is evident that, if the facts are as I have stated",the,rstb_1924_0007.txt,txt_rstb
purely anatomical character of the facts upon which they are based.,the,rstb_1924_0007.txt,txt_rstb
"origin and distribution, . These facts suggest that the * It",the,rstb_1924_0008.txt,txt_rstb
"with the pars superior. These facts are not revealed, however, by",the,rstb_1924_0008.txt,txt_rstb
"theory embracing all the known facts exists at present. Thus, though",the,rsta_1924_0001.txt,txt_rsta
of Asterorylon and Lycopodium. The facts before us appear fully to,the,rstb_1925_0004.txt,txt_rstb
In view of the foregoing facts it would seem worth while,the,rstb_1925_0003.txt,txt_rstb
lies not only in the facts that for a fine division,the,rstb_1925_0003.txt,txt_rstb
facilitated by the body of facts expressed in these curves. Previous,the,rstb_1925_0003.txt,txt_rstb
"is capable of representing the facts with considerable precision, more closely",the,rstb_1925_0002.txt,txt_rstb
be drawn from the observed facts of variation. The answer is,the,rstb_1925_0002.txt,txt_rstb
"slightly closer representation of the facts ; at all events, a",the,rstb_1925_0002.txt,txt_rstb
but when taken with the facts of association they justify us,the,rstb_1925_0006.txt,txt_rstb
"So far as the available facts go, it is not impossible",the,rstb_1925_0006.txt,txt_rstb
of the micropylar tube. Such facts seem to point rather to,the,rstb_1925_0006.txt,txt_rstb
"instructive section, of which the facts recorded in our note books",the,rstb_1925_0005.txt,txt_rstb
"is indicated by the following facts :— First, the nearest Silurian",the,rstb_1925_0005.txt,txt_rstb
also remark that the essential facts shown in the section of,the,rstb_1925_0005.txt,txt_rstb
beyond Indo-China. 'The essential major facts in the structure of eastern,the,rstb_1925_0005.txt,txt_rstb
by anyone not knowing the facts already disclosed in con- nection,the,rstb_1926_0003.txt,txt_rstb
"canals, and also of the facts stated as to the evolutionary",the,rstb_1926_0003.txt,txt_rstb
very many new and striking facts to our knowledge of the,the,rstb_1926_0006.txt,txt_rstb
based on a number of facts concerning the relations of the,the,rstb_1926_0009.txt,txt_rstb
the light of these new facts shows that very probably the,the,rstb_1927_0004.txt,txt_rstb
(1907-09). ‘A Study of some Facts and Theories bearing upon the,the,rstb_1927_0005.txt,txt_rstb
"present in Lophius. From the facts at our disposal it seems,",the,rstb_1927_0001.txt,txt_rstb
"researches, the whole of the facts set forth above, I think",the,rstb_1927_0001.txt,txt_rstb
"one can judge from the facts ascertained, there are in Lophius",the,rstb_1927_0001.txt,txt_rstb
cells of Type II. These facts demonstrate that the function of,the,rstb_1927_0008.txt,txt_rstb
"never been confirmed, and the facts put forward earlier in this",the,rstb_1927_0008.txt,txt_rstb
those of extrinsic fibres. The facts that the neurones of Type,the,rstb_1927_0008.txt,txt_rstb
in the some of the facts mentioned in this Section. ‘,the,rstb_1927_0002.txt,txt_rstb
to add anything to the facts already published ; the length,the,rstb_1927_0002.txt,txt_rstb
as only approximations to the facts of geographical distribution. Thus a,the,rstb_1927_0002.txt,txt_rstb
use being made of the facts that the law of energy,the,rsta_1927_0002.txt,txt_rsta
these air-breathing fishes the following facts should be carefully noticed :—,the,rstb_1928_0003.txt,txt_rstb
"appear then from, the observed facts that the frequency gradient associated",the,rstb_1928_0001.txt,txt_rstb
negative or positive correlation. The facts that plants of moist habitats,the,rstb_1928_0001.txt,txt_rstb
intrasclerotomic (= intervertebral) position. These facts explain the paired character of,the,rstb_1928_0006.txt,txt_rstb
"conclusion, then, to which the facts seem to point is that",the,rstb_1928_0002.txt,txt_rstb
can be placed on the facts in Hemimysis. ‘The anus pushes,the,rstb_1928_0008.txt,txt_rstb
using an index law. These facts illustrate the great importance of,the,rsta_1928_0009.txt,txt_rsta
"proportions is given below, the facts being recorded for convenience in",the,rsta_1928_0007.txt,txt_rsta
changed by 0-6 u. The facts appeared to point to some,the,rsta_1928_0007.txt,txt_rsta
secondary positive pulse. Thus the facts that the portion of curve,the,rsta_1928_0002.txt,txt_rsta
"no doubt was erect. ‘The facts suggested, at the time, the",the,rstb_1929_0001.txt,txt_rstb
the parent stem. ‘These are facts of importance in a reconstruction,the,rstb_1929_0001.txt,txt_rstb
the foliage. But with the facts at our disposal it is,the,rstb_1929_0001.txt,txt_rstb
"axis. But now that the facts are known, a symmetrical disposition",the,rstb_1929_0001.txt,txt_rstb
"the older petioles. Viewing the facts as they are, and they",the,rstb_1929_0001.txt,txt_rstb
cells as in Clepsydropsis. These facts suggest that the organ may,the,rstb_1929_0001.txt,txt_rstb
question of specific identity the facts do not seem to conflict,the,rstb_1929_0001.txt,txt_rstb
—One of the most interesting facts about C. australis is its,the,rstb_1929_0001.txt,txt_rstb
Linkage of Chromosomes. Several notable facts regarding the pairing and linkage,the,rstb_1929_0007.txt,txt_rstb
"efferent component vessels. From the facts observed in Lophius, I put",the,rstb_1929_0006.txt,txt_rstb
"first place, to confirm the facts recorded in Lophius in some",the,rstb_1929_0006.txt,txt_rstb
on all fours with the facts observed in greater detail in,the,rstb_1929_0006.txt,txt_rstb
Vessel System. With only the facts furnished by my investigation of,the,rstb_1929_0006.txt,txt_rstb
again less in quantity. These facts point to the conclusion that,the,rstb_1929_0006.txt,txt_rstb
"This seems likely from the facts observed in the Cod, and",the,rstb_1929_0006.txt,txt_rstb
"origin and morphological status. The facts so far ascertained show clearly,",the,rstb_1929_0006.txt,txt_rstb
"anatomy and embryology, but the facts : regarding them set forth",the,rstb_1929_0006.txt,txt_rstb
"think, at variance with the facts revealed by comparative anatomy and",the,rstb_1929_0006.txt,txt_rstb
"in structure and contents. The facts of comparative anatomy, as may",the,rstb_1929_0006.txt,txt_rstb
"some extent suggested by the facts of embryology. It is, of",the,rstb_1929_0006.txt,txt_rstb
"the embryo, and also the facts shown by a comparative study",the,rstb_1929_0006.txt,txt_rstb
If Sapm’s interpretation of the facts of the early ontogeny are,the,rstb_1929_0006.txt,txt_rstb
"I am assuming from the facts observed in Teleosteans, the lymphatic",the,rstb_1929_0006.txt,txt_rstb
"class Echinoidea, some of the facts brought forward in the papers",the,rstb_1929_0005.txt,txt_rstb
the Spatangoids. Two embryo- logical facts seem to be in keeping,the,rstb_1929_0005.txt,txt_rstb
plate is formed- 8 ‘These facts led Gaver to the conclusion,the,rstb_1929_0009.txt,txt_rstb
Gaupp’s theory would fit the facts provided that a satisfactory explanation,the,rstb_1929_0009.txt,txt_rstb
"chance to give the old facts new relation- ships. This monograph,",the,rstb_1929_0004.txt,txt_rstb
"is generally conceded, then the facts presented might hint that the",the,rstb_1929_0004.txt,txt_rstb
A STELLAR ATMOSPHERE. The observed facts are that hydrogen shows a,the,rsta_1929_0010.txt,txt_rsta
"fully-viewed atoms, then the observed facts correspond to a kind of",the,rsta_1929_0010.txt,txt_rsta
"$’,4 and Q. From these facts we deduce the follow- ing:",the,rsta_1929_0008.txt,txt_rsta
ay ‘Making use of these facts we see that the variable,the,rsta_1929_0002.txt,txt_rsta
the result does not represent facts when weak fields are employed.,the,rsta_1929_0002.txt,txt_rsta
in order to present our facts in an intelligible order. When,in,rstb_1920_0004.txt,txt_rstb
"in the Cretaceous Cheilostomes, the facts are as follows. The skeletal",in,rstb_1920_0004.txt,txt_rstb
"Cyclotosaurus in which genus the facts are not known, they do",in,rstb_1920_0001.txt,txt_rstb
"a detailed description of the facts in Amblystoma, has recently been",in,rstb_1920_0001.txt,txt_rstb
equally in accordance with the facts that are at present available.,in,rstb_1920_0002.txt,txt_rstb
less in accord with observed facts than the one indicated above.,in,rstb_1920_0010.txt,txt_rstb
"possible, in the light of facts and morphogenetic tendencies as yet",in,rstb_1920_0010.txt,txt_rstb
in indirect deduction from experimental facts which record the change of,in,rsta_1920_0008.txt,txt_rsta
further research of the new facts brought to light in the,in,rsta_1920_0010.txt,txt_rsta
of work obtained increases. These facts confirm the theory discussed in,in,rstb_1921_0005.txt,txt_rstb
"use, to some extent, the facts described above in support of",in,rstb_1921_0002.txt,txt_rstb
in general agreement with the facts derived from the microscopic appearances,in,rstb_1921_0002.txt,txt_rstb
almost solely in relation to facts derived from the study of,in,rstb_1921_0002.txt,txt_rstb
of Recorded Mutations. The essential facts in the preceding pages may,in,rstb_1921_0003.txt,txt_rstb
": in the light of facts which have since been observed,",in,rstb_1921_0007.txt,txt_rstb
Miss AASE (1915) has published facts which are of value in,in,rstb_1921_0007.txt,txt_rstb
in expressing and co-ordinating the facts in a scheme that adequately,in,rstb_1921_0008.txt,txt_rstb
"drawn in illustration of the facts observed are treated rather diagrammatically,",in,rstb_1921_0008.txt,txt_rstb
usually very small. All these facts are evidently in complete agreement,in,rsta_1921_0006.txt,txt_rsta
Since the number of independent facts supplied in 2x 2 312,in,rsta_1922_0009.txt,txt_rsta
and in its absence. The facts are the direct converse of,in,rstb_1923_0006.txt,txt_rstb
"is concerned, With the main facts in hand, it appears that",in,rstb_1924_0005.txt,txt_rstb
In view of the foregoing facts it would seem worth while,in,rstb_1925_0003.txt,txt_rstb
lies not only in the facts that for a fine division,in,rstb_1925_0003.txt,txt_rstb
facilitated by the body of facts expressed in these curves. Previous,in,rstb_1925_0003.txt,txt_rstb
"instructive section, of which the facts recorded in our note books",in,rstb_1925_0005.txt,txt_rstb
also remark that the essential facts shown in the section of,in,rstb_1925_0005.txt,txt_rstb
beyond Indo-China. 'The essential major facts in the structure of eastern,in,rstb_1925_0005.txt,txt_rstb
by anyone not knowing the facts already disclosed in con- nection,in,rstb_1926_0003.txt,txt_rstb
"in consideration of some additional facts to be demonstrated below, it",in,rstb_1927_0004.txt,txt_rstb
"present in Lophius. From the facts at our disposal it seems,",in,rstb_1927_0001.txt,txt_rstb
it is possible that certain facts recorded by Frrcuson (5) in,in,rstb_1927_0001.txt,txt_rstb
"one can judge from the facts ascertained, there are in Lophius",in,rstb_1927_0001.txt,txt_rstb
"never been confirmed, and the facts put forward earlier in this",in,rstb_1927_0008.txt,txt_rstb
in the some of the facts mentioned in this Section. ‘,in,rstb_1927_0002.txt,txt_rstb
enable us to discover any facts in favour of a geological,in,rstb_1927_0002.txt,txt_rstb
réswmé of these and other facts is given by MULLIKEN in,in,rsta_1927_0005.txt,txt_rsta
"a,,=«'’n’. In Table IX these facts are illus- trated : A”",in,rsta_1927_0005.txt,txt_rsta
unintelligibility. Tn view of these facts we seem thoroughly justified in,in,rstb_1928_0002.txt,txt_rstb
can be placed on the facts in Hemimysis. ‘The anus pushes,in,rstb_1928_0008.txt,txt_rstb
"proportions is given below, the facts being recorded for convenience in",in,rsta_1928_0007.txt,txt_rsta
the parent stem. ‘These are facts of importance in a reconstruction,in,rstb_1929_0001.txt,txt_rstb
cells as in Clepsydropsis. These facts suggest that the organ may,in,rstb_1929_0001.txt,txt_rstb
"efferent component vessels. From the facts observed in Lophius, I put",in,rstb_1929_0006.txt,txt_rstb
"first place, to confirm the facts recorded in Lophius in some",in,rstb_1929_0006.txt,txt_rstb
on all fours with the facts observed in greater detail in,in,rstb_1929_0006.txt,txt_rstb
again less in quantity. These facts point to the conclusion that,in,rstb_1929_0006.txt,txt_rstb
"This seems likely from the facts observed in the Cod, and",in,rstb_1929_0006.txt,txt_rstb
"in structure and contents. The facts of comparative anatomy, as may",in,rstb_1929_0006.txt,txt_rstb
"I am assuming from the facts observed in Teleosteans, the lymphatic",in,rstb_1929_0006.txt,txt_rstb
"class Echinoidea, some of the facts brought forward in the papers",in,rstb_1929_0005.txt,txt_rstb
the Spatangoids. Two embryo- logical facts seem to be in keeping,in,rstb_1929_0005.txt,txt_rstb
