Context,Word,File,Directory
was not aware of the facts stated in M. Du Buart's,stated,rstl_1832_0020.txt,txt_rstl
a necessary inference from the facts stated in the last paper,stated,rstl_1833_0009.txt,txt_rstl
stated or referred to the facts which prove that in all,stated,rstl_1833_0009.txt,txt_rstl
is much less 80. The facts stated in the paper just,stated,rstl_1833_0009.txt,txt_rstl
It appears from all the facts which have been stated or,stated,rstl_1833_0007.txt,txt_rstl
excepting that already mentioned-f. The facts I have stated relative to,stated,rstl_1834_0026.txt,txt_rstl
in as much as the facts subsequently stated respecting the ova,stated,rstl_1835_0019.txt,txt_rstl
to refer to the conclusive facts subsequently stated in proof that,stated,rstl_1835_0019.txt,txt_rstl
the conclusions deducible from the facts and observations stated in the,stated,rstl_1836_0025.txt,txt_rstl
"fact been questioned. If the facts I have stated be correct,",stated,rstl_1836_0020.txt,txt_rstl
"functions, as appears from the facts stated in a paper which",stated,rstl_1836_0020.txt,txt_rstl
accordance with all the other facts which have been stated respecting,stated,rstl_1836_0020.txt,txt_rstl
"system, as appears from the facts stated in my paper on",stated,rstl_1836_0020.txt,txt_rstl
we also know from the facts which have been stated that,stated,rstl_1836_0020.txt,txt_rstl
"and (I believe, from the facts stated in the foregoing paper,",stated,rstl_1836_0020.txt,txt_rstl
"before been collected from the facts of observation, or indeed stated",stated,rstl_1837_0016.txt,txt_rstl
be seen from the additional facts about to be stated that,stated,rstl_1837_0019.txt,txt_rstl
"central thickened part.” If, however, facts to be hereafter stated should",stated,rstl_1839_0021.txt,txt_rstl
On a review of the facts stated in the course of,stated,rstl_1841_0018.txt,txt_rstl
the eggs ; but the facts now about to be stated,stated,rstl_1841_0012.txt,txt_rstl
afford many explanations of the facts detailed in the extraordinary works,many,rstl_1832_0016.txt,txt_rstl
affords evidence of many important facts in physiology. It proves that,many,rstl_1833_0028.txt,txt_rstl
: 1. Many of the facts which depend upon the reflex,many,rstl_1833_0028.txt,txt_rstl
public hospital ; and many facts are incidentally related by medical,many,rstl_1833_0016.txt,txt_rstl
beyond it. Many very interesting facts might be mentioned concerning the,many,rstl_1834_0029.txt,txt_rstl
and the like. Many striking facts seem to warrant the supposition,many,rstl_1834_0016.txt,txt_rstl
"by electrical influence. Many striking facts lead us to conclude, that",many,rstl_1834_0016.txt,txt_rstl
surprising that 80 many curious facts should have remained until the,many,rstl_1835_0023.txt,txt_rstl
"first warmly controverted, and many facts were adduced to prove that",many,rstl_1835_0002.txt,txt_rstl
and together with many other facts connected with the physiology of,many,rstl_1837_0019.txt,txt_rstl
the Winter. The many curious facts connected with the production of,many,rstl_1837_0019.txt,txt_rstl
"in conjunction with many preceding facts and arguments, to show that",many,rstl_1840_0004.txt,txt_rstl
entirely overlooked many most important facts in regard to the production,many,rstl_1841_0012.txt,txt_rstl
immediately incommoded or injured. These facts I have observed in the,these,rstl_1832_0017.txt,txt_rstl
repetition.” The explanation of these facts is afforded by noticing that,these,rstl_1832_0017.txt,txt_rstl
Pneumatometer. The principal of these facts is that of the quantity,these,rstl_1832_0016.txt,txt_rstl
a supply of blood. These facts prove that arterial blood is,these,rstl_1832_0016.txt,txt_rstl
the velum recoiled forcibly. These facts lead us to the further,these,rstl_1832_0015.txt,txt_rstl
"effort of life. By these facts it appears; 1st, That the",these,rstl_1832_0015.txt,txt_rstl
"the name of Theodozus. These facts distinctly show, that as the",these,rstl_1833_0032.txt,txt_rstl
"water (495.), already quoted, for facts illustrating these views in the",these,rstl_1833_0030.txt,txt_rstl
and the medulla oblongata. These facts are fully proved by the,these,rstl_1833_0028.txt,txt_rstl
altogether. * Having observed these facts in connexion with the reflex,these,rstl_1833_0028.txt,txt_rstl
"the reflex function. However these facts may have been known, their",these,rstl_1833_0028.txt,txt_rstl
wound of a nerve. These facts demonstrate the strict connexion and,these,rstl_1833_0028.txt,txt_rstl
physiologists : 2. But these facts only extend to the excited,these,rstl_1833_0028.txt,txt_rstl
less than twenty-seven pounds. These facts will enable us to obtain,these,rstl_1833_0017.txt,txt_rstl
quality; the knowledge of these facts may afford useful hints for,these,rstl_1833_0016.txt,txt_rstl
nine days. Reflecting on these facts and on those I have,these,rstl_1833_0004.txt,txt_rstl
of bile *. All these facts seem to show a very,these,rstl_1834_0026.txt,txt_rstl
anatomist to attempt demonstrating these facts in the recent brain ;,these,rstl_1834_0023.txt,txt_rstl
to the discovery of these facts MDCCCXXXIV. 3G 406 MR. NEWPORT,these,rstl_1834_0021.txt,txt_rstl
"time proportionably developed. From these facts we may conclude, 418 MR.",these,rstl_1834_0021.txt,txt_rstl
"these pheno- mena, the mere facts being alone requisite; for whatever",these,rstl_1834_0016.txt,txt_rstl
"than tin. 821. All these facts combine into, I think, an",these,rstl_1834_0008.txt,txt_rstl
"655, Such are the general facts of these remarkable interferences. Whether",these,rstl_1834_0007.txt,txt_rstl
"or arterial colour. From these facts we may conclude, that oxygen",these,rstl_1835_0021.txt,txt_rstl
"West Indian islands, where these facts were constantly before him, neither",these,rstl_1835_0019.txt,txt_rstl
"upon the inquiry. Still, these facts combined with observations relative to",these,rstl_1835_0013.txt,txt_rstl
a state of vapour. These facts fully establish the remarkable discrepancies,these,rstl_1835_0012.txt,txt_rstl
had daily experience of these facts from my habits of quail,these,rstl_1835_0012.txt,txt_rstl
functions. When we connect these facts with that of the longitudinal,these,rstl_1836_0026.txt,txt_rstl
of column B. 20. These facts are of great consequence to,these,rstl_1836_0022.txt,txt_rstl
susceptible. In accordance with these facts a per- fectly insulating disc,these,rstl_1836_0022.txt,txt_rstl
hot one. When to these facts we add others scarcely less,these,rstl_1836_0028.txt,txt_rstl
these the course of the facts far more distinctly than from,these,rstl_1836_0019.txt,txt_rstl
"transmitted at great incidences. These facts prove, beyond a doubt, that",these,rstl_1837_0017.txt,txt_rstl
inspirations. By attending to these facts we acquire a knowledge of,these,rstl_1837_0019.txt,txt_rstl
of the insect. From these facts it is sufficiently clear that,these,rstl_1837_0019.txt,txt_rstl
THE TEMPERATURE OF INSECTS. These facts are suflicient to prove that,these,rstl_1837_0019.txt,txt_rstl
of the eurrounding medium. These facts may be readily demonstrated by,these,rstl_1837_0019.txt,txt_rstl
observations that these apparently contradictory facts arose only from the circumstance,these,rstl_1837_0019.txt,txt_rstl
fasted about eighteen hours. These facts were further illustrated by a,these,rstl_1837_0019.txt,txt_rstl
had subsided to 91%. These facts distinctly prove that bees have,these,rstl_1837_0019.txt,txt_rstl
"with much less rapidity. These facts are shown in the observations,",these,rstl_1837_0019.txt,txt_rstl
the young may demand. These facts will explain a circumstance connected,these,rstl_1837_0019.txt,txt_rstl
same state of excitement. These facts readily account for the diminished,these,rstl_1837_0019.txt,txt_rstl
that a knowledge of these facts may lead us toa practical,these,rstl_1837_0019.txt,txt_rstl
per minute. These are interesting facts as connected with the power,these,rstl_1837_0019.txt,txt_rstl
"increased during respiration? With these facts in consideration, and looking at",these,rstl_1837_0019.txt,txt_rstl
thirty-four beats per minute. These facts therefore are in accordance with,these,rstl_1837_0019.txt,txt_rstl
"in the same. With these facts before us, we are enabled",these,rstl_1838_0021.txt,txt_rstl
"spheres*, &e. These and similar facts deducible by experiment enable us,",these,rstl_1839_0015.txt,txt_rstl
of fluids. 13. Since these facts furnish some evidence in fayour,these,rstl_1839_0015.txt,txt_rstl
"these mountains. I state these facts distinctly, because MaccuLLocn says\ that",these,rstl_1839_0005.txt,txt_rstl
not so obvious. From these facts it is certain that there,these,rstl_1839_0005.txt,txt_rstl
of the little stream. These facts seem at first to indicate,these,rstl_1839_0005.txt,txt_rstl
the hand of nature. These facts are interesting under another point,these,rstl_1839_0005.txt,txt_rstl
which are quietly subsiding. These facts to be explicable on the,these,rstl_1839_0005.txt,txt_rstl
3. y.)}. 19. Should these facts be thought to confirm the,these,rstl_1840_0025.txt,txt_rstl
in these early papers. Those facts I am now desirous of,these,rstl_1840_0014.txt,txt_rstl
"eight, &c. cells.” But these facts strengthen the analogy pointed out",these,rstl_1840_0024.txt,txt_rstl
of urea 6 Whether these facts have any connexion with the,these,rstl_1840_0002.txt,txt_rstl
"resolved. Notwithstanding these differences, however, facts mentioned by authors regarding the",these,rstl_1841_0017.txt,txt_rstl
"is not 80 much these facts to which I ask attention,",these,rstl_1841_0018.txt,txt_rstl
61 and 62. 63. Such facts as these appear to warrant,these,rstl_1841_0018.txt,txt_rstl
they respectively give of such facts as these. 551. The instances,such,rstl_1833_0030.txt,txt_rstl
a mode of denoting the facts of such cases. As a,such,rstl_1833_0013.txt,txt_rstl
the increasing affection * Such facts are adduced in the paper,such,rstl_1833_0009.txt,txt_rstl
the snbject ; and such facts as have been men- tioned,such,rstl_1834_0029.txt,txt_rstl
have been limited to such facts as would assist in establishing,such,rstl_1834_0029.txt,txt_rstl
be new in physiology. The facts being only such as presented,such,rstl_1834_0020.txt,txt_rstl
"655, Such are the general facts of these remarkable interferences. Whether",such,rstl_1834_0007.txt,txt_rstl
to such as relate to facts noticed respecting the trans- formations,such,rstl_1835_0019.txt,txt_rstl
be unimportant to review such facts connected with this point as,such,rstl_1836_0022.txt,txt_rstl
any such agents. When the facts adduced in the paper just,such,rstl_1836_0020.txt,txt_rstl
"capable of judging, adduced such facts as prove that the muscles",such,rstl_1836_0020.txt,txt_rstl
Such then are the principal facts that have offered themselves to,such,rstl_1837_0024.txt,txt_rstl
"I may add, that such facts tend in part to reconcile",such,rstl_1838_0015.txt,txt_rstl
theory of induction ; the facts do not oppose such a,such,rstl_1838_0008.txt,txt_rstl
common case of hemiplegia. Such facts countenance the view which was,such,rstl_1840_0014.txt,txt_rstl
results > To meet such facts it must be bent about,such,rstl_1840_0004.txt,txt_rstl
61 and 62. 63. Such facts as these appear to warrant,such,rstl_1841_0018.txt,txt_rstl
produce such division. 97. But facts recorded in several of my,such,rstl_1841_0019.txt,txt_rstl
to have recollected the singular facts recorded by that author. And,have,rstl_1832_0020.txt,txt_rstl
immediately incommoded or injured. These facts I have observed in the,have,rstl_1832_0017.txt,txt_rstl
or contractile. Reflecting on the facts and observations which I have,have,rstl_1832_0013.txt,txt_rstl
more accurately to agree with facts ; and I have ventured,have,rstl_1833_0030.txt,txt_rstl
"the reflex function. However these facts may have been known, their",have,rstl_1833_0028.txt,txt_rstl
"qui nous Echappe #,” The facts which have been detailed in",have,rstl_1833_0028.txt,txt_rstl
which flow from the preceding facts and experiments. Physiologists have hitherto,have,rstl_1833_0028.txt,txt_rstl
since most of the principal facts have been ascertained by processes,have,rstl_1833_0023.txt,txt_rstl
"power, but to record certain facts and observations which have arisen",have,rstl_1833_0022.txt,txt_rstl
"INFLUENCE OF COLOUR, &e. patients. Facts have been mentioned which make",have,rstl_1833_0016.txt,txt_rstl
"in this function. Besides, the facts which have been laid before",have,rstl_1833_0009.txt,txt_rstl
of the whole of the facts which have been laid before,have,rstl_1833_0009.txt,txt_rstl
are strikingly illustrated by the facts which have been ascertained respecting.,have,rstl_1833_0007.txt,txt_rstl
It appears from all the facts which have been stated or,have,rstl_1833_0007.txt,txt_rstl
nine days. Reflecting on these facts and on those I have,have,rstl_1833_0004.txt,txt_rstl
the snbject ; and such facts as have been men- tioned,have,rstl_1834_0029.txt,txt_rstl
have been limited to such facts as would assist in establishing,have,rstl_1834_0029.txt,txt_rstl
"founded, nor compatible with the facts which I have brought forward.",have,rstl_1834_0027.txt,txt_rstl
excepting that already mentioned-f. The facts I have stated relative to,have,rstl_1834_0026.txt,txt_rstl
have thus a series of facts which distinctly show the existence,have,rstl_1834_0021.txt,txt_rstl
"the chemist, even if the facts to which I have had",have,rstl_1834_0012.txt,txt_rstl
"do not believe that the facts which I have advanced, or",have,rstl_1834_0008.txt,txt_rstl
surprising that 80 many curious facts should have remained until the,have,rstl_1835_0023.txt,txt_rstl
have noted in foreign countries facts similar to those which I,have,rstl_1835_0018.txt,txt_rstl
cannot be doubted. As the facts which we have advanced plainly,have,rstl_1836_0025.txt,txt_rstl
assimilation ; and by other facts to which I shall have,have,rstl_1836_0020.txt,txt_rstl
"from the whole of the facts which have been referred to,",have,rstl_1836_0020.txt,txt_rstl
"fact been questioned. If the facts I have stated be correct,",have,rstl_1836_0020.txt,txt_rstl
"inference, because I have adduced facts which prove, either that electricity",have,rstl_1836_0020.txt,txt_rstl
accordance with all the other facts which have been stated respecting,have,rstl_1836_0020.txt,txt_rstl
"recollected, as appears from the facts which have been stated, that",have,rstl_1836_0020.txt,txt_rstl
we also know from the facts which have been stated that,have,rstl_1836_0020.txt,txt_rstl
"to exhibit the succession of facts of this kind, I have",have,rstl_1836_0019.txt,txt_rstl
"animals, but as all the facts which I have noticed are",have,rstl_1837_0022.txt,txt_rstl
"degree of probability from the facts which I have stated, since",have,rstl_1837_0005.txt,txt_rstl
render the subject intelligible. The facts that I have thought the,have,rstl_1837_0024.txt,txt_rstl
Such then are the principal facts that have offered themselves to,have,rstl_1837_0024.txt,txt_rstl
had subsided to 91%. These facts distinctly prove that bees have,have,rstl_1837_0019.txt,txt_rstl
a little further into the facts which have driven me to,have,rstl_1838_0009.txt,txt_rstl
physiology. That in the main facts I have not erred seems,have,rstl_1839_0021.txt,txt_rstl
1 have now to record facts which in some of the,have,rstl_1840_0025.txt,txt_rstl
"finitely, and to have withheld facts which may perhaps be useful",have,rstl_1840_0023.txt,txt_rstl
shall have brought for- ward facts and analytical results by which,have,rstl_1840_0020.txt,txt_rstl
till we have some distinct facts on which to rest ;,have,rstl_1840_0020.txt,txt_rstl
have appeared to consider the facts brought out by the experiments,have,rstl_1840_0014.txt,txt_rstl
experiments. But as the leading facts of- the experiments have now,have,rstl_1840_0013.txt,txt_rstl
opportunity for confirming the principal facts therein stated. I have now,have,rstl_1840_0024.txt,txt_rstl
"have now to state, that facts observed in the pre- sent",have,rstl_1840_0024.txt,txt_rstl
"time, a number of interesting facts have been en- countered in",have,rstl_1840_0002.txt,txt_rstl
of urea 6 Whether these facts have any connexion with the,have,rstl_1840_0002.txt,txt_rstl
have added but few new facts in this department of my,have,rstl_1841_0015.txt,txt_rstl
have noticed the important additional facts of the detection of the,have,rstl_1841_0012.txt,txt_rstl
"period just mentioned, any additional facts have been published, relating to",have,rstl_1841_0019.txt,txt_rstl
"will be seen that the facts I have now to mention,",have,rstl_1841_0019.txt,txt_rstl
&c. However some of the facts detailed in this paper may,some,rstl_1833_0028.txt,txt_rstl
be well to state some facts bearing on the same subject,some,rstl_1835_0002.txt,txt_rstl
the purposes required. Some striking facts respecting the local attraction of,some,rstl_1836_0018.txt,txt_rstl
appears from some lately ascertained facts that the secreted fluids are,some,rstl_1836_0020.txt,txt_rstl
a very short time some facts came under my observation which,some,rstl_1837_0022.txt,txt_rstl
now proceed to relate some facts re- specting the changes which,some,rstl_1837_0020.txt,txt_rstl
and to add some new facts which I hope may be,some,rstl_1837_0023.txt,txt_rstl
been led to observe some facts regarding the illuminating powers of,some,rstl_1837_0015.txt,txt_rstl
EUROPE. 233 some of the facts do appear to indicate this,some,rstl_1837_0016.txt,txt_rstl
opinions are 8upported by the facts that some insects pass into,some,rstl_1837_0019.txt,txt_rstl
alternate differently. There are some facts intimately connected with the subject,some,rstl_1838_0019.txt,txt_rstl
di- electric ; but both facts (and some others) are against,some,rstl_1838_0008.txt,txt_rstl
of fluids. 13. Since these facts furnish some evidence in fayour,some,rstl_1839_0015.txt,txt_rstl
"theory representing ac- urately the facts of some very peculiar cases,",some,rstl_1839_0014.txt,txt_rstl
GraxT for some very interesting facts on this subject. Several obseryers,some,rstl_1839_0021.txt,txt_rstl
1 have now to record facts which in some of the,some,rstl_1840_0025.txt,txt_rstl
till we have some distinct facts on which to rest ;,some,rstl_1840_0020.txt,txt_rstl
of some of the foregoing Facts to the Physiology of Cells.,some,rstl_1840_0024.txt,txt_rstl
"that I worked out the facts to some extent, and think",some,rstl_1840_0004.txt,txt_rstl
"as ** wseless,” —but also facts which go to corroborate some",some,rstl_1841_0018.txt,txt_rstl
epitome of nearly all the facts of magneto-electric induction. 171. A,all,rstl_1832_0007.txt,txt_rstl
at variance with all the facts and experiments detailed in the,all,rstl_1833_0028.txt,txt_rstl
stated or referred to the facts which prove that in all,all,rstl_1833_0009.txt,txt_rstl
It appears from all the facts which have been stated or,all,rstl_1833_0007.txt,txt_rstl
of bile *. All these facts seem to show a very,all,rstl_1834_0026.txt,txt_rstl
lever (1031.). 918. All the facts show us that that power,all,rstl_1834_0022.txt,txt_rstl
is perfectly consistent. All the facts and also the theory I,all,rstl_1834_0022.txt,txt_rstl
"than tin. 821. All these facts combine into, I think, an",all,rstl_1834_0008.txt,txt_rstl
accordance with all the other facts which have been stated respecting,all,rstl_1836_0020.txt,txt_rstl
be done till all the facts on the subject had been,all,rstl_1836_0020.txt,txt_rstl
"may best combine all the facts into a consistent scheme, by",all,rstl_1836_0019.txt,txt_rstl
"animals, but as all the facts which I have noticed are",all,rstl_1837_0022.txt,txt_rstl
means of ascertaining all the facts connected with the temperature of,all,rstl_1837_0019.txt,txt_rstl
"be established, almost all the facts hitherto discovered respecting the tides",all,rstl_1838_0011.txt,txt_rstl
"but with all the known facts of common induction, conduction, and",all,rstl_1838_0008.txt,txt_rstl
"to establish, what all the facts seem to prove, that when",all,rstl_1838_0009.txt,txt_rstl
"a long while fruitless, unexpected facts were noticed, amply repaying all",all,rstl_1839_0021.txt,txt_rstl
satisfactory explanation of all the facts be given. That deoxidation is,all,rstl_1840_0016.txt,txt_rstl
"all anticipated. For, although the facts observed had led me pretty",all,rstl_1841_0019.txt,txt_rstl
"this way a series of facts has been ascertained, which I",i,rstl_1832_0023.txt,txt_rstl
immediately incommoded or injured. These facts I have observed in the,i,rstl_1832_0017.txt,txt_rstl
or contractile. Reflecting on the facts and observations which I have,i,rstl_1832_0013.txt,txt_rstl
more accurately to agree with facts ; and I have ventured,i,rstl_1833_0030.txt,txt_rstl
interesting of chemical substances. The facts which I haye to communicate,i,rstl_1833_0015.txt,txt_rstl
nine days. Reflecting on these facts and on those I have,i,rstl_1833_0004.txt,txt_rstl
"founded, nor compatible with the facts which I have brought forward.",i,rstl_1834_0027.txt,txt_rstl
excepting that already mentioned-f. The facts I have stated relative to,i,rstl_1834_0026.txt,txt_rstl
is perfectly consistent. All the facts and also the theory I,i,rstl_1834_0022.txt,txt_rstl
"the chemist, even if the facts to which I have had",i,rstl_1834_0012.txt,txt_rstl
current. As I want the facts in illustration of the distinction,i,rstl_1834_0008.txt,txt_rstl
"and the chloride, I observed facts which lead me to doubt",i,rstl_1834_0008.txt,txt_rstl
"than tin. 821. All these facts combine into, I think, an",i,rstl_1834_0008.txt,txt_rstl
"do not believe that the facts which I have advanced, or",i,rstl_1834_0008.txt,txt_rstl
"M. ST. HiLairs from the facts noticed by M. Epwasps, I",i,rstl_1835_0019.txt,txt_rstl
have noted in foreign countries facts similar to those which I,i,rstl_1835_0018.txt,txt_rstl
shall illustrate by a few facts equally brief and satisfactory. I,i,rstl_1835_0012.txt,txt_rstl
"expect, I think the few facts bearing upon this subject with",i,rstl_1835_0005.txt,txt_rstl
"with the fundamental laws and facts of electrical science, that I",i,rstl_1835_0005.txt,txt_rstl
one of the most essential facts to determine ; yet I,i,rstl_1836_0028.txt,txt_rstl
"it will appear from the facts I am about to adduce,",i,rstl_1836_0020.txt,txt_rstl
assimilation ; and by other facts to which I shall have,i,rstl_1836_0020.txt,txt_rstl
"fact been questioned. If the facts I have stated be correct,",i,rstl_1836_0020.txt,txt_rstl
"inference, because I have adduced facts which prove, either that electricity",i,rstl_1836_0020.txt,txt_rstl
"to exhibit the succession of facts of this kind, I have",i,rstl_1836_0019.txt,txt_rstl
induced to believe that the facts which I am prepared to,i,rstl_1837_0022.txt,txt_rstl
"animals, but as all the facts which I have noticed are",i,rstl_1837_0022.txt,txt_rstl
and to add some new facts which I hope may be,i,rstl_1837_0023.txt,txt_rstl
"be needful to premise certain facts which are, I believe, universally",i,rstl_1837_0021.txt,txt_rstl
also mention another class of facts to which I think those,i,rstl_1837_0005.txt,txt_rstl
"degree of probability from the facts which I have stated, since",i,rstl_1837_0005.txt,txt_rstl
render the subject intelligible. The facts that I have thought the,i,rstl_1837_0024.txt,txt_rstl
"Vobservation++.” I trust that the facts mentioned in the preceding pages,",i,rstl_1838_0016.txt,txt_rstl
"I may add, that such facts tend in part to reconcile",i,rstl_1838_0015.txt,txt_rstl
"I hope that, considering the facts and investigations contained in the",i,rstl_1838_0008.txt,txt_rstl
"I think, in contradiction with facts (511, &c.). It appears to",i,rstl_1838_0009.txt,txt_rstl
"I conclude, therefore, that the facts upon which the doctrine of",i,rstl_1838_0009.txt,txt_rstl
physiology. That in the main facts I have not erred seems,i,rstl_1839_0021.txt,txt_rstl
"these mountains. I state these facts distinctly, because MaccuLLocn says\ that",i,rstl_1839_0005.txt,txt_rstl
"attention. Taking adyantage of the facts pointed out by Wonrer®, I",i,rstl_1840_0017.txt,txt_rstl
in these early papers. Those facts I am now desirous of,i,rstl_1840_0014.txt,txt_rstl
"the experi- ments relate to facts and not opinions, I can",i,rstl_1840_0010.txt,txt_rstl
opportunity for confirming the principal facts therein stated. I have now,i,rstl_1840_0024.txt,txt_rstl
"that I worked out the facts to some extent, and think",i,rstl_1840_0004.txt,txt_rstl
"of no small interest. The facts I am about to recite,",i,rstl_1840_0002.txt,txt_rstl
"is not 80 much these facts to which I ask attention,",i,rstl_1841_0018.txt,txt_rstl
"I explain it, and from facts above mentioned, showing that blood-corpuscles",i,rstl_1841_0018.txt,txt_rstl
"will be seen that the facts I have now to mention,",i,rstl_1841_0019.txt,txt_rstl
nucleated cells. But the other facts now men- tioned+; I believe,i,rstl_1841_0019.txt,txt_rstl
I in pos- ses8ion of facts connected with the process of,i,rstl_1841_0019.txt,txt_rstl
"each other, and from the facts on which that law is",from,rstl_1832_0016.txt,txt_rstl
"chemically *, 517. Judging from facts only, there is not as",from,rstl_1833_0030.txt,txt_rstl
not legitimate deductions from the facts before them. But M. CruvgrLn,from,rstl_1833_0028.txt,txt_rstl
"deeply interesting character, The following facts are extracted from a letter",from,rstl_1833_0028.txt,txt_rstl
which flow from the preceding facts and experiments. Physiologists have hitherto,from,rstl_1833_0028.txt,txt_rstl
a necessary inference from the facts stated in the last paper,from,rstl_1833_0009.txt,txt_rstl
union. It appears from those facts that the muscles of respiration,from,rstl_1833_0009.txt,txt_rstl
"admitted, from the statement of facts made in the paper just",from,rstl_1833_0007.txt,txt_rstl
"from this and the preceding facts are unavoidable, that the former",from,rstl_1833_0007.txt,txt_rstl
It appears from all the facts which have been stated or,from,rstl_1833_0007.txt,txt_rstl
