Context,Word,File,Directory
when the whole of the facts on the subject are carefully,are,rstl_1834_0012.txt,txt_rstl
"action of heat, still the facts are considered as justifying the",are,rstl_1834_0007.txt,txt_rstl
"655, Such are the general facts of these remarkable interferences. Whether",are,rstl_1834_0007.txt,txt_rstl
"that the laws of the facts are Such, or nearly such,",are,rstl_1834_0004.txt,txt_rstl
the known laws of the facts are accounted for by the,are,rstl_1834_0004.txt,txt_rstl
of column B. 20. These facts are of great consequence to,are,rstl_1836_0022.txt,txt_rstl
from the great variety of facts on which the conclusions are,are,rstl_1836_0020.txt,txt_rstl
experience alone. Hence the well-known facts that infants are not aware,are,rstl_1836_0020.txt,txt_rstl
appears from some lately ascertained facts that the secreted fluids are,are,rstl_1836_0020.txt,txt_rstl
light. The following are the facts which appear to fayour this,are,rstl_1836_0007.txt,txt_rstl
"animals, but as all the facts which I have noticed are",are,rstl_1837_0022.txt,txt_rstl
"thin plates, two classes of facts are compared under yery different",are,rstl_1837_0017.txt,txt_rstl
Such then are the principal facts that have offered themselves to,are,rstl_1837_0024.txt,txt_rstl
cells are lined. With the facts before us of the progressive,are,rstl_1837_0024.txt,txt_rstl
a great number of curious facts in fluid motion are established,are,rstl_1837_0009.txt,txt_rstl
THE TEMPERATURE OF INSECTS. These facts are suflicient to prove that,are,rstl_1837_0019.txt,txt_rstl
opinions are 8upported by the facts that some insects pass into,are,rstl_1837_0019.txt,txt_rstl
"with much less rapidity. These facts are shown in the observations,",are,rstl_1837_0019.txt,txt_rstl
per minute. These are interesting facts as connected with the power,are,rstl_1837_0019.txt,txt_rstl
thirty-four beats per minute. These facts therefore are in accordance with,are,rstl_1837_0019.txt,txt_rstl
"in the same. With these facts before us, we are enabled",are,rstl_1838_0021.txt,txt_rstl
alternate differently. There are some facts intimately connected with the subject,are,rstl_1838_0019.txt,txt_rstl
di- electric ; but both facts (and some others) are against,are,rstl_1838_0008.txt,txt_rstl
the hand of nature. These facts are interesting under another point,are,rstl_1839_0005.txt,txt_rstl
which are quietly subsiding. These facts to be explicable on the,are,rstl_1839_0005.txt,txt_rstl
"function, we are inattentive to facts of daily occurrence. To take",are,rstl_1840_0014.txt,txt_rstl
"the ceconomy, there are no facts to countenance the belief, that",are,rstl_1840_0014.txt,txt_rstl
a new examination and new facts are required to de- termine,are,rstl_1840_0022.txt,txt_rstl
to determine how far the facts elicited are of ge- neral,are,rstl_1840_0022.txt,txt_rstl
'The following are the leading facts which the preceding researches upon,are,rstl_1841_0015.txt,txt_rstl
with great difficulty that the facts connected with them are ascertained.,are,rstl_1841_0012.txt,txt_rstl
"this time to speculate, without facts that are $till wanted regarding",are,rstl_1841_0019.txt,txt_rstl
"each other, and from the facts on which that law is",on,rstl_1832_0016.txt,txt_rstl
or contractile. Reflecting on the facts and observations which I have,on,rstl_1832_0013.txt,txt_rstl
been desirous of discovering new facts and new relations dependent on,on,rstl_1832_0007.txt,txt_rstl
support their opinion by any facts directly bearing on the point.,on,rstl_1833_0007.txt,txt_rstl
"on this subject, for the facts on which the foregoing positions",on,rstl_1833_0007.txt,txt_rstl
"in possession of no other facts on the subject, we should",on,rstl_1833_0007.txt,txt_rstl
nine days. Reflecting on these facts and on those I have,on,rstl_1833_0004.txt,txt_rstl
"or general notion, but on facts which, being altogether new, were",on,rstl_1834_0022.txt,txt_rstl
when the whole of the facts on the subject are carefully,on,rstl_1834_0012.txt,txt_rstl
on this and the other facts brought to light during the,on,rstl_1835_0002.txt,txt_rstl
be well to state some facts bearing on the same subject,on,rstl_1835_0002.txt,txt_rstl
from the great variety of facts on which the conclusions are,on,rstl_1836_0020.txt,txt_rstl
common. IT appears from the facts adduced in my paper on,on,rstl_1836_0020.txt,txt_rstl
"system, as appears from the facts stated in my paper on",on,rstl_1836_0020.txt,txt_rstl
often proved fatal. On the facts that the central organs of,on,rstl_1836_0020.txt,txt_rstl
be done till all the facts on the subject had been,on,rstl_1836_0020.txt,txt_rstl
becoming acquainted with the known facts on animal development and other,on,rstl_1838_0016.txt,txt_rstl
"has been thus applied. The facts of interference, on which the",on,rstl_1838_0013.txt,txt_rstl
GraxT for some very interesting facts on this subject. Several obseryers,on,rstl_1839_0021.txt,txt_rstl
which are quietly subsiding. These facts to be explicable on the,on,rstl_1839_0005.txt,txt_rstl
till we have some distinct facts on which to rest ;,on,rstl_1840_0020.txt,txt_rstl
"be seen on comparing the facts about to be recorded, with",on,rstl_1840_0024.txt,txt_rstl
"on the ovary||. From the facts just mentioned, and those about",on,rstl_1840_0024.txt,txt_rstl
"think accountable for, on the facts partly known respecting opposed currents;",on,rstl_1840_0003.txt,txt_rstl
experiment. 1849. Proceeding on the facts made known by ScaaNBEIN respecting,on,rstl_1840_0003.txt,txt_rstl
"enhances the value of any facts bearing on this obscure point,",on,rstl_1841_0009.txt,txt_rstl
On a review of the facts stated in the course of,on,rstl_1841_0018.txt,txt_rstl
"the name of Theodozus. These facts distinctly show, that as the",as,rstl_1833_0032.txt,txt_rstl
be considered as the general facts of electro-chemical de- composition are,as,rstl_1833_0030.txt,txt_rstl
"chemically *, 517. Judging from facts only, there is not as",as,rstl_1833_0030.txt,txt_rstl
they respectively give of such facts as these. 551. The instances,as,rstl_1833_0030.txt,txt_rstl
a mode of denoting the facts of such cases. As a,as,rstl_1833_0013.txt,txt_rstl
the snbject ; and such facts as have been men- tioned,as,rstl_1834_0029.txt,txt_rstl
have been limited to such facts as would assist in establishing,as,rstl_1834_0029.txt,txt_rstl
be new in physiology. The facts being only such as presented,as,rstl_1834_0020.txt,txt_rstl
be satisfied to take the facts as we find them. And,as,rstl_1834_0012.txt,txt_rstl
current. As I want the facts in illustration of the distinction,as,rstl_1834_0008.txt,txt_rstl
"action of heat, still the facts are considered as justifying the",as,rstl_1834_0007.txt,txt_rstl
in as much as the facts subsequently stated respecting the ova,as,rstl_1835_0019.txt,txt_rstl
to such as relate to facts noticed respecting the trans- formations,as,rstl_1835_0019.txt,txt_rstl
than as the compiler of facts observed and reported to me,as,rstl_1835_0011.txt,txt_rstl
"that of the Tyrol, as facts of the same description. The",as,rstl_1835_0011.txt,txt_rstl
cannot be doubted. As the facts which we have advanced plainly,as,rstl_1836_0025.txt,txt_rstl
be unimportant to review such facts connected with this point as,as,rstl_1836_0022.txt,txt_rstl
"functions, as appears from the facts stated in a paper which",as,rstl_1836_0020.txt,txt_rstl
"recollected, as appears from the facts which have been stated, that",as,rstl_1836_0020.txt,txt_rstl
"system, as appears from the facts stated in my paper on",as,rstl_1836_0020.txt,txt_rstl
"capable of judging, adduced such facts as prove that the muscles",as,rstl_1836_0020.txt,txt_rstl
"And such, as appears from facts aboye referred to, is its",as,rstl_1836_0020.txt,txt_rstl
"the muscular, as appears from facts aboye referred to, being the",as,rstl_1836_0020.txt,txt_rstl
"animals, but as all the facts which I have noticed are",as,rstl_1837_0022.txt,txt_rstl
per minute. These are interesting facts as connected with the power,as,rstl_1837_0019.txt,txt_rstl
peculiarly noted as cold-blooded. 'These facts con- * This is in,as,rstl_1837_0019.txt,txt_rstl
as yet convinced by the facts that the nervous fluid is,as,rstl_1839_0002.txt,txt_rstl
close as from the above facts it appears to be. (Compare,as,rstl_1839_0021.txt,txt_rstl
experiments. But as the leading facts of- the experiments have now,as,rstl_1840_0013.txt,txt_rstl
theoretical. < As the experimental facts observed by myself differ from,as,rstl_1840_0013.txt,txt_rstl
"to the platinum, and the facts mainly as with iron. But",as,rstl_1840_0003.txt,txt_rstl
"considered as hitherto undecided. The facts about to be tated, however,",as,rstl_1840_0002.txt,txt_rstl
"as ** wseless,” —but also facts which go to corroborate some",as,rstl_1841_0018.txt,txt_rstl
61 and 62. 63. Such facts as these appear to warrant,as,rstl_1841_0018.txt,txt_rstl
as fibrous tissues. 174. Other facts observable in an examination of,as,rstl_1841_0019.txt,txt_rstl
"the name of Theodozus. These facts distinctly show, that as the",as,rstl_1833_0032.txt,txt_rstl
be considered as the general facts of electro-chemical de- composition are,as,rstl_1833_0030.txt,txt_rstl
"chemically *, 517. Judging from facts only, there is not as",as,rstl_1833_0030.txt,txt_rstl
they respectively give of such facts as these. 551. The instances,as,rstl_1833_0030.txt,txt_rstl
a mode of denoting the facts of such cases. As a,as,rstl_1833_0013.txt,txt_rstl
the snbject ; and such facts as have been men- tioned,as,rstl_1834_0029.txt,txt_rstl
have been limited to such facts as would assist in establishing,as,rstl_1834_0029.txt,txt_rstl
be new in physiology. The facts being only such as presented,as,rstl_1834_0020.txt,txt_rstl
be satisfied to take the facts as we find them. And,as,rstl_1834_0012.txt,txt_rstl
current. As I want the facts in illustration of the distinction,as,rstl_1834_0008.txt,txt_rstl
"action of heat, still the facts are considered as justifying the",as,rstl_1834_0007.txt,txt_rstl
in as much as the facts subsequently stated respecting the ova,as,rstl_1835_0019.txt,txt_rstl
to such as relate to facts noticed respecting the trans- formations,as,rstl_1835_0019.txt,txt_rstl
than as the compiler of facts observed and reported to me,as,rstl_1835_0011.txt,txt_rstl
"that of the Tyrol, as facts of the same description. The",as,rstl_1835_0011.txt,txt_rstl
cannot be doubted. As the facts which we have advanced plainly,as,rstl_1836_0025.txt,txt_rstl
be unimportant to review such facts connected with this point as,as,rstl_1836_0022.txt,txt_rstl
"functions, as appears from the facts stated in a paper which",as,rstl_1836_0020.txt,txt_rstl
"recollected, as appears from the facts which have been stated, that",as,rstl_1836_0020.txt,txt_rstl
"system, as appears from the facts stated in my paper on",as,rstl_1836_0020.txt,txt_rstl
"capable of judging, adduced such facts as prove that the muscles",as,rstl_1836_0020.txt,txt_rstl
"And such, as appears from facts aboye referred to, is its",as,rstl_1836_0020.txt,txt_rstl
"the muscular, as appears from facts aboye referred to, being the",as,rstl_1836_0020.txt,txt_rstl
"animals, but as all the facts which I have noticed are",as,rstl_1837_0022.txt,txt_rstl
per minute. These are interesting facts as connected with the power,as,rstl_1837_0019.txt,txt_rstl
peculiarly noted as cold-blooded. 'These facts con- * This is in,as,rstl_1837_0019.txt,txt_rstl
as yet convinced by the facts that the nervous fluid is,as,rstl_1839_0002.txt,txt_rstl
close as from the above facts it appears to be. (Compare,as,rstl_1839_0021.txt,txt_rstl
experiments. But as the leading facts of- the experiments have now,as,rstl_1840_0013.txt,txt_rstl
theoretical. < As the experimental facts observed by myself differ from,as,rstl_1840_0013.txt,txt_rstl
"to the platinum, and the facts mainly as with iron. But",as,rstl_1840_0003.txt,txt_rstl
"considered as hitherto undecided. The facts about to be tated, however,",as,rstl_1840_0002.txt,txt_rstl
"as ** wseless,” —but also facts which go to corroborate some",as,rstl_1841_0018.txt,txt_rstl
61 and 62. 63. Such facts as these appear to warrant,as,rstl_1841_0018.txt,txt_rstl
as fibrous tissues. 174. Other facts observable in an examination of,as,rstl_1841_0019.txt,txt_rstl
addition to the series of facts already ascertained respecting 80 anomalous,of,rstl_1832_0023.txt,txt_rstl
"this way a series of facts has been ascertained, which I",of,rstl_1832_0023.txt,txt_rstl
was not aware of the facts stated in M. Du Buart's,of,rstl_1832_0020.txt,txt_rstl
repetition.” The explanation of these facts is afforded by noticing that,of,rstl_1832_0017.txt,txt_rstl
Pneumatometer. The principal of these facts is that of the quantity,of,rstl_1832_0016.txt,txt_rstl
a supply of blood. These facts prove that arterial blood is,of,rstl_1832_0016.txt,txt_rstl
afford many explanations of the facts detailed in the extraordinary works,of,rstl_1832_0016.txt,txt_rstl
"effort of life. By these facts it appears; 1st, That the",of,rstl_1832_0015.txt,txt_rstl
been desirous of discovering new facts and new relations dependent on,of,rstl_1832_0007.txt,txt_rstl
epitome of nearly all the facts of magneto-electric induction. 171. A,of,rstl_1832_0007.txt,txt_rstl
not aware of any distinct facts which authorize the conclusion that,of,rstl_1832_0007.txt,txt_rstl
of dispute; and the following facts render it more than probable,of,rstl_1832_0004.txt,txt_rstl
"the name of Theodozus. These facts distinctly show, that as the",of,rstl_1833_0032.txt,txt_rstl
out of the preceding anatomical facts are extremely simple. If it,of,rstl_1833_0031.txt,txt_rstl
be considered as the general facts of electro-chemical de- composition are,of,rstl_1833_0030.txt,txt_rstl
"consideration of electro-chemical decompositions. The facts are of the utmost, value,",of,rstl_1833_0030.txt,txt_rstl
with the immense collection of facts belonging to this branch of,of,rstl_1833_0030.txt,txt_rstl
they respectively give of such facts as these. 551. The instances,of,rstl_1833_0030.txt,txt_rstl
consideration beyond that of insulated facts or mere details. Impressed with,of,rstl_1833_0028.txt,txt_rstl
deprived of its encephalon. 'The facts are these: in the entire,of,rstl_1833_0028.txt,txt_rstl
affords evidence of many important facts in physiology. It proves that,of,rstl_1833_0028.txt,txt_rstl
"a totally new order of facts in pathology, and to lead",of,rstl_1833_0028.txt,txt_rstl
between the two orders of facts to which LecarLos refers. The,of,rstl_1833_0028.txt,txt_rstl
&c. However some of the facts detailed in this paper may,of,rstl_1833_0028.txt,txt_rstl
It appears probable that the facts of this paper may lead,of,rstl_1833_0028.txt,txt_rstl
wound of a nerve. These facts demonstrate the strict connexion and,of,rstl_1833_0028.txt,txt_rstl
: 1. Many of the facts which depend upon the reflex,of,rstl_1833_0028.txt,txt_rstl
or instinct : 3. The facts of excited movements of the,of,rstl_1833_0028.txt,txt_rstl
poisons. 7. This series of facts has not been duly associated,of,rstl_1833_0028.txt,txt_rstl
action in this order of facts has not been demonstrated to,of,rstl_1833_0028.txt,txt_rstl
since most of the principal facts have been ascertained by processes,of,rstl_1833_0023.txt,txt_rstl
strict accordance with the observed facts of the influence of colour,of,rstl_1833_0016.txt,txt_rstl
and know of no recorded facts in which the influence of,of,rstl_1833_0016.txt,txt_rstl
quality; the knowledge of these facts may afford useful hints for,of,rstl_1833_0016.txt,txt_rstl
"INFLUENCE OF COLOUR, &e. patients. Facts have been mentioned which make",of,rstl_1833_0016.txt,txt_rstl
interesting of chemical substances. The facts which I haye to communicate,of,rstl_1833_0015.txt,txt_rstl
a mode of denoting the facts of such cases. As a,of,rstl_1833_0013.txt,txt_rstl
now discover of grouping the facts which we possess. The lines,of,rstl_1833_0013.txt,txt_rstl
union. It appears from those facts that the muscles of respiration,of,rstl_1833_0009.txt,txt_rstl
of the whole of the facts which have been laid before,of,rstl_1833_0009.txt,txt_rstl
by com- paring the various facts relating to the circulation of,of,rstl_1833_0007.txt,txt_rstl
"admitted, from the statement of facts made in the paper just",of,rstl_1833_0007.txt,txt_rstl
to be possessed of any facts which directly support them; the,of,rstl_1833_0007.txt,txt_rstl
"in possession of no other facts on the subject, we should",of,rstl_1833_0007.txt,txt_rstl
"that the whole of the facts relating to this agent, prove",of,rstl_1833_0007.txt,txt_rstl
"from this col- lection of facts is, that electricity, whatever may",of,rstl_1833_0006.txt,txt_rstl
me to make of the facts and views constituting the theory,of,rstl_1833_0006.txt,txt_rstl
little usefulness ; for what facts are there in favour of,of,rstl_1834_0027.txt,txt_rstl
of bile *. All these facts seem to show a very,of,rstl_1834_0026.txt,txt_rstl
by the majority of the facts adduced in this paper. The,of,rstl_1834_0026.txt,txt_rstl
of respiration. But there are facts which might at first incline,of,rstl_1834_0021.txt,txt_rstl
to the discovery of these facts MDCCCXXXIV. 3G 406 MR. NEWPORT,of,rstl_1834_0021.txt,txt_rstl
have thus a series of facts which distinctly show the existence,of,rstl_1834_0021.txt,txt_rstl
"hitherto done, a class of facts essentially involved in the subject",of,rstl_1834_0016.txt,txt_rstl
to me that the various facts ascertained in the course of,of,rstl_1834_0012.txt,txt_rstl
when the whole of the facts on the subject are carefully,of,rstl_1834_0012.txt,txt_rstl
"a true expression of the facts of electro- chemical decomposition, and",of,rstl_1834_0008.txt,txt_rstl
current. As I want the facts in illustration of the distinction,of,rstl_1834_0008.txt,txt_rstl
there is an immensity of facts which justify us in believing,of,rstl_1834_0008.txt,txt_rstl
"action of heat, still the facts are considered as justifying the",of,rstl_1834_0007.txt,txt_rstl
"655, Such are the general facts of these remarkable interferences. Whether",of,rstl_1834_0007.txt,txt_rstl
"that the laws of the facts are Such, or nearly such,",of,rstl_1834_0004.txt,txt_rstl
the known laws of the facts are accounted for by the,of,rstl_1834_0004.txt,txt_rstl
to our stock of information facts which prove the fallacy of,of,rstl_1835_0018.txt,txt_rstl
One of the most decisive facts regarding the finding of the,of,rstl_1835_0018.txt,txt_rstl
a state of vapour. These facts fully establish the remarkable discrepancies,of,rstl_1835_0012.txt,txt_rstl
had daily experience of these facts from my habits of quail,of,rstl_1835_0012.txt,txt_rstl
"give an abstract of the facts established, and the principal matters",of,rstl_1835_0012.txt,txt_rstl
than as the compiler of facts observed and reported to me,of,rstl_1835_0011.txt,txt_rstl
"that of the Tyrol, as facts of the same description. The",of,rstl_1835_0011.txt,txt_rstl
"with the fundamental laws and facts of electrical science, that I",of,rstl_1835_0005.txt,txt_rstl
functions. When we connect these facts with that of the longitudinal,of,rstl_1836_0026.txt,txt_rstl
of column B. 20. These facts are of great consequence to,of,rstl_1836_0022.txt,txt_rstl
30. This simple induction of facts appears sufficiently conclusive ; it,of,rstl_1836_0022.txt,txt_rstl
whilst detailing a series of facts carefully deduced by induction and,of,rstl_1836_0022.txt,txt_rstl
one of the most essential facts to determine ; yet I,of,rstl_1836_0028.txt,txt_rstl
"of these, which with other facts immediately to be noticed, render",of,rstl_1836_0028.txt,txt_rstl
of five classes of geological facts already alluded to in the,of,rstl_1836_0028.txt,txt_rstl
6? 20' E.*# The preceding facts showing the influence of small,of,rstl_1836_0018.txt,txt_rstl
the purposes required. Some striking facts respecting the local attraction of,of,rstl_1836_0018.txt,txt_rstl
from the great variety of facts on which the conclusions are,of,rstl_1836_0020.txt,txt_rstl
"from the whole of the facts which have been referred to,",of,rstl_1836_0020.txt,txt_rstl
"8tate the whole of those facts with their various bearings, which",of,rstl_1836_0020.txt,txt_rstl
often proved fatal. On the facts that the central organs of,of,rstl_1836_0020.txt,txt_rstl
"capable of judging, adduced such facts as prove that the muscles",of,rstl_1836_0020.txt,txt_rstl
FROM the whole of the facts referred to in the preceding,of,rstl_1836_0020.txt,txt_rstl
"of the equilibrium-theory with the facts (assuming « = 2"") is",of,rstl_1836_0014.txt,txt_rstl
in possession of the leading facts appertaining to the influence of,of,rstl_1836_0015.txt,txt_rstl
than a representation of the facts of the case ; yet,of,rstl_1836_0019.txt,txt_rstl
"to exhibit the succession of facts of this kind, I have",of,rstl_1836_0019.txt,txt_rstl
these the course of the facts far more distinctly than from,of,rstl_1836_0019.txt,txt_rstl
"thin plates, two classes of facts are compared under yery different",of,rstl_1837_0017.txt,txt_rstl
bringing the two series of facts under the same conditions. Sir,of,rstl_1837_0017.txt,txt_rstl
been led to observe some facts regarding the illuminating powers of,of,rstl_1837_0015.txt,txt_rstl
"before been collected from the facts of observation, or indeed stated",of,rstl_1837_0016.txt,txt_rstl
"suggestion was founded upon the facts of a few places, and",of,rstl_1837_0016.txt,txt_rstl
EUROPE. 233 some of the facts do appear to indicate this,of,rstl_1837_0016.txt,txt_rstl
also mention another class of facts to which I think those,of,rstl_1837_0005.txt,txt_rstl
"degree of probability from the facts which I have stated, since",of,rstl_1837_0005.txt,txt_rstl
cells are lined. With the facts before us of the progressive,of,rstl_1837_0024.txt,txt_rstl
a great number of curious facts in fluid motion are established,of,rstl_1837_0009.txt,txt_rstl
and together with many other facts connected with the physiology of,of,rstl_1837_0019.txt,txt_rstl
inspirations. By attending to these facts we acquire a knowledge of,of,rstl_1837_0019.txt,txt_rstl
of the insect. From these facts it is sufficiently clear that,of,rstl_1837_0019.txt,txt_rstl
means of ascertaining all the facts connected with the temperature of,of,rstl_1837_0019.txt,txt_rstl
THE TEMPERATURE OF INSECTS. These facts are suflicient to prove that,of,rstl_1837_0019.txt,txt_rstl
of the eurrounding medium. These facts may be readily demonstrated by,of,rstl_1837_0019.txt,txt_rstl
high degrees of temperature. The facts connected with the presumed plethoric,of,rstl_1837_0019.txt,txt_rstl
the Winter. The many curious facts connected with the production of,of,rstl_1837_0019.txt,txt_rstl
explained by reference to the facts connected with the production of,of,rstl_1837_0019.txt,txt_rstl
same state of excitement. These facts readily account for the diminished,of,rstl_1837_0019.txt,txt_rstl
that a knowledge of these facts may lead us toa practical,of,rstl_1837_0019.txt,txt_rstl
"comparing the whole of the facts we haye just examined, we",of,rstl_1837_0019.txt,txt_rstl
to ascertain a few additional facts respecting the temperature of zome,of,rstl_1837_0019.txt,txt_rstl
was one of the earliest facts which drew my attention to,of,rstl_1838_0019.txt,txt_rstl
yeri- fying most of the facts by repeated observation. The examinations,of,rstl_1838_0016.txt,txt_rstl
"has been thus applied. The facts of interference, on which the",of,rstl_1838_0013.txt,txt_rstl
being merely an expression of facts and truths in nature being,of,rstl_1838_0015.txt,txt_rstl
"to examine, by the great facts of electrical science, that theory",of,rstl_1838_0008.txt,txt_rstl
"but with all the known facts of common induction, conduction, and",of,rstl_1838_0008.txt,txt_rstl
theory of induction ; the facts do not oppose such a,of,rstl_1838_0008.txt,txt_rstl
"I conclude, therefore, that the facts upon which the doctrine of",of,rstl_1838_0009.txt,txt_rstl
"the ac- cordance of known facts with it, but in the",of,rstl_1838_0002.txt,txt_rstl
further consideration of the preceding facts until they can be collated,of,rstl_1838_0002.txt,txt_rstl
of fluids. 13. Since these facts furnish some evidence in fayour,of,rstl_1839_0015.txt,txt_rstl
of B. 38. The preceding facts lead us to refer every,of,rstl_1839_0015.txt,txt_rstl
"theory representing ac- urately the facts of some very peculiar cases,",of,rstl_1839_0014.txt,txt_rstl
recapitulation of sevyeral of the facts recorded in this memoir; viz.,of,rstl_1839_0021.txt,txt_rstl
most important of the foregoing facts respecting the development of the,of,rstl_1839_0021.txt,txt_rstl
with a number of new facts observed by the author. {,of,rstl_1839_0021.txt,txt_rstl
to a few of the facts recorded in the foregoing and,of,rstl_1839_0021.txt,txt_rstl
of the little stream. These facts seem at first to indicate,of,rstl_1839_0005.txt,txt_rstl
the hand of nature. These facts are interesting under another point,of,rstl_1839_0005.txt,txt_rstl
1 have now to record facts which in some of the,of,rstl_1840_0025.txt,txt_rstl
am not aware of any facts having been observed which warranted,of,rstl_1840_0025.txt,txt_rstl
functions of those tissnes. 'The facts made known in the present,of,rstl_1840_0025.txt,txt_rstl
"attention. Taking adyantage of the facts pointed out by Wonrer®, I",of,rstl_1840_0017.txt,txt_rstl
in these early papers. Those facts I am now desirous of,of,rstl_1840_0014.txt,txt_rstl
"function, we are inattentive to facts of daily occurrence. To take",of,rstl_1840_0014.txt,txt_rstl
common case of hemiplegia. Such facts countenance the view which was,of,rstl_1840_0014.txt,txt_rstl
the obser- vation of the facts was with me long anterior,of,rstl_1840_0013.txt,txt_rstl
in the perception of experimental facts not wholly coinciding with Sir,of,rstl_1840_0013.txt,txt_rstl
to determine how far the facts elicited are of ge- neral,of,rstl_1840_0022.txt,txt_rstl
of some of the foregoing Facts to the Physiology of Cells.,of,rstl_1840_0024.txt,txt_rstl
