Context,Word,File,Directory
282 / 218 When these facts had been ascertained the obvious,these,rstb_1920_0003.txt,txt_rstb
magnesia. ~ “Where do these facts point? A moment’s speculation will,these,rsta_1920_0008.txt,txt_rsta
"laws of spectral construction, such facts as these may be expected",these,rsta_1920_0010.txt,txt_rsta
of work obtained increases. These facts confirm the theory discussed in,these,rstb_1921_0005.txt,txt_rstb
"was based, are incorrect. These facts need not be referred to",these,rstb_1921_0002.txt,txt_rstb
to the same conclusion. These facts about Podocarpus are not here,these,rstb_1921_0007.txt,txt_rstb
usually very small. All these facts are evidently in complete agreement,these,rsta_1921_0006.txt,txt_rsta
60th degree of latitude. These facts will give an idea of,these,rstb_1923_0004.txt,txt_rstb
and (p. 385) :—‘“ These facts seem to me to establish,these,rstb_1923_0005.txt,txt_rstb
the load is decreased. These facts have an important bearing on,these,rsta_1923_0003.txt,txt_rsta
at above. From all these facts the conclusion may be drawn,these,rsta_1923_0004.txt,txt_rsta
same nature occur. All these facts lead up to the inevitable,these,rstb_1924_0004.txt,txt_rstb
hardly any wear. From these facts it seems most probable that,these,rstb_1924_0009.txt,txt_rstb
"origin and distribution, . These facts suggest that the * It",these,rstb_1924_0008.txt,txt_rstb
"51a, and R. 141). These facts VOL. CCXI.—B, 2P 284 REV.",these,rstb_1924_0008.txt,txt_rstb
an embryo Trichosurus. All these facts appear sufticiently conclusive to justify,these,rstb_1924_0008.txt,txt_rstb
"with the pars superior. These facts are not revealed, however, by",these,rstb_1924_0008.txt,txt_rstb
small northerly current. These observational facts agree well with fig. 7.,these,rsta_1924_0005.txt,txt_rsta
facilitated by the body of facts expressed in these curves. Previous,these,rstb_1925_0003.txt,txt_rstb
"by Krpston. Taking all these facts into consideration, it seems highly",these,rstb_1927_0004.txt,txt_rstb
the light of these new facts shows that very probably the,these,rstb_1927_0004.txt,txt_rstb
cells of Type II. These facts demonstrate that the function of,these,rstb_1927_0008.txt,txt_rstb
"these { Know ron (19%). facts (Letter, April, 1924). See also",these,rstb_1927_0002.txt,txt_rstb
réswmé of these and other facts is given by MULLIKEN in,these,rsta_1927_0005.txt,txt_rsta
"a,,=«'’n’. In Table IX these facts are illus- trated : A”",these,rsta_1927_0005.txt,txt_rsta
these air-breathing fishes the following facts should be carefully noticed :—,these,rstb_1928_0003.txt,txt_rstb
intrasclerotomic (= intervertebral) position. These facts explain the paired character of,these,rstb_1928_0006.txt,txt_rstb
Larus and 8-day Struthio. These facts suggest that both components (inter-,these,rstb_1928_0006.txt,txt_rstb
unintelligibility. Tn view of these facts we seem thoroughly justified in,these,rstb_1928_0002.txt,txt_rstb
using an index law. These facts illustrate the great importance of,these,rsta_1928_0009.txt,txt_rsta
"(loc. cit.) states, “ These facts suggest initial heterospory, but they",these,rstb_1929_0001.txt,txt_rstb
cells as in Clepsydropsis. These facts suggest that the organ may,these,rstb_1929_0001.txt,txt_rstb
again less in quantity. These facts point to the conclusion that,these,rstb_1929_0006.txt,txt_rstb
in that vicinity. If these facts form a basis for judg-,these,rstb_1929_0004.txt,txt_rstb
"$’,4 and Q. From these facts we deduce the follow- ing:",these,rsta_1929_0008.txt,txt_rsta
ay ‘Making use of these facts we see that the variable,these,rsta_1929_0002.txt,txt_rsta
that a reason for these facts is to be found in,these,rsta_1929_0001.txt,txt_rsta
2). A reason for these facts is to be found in,these,rsta_1929_0001.txt,txt_rsta
may be answered that the facts are confined to the diagnoses,are,rstb_1920_0004.txt,txt_rstb
"in the Cretaceous Cheilostomes, the facts are as follows. The skeletal",are,rstb_1920_0004.txt,txt_rstb
"Cyclotosaurus in which genus the facts are not known, they do",are,rstb_1920_0001.txt,txt_rstb
"Eryops, so far as the facts are shown. Laceocephalus is intermediate",are,rstb_1920_0001.txt,txt_rstb
to the nutrition they receive—the facts are indeed to the contrary.,are,rstb_1920_0002.txt,txt_rstb
equally in accordance with the facts that are at present available.,are,rstb_1920_0002.txt,txt_rstb
it is believed that the facts already known are here first,are,rstb_1920_0010.txt,txt_rstb
clean plane of cleavage. “These facts are suggestive. The crystals here,are,rsta_1920_0008.txt,txt_rsta
"was based, are incorrect. These facts need not be referred to",are,rstb_1921_0002.txt,txt_rstb
to the same conclusion. These facts about Podocarpus are not here,are,rstb_1921_0007.txt,txt_rstb
Miss AASE (1915) has published facts which are of value in,are,rstb_1921_0007.txt,txt_rstb
"drawn in illustration of the facts observed are treated rather diagrammatically,",are,rstb_1921_0008.txt,txt_rstb
"various angles, and the observed facts are compared with what would",are,rsta_1921_0011.txt,txt_rsta
usually very small. All these facts are evidently in complete agreement,are,rsta_1921_0006.txt,txt_rsta
"OF There are therefore two facts to explain. First, the existence",are,rsta_1922_0004.txt,txt_rsta
and in its absence. The facts are the direct converse of,are,rstb_1923_0006.txt,txt_rstb
Blood at Rest. Whilst the facts given above are a mere,are,rstb_1923_0008.txt,txt_rstb
"is evident that, if the facts are as I have stated",are,rstb_1924_0007.txt,txt_rstb
purely anatomical character of the facts upon which they are based.,are,rstb_1924_0007.txt,txt_rstb
"with the pars superior. These facts are not revealed, however, by",are,rstb_1924_0008.txt,txt_rstb
"one can judge from the facts ascertained, there are in Lophius",are,rstb_1927_0001.txt,txt_rstb
am convinced that until more facts are available we cannot overcome,are,rstb_1927_0002.txt,txt_rstb
"a,,=«'’n’. In Table IX these facts are illus- trated : A”",are,rsta_1927_0005.txt,txt_rsta
the parent stem. ‘These are facts of importance in a reconstruction,are,rstb_1929_0001.txt,txt_rstb
"axis. But now that the facts are known, a symmetrical disposition",are,rstb_1929_0001.txt,txt_rstb
If Sapm’s interpretation of the facts of the early ontogeny are,are,rstb_1929_0006.txt,txt_rstb
A STELLAR ATMOSPHERE. The observed facts are that hydrogen shows a,are,rsta_1929_0010.txt,txt_rsta
the result does not represent facts when weak fields are employed.,are,rsta_1929_0002.txt,txt_rsta
may afford against another. The facts seem to indicate that this,that,rstb_1920_0003.txt,txt_rstb
may be answered that the facts are confined to the diagnoses,that,rstb_1920_0004.txt,txt_rstb
is indicated by the following facts :— 1. That a single,that,rstb_1920_0001.txt,txt_rstb
"many, and probably more. The facts recorded above suggest that the",that,rstb_1920_0001.txt,txt_rstb
equally in accordance with the facts that are at present available.,that,rstb_1920_0002.txt,txt_rstb
it is believed that the facts already known are here first,that,rstb_1920_0010.txt,txt_rstb
"the foregoing considerations, and of facts that will appear during 422",that,rstb_1920_0010.txt,txt_rstb
in expressing and co-ordinating the facts in a scheme that adequately,that,rstb_1921_0008.txt,txt_rstb
"close, having regard to the facts that (i.) the linear law",that,rsta_1922_0008.txt,txt_rsta
"to experimental error, the main facts stand out: (1) that there",that,rstb_1923_0008.txt,txt_rstb
pointed out that the observed facts might be met on the,that,rstb_1923_0008.txt,txt_rstb
just described establish the following facts :— 1. That the specialised,that,rstb_1924_0001.txt,txt_rstb
"of Trachinus draco, establishes the facts that the venom is both",that,rstb_1924_0001.txt,txt_rstb
"liane stem structure, then other facts support the hypothesis that the",that,rstb_1924_0004.txt,txt_rstb
"is concerned, With the main facts in hand, it appears that",that,rstb_1924_0005.txt,txt_rstb
hardly any wear. From these facts it seems most probable that,that,rstb_1924_0009.txt,txt_rstb
"origin and distribution, . These facts suggest that the * It",that,rstb_1924_0008.txt,txt_rstb
lies not only in the facts that for a fine division,that,rstb_1925_0003.txt,txt_rstb
also remark that the essential facts shown in the section of,that,rstb_1925_0005.txt,txt_rstb
the light of these new facts shows that very probably the,that,rstb_1927_0004.txt,txt_rstb
it is possible that certain facts recorded by Frrcuson (5) in,that,rstb_1927_0001.txt,txt_rstb
cells of Type II. These facts demonstrate that the function of,that,rstb_1927_0008.txt,txt_rstb
those of extrinsic fibres. The facts that the neurones of Type,that,rstb_1927_0008.txt,txt_rstb
am convinced that until more facts are available we cannot overcome,that,rstb_1927_0002.txt,txt_rstb
use being made of the facts that the law of energy,that,rsta_1927_0002.txt,txt_rsta
"appear then from, the observed facts that the frequency gradient associated",that,rstb_1928_0001.txt,txt_rstb
negative or positive correlation. The facts that plants of moist habitats,that,rstb_1928_0001.txt,txt_rstb
Larus and 8-day Struthio. These facts suggest that both components (inter-,that,rstb_1928_0006.txt,txt_rstb
"conclusion, then, to which the facts seem to point is that",that,rstb_1928_0002.txt,txt_rstb
secondary positive pulse. Thus the facts that the portion of curve,that,rsta_1928_0002.txt,txt_rsta
"axis. But now that the facts are known, a symmetrical disposition",that,rstb_1929_0001.txt,txt_rstb
cells as in Clepsydropsis. These facts suggest that the organ may,that,rstb_1929_0001.txt,txt_rstb
again less in quantity. These facts point to the conclusion that,that,rstb_1929_0006.txt,txt_rstb
Gaupp’s theory would fit the facts provided that a satisfactory explanation,that,rstb_1929_0009.txt,txt_rstb
in that vicinity. If these facts form a basis for judg-,that,rstb_1929_0004.txt,txt_rstb
"is generally conceded, then the facts presented might hint that the",that,rstb_1929_0004.txt,txt_rstb
A STELLAR ATMOSPHERE. The observed facts are that hydrogen shows a,that,rsta_1929_0010.txt,txt_rsta
ay ‘Making use of these facts we see that the variable,that,rsta_1929_0002.txt,txt_rsta
that a reason for these facts is to be found in,that,rsta_1929_0001.txt,txt_rsta
equally in accordance with the facts that are at present available.,with,rstb_1920_0002.txt,txt_rstb
less in accord with observed facts than the one indicated above.,with,rstb_1920_0010.txt,txt_rstb
in general agreement with the facts derived from the microscopic appearances,with,rstb_1921_0002.txt,txt_rstb
"various angles, and the observed facts are compared with what would",with,rsta_1921_0011.txt,txt_rsta
theory will best describe the facts ? With regard to the,with,rstb_1923_0002.txt,txt_rstb
such general accordance with the facts should have sprung to birth,with,rsta_1923_0006.txt,txt_rsta
"first experiment with celluloid, two facts immediately became apparent. (1) After",with,rsta_1923_0003.txt,txt_rsta
"is concerned, With the main facts in hand, it appears that",with,rstb_1924_0005.txt,txt_rstb
"with the pars superior. These facts are not revealed, however, by",with,rstb_1924_0008.txt,txt_rstb
small northerly current. These observational facts agree well with fig. 7.,with,rsta_1924_0005.txt,txt_rsta
"at ot = 90°, which facts agree well with figs. 4",with,rsta_1924_0005.txt,txt_rsta
"is capable of representing the facts with considerable precision, more closely",with,rstb_1925_0002.txt,txt_rstb
but when taken with the facts of association they justify us,with,rstb_1925_0006.txt,txt_rstb
the foliage. But with the facts at our disposal it is,with,rstb_1929_0001.txt,txt_rstb
on all fours with the facts observed in greater detail in,with,rstb_1929_0006.txt,txt_rstb
Vessel System. With only the facts furnished by my investigation of,with,rstb_1929_0006.txt,txt_rstb
"think, at variance with the facts revealed by comparative anatomy and",with,rstb_1929_0006.txt,txt_rstb
effect will be equalised. The facts relating to the epidemic of,to,rstb_1920_0003.txt,txt_rstb
may afford against another. The facts seem to indicate that this,to,rstb_1920_0003.txt,txt_rstb
may be answered that the facts are confined to the diagnoses,to,rstb_1920_0004.txt,txt_rstb
in order to present our facts in an intelligible order. When,to,rstb_1920_0004.txt,txt_rstb
"further theory to make our facts more intelligible. Now, generally speaking,",to,rstb_1920_0004.txt,txt_rstb
allows me to add some facts to those previously recorded. The,to,rstb_1920_0001.txt,txt_rstb
"advanced to account for the facts observed. A provisional hypothesis, based",to,rstb_1920_0002.txt,txt_rstb
to the nutrition they receive—the facts are indeed to the contrary.,to,rstb_1920_0002.txt,txt_rstb
to bring out the morphogenetic facts clearly. Whether this was due,to,rstb_1920_0010.txt,txt_rstb
Such a representation of the facts has led to the recognition,to,rsta_1920_0008.txt,txt_rsta
further research of the new facts brought to light in the,to,rsta_1920_0010.txt,txt_rsta
the power of the new facts to guide a search even,to,rsta_1920_0010.txt,txt_rsta
"has been possible, from the facts for wood, to frame a",to,rstb_1921_0002.txt,txt_rstb
to attempt to relate the facts of the mechanical properties of,to,rstb_1921_0002.txt,txt_rstb
"was based, are incorrect. These facts need not be referred to",to,rstb_1921_0002.txt,txt_rstb
"use, to some extent, the facts described above in support of",to,rstb_1921_0002.txt,txt_rstb
conception necessary to explain the facts described above for wood. It,to,rstb_1921_0002.txt,txt_rstb
almost solely in relation to facts derived from the study of,to,rstb_1921_0002.txt,txt_rstb
"its point of origin. Certain facts relevant to the foregoing must,",to,rstb_1921_0003.txt,txt_rstb
"it now stands. As the facts present themselves to me, avenues",to,rstb_1921_0003.txt,txt_rstb
to the oxygen consumed. The facts seem to us capable of,to,rstb_1921_0001.txt,txt_rstb
to the same conclusion. These facts about Podocarpus are not here,to,rstb_1921_0007.txt,txt_rstb
after Porrer’s publication appeared few facts were added to the existing,to,rstb_1921_0009.txt,txt_rstb
"close, having regard to the facts that (i.) the linear law",to,rsta_1922_0008.txt,txt_rsta
of such compensation of actual facts to explain a theoretical formula,to,rsta_1922_0002.txt,txt_rsta
"OF There are therefore two facts to explain. First, the existence",to,rsta_1922_0004.txt,txt_rsta
"stages, when the paucity of facts gives freer play to the",to,rstb_1923_0004.txt,txt_rstb
"now, of course, some definite facts to go upon, We knew",to,rstb_1923_0004.txt,txt_rstb
theory will best describe the facts ? With regard to the,to,rstb_1923_0002.txt,txt_rstb
and (p. 385) :—‘“ These facts seem to me to establish,to,rstb_1923_0005.txt,txt_rstb
"to experimental error, the main facts stand out: (1) that there",to,rstb_1923_0008.txt,txt_rstb
to put upon the above facts seems to be the following,to,rstb_1923_0008.txt,txt_rstb
such general accordance with the facts should have sprung to birth,to,rsta_1923_0006.txt,txt_rsta
same nature occur. All these facts lead up to the inevitable,to,rstb_1924_0004.txt,txt_rstb
"the main xylem ring), other facts have come to light which",to,rstb_1924_0004.txt,txt_rstb
an embryo Trichosurus. All these facts appear sufticiently conclusive to justify,to,rstb_1924_0008.txt,txt_rstb
of Asterorylon and Lycopodium. The facts before us appear fully to,to,rstb_1925_0004.txt,txt_rstb
of the micropylar tube. Such facts seem to point rather to,to,rstb_1925_0006.txt,txt_rstb
"canals, and also of the facts stated as to the evolutionary",to,rstb_1926_0003.txt,txt_rstb
very many new and striking facts to our knowledge of the,to,rstb_1926_0006.txt,txt_rstb
"in consideration of some additional facts to be demonstrated below, it",to,rstb_1927_0004.txt,txt_rstb
membranes did not add any facts to those published by Naruorst.,to,rstb_1927_0002.txt,txt_rstb
to add anything to the facts already published ; the length,to,rstb_1927_0002.txt,txt_rstb
enable us to discover any facts in favour of a geological,to,rstb_1927_0002.txt,txt_rstb
as only approximations to the facts of geographical distribution. Thus a,to,rstb_1927_0002.txt,txt_rstb
"conclusion, then, to which the facts seem to point is that",to,rstb_1928_0002.txt,txt_rstb
changed by 0-6 u. The facts appeared to point to some,to,rsta_1928_0007.txt,txt_rsta
a view suggested by certain facts presently to be described. (ii),to,rstb_1929_0001.txt,txt_rstb
question of specific identity the facts do not seem to conflict,to,rstb_1929_0001.txt,txt_rstb
"first place, to confirm the facts recorded in Lophius in some",to,rstb_1929_0006.txt,txt_rstb
again less in quantity. These facts point to the conclusion that,to,rstb_1929_0006.txt,txt_rstb
Clypeastroida ” (p. 481). Two facts tend to support Hawxins’ view,to,rstb_1929_0005.txt,txt_rstb
the Spatangoids. Two embryo- logical facts seem to be in keeping,to,rstb_1929_0005.txt,txt_rstb
(dry flora). H Two significant facts come to light:—(q) pairs of,to,rstb_1929_0003.txt,txt_rstb
plate is formed- 8 ‘These facts led Gaver to the conclusion,to,rstb_1929_0009.txt,txt_rstb
"chance to give the old facts new relation- ships. This monograph,",to,rstb_1929_0004.txt,txt_rstb
"fully-viewed atoms, then the observed facts correspond to a kind of",to,rsta_1929_0010.txt,txt_rsta
that a reason for these facts is to be found in,to,rsta_1929_0001.txt,txt_rsta
2). A reason for these facts is to be found in,to,rsta_1929_0001.txt,txt_rsta
effect will be equalised. The facts relating to the epidemic of,to,rstb_1920_0003.txt,txt_rstb
may afford against another. The facts seem to indicate that this,to,rstb_1920_0003.txt,txt_rstb
may be answered that the facts are confined to the diagnoses,to,rstb_1920_0004.txt,txt_rstb
in order to present our facts in an intelligible order. When,to,rstb_1920_0004.txt,txt_rstb
"further theory to make our facts more intelligible. Now, generally speaking,",to,rstb_1920_0004.txt,txt_rstb
allows me to add some facts to those previously recorded. The,to,rstb_1920_0001.txt,txt_rstb
"advanced to account for the facts observed. A provisional hypothesis, based",to,rstb_1920_0002.txt,txt_rstb
to the nutrition they receive—the facts are indeed to the contrary.,to,rstb_1920_0002.txt,txt_rstb
to bring out the morphogenetic facts clearly. Whether this was due,to,rstb_1920_0010.txt,txt_rstb
Such a representation of the facts has led to the recognition,to,rsta_1920_0008.txt,txt_rsta
further research of the new facts brought to light in the,to,rsta_1920_0010.txt,txt_rsta
the power of the new facts to guide a search even,to,rsta_1920_0010.txt,txt_rsta
"has been possible, from the facts for wood, to frame a",to,rstb_1921_0002.txt,txt_rstb
to attempt to relate the facts of the mechanical properties of,to,rstb_1921_0002.txt,txt_rstb
"was based, are incorrect. These facts need not be referred to",to,rstb_1921_0002.txt,txt_rstb
"use, to some extent, the facts described above in support of",to,rstb_1921_0002.txt,txt_rstb
conception necessary to explain the facts described above for wood. It,to,rstb_1921_0002.txt,txt_rstb
almost solely in relation to facts derived from the study of,to,rstb_1921_0002.txt,txt_rstb
"its point of origin. Certain facts relevant to the foregoing must,",to,rstb_1921_0003.txt,txt_rstb
"it now stands. As the facts present themselves to me, avenues",to,rstb_1921_0003.txt,txt_rstb
to the oxygen consumed. The facts seem to us capable of,to,rstb_1921_0001.txt,txt_rstb
to the same conclusion. These facts about Podocarpus are not here,to,rstb_1921_0007.txt,txt_rstb
after Porrer’s publication appeared few facts were added to the existing,to,rstb_1921_0009.txt,txt_rstb
"close, having regard to the facts that (i.) the linear law",to,rsta_1922_0008.txt,txt_rsta
of such compensation of actual facts to explain a theoretical formula,to,rsta_1922_0002.txt,txt_rsta
"OF There are therefore two facts to explain. First, the existence",to,rsta_1922_0004.txt,txt_rsta
"stages, when the paucity of facts gives freer play to the",to,rstb_1923_0004.txt,txt_rstb
"now, of course, some definite facts to go upon, We knew",to,rstb_1923_0004.txt,txt_rstb
theory will best describe the facts ? With regard to the,to,rstb_1923_0002.txt,txt_rstb
and (p. 385) :—‘“ These facts seem to me to establish,to,rstb_1923_0005.txt,txt_rstb
"to experimental error, the main facts stand out: (1) that there",to,rstb_1923_0008.txt,txt_rstb
to put upon the above facts seems to be the following,to,rstb_1923_0008.txt,txt_rstb
such general accordance with the facts should have sprung to birth,to,rsta_1923_0006.txt,txt_rsta
same nature occur. All these facts lead up to the inevitable,to,rstb_1924_0004.txt,txt_rstb
"the main xylem ring), other facts have come to light which",to,rstb_1924_0004.txt,txt_rstb
an embryo Trichosurus. All these facts appear sufticiently conclusive to justify,to,rstb_1924_0008.txt,txt_rstb
of Asterorylon and Lycopodium. The facts before us appear fully to,to,rstb_1925_0004.txt,txt_rstb
of the micropylar tube. Such facts seem to point rather to,to,rstb_1925_0006.txt,txt_rstb
"canals, and also of the facts stated as to the evolutionary",to,rstb_1926_0003.txt,txt_rstb
very many new and striking facts to our knowledge of the,to,rstb_1926_0006.txt,txt_rstb
"in consideration of some additional facts to be demonstrated below, it",to,rstb_1927_0004.txt,txt_rstb
membranes did not add any facts to those published by Naruorst.,to,rstb_1927_0002.txt,txt_rstb
to add anything to the facts already published ; the length,to,rstb_1927_0002.txt,txt_rstb
enable us to discover any facts in favour of a geological,to,rstb_1927_0002.txt,txt_rstb
as only approximations to the facts of geographical distribution. Thus a,to,rstb_1927_0002.txt,txt_rstb
"conclusion, then, to which the facts seem to point is that",to,rstb_1928_0002.txt,txt_rstb
changed by 0-6 u. The facts appeared to point to some,to,rsta_1928_0007.txt,txt_rsta
a view suggested by certain facts presently to be described. (ii),to,rstb_1929_0001.txt,txt_rstb
question of specific identity the facts do not seem to conflict,to,rstb_1929_0001.txt,txt_rstb
"first place, to confirm the facts recorded in Lophius in some",to,rstb_1929_0006.txt,txt_rstb
again less in quantity. These facts point to the conclusion that,to,rstb_1929_0006.txt,txt_rstb
Clypeastroida ” (p. 481). Two facts tend to support Hawxins’ view,to,rstb_1929_0005.txt,txt_rstb
the Spatangoids. Two embryo- logical facts seem to be in keeping,to,rstb_1929_0005.txt,txt_rstb
(dry flora). H Two significant facts come to light:—(q) pairs of,to,rstb_1929_0003.txt,txt_rstb
plate is formed- 8 ‘These facts led Gaver to the conclusion,to,rstb_1929_0009.txt,txt_rstb
"chance to give the old facts new relation- ships. This monograph,",to,rstb_1929_0004.txt,txt_rstb
"fully-viewed atoms, then the observed facts correspond to a kind of",to,rsta_1929_0010.txt,txt_rsta
that a reason for these facts is to be found in,to,rsta_1929_0001.txt,txt_rsta
2). A reason for these facts is to be found in,to,rsta_1929_0001.txt,txt_rsta
282 / 218 When these facts had been ascertained the obvious,the,rstb_1920_0003.txt,txt_rstb
effect will be equalised. The facts relating to the epidemic of,the,rstb_1920_0003.txt,txt_rstb
may afford against another. The facts seem to indicate that this,the,rstb_1920_0003.txt,txt_rstb
may be answered that the facts are confined to the diagnoses,the,rstb_1920_0004.txt,txt_rstb
"in the Cretaceous Cheilostomes, the facts are as follows. The skeletal",the,rstb_1920_0004.txt,txt_rstb
(39) made out some further facts about the ribs and lower,the,rstb_1920_0001.txt,txt_rstb
allows me to add some facts to those previously recorded. The,the,rstb_1920_0001.txt,txt_rstb
"Cyclotosaurus in which genus the facts are not known, they do",the,rstb_1920_0001.txt,txt_rstb
is indicated by the following facts :— 1. That a single,the,rstb_1920_0001.txt,txt_rstb
"Eryops, so far as the facts are shown. Laceocephalus is intermediate",the,rstb_1920_0001.txt,txt_rstb
"a detailed description of the facts in Amblystoma, has recently been",the,rstb_1920_0001.txt,txt_rstb
"many, and probably more. The facts recorded above suggest that the",the,rstb_1920_0001.txt,txt_rstb
"advanced to account for the facts observed. A provisional hypothesis, based",the,rstb_1920_0002.txt,txt_rstb
to the nutrition they receive—the facts are indeed to the contrary.,the,rstb_1920_0002.txt,txt_rstb
equally in accordance with the facts that are at present available.,the,rstb_1920_0002.txt,txt_rstb
parasitaire ” explain the observed facts of the phenomenon. The Mendelian,the,rstb_1920_0002.txt,txt_rstb
it is believed that the facts already known are here first,the,rstb_1920_0010.txt,txt_rstb
to bring out the morphogenetic facts clearly. Whether this was due,the,rstb_1920_0010.txt,txt_rstb
less in accord with observed facts than the one indicated above.,the,rstb_1920_0010.txt,txt_rstb
"the foregoing considerations, and of facts that will appear during 422",the,rstb_1920_0010.txt,txt_rstb
"can be ascertained from the facts of geological distribution, the Pygasteridze",the,rstb_1920_0010.txt,txt_rstb
"possible, in the light of facts and morphogenetic tendencies as yet",the,rstb_1920_0010.txt,txt_rstb
Such a representation of the facts has led to the recognition,the,rsta_1920_0008.txt,txt_rsta
in indirect deduction from experimental facts which record the change of,the,rsta_1920_0008.txt,txt_rsta
clean plane of cleavage. “These facts are suggestive. The crystals here,the,rsta_1920_0008.txt,txt_rsta
further research of the new facts brought to light in the,the,rsta_1920_0010.txt,txt_rsta
the power of the new facts to guide a search even,the,rsta_1920_0010.txt,txt_rsta
