Context,Word,File,Directory
"Ross, or SmiTH, the leading facts recorded in it. To one",the,rstl_1842_0008.txt,txt_rstl
saw the objects in question. Facts observed in the Coagulation of,the,rstl_1842_0008.txt,txt_rstl
"explained, I believe, by the facts above mentioned: as well as",the,rstl_1842_0008.txt,txt_rstl
of the physical sciences the facts of observation and experiment have,the,rstl_1843_0014.txt,txt_rstl
"lead, to some new valuable facts or natural relations. Reviewing the",the,rstl_1843_0009.txt,txt_rstl
relation is confirmed by the facts detailed in the paper of,the,rstl_1843_0009.txt,txt_rstl
the whole tenor of voltaic facts and general experience. Another point,the,rstl_1843_0009.txt,txt_rstl
traced (in addition to the facts brought forward in the notes,the,rstl_1843_0002.txt,txt_rstl
"baryta, and others, confirm the facts already stated ; viz. that",the,rstl_1843_0003.txt,txt_rstl
"by publication some of the facts which I also have obtained,",the,rstl_1843_0004.txt,txt_rstl
arranging in one system numerous facts connected with the reflected movements,the,rstl_1843_0013.txt,txt_rstl
leads us to 8ome important facts in reference to the means,the,rstl_1843_0013.txt,txt_rstl
the abdominal nervous cord. The facts ascertained by Mr. Lonp were,the,rstl_1843_0013.txt,txt_rstl
with the orifices. From these facts it would appear that the,the,rstl_1843_0013.txt,txt_rstl
"the attention of physiologists, certain facts appear, nevertheless, to have been",the,rstl_1843_0013.txt,txt_rstl
divisions of Myriapoda. These additional facts fully accord with the already,the,rstl_1843_0013.txt,txt_rstl
and liver in the latter; facts which I regard as new,the,rstl_1843_0013.txt,txt_rstl
the Royal Society. Myriapoda. The facts already ascertained respecting the periodical,the,rstl_1844_0009.txt,txt_rstl
"I was examining it, the facts were still more satisfac- tory.",the,rstl_1844_0009.txt,txt_rstl
"with others showing the same facts in F. 15,—G. N., Sept.",the,rstl_1844_0009.txt,txt_rstl
"communicated it was remodelled, the facts remaining the same.—E. W. EXPLANATION",the,rstl_1844_0011.txt,txt_rstl
incorrect. 2. The preceding negative facts are not without their value,the,rstl_1844_0003.txt,txt_rstl
"the whole tenor of voltaic facts and genera] experience.” 24, I",the,rstl_1844_0003.txt,txt_rstl
we have before us certain facts connected with the action of,the,rstl_1844_0003.txt,txt_rstl
"'the Cephalopodal organization, the additional facts afforded by the well-preserved specimens",the,rstl_1844_0006.txt,txt_rstl
and Sepia: and the additional facts which we have now unexpectedly,the,rstl_1844_0006.txt,txt_rstl
"certain thermal effect, the general facts now established will not be",the,rstl_1844_0002.txt,txt_rstl
"exclusion of the anion. These facts are, we believe, irreconcilable with",the,rstl_1844_0001.txt,txt_rstl
"fix the attention. These are facts which, when the true physical",the,rstl_1844_0007.txt,txt_rstl
place distinctly before our minds facts of which the explanation mnst,the,rstl_1844_0007.txt,txt_rstl
"differ 80 widely from the facts in the southern latitudes, shows",the,rstl_1844_0007.txt,txt_rstl
From the sum of these facts I am again forced to,the,rstl_1845_0012.txt,txt_rstl
of the happy temperate mean.:..Some facts which I sball have presently,the,rstl_1845_0014.txt,txt_rstl
the urine alkaline; and from facts which have been stated to,the,rstl_1845_0015.txt,txt_rstl
"From the whole of these facts I was led to conclude,",the,rstl_1845_0013.txt,txt_rstl
and the explanation of the facts is as follows :— Whatever,the,rstl_1845_0013.txt,txt_rstl
described a long series of facts relative to the cireumstances that,the,rstl_1845_0013.txt,txt_rstl
simplest interpretation of all the facts discovered by myself ; it,the,rstl_1845_0011.txt,txt_rstl
however to some of the facts connected with observations at different,the,rstl_1845_0010.txt,txt_rstl
easily accounted for by the facts already stated of irregular composition,the,rstl_1845_0006.txt,txt_rstl
upon the truth of the facts on which the doctrine of,the,rstl_1845_0007.txt,txt_rstl
"may be countenanced by the facts detailed in the text, but",the,rstl_1845_0007.txt,txt_rstl
present to deduce from the facts which I have laid before,the,rstl_1845_0007.txt,txt_rstl
"general tenor of the preceding facts and observations, to maintain with",the,rstl_1845_0007.txt,txt_rstl
this instance adopted. Now the facts and observations detailed in the,the,rstl_1845_0007.txt,txt_rstl
"the development of the principal facts of diurnal tide. Finally, that",the,rstl_1845_0001.txt,txt_rstl
"formed :— From the ordinary facts of the tides, it seems",the,rstl_1845_0001.txt,txt_rstl
"great, addition made to the facts and considerations which tend to",the,rstl_1846_0001.txt,txt_rstl
tween the poles. The new facts give not a mere negative,the,rstl_1846_0003.txt,txt_rstl
"equatorial position : and the facts with regard to bodies generally,",the,rstl_1846_0003.txt,txt_rstl
could be lowered sufficiently. The facts just described appear to me,the,rstl_1846_0004.txt,txt_rstl
"be drawn from all the facts described in this paper, I",the,rstl_1846_0004.txt,txt_rstl
"considerations. 2417. Such are the facts which, in addition to those",the,rstl_1846_0004.txt,txt_rstl
to the bearing of the facts I have now related on,the,rstl_1846_0005.txt,txt_rstl
"T have suggested of the facts described be '> correct, and",the,rstl_1846_0024.txt,txt_rstl
"and the bearing of the facts now related, to dis- sent",the,rstl_1846_0025.txt,txt_rstl
"secrefory portion+. From all the facts which have been now related,",the,rstl_1846_0025.txt,txt_rstl
reduced to the two following facts :— 1. 'The electric discharge,the,rstl_1846_0026.txt,txt_rstl
"say, the greatest number of facts possible from the smallest number",the,rstl_1846_0026.txt,txt_rstl
the simplest and most elementary facts in s0 yast a field,the,rstl_1846_0026.txt,txt_rstl
see the application of these facts to the vocal apparatus. We,the,rstl_1846_0028.txt,txt_rstl
were expiratory. These were the facts ; | I could not,the,rstl_1846_0027.txt,txt_rstl
to 089 inch. As the facts shown by these observations are,the,rstl_1846_0020.txt,txt_rstl
vessels in the neighbourhood. These facts were demonstrated by preparations at,the,rstl_1846_0017.txt,txt_rstl
collections of Ganglia.—From the foregoing facts it will appear that a,the,rstl_1846_0017.txt,txt_rstl
a correct statement of the facts *. My attention was at,the,rstl_1846_0013.txt,txt_rstl
play of forces. The following facts appear to me quite conclu-,the,rstl_1846_0013.txt,txt_rstl
The following are a few facts which I have collected on,the,rstl_1846_0013.txt,txt_rstl
present ; the seemingly opposed facts showing the glacier to be,the,rstl_1846_0015.txt,txt_rstl
"are to investigations into the facts of terrestrial mag- netism, I",the,rstl_1846_0018.txt,txt_rstl
"a sulphate, &c. : the facts stated are suffi- cient to",the,rstl_1846_0012.txt,txt_rstl
"is generated. 5 From the facts above stated, it appears that",the,rstl_1846_0012.txt,txt_rstl
"refresbing his memory. The real facts are, that on the 6th",the,rstl_1846_0008.txt,txt_rstl
of a certain number of facts lately discovered on the electricity,the,rstl_1847_0014.txt,txt_rstl
of expo- sition of the facts in this memoir will be,the,rstl_1847_0014.txt,txt_rstl
"the entire organ, These same facts are verified also by including",the,rstl_1847_0014.txt,txt_rstl
This Jast and the preceding facts establish the connection between the,the,rstl_1847_0014.txt,txt_rstl
"Virginia, adding several other analogous facts confirming the theory of a",the,rstl_1847_0017.txt,txt_rstl
fixation of mercurial vapour. The facts pointed out by M. Gavpin,the,rstl_1847_0017.txt,txt_rstl
I would here recall the facts discovered by M. Loxcer and,the,rstl_1847_0013.txt,txt_rstl
"July and August. From the facts here brought forward, it may",the,rstl_1847_0006.txt,txt_rstl
"there may be in the facts I have communicated, is the",the,rstl_1847_0002.txt,txt_rstl
"as I do to the facts themselves, though I consider it",the,rstl_1847_0002.txt,txt_rstl
"Although, as applied to the facts detailed, I attached no further",the,rstl_1847_0002.txt,txt_rstl
and Fovcavrr observed some remarkable facts of the same kind on,the,rstl_1847_0004.txt,txt_rstl
of a sufficient number of facts to decide on the direction,the,rstl_1847_0009.txt,txt_rstl
"the combustible gases, but the facts are far too few to",the,rstl_1847_0001.txt,txt_rstl
"The very singular and unexpected facts now detailed, merit attention and",the,rstl_1847_0011.txt,txt_rstl
pletely set aside by the facts and arguments which have been,the,rstl_1848_0019.txt,txt_rstl
"probable, has by the same facts and arguments been proved to",the,rstl_1848_0019.txt,txt_rstl
lowing experiment containing the principal facts worthy of notice will be,the,rstl_1848_0017.txt,txt_rstl
and the bearing of the facts described on the still mooted,the,rstl_1848_0012.txt,txt_rstl
"4, a.]* According to the facts at present known, the chambered",the,rstl_1848_0012.txt,txt_rstl
the erystalline mineral matter. The facts above described appear to me,the,rstl_1848_0012.txt,txt_rstl
very close approximation to the facts of nature. There is a,the,rstl_1848_0008.txt,txt_rstl
exactly the reverse of the facts which take place at the,the,rstl_1848_0008.txt,txt_rstl
as to include the following facts of observation :— (1.) The,the,rstl_1848_0001.txt,txt_rstl
irregularity or complexity of the facts themselves. With regard to the,the,rstl_1848_0001.txt,txt_rstl
":—the collec- tion of the facts then known, given in the",the,rstl_1848_0001.txt,txt_rstl
combines these and many other facts respecting the tides into a,the,rstl_1848_0001.txt,txt_rstl
"a given point belonged. The facts that I have stated lead,",the,rstl_1849_0021.txt,txt_rstl
"District, as far as the facts then ascertained would permit. I",the,rstl_1849_0017.txt,txt_rstl
"about three years ago. The facts previously on record, with few",the,rstl_1849_0017.txt,txt_rstl
conelusions are deducible from the facts stated in the pre- ceding,the,rstl_1849_0022.txt,txt_rstl
quoted. The following are the facts relative to the nervous supply,the,rstl_1849_0003.txt,txt_rstl
to ganoid seales.” The new facts brought forward by Professor Owex,the,rstl_1849_0023.txt,txt_rstl
hope and believe that the facts about to be brought forward,the,rstl_1849_0023.txt,txt_rstl
"THE MICROSCOPIC STRUCTURE OP THE facts is, that Mr. Quzekerr's objection",the,rstl_1849_0023.txt,txt_rstl
pass through the tissue. These facts of course do away with,the,rstl_1849_0023.txt,txt_rstl
the true explanation of the facts which have been thus pointed,the,rstl_1849_0012.txt,txt_rstl
"been thus pointed out, the facts themselves are highly deserving of",the,rstl_1849_0012.txt,txt_rstl
very desirable to test these facts by further experiments. (47.) The,the,rstl_1850_0035.txt,txt_rstl
which the accuracy of the facts stated in this paper are,the,rstl_1850_0027.txt,txt_rstl
and the accumulation of various facts relative to the existence of,the,rstl_1850_0037.txt,txt_rstl
of conducting electricity. All the facts which have been adduced in,the,rstl_1850_0037.txt,txt_rstl
and may instance the following facts as examples. 1. According to,the,rstl_1850_0037.txt,txt_rstl
animals. A comparison of the facts relating to the geographical distribution,the,rstl_1850_0037.txt,txt_rstl
"is no less remarkable, The facts determined by the experiments of",the,rstl_1850_0037.txt,txt_rstl
"fabric that manifests it. The facts already cited, which show how",the,rstl_1850_0037.txt,txt_rstl
"afforded by the generally admitted facts of Physiological science*, than to",the,rstl_1850_0037.txt,txt_rstl
"The conclusions drawn from the facts given are, that the Sus",the,rstl_1850_0025.txt,txt_rstl
"my *Odontography* ©, that the facts detailed in How's paper were",the,rstl_1850_0025.txt,txt_rstl
and to add the additional facts and illustrations of the peculiarities,the,rstl_1850_0025.txt,txt_rstl
the ready comprehension of the facts which have been recorded by,the,rstl_1850_0025.txt,txt_rstl
terpretation of some of the facts described in the Memoir on,the,rstl_1850_0019.txt,txt_rstl
intended to express concisely the facts described. With regard to the,the,rstl_1850_0019.txt,txt_rstl
"is generically distinetf. From the facts before us, our knowledge of",the,rstl_1850_0019.txt,txt_rstl
"the palzeontologist, since the new facts herein described tend to remove",the,rstl_1850_0019.txt,txt_rstl
in the text. + The facts dexcribed in the text are,the,rstl_1850_0019.txt,txt_rstl
draw a distinetion between two facts s0 very similar as the,the,rstl_1850_0038.txt,txt_rstl
"the impression made by these facts upon TatnaRD, who first discovered",the,rstl_1850_0038.txt,txt_rstl
the scientific conception of these facts from the electro- chemical point,the,rstl_1850_0038.txt,txt_rstl
"always present, being dissolved. These facts are contrary to the usual",the,rstl_1850_0038.txt,txt_rstl
theory of this action. The facts I have just mentioned gave,the,rstl_1850_0038.txt,txt_rstl
"may express these facts, the facts themselves are the 8ame. We",the,rstl_1850_0038.txt,txt_rstl
"part, the absence of acknowledged facts relative to the strength and",the,rstl_1850_0036.txt,txt_rstl
"wooden standards, * Several important facts and improvements in the construction",the,rstl_1850_0036.txt,txt_rstl
the purpose of collecting the facts on which are founded the,the,rstl_1850_0036.txt,txt_rstl
"24 : 16'5, From these facts it is evident that the",the,rstl_1850_0036.txt,txt_rstl
of the plates. From these facts I would infer that single,the,rstl_1850_0036.txt,txt_rstl
"strength, and exhibits several important facts in connection with the construction",the,rstl_1850_0036.txt,txt_rstl
a striking coincidence in the facts tending to establish the principle,the,rstl_1850_0036.txt,txt_rstl
"alone, it appears from the facts already recorded, that iron is",the,rstl_1850_0036.txt,txt_rstl
"which will be found the facts more in detail, and which",the,rstl_1850_0036.txt,txt_rstl
IV. we have some curious facts illustrative of the necessity and,the,rstl_1850_0036.txt,txt_rstl
"of the bars. These interesting facts are of considerable value, as",the,rstl_1850_0036.txt,txt_rstl
be negatived. Summary —From the facts described he following inferences result,the,rstl_1850_0017.txt,txt_rstl
this conclusion : and the facts on which it was based,the,rstl_1850_0011.txt,txt_rstl
is not perfectly hardened. The facts which are recorded in the,the,rstl_1850_0029.txt,txt_rstl
to the optic lobes. These facts I think are of some,the,rstl_1850_0009.txt,txt_rstl
from the great mass of facts which have now been collected,the,rstl_1850_0010.txt,txt_rstl
assist the recollection of the facts regarding the annual variation of,the,rstl_1850_0010.txt,txt_rstl
"with alkaline lyes. —From the facts which haye been previously stated,",the,rstl_1850_0003.txt,txt_rstl
"volatile organic bases. From the facts which have been now stated,",the,rstl_1850_0003.txt,txt_rstl
a synopsis of all the facts supporting the view of BerzerLws.,the,rstl_1850_0006.txt,txt_rstl
under a general view the facts acquired up to the moment,the,rstl_1850_0006.txt,txt_rstl
"as it did, upon the facts observed in the formation of",the,rstl_1850_0006.txt,txt_rstl
desirable the acquisition of additional facts in support of the position,the,rstl_1850_0006.txt,txt_rstl
in perfect harmony with the facts at pre- E 8ent in,the,rstl_1850_0006.txt,txt_rstl
"vertex to coccyx, the same facts are as plainly observed =",the,rstl_1850_0007.txt,txt_rstl
"right auricle ; but the facts seem to bear another explanation,",the,rstl_1850_0007.txt,txt_rstl
to the determination of new facts and the enlargement of my,the,rstl_1850_0001.txt,txt_rstl
the 21st of May. These facts Dr. Butsr recorded in a,the,rstl_1850_0016.txt,txt_rstl
corrections. The whole of the facts connected with the meteorology of,the,rstl_1850_0016.txt,txt_rstl
Bungalow and Cantonment Hospital. The facts show how necessary is a,the,rstl_1850_0016.txt,txt_rstl
"confirm, from European localities, the facts I have stated respecting the",the,rstl_1850_0016.txt,txt_rstl
"resolved. Notwithstanding these differences, however, facts mentioned by authors regarding the",the,rstl_1841_0017.txt,txt_rstl
"enhances the value of any facts bearing on this obscure point,",the,rstl_1841_0009.txt,txt_rstl
"preceding remarks, combined with the facts and arguments advanced in my",the,rstl_1841_0009.txt,txt_rstl
corpuscles of the blood. Those facts were of a character which,the,rstl_1841_0018.txt,txt_rstl
On a review of the facts stated in the course of,the,rstl_1841_0018.txt,txt_rstl
granules of the yelk. The facts recorded in the foregoing memoir,the,rstl_1841_0018.txt,txt_rstl
"be naturally deduced from the facts demonstrated in the foregoing dissections,—",the,rstl_1841_0015.txt,txt_rstl
'The following are the leading facts which the preceding researches upon,the,rstl_1841_0015.txt,txt_rstl
the eggs ; but the facts now about to be stated,the,rstl_1841_0012.txt,txt_rstl
entirely overlooked many most important facts in regard to the production,the,rstl_1841_0012.txt,txt_rstl
'The conclusions to which the facts detailed in this paper seem,the,rstl_1841_0012.txt,txt_rstl
entirely in accordance with the facts subse- quently ascertained respecting the,the,rstl_1841_0012.txt,txt_rstl
"the oyum. Moreover, the few facts detailed in this paper show",the,rstl_1841_0012.txt,txt_rstl
of the embryo that the facts ascertained appear to be of,the,rstl_1841_0012.txt,txt_rstl
with great difficulty that the facts connected with them are ascertained.,the,rstl_1841_0012.txt,txt_rstl
have noticed the important additional facts of the detection of the,the,rstl_1841_0012.txt,txt_rstl
"will be seen that the facts I have now to mention,",the,rstl_1841_0019.txt,txt_rstl
nucleated cells. But the other facts now men- tioned+; I believe,the,rstl_1841_0019.txt,txt_rstl
"find that, while bringing forward facts opposed to the views of",the,rstl_1841_0019.txt,txt_rstl
"all anticipated. For, although the facts observed had led me pretty",the,rstl_1841_0019.txt,txt_rstl
I in pos- ses8ion of facts connected with the process of,the,rstl_1841_0019.txt,txt_rstl
higher tribes of animals. 'These facts I had the honour of,the,rstl_1842_0014.txt,txt_rstl
"of a Postscript, some additional facts illustrative of the singular properties",the,rstl_1842_0013.txt,txt_rstl
of Extinction. 84. Many familiar facts connected with the extinction of,the,rstl_1842_0015.txt,txt_rstl
"whole, it appears from the facts and reasonings of this paper,",the,rstl_1842_0015.txt,txt_rstl
remarks founded on the foregoing facts and speculations. 1. The bile,the,rstl_1842_0005.txt,txt_rstl
subsequent figures in this Plate. Facts observed in the Formation and,the,rstl_1842_0008.txt,txt_rstl
this object and its loop. Facts observed in the Formation and,the,rstl_1842_0008.txt,txt_rstl
Insecta (a kind of Caterpillar). Facts observed in the Formation and,the,rstl_1842_0008.txt,txt_rstl
the same mode of origin. Facts observed in the Structure of,the,rstl_1842_0008.txt,txt_rstl
an investigator to record the facts he DR. MARTIN BARRY ON,the,rstl_1842_0008.txt,txt_rstl
"peared almost wanting. Should the facts recorded in this memoir, however,",the,rstl_1842_0008.txt,txt_rstl
"Ross, or SmiTH, the leading facts recorded in it. To one",the,rstl_1842_0008.txt,txt_rstl
saw the objects in question. Facts observed in the Coagulation of,the,rstl_1842_0008.txt,txt_rstl
"explained, I believe, by the facts above mentioned: as well as",the,rstl_1842_0008.txt,txt_rstl
of the physical sciences the facts of observation and experiment have,the,rstl_1843_0014.txt,txt_rstl
"lead, to some new valuable facts or natural relations. Reviewing the",the,rstl_1843_0009.txt,txt_rstl
relation is confirmed by the facts detailed in the paper of,the,rstl_1843_0009.txt,txt_rstl
the whole tenor of voltaic facts and general experience. Another point,the,rstl_1843_0009.txt,txt_rstl
traced (in addition to the facts brought forward in the notes,the,rstl_1843_0002.txt,txt_rstl
"baryta, and others, confirm the facts already stated ; viz. that",the,rstl_1843_0003.txt,txt_rstl
"by publication some of the facts which I also have obtained,",the,rstl_1843_0004.txt,txt_rstl
arranging in one system numerous facts connected with the reflected movements,the,rstl_1843_0013.txt,txt_rstl
leads us to 8ome important facts in reference to the means,the,rstl_1843_0013.txt,txt_rstl
the abdominal nervous cord. The facts ascertained by Mr. Lonp were,the,rstl_1843_0013.txt,txt_rstl
with the orifices. From these facts it would appear that the,the,rstl_1843_0013.txt,txt_rstl
"the attention of physiologists, certain facts appear, nevertheless, to have been",the,rstl_1843_0013.txt,txt_rstl
divisions of Myriapoda. These additional facts fully accord with the already,the,rstl_1843_0013.txt,txt_rstl
and liver in the latter; facts which I regard as new,the,rstl_1843_0013.txt,txt_rstl
the Royal Society. Myriapoda. The facts already ascertained respecting the periodical,the,rstl_1844_0009.txt,txt_rstl
"I was examining it, the facts were still more satisfac- tory.",the,rstl_1844_0009.txt,txt_rstl
"with others showing the same facts in F. 15,—G. N., Sept.",the,rstl_1844_0009.txt,txt_rstl
"communicated it was remodelled, the facts remaining the same.—E. W. EXPLANATION",the,rstl_1844_0011.txt,txt_rstl
incorrect. 2. The preceding negative facts are not without their value,the,rstl_1844_0003.txt,txt_rstl
"the whole tenor of voltaic facts and genera] experience.” 24, I",the,rstl_1844_0003.txt,txt_rstl
we have before us certain facts connected with the action of,the,rstl_1844_0003.txt,txt_rstl
"'the Cephalopodal organization, the additional facts afforded by the well-preserved specimens",the,rstl_1844_0006.txt,txt_rstl
and Sepia: and the additional facts which we have now unexpectedly,the,rstl_1844_0006.txt,txt_rstl
"certain thermal effect, the general facts now established will not be",the,rstl_1844_0002.txt,txt_rstl
"exclusion of the anion. These facts are, we believe, irreconcilable with",the,rstl_1844_0001.txt,txt_rstl
"fix the attention. These are facts which, when the true physical",the,rstl_1844_0007.txt,txt_rstl
place distinctly before our minds facts of which the explanation mnst,the,rstl_1844_0007.txt,txt_rstl
"differ 80 widely from the facts in the southern latitudes, shows",the,rstl_1844_0007.txt,txt_rstl
From the sum of these facts I am again forced to,the,rstl_1845_0012.txt,txt_rstl
of the happy temperate mean.:..Some facts which I sball have presently,the,rstl_1845_0014.txt,txt_rstl
the urine alkaline; and from facts which have been stated to,the,rstl_1845_0015.txt,txt_rstl
"From the whole of these facts I was led to conclude,",the,rstl_1845_0013.txt,txt_rstl
and the explanation of the facts is as follows :— Whatever,the,rstl_1845_0013.txt,txt_rstl
described a long series of facts relative to the cireumstances that,the,rstl_1845_0013.txt,txt_rstl
simplest interpretation of all the facts discovered by myself ; it,the,rstl_1845_0011.txt,txt_rstl
however to some of the facts connected with observations at different,the,rstl_1845_0010.txt,txt_rstl
easily accounted for by the facts already stated of irregular composition,the,rstl_1845_0006.txt,txt_rstl
upon the truth of the facts on which the doctrine of,the,rstl_1845_0007.txt,txt_rstl
"may be countenanced by the facts detailed in the text, but",the,rstl_1845_0007.txt,txt_rstl
present to deduce from the facts which I have laid before,the,rstl_1845_0007.txt,txt_rstl
"general tenor of the preceding facts and observations, to maintain with",the,rstl_1845_0007.txt,txt_rstl
this instance adopted. Now the facts and observations detailed in the,the,rstl_1845_0007.txt,txt_rstl
"the development of the principal facts of diurnal tide. Finally, that",the,rstl_1845_0001.txt,txt_rstl
"formed :— From the ordinary facts of the tides, it seems",the,rstl_1845_0001.txt,txt_rstl
"great, addition made to the facts and considerations which tend to",the,rstl_1846_0001.txt,txt_rstl
tween the poles. The new facts give not a mere negative,the,rstl_1846_0003.txt,txt_rstl
"equatorial position : and the facts with regard to bodies generally,",the,rstl_1846_0003.txt,txt_rstl
could be lowered sufficiently. The facts just described appear to me,the,rstl_1846_0004.txt,txt_rstl
"be drawn from all the facts described in this paper, I",the,rstl_1846_0004.txt,txt_rstl
"considerations. 2417. Such are the facts which, in addition to those",the,rstl_1846_0004.txt,txt_rstl
to the bearing of the facts I have now related on,the,rstl_1846_0005.txt,txt_rstl
"T have suggested of the facts described be '> correct, and",the,rstl_1846_0024.txt,txt_rstl
"and the bearing of the facts now related, to dis- sent",the,rstl_1846_0025.txt,txt_rstl
"secrefory portion+. From all the facts which have been now related,",the,rstl_1846_0025.txt,txt_rstl
reduced to the two following facts :— 1. 'The electric discharge,the,rstl_1846_0026.txt,txt_rstl
"say, the greatest number of facts possible from the smallest number",the,rstl_1846_0026.txt,txt_rstl
the simplest and most elementary facts in s0 yast a field,the,rstl_1846_0026.txt,txt_rstl
see the application of these facts to the vocal apparatus. We,the,rstl_1846_0028.txt,txt_rstl
were expiratory. These were the facts ; | I could not,the,rstl_1846_0027.txt,txt_rstl
to 089 inch. As the facts shown by these observations are,the,rstl_1846_0020.txt,txt_rstl
vessels in the neighbourhood. These facts were demonstrated by preparations at,the,rstl_1846_0017.txt,txt_rstl
collections of Ganglia.—From the foregoing facts it will appear that a,the,rstl_1846_0017.txt,txt_rstl
a correct statement of the facts *. My attention was at,the,rstl_1846_0013.txt,txt_rstl
play of forces. The following facts appear to me quite conclu-,the,rstl_1846_0013.txt,txt_rstl
