Context,Word,File,Directory
experiments. But as the leading facts of- the experiments have now,the,rstl_1840_0013.txt,txt_rstl
theoretical. < As the experimental facts observed by myself differ from,the,rstl_1840_0013.txt,txt_rstl
the obser- vation of the facts was with me long anterior,the,rstl_1840_0013.txt,txt_rstl
in the perception of experimental facts not wholly coinciding with Sir,the,rstl_1840_0013.txt,txt_rstl
"the experi- ments relate to facts and not opinions, I can",the,rstl_1840_0010.txt,txt_rstl
to determine how far the facts elicited are of ge- neral,the,rstl_1840_0022.txt,txt_rstl
opportunity for confirming the principal facts therein stated. I have now,the,rstl_1840_0024.txt,txt_rstl
"be seen on comparing the facts about to be recorded, with",the,rstl_1840_0024.txt,txt_rstl
"on the ovary||. From the facts just mentioned, and those about",the,rstl_1840_0024.txt,txt_rstl
"** Second Series,” among the facts rendering it probable that the",the,rstl_1840_0024.txt,txt_rstl
the same means. 364. The facts above recorded will show that,the,rstl_1840_0024.txt,txt_rstl
"eight, &c. cells.” But these facts strengthen the analogy pointed out",the,rstl_1840_0024.txt,txt_rstl
of some of the foregoing Facts to the Physiology of Cells.,the,rstl_1840_0024.txt,txt_rstl
"have now to state, that facts observed in the pre- sent",the,rstl_1840_0024.txt,txt_rstl
is a © eytoblast.” And facts made known in the foregoing,the,rstl_1840_0024.txt,txt_rstl
in the parent cell.” The facts recorded in the present memoir,the,rstl_1840_0024.txt,txt_rstl
"18, 1840. 431. Should the facts made known in the foregoing",the,rstl_1840_0024.txt,txt_rstl
"near the truth ; and facts about to be made known,",the,rstl_1840_0024.txt,txt_rstl
it must be by the facts made known in this memoir—affects,the,rstl_1840_0024.txt,txt_rstl
"of the lichen products, any facts belonging to the substance found",the,rstl_1840_0016.txt,txt_rstl
satisfactory explanation of all the facts be given. That deoxidation is,the,rstl_1840_0016.txt,txt_rstl
"zealous in his production of facts and arguments, from the year",the,rstl_1840_0003.txt,txt_rstl
"not controversial, but contains further facts and proofs of the truth",the,rstl_1840_0003.txt,txt_rstl
"think accountable for, on the facts partly known respecting opposed currents;",the,rstl_1840_0003.txt,txt_rstl
theory may agree with the facts is necessary : $till it,the,rstl_1840_0003.txt,txt_rstl
"by any independent measurement or facts (1808.), but only by the",the,rstl_1840_0003.txt,txt_rstl
"in opposition to the foregoing facts and conclusions is, to say",the,rstl_1840_0003.txt,txt_rstl
experiment. 1849. Proceeding on the facts made known by ScaaNBEIN respecting,the,rstl_1840_0003.txt,txt_rstl
"to the platinum, and the facts mainly as with iron. But",the,rstl_1840_0003.txt,txt_rstl
of the enormous body of facts which appear to me to,the,rstl_1840_0003.txt,txt_rstl
"that I worked out the facts to some extent, and think",the,rstl_1840_0004.txt,txt_rstl
"contortions of the string of facts (1874. 1956. 1992. 2006. 2063.),",the,rstl_1840_0004.txt,txt_rstl
METALLIC CONTACT. 115 observations and facts to show the number of,the,rstl_1840_0004.txt,txt_rstl
"but reservedly expressed, that the facts were favourable to the theory",the,rstl_1840_0004.txt,txt_rstl
"mere-contact excitement, derivable from the facts of thermo electricity, remains, since",the,rstl_1840_0004.txt,txt_rstl
"Dr. Rocer is, upon the facts of the science, a sup-",the,rstl_1840_0004.txt,txt_rstl
record a number of insulated facts and observations respecting the relations,the,rstl_1840_0002.txt,txt_rstl
"of M. Dacuerre's discovery. The facts themselves, in the present state",the,rstl_1840_0002.txt,txt_rstl
"considered as hitherto undecided. The facts about to be tated, however,",the,rstl_1840_0002.txt,txt_rstl
"of no small interest. The facts I am about to recite,",the,rstl_1840_0002.txt,txt_rstl
of urea 6 Whether these facts have any connexion with the,the,rstl_1840_0002.txt,txt_rstl
"resolved. Notwithstanding these differences, however, facts mentioned by authors regarding the",the,rstl_1841_0017.txt,txt_rstl
"enhances the value of any facts bearing on this obscure point,",the,rstl_1841_0009.txt,txt_rstl
"preceding remarks, combined with the facts and arguments advanced in my",the,rstl_1841_0009.txt,txt_rstl
corpuscles of the blood. Those facts were of a character which,the,rstl_1841_0018.txt,txt_rstl
On a review of the facts stated in the course of,the,rstl_1841_0018.txt,txt_rstl
granules of the yelk. The facts recorded in the foregoing memoir,the,rstl_1841_0018.txt,txt_rstl
"be naturally deduced from the facts demonstrated in the foregoing dissections,—",the,rstl_1841_0015.txt,txt_rstl
'The following are the leading facts which the preceding researches upon,the,rstl_1841_0015.txt,txt_rstl
the eggs ; but the facts now about to be stated,the,rstl_1841_0012.txt,txt_rstl
entirely overlooked many most important facts in regard to the production,the,rstl_1841_0012.txt,txt_rstl
'The conclusions to which the facts detailed in this paper seem,the,rstl_1841_0012.txt,txt_rstl
entirely in accordance with the facts subse- quently ascertained respecting the,the,rstl_1841_0012.txt,txt_rstl
"the oyum. Moreover, the few facts detailed in this paper show",the,rstl_1841_0012.txt,txt_rstl
of the embryo that the facts ascertained appear to be of,the,rstl_1841_0012.txt,txt_rstl
with great difficulty that the facts connected with them are ascertained.,the,rstl_1841_0012.txt,txt_rstl
have noticed the important additional facts of the detection of the,the,rstl_1841_0012.txt,txt_rstl
"will be seen that the facts I have now to mention,",the,rstl_1841_0019.txt,txt_rstl
nucleated cells. But the other facts now men- tioned+; I believe,the,rstl_1841_0019.txt,txt_rstl
"find that, while bringing forward facts opposed to the views of",the,rstl_1841_0019.txt,txt_rstl
"all anticipated. For, although the facts observed had led me pretty",the,rstl_1841_0019.txt,txt_rstl
I in pos- ses8ion of facts connected with the process of,the,rstl_1841_0019.txt,txt_rstl
addition to the series of facts already ascertained respecting 80 anomalous,the,rstl_1832_0023.txt,txt_rstl
unsup- ported by any additional facts relative to the internal anatomy,the,rstl_1832_0023.txt,txt_rstl
"preceding account, therefore, two important facts are distinctly tated ; the",the,rstl_1832_0023.txt,txt_rstl
to have recollected the singular facts recorded by that author. And,the,rstl_1832_0020.txt,txt_rstl
was not aware of the facts stated in M. Du Buart's,the,rstl_1832_0020.txt,txt_rstl
immediately incommoded or injured. These facts I have observed in the,the,rstl_1832_0017.txt,txt_rstl
repetition.” The explanation of these facts is afforded by noticing that,the,rstl_1832_0017.txt,txt_rstl
Pneumatometer. The principal of these facts is that of the quantity,the,rstl_1832_0016.txt,txt_rstl
be supposed to fail. The facts detailed by Harvey had shown,the,rstl_1832_0016.txt,txt_rstl
"each other, and from the facts on which that law is",the,rstl_1832_0016.txt,txt_rstl
afford many explanations of the facts detailed in the extraordinary works,the,rstl_1832_0016.txt,txt_rstl
"point out particularly hereafter. The facts in regard to the irritability,",the,rstl_1832_0016.txt,txt_rstl
the velum recoiled forcibly. These facts lead us to the further,the,rstl_1832_0015.txt,txt_rstl
"effort of life. By these facts it appears; 1st, That the",the,rstl_1832_0015.txt,txt_rstl
or contractile. Reflecting on the facts and observations which I have,the,rstl_1832_0013.txt,txt_rstl
Induction. 140. WHEN the general facts described in the former paper,the,rstl_1832_0007.txt,txt_rstl
epitome of nearly all the facts of magneto-electric induction. 171. A,the,rstl_1832_0007.txt,txt_rstl
not aware of any distinct facts which authorize the conclusion that,the,rstl_1832_0007.txt,txt_rstl
of dispute; and the following facts render it more than probable,the,rstl_1832_0004.txt,txt_rstl
"the name of Theodozus. These facts distinctly show, that as the",the,rstl_1833_0032.txt,txt_rstl
out of the preceding anatomical facts are extremely simple. If it,the,rstl_1833_0031.txt,txt_rstl
be considered as the general facts of electro-chemical de- composition are,the,rstl_1833_0030.txt,txt_rstl
"consideration of electro-chemical decompositions. The facts are of the utmost, value,",the,rstl_1833_0030.txt,txt_rstl
affected by either arguments or facts against the latter. Considering it,the,rstl_1833_0030.txt,txt_rstl
with the immense collection of facts belonging to this branch of,the,rstl_1833_0030.txt,txt_rstl
"water (495.), already quoted, for facts illustrating these views in the",the,rstl_1833_0030.txt,txt_rstl
they respectively give of such facts as these. 551. The instances,the,rstl_1833_0030.txt,txt_rstl
not legitimate deductions from the facts before them. But M. CruvgrLn,the,rstl_1833_0028.txt,txt_rstl
deprived of its encephalon. 'The facts are these: in the entire,the,rstl_1833_0028.txt,txt_rstl
and the medulla oblongata. These facts are fully proved by the,the,rstl_1833_0028.txt,txt_rstl
"deeply interesting character, The following facts are extracted from a letter",the,rstl_1833_0028.txt,txt_rstl
The irritability remains unimpaired. 'These facts complete the proof that the,the,rstl_1833_0028.txt,txt_rstl
altogether. * Having observed these facts in connexion with the reflex,the,rstl_1833_0028.txt,txt_rstl
"the reflex function. However these facts may have been known, their",the,rstl_1833_0028.txt,txt_rstl
"qui nous Echappe #,” The facts which have been detailed in",the,rstl_1833_0028.txt,txt_rstl
between the two orders of facts to which LecarLos refers. The,the,rstl_1833_0028.txt,txt_rstl
which LecarLos refers. The same facts enable us to understand how,the,rstl_1833_0028.txt,txt_rstl
which flow from the preceding facts and experiments. Physiologists have hitherto,the,rstl_1833_0028.txt,txt_rstl
&c. However some of the facts detailed in this paper may,the,rstl_1833_0028.txt,txt_rstl
"spinalis. In like manner, the facts relative to the irritability were",the,rstl_1833_0028.txt,txt_rstl
at variance with all the facts and experiments detailed in the,the,rstl_1833_0028.txt,txt_rstl
It appears probable that the facts of this paper may lead,the,rstl_1833_0028.txt,txt_rstl
wound of a nerve. These facts demonstrate the strict connexion and,the,rstl_1833_0028.txt,txt_rstl
: 1. Many of the facts which depend upon the reflex,the,rstl_1833_0028.txt,txt_rstl
physiologists : 2. But these facts only extend to the excited,the,rstl_1833_0028.txt,txt_rstl
or instinct : 3. The facts of excited movements of the,the,rstl_1833_0028.txt,txt_rstl
since most of the principal facts have been ascertained by processes,the,rstl_1833_0023.txt,txt_rstl
"touched only by points, the facts show that this salt is",the,rstl_1833_0022.txt,txt_rstl
"the world, and with other facts probably still to be revealed,",the,rstl_1833_0019.txt,txt_rstl
strict accordance with the observed facts of the influence of colour,the,rstl_1833_0016.txt,txt_rstl
and know of no recorded facts in which the influence of,the,rstl_1833_0016.txt,txt_rstl
quality; the knowledge of these facts may afford useful hints for,the,rstl_1833_0016.txt,txt_rstl
interesting of chemical substances. The facts which I haye to communicate,the,rstl_1833_0015.txt,txt_rstl
a mode of denoting the facts of such cases. As a,the,rstl_1833_0013.txt,txt_rstl
now discover of grouping the facts which we possess. The lines,the,rstl_1833_0013.txt,txt_rstl
a necessary inference from the facts stated in the last paper,the,rstl_1833_0009.txt,txt_rstl
stated or referred to the facts which prove that in all,the,rstl_1833_0009.txt,txt_rstl
is much less 80. The facts stated in the paper just,the,rstl_1833_0009.txt,txt_rstl
union. It appears from those facts that the muscles of respiration,the,rstl_1833_0009.txt,txt_rstl
"in this function. Besides, the facts which have been laid before",the,rstl_1833_0009.txt,txt_rstl
the increasing affection * Such facts are adduced in the paper,the,rstl_1833_0009.txt,txt_rstl
of the whole of the facts which have been laid before,the,rstl_1833_0009.txt,txt_rstl
by com- paring the various facts relating to the circulation of,the,rstl_1833_0007.txt,txt_rstl
"admitted, from the statement of facts made in the paper just",the,rstl_1833_0007.txt,txt_rstl
to be possessed of any facts which directly support them; the,the,rstl_1833_0007.txt,txt_rstl
"inferences apparently supported by the facts he adduces, but wholly inconsistent",the,rstl_1833_0007.txt,txt_rstl
support their opinion by any facts directly bearing on the point.,the,rstl_1833_0007.txt,txt_rstl
"from this and the preceding facts are unavoidable, that the former",the,rstl_1833_0007.txt,txt_rstl
"on this subject, for the facts on which the foregoing positions",the,rstl_1833_0007.txt,txt_rstl
"in possession of no other facts on the subject, we should",the,rstl_1833_0007.txt,txt_rstl
are strikingly illustrated by the facts which have been ascertained respecting.,the,rstl_1833_0007.txt,txt_rstl
It appears from all the facts which have been stated or,the,rstl_1833_0007.txt,txt_rstl
"that the whole of the facts relating to this agent, prove",the,rstl_1833_0007.txt,txt_rstl
me to make of the facts and views constituting the theory,the,rstl_1833_0006.txt,txt_rstl
the snbject ; and such facts as have been men- tioned,the,rstl_1834_0029.txt,txt_rstl
beyond it. Many very interesting facts might be mentioned concerning the,the,rstl_1834_0029.txt,txt_rstl
to reconcile the lately ascertained facts respecting the mammary glands with,the,rstl_1834_0028.txt,txt_rstl
"founded, nor compatible with the facts which I have brought forward.",the,rstl_1834_0027.txt,txt_rstl
excepting that already mentioned-f. The facts I have stated relative to,the,rstl_1834_0026.txt,txt_rstl
"a closed membrane. From the facts given in the preceding tables,",the,rstl_1834_0026.txt,txt_rstl
by the majority of the facts adduced in this paper. The,the,rstl_1834_0026.txt,txt_rstl
anatomist to attempt demonstrating these facts in the recent brain ;,the,rstl_1834_0023.txt,txt_rstl
lever (1031.). 918. All the facts show us that that power,the,rstl_1834_0022.txt,txt_rstl
is perfectly consistent. All the facts and also the theory I,the,rstl_1834_0022.txt,txt_rstl
to the discovery of these facts MDCCCXXXIV. 3G 406 MR. NEWPORT,the,rstl_1834_0021.txt,txt_rstl
have thus a series of facts which distinctly show the existence,the,rstl_1834_0021.txt,txt_rstl
be new in physiology. The facts being only such as presented,the,rstl_1834_0020.txt,txt_rstl
and the like. Many striking facts seem to warrant the supposition,the,rstl_1834_0016.txt,txt_rstl
"these pheno- mena, the mere facts being alone requisite; for whatever",the,rstl_1834_0016.txt,txt_rstl
"hitherto done, a class of facts essentially involved in the subject",the,rstl_1834_0016.txt,txt_rstl
to me that the various facts ascertained in the course of,the,rstl_1834_0012.txt,txt_rstl
when the whole of the facts on the subject are carefully,the,rstl_1834_0012.txt,txt_rstl
"the chemist, even if the facts to which I have had",the,rstl_1834_0012.txt,txt_rstl
be satisfied to take the facts as we find them. And,the,rstl_1834_0012.txt,txt_rstl
"a true expression of the facts of electro- chemical decomposition, and",the,rstl_1834_0008.txt,txt_rstl
current. As I want the facts in illustration of the distinction,the,rstl_1834_0008.txt,txt_rstl
"and the chloride, I observed facts which lead me to doubt",the,rstl_1834_0008.txt,txt_rstl
the slightest degree with the facts which can be brought to,the,rstl_1834_0008.txt,txt_rstl
"do not believe that the facts which I have advanced, or",the,rstl_1834_0008.txt,txt_rstl
"action of heat, still the facts are considered as justifying the",the,rstl_1834_0007.txt,txt_rstl
"655, Such are the general facts of these remarkable interferences. Whether",the,rstl_1834_0007.txt,txt_rstl
"that the laws of the facts are Such, or nearly such,",the,rstl_1834_0004.txt,txt_rstl
the known laws of the facts are accounted for by the,the,rstl_1834_0004.txt,txt_rstl
darker spots. If the above facts do not warrant the conclusion,the,rstl_1835_0023.txt,txt_rstl
surprising that 80 many curious facts should have remained until the,the,rstl_1835_0023.txt,txt_rstl
"subsequent, memoirs will prove. The facts connected with the metamorphosis in",the,rstl_1835_0023.txt,txt_rstl
"which, in addition to the facts adduced in his first memoir,",the,rstl_1835_0019.txt,txt_rstl
in as much as the facts subsequently stated respecting the ova,the,rstl_1835_0019.txt,txt_rstl
to refer to the conclusive facts subsequently stated in proof that,the,rstl_1835_0019.txt,txt_rstl
to such as relate to facts noticed respecting the trans- formations,the,rstl_1835_0019.txt,txt_rstl
"M. ST. HiLairs from the facts noticed by M. Epwasps, I",the,rstl_1835_0019.txt,txt_rstl
to our stock of information facts which prove the fallacy of,the,rstl_1835_0018.txt,txt_rstl
One of the most decisive facts regarding the finding of the,the,rstl_1835_0018.txt,txt_rstl
"upon the inquiry. Still, these facts combined with observations relative to",the,rstl_1835_0013.txt,txt_rstl
a state of vapour. These facts fully establish the remarkable discrepancies,the,rstl_1835_0012.txt,txt_rstl
"give an abstract of the facts established, and the principal matters",the,rstl_1835_0012.txt,txt_rstl
than as the compiler of facts observed and reported to me,the,rstl_1835_0011.txt,txt_rstl
"that of the Tyrol, as facts of the same description. The",the,rstl_1835_0011.txt,txt_rstl
"expect, I think the few facts bearing upon this subject with",the,rstl_1835_0005.txt,txt_rstl
"with the fundamental laws and facts of electrical science, that I",the,rstl_1835_0005.txt,txt_rstl
on this and the other facts brought to light during the,the,rstl_1835_0002.txt,txt_rstl
be well to state some facts bearing on the same subject,the,rstl_1835_0002.txt,txt_rstl
the conclusions deducible from the facts and observations stated in the,the,rstl_1836_0025.txt,txt_rstl
cannot be doubted. As the facts which we have advanced plainly,the,rstl_1836_0025.txt,txt_rstl
functions. When we connect these facts with that of the longitudinal,the,rstl_1836_0026.txt,txt_rstl
one of the most essential facts to determine ; yet I,the,rstl_1836_0028.txt,txt_rstl
of five classes of geological facts already alluded to in the,the,rstl_1836_0028.txt,txt_rstl
6? 20' E.*# The preceding facts showing the influence of small,the,rstl_1836_0018.txt,txt_rstl
the purposes required. Some striking facts respecting the local attraction of,the,rstl_1836_0018.txt,txt_rstl
"is necessary that the various facts should be com- 2 pared,",the,rstl_1836_0020.txt,txt_rstl
from the great variety of facts on which the conclusions are,the,rstl_1836_0020.txt,txt_rstl
"it will appear from the facts I am about to adduce,",the,rstl_1836_0020.txt,txt_rstl
"from the whole of the facts which have been referred to,",the,rstl_1836_0020.txt,txt_rstl
experience alone. Hence the well-known facts that infants are not aware,the,rstl_1836_0020.txt,txt_rstl
"fact been questioned. If the facts I have stated be correct,",the,rstl_1836_0020.txt,txt_rstl
avail except either disproving the facts or pointing out the fallacy,the,rstl_1836_0020.txt,txt_rstl
"functions, as appears from the facts stated in a paper which",the,rstl_1836_0020.txt,txt_rstl
accordance with all the other facts which have been stated respecting,the,rstl_1836_0020.txt,txt_rstl
appears from some lately ascertained facts that the secreted fluids are,the,rstl_1836_0020.txt,txt_rstl
common. IT appears from the facts adduced in my paper on,the,rstl_1836_0020.txt,txt_rstl
"recollected, as appears from the facts which have been stated, that",the,rstl_1836_0020.txt,txt_rstl
any such agents. When the facts adduced in the paper just,the,rstl_1836_0020.txt,txt_rstl
"system, as appears from the facts stated in my paper on",the,rstl_1836_0020.txt,txt_rstl
"8tate the whole of those facts with their various bearings, which",the,rstl_1836_0020.txt,txt_rstl
"prevail in all*, From the facts just referred to we easily",the,rstl_1836_0020.txt,txt_rstl
we also know from the facts which have been stated that,the,rstl_1836_0020.txt,txt_rstl
often proved fatal. On the facts that the central organs of,the,rstl_1836_0020.txt,txt_rstl
"mervyeilleuse puissance,” If the preceding facts be kept in view, it",the,rstl_1836_0020.txt,txt_rstl
"capable of judging, adduced such facts as prove that the muscles",the,rstl_1836_0020.txt,txt_rstl
FROM the whole of the facts referred to in the preceding,the,rstl_1836_0020.txt,txt_rstl
"the muscular, as appears from facts aboye referred to, being the",the,rstl_1836_0020.txt,txt_rstl
"and (I believe, from the facts stated in the foregoing paper,",the,rstl_1836_0020.txt,txt_rstl
be done till all the facts on the subject had been,the,rstl_1836_0020.txt,txt_rstl
light. The following are the facts which appear to fayour this,the,rstl_1836_0007.txt,txt_rstl
our guide the ana- logous facts presented by certain composite crystals,the,rstl_1836_0009.txt,txt_rstl
"of the equilibrium-theory with the facts (assuming « = 2"") is",the,rstl_1836_0014.txt,txt_rstl
in possession of the leading facts appertaining to the influence of,the,rstl_1836_0015.txt,txt_rstl
"own mind with the new facts and reasonings which they contain,",the,rstl_1836_0012.txt,txt_rstl
"may best combine all the facts into a consistent scheme, by",the,rstl_1836_0019.txt,txt_rstl
than a representation of the facts of the case ; yet,the,rstl_1836_0019.txt,txt_rstl
"to exhibit the succession of facts of this kind, I have",the,rstl_1836_0019.txt,txt_rstl
these the course of the facts far more distinctly than from,the,rstl_1836_0019.txt,txt_rstl
induced to believe that the facts which I am prepared to,the,rstl_1837_0022.txt,txt_rstl
"animals, but as all the facts which I have noticed are",the,rstl_1837_0022.txt,txt_rstl
now proceed to relate some facts re- specting the changes which,the,rstl_1837_0020.txt,txt_rstl
bringing the two series of facts under the same conditions. Sir,the,rstl_1837_0017.txt,txt_rstl
been led to observe some facts regarding the illuminating powers of,the,rstl_1837_0015.txt,txt_rstl
"before been collected from the facts of observation, or indeed stated",the,rstl_1837_0016.txt,txt_rstl
"suggestion was founded upon the facts of a few places, and",the,rstl_1837_0016.txt,txt_rstl
"but it appears in the facts themselves. For instance, if we",the,rstl_1837_0016.txt,txt_rstl
EUROPE. 233 some of the facts do appear to indicate this,the,rstl_1837_0016.txt,txt_rstl
"degree of probability from the facts which I have stated, since",the,rstl_1837_0005.txt,txt_rstl
the Royal Society. 2. The facts recently pointed out by M.,the,rstl_1837_0007.txt,txt_rstl
render the subject intelligible. The facts that I have thought the,the,rstl_1837_0024.txt,txt_rstl
Such then are the principal facts that have offered themselves to,the,rstl_1837_0024.txt,txt_rstl
cells are lined. With the facts before us of the progressive,the,rstl_1837_0024.txt,txt_rstl
has hitherto demonstrated the interesting facts that every individual insect when,the,rstl_1837_0019.txt,txt_rstl
and together with many other facts connected with the physiology of,the,rstl_1837_0019.txt,txt_rstl
of the insect. From these facts it is sufficiently clear that,the,rstl_1837_0019.txt,txt_rstl
means of ascertaining all the facts connected with the temperature of,the,rstl_1837_0019.txt,txt_rstl
THE TEMPERATURE OF INSECTS. These facts are suflicient to prove that,the,rstl_1837_0019.txt,txt_rstl
"also beautifully accord with the facts ascertained, and the views deduced",the,rstl_1837_0019.txt,txt_rstl
of the eurrounding medium. These facts may be readily demonstrated by,the,rstl_1837_0019.txt,txt_rstl
opinions are 8upported by the facts that some insects pass into,the,rstl_1837_0019.txt,txt_rstl
high degrees of temperature. The facts connected with the presumed plethoric,the,rstl_1837_0019.txt,txt_rstl
observations that these apparently contradictory facts arose only from the circumstance,the,rstl_1837_0019.txt,txt_rstl
the Winter. The many curious facts connected with the production of,the,rstl_1837_0019.txt,txt_rstl
"with much less rapidity. These facts are shown in the observations,",the,rstl_1837_0019.txt,txt_rstl
the young may demand. These facts will explain a circumstance connected,the,rstl_1837_0019.txt,txt_rstl
explained by reference to the facts connected with the production of,the,rstl_1837_0019.txt,txt_rstl
same state of excitement. These facts readily account for the diminished,the,rstl_1837_0019.txt,txt_rstl
per minute. These are interesting facts as connected with the power,the,rstl_1837_0019.txt,txt_rstl
be seen from the additional facts about to be stated that,the,rstl_1837_0019.txt,txt_rstl
Table we deduce the following facts :—First that the expenditure which,the,rstl_1837_0019.txt,txt_rstl
"comparing the whole of the facts we haye just examined, we",the,rstl_1837_0019.txt,txt_rstl
to ascertain a few additional facts respecting the temperature of zome,the,rstl_1837_0019.txt,txt_rstl
"in the same. With these facts before us, we are enabled",the,rstl_1838_0021.txt,txt_rstl
possesses this property. Certain physiological facts having reference to the growth,the,rstl_1838_0018.txt,txt_rstl
was one of the earliest facts which drew my attention to,the,rstl_1838_0019.txt,txt_rstl
alternate differently. There are some facts intimately connected with the subject,the,rstl_1838_0019.txt,txt_rstl
this opinion by the curious facts alluded to in \ 14.,the,rstl_1838_0019.txt,txt_rstl
yeri- fying most of the facts by repeated observation. The examinations,the,rstl_1838_0016.txt,txt_rstl
becoming acquainted with the known facts on animal development and other,the,rstl_1838_0016.txt,txt_rstl
"Vobservation++.” I trust that the facts mentioned in the preceding pages,",the,rstl_1838_0016.txt,txt_rstl
