Context,Collocate,File,Directory,Year,Frequency Filter
282 / 218 When these facts had been ascertained the obvious,these,rstb_1920_0003.txt,txt_rstb,1920,14
magnesia. ~ “Where do these facts point? A moment’s speculation will,these,rsta_1920_0008.txt,txt_rsta,1920,14
"laws of spectral construction, such facts as these may be expected",these,rsta_1920_0010.txt,txt_rsta,1920,14
of work obtained increases. These facts confirm the theory discussed in,these,rstb_1921_0005.txt,txt_rstb,1921,14
"was based, are incorrect. These facts need not be referred to",these,rstb_1921_0002.txt,txt_rstb,1921,14
to the same conclusion. These facts about Podocarpus are not here,these,rstb_1921_0007.txt,txt_rstb,1921,14
usually very small. All these facts are evidently in complete agreement,these,rsta_1921_0006.txt,txt_rsta,1921,14
60th degree of latitude. These facts will give an idea of,these,rstb_1923_0004.txt,txt_rstb,1923,14
and (p. 385) :—‘“ These facts seem to me to establish,these,rstb_1923_0005.txt,txt_rstb,1923,14
the load is decreased. These facts have an important bearing on,these,rsta_1923_0003.txt,txt_rsta,1923,14
at above. From all these facts the conclusion may be drawn,these,rsta_1923_0004.txt,txt_rsta,1923,14
same nature occur. All these facts lead up to the inevitable,these,rstb_1924_0004.txt,txt_rstb,1924,14
hardly any wear. From these facts it seems most probable that,these,rstb_1924_0009.txt,txt_rstb,1924,14
"origin and distribution, . These facts suggest that the * It",these,rstb_1924_0008.txt,txt_rstb,1924,14
"51a, and R. 141). These facts VOL. CCXI.—B, 2P 284 REV.",these,rstb_1924_0008.txt,txt_rstb,1924,14
an embryo Trichosurus. All these facts appear sufticiently conclusive to justify,these,rstb_1924_0008.txt,txt_rstb,1924,14
"with the pars superior. These facts are not revealed, however, by",these,rstb_1924_0008.txt,txt_rstb,1924,14
small northerly current. These observational facts agree well with fig. 7.,these,rsta_1924_0005.txt,txt_rsta,1924,14
facilitated by the body of facts expressed in these curves. Previous,these,rstb_1925_0003.txt,txt_rstb,1925,14
"by Krpston. Taking all these facts into consideration, it seems highly",these,rstb_1927_0004.txt,txt_rstb,1927,14
the light of these new facts shows that very probably the,these,rstb_1927_0004.txt,txt_rstb,1927,14
cells of Type II. These facts demonstrate that the function of,these,rstb_1927_0008.txt,txt_rstb,1927,14
"these { Know ron (19%). facts (Letter, April, 1924). See also",these,rstb_1927_0002.txt,txt_rstb,1927,14
réswmé of these and other facts is given by MULLIKEN in,these,rsta_1927_0005.txt,txt_rsta,1927,14
"a,,=«'’n’. In Table IX these facts are illus- trated : A”",these,rsta_1927_0005.txt,txt_rsta,1927,14
these air-breathing fishes the following facts should be carefully noticed :—,these,rstb_1928_0003.txt,txt_rstb,1928,14
intrasclerotomic (= intervertebral) position. These facts explain the paired character of,these,rstb_1928_0006.txt,txt_rstb,1928,14
Larus and 8-day Struthio. These facts suggest that both components (inter-,these,rstb_1928_0006.txt,txt_rstb,1928,14
unintelligibility. Tn view of these facts we seem thoroughly justified in,these,rstb_1928_0002.txt,txt_rstb,1928,14
using an index law. These facts illustrate the great importance of,these,rsta_1928_0009.txt,txt_rsta,1928,14
"(loc. cit.) states, “ These facts suggest initial heterospory, but they",these,rstb_1929_0001.txt,txt_rstb,1929,14
cells as in Clepsydropsis. These facts suggest that the organ may,these,rstb_1929_0001.txt,txt_rstb,1929,14
again less in quantity. These facts point to the conclusion that,these,rstb_1929_0006.txt,txt_rstb,1929,14
in that vicinity. If these facts form a basis for judg-,these,rstb_1929_0004.txt,txt_rstb,1929,14
"$’,4 and Q. From these facts we deduce the follow- ing:",these,rsta_1929_0008.txt,txt_rsta,1929,14
ay ‘Making use of these facts we see that the variable,these,rsta_1929_0002.txt,txt_rsta,1929,14
that a reason for these facts is to be found in,these,rsta_1929_0001.txt,txt_rsta,1929,14
2). A reason for these facts is to be found in,these,rsta_1929_0001.txt,txt_rsta,1929,14
may be answered that the facts are confined to the diagnoses,are,rstb_1920_0004.txt,txt_rstb,1920,14
"in the Cretaceous Cheilostomes, the facts are as follows. The skeletal",are,rstb_1920_0004.txt,txt_rstb,1920,14
"Cyclotosaurus in which genus the facts are not known, they do",are,rstb_1920_0001.txt,txt_rstb,1920,14
"Eryops, so far as the facts are shown. Laceocephalus is intermediate",are,rstb_1920_0001.txt,txt_rstb,1920,14
to the nutrition they receive—the facts are indeed to the contrary.,are,rstb_1920_0002.txt,txt_rstb,1920,14
equally in accordance with the facts that are at present available.,are,rstb_1920_0002.txt,txt_rstb,1920,14
it is believed that the facts already known are here first,are,rstb_1920_0010.txt,txt_rstb,1920,14
clean plane of cleavage. “These facts are suggestive. The crystals here,are,rsta_1920_0008.txt,txt_rsta,1920,14
"was based, are incorrect. These facts need not be referred to",are,rstb_1921_0002.txt,txt_rstb,1921,14
to the same conclusion. These facts about Podocarpus are not here,are,rstb_1921_0007.txt,txt_rstb,1921,14
Miss AASE (1915) has published facts which are of value in,are,rstb_1921_0007.txt,txt_rstb,1921,14
"drawn in illustration of the facts observed are treated rather diagrammatically,",are,rstb_1921_0008.txt,txt_rstb,1921,14
"various angles, and the observed facts are compared with what would",are,rsta_1921_0011.txt,txt_rsta,1921,14
usually very small. All these facts are evidently in complete agreement,are,rsta_1921_0006.txt,txt_rsta,1921,14
"OF There are therefore two facts to explain. First, the existence",are,rsta_1922_0004.txt,txt_rsta,1922,14
and in its absence. The facts are the direct converse of,are,rstb_1923_0006.txt,txt_rstb,1923,14
Blood at Rest. Whilst the facts given above are a mere,are,rstb_1923_0008.txt,txt_rstb,1923,14
"is evident that, if the facts are as I have stated",are,rstb_1924_0007.txt,txt_rstb,1924,14
purely anatomical character of the facts upon which they are based.,are,rstb_1924_0007.txt,txt_rstb,1924,14
"with the pars superior. These facts are not revealed, however, by",are,rstb_1924_0008.txt,txt_rstb,1924,14
"one can judge from the facts ascertained, there are in Lophius",are,rstb_1927_0001.txt,txt_rstb,1927,14
am convinced that until more facts are available we cannot overcome,are,rstb_1927_0002.txt,txt_rstb,1927,14
"a,,=«'’n’. In Table IX these facts are illus- trated : A”",are,rsta_1927_0005.txt,txt_rsta,1927,14
the parent stem. ‘These are facts of importance in a reconstruction,are,rstb_1929_0001.txt,txt_rstb,1929,14
"axis. But now that the facts are known, a symmetrical disposition",are,rstb_1929_0001.txt,txt_rstb,1929,14
If Sapm’s interpretation of the facts of the early ontogeny are,are,rstb_1929_0006.txt,txt_rstb,1929,14
A STELLAR ATMOSPHERE. The observed facts are that hydrogen shows a,are,rsta_1929_0010.txt,txt_rsta,1929,14
the result does not represent facts when weak fields are employed.,are,rsta_1929_0002.txt,txt_rsta,1929,14
may afford against another. The facts seem to indicate that this,that,rstb_1920_0003.txt,txt_rstb,1920,14
may be answered that the facts are confined to the diagnoses,that,rstb_1920_0004.txt,txt_rstb,1920,14
is indicated by the following facts :— 1. That a single,that,rstb_1920_0001.txt,txt_rstb,1920,14
"many, and probably more. The facts recorded above suggest that the",that,rstb_1920_0001.txt,txt_rstb,1920,14
equally in accordance with the facts that are at present available.,that,rstb_1920_0002.txt,txt_rstb,1920,14
it is believed that the facts already known are here first,that,rstb_1920_0010.txt,txt_rstb,1920,14
"the foregoing considerations, and of facts that will appear during 422",that,rstb_1920_0010.txt,txt_rstb,1920,14
in expressing and co-ordinating the facts in a scheme that adequately,that,rstb_1921_0008.txt,txt_rstb,1921,14
"close, having regard to the facts that (i.) the linear law",that,rsta_1922_0008.txt,txt_rsta,1922,14
"to experimental error, the main facts stand out: (1) that there",that,rstb_1923_0008.txt,txt_rstb,1923,14
pointed out that the observed facts might be met on the,that,rstb_1923_0008.txt,txt_rstb,1923,14
just described establish the following facts :— 1. That the specialised,that,rstb_1924_0001.txt,txt_rstb,1924,14
"of Trachinus draco, establishes the facts that the venom is both",that,rstb_1924_0001.txt,txt_rstb,1924,14
"liane stem structure, then other facts support the hypothesis that the",that,rstb_1924_0004.txt,txt_rstb,1924,14
"is concerned, With the main facts in hand, it appears that",that,rstb_1924_0005.txt,txt_rstb,1924,14
hardly any wear. From these facts it seems most probable that,that,rstb_1924_0009.txt,txt_rstb,1924,14
"origin and distribution, . These facts suggest that the * It",that,rstb_1924_0008.txt,txt_rstb,1924,14
lies not only in the facts that for a fine division,that,rstb_1925_0003.txt,txt_rstb,1925,14
also remark that the essential facts shown in the section of,that,rstb_1925_0005.txt,txt_rstb,1925,14
the light of these new facts shows that very probably the,that,rstb_1927_0004.txt,txt_rstb,1927,14
it is possible that certain facts recorded by Frrcuson (5) in,that,rstb_1927_0001.txt,txt_rstb,1927,14
cells of Type II. These facts demonstrate that the function of,that,rstb_1927_0008.txt,txt_rstb,1927,14
those of extrinsic fibres. The facts that the neurones of Type,that,rstb_1927_0008.txt,txt_rstb,1927,14
am convinced that until more facts are available we cannot overcome,that,rstb_1927_0002.txt,txt_rstb,1927,14
use being made of the facts that the law of energy,that,rsta_1927_0002.txt,txt_rsta,1927,14
"appear then from, the observed facts that the frequency gradient associated",that,rstb_1928_0001.txt,txt_rstb,1928,14
negative or positive correlation. The facts that plants of moist habitats,that,rstb_1928_0001.txt,txt_rstb,1928,14
Larus and 8-day Struthio. These facts suggest that both components (inter-,that,rstb_1928_0006.txt,txt_rstb,1928,14
"conclusion, then, to which the facts seem to point is that",that,rstb_1928_0002.txt,txt_rstb,1928,14
secondary positive pulse. Thus the facts that the portion of curve,that,rsta_1928_0002.txt,txt_rsta,1928,14
"axis. But now that the facts are known, a symmetrical disposition",that,rstb_1929_0001.txt,txt_rstb,1929,14
cells as in Clepsydropsis. These facts suggest that the organ may,that,rstb_1929_0001.txt,txt_rstb,1929,14
again less in quantity. These facts point to the conclusion that,that,rstb_1929_0006.txt,txt_rstb,1929,14
Gaupp’s theory would fit the facts provided that a satisfactory explanation,that,rstb_1929_0009.txt,txt_rstb,1929,14
in that vicinity. If these facts form a basis for judg-,that,rstb_1929_0004.txt,txt_rstb,1929,14
"is generally conceded, then the facts presented might hint that the",that,rstb_1929_0004.txt,txt_rstb,1929,14
A STELLAR ATMOSPHERE. The observed facts are that hydrogen shows a,that,rsta_1929_0010.txt,txt_rsta,1929,14
ay ‘Making use of these facts we see that the variable,that,rsta_1929_0002.txt,txt_rsta,1929,14
that a reason for these facts is to be found in,that,rsta_1929_0001.txt,txt_rsta,1929,14
equally in accordance with the facts that are at present available.,with,rstb_1920_0002.txt,txt_rstb,1920,14
less in accord with observed facts than the one indicated above.,with,rstb_1920_0010.txt,txt_rstb,1920,14
in general agreement with the facts derived from the microscopic appearances,with,rstb_1921_0002.txt,txt_rstb,1921,14
"various angles, and the observed facts are compared with what would",with,rsta_1921_0011.txt,txt_rsta,1921,14
theory will best describe the facts ? With regard to the,with,rstb_1923_0002.txt,txt_rstb,1923,14
such general accordance with the facts should have sprung to birth,with,rsta_1923_0006.txt,txt_rsta,1923,14
"first experiment with celluloid, two facts immediately became apparent. (1) After",with,rsta_1923_0003.txt,txt_rsta,1923,14
"is concerned, With the main facts in hand, it appears that",with,rstb_1924_0005.txt,txt_rstb,1924,14
"with the pars superior. These facts are not revealed, however, by",with,rstb_1924_0008.txt,txt_rstb,1924,14
small northerly current. These observational facts agree well with fig. 7.,with,rsta_1924_0005.txt,txt_rsta,1924,14
"at ot = 90°, which facts agree well with figs. 4",with,rsta_1924_0005.txt,txt_rsta,1924,14
"is capable of representing the facts with considerable precision, more closely",with,rstb_1925_0002.txt,txt_rstb,1925,14
but when taken with the facts of association they justify us,with,rstb_1925_0006.txt,txt_rstb,1925,14
the foliage. But with the facts at our disposal it is,with,rstb_1929_0001.txt,txt_rstb,1929,14
on all fours with the facts observed in greater detail in,with,rstb_1929_0006.txt,txt_rstb,1929,14
Vessel System. With only the facts furnished by my investigation of,with,rstb_1929_0006.txt,txt_rstb,1929,14
"think, at variance with the facts revealed by comparative anatomy and",with,rstb_1929_0006.txt,txt_rstb,1929,14
effect will be equalised. The facts relating to the epidemic of,to,rstb_1920_0003.txt,txt_rstb,1920,14
may afford against another. The facts seem to indicate that this,to,rstb_1920_0003.txt,txt_rstb,1920,14
may be answered that the facts are confined to the diagnoses,to,rstb_1920_0004.txt,txt_rstb,1920,14
in order to present our facts in an intelligible order. When,to,rstb_1920_0004.txt,txt_rstb,1920,14
"further theory to make our facts more intelligible. Now, generally speaking,",to,rstb_1920_0004.txt,txt_rstb,1920,14
allows me to add some facts to those previously recorded. The,to,rstb_1920_0001.txt,txt_rstb,1920,14
"advanced to account for the facts observed. A provisional hypothesis, based",to,rstb_1920_0002.txt,txt_rstb,1920,14
to the nutrition they receive—the facts are indeed to the contrary.,to,rstb_1920_0002.txt,txt_rstb,1920,14
to bring out the morphogenetic facts clearly. Whether this was due,to,rstb_1920_0010.txt,txt_rstb,1920,14
Such a representation of the facts has led to the recognition,to,rsta_1920_0008.txt,txt_rsta,1920,14
further research of the new facts brought to light in the,to,rsta_1920_0010.txt,txt_rsta,1920,14
the power of the new facts to guide a search even,to,rsta_1920_0010.txt,txt_rsta,1920,14
"has been possible, from the facts for wood, to frame a",to,rstb_1921_0002.txt,txt_rstb,1921,14
to attempt to relate the facts of the mechanical properties of,to,rstb_1921_0002.txt,txt_rstb,1921,14
"was based, are incorrect. These facts need not be referred to",to,rstb_1921_0002.txt,txt_rstb,1921,14
"use, to some extent, the facts described above in support of",to,rstb_1921_0002.txt,txt_rstb,1921,14
conception necessary to explain the facts described above for wood. It,to,rstb_1921_0002.txt,txt_rstb,1921,14
almost solely in relation to facts derived from the study of,to,rstb_1921_0002.txt,txt_rstb,1921,14
"its point of origin. Certain facts relevant to the foregoing must,",to,rstb_1921_0003.txt,txt_rstb,1921,14
"it now stands. As the facts present themselves to me, avenues",to,rstb_1921_0003.txt,txt_rstb,1921,14
to the oxygen consumed. The facts seem to us capable of,to,rstb_1921_0001.txt,txt_rstb,1921,14
to the same conclusion. These facts about Podocarpus are not here,to,rstb_1921_0007.txt,txt_rstb,1921,14
after Porrer’s publication appeared few facts were added to the existing,to,rstb_1921_0009.txt,txt_rstb,1921,14
"close, having regard to the facts that (i.) the linear law",to,rsta_1922_0008.txt,txt_rsta,1922,14
of such compensation of actual facts to explain a theoretical formula,to,rsta_1922_0002.txt,txt_rsta,1922,14
"OF There are therefore two facts to explain. First, the existence",to,rsta_1922_0004.txt,txt_rsta,1922,14
"stages, when the paucity of facts gives freer play to the",to,rstb_1923_0004.txt,txt_rstb,1923,14
"now, of course, some definite facts to go upon, We knew",to,rstb_1923_0004.txt,txt_rstb,1923,14
theory will best describe the facts ? With regard to the,to,rstb_1923_0002.txt,txt_rstb,1923,14
and (p. 385) :—‘“ These facts seem to me to establish,to,rstb_1923_0005.txt,txt_rstb,1923,14
"to experimental error, the main facts stand out: (1) that there",to,rstb_1923_0008.txt,txt_rstb,1923,14
to put upon the above facts seems to be the following,to,rstb_1923_0008.txt,txt_rstb,1923,14
such general accordance with the facts should have sprung to birth,to,rsta_1923_0006.txt,txt_rsta,1923,14
same nature occur. All these facts lead up to the inevitable,to,rstb_1924_0004.txt,txt_rstb,1924,14
"the main xylem ring), other facts have come to light which",to,rstb_1924_0004.txt,txt_rstb,1924,14
an embryo Trichosurus. All these facts appear sufticiently conclusive to justify,to,rstb_1924_0008.txt,txt_rstb,1924,14
of Asterorylon and Lycopodium. The facts before us appear fully to,to,rstb_1925_0004.txt,txt_rstb,1925,14
of the micropylar tube. Such facts seem to point rather to,to,rstb_1925_0006.txt,txt_rstb,1925,14
"canals, and also of the facts stated as to the evolutionary",to,rstb_1926_0003.txt,txt_rstb,1926,14
very many new and striking facts to our knowledge of the,to,rstb_1926_0006.txt,txt_rstb,1926,14
"in consideration of some additional facts to be demonstrated below, it",to,rstb_1927_0004.txt,txt_rstb,1927,14
membranes did not add any facts to those published by Naruorst.,to,rstb_1927_0002.txt,txt_rstb,1927,14
to add anything to the facts already published ; the length,to,rstb_1927_0002.txt,txt_rstb,1927,14
enable us to discover any facts in favour of a geological,to,rstb_1927_0002.txt,txt_rstb,1927,14
as only approximations to the facts of geographical distribution. Thus a,to,rstb_1927_0002.txt,txt_rstb,1927,14
"conclusion, then, to which the facts seem to point is that",to,rstb_1928_0002.txt,txt_rstb,1928,14
changed by 0-6 u. The facts appeared to point to some,to,rsta_1928_0007.txt,txt_rsta,1928,14
a view suggested by certain facts presently to be described. (ii),to,rstb_1929_0001.txt,txt_rstb,1929,14
question of specific identity the facts do not seem to conflict,to,rstb_1929_0001.txt,txt_rstb,1929,14
"first place, to confirm the facts recorded in Lophius in some",to,rstb_1929_0006.txt,txt_rstb,1929,14
again less in quantity. These facts point to the conclusion that,to,rstb_1929_0006.txt,txt_rstb,1929,14
Clypeastroida ” (p. 481). Two facts tend to support Hawxins’ view,to,rstb_1929_0005.txt,txt_rstb,1929,14
the Spatangoids. Two embryo- logical facts seem to be in keeping,to,rstb_1929_0005.txt,txt_rstb,1929,14
(dry flora). H Two significant facts come to light:—(q) pairs of,to,rstb_1929_0003.txt,txt_rstb,1929,14
plate is formed- 8 ‘These facts led Gaver to the conclusion,to,rstb_1929_0009.txt,txt_rstb,1929,14
"chance to give the old facts new relation- ships. This monograph,",to,rstb_1929_0004.txt,txt_rstb,1929,14
"fully-viewed atoms, then the observed facts correspond to a kind of",to,rsta_1929_0010.txt,txt_rsta,1929,14
that a reason for these facts is to be found in,to,rsta_1929_0001.txt,txt_rsta,1929,14
2). A reason for these facts is to be found in,to,rsta_1929_0001.txt,txt_rsta,1929,14
effect will be equalised. The facts relating to the epidemic of,to,rstb_1920_0003.txt,txt_rstb,1920,14
may afford against another. The facts seem to indicate that this,to,rstb_1920_0003.txt,txt_rstb,1920,14
may be answered that the facts are confined to the diagnoses,to,rstb_1920_0004.txt,txt_rstb,1920,14
in order to present our facts in an intelligible order. When,to,rstb_1920_0004.txt,txt_rstb,1920,14
"further theory to make our facts more intelligible. Now, generally speaking,",to,rstb_1920_0004.txt,txt_rstb,1920,14
allows me to add some facts to those previously recorded. The,to,rstb_1920_0001.txt,txt_rstb,1920,14
"advanced to account for the facts observed. A provisional hypothesis, based",to,rstb_1920_0002.txt,txt_rstb,1920,14
to the nutrition they receive—the facts are indeed to the contrary.,to,rstb_1920_0002.txt,txt_rstb,1920,14
to bring out the morphogenetic facts clearly. Whether this was due,to,rstb_1920_0010.txt,txt_rstb,1920,14
Such a representation of the facts has led to the recognition,to,rsta_1920_0008.txt,txt_rsta,1920,14
further research of the new facts brought to light in the,to,rsta_1920_0010.txt,txt_rsta,1920,14
the power of the new facts to guide a search even,to,rsta_1920_0010.txt,txt_rsta,1920,14
"has been possible, from the facts for wood, to frame a",to,rstb_1921_0002.txt,txt_rstb,1921,14
to attempt to relate the facts of the mechanical properties of,to,rstb_1921_0002.txt,txt_rstb,1921,14
"was based, are incorrect. These facts need not be referred to",to,rstb_1921_0002.txt,txt_rstb,1921,14
"use, to some extent, the facts described above in support of",to,rstb_1921_0002.txt,txt_rstb,1921,14
conception necessary to explain the facts described above for wood. It,to,rstb_1921_0002.txt,txt_rstb,1921,14
almost solely in relation to facts derived from the study of,to,rstb_1921_0002.txt,txt_rstb,1921,14
"its point of origin. Certain facts relevant to the foregoing must,",to,rstb_1921_0003.txt,txt_rstb,1921,14
"it now stands. As the facts present themselves to me, avenues",to,rstb_1921_0003.txt,txt_rstb,1921,14
to the oxygen consumed. The facts seem to us capable of,to,rstb_1921_0001.txt,txt_rstb,1921,14
to the same conclusion. These facts about Podocarpus are not here,to,rstb_1921_0007.txt,txt_rstb,1921,14
after Porrer’s publication appeared few facts were added to the existing,to,rstb_1921_0009.txt,txt_rstb,1921,14
"close, having regard to the facts that (i.) the linear law",to,rsta_1922_0008.txt,txt_rsta,1922,14
of such compensation of actual facts to explain a theoretical formula,to,rsta_1922_0002.txt,txt_rsta,1922,14
"OF There are therefore two facts to explain. First, the existence",to,rsta_1922_0004.txt,txt_rsta,1922,14
"stages, when the paucity of facts gives freer play to the",to,rstb_1923_0004.txt,txt_rstb,1923,14
"now, of course, some definite facts to go upon, We knew",to,rstb_1923_0004.txt,txt_rstb,1923,14
theory will best describe the facts ? With regard to the,to,rstb_1923_0002.txt,txt_rstb,1923,14
and (p. 385) :—‘“ These facts seem to me to establish,to,rstb_1923_0005.txt,txt_rstb,1923,14
"to experimental error, the main facts stand out: (1) that there",to,rstb_1923_0008.txt,txt_rstb,1923,14
to put upon the above facts seems to be the following,to,rstb_1923_0008.txt,txt_rstb,1923,14
such general accordance with the facts should have sprung to birth,to,rsta_1923_0006.txt,txt_rsta,1923,14
same nature occur. All these facts lead up to the inevitable,to,rstb_1924_0004.txt,txt_rstb,1924,14
"the main xylem ring), other facts have come to light which",to,rstb_1924_0004.txt,txt_rstb,1924,14
an embryo Trichosurus. All these facts appear sufticiently conclusive to justify,to,rstb_1924_0008.txt,txt_rstb,1924,14
of Asterorylon and Lycopodium. The facts before us appear fully to,to,rstb_1925_0004.txt,txt_rstb,1925,14
of the micropylar tube. Such facts seem to point rather to,to,rstb_1925_0006.txt,txt_rstb,1925,14
"canals, and also of the facts stated as to the evolutionary",to,rstb_1926_0003.txt,txt_rstb,1926,14
very many new and striking facts to our knowledge of the,to,rstb_1926_0006.txt,txt_rstb,1926,14
"in consideration of some additional facts to be demonstrated below, it",to,rstb_1927_0004.txt,txt_rstb,1927,14
membranes did not add any facts to those published by Naruorst.,to,rstb_1927_0002.txt,txt_rstb,1927,14
to add anything to the facts already published ; the length,to,rstb_1927_0002.txt,txt_rstb,1927,14
enable us to discover any facts in favour of a geological,to,rstb_1927_0002.txt,txt_rstb,1927,14
as only approximations to the facts of geographical distribution. Thus a,to,rstb_1927_0002.txt,txt_rstb,1927,14
"conclusion, then, to which the facts seem to point is that",to,rstb_1928_0002.txt,txt_rstb,1928,14
changed by 0-6 u. The facts appeared to point to some,to,rsta_1928_0007.txt,txt_rsta,1928,14
a view suggested by certain facts presently to be described. (ii),to,rstb_1929_0001.txt,txt_rstb,1929,14
question of specific identity the facts do not seem to conflict,to,rstb_1929_0001.txt,txt_rstb,1929,14
"first place, to confirm the facts recorded in Lophius in some",to,rstb_1929_0006.txt,txt_rstb,1929,14
again less in quantity. These facts point to the conclusion that,to,rstb_1929_0006.txt,txt_rstb,1929,14
Clypeastroida ” (p. 481). Two facts tend to support Hawxins’ view,to,rstb_1929_0005.txt,txt_rstb,1929,14
the Spatangoids. Two embryo- logical facts seem to be in keeping,to,rstb_1929_0005.txt,txt_rstb,1929,14
(dry flora). H Two significant facts come to light:—(q) pairs of,to,rstb_1929_0003.txt,txt_rstb,1929,14
plate is formed- 8 ‘These facts led Gaver to the conclusion,to,rstb_1929_0009.txt,txt_rstb,1929,14
"chance to give the old facts new relation- ships. This monograph,",to,rstb_1929_0004.txt,txt_rstb,1929,14
"fully-viewed atoms, then the observed facts correspond to a kind of",to,rsta_1929_0010.txt,txt_rsta,1929,14
that a reason for these facts is to be found in,to,rsta_1929_0001.txt,txt_rsta,1929,14
2). A reason for these facts is to be found in,to,rsta_1929_0001.txt,txt_rsta,1929,14
"can be ascertained from the facts of geological distribution, the Pygasteridze",from,rstb_1920_0010.txt,txt_rstb,1920,14
in indirect deduction from experimental facts which record the change of,from,rsta_1920_0008.txt,txt_rsta,1920,14
"has been possible, from the facts for wood, to frame a",from,rstb_1921_0002.txt,txt_rstb,1921,14
in general agreement with the facts derived from the microscopic appearances,from,rstb_1921_0002.txt,txt_rstb,1921,14
almost solely in relation to facts derived from the study of,from,rstb_1921_0002.txt,txt_rstb,1921,14
at above. From all these facts the conclusion may be drawn,from,rsta_1923_0004.txt,txt_rsta,1923,14
arisen by mutation. From the facts which research upon isolated stocks,from,rstb_1924_0005.txt,txt_rstb,1924,14
