Context,Collocate,File,Directory,Year,Frequency Filter
"various angles, and the observed facts are compared with what would",the,rsta_1921_0011.txt,txt_rsta,1921,14
§ 4.3 below. The above facts indicate the lines on which,the,rsta_1921_0010.txt,txt_rsta,1921,14
Since the number of independent facts supplied in 2x 2 312,the,rsta_1922_0009.txt,txt_rsta,1922,14
"greater than the number of facts sought, much of the information",the,rsta_1922_0009.txt,txt_rsta,1922,14
"close, having regard to the facts that (i.) the linear law",the,rsta_1922_0008.txt,txt_rsta,1922,14
"OF There are therefore two facts to explain. First, the existence",the,rsta_1922_0004.txt,txt_rsta,1922,14
"larvee. There were, however, several facts which spoke against the theory",the,rstb_1923_0004.txt,txt_rstb,1923,14
"stages, when the paucity of facts gives freer play to the",the,rstb_1923_0004.txt,txt_rstb,1923,14
"eel, as indicated by the facts now ascertained. During the autumn",the,rstb_1923_0004.txt,txt_rstb,1923,14
theory will best describe the facts ? With regard to the,the,rstb_1923_0002.txt,txt_rstb,1923,14
and in its absence. The facts are the direct converse of,the,rstb_1923_0006.txt,txt_rstb,1923,14
"to experimental error, the main facts stand out: (1) that there",the,rstb_1923_0008.txt,txt_rstb,1923,14
Blood at Rest. Whilst the facts given above are a mere,the,rstb_1923_0008.txt,txt_rstb,1923,14
pointed out that the observed facts might be met on the,the,rstb_1923_0008.txt,txt_rstb,1923,14
to put upon the above facts seems to be the following,the,rstb_1923_0008.txt,txt_rstb,1923,14
such general accordance with the facts should have sprung to birth,the,rsta_1923_0006.txt,txt_rsta,1923,14
"qualitative descrip- tion of the facts observed. When, however, the observations",the,rsta_1923_0003.txt,txt_rsta,1923,14
celluloid will account for the facts observed. This heterogeneity may be,the,rsta_1923_0003.txt,txt_rsta,1923,14
we cannot account for the facts observed on this theory if,the,rsta_1923_0003.txt,txt_rsta,1923,14
the load is decreased. These facts have an important bearing on,the,rsta_1923_0003.txt,txt_rsta,1923,14
at above. From all these facts the conclusion may be drawn,the,rsta_1923_0004.txt,txt_rsta,1923,14
of temperature. Hence the preceding facts may be summarised as follows:,the,rsta_1923_0004.txt,txt_rsta,1923,14
just described establish the following facts :— 1. That the specialised,the,rstb_1924_0001.txt,txt_rstb,1924,14
"of Trachinus draco, establishes the facts that the venom is both",the,rstb_1924_0001.txt,txt_rstb,1924,14
same nature occur. All these facts lead up to the inevitable,the,rstb_1924_0004.txt,txt_rstb,1924,14
"liane stem structure, then other facts support the hypothesis that the",the,rstb_1924_0004.txt,txt_rstb,1924,14
"the main xylem ring), other facts have come to light which",the,rstb_1924_0004.txt,txt_rstb,1924,14
arisen by mutation. From the facts which research upon isolated stocks,the,rstb_1924_0005.txt,txt_rstb,1924,14
"is concerned, With the main facts in hand, it appears that",the,rstb_1924_0005.txt,txt_rstb,1924,14
"is evident that, if the facts are as I have stated",the,rstb_1924_0007.txt,txt_rstb,1924,14
purely anatomical character of the facts upon which they are based.,the,rstb_1924_0007.txt,txt_rstb,1924,14
"origin and distribution, . These facts suggest that the * It",the,rstb_1924_0008.txt,txt_rstb,1924,14
"with the pars superior. These facts are not revealed, however, by",the,rstb_1924_0008.txt,txt_rstb,1924,14
"theory embracing all the known facts exists at present. Thus, though",the,rsta_1924_0001.txt,txt_rsta,1924,14
of Asterorylon and Lycopodium. The facts before us appear fully to,the,rstb_1925_0004.txt,txt_rstb,1925,14
In view of the foregoing facts it would seem worth while,the,rstb_1925_0003.txt,txt_rstb,1925,14
lies not only in the facts that for a fine division,the,rstb_1925_0003.txt,txt_rstb,1925,14
facilitated by the body of facts expressed in these curves. Previous,the,rstb_1925_0003.txt,txt_rstb,1925,14
"is capable of representing the facts with considerable precision, more closely",the,rstb_1925_0002.txt,txt_rstb,1925,14
be drawn from the observed facts of variation. The answer is,the,rstb_1925_0002.txt,txt_rstb,1925,14
"slightly closer representation of the facts ; at all events, a",the,rstb_1925_0002.txt,txt_rstb,1925,14
but when taken with the facts of association they justify us,the,rstb_1925_0006.txt,txt_rstb,1925,14
"So far as the available facts go, it is not impossible",the,rstb_1925_0006.txt,txt_rstb,1925,14
of the micropylar tube. Such facts seem to point rather to,the,rstb_1925_0006.txt,txt_rstb,1925,14
"instructive section, of which the facts recorded in our note books",the,rstb_1925_0005.txt,txt_rstb,1925,14
"is indicated by the following facts :— First, the nearest Silurian",the,rstb_1925_0005.txt,txt_rstb,1925,14
also remark that the essential facts shown in the section of,the,rstb_1925_0005.txt,txt_rstb,1925,14
beyond Indo-China. 'The essential major facts in the structure of eastern,the,rstb_1925_0005.txt,txt_rstb,1925,14
by anyone not knowing the facts already disclosed in con- nection,the,rstb_1926_0003.txt,txt_rstb,1926,14
"canals, and also of the facts stated as to the evolutionary",the,rstb_1926_0003.txt,txt_rstb,1926,14
very many new and striking facts to our knowledge of the,the,rstb_1926_0006.txt,txt_rstb,1926,14
based on a number of facts concerning the relations of the,the,rstb_1926_0009.txt,txt_rstb,1926,14
the light of these new facts shows that very probably the,the,rstb_1927_0004.txt,txt_rstb,1927,14
(1907-09). ‘A Study of some Facts and Theories bearing upon the,the,rstb_1927_0005.txt,txt_rstb,1927,14
"present in Lophius. From the facts at our disposal it seems,",the,rstb_1927_0001.txt,txt_rstb,1927,14
"researches, the whole of the facts set forth above, I think",the,rstb_1927_0001.txt,txt_rstb,1927,14
"one can judge from the facts ascertained, there are in Lophius",the,rstb_1927_0001.txt,txt_rstb,1927,14
cells of Type II. These facts demonstrate that the function of,the,rstb_1927_0008.txt,txt_rstb,1927,14
"never been confirmed, and the facts put forward earlier in this",the,rstb_1927_0008.txt,txt_rstb,1927,14
those of extrinsic fibres. The facts that the neurones of Type,the,rstb_1927_0008.txt,txt_rstb,1927,14
in the some of the facts mentioned in this Section. ‘,the,rstb_1927_0002.txt,txt_rstb,1927,14
to add anything to the facts already published ; the length,the,rstb_1927_0002.txt,txt_rstb,1927,14
as only approximations to the facts of geographical distribution. Thus a,the,rstb_1927_0002.txt,txt_rstb,1927,14
use being made of the facts that the law of energy,the,rsta_1927_0002.txt,txt_rsta,1927,14
these air-breathing fishes the following facts should be carefully noticed :—,the,rstb_1928_0003.txt,txt_rstb,1928,14
"appear then from, the observed facts that the frequency gradient associated",the,rstb_1928_0001.txt,txt_rstb,1928,14
negative or positive correlation. The facts that plants of moist habitats,the,rstb_1928_0001.txt,txt_rstb,1928,14
intrasclerotomic (= intervertebral) position. These facts explain the paired character of,the,rstb_1928_0006.txt,txt_rstb,1928,14
"conclusion, then, to which the facts seem to point is that",the,rstb_1928_0002.txt,txt_rstb,1928,14
can be placed on the facts in Hemimysis. ‘The anus pushes,the,rstb_1928_0008.txt,txt_rstb,1928,14
using an index law. These facts illustrate the great importance of,the,rsta_1928_0009.txt,txt_rsta,1928,14
"proportions is given below, the facts being recorded for convenience in",the,rsta_1928_0007.txt,txt_rsta,1928,14
changed by 0-6 u. The facts appeared to point to some,the,rsta_1928_0007.txt,txt_rsta,1928,14
secondary positive pulse. Thus the facts that the portion of curve,the,rsta_1928_0002.txt,txt_rsta,1928,14
"no doubt was erect. ‘The facts suggested, at the time, the",the,rstb_1929_0001.txt,txt_rstb,1929,14
the parent stem. ‘These are facts of importance in a reconstruction,the,rstb_1929_0001.txt,txt_rstb,1929,14
the foliage. But with the facts at our disposal it is,the,rstb_1929_0001.txt,txt_rstb,1929,14
"axis. But now that the facts are known, a symmetrical disposition",the,rstb_1929_0001.txt,txt_rstb,1929,14
"the older petioles. Viewing the facts as they are, and they",the,rstb_1929_0001.txt,txt_rstb,1929,14
cells as in Clepsydropsis. These facts suggest that the organ may,the,rstb_1929_0001.txt,txt_rstb,1929,14
question of specific identity the facts do not seem to conflict,the,rstb_1929_0001.txt,txt_rstb,1929,14
—One of the most interesting facts about C. australis is its,the,rstb_1929_0001.txt,txt_rstb,1929,14
Linkage of Chromosomes. Several notable facts regarding the pairing and linkage,the,rstb_1929_0007.txt,txt_rstb,1929,14
"efferent component vessels. From the facts observed in Lophius, I put",the,rstb_1929_0006.txt,txt_rstb,1929,14
"first place, to confirm the facts recorded in Lophius in some",the,rstb_1929_0006.txt,txt_rstb,1929,14
on all fours with the facts observed in greater detail in,the,rstb_1929_0006.txt,txt_rstb,1929,14
Vessel System. With only the facts furnished by my investigation of,the,rstb_1929_0006.txt,txt_rstb,1929,14
again less in quantity. These facts point to the conclusion that,the,rstb_1929_0006.txt,txt_rstb,1929,14
"This seems likely from the facts observed in the Cod, and",the,rstb_1929_0006.txt,txt_rstb,1929,14
"origin and morphological status. The facts so far ascertained show clearly,",the,rstb_1929_0006.txt,txt_rstb,1929,14
"anatomy and embryology, but the facts : regarding them set forth",the,rstb_1929_0006.txt,txt_rstb,1929,14
"think, at variance with the facts revealed by comparative anatomy and",the,rstb_1929_0006.txt,txt_rstb,1929,14
"in structure and contents. The facts of comparative anatomy, as may",the,rstb_1929_0006.txt,txt_rstb,1929,14
"some extent suggested by the facts of embryology. It is, of",the,rstb_1929_0006.txt,txt_rstb,1929,14
"the embryo, and also the facts shown by a comparative study",the,rstb_1929_0006.txt,txt_rstb,1929,14
If Sapm’s interpretation of the facts of the early ontogeny are,the,rstb_1929_0006.txt,txt_rstb,1929,14
"I am assuming from the facts observed in Teleosteans, the lymphatic",the,rstb_1929_0006.txt,txt_rstb,1929,14
"class Echinoidea, some of the facts brought forward in the papers",the,rstb_1929_0005.txt,txt_rstb,1929,14
the Spatangoids. Two embryo- logical facts seem to be in keeping,the,rstb_1929_0005.txt,txt_rstb,1929,14
plate is formed- 8 ‘These facts led Gaver to the conclusion,the,rstb_1929_0009.txt,txt_rstb,1929,14
Gaupp’s theory would fit the facts provided that a satisfactory explanation,the,rstb_1929_0009.txt,txt_rstb,1929,14
"chance to give the old facts new relation- ships. This monograph,",the,rstb_1929_0004.txt,txt_rstb,1929,14
"is generally conceded, then the facts presented might hint that the",the,rstb_1929_0004.txt,txt_rstb,1929,14
A STELLAR ATMOSPHERE. The observed facts are that hydrogen shows a,the,rsta_1929_0010.txt,txt_rsta,1929,14
"fully-viewed atoms, then the observed facts correspond to a kind of",the,rsta_1929_0010.txt,txt_rsta,1929,14
"$’,4 and Q. From these facts we deduce the follow- ing:",the,rsta_1929_0008.txt,txt_rsta,1929,14
ay ‘Making use of these facts we see that the variable,the,rsta_1929_0002.txt,txt_rsta,1929,14
the result does not represent facts when weak fields are employed.,the,rsta_1929_0002.txt,txt_rsta,1929,14
in order to present our facts in an intelligible order. When,in,rstb_1920_0004.txt,txt_rstb,1920,14
"in the Cretaceous Cheilostomes, the facts are as follows. The skeletal",in,rstb_1920_0004.txt,txt_rstb,1920,14
"Cyclotosaurus in which genus the facts are not known, they do",in,rstb_1920_0001.txt,txt_rstb,1920,14
"a detailed description of the facts in Amblystoma, has recently been",in,rstb_1920_0001.txt,txt_rstb,1920,14
equally in accordance with the facts that are at present available.,in,rstb_1920_0002.txt,txt_rstb,1920,14
less in accord with observed facts than the one indicated above.,in,rstb_1920_0010.txt,txt_rstb,1920,14
"possible, in the light of facts and morphogenetic tendencies as yet",in,rstb_1920_0010.txt,txt_rstb,1920,14
in indirect deduction from experimental facts which record the change of,in,rsta_1920_0008.txt,txt_rsta,1920,14
further research of the new facts brought to light in the,in,rsta_1920_0010.txt,txt_rsta,1920,14
of work obtained increases. These facts confirm the theory discussed in,in,rstb_1921_0005.txt,txt_rstb,1921,14
"use, to some extent, the facts described above in support of",in,rstb_1921_0002.txt,txt_rstb,1921,14
in general agreement with the facts derived from the microscopic appearances,in,rstb_1921_0002.txt,txt_rstb,1921,14
almost solely in relation to facts derived from the study of,in,rstb_1921_0002.txt,txt_rstb,1921,14
of Recorded Mutations. The essential facts in the preceding pages may,in,rstb_1921_0003.txt,txt_rstb,1921,14
": in the light of facts which have since been observed,",in,rstb_1921_0007.txt,txt_rstb,1921,14
Miss AASE (1915) has published facts which are of value in,in,rstb_1921_0007.txt,txt_rstb,1921,14
in expressing and co-ordinating the facts in a scheme that adequately,in,rstb_1921_0008.txt,txt_rstb,1921,14
"drawn in illustration of the facts observed are treated rather diagrammatically,",in,rstb_1921_0008.txt,txt_rstb,1921,14
usually very small. All these facts are evidently in complete agreement,in,rsta_1921_0006.txt,txt_rsta,1921,14
Since the number of independent facts supplied in 2x 2 312,in,rsta_1922_0009.txt,txt_rsta,1922,14
and in its absence. The facts are the direct converse of,in,rstb_1923_0006.txt,txt_rstb,1923,14
"is concerned, With the main facts in hand, it appears that",in,rstb_1924_0005.txt,txt_rstb,1924,14
In view of the foregoing facts it would seem worth while,in,rstb_1925_0003.txt,txt_rstb,1925,14
lies not only in the facts that for a fine division,in,rstb_1925_0003.txt,txt_rstb,1925,14
facilitated by the body of facts expressed in these curves. Previous,in,rstb_1925_0003.txt,txt_rstb,1925,14
"instructive section, of which the facts recorded in our note books",in,rstb_1925_0005.txt,txt_rstb,1925,14
also remark that the essential facts shown in the section of,in,rstb_1925_0005.txt,txt_rstb,1925,14
beyond Indo-China. 'The essential major facts in the structure of eastern,in,rstb_1925_0005.txt,txt_rstb,1925,14
by anyone not knowing the facts already disclosed in con- nection,in,rstb_1926_0003.txt,txt_rstb,1926,14
"in consideration of some additional facts to be demonstrated below, it",in,rstb_1927_0004.txt,txt_rstb,1927,14
"present in Lophius. From the facts at our disposal it seems,",in,rstb_1927_0001.txt,txt_rstb,1927,14
it is possible that certain facts recorded by Frrcuson (5) in,in,rstb_1927_0001.txt,txt_rstb,1927,14
"one can judge from the facts ascertained, there are in Lophius",in,rstb_1927_0001.txt,txt_rstb,1927,14
"never been confirmed, and the facts put forward earlier in this",in,rstb_1927_0008.txt,txt_rstb,1927,14
in the some of the facts mentioned in this Section. ‘,in,rstb_1927_0002.txt,txt_rstb,1927,14
enable us to discover any facts in favour of a geological,in,rstb_1927_0002.txt,txt_rstb,1927,14
réswmé of these and other facts is given by MULLIKEN in,in,rsta_1927_0005.txt,txt_rsta,1927,14
"a,,=«'’n’. In Table IX these facts are illus- trated : A”",in,rsta_1927_0005.txt,txt_rsta,1927,14
unintelligibility. Tn view of these facts we seem thoroughly justified in,in,rstb_1928_0002.txt,txt_rstb,1928,14
can be placed on the facts in Hemimysis. ‘The anus pushes,in,rstb_1928_0008.txt,txt_rstb,1928,14
"proportions is given below, the facts being recorded for convenience in",in,rsta_1928_0007.txt,txt_rsta,1928,14
the parent stem. ‘These are facts of importance in a reconstruction,in,rstb_1929_0001.txt,txt_rstb,1929,14
cells as in Clepsydropsis. These facts suggest that the organ may,in,rstb_1929_0001.txt,txt_rstb,1929,14
"efferent component vessels. From the facts observed in Lophius, I put",in,rstb_1929_0006.txt,txt_rstb,1929,14
"first place, to confirm the facts recorded in Lophius in some",in,rstb_1929_0006.txt,txt_rstb,1929,14
on all fours with the facts observed in greater detail in,in,rstb_1929_0006.txt,txt_rstb,1929,14
again less in quantity. These facts point to the conclusion that,in,rstb_1929_0006.txt,txt_rstb,1929,14
"This seems likely from the facts observed in the Cod, and",in,rstb_1929_0006.txt,txt_rstb,1929,14
"in structure and contents. The facts of comparative anatomy, as may",in,rstb_1929_0006.txt,txt_rstb,1929,14
"I am assuming from the facts observed in Teleosteans, the lymphatic",in,rstb_1929_0006.txt,txt_rstb,1929,14
"class Echinoidea, some of the facts brought forward in the papers",in,rstb_1929_0005.txt,txt_rstb,1929,14
the Spatangoids. Two embryo- logical facts seem to be in keeping,in,rstb_1929_0005.txt,txt_rstb,1929,14
in that vicinity. If these facts form a basis for judg-,in,rstb_1929_0004.txt,txt_rstb,1929,14
that a reason for these facts is to be found in,in,rsta_1929_0001.txt,txt_rsta,1929,14
2). A reason for these facts is to be found in,in,rsta_1929_0001.txt,txt_rsta,1929,14
in order to present our facts in an intelligible order. When,in,rstb_1920_0004.txt,txt_rstb,1920,14
"in the Cretaceous Cheilostomes, the facts are as follows. The skeletal",in,rstb_1920_0004.txt,txt_rstb,1920,14
"Cyclotosaurus in which genus the facts are not known, they do",in,rstb_1920_0001.txt,txt_rstb,1920,14
"a detailed description of the facts in Amblystoma, has recently been",in,rstb_1920_0001.txt,txt_rstb,1920,14
equally in accordance with the facts that are at present available.,in,rstb_1920_0002.txt,txt_rstb,1920,14
less in accord with observed facts than the one indicated above.,in,rstb_1920_0010.txt,txt_rstb,1920,14
"possible, in the light of facts and morphogenetic tendencies as yet",in,rstb_1920_0010.txt,txt_rstb,1920,14
in indirect deduction from experimental facts which record the change of,in,rsta_1920_0008.txt,txt_rsta,1920,14
further research of the new facts brought to light in the,in,rsta_1920_0010.txt,txt_rsta,1920,14
of work obtained increases. These facts confirm the theory discussed in,in,rstb_1921_0005.txt,txt_rstb,1921,14
"use, to some extent, the facts described above in support of",in,rstb_1921_0002.txt,txt_rstb,1921,14
in general agreement with the facts derived from the microscopic appearances,in,rstb_1921_0002.txt,txt_rstb,1921,14
almost solely in relation to facts derived from the study of,in,rstb_1921_0002.txt,txt_rstb,1921,14
of Recorded Mutations. The essential facts in the preceding pages may,in,rstb_1921_0003.txt,txt_rstb,1921,14
": in the light of facts which have since been observed,",in,rstb_1921_0007.txt,txt_rstb,1921,14
Miss AASE (1915) has published facts which are of value in,in,rstb_1921_0007.txt,txt_rstb,1921,14
in expressing and co-ordinating the facts in a scheme that adequately,in,rstb_1921_0008.txt,txt_rstb,1921,14
"drawn in illustration of the facts observed are treated rather diagrammatically,",in,rstb_1921_0008.txt,txt_rstb,1921,14
usually very small. All these facts are evidently in complete agreement,in,rsta_1921_0006.txt,txt_rsta,1921,14
Since the number of independent facts supplied in 2x 2 312,in,rsta_1922_0009.txt,txt_rsta,1922,14
and in its absence. The facts are the direct converse of,in,rstb_1923_0006.txt,txt_rstb,1923,14
"is concerned, With the main facts in hand, it appears that",in,rstb_1924_0005.txt,txt_rstb,1924,14
In view of the foregoing facts it would seem worth while,in,rstb_1925_0003.txt,txt_rstb,1925,14
lies not only in the facts that for a fine division,in,rstb_1925_0003.txt,txt_rstb,1925,14
facilitated by the body of facts expressed in these curves. Previous,in,rstb_1925_0003.txt,txt_rstb,1925,14
"instructive section, of which the facts recorded in our note books",in,rstb_1925_0005.txt,txt_rstb,1925,14
also remark that the essential facts shown in the section of,in,rstb_1925_0005.txt,txt_rstb,1925,14
beyond Indo-China. 'The essential major facts in the structure of eastern,in,rstb_1925_0005.txt,txt_rstb,1925,14
by anyone not knowing the facts already disclosed in con- nection,in,rstb_1926_0003.txt,txt_rstb,1926,14
"in consideration of some additional facts to be demonstrated below, it",in,rstb_1927_0004.txt,txt_rstb,1927,14
"present in Lophius. From the facts at our disposal it seems,",in,rstb_1927_0001.txt,txt_rstb,1927,14
it is possible that certain facts recorded by Frrcuson (5) in,in,rstb_1927_0001.txt,txt_rstb,1927,14
"one can judge from the facts ascertained, there are in Lophius",in,rstb_1927_0001.txt,txt_rstb,1927,14
"never been confirmed, and the facts put forward earlier in this",in,rstb_1927_0008.txt,txt_rstb,1927,14
in the some of the facts mentioned in this Section. ‘,in,rstb_1927_0002.txt,txt_rstb,1927,14
enable us to discover any facts in favour of a geological,in,rstb_1927_0002.txt,txt_rstb,1927,14
réswmé of these and other facts is given by MULLIKEN in,in,rsta_1927_0005.txt,txt_rsta,1927,14
"a,,=«'’n’. In Table IX these facts are illus- trated : A”",in,rsta_1927_0005.txt,txt_rsta,1927,14
unintelligibility. Tn view of these facts we seem thoroughly justified in,in,rstb_1928_0002.txt,txt_rstb,1928,14
can be placed on the facts in Hemimysis. ‘The anus pushes,in,rstb_1928_0008.txt,txt_rstb,1928,14
"proportions is given below, the facts being recorded for convenience in",in,rsta_1928_0007.txt,txt_rsta,1928,14
the parent stem. ‘These are facts of importance in a reconstruction,in,rstb_1929_0001.txt,txt_rstb,1929,14
cells as in Clepsydropsis. These facts suggest that the organ may,in,rstb_1929_0001.txt,txt_rstb,1929,14
"efferent component vessels. From the facts observed in Lophius, I put",in,rstb_1929_0006.txt,txt_rstb,1929,14
"first place, to confirm the facts recorded in Lophius in some",in,rstb_1929_0006.txt,txt_rstb,1929,14
on all fours with the facts observed in greater detail in,in,rstb_1929_0006.txt,txt_rstb,1929,14
again less in quantity. These facts point to the conclusion that,in,rstb_1929_0006.txt,txt_rstb,1929,14
"This seems likely from the facts observed in the Cod, and",in,rstb_1929_0006.txt,txt_rstb,1929,14
"in structure and contents. The facts of comparative anatomy, as may",in,rstb_1929_0006.txt,txt_rstb,1929,14
"I am assuming from the facts observed in Teleosteans, the lymphatic",in,rstb_1929_0006.txt,txt_rstb,1929,14
"class Echinoidea, some of the facts brought forward in the papers",in,rstb_1929_0005.txt,txt_rstb,1929,14
the Spatangoids. Two embryo- logical facts seem to be in keeping,in,rstb_1929_0005.txt,txt_rstb,1929,14
in that vicinity. If these facts form a basis for judg-,in,rstb_1929_0004.txt,txt_rstb,1929,14
that a reason for these facts is to be found in,in,rsta_1929_0001.txt,txt_rsta,1929,14
2). A reason for these facts is to be found in,in,rsta_1929_0001.txt,txt_rsta,1929,14
effect will be equalised. The facts relating to the epidemic of,to,rstb_1920_0003.txt,txt_rstb,1920,14
may afford against another. The facts seem to indicate that this,to,rstb_1920_0003.txt,txt_rstb,1920,14
may be answered that the facts are confined to the diagnoses,to,rstb_1920_0004.txt,txt_rstb,1920,14
in order to present our facts in an intelligible order. When,to,rstb_1920_0004.txt,txt_rstb,1920,14
"further theory to make our facts more intelligible. Now, generally speaking,",to,rstb_1920_0004.txt,txt_rstb,1920,14
allows me to add some facts to those previously recorded. The,to,rstb_1920_0001.txt,txt_rstb,1920,14
"advanced to account for the facts observed. A provisional hypothesis, based",to,rstb_1920_0002.txt,txt_rstb,1920,14
to the nutrition they receive—the facts are indeed to the contrary.,to,rstb_1920_0002.txt,txt_rstb,1920,14
to bring out the morphogenetic facts clearly. Whether this was due,to,rstb_1920_0010.txt,txt_rstb,1920,14
Such a representation of the facts has led to the recognition,to,rsta_1920_0008.txt,txt_rsta,1920,14
further research of the new facts brought to light in the,to,rsta_1920_0010.txt,txt_rsta,1920,14
the power of the new facts to guide a search even,to,rsta_1920_0010.txt,txt_rsta,1920,14
"has been possible, from the facts for wood, to frame a",to,rstb_1921_0002.txt,txt_rstb,1921,14
to attempt to relate the facts of the mechanical properties of,to,rstb_1921_0002.txt,txt_rstb,1921,14
"was based, are incorrect. These facts need not be referred to",to,rstb_1921_0002.txt,txt_rstb,1921,14
"use, to some extent, the facts described above in support of",to,rstb_1921_0002.txt,txt_rstb,1921,14
conception necessary to explain the facts described above for wood. It,to,rstb_1921_0002.txt,txt_rstb,1921,14
almost solely in relation to facts derived from the study of,to,rstb_1921_0002.txt,txt_rstb,1921,14
"its point of origin. Certain facts relevant to the foregoing must,",to,rstb_1921_0003.txt,txt_rstb,1921,14
"it now stands. As the facts present themselves to me, avenues",to,rstb_1921_0003.txt,txt_rstb,1921,14
to the oxygen consumed. The facts seem to us capable of,to,rstb_1921_0001.txt,txt_rstb,1921,14
to the same conclusion. These facts about Podocarpus are not here,to,rstb_1921_0007.txt,txt_rstb,1921,14
after Porrer’s publication appeared few facts were added to the existing,to,rstb_1921_0009.txt,txt_rstb,1921,14
"close, having regard to the facts that (i.) the linear law",to,rsta_1922_0008.txt,txt_rsta,1922,14
of such compensation of actual facts to explain a theoretical formula,to,rsta_1922_0002.txt,txt_rsta,1922,14
"OF There are therefore two facts to explain. First, the existence",to,rsta_1922_0004.txt,txt_rsta,1922,14
"stages, when the paucity of facts gives freer play to the",to,rstb_1923_0004.txt,txt_rstb,1923,14
"now, of course, some definite facts to go upon, We knew",to,rstb_1923_0004.txt,txt_rstb,1923,14
theory will best describe the facts ? With regard to the,to,rstb_1923_0002.txt,txt_rstb,1923,14
and (p. 385) :—‘“ These facts seem to me to establish,to,rstb_1923_0005.txt,txt_rstb,1923,14
