Context,Word,File,Directory
and I noticed a curious fact which I first remarked in,a,Unknown,Unknown
"This, I think, is a fact which deserves some consideration with",a,Unknown,Unknown
"granulation of the surface, a fact which proved most distinetly that",a,Unknown,Unknown
"susceptible of impregnation. A remarkable fact which I noticed, at a",a,Unknown,Unknown
to a certainty by the fact that the spermatozoa are not,a,Unknown,Unknown
"the Malpighian Fyesicles ; a fact which, I think, tends to",a,Unknown,Unknown
"parts in those organs, a fact which $hows the analogy they",a,Unknown,Unknown
"floating cells. It is a fact of singular interest, that the",a,Unknown,Unknown
lined with vibratile epithelium. This fact establishes a connection between the,a,Unknown,Unknown
ventured to estimate this frequent fact as a direct demonstration of,a,Unknown,Unknown
do not branch. In this fact is seen a beautiful provision,a,Unknown,Unknown
cells. This is a constant fact observed with the utmost exactness,a,Unknown,Unknown
"several varieties. It is a fact of considerable interest, that the",a,Unknown,Unknown
inferior molluscan families. In this fact they exhibit a near approximation,a,Unknown,Unknown
also in accordance with a fact long since ascertained by phy-,a,rstl_1852_0005.txt,txt_rstl
and the commutator might in fact be made to a large,a,rstl_1852_0012.txt,txt_rstl
"overlook the still more remarkable fact which they manifest, of a",a,Unknown,Unknown
"of a most im- portant fact discovered by RaxkxixNg and CLavus1vs,",a,Unknown,Unknown
"of generation, it is in fact a closed curve, like all",a,Unknown,Unknown
be a circle; yet the fact is not 80. The inter-,a,Unknown,Unknown
consequences. Now this is a fact of great import- ance to,a,Unknown,Unknown
of a particular plane; in fact «Xx « and BX 3,a,Unknown,Unknown
and Az+BB+Cy; and from this fact a number of curious symbolical,a,Unknown,Unknown
"a future paper; but the fact is, Q' is a distributive",a,Unknown,Unknown
"reference to it, and in fact ignoring such a condition of",a,rstl_1852_0004.txt,txt_rstl
were conclusive as to the fact of a change of refrangibility.,a,Unknown,Unknown
"doubt, either as to the fact of a change of re-",a,Unknown,Unknown
drying the archil. And #n fact when a small quantity of,a,Unknown,Unknown
in this manner was in fact found Ea disperse a red,a,Unknown,Unknown
"interest- ing to mention a fact which I have since observed,",a,Unknown,Unknown
"of the vertebrata, A similar fact is said to have been",a,Unknown,Unknown
"growth of the animal, a fact which we can reconcile with",a,rstl_1853_0015.txt,txt_rstl
only difference being in the fact that the endoderm forms a,a,rstl_1853_0015.txt,txt_rstl
"marine Tubulariadea ; each/of them'is/in fact a fixed Medusa: developing' within,",a,rstl_1853_0015.txt,txt_rstl
also we find the same fact occurring; the value of a,a,rstl_1853_0006.txt,txt_rstl
daily disturbances ;' but the fact is interesting as evidencing a,a,rstl_1853_0006.txt,txt_rstl
"from Damorseav's tables, gives in fact a comparison between the true",a,rstl_1853_0007.txt,txt_rstl
"is necessary to bear this fact in mind, for on a",a,Unknown,Unknown
"transparent tissue, and has in fact become developed into a lacunal",a,Unknown,Unknown
August 17 and 26 this fact is strikingly coincident with a,a,Unknown,Unknown
cluded that purpurine is in fact a mixture of those two,a,rstl_1853_0003.txt,txt_rstl
more manifest proof of the fact of purpurine not being a,a,rstl_1853_0003.txt,txt_rstl
has arisen seemingly from the fact that a sort of cleft,a,Unknown,Unknown
It is a very interesting fact that Professor Mi'LLEs has found,a,Unknown,Unknown
behind the anus; is in fact a post-abdomen*. Plate V. figs.,a,Unknown,Unknown
in assuming that the anatomical fact of a neural flexure indicates,a,Unknown,Unknown
"of a Heteropod, is. in fact s0 totally different as at",a,Unknown,Unknown
"now supplied to me a fact which renders these considera- tions,",a,Unknown,Unknown
more or less fecundated. The fact of the existence of a,a,Unknown,Unknown
"animals. S Thus then, the fact of only a slight wavy",a,Unknown,Unknown
subjoin my testimony to a fact which I had heretofore failed,a,Unknown,Unknown
"the inference deducible from the fact seemed to be, that a",a,Unknown,Unknown
"had promised to show the fact of penetration to a friend,",a,Unknown,Unknown
"envelopes of the egg; a fact which, when known, seemed further",a,Unknown,Unknown
"very. simple factor, which in fact will-be a constant, power of",a,Unknown,Unknown
to the Bezoutiant ; in fact there exists a whole family,a,Unknown,Unknown
"treated as known, having in fact been completely determined as a",a,Unknown,Unknown
"somewhat long, T being in fact represented by a double sum",a,Unknown,Unknown
from any cumulant being in fact representable under theform of a,a,Unknown,Unknown
a syStem. S. Is in fact J2 3 ( CT TEOna,a,Unknown,Unknown
the Scolopendre are armed. This fact is of consequence in a,a,Unknown,Unknown
the inductive state being in fact a necessary preliminary to discharge.”,a,Unknown,Unknown
a first view this Jast fact appears to prove that potash,a,rstl_1844_0002.txt,txt_rstl
if simply stated as a fact a few years ago. By,a,Unknown,Unknown
"in England to a physiological fact discovered by myself, and described",a,rstl_1845_0013.txt,txt_rstl
seem to be a first fact of induction of that force,a,rstl_1845_0013.txt,txt_rstl
"although a knowledge of this fact is illus- trative, not only",a,rstl_1845_0002.txt,txt_rstl
and freshbwater springs; . a fact to be ascribed probably to,a,rstl_1845_0002.txt,txt_rstl
"upheaving of plutonic rocks, a fact that speaks intelligibly as to",a,rstl_1845_0002.txt,txt_rstl
"however brought about, is a fact which hardly admits of being",a,Unknown,Unknown
he also states the striking fact that he had found a,a,rstl_1846_0003.txt,txt_rstl
"was en- shrined, is a fact not less remarkable than the",a,Unknown,Unknown
"is distended, and is in fact a con- tinuation of the",a,Unknown,Unknown
"immediately (assuming it as a fact very probable, but still to",a,rstl_1846_0013.txt,txt_rstl
"glaciers unite, it is a fact that the structure immediately becomes",a,rstl_1846_0013.txt,txt_rstl
mass most perfect ; a fact stated and referred to its,a,Unknown,Unknown
"a question s0 remarkable a fact in Physical Geography, —to fix",a,Unknown,Unknown
to 48%. It is in fact a magnetic survey of the,a,Unknown,Unknown
"—Read February 12, 1846. A FACT not yet well understood is",a,rstl_1846_0012.txt,txt_rstl
silver. If it be a fact that the chemical powers of,a,rstl_1846_0012.txt,txt_rstl
"parts, and it being a fact that during the slow combustion",a,rstl_1846_0012.txt,txt_rstl
And if it be a fact that during the slow combustion,a,rstl_1846_0012.txt,txt_rstl
singular and the most important fact in a theoretical point of,a,rstl_1847_0014.txt,txt_rstl
"here call attention to a fact 80mewhat remarkable, which has always",a,Unknown,Unknown
the numerous contractions. The above fact establishes a fresh connection between,a,Unknown,Unknown
there under observation. A singular fact is established by some of,a,rstl_1847_0007.txt,txt_rstl
"This register well illustrates a fact that has been frequently noticed,",a,rstl_1847_0008.txt,txt_rstl
"electrode to the negative, a fact which may be verified with",a,Unknown,Unknown
this section by stating a fact which appears to me to,a,Unknown,Unknown
the other side experiences; a fact which is confirmed by the,a,Unknown,Unknown
found that it did in fact afford indications of snch a,a,Unknown,Unknown
not a little remarkable. In fact the southern stars would seem,a,Unknown,Unknown
"sky. Hence, as a general fact it may be considered, that",a,Unknown,Unknown
be mentioned the ob- served fact that the definition of a,a,Unknown,Unknown
implanted in the alveolus; a fact doubtless connected with the similar,a,Unknown,Unknown
"a certain apparent amount of fact to support it, and because",a,Unknown,Unknown
acid in wax is a fact to which we have no,a,Unknown,Unknown
It is certainly a strange fact that the presence of this,a,Unknown,Unknown
"light in this phenomenon, the fact that having placed a Convolvulus",a,Unknown,Unknown
"and satisfactory, together with the fact of a simple curve passing",a,Unknown,Unknown
"barometer, and conse- quently the fact of a triple maximum and",a,Unknown,Unknown
"will commence or terminate; a fact which will, I am sure,",a,Unknown,Unknown
does not represent a corresponding fact at different places. In some,a,Unknown,Unknown
places by means of a fact which had the same meaning,a,Unknown,Unknown
that a knowledge of the fact is of great importance in,a,Unknown,Unknown
dise. The pedicle is in fact a mere process of the,a,Unknown,Unknown
this appearance is due in fact to a multitude of suckers,a,Unknown,Unknown
"dif- ferent temperatures, as a fact of the same class as",a,Unknown,Unknown
"of +452 32, did in fact correspond to a dip of",a,Unknown,Unknown
connects itself with the well-known fact of the rise of a,a,Unknown,Unknown
uncombined particle ” was a fact quite different to the formation,a,Unknown,Unknown
substitntion is a very similar fact to that distribution of the,a,Unknown,Unknown
copper and zine is a fact very analogous to the action,a,Unknown,Unknown
peroxide of hydrogen is a fact precisely similar to the formation,a,Unknown,Unknown
a philosophical account of either fact we must assume alike the,a,Unknown,Unknown
"different manner, that the one fact is a chemical synthesis and",a,Unknown,Unknown
the above experiment (2681.) in fact confirms snch a conclusion. But,a,rstl_1850_0008.txt,txt_rstl
"external. It is a curious fact connected with polarization by inflexion,",a,Unknown,Unknown
suggests a comparison with the fact that it is also absent,a,Unknown,Unknown
"a longer time, till in fact the quantity diffused is the",a,Unknown,Unknown
years: a very remarkable 2 fact is exhibited by these hourly,a,Unknown,Unknown
"an hour, will be a fact equally unique and startling. 86.",a,Unknown,Unknown
"chief results arrived at, a fact of which the author was",a,Unknown,Unknown
heart. The tube is in fact merely a diverticulum of the,a,Unknown,Unknown
"Didem- Hidee®, Z The actual fact of a placental circulation indeed",a,Unknown,Unknown
"a mistake, arising from the fact at the heart always presents",a,Unknown,Unknown
"different species of fishes, a fact which adds to the proof",a,Unknown,Unknown
which is below. As a fact this result is perfectly well,a,Unknown,Unknown
"Q 76. merely expresses a fact with reference to lamellar distributions,",a,Unknown,Unknown
obscurity. It is a well-known fact that the madder root is,a,rstl_1851_0021.txt,txt_rstl
"suppose that purpurine is in fact no distinct snbstance, but a",a,rstl_1851_0021.txt,txt_rstl
"scales of a Lepidosteus. The fact is, that though analogous they",a,Unknown,Unknown
"a hour-glass*. It is in fact an osseous cylinder, constricted in",a,Unknown,Unknown
osseous cylinder. It is in fact a rudi- EZ mentary vertical,a,Unknown,Unknown
"of the bone, the aboye fact has a significant bearing upon",a,Unknown,Unknown
an endeavour to establish the fact of a distinet law of,a,rstl_1851_0007.txt,txt_rstl
"the theore- tical value, a fact which I suppose is due",a,Unknown,Unknown
"place even to methyl, a fact which could not have been",a,Unknown,Unknown
"a new iodide*, which in fact resembles in its outward appearance",a,Unknown,Unknown
"usually absent in hybrids, a fact that has since been confirmed",a,Unknown,Unknown
and I noticed a curious fact which I first remarked in,a,Unknown,Unknown
"This, I think, is a fact which deserves some consideration with",a,Unknown,Unknown
"granulation of the surface, a fact which proved most distinetly that",a,Unknown,Unknown
"susceptible of impregnation. A remarkable fact which I noticed, at a",a,Unknown,Unknown
to a certainty by the fact that the spermatozoa are not,a,Unknown,Unknown
"the Malpighian Fyesicles ; a fact which, I think, tends to",a,Unknown,Unknown
"parts in those organs, a fact which $hows the analogy they",a,Unknown,Unknown
"floating cells. It is a fact of singular interest, that the",a,Unknown,Unknown
lined with vibratile epithelium. This fact establishes a connection between the,a,Unknown,Unknown
ventured to estimate this frequent fact as a direct demonstration of,a,Unknown,Unknown
do not branch. In this fact is seen a beautiful provision,a,Unknown,Unknown
cells. This is a constant fact observed with the utmost exactness,a,Unknown,Unknown
"several varieties. It is a fact of considerable interest, that the",a,Unknown,Unknown
inferior molluscan families. In this fact they exhibit a near approximation,a,Unknown,Unknown
also in accordance with a fact long since ascertained by phy-,a,rstl_1852_0005.txt,txt_rstl
and the commutator might in fact be made to a large,a,rstl_1852_0012.txt,txt_rstl
"overlook the still more remarkable fact which they manifest, of a",a,Unknown,Unknown
"of a most im- portant fact discovered by RaxkxixNg and CLavus1vs,",a,Unknown,Unknown
"of generation, it is in fact a closed curve, like all",a,Unknown,Unknown
be a circle; yet the fact is not 80. The inter-,a,Unknown,Unknown
consequences. Now this is a fact of great import- ance to,a,Unknown,Unknown
of a particular plane; in fact «Xx « and BX 3,a,Unknown,Unknown
and Az+BB+Cy; and from this fact a number of curious symbolical,a,Unknown,Unknown
"a future paper; but the fact is, Q' is a distributive",a,Unknown,Unknown
"reference to it, and in fact ignoring such a condition of",a,rstl_1852_0004.txt,txt_rstl
were conclusive as to the fact of a change of refrangibility.,a,Unknown,Unknown
"doubt, either as to the fact of a change of re-",a,Unknown,Unknown
drying the archil. And #n fact when a small quantity of,a,Unknown,Unknown
in this manner was in fact found Ea disperse a red,a,Unknown,Unknown
"interest- ing to mention a fact which I have since observed,",a,Unknown,Unknown
"of the vertebrata, A similar fact is said to have been",a,Unknown,Unknown
"growth of the animal, a fact which we can reconcile with",a,rstl_1853_0015.txt,txt_rstl
only difference being in the fact that the endoderm forms a,a,rstl_1853_0015.txt,txt_rstl
"marine Tubulariadea ; each/of them'is/in fact a fixed Medusa: developing' within,",a,rstl_1853_0015.txt,txt_rstl
also we find the same fact occurring; the value of a,a,rstl_1853_0006.txt,txt_rstl
daily disturbances ;' but the fact is interesting as evidencing a,a,rstl_1853_0006.txt,txt_rstl
"from Damorseav's tables, gives in fact a comparison between the true",a,rstl_1853_0007.txt,txt_rstl
"is necessary to bear this fact in mind, for on a",a,Unknown,Unknown
"transparent tissue, and has in fact become developed into a lacunal",a,Unknown,Unknown
August 17 and 26 this fact is strikingly coincident with a,a,Unknown,Unknown
cluded that purpurine is in fact a mixture of those two,a,rstl_1853_0003.txt,txt_rstl
more manifest proof of the fact of purpurine not being a,a,rstl_1853_0003.txt,txt_rstl
has arisen seemingly from the fact that a sort of cleft,a,Unknown,Unknown
It is a very interesting fact that Professor Mi'LLEs has found,a,Unknown,Unknown
behind the anus; is in fact a post-abdomen*. Plate V. figs.,a,Unknown,Unknown
in assuming that the anatomical fact of a neural flexure indicates,a,Unknown,Unknown
"of a Heteropod, is. in fact s0 totally different as at",a,Unknown,Unknown
"now supplied to me a fact which renders these considera- tions,",a,Unknown,Unknown
more or less fecundated. The fact of the existence of a,a,Unknown,Unknown
"animals. S Thus then, the fact of only a slight wavy",a,Unknown,Unknown
subjoin my testimony to a fact which I had heretofore failed,a,Unknown,Unknown
"the inference deducible from the fact seemed to be, that a",a,Unknown,Unknown
"had promised to show the fact of penetration to a friend,",a,Unknown,Unknown
"envelopes of the egg; a fact which, when known, seemed further",a,Unknown,Unknown
"very. simple factor, which in fact will-be a constant, power of",a,Unknown,Unknown
to the Bezoutiant ; in fact there exists a whole family,a,Unknown,Unknown
"treated as known, having in fact been completely determined as a",a,Unknown,Unknown
"somewhat long, T being in fact represented by a double sum",a,Unknown,Unknown
from any cumulant being in fact representable under theform of a,a,Unknown,Unknown
a syStem. S. Is in fact J2 3 ( CT TEOna,a,Unknown,Unknown
if simply stated as a fact a few years ago. By,as,Unknown,Unknown
"was the same, as in fact it ought to have been,",as,Unknown,Unknown
"upheaving of plutonic rocks, a fact that speaks intelligibly as to",as,rstl_1845_0002.txt,txt_rstl
many as twenty. The first fact which strikes our attention in,as,rstl_1846_0026.txt,txt_rstl
"edge, as in HP. In fact that curve that looked upward",as,Unknown,Unknown
"immediately (assuming it as a fact very probable, but still to",as,rstl_1846_0013.txt,txt_rstl
excessive. Now in point of fact we have such cases as,as,rstl_1846_0015.txt,txt_rstl
"be devised ; we in fact by this means, as it",as,rstl_1847_0001.txt,txt_rstl
"sky. Hence, as a general fact it may be considered, that",as,Unknown,Unknown
ideas. It is usnal in fact to speak of light as,as,Unknown,Unknown
"of his explanation, and in fact to offer it as little",as,Unknown,Unknown
"lecanoric acid, and are in fact lecanoric ether, as any person",as,rstl_1849_0020.txt,txt_rstl
"as an embryologist, and the fact of his having deduced his",as,Unknown,Unknown
"dif- ferent temperatures, as a fact of the same class as",as,Unknown,Unknown
"N.E. and S.W. As the fact above mentioned, namely, that the",as,Unknown,Unknown
"as dormant or latent force,—the fact of the mutual relationship, and",as,Unknown,Unknown
"silver dissolved, which was in fact the silver reduced, estimated as",as,Unknown,Unknown
which is below. As a fact this result is perfectly well,as,Unknown,Unknown
"as of frogs, although the fact of its occurrence was overlooked",as,Unknown,Unknown
"impregnation, as evidenced in the fact of the yelk be- coming",as,Unknown,Unknown
trace of floating corpuscles. This fact is full of interest. As,as,Unknown,Unknown
ventured to estimate this frequent fact as a direct demonstration of,as,Unknown,Unknown
"same conclusions, but as the fact may not be dispnted, we",as,rstl_1852_0016.txt,txt_rstl
"in its favour, and the fact strongly impressed my mind as",as,Unknown,Unknown
"is £9D®. 'V, which in fact is the same thing as",as,Unknown,Unknown
were conclusive as to the fact of a change of refrangibility.,as,Unknown,Unknown
"doubt, either as to the fact of a change of re-",as,Unknown,Unknown
"called, for distinction, as in fact it has been already called,",as,Unknown,Unknown
"he be aware of the fact of dispersion, s0 as to",as,Unknown,Unknown
daily disturbances ;' but the fact is interesting as evidencing a,as,rstl_1853_0006.txt,txt_rstl
"the hamal side, as in fact it is in the embryos",as,Unknown,Unknown
"is as yet an isolated fact among the land Gastero- poda,",as,Unknown,Unknown
"of a Heteropod, is. in fact s0 totally different as at",as,Unknown,Unknown
: quite assured of the fact of penetration as connected with,as,Unknown,Unknown
"treated as known, having in fact been completely determined as a",as,Unknown,Unknown
if simply stated as a fact a few years ago. By,as,Unknown,Unknown
"was the same, as in fact it ought to have been,",as,Unknown,Unknown
"upheaving of plutonic rocks, a fact that speaks intelligibly as to",as,rstl_1845_0002.txt,txt_rstl
many as twenty. The first fact which strikes our attention in,as,rstl_1846_0026.txt,txt_rstl
"edge, as in HP. In fact that curve that looked upward",as,Unknown,Unknown
"immediately (assuming it as a fact very probable, but still to",as,rstl_1846_0013.txt,txt_rstl
excessive. Now in point of fact we have such cases as,as,rstl_1846_0015.txt,txt_rstl
"be devised ; we in fact by this means, as it",as,rstl_1847_0001.txt,txt_rstl
"sky. Hence, as a general fact it may be considered, that",as,Unknown,Unknown
ideas. It is usnal in fact to speak of light as,as,Unknown,Unknown
"of his explanation, and in fact to offer it as little",as,Unknown,Unknown
"lecanoric acid, and are in fact lecanoric ether, as any person",as,rstl_1849_0020.txt,txt_rstl
"as an embryologist, and the fact of his having deduced his",as,Unknown,Unknown
"dif- ferent temperatures, as a fact of the same class as",as,Unknown,Unknown
"N.E. and S.W. As the fact above mentioned, namely, that the",as,Unknown,Unknown
"as dormant or latent force,—the fact of the mutual relationship, and",as,Unknown,Unknown
"silver dissolved, which was in fact the silver reduced, estimated as",as,Unknown,Unknown
which is below. As a fact this result is perfectly well,as,Unknown,Unknown
"as of frogs, although the fact of its occurrence was overlooked",as,Unknown,Unknown
"impregnation, as evidenced in the fact of the yelk be- coming",as,Unknown,Unknown
trace of floating corpuscles. This fact is full of interest. As,as,Unknown,Unknown
ventured to estimate this frequent fact as a direct demonstration of,as,Unknown,Unknown
"same conclusions, but as the fact may not be dispnted, we",as,rstl_1852_0016.txt,txt_rstl
"in its favour, and the fact strongly impressed my mind as",as,Unknown,Unknown
"is £9D®. 'V, which in fact is the same thing as",as,Unknown,Unknown
were conclusive as to the fact of a change of refrangibility.,as,Unknown,Unknown
"doubt, either as to the fact of a change of re-",as,Unknown,Unknown
"called, for distinction, as in fact it has been already called,",as,Unknown,Unknown
"he be aware of the fact of dispersion, s0 as to",as,Unknown,Unknown
daily disturbances ;' but the fact is interesting as evidencing a,as,rstl_1853_0006.txt,txt_rstl
"the hamal side, as in fact it is in the embryos",as,Unknown,Unknown
"is as yet an isolated fact among the land Gastero- poda,",as,Unknown,Unknown
"of a Heteropod, is. in fact s0 totally different as at",as,Unknown,Unknown
: quite assured of the fact of penetration as connected with,as,Unknown,Unknown
"treated as known, having in fact been completely determined as a",as,Unknown,Unknown
with the alkalies render this fact of some importance. The $0-called,with,rstl_1844_0002.txt,txt_rstl
"few words, in what this fact consists, together with the principal",with,rstl_1845_0013.txt,txt_rstl
the transversales (20) ; in fact the triangulares sterni combine with,with,Unknown,Unknown
mo- tion with the ascertained fact that the centre of the,with,Unknown,Unknown
"This coincides with the important fact noted in the preceding register,",with,rstl_1846_0015.txt,txt_rstl
"increasing, which corresponds with the fact men- tioned above (3), that",with,rstl_1846_0015.txt,txt_rstl
"electrode to the negative, a fact which may be verified with",with,Unknown,Unknown
but was much weaker. This fact is evidently con- nected with,with,Unknown,Unknown
implanted in the alveolus; a fact doubtless connected with the similar,with,Unknown,Unknown
"and satisfactory, together with the fact of a simple curve passing",with,Unknown,Unknown
more necessary to verify eyery fact with the greatest care. Perhaps,with,Unknown,Unknown
throughout their length. Taking this fact in connection with those before,with,Unknown,Unknown
"also, is consistent with the fact that variation of the force",with,Unknown,Unknown
"besides being supported by the fact just stated, perfectly accords with",with,Unknown,Unknown
"with these bright stars, in fact that they are equidistant, and",with,Unknown,Unknown
"it harmonizes well with the fact that, in hemiplegia, the ©",with,Unknown,Unknown
hereafter) it accords with the fact of the restoration to the,with,Unknown,Unknown
connects itself with the well-known fact of the rise of a,with,Unknown,Unknown
"external. It is a curious fact connected with polarization by inflexion,",with,Unknown,Unknown
suggests a comparison with the fact that it is also absent,with,Unknown,Unknown
"certain divergence occurs. This last fact is consistent with our expectations,",with,Unknown,Unknown
"Q 76. merely expresses a fact with reference to lamellar distributions,",with,Unknown,Unknown
those of the alkali-metals. In fact the molecular group combined with,with,Unknown,Unknown
"surface, and thus far the fact is in accord- ance with",with,Unknown,Unknown
"This, I think, is a fact which deserves some consideration with",with,Unknown,Unknown
"totally unacquainted with the interesting fact announced in this paper, that",with,Unknown,Unknown
lined with vibratile epithelium. This fact establishes a connection between the,with,Unknown,Unknown
cells. This is a constant fact observed with the utmost exactness,with,Unknown,Unknown
"of the true-blood ! This fact indicates in the former, with",with,Unknown,Unknown
"cause for the current. The fact is, the vagueness associated with",with,rstl_1852_0016.txt,txt_rstl
be made out beyond the fact that it was covered with,with,rstl_1852_0005.txt,txt_rstl
also in accordance with a fact long since ascertained by phy-,with,rstl_1852_0005.txt,txt_rstl
"simultaneously. Speaking approximately, and in fact with almost perfect accuracy, we",with,Unknown,Unknown
"growth of the animal, a fact which we can reconcile with",with,rstl_1853_0015.txt,txt_rstl
neither does he mention the fact that the granular cells with,with,Unknown,Unknown
connect these conditions with the fact that the nucleated cells which,with,Unknown,Unknown
August 17 and 26 this fact is strikingly coincident with a,with,Unknown,Unknown
"13,000 feet, and with the fact that at the highest point",with,Unknown,Unknown
"of madder, which is in fact synonymous with the fermentation of",with,rstl_1853_0003.txt,txt_rstl
"in full accordance with the fact of the existence of, and",with,Unknown,Unknown
: quite assured of the fact of penetration as connected with,with,Unknown,Unknown
I was struck with the fact that the quantity of sperma-,with,Unknown,Unknown
coefficients [by which they may\in fact be» computed- and-verified with comparatively,with,Unknown,Unknown
