Context,Word,File,Directory
before we can establish the fact of induced con- tractions not,of,Unknown,Unknown
myself quite certain of this fact by means of the galya-,of,Unknown,Unknown
there under observation. A singular fact is established by some of,of,rstl_1847_0007.txt,txt_rstl
the point of coke. This fact shows clearly the influence that,of,Unknown,Unknown
Farapay has remarked an analogous fact in the action of the,of,Unknown,Unknown
"means.” Lamserr's argument, that the fact of the sun's rotatory motion",of,Unknown,Unknown
found that it did in fact afford indications of snch a,of,Unknown,Unknown
it is manifest that the fact of proper motions being observed,of,Unknown,Unknown
sufficient weight to establish the fact and direc- tion of the,of,Unknown,Unknown
WATER BY HEAT. and the fact of any uncombined gas existing,of,rstl_1847_0001.txt,txt_rstl
resolution into pancreatic juice. The fact of the existence of hepatic,of,rstl_1848_0019.txt,txt_rstl
"establishing this physiological proposition, the fact of the exist- ence of",of,rstl_1848_0019.txt,txt_rstl
be seen to be in fact composed of two sets s8uperim-,of,rstl_1848_0015.txt,txt_rstl
be mentioned the ob- served fact that the definition of a,of,Unknown,Unknown
ideas. It is usnal in fact to speak of light as,of,Unknown,Unknown
"of his explanation, and in fact to offer it as little",of,Unknown,Unknown
"a certain apparent amount of fact to support it, and because",of,Unknown,Unknown
portion of wax dissolved. This fact alone might lead us to,of,Unknown,Unknown
It is certainly a strange fact that the presence of this,of,Unknown,Unknown
sugar or from starch. Any fact is of importance which can,of,Unknown,Unknown
"and satisfactory, together with the fact of a simple curve passing",of,Unknown,Unknown
"barometer, and conse- quently the fact of a triple maximum and",of,Unknown,Unknown
till the following morning. The fact of the almost stationary temperature,of,Unknown,Unknown
without the factor z””. In fact the solution of (8.) is,of,Unknown,Unknown
"far the best way, in fact the only way, of procuring",of,rstl_1848_0004.txt,txt_rstl
places by means of a fact which had the same meaning,of,Unknown,Unknown
to believe that the same fact extends oyer the whole of,of,Unknown,Unknown
formula of gyrophoric acid. In fact the acid in the Lecanora,of,rstl_1849_0020.txt,txt_rstl
"is further countenanced by the fact of the stomach, when employed",of,Unknown,Unknown
from his notice of the fact in the Annals of Natural,of,Unknown,Unknown
"male, but by the observed fact of the intromission of the",of,Unknown,Unknown
that a knowledge of the fact is of great importance in,of,Unknown,Unknown
dise. The pedicle is in fact a mere process of the,of,Unknown,Unknown
this appearance is due in fact to a multitude of suckers,of,Unknown,Unknown
most satisfactorily proved from the fact of the results being the,of,rstl_1849_0016.txt,txt_rstl
from which I have in fact procured an acid of this,of,Unknown,Unknown
sulphides. Nitric oxide is in fact readily absorbed by cyanide of,of,rstl_1849_0024.txt,txt_rstl
NEW CLASS OF SALTS. 485 fact the formula Cy+2HO correctly represents,of,rstl_1849_0024.txt,txt_rstl
"detail nor supported by any fact of development, but is rather",of,Unknown,Unknown
"as an embryologist, and the fact of his having deduced his",of,Unknown,Unknown
"dermal homology, than the mere fact of their connation in opposition",of,Unknown,Unknown
and avails himself of the fact to refute the conclusions to,of,Unknown,Unknown
which most distinctly establishes the fact of fusiform enlarge- ments of,of,Unknown,Unknown
"dif- ferent temperatures, as a fact of the same class as",of,Unknown,Unknown
"observations ; but beyond the fact of the unusual disturbance, they",of,Unknown,Unknown
nature. These foxsils are in fact one of the large vertebrz,of,rstl_1849_0015.txt,txt_rstl
to the Iguanodon; being in fact one of the most anterior,of,rstl_1849_0015.txt,txt_rstl
point in question ; in fact I know of no other,of,Unknown,Unknown
"also, is consistent with the fact that variation of the force",of,Unknown,Unknown
"of +452 32, did in fact correspond to a dip of",of,Unknown,Unknown
increase is proved by the fact that many of the patients,of,Unknown,Unknown
"in its minute details, the fact of induced contraction, in order",of,rstl_1850_0032.txt,txt_rstl
"of the striped variety, in fact that they correspond in all",of,Unknown,Unknown
"+. In like manner, the fact that many of the *",of,Unknown,Unknown
"as dormant or latent force,—the fact of the mutual relationship, and",of,Unknown,Unknown
hereafter) it accords with the fact of the restoration to the,of,Unknown,Unknown
of temperature. But the remarkable fact above quoted from Dr. Evwauvs's,of,Unknown,Unknown
connects itself with the well-known fact of the rise of a,of,Unknown,Unknown
"render further description unnecessary. This fact is of considerable interest, since",of,rstl_1850_0018.txt,txt_rstl
"of the element from the fact of their chemical separation, I",of,Unknown,Unknown
The rational conception of the fact is given in the ex-,of,Unknown,Unknown
it is by the very fact alone of the decomposition of,of,Unknown,Unknown
This is shown by the fact that the particles of the,of,Unknown,Unknown
"the other explanations of this fact is, in my opinion, that",of,Unknown,Unknown
substitntion is a very similar fact to that distribution of the,of,Unknown,Unknown
"of the element the correlative fact is to be observed, and",of,Unknown,Unknown
and the explanation of this fact involves similar phenomena ; thus—,of,Unknown,Unknown
peroxide of hydrogen is a fact precisely similar to the formation,of,Unknown,Unknown
"CERTAIN ELEMENTS 1818, no new fact of the slightest importance has",of,Unknown,Unknown
"peroxide of hydrogen, no chemical fact has been recognised but the",of,Unknown,Unknown
is composed being the corresponding fact in the decomposition of the,of,Unknown,Unknown
less certain than the similar fact observed in the case of,of,Unknown,Unknown
a philosophical account of either fact we must assume alike the,of,Unknown,Unknown
"an i80sceles triangle (which in fact is double riveting), and of",of,Unknown,Unknown
"the experiments, but the simple fact of sinking the head of",of,Unknown,Unknown
must appear evident from the fact of the sectional area of,of,Unknown,Unknown
"although exceedingly useful, and in fact indispensable for many purposes of",of,Unknown,Unknown
"of the prisms, by the fact that each prism of the",of,rstl_1850_0015.txt,txt_rstl
no deflecting force. * The fact of the decrease of magnetic,of,Unknown,Unknown
"the cerebral cells, being in fact part of them and performing",of,Unknown,Unknown
"of experiment, therefore, the general fact of an annual variation of",of,rstl_1850_0010.txt,txt_rstl
clear that we had in fact crossed the meridian of the,of,rstl_1850_0010.txt,txt_rstl
"are very considerable, constituting in fact an ex- tensive branch of",of,rstl_1850_0003.txt,txt_rstl
; and thus the known fact of the edge and the,of,Unknown,Unknown
the discovery of the remarkable fact that * equal volumes of,of,Unknown,Unknown
skilful interpretation of every new fact which was elaborated by the,of,Unknown,Unknown
"of methyl, methylamylaniline being in fact C,, Hjy N =C,, H,",of,Unknown,Unknown
"Allepy towards Bombay, commencing in fact on the coast of Travancore",of,Unknown,Unknown
ac- counted for by the fact of its not being 80,of,Unknown,Unknown
"monsoon in Western India, The fact was also unquestionably established of",of,Unknown,Unknown
inter- rupting them. The anomalous fact was also shown of the,of,Unknown,Unknown
is doubtless attributable to the fact of the deposition being almost,of,Unknown,Unknown
but actual demonstration of the fact is yet wanted.” —Quarx's Anat.,of,rstl_1851_0029.txt,txt_rstl
"sides of them, and in fact that they both govern their",of,Unknown,Unknown
"the English Channel, from the fact of the stream there pursuing",of,Unknown,Unknown
"chief results arrived at, a fact of which the author was",of,Unknown,Unknown
heart. The tube is in fact merely a diverticulum of the,of,Unknown,Unknown
"upon the surest zoological basis,—a fact of development, —that between zovid",of,Unknown,Unknown
"Didem- Hidee®, Z The actual fact of a placental circulation indeed",of,Unknown,Unknown
"exogenous, partly antogenous, consisting in fact of two distinct, processes and",of,Unknown,Unknown
"different species of fishes, a fact which adds to the proof",of,Unknown,Unknown
I could not determine the fact of any great increase in,of,rstl_1851_0018.txt,txt_rstl
"iT @,=0 or =; the fact of the resulting value being",of,Unknown,Unknown
"evidence of orbital motion. This fact being admitted, it is plain",of,Unknown,Unknown
"regularity, is evident from the fact of there having been 236",of,rstl_1851_0009.txt,txt_rstl
me to add any new fact of importance to those already,of,rstl_1851_0009.txt,txt_rstl
"lapse of time, and in fact most of the at- tempts",of,rstl_1851_0021.txt,txt_rstl
of two distinct substances. This fact however does not affect the,of,rstl_1851_0021.txt,txt_rstl
"bitter taste, and is in fact devoid of any characteristic property",of,rstl_1851_0021.txt,txt_rstl
to take into consideration the fact of its leaving when burnt,of,rstl_1851_0021.txt,txt_rstl
substances derived from madder. 'The fact of rubianine also dissolving in,of,rstl_1851_0021.txt,txt_rstl
"boiling water, more $0 in fact than any of the products",of,rstl_1851_0021.txt,txt_rstl
"to have coalesced, forming in fact the inferior surface of the",of,Unknown,Unknown
"scales of a Lepidosteus. The fact is, that though analogous they",of,Unknown,Unknown
has already pointed out the fact that the ossified centrum of,of,Unknown,Unknown
"of the bone, the aboye fact has a significant bearing upon",of,Unknown,Unknown
we remember the un- doubted fact that all these forms of,of,Unknown,Unknown
of the given magnet. The fact that the quantity of northern,of,Unknown,Unknown
an endeavour to establish the fact of a distinet law of,of,rstl_1851_0007.txt,txt_rstl
those of the alkali-metals. In fact the molecular group combined with,of,Unknown,Unknown
and oxide of ethyl (ether)—a fact which was pointed out long,of,Unknown,Unknown
action of the air. In fact it is difficult to avoid,of,Unknown,Unknown
"the box, 80 that in fact the inner faces of the",of,rstl_1851_0004.txt,txt_rstl
of the given magnet. The fact that the quantity of northern,of,Unknown,Unknown
"plane of indifference, but in fact passed at the middle of",of,Unknown,Unknown
is founded chiefly on the fact that in some of the,of,Unknown,Unknown
"of the yelk,—first, from the fact that the vesicle at this",of,Unknown,Unknown
"remark, however, that saving the fact noticed, of having seen in",of,Unknown,Unknown
Lissotritons. But independent of the fact that the germinal vesicle has,of,Unknown,Unknown
"the vesicle, both in the fact that in the egg of",of,Unknown,Unknown
since the ascertainment of the fact in the negative would be,of,Unknown,Unknown
although full proof of the fact has been wanted. TI have,of,Unknown,Unknown
"of direct experiment, or the fact be capable of demonstration by",of,Unknown,Unknown
now tend to place the fact of the direct agency of,of,Unknown,Unknown
to this view by the fact that the jelly-like envelope of,of,Unknown,Unknown
and noticed only the general fact that the diameter of the,of,Unknown,Unknown
"of this kind, from the fact of the existence of this",of,Unknown,Unknown
"granulation of the surface, a fact which proved most distinetly that",of,Unknown,Unknown
"susceptible of impregnation. A remarkable fact which I noticed, at a",of,Unknown,Unknown
"as of frogs, although the fact of its occurrence was overlooked",of,Unknown,Unknown
"the supposition that, from the fact of the interior of the",of,Unknown,Unknown
be due chiefly to the fact that the greater proportion of,of,Unknown,Unknown
"impregnation, as evidenced in the fact of the yelk be- coming",of,Unknown,Unknown
of the surrounding medinm. The fact of the occurrence of segmentation,of,Unknown,Unknown
the first in which the fact of the penetration of spermatozoa,of,Unknown,Unknown
are constantly met with. The fact of their constant pre- sence,of,Unknown,Unknown
"floating cells. It is a fact of singular interest, that the",of,Unknown,Unknown
of this fluid explain the fact of the suppressed or rudimentary,of,Unknown,Unknown
zoological features. 'Ihey explain the fact of the diminished bulk and,of,Unknown,Unknown
"of other classes, the singular fact will be established that the",of,Unknown,Unknown
of having independently determined the fact of the existence of *a,of,Unknown,Unknown
trace of floating corpuscles. This fact is full of interest. As,of,Unknown,Unknown
"fluid in the Annelids, another fact of equal value and significance",of,Unknown,Unknown
ventured to estimate this frequent fact as a direct demonstration of,of,Unknown,Unknown
"of moisture to life, The fact of its exixtence, and next",of,Unknown,Unknown
have doubtfully recognised the general fact of the fluidity of the,of,Unknown,Unknown
perfectly destitute of colour. This fact is true of the fluid,of,Unknown,Unknown
"of the true-blood ! This fact indicates in the former, with",of,Unknown,Unknown
"several varieties. It is a fact of considerable interest, that the",of,Unknown,Unknown
"anxious to ascertain if the fact of the moon's influence, s0",of,rstl_1852_0010.txt,txt_rstl
& is not the mere fact of getting an effect upon,of,rstl_1852_0016.txt,txt_rstl
of the liquified gases. In fact the difference is not greater,of,Unknown,Unknown
"overlook the still more remarkable fact which they manifest, of a",of,Unknown,Unknown
"or of variable duration, the fact of the progressive increase being",of,Unknown,Unknown
"of a most im- portant fact discovered by RaxkxixNg and CLavus1vs,",of,Unknown,Unknown
of the expanding vapour. This fact would induce the hope that,of,Unknown,Unknown
criterion of reyersibility (being in fact precisely analogous to those described,of,Unknown,Unknown
"of generation, it is in fact a closed curve, like all",of,Unknown,Unknown
geometrical explanation of the analytical fact observed in this theory. that,of,Unknown,Unknown
consequences. Now this is a fact of great import- ance to,of,Unknown,Unknown
of a particular plane; in fact «Xx « and BX 3,of,Unknown,Unknown
"distributiveness of 4.v, and the fact that numerical coefficients may be",of,Unknown,Unknown
"smallness of 7, and the fact that T is multiplied by",of,Unknown,Unknown
and Az+BB+Cy; and from this fact a number of curious symbolical,of,Unknown,Unknown
"those without ; and in fact are conti- nuations of them,",of,rstl_1852_0004.txt,txt_rstl
"reference to it, and in fact ignoring such a condition of",of,rstl_1852_0004.txt,txt_rstl
were conclusive as to the fact of a change of refrangibility.,of,Unknown,Unknown
"doubt, either as to the fact of a change of re-",of,Unknown,Unknown
drying the archil. And #n fact when a small quantity of,of,Unknown,Unknown
termed © lavender.” 88. The fact of the change of refrangibility,of,Unknown,Unknown
"crystal, where flaws did in fact exist, bands of the same",of,Unknown,Unknown
"he be aware of the fact of dispersion, s0 as to",of,Unknown,Unknown
we first pointed out the fact of the blood being returned,of,Unknown,Unknown
prove its presence in the fact of the existence of two,of,Unknown,Unknown
see what light this new fact is capable of Ethrowing upon,of,Unknown,Unknown
J. Bupcs+ have adduced the fact of having traced these fibres,of,Unknown,Unknown
"of the vertebrata, A similar fact is said to have been",of,Unknown,Unknown
sensitive and motor. = The fact that many fibres of each,of,Unknown,Unknown
"of the zoophyte, in the fact of the thread-cells being for",of,rstl_1853_0015.txt,txt_rstl
"growth of the animal, a fact which we can reconcile with",of,rstl_1853_0015.txt,txt_rstl
also we find the same fact occurring; the value of a,of,rstl_1853_0006.txt,txt_rstl
five specimens examined established the fact of the feeble conductivity of,of,Unknown,Unknown
been pointed ont; and the fact of the larger apertures in,of,Unknown,Unknown
"Haversian systems, and are in fact subservient to the development, of",of,Unknown,Unknown
"cartilage-nuclei containing nucleoli, while in fact they are cells capable of",of,Unknown,Unknown
"below it. We have in fact interrupted lines of cells, each",of,Unknown,Unknown
"of the cells, but the fact that it also increased on",of,Unknown,Unknown
preceding products of decomposition. This fact is sufficiently proved by the,of,rstl_1853_0003.txt,txt_rstl
Sloane tia bbanurta 2960 In fact the amount of carbon and,of,rstl_1853_0003.txt,txt_rstl
place of which it in fact occupies in the series of,of,rstl_1853_0003.txt,txt_rstl
"of madder, which is in fact synonymous with the fermentation of",of,rstl_1853_0003.txt,txt_rstl
cluded that purpurine is in fact a mixture of those two,of,rstl_1853_0003.txt,txt_rstl
more manifest proof of the fact of purpurine not being a,of,rstl_1853_0003.txt,txt_rstl
foot of the Gasteropoda. In fact it was on the strength,of,Unknown,Unknown
"of the foot, and the fact that their nerves arise, like",of,Unknown,Unknown
has arisen seemingly from the fact that a sort of cleft,of,Unknown,Unknown
80 uniform (the uniformity in fact constituting the true bond of,of,Unknown,Unknown
in assuming that the anatomical fact of a neural flexure indicates,of,Unknown,Unknown
"of a Heteropod, is. in fact s0 totally different as at",of,Unknown,Unknown
"in self-correction, the certainty of fact now take the place of",of,Unknown,Unknown
in course of development. This fact seemed to afford an explanation,of,Unknown,Unknown
the whole period. Thus the fact of the prolonged fecundity of,of,Unknown,Unknown
in the establisghment of the fact that the spermatozoon penetrates into,of,Unknown,Unknown
proof of this in the fact that the vitality of the,of,Unknown,Unknown
"They agree, too, in the fact that the number of £",of,Unknown,Unknown
more or less fecundated. The fact of the existence of a,of,Unknown,Unknown
"eggs produced an embryo. The fact of this production, however, shows,",of,Unknown,Unknown
correct ex- pression of the fact than at first is apparent.,of,Unknown,Unknown
"animals. S Thus then, the fact of only a slight wavy",of,Unknown,Unknown
"in full accordance with the fact of the existence of, and",of,Unknown,Unknown
or through them. Yet the fact of pene- tration was stated,of,Unknown,Unknown
"have hesitated to admit the fact of any penetration, eyen into",of,Unknown,Unknown
"recently been convinced of this fact by direct observa- tion, in",of,Unknown,Unknown
: quite assured of the fact of penetration as connected with,of,Unknown,Unknown
granules. The importance of this fact of actual penetration by the,of,Unknown,Unknown
I was struck with the fact that the quantity of sperma-,of,Unknown,Unknown
were s0 decisive of the fact of penetration by the spermatozoa,of,Unknown,Unknown
the proper explanation of the fact of penetration by this body.,of,Unknown,Unknown
"had promised to show the fact of penetration to a friend,",of,Unknown,Unknown
is increased. The now ascertained fact of almost instantaneous Sz penetration,of,Unknown,Unknown
I was aware of the fact that the spermatozoon penetrates into,of,Unknown,Unknown
"envelopes of the egg; a fact which, when known, seemed further",of,Unknown,Unknown
countenanced by the now established fact that the spermatozoon of the,of,Unknown,Unknown
"very. simple factor, which in fact will-be a constant, power of",of,Unknown,Unknown
the allotrious factor; being in fact foreign to the value of,of,Unknown,Unknown
antecedently [taking account of the fact of the leading coefficient of,of,Unknown,Unknown
(and which constant is in fact the resultant of the two,of,Unknown,Unknown
This latter number being in fact the number of ways in,of,Unknown,Unknown
"IT D,_.(z), A,.,.z being in fact the multiplier of f'x in",of,Unknown,Unknown
from any cumulant being in fact representable under theform of a,of,Unknown,Unknown
of this progression being in fact the determinants of what the,of,Unknown,Unknown
"and 7, which are in fact only of the degrees r+1,",of,Unknown,Unknown
"called 1, L,....li41, from the fact of the leading coefficients in",of,Unknown,Unknown
"'a, zero, 80 that in fact when z=4 none of the",of,Unknown,Unknown
far and 29.9 heing in fact the revaltant of theze thro,of,Unknown,Unknown
"true, and have verified the fact for the case of two",of,Unknown,Unknown
"animal kingdoms, and the well-known fact that rocks of nearly every",that,Unknown,Unknown
sunk in its apex. This fact sufficiently proved to me that,that,Unknown,Unknown
regeneration of-parts takes place. The fact that it commences in insects,that,Unknown,Unknown
a first view this Jast fact appears to prove that potash,that,rstl_1844_0002.txt,txt_rstl
"in order to illustrate the fact before adverted to, that when",that,Unknown,Unknown
surface of the muscle.” This fact comprehends that of the proper,that,rstl_1845_0012.txt,txt_rstl
are we to explain the fact that the in- duced contraction,that,rstl_1845_0013.txt,txt_rstl
seem to be a first fact of induction of that force,that,rstl_1845_0013.txt,txt_rstl
"frogs gave, acting alone. This fact evidently proves that simple heterogeneity",that,Unknown,Unknown
"upheaving of plutonic rocks, a fact that speaks intelligibly as to",that,rstl_1845_0002.txt,txt_rstl
always be 80; and in fact we know that ether takes,that,Unknown,Unknown
he also states the striking fact that he had found a,that,rstl_1846_0003.txt,txt_rstl
was much impressed by the fact that blood was not magnetic,that,rstl_1846_0003.txt,txt_rstl
known ; and also the fact that at certain temperatures they,that,Unknown,Unknown
"edge, as in HP. In fact that curve that looked upward",that,Unknown,Unknown
"the fibres, and from the fact that the fibres are shorter",that,Unknown,Unknown
"glaciers unite, it is a fact that the structure immediately becomes",that,rstl_1846_0013.txt,txt_rstl
mo- tion with the ascertained fact that the centre of the,that,Unknown,Unknown
"increasing, which corresponds with the fact men- tioned above (3), that",that,rstl_1846_0015.txt,txt_rstl
"FROM the moment that the fact was known, that the locality",that,Unknown,Unknown
in placing beyond question the fact that the direction of the,that,Unknown,Unknown
of destroying indigo*. From that fact I inferred at the time,that,rstl_1846_0012.txt,txt_rstl
silver. If it be a fact that the chemical powers of,that,rstl_1846_0012.txt,txt_rstl
"parts, and it being a fact that during the slow combustion",that,rstl_1846_0012.txt,txt_rstl
And if it be a fact that during the slow combustion,that,rstl_1846_0012.txt,txt_rstl
"arrive at certainty regarding that fact is im- portant, not only",that,rstl_1846_0012.txt,txt_rstl
thus intimates that the mere fact of joining the Com- mittee,that,Unknown,Unknown
verify upon the gymnotus the fact that the strongest discharge is,that,rstl_1847_0014.txt,txt_rstl
"the red rays ; this fact proves then evidently, that if",that,Unknown,Unknown
from concluding from the above fact that the two phenomena may,that,Unknown,Unknown
may be inferred from the fact that no significant difference appears,that,rstl_1847_0005.txt,txt_rstl
resemblance is shown * The fact that October corresponds much more,that,Unknown,Unknown
"This register well illustrates a fact that has been frequently noticed,",that,rstl_1847_0008.txt,txt_rstl
"presently show, nor from the fact that the electrical spark will",that,Unknown,Unknown
the point of coke. This fact shows clearly the influence that,that,Unknown,Unknown
the positive side. This important fact evi- dently proves that this,that,Unknown,Unknown
"closely, I perceived that the fact I have just mentioned was",that,Unknown,Unknown
"means.” Lamserr's argument, that the fact of the sun's rotatory motion",that,Unknown,Unknown
found that it did in fact afford indications of snch a,that,Unknown,Unknown
it is manifest that the fact of proper motions being observed,that,Unknown,Unknown
"sky. Hence, as a general fact it may be considered, that",that,Unknown,Unknown
"times * Thus explaining the fact frequently noticed by sportsmen, that",that,Unknown,Unknown
"in thickness, hardness, and in fact in every respect except that",that,Unknown,Unknown
be mentioned the ob- served fact that the definition of a,that,Unknown,Unknown
it will be found in fact that the sign + indicates,that,Unknown,Unknown
It is certainly a strange fact that the presence of this,that,Unknown,Unknown
"light in this phenomenon, the fact that having placed a Convolvulus",that,Unknown,Unknown
I ascertained afterwards that this fact had already been mentioned by,that,Unknown,Unknown
"confusion is still greater. The fact is, that in snch cases",that,Unknown,Unknown
to believe that the same fact extends oyer the whole of,that,Unknown,Unknown
"however, much weakened from the fact that we possess no means",that,rstl_1849_0020.txt,txt_rstl
is further proved by the fact that it is impossible to,that,Unknown,Unknown
that a knowledge of the fact is of great importance in,that,Unknown,Unknown
"latter may be adduced the fact observed by GrEcory, that sulpburet",that,rstl_1849_0024.txt,txt_rstl
"RaTaxe in regard to the fact that the neural plates, answering",that,Unknown,Unknown
do not consider that this fact in itself proves that the,that,Unknown,Unknown
"N.E. and S.W. As the fact above mentioned, namely, that the",that,Unknown,Unknown
"might be erroneous, from the fact that all the convexo-concave vertebrz",that,rstl_1849_0015.txt,txt_rstl
"also, is consistent with the fact that variation of the force",that,Unknown,Unknown
increase is proved by the fact that many of the patients,that,Unknown,Unknown
"of the striped variety, in fact that they correspond in all",that,Unknown,Unknown
"smaller instrament. There is another fact I may perhaps add, that",that,Unknown,Unknown
