Context,Word,File,Directory
"animal kingdoms, and the well-known fact that rocks of nearly every",that,Unknown,Unknown
sunk in its apex. This fact sufficiently proved to me that,that,Unknown,Unknown
regeneration of-parts takes place. The fact that it commences in insects,that,Unknown,Unknown
a first view this Jast fact appears to prove that potash,that,rstl_1844_0002.txt,txt_rstl
"in order to illustrate the fact before adverted to, that when",that,Unknown,Unknown
surface of the muscle.” This fact comprehends that of the proper,that,rstl_1845_0012.txt,txt_rstl
are we to explain the fact that the in- duced contraction,that,rstl_1845_0013.txt,txt_rstl
seem to be a first fact of induction of that force,that,rstl_1845_0013.txt,txt_rstl
"frogs gave, acting alone. This fact evidently proves that simple heterogeneity",that,Unknown,Unknown
"upheaving of plutonic rocks, a fact that speaks intelligibly as to",that,rstl_1845_0002.txt,txt_rstl
always be 80; and in fact we know that ether takes,that,Unknown,Unknown
he also states the striking fact that he had found a,that,rstl_1846_0003.txt,txt_rstl
was much impressed by the fact that blood was not magnetic,that,rstl_1846_0003.txt,txt_rstl
known ; and also the fact that at certain temperatures they,that,Unknown,Unknown
"edge, as in HP. In fact that curve that looked upward",that,Unknown,Unknown
"the fibres, and from the fact that the fibres are shorter",that,Unknown,Unknown
"glaciers unite, it is a fact that the structure immediately becomes",that,rstl_1846_0013.txt,txt_rstl
mo- tion with the ascertained fact that the centre of the,that,Unknown,Unknown
"increasing, which corresponds with the fact men- tioned above (3), that",that,rstl_1846_0015.txt,txt_rstl
"FROM the moment that the fact was known, that the locality",that,Unknown,Unknown
in placing beyond question the fact that the direction of the,that,Unknown,Unknown
of destroying indigo*. From that fact I inferred at the time,that,rstl_1846_0012.txt,txt_rstl
silver. If it be a fact that the chemical powers of,that,rstl_1846_0012.txt,txt_rstl
"parts, and it being a fact that during the slow combustion",that,rstl_1846_0012.txt,txt_rstl
And if it be a fact that during the slow combustion,that,rstl_1846_0012.txt,txt_rstl
"arrive at certainty regarding that fact is im- portant, not only",that,rstl_1846_0012.txt,txt_rstl
thus intimates that the mere fact of joining the Com- mittee,that,Unknown,Unknown
verify upon the gymnotus the fact that the strongest discharge is,that,rstl_1847_0014.txt,txt_rstl
"the red rays ; this fact proves then evidently, that if",that,Unknown,Unknown
from concluding from the above fact that the two phenomena may,that,Unknown,Unknown
may be inferred from the fact that no significant difference appears,that,rstl_1847_0005.txt,txt_rstl
resemblance is shown * The fact that October corresponds much more,that,Unknown,Unknown
"This register well illustrates a fact that has been frequently noticed,",that,rstl_1847_0008.txt,txt_rstl
"presently show, nor from the fact that the electrical spark will",that,Unknown,Unknown
the point of coke. This fact shows clearly the influence that,that,Unknown,Unknown
the positive side. This important fact evi- dently proves that this,that,Unknown,Unknown
"closely, I perceived that the fact I have just mentioned was",that,Unknown,Unknown
"means.” Lamserr's argument, that the fact of the sun's rotatory motion",that,Unknown,Unknown
found that it did in fact afford indications of snch a,that,Unknown,Unknown
it is manifest that the fact of proper motions being observed,that,Unknown,Unknown
"sky. Hence, as a general fact it may be considered, that",that,Unknown,Unknown
"times * Thus explaining the fact frequently noticed by sportsmen, that",that,Unknown,Unknown
"in thickness, hardness, and in fact in every respect except that",that,Unknown,Unknown
be mentioned the ob- served fact that the definition of a,that,Unknown,Unknown
it will be found in fact that the sign + indicates,that,Unknown,Unknown
It is certainly a strange fact that the presence of this,that,Unknown,Unknown
"light in this phenomenon, the fact that having placed a Convolvulus",that,Unknown,Unknown
I ascertained afterwards that this fact had already been mentioned by,that,Unknown,Unknown
"confusion is still greater. The fact is, that in snch cases",that,Unknown,Unknown
to believe that the same fact extends oyer the whole of,that,Unknown,Unknown
"however, much weakened from the fact that we possess no means",that,rstl_1849_0020.txt,txt_rstl
is further proved by the fact that it is impossible to,that,Unknown,Unknown
that a knowledge of the fact is of great importance in,that,Unknown,Unknown
"latter may be adduced the fact observed by GrEcory, that sulpburet",that,rstl_1849_0024.txt,txt_rstl
"RaTaxe in regard to the fact that the neural plates, answering",that,Unknown,Unknown
do not consider that this fact in itself proves that the,that,Unknown,Unknown
"N.E. and S.W. As the fact above mentioned, namely, that the",that,Unknown,Unknown
"might be erroneous, from the fact that all the convexo-concave vertebrz",that,rstl_1849_0015.txt,txt_rstl
"also, is consistent with the fact that variation of the force",that,Unknown,Unknown
increase is proved by the fact that many of the patients,that,Unknown,Unknown
"of the striped variety, in fact that they correspond in all",that,Unknown,Unknown
"smaller instrament. There is another fact I may perhaps add, that",that,Unknown,Unknown
"dumb-bell nebula in 1845 that fact was overlooked, and but one",that,Unknown,Unknown
"with these bright stars, in fact that they are equidistant, and",that,Unknown,Unknown
"+. In like manner, the fact that many of the *",that,Unknown,Unknown
"speedily undergoes alteration. Hence, the fact that the electric force can",that,Unknown,Unknown
easily demonstrated ; and every fact which indicates that other physical,that,Unknown,Unknown
which is implied in the fact that she does not strain,that,Unknown,Unknown
in my former memoir*. In fact it is now proved that,that,rstl_1850_0019.txt,txt_rstl
not simply due to the fact that the chlorine or iodine,that,Unknown,Unknown
This is shown by the fact that the particles of the,that,Unknown,Unknown
these properties depend upon the fact that the par- ticle is,that,Unknown,Unknown
"the other explanations of this fact is, in my opinion, that",that,Unknown,Unknown
substitntion is a very similar fact to that distribution of the,that,Unknown,Unknown
"chemist, but also by the fact that Poacxxporey had succeeded in",that,Unknown,Unknown
"decomposition, 80 that theory and fact are plainly at issue. On",that,Unknown,Unknown
chemical substances. This is that fact for which it has been,that,Unknown,Unknown
"different manner, that the one fact is a chemical synthesis and",that,Unknown,Unknown
"of the prisms, by the fact that each prism of the",that,rstl_1850_0015.txt,txt_rstl
clear that we had in fact crossed the meridian of the,that,rstl_1850_0010.txt,txt_rstl
is very much greater in fact than that calculation would lead,that,Unknown,Unknown
the discovery of the remarkable fact that * equal volumes of,that,Unknown,Unknown
In 1843 I announced the fact that © heat is evolved,that,Unknown,Unknown
suggests a comparison with the fact that it is also absent,that,Unknown,Unknown
nothing more respecting them. The fact that the relations in diffusion,that,Unknown,Unknown
"and December; $0 that in fact the maximum daily heat, although",that,Unknown,Unknown
"locomotive, is diminished by the fact that whilst one wheel is",that,Unknown,Unknown
"sides of them, and in fact that they both govern their",that,Unknown,Unknown
composition is based on the fact that it might be used,that,rstl_1851_0008.txt,txt_rstl
obscurity. It is a well-known fact that the madder root is,that,rstl_1851_0021.txt,txt_rstl
"genine, is proved by the fact that far more rubian is",that,rstl_1851_0021.txt,txt_rstl
"suppose that purpurine is in fact no distinct snbstance, but a",that,rstl_1851_0021.txt,txt_rstl
"highly interesting, partly from the fact that = it is merely",that,Unknown,Unknown
Snarrgy has pointed out the fact that two distinet processes are,that,Unknown,Unknown
"scales of a Lepidosteus. The fact is, that though analogous they",that,Unknown,Unknown
has already pointed out the fact that the ossified centrum of,that,Unknown,Unknown
we remember the un- doubted fact that all these forms of,that,Unknown,Unknown
of the given magnet. The fact that the quantity of northern,that,Unknown,Unknown
"in all propor- tions, in fact 80 soluble that it can",that,Unknown,Unknown
"the box, 80 that in fact the inner faces of the",that,rstl_1851_0004.txt,txt_rstl
of the given magnet. The fact that the quantity of northern,that,Unknown,Unknown
"usually absent in hybrids, a fact that has since been confirmed",that,Unknown,Unknown
is founded chiefly on the fact that in some of the,that,Unknown,Unknown
"of the yelk,—first, from the fact that the vesicle at this",that,Unknown,Unknown
"remark, however, that saving the fact noticed, of having seen in",that,Unknown,Unknown
Lissotritons. But independent of the fact that the germinal vesicle has,that,Unknown,Unknown
"the vesicle, both in the fact that in the egg of",that,Unknown,Unknown
to this view by the fact that the jelly-like envelope of,that,Unknown,Unknown
and noticed only the general fact that the diameter of the,that,Unknown,Unknown
"There was one exceedingly interesting fact in this experiment,—it was that",that,Unknown,Unknown
some sup- port from the fact that the liquor seminis has,that,Unknown,Unknown
"granulation of the surface, a fact which proved most distinetly that",that,Unknown,Unknown
be due chiefly to the fact that the greater proportion of,that,Unknown,Unknown
to a certainty by the fact that the spermatozoa are not,that,Unknown,Unknown
"fluid, is proved by the fact that they become turgid when",that,Unknown,Unknown
larger (fig. 42 kh). The fact that the ovula were packed,that,Unknown,Unknown
"totally unacquainted with the interesting fact announced in this paper, that",that,Unknown,Unknown
"into the visceral chamber. This fact explains the circumstance, that in",that,Unknown,Unknown
"floating cells. It is a fact of singular interest, that the",that,Unknown,Unknown
"Spatangus and Echinus, from the fact that these latter processes are",that,Unknown,Unknown
"of other classes, the singular fact will be established that the",that,Unknown,Unknown
"31) there is this extraordinary fact to be related, that they",that,Unknown,Unknown
air other Annelids by the fact that it is lined by,that,Unknown,Unknown
"vessels there is one remarkable fact to be stated, namely, that",that,Unknown,Unknown
"true chylaqueous fluid, in the fact that the corpuscles are more",that,Unknown,Unknown
"several varieties. It is a fact of considerable interest, that the",that,Unknown,Unknown
"air-canals, and, moreover, by the fact that they are not supported",that,rstl_1852_0017.txt,txt_rstl
be made out beyond the fact that it was covered with,that,rstl_1852_0005.txt,txt_rstl
"oxides, possibly arising from the fact that at certain definite periods",that,Unknown,Unknown
of the expanding vapour. This fact would induce the hope that,that,Unknown,Unknown
geometrical explanation of the analytical fact observed in this theory. that,that,Unknown,Unknown
"distributiveness of 4.v, and the fact that numerical coefficients may be",that,Unknown,Unknown
"smallness of 7, and the fact that T is multiplied by",that,Unknown,Unknown
sensitive and motor. = The fact that many fibres of each,that,Unknown,Unknown
only difference being in the fact that the endoderm forms a,that,rstl_1853_0015.txt,txt_rstl
neither does he mention the fact that the granular cells with,that,Unknown,Unknown
connect these conditions with the fact that the nucleated cells which,that,Unknown,Unknown
"during its development, the unquestionable fact that in the deyelopment from",that,Unknown,Unknown
"of the cells, but the fact that it also increased on",that,Unknown,Unknown
"13,000 feet, and with the fact that at the highest point",that,Unknown,Unknown
"surface: that there is, in fact (as Gay-Lussac had long since",that,Unknown,Unknown
"temperature, is proved by the fact that the extract, if concentrated,",that,rstl_1853_0003.txt,txt_rstl
cluded that purpurine is in fact a mixture of those two,that,rstl_1853_0003.txt,txt_rstl
"belief that it is in fact the nrinary organ, at once",that,Unknown,Unknown
"of the foot, and the fact that their nerves arise, like",that,Unknown,Unknown
has arisen seemingly from the fact that a sort of cleft,that,Unknown,Unknown
It is a very interesting fact that Professor Mi'LLEs has found,that,Unknown,Unknown
in assuming that the anatomical fact of a neural flexure indicates,that,Unknown,Unknown
any other Nudibranch-f. The simple fact that the cephalic tentacles arise,that,Unknown,Unknown
"seemed to be supported. The fact referred to, is, that the",that,Unknown,Unknown
in the establisghment of the fact that the spermatozoon penetrates into,that,Unknown,Unknown
proof of this in the fact that the vitality of the,that,Unknown,Unknown
"They agree, too, in the fact that the number of £",that,Unknown,Unknown
"that animal, and in the fact that, if the fecundatory fluid",that,Unknown,Unknown
I was struck with the fact that the quantity of sperma-,that,Unknown,Unknown
"the inference deducible from the fact seemed to be, that a",that,Unknown,Unknown
yelk ; although from the fact that the spermatozoa usually enter,that,Unknown,Unknown
to be met by the fact that water must always be,that,Unknown,Unknown
I was aware of the fact that the spermatozoon penetrates into,that,Unknown,Unknown
countenanced by the now established fact that the spermatozoon of the,that,Unknown,Unknown
"419 terms, as/evinced by the. fact that there/exist terms-(ergr.ca%ys) baving +1",that,Unknown,Unknown
"no more (80 that in fact p(i) is always 1), we",that,Unknown,Unknown
"in the first place, the fact that the 7 vanishes when",that,Unknown,Unknown
"'a, zero, 80 that in fact when z=4 none of the",that,Unknown,Unknown
"without some interest, that in fact the Bezoutiant, which is capable",that,Unknown,Unknown
"animal kingdoms, and the well-known fact that rocks of nearly every",that,Unknown,Unknown
sunk in its apex. This fact sufficiently proved to me that,that,Unknown,Unknown
regeneration of-parts takes place. The fact that it commences in insects,that,Unknown,Unknown
a first view this Jast fact appears to prove that potash,that,rstl_1844_0002.txt,txt_rstl
"in order to illustrate the fact before adverted to, that when",that,Unknown,Unknown
surface of the muscle.” This fact comprehends that of the proper,that,rstl_1845_0012.txt,txt_rstl
are we to explain the fact that the in- duced contraction,that,rstl_1845_0013.txt,txt_rstl
seem to be a first fact of induction of that force,that,rstl_1845_0013.txt,txt_rstl
"frogs gave, acting alone. This fact evidently proves that simple heterogeneity",that,Unknown,Unknown
"upheaving of plutonic rocks, a fact that speaks intelligibly as to",that,rstl_1845_0002.txt,txt_rstl
always be 80; and in fact we know that ether takes,that,Unknown,Unknown
he also states the striking fact that he had found a,that,rstl_1846_0003.txt,txt_rstl
was much impressed by the fact that blood was not magnetic,that,rstl_1846_0003.txt,txt_rstl
known ; and also the fact that at certain temperatures they,that,Unknown,Unknown
"edge, as in HP. In fact that curve that looked upward",that,Unknown,Unknown
"the fibres, and from the fact that the fibres are shorter",that,Unknown,Unknown
"glaciers unite, it is a fact that the structure immediately becomes",that,rstl_1846_0013.txt,txt_rstl
mo- tion with the ascertained fact that the centre of the,that,Unknown,Unknown
"increasing, which corresponds with the fact men- tioned above (3), that",that,rstl_1846_0015.txt,txt_rstl
"FROM the moment that the fact was known, that the locality",that,Unknown,Unknown
in placing beyond question the fact that the direction of the,that,Unknown,Unknown
of destroying indigo*. From that fact I inferred at the time,that,rstl_1846_0012.txt,txt_rstl
silver. If it be a fact that the chemical powers of,that,rstl_1846_0012.txt,txt_rstl
"parts, and it being a fact that during the slow combustion",that,rstl_1846_0012.txt,txt_rstl
And if it be a fact that during the slow combustion,that,rstl_1846_0012.txt,txt_rstl
"arrive at certainty regarding that fact is im- portant, not only",that,rstl_1846_0012.txt,txt_rstl
thus intimates that the mere fact of joining the Com- mittee,that,Unknown,Unknown
verify upon the gymnotus the fact that the strongest discharge is,that,rstl_1847_0014.txt,txt_rstl
"the red rays ; this fact proves then evidently, that if",that,Unknown,Unknown
from concluding from the above fact that the two phenomena may,that,Unknown,Unknown
may be inferred from the fact that no significant difference appears,that,rstl_1847_0005.txt,txt_rstl
resemblance is shown * The fact that October corresponds much more,that,Unknown,Unknown
"This register well illustrates a fact that has been frequently noticed,",that,rstl_1847_0008.txt,txt_rstl
"presently show, nor from the fact that the electrical spark will",that,Unknown,Unknown
the point of coke. This fact shows clearly the influence that,that,Unknown,Unknown
the positive side. This important fact evi- dently proves that this,that,Unknown,Unknown
"closely, I perceived that the fact I have just mentioned was",that,Unknown,Unknown
"means.” Lamserr's argument, that the fact of the sun's rotatory motion",that,Unknown,Unknown
found that it did in fact afford indications of snch a,that,Unknown,Unknown
it is manifest that the fact of proper motions being observed,that,Unknown,Unknown
"sky. Hence, as a general fact it may be considered, that",that,Unknown,Unknown
"times * Thus explaining the fact frequently noticed by sportsmen, that",that,Unknown,Unknown
"in thickness, hardness, and in fact in every respect except that",that,Unknown,Unknown
be mentioned the ob- served fact that the definition of a,that,Unknown,Unknown
it will be found in fact that the sign + indicates,that,Unknown,Unknown
It is certainly a strange fact that the presence of this,that,Unknown,Unknown
"light in this phenomenon, the fact that having placed a Convolvulus",that,Unknown,Unknown
I ascertained afterwards that this fact had already been mentioned by,that,Unknown,Unknown
"confusion is still greater. The fact is, that in snch cases",that,Unknown,Unknown
to believe that the same fact extends oyer the whole of,that,Unknown,Unknown
"however, much weakened from the fact that we possess no means",that,rstl_1849_0020.txt,txt_rstl
is further proved by the fact that it is impossible to,that,Unknown,Unknown
that a knowledge of the fact is of great importance in,that,Unknown,Unknown
"latter may be adduced the fact observed by GrEcory, that sulpburet",that,rstl_1849_0024.txt,txt_rstl
"RaTaxe in regard to the fact that the neural plates, answering",that,Unknown,Unknown
do not consider that this fact in itself proves that the,that,Unknown,Unknown
"N.E. and S.W. As the fact above mentioned, namely, that the",that,Unknown,Unknown
"might be erroneous, from the fact that all the convexo-concave vertebrz",that,rstl_1849_0015.txt,txt_rstl
"also, is consistent with the fact that variation of the force",that,Unknown,Unknown
increase is proved by the fact that many of the patients,that,Unknown,Unknown
"of the striped variety, in fact that they correspond in all",that,Unknown,Unknown
"smaller instrament. There is another fact I may perhaps add, that",that,Unknown,Unknown
"dumb-bell nebula in 1845 that fact was overlooked, and but one",that,Unknown,Unknown
"with these bright stars, in fact that they are equidistant, and",that,Unknown,Unknown
"+. In like manner, the fact that many of the *",that,Unknown,Unknown
"speedily undergoes alteration. Hence, the fact that the electric force can",that,Unknown,Unknown
easily demonstrated ; and every fact which indicates that other physical,that,Unknown,Unknown
which is implied in the fact that she does not strain,that,Unknown,Unknown
in my former memoir*. In fact it is now proved that,that,rstl_1850_0019.txt,txt_rstl
not simply due to the fact that the chlorine or iodine,that,Unknown,Unknown
This is shown by the fact that the particles of the,that,Unknown,Unknown
these properties depend upon the fact that the par- ticle is,that,Unknown,Unknown
"the other explanations of this fact is, in my opinion, that",that,Unknown,Unknown
substitntion is a very similar fact to that distribution of the,that,Unknown,Unknown
"chemist, but also by the fact that Poacxxporey had succeeded in",that,Unknown,Unknown
"decomposition, 80 that theory and fact are plainly at issue. On",that,Unknown,Unknown
chemical substances. This is that fact for which it has been,that,Unknown,Unknown
"different manner, that the one fact is a chemical synthesis and",that,Unknown,Unknown
"of the prisms, by the fact that each prism of the",that,rstl_1850_0015.txt,txt_rstl
clear that we had in fact crossed the meridian of the,that,rstl_1850_0010.txt,txt_rstl
is very much greater in fact than that calculation would lead,that,Unknown,Unknown
the discovery of the remarkable fact that * equal volumes of,that,Unknown,Unknown
In 1843 I announced the fact that © heat is evolved,that,Unknown,Unknown
suggests a comparison with the fact that it is also absent,that,Unknown,Unknown
nothing more respecting them. The fact that the relations in diffusion,that,Unknown,Unknown
"and December; $0 that in fact the maximum daily heat, although",that,Unknown,Unknown
"locomotive, is diminished by the fact that whilst one wheel is",that,Unknown,Unknown
"sides of them, and in fact that they both govern their",that,Unknown,Unknown
composition is based on the fact that it might be used,that,rstl_1851_0008.txt,txt_rstl
obscurity. It is a well-known fact that the madder root is,that,rstl_1851_0021.txt,txt_rstl
"genine, is proved by the fact that far more rubian is",that,rstl_1851_0021.txt,txt_rstl
"suppose that purpurine is in fact no distinct snbstance, but a",that,rstl_1851_0021.txt,txt_rstl
"highly interesting, partly from the fact that = it is merely",that,Unknown,Unknown
Snarrgy has pointed out the fact that two distinet processes are,that,Unknown,Unknown
"scales of a Lepidosteus. The fact is, that though analogous they",that,Unknown,Unknown
has already pointed out the fact that the ossified centrum of,that,Unknown,Unknown
we remember the un- doubted fact that all these forms of,that,Unknown,Unknown
of the given magnet. The fact that the quantity of northern,that,Unknown,Unknown
"in all propor- tions, in fact 80 soluble that it can",that,Unknown,Unknown
"the box, 80 that in fact the inner faces of the",that,rstl_1851_0004.txt,txt_rstl
of the given magnet. The fact that the quantity of northern,that,Unknown,Unknown
"usually absent in hybrids, a fact that has since been confirmed",that,Unknown,Unknown
is founded chiefly on the fact that in some of the,that,Unknown,Unknown
"of the yelk,—first, from the fact that the vesicle at this",that,Unknown,Unknown
"remark, however, that saving the fact noticed, of having seen in",that,Unknown,Unknown
Lissotritons. But independent of the fact that the germinal vesicle has,that,Unknown,Unknown
"the vesicle, both in the fact that in the egg of",that,Unknown,Unknown
to this view by the fact that the jelly-like envelope of,that,Unknown,Unknown
and noticed only the general fact that the diameter of the,that,Unknown,Unknown
"There was one exceedingly interesting fact in this experiment,—it was that",that,Unknown,Unknown
some sup- port from the fact that the liquor seminis has,that,Unknown,Unknown
"granulation of the surface, a fact which proved most distinetly that",that,Unknown,Unknown
be due chiefly to the fact that the greater proportion of,that,Unknown,Unknown
to a certainty by the fact that the spermatozoa are not,that,Unknown,Unknown
"fluid, is proved by the fact that they become turgid when",that,Unknown,Unknown
larger (fig. 42 kh). The fact that the ovula were packed,that,Unknown,Unknown
"totally unacquainted with the interesting fact announced in this paper, that",that,Unknown,Unknown
"into the visceral chamber. This fact explains the circumstance, that in",that,Unknown,Unknown
"floating cells. It is a fact of singular interest, that the",that,Unknown,Unknown
"Spatangus and Echinus, from the fact that these latter processes are",that,Unknown,Unknown
"of other classes, the singular fact will be established that the",that,Unknown,Unknown
"31) there is this extraordinary fact to be related, that they",that,Unknown,Unknown
air other Annelids by the fact that it is lined by,that,Unknown,Unknown
"vessels there is one remarkable fact to be stated, namely, that",that,Unknown,Unknown
"true chylaqueous fluid, in the fact that the corpuscles are more",that,Unknown,Unknown
"several varieties. It is a fact of considerable interest, that the",that,Unknown,Unknown
"air-canals, and, moreover, by the fact that they are not supported",that,rstl_1852_0017.txt,txt_rstl
be made out beyond the fact that it was covered with,that,rstl_1852_0005.txt,txt_rstl
"oxides, possibly arising from the fact that at certain definite periods",that,Unknown,Unknown
of the expanding vapour. This fact would induce the hope that,that,Unknown,Unknown
geometrical explanation of the analytical fact observed in this theory. that,that,Unknown,Unknown
"distributiveness of 4.v, and the fact that numerical coefficients may be",that,Unknown,Unknown
"smallness of 7, and the fact that T is multiplied by",that,Unknown,Unknown
sensitive and motor. = The fact that many fibres of each,that,Unknown,Unknown
only difference being in the fact that the endoderm forms a,that,rstl_1853_0015.txt,txt_rstl
neither does he mention the fact that the granular cells with,that,Unknown,Unknown
connect these conditions with the fact that the nucleated cells which,that,Unknown,Unknown
