Context,Word,File,Directory
"electrode to the negative, a fact which may be verified with",which,Unknown,Unknown
this section by stating a fact which appears to me to,which,Unknown,Unknown
the other side experiences; a fact which is confirmed by the,which,Unknown,Unknown
acid in wax is a fact to which we have no,which,Unknown,Unknown
sugar or from starch. Any fact is of importance which can,which,Unknown,Unknown
"will commence or terminate; a fact which will, I am sure,",which,Unknown,Unknown
places by means of a fact which had the same meaning,which,Unknown,Unknown
"which they yield are in fact only one compound, viz. lecanoric",which,rstl_1849_0020.txt,txt_rstl
from which I have in fact procured an acid of this,which,Unknown,Unknown
"occupied by the plastron, which fact invalidates the hypothesis. My observations",which,Unknown,Unknown
which most distinctly establishes the fact of fusiform enlarge- ments of,which,Unknown,Unknown
easily demonstrated ; and every fact which indicates that other physical,which,Unknown,Unknown
which is implied in the fact that she does not strain,which,Unknown,Unknown
; nor indeed has any fact been discovered which places such,which,Unknown,Unknown
chemical substances. This is that fact for which it has been,which,Unknown,Unknown
"silver dissolved, which was in fact the silver reduced, estimated as",which,Unknown,Unknown
this is ever definite. The fact therefore which is expressed by,which,Unknown,Unknown
"On this view, the real fact which lay hid under these",which,Unknown,Unknown
skilful interpretation of every new fact which was elaborated by the,which,Unknown,Unknown
"chief results arrived at, a fact of which the author was",which,Unknown,Unknown
"different species of fishes, a fact which adds to the proof",which,Unknown,Unknown
which is below. As a fact this result is perfectly well,which,Unknown,Unknown
by baryta. This was in fact the first process by which,which,Unknown,Unknown
and oxide of ethyl (ether)—a fact which was pointed out long,which,Unknown,Unknown
"the theore- tical value, a fact which I suppose is due",which,Unknown,Unknown
"place even to methyl, a fact which could not have been",which,Unknown,Unknown
"a new iodide*, which in fact resembles in its outward appearance",which,Unknown,Unknown
is further supported by the fact which I have seen in,which,Unknown,Unknown
this I may add another fact which appears to be equally,which,Unknown,Unknown
and I noticed a curious fact which I first remarked in,which,Unknown,Unknown
"This, I think, is a fact which deserves some consideration with",which,Unknown,Unknown
"granulation of the surface, a fact which proved most distinetly that",which,Unknown,Unknown
"susceptible of impregnation. A remarkable fact which I noticed, at a",which,Unknown,Unknown
the first in which the fact of the penetration of spermatozoa,which,Unknown,Unknown
"parts in those organs, a fact which $hows the analogy they",which,Unknown,Unknown
the latter. It was this fact which led me to make,which,Unknown,Unknown
"sy—l1 P=P+/—4B(7+358)=8+7*—45(7+88)B, which is in fact the case. Writing the equations",which,Unknown,Unknown
"am acquainted, is the curious fact which was observed by Mr.",which,Unknown,Unknown
"overlook the still more remarkable fact which they manifest, of a",which,Unknown,Unknown
"is £9D®. 'V, which in fact is the same thing as",which,Unknown,Unknown
"the term itself, which in fact was only adopted provisionally by",which,Unknown,Unknown
"dark band, which was 1n fact the absorption band No. 1,",which,Unknown,Unknown
"experi- ment, which was in fact performed at an early stage",which,Unknown,Unknown
which then commenced. And in fact Fen the green-dispersing principle was,which,Unknown,Unknown
"interest- ing to mention a fact which I have since observed,",which,Unknown,Unknown
"growth of the animal, a fact which we can reconcile with",which,rstl_1853_0015.txt,txt_rstl
connect these conditions with the fact that the nucleated cells which,which,Unknown,Unknown
place of which it in fact occupies in the series of,which,rstl_1853_0003.txt,txt_rstl
"of madder, which is in fact synonymous with the fermentation of",which,rstl_1853_0003.txt,txt_rstl
"now supplied to me a fact which renders these considera- tions,",which,Unknown,Unknown
"4, in which the latter fact is shown, is interesting, from",which,Unknown,Unknown
subjoin my testimony to a fact which I had heretofore failed,which,Unknown,Unknown
"very. simple factor, which in fact will-be a constant, power of",which,Unknown,Unknown
(and which constant is in fact the resultant of the two,which,Unknown,Unknown
"and 7, which are in fact only of the degrees r+1,",which,Unknown,Unknown
"without some interest, that in fact the Bezoutiant, which is capable",which,Unknown,Unknown
coefficients [by which they may\in fact be» computed- and-verified with comparatively,which,Unknown,Unknown
third one was not. This fact appears at first to support,was,Unknown,Unknown
strongly marked ; but in fact less of the base was,was,Unknown,Unknown
"was the same, as in fact it ought to have been,",was,Unknown,Unknown
was much impressed by the fact that blood was not magnetic,was,rstl_1846_0003.txt,txt_rstl
"stronger than the weakest, In fact it was easy to keep",was,Unknown,Unknown
"was en- shrined, is a fact not less remarkable than the",was,Unknown,Unknown
the preceding pbysical fact. The fact of plasticity was suspected by,was,Unknown,Unknown
"FROM the moment that the fact was known, that the locality",was,Unknown,Unknown
"closely, I perceived that the fact I have just mentioned was",was,Unknown,Unknown
but was much weaker. This fact is evidently con- nected with,was,Unknown,Unknown
"room was kept uniform, in fact it did not vary one",was,Unknown,Unknown
"the two slips, and this fact was sufficient to overthrow DecanpoiLt's",was,Unknown,Unknown
"to these experiments, the same fact was noted. Thus, October 13,",was,Unknown,Unknown
an alkaline sulphide. The same fact was noted by Mr. Mzrcery,was,rstl_1849_0024.txt,txt_rstl
repeating DoBEREINER's experiment. One important fact was observyed in this preliminary,was,rstl_1849_0024.txt,txt_rstl
On this subject an important fact was ascertained during the large,was,Unknown,Unknown
below the average. The same fact was stated in my previous,was,Unknown,Unknown
"dumb-bell nebula in 1845 that fact was overlooked, and but one",was,Unknown,Unknown
uncombined particle ” was a fact quite different to the formation,was,Unknown,Unknown
"silver dissolved, which was in fact the silver reduced, estimated as",was,Unknown,Unknown
skilful interpretation of every new fact which was elaborated by the,was,Unknown,Unknown
"monsoon in Western India, The fact was also unquestionably established of",was,Unknown,Unknown
inter- rupting them. The anomalous fact was also shown of the,was,Unknown,Unknown
"chief results arrived at, a fact of which the author was",was,Unknown,Unknown
by baryta. This was in fact the first process by which,was,Unknown,Unknown
and oxide of ethyl (ether)—a fact which was pointed out long,was,Unknown,Unknown
to it was repelled. In fact every case is included in,was,Unknown,Unknown
"There was one exceedingly interesting fact in this experiment,—it was that",was,Unknown,Unknown
"as of frogs, although the fact of its occurrence was overlooked",was,Unknown,Unknown
the latter. It was this fact which led me to make,was,Unknown,Unknown
be made out beyond the fact that it was covered with,was,rstl_1852_0005.txt,txt_rstl
"am acquainted, is the curious fact which was observed by Mr.",was,Unknown,Unknown
"the term itself, which in fact was only adopted provisionally by",was,Unknown,Unknown
"dark band, which was 1n fact the absorption band No. 1,",was,Unknown,Unknown
"experi- ment, which was in fact performed at an early stage",was,Unknown,Unknown
would be blue. And in fact when the blue Muid was,was,Unknown,Unknown
which then commenced. And in fact Fen the green-dispersing principle was,was,Unknown,Unknown
"It was tolerably sensitive, in fact for an inorganic substance extremely",was,Unknown,Unknown
in this manner was in fact found Ea disperse a red,was,Unknown,Unknown
"in the year, whether in fact there was any analogy between",was,rstl_1853_0006.txt,txt_rstl
foot of the Gasteropoda. In fact it was on the strength,was,Unknown,Unknown
or through them. Yet the fact of pene- tration was stated,was,Unknown,Unknown
I was struck with the fact that the quantity of sperma-,was,Unknown,Unknown
I was aware of the fact that the spermatozoon penetrates into,was,Unknown,Unknown
the Scolopendre are armed. This fact is of consequence in a,a,Unknown,Unknown
the inductive state being in fact a necessary preliminary to discharge.”,a,Unknown,Unknown
a first view this Jast fact appears to prove that potash,a,rstl_1844_0002.txt,txt_rstl
if simply stated as a fact a few years ago. By,a,Unknown,Unknown
"in England to a physiological fact discovered by myself, and described",a,rstl_1845_0013.txt,txt_rstl
seem to be a first fact of induction of that force,a,rstl_1845_0013.txt,txt_rstl
"although a knowledge of this fact is illus- trative, not only",a,rstl_1845_0002.txt,txt_rstl
and freshbwater springs; . a fact to be ascribed probably to,a,rstl_1845_0002.txt,txt_rstl
"upheaving of plutonic rocks, a fact that speaks intelligibly as to",a,rstl_1845_0002.txt,txt_rstl
"however brought about, is a fact which hardly admits of being",a,Unknown,Unknown
he also states the striking fact that he had found a,a,rstl_1846_0003.txt,txt_rstl
"was en- shrined, is a fact not less remarkable than the",a,Unknown,Unknown
"is distended, and is in fact a con- tinuation of the",a,Unknown,Unknown
"immediately (assuming it as a fact very probable, but still to",a,rstl_1846_0013.txt,txt_rstl
"glaciers unite, it is a fact that the structure immediately becomes",a,rstl_1846_0013.txt,txt_rstl
mass most perfect ; a fact stated and referred to its,a,Unknown,Unknown
"a question s0 remarkable a fact in Physical Geography, —to fix",a,Unknown,Unknown
to 48%. It is in fact a magnetic survey of the,a,Unknown,Unknown
"—Read February 12, 1846. A FACT not yet well understood is",a,rstl_1846_0012.txt,txt_rstl
silver. If it be a fact that the chemical powers of,a,rstl_1846_0012.txt,txt_rstl
"parts, and it being a fact that during the slow combustion",a,rstl_1846_0012.txt,txt_rstl
And if it be a fact that during the slow combustion,a,rstl_1846_0012.txt,txt_rstl
singular and the most important fact in a theoretical point of,a,rstl_1847_0014.txt,txt_rstl
"here call attention to a fact 80mewhat remarkable, which has always",a,Unknown,Unknown
the numerous contractions. The above fact establishes a fresh connection between,a,Unknown,Unknown
there under observation. A singular fact is established by some of,a,rstl_1847_0007.txt,txt_rstl
"This register well illustrates a fact that has been frequently noticed,",a,rstl_1847_0008.txt,txt_rstl
"electrode to the negative, a fact which may be verified with",a,Unknown,Unknown
this section by stating a fact which appears to me to,a,Unknown,Unknown
the other side experiences; a fact which is confirmed by the,a,Unknown,Unknown
found that it did in fact afford indications of snch a,a,Unknown,Unknown
not a little remarkable. In fact the southern stars would seem,a,Unknown,Unknown
"sky. Hence, as a general fact it may be considered, that",a,Unknown,Unknown
be mentioned the ob- served fact that the definition of a,a,Unknown,Unknown
implanted in the alveolus; a fact doubtless connected with the similar,a,Unknown,Unknown
"a certain apparent amount of fact to support it, and because",a,Unknown,Unknown
acid in wax is a fact to which we have no,a,Unknown,Unknown
It is certainly a strange fact that the presence of this,a,Unknown,Unknown
"light in this phenomenon, the fact that having placed a Convolvulus",a,Unknown,Unknown
"and satisfactory, together with the fact of a simple curve passing",a,Unknown,Unknown
"barometer, and conse- quently the fact of a triple maximum and",a,Unknown,Unknown
"will commence or terminate; a fact which will, I am sure,",a,Unknown,Unknown
does not represent a corresponding fact at different places. In some,a,Unknown,Unknown
places by means of a fact which had the same meaning,a,Unknown,Unknown
that a knowledge of the fact is of great importance in,a,Unknown,Unknown
dise. The pedicle is in fact a mere process of the,a,Unknown,Unknown
this appearance is due in fact to a multitude of suckers,a,Unknown,Unknown
"dif- ferent temperatures, as a fact of the same class as",a,Unknown,Unknown
"of +452 32, did in fact correspond to a dip of",a,Unknown,Unknown
connects itself with the well-known fact of the rise of a,a,Unknown,Unknown
uncombined particle ” was a fact quite different to the formation,a,Unknown,Unknown
substitntion is a very similar fact to that distribution of the,a,Unknown,Unknown
copper and zine is a fact very analogous to the action,a,Unknown,Unknown
peroxide of hydrogen is a fact precisely similar to the formation,a,Unknown,Unknown
a philosophical account of either fact we must assume alike the,a,Unknown,Unknown
"different manner, that the one fact is a chemical synthesis and",a,Unknown,Unknown
the above experiment (2681.) in fact confirms snch a conclusion. But,a,rstl_1850_0008.txt,txt_rstl
"external. It is a curious fact connected with polarization by inflexion,",a,Unknown,Unknown
suggests a comparison with the fact that it is also absent,a,Unknown,Unknown
"a longer time, till in fact the quantity diffused is the",a,Unknown,Unknown
years: a very remarkable 2 fact is exhibited by these hourly,a,Unknown,Unknown
"an hour, will be a fact equally unique and startling. 86.",a,Unknown,Unknown
"chief results arrived at, a fact of which the author was",a,Unknown,Unknown
heart. The tube is in fact merely a diverticulum of the,a,Unknown,Unknown
"Didem- Hidee®, Z The actual fact of a placental circulation indeed",a,Unknown,Unknown
"a mistake, arising from the fact at the heart always presents",a,Unknown,Unknown
"different species of fishes, a fact which adds to the proof",a,Unknown,Unknown
which is below. As a fact this result is perfectly well,a,Unknown,Unknown
"Q 76. merely expresses a fact with reference to lamellar distributions,",a,Unknown,Unknown
obscurity. It is a well-known fact that the madder root is,a,rstl_1851_0021.txt,txt_rstl
"suppose that purpurine is in fact no distinct snbstance, but a",a,rstl_1851_0021.txt,txt_rstl
"scales of a Lepidosteus. The fact is, that though analogous they",a,Unknown,Unknown
"a hour-glass*. It is in fact an osseous cylinder, constricted in",a,Unknown,Unknown
osseous cylinder. It is in fact a rudi- EZ mentary vertical,a,Unknown,Unknown
"of the bone, the aboye fact has a significant bearing upon",a,Unknown,Unknown
an endeavour to establish the fact of a distinet law of,a,rstl_1851_0007.txt,txt_rstl
"the theore- tical value, a fact which I suppose is due",a,Unknown,Unknown
"place even to methyl, a fact which could not have been",a,Unknown,Unknown
"a new iodide*, which in fact resembles in its outward appearance",a,Unknown,Unknown
"usually absent in hybrids, a fact that has since been confirmed",a,Unknown,Unknown
and I noticed a curious fact which I first remarked in,a,Unknown,Unknown
"This, I think, is a fact which deserves some consideration with",a,Unknown,Unknown
"granulation of the surface, a fact which proved most distinetly that",a,Unknown,Unknown
"susceptible of impregnation. A remarkable fact which I noticed, at a",a,Unknown,Unknown
to a certainty by the fact that the spermatozoa are not,a,Unknown,Unknown
"the Malpighian Fyesicles ; a fact which, I think, tends to",a,Unknown,Unknown
"parts in those organs, a fact which $hows the analogy they",a,Unknown,Unknown
"floating cells. It is a fact of singular interest, that the",a,Unknown,Unknown
lined with vibratile epithelium. This fact establishes a connection between the,a,Unknown,Unknown
ventured to estimate this frequent fact as a direct demonstration of,a,Unknown,Unknown
do not branch. In this fact is seen a beautiful provision,a,Unknown,Unknown
cells. This is a constant fact observed with the utmost exactness,a,Unknown,Unknown
"several varieties. It is a fact of considerable interest, that the",a,Unknown,Unknown
inferior molluscan families. In this fact they exhibit a near approximation,a,Unknown,Unknown
also in accordance with a fact long since ascertained by phy-,a,rstl_1852_0005.txt,txt_rstl
and the commutator might in fact be made to a large,a,rstl_1852_0012.txt,txt_rstl
"overlook the still more remarkable fact which they manifest, of a",a,Unknown,Unknown
"of a most im- portant fact discovered by RaxkxixNg and CLavus1vs,",a,Unknown,Unknown
"of generation, it is in fact a closed curve, like all",a,Unknown,Unknown
be a circle; yet the fact is not 80. The inter-,a,Unknown,Unknown
consequences. Now this is a fact of great import- ance to,a,Unknown,Unknown
of a particular plane; in fact «Xx « and BX 3,a,Unknown,Unknown
and Az+BB+Cy; and from this fact a number of curious symbolical,a,Unknown,Unknown
"a future paper; but the fact is, Q' is a distributive",a,Unknown,Unknown
"reference to it, and in fact ignoring such a condition of",a,rstl_1852_0004.txt,txt_rstl
were conclusive as to the fact of a change of refrangibility.,a,Unknown,Unknown
"doubt, either as to the fact of a change of re-",a,Unknown,Unknown
drying the archil. And #n fact when a small quantity of,a,Unknown,Unknown
in this manner was in fact found Ea disperse a red,a,Unknown,Unknown
"interest- ing to mention a fact which I have since observed,",a,Unknown,Unknown
"of the vertebrata, A similar fact is said to have been",a,Unknown,Unknown
"growth of the animal, a fact which we can reconcile with",a,rstl_1853_0015.txt,txt_rstl
only difference being in the fact that the endoderm forms a,a,rstl_1853_0015.txt,txt_rstl
"marine Tubulariadea ; each/of them'is/in fact a fixed Medusa: developing' within,",a,rstl_1853_0015.txt,txt_rstl
also we find the same fact occurring; the value of a,a,rstl_1853_0006.txt,txt_rstl
daily disturbances ;' but the fact is interesting as evidencing a,a,rstl_1853_0006.txt,txt_rstl
"from Damorseav's tables, gives in fact a comparison between the true",a,rstl_1853_0007.txt,txt_rstl
"is necessary to bear this fact in mind, for on a",a,Unknown,Unknown
"transparent tissue, and has in fact become developed into a lacunal",a,Unknown,Unknown
August 17 and 26 this fact is strikingly coincident with a,a,Unknown,Unknown
cluded that purpurine is in fact a mixture of those two,a,rstl_1853_0003.txt,txt_rstl
more manifest proof of the fact of purpurine not being a,a,rstl_1853_0003.txt,txt_rstl
has arisen seemingly from the fact that a sort of cleft,a,Unknown,Unknown
It is a very interesting fact that Professor Mi'LLEs has found,a,Unknown,Unknown
behind the anus; is in fact a post-abdomen*. Plate V. figs.,a,Unknown,Unknown
in assuming that the anatomical fact of a neural flexure indicates,a,Unknown,Unknown
"of a Heteropod, is. in fact s0 totally different as at",a,Unknown,Unknown
"now supplied to me a fact which renders these considera- tions,",a,Unknown,Unknown
more or less fecundated. The fact of the existence of a,a,Unknown,Unknown
"animals. S Thus then, the fact of only a slight wavy",a,Unknown,Unknown
subjoin my testimony to a fact which I had heretofore failed,a,Unknown,Unknown
"the inference deducible from the fact seemed to be, that a",a,Unknown,Unknown
"had promised to show the fact of penetration to a friend,",a,Unknown,Unknown
"envelopes of the egg; a fact which, when known, seemed further",a,Unknown,Unknown
"very. simple factor, which in fact will-be a constant, power of",a,Unknown,Unknown
to the Bezoutiant ; in fact there exists a whole family,a,Unknown,Unknown
"treated as known, having in fact been completely determined as a",a,Unknown,Unknown
"somewhat long, T being in fact represented by a double sum",a,Unknown,Unknown
from any cumulant being in fact representable under theform of a,a,Unknown,Unknown
a syStem. S. Is in fact J2 3 ( CT TEOna,a,Unknown,Unknown
the Scolopendre are armed. This fact is of consequence in a,a,Unknown,Unknown
the inductive state being in fact a necessary preliminary to discharge.”,a,Unknown,Unknown
a first view this Jast fact appears to prove that potash,a,rstl_1844_0002.txt,txt_rstl
if simply stated as a fact a few years ago. By,a,Unknown,Unknown
"in England to a physiological fact discovered by myself, and described",a,rstl_1845_0013.txt,txt_rstl
seem to be a first fact of induction of that force,a,rstl_1845_0013.txt,txt_rstl
"although a knowledge of this fact is illus- trative, not only",a,rstl_1845_0002.txt,txt_rstl
and freshbwater springs; . a fact to be ascribed probably to,a,rstl_1845_0002.txt,txt_rstl
"upheaving of plutonic rocks, a fact that speaks intelligibly as to",a,rstl_1845_0002.txt,txt_rstl
"however brought about, is a fact which hardly admits of being",a,Unknown,Unknown
he also states the striking fact that he had found a,a,rstl_1846_0003.txt,txt_rstl
"was en- shrined, is a fact not less remarkable than the",a,Unknown,Unknown
"is distended, and is in fact a con- tinuation of the",a,Unknown,Unknown
"immediately (assuming it as a fact very probable, but still to",a,rstl_1846_0013.txt,txt_rstl
"glaciers unite, it is a fact that the structure immediately becomes",a,rstl_1846_0013.txt,txt_rstl
mass most perfect ; a fact stated and referred to its,a,Unknown,Unknown
"a question s0 remarkable a fact in Physical Geography, —to fix",a,Unknown,Unknown
to 48%. It is in fact a magnetic survey of the,a,Unknown,Unknown
"—Read February 12, 1846. A FACT not yet well understood is",a,rstl_1846_0012.txt,txt_rstl
silver. If it be a fact that the chemical powers of,a,rstl_1846_0012.txt,txt_rstl
"parts, and it being a fact that during the slow combustion",a,rstl_1846_0012.txt,txt_rstl
And if it be a fact that during the slow combustion,a,rstl_1846_0012.txt,txt_rstl
singular and the most important fact in a theoretical point of,a,rstl_1847_0014.txt,txt_rstl
"here call attention to a fact 80mewhat remarkable, which has always",a,Unknown,Unknown
the numerous contractions. The above fact establishes a fresh connection between,a,Unknown,Unknown
there under observation. A singular fact is established by some of,a,rstl_1847_0007.txt,txt_rstl
"This register well illustrates a fact that has been frequently noticed,",a,rstl_1847_0008.txt,txt_rstl
"electrode to the negative, a fact which may be verified with",a,Unknown,Unknown
this section by stating a fact which appears to me to,a,Unknown,Unknown
the other side experiences; a fact which is confirmed by the,a,Unknown,Unknown
found that it did in fact afford indications of snch a,a,Unknown,Unknown
not a little remarkable. In fact the southern stars would seem,a,Unknown,Unknown
"sky. Hence, as a general fact it may be considered, that",a,Unknown,Unknown
be mentioned the ob- served fact that the definition of a,a,Unknown,Unknown
implanted in the alveolus; a fact doubtless connected with the similar,a,Unknown,Unknown
"a certain apparent amount of fact to support it, and because",a,Unknown,Unknown
acid in wax is a fact to which we have no,a,Unknown,Unknown
It is certainly a strange fact that the presence of this,a,Unknown,Unknown
"light in this phenomenon, the fact that having placed a Convolvulus",a,Unknown,Unknown
"and satisfactory, together with the fact of a simple curve passing",a,Unknown,Unknown
"barometer, and conse- quently the fact of a triple maximum and",a,Unknown,Unknown
"will commence or terminate; a fact which will, I am sure,",a,Unknown,Unknown
does not represent a corresponding fact at different places. In some,a,Unknown,Unknown
places by means of a fact which had the same meaning,a,Unknown,Unknown
that a knowledge of the fact is of great importance in,a,Unknown,Unknown
dise. The pedicle is in fact a mere process of the,a,Unknown,Unknown
this appearance is due in fact to a multitude of suckers,a,Unknown,Unknown
"dif- ferent temperatures, as a fact of the same class as",a,Unknown,Unknown
"of +452 32, did in fact correspond to a dip of",a,Unknown,Unknown
connects itself with the well-known fact of the rise of a,a,Unknown,Unknown
uncombined particle ” was a fact quite different to the formation,a,Unknown,Unknown
substitntion is a very similar fact to that distribution of the,a,Unknown,Unknown
copper and zine is a fact very analogous to the action,a,Unknown,Unknown
peroxide of hydrogen is a fact precisely similar to the formation,a,Unknown,Unknown
a philosophical account of either fact we must assume alike the,a,Unknown,Unknown
"different manner, that the one fact is a chemical synthesis and",a,Unknown,Unknown
the above experiment (2681.) in fact confirms snch a conclusion. But,a,rstl_1850_0008.txt,txt_rstl
"external. It is a curious fact connected with polarization by inflexion,",a,Unknown,Unknown
suggests a comparison with the fact that it is also absent,a,Unknown,Unknown
"a longer time, till in fact the quantity diffused is the",a,Unknown,Unknown
years: a very remarkable 2 fact is exhibited by these hourly,a,Unknown,Unknown
"an hour, will be a fact equally unique and startling. 86.",a,Unknown,Unknown
"chief results arrived at, a fact of which the author was",a,Unknown,Unknown
heart. The tube is in fact merely a diverticulum of the,a,Unknown,Unknown
"Didem- Hidee®, Z The actual fact of a placental circulation indeed",a,Unknown,Unknown
"a mistake, arising from the fact at the heart always presents",a,Unknown,Unknown
"different species of fishes, a fact which adds to the proof",a,Unknown,Unknown
which is below. As a fact this result is perfectly well,a,Unknown,Unknown
"Q 76. merely expresses a fact with reference to lamellar distributions,",a,Unknown,Unknown
obscurity. It is a well-known fact that the madder root is,a,rstl_1851_0021.txt,txt_rstl
"suppose that purpurine is in fact no distinct snbstance, but a",a,rstl_1851_0021.txt,txt_rstl
